comment_id,comment_body,submission_id
dmng6jj,"It's agreeable that this film has its issues, but for the most part, the ones you have noted are mostly intended to be that way, and for very particular reason. Before I address these points, please bear in mind these few (major) influences on the film: 

**1. In its purest, most linear and most analytical sense, Wind River is a Western. It's also dynamically allegorical.** I don't mean a ""shoot-em-down-good guy- bad guy"", traditional kind of western. It's much deeper and, in many cases, this film is paying homage to western film arcs and storytelling. The forced and purposefully placed nuances may seem awkward, but try to appreciate that Sheridan is attempting a nod to the *past and present western, all at once. These scenes make you uncomfortable because they are not meant to be fully realistic; they are meant to blend reality with western film, and with metaphors, etc.*   **2. Sheridan is known for writing contemporary westerns, and often with fairly impressive analytical depth.** If you look up various film analysis of his other writings, it can get deep fast. **3.This is Sheridan's directors debut**. Yea, I thought some parts were gaudy or a bit overbearing, and that sometimes the dialogue maybe didn't fit well. But he's fairly new to the Director's chair, and it's possible he got carried away trying to over-romanticize some scenes. I so imagine if he had directed *Hell or High Water*, it would've been noticeably different. But I thought that turned out fucking amazing anyways.

**To try and address the list you mentioned:**


**1. They do not look down on the Native population, from what we know. They simply work out in the wilderness, but did not grow up on or near the reservation. They are not enemies prior to this crime.** The major outlier is that these men did not grow up on the land: they are not used to it, and may not have bonded or grown stronger from the wilderness as the locals have, and they may not have had similar ethnic histories/hardships as the locals d0. In addition, these men created a lawless and wreckless bond after they committed the rape and murder, further separating them morally and socially from everyone else.

You mention there is no build-up to their introduction, yet, from the second they first mention those men working there, it's clear from context that they are considered outliers, and mainly keep to themselves. Already, there is foreshadowing. There are other beautifully subtle hints leading up to the shoot-out-scene, and they are intentional.

**2. This entire scene epitomizes yet another traditional Western cornerstone that Sheridan pays homage to: the Harshness of the Wilderness. Here, Sheridan takes that to the next level, and forms the wilderness into an actual enemy.**  I do agree that Pete's excuse of ""the snow"" was corny and a bit over the top, but could I also appreciate the hell out of it, it was like a little nugget that Sheridan slipped in (could've been done with more tact, and at a different time, though). Sheridan knew why it had to be brought up, it was entirely central to one of the major themes. Pete's complaint about ""snow"" was him referencing the isolation and cold as an enemy, even though he didn't realize it. While it is no valid excuse for what he did, he sees it as his enemy and what set him up to do the things he did. **The director further hits his point home when the traditional ""show down"" is not between Renner and the rapist...it's between the rapist and nature.** Again, paying some homage to traditional westerns.

**3. This scene also references two additional major cornerstones of any western: lawlessness, and a shootout.** The second I heard the security detail say line ""You're on private property, you have no jurisdiction here.."" or something like that, *I KNEW shit was going down.* That was a red flag that they were beyond a land of reasonable law enforcement, and that they could enact lawlessness if they wished: there no common understanding or morals, so to each their own, and a shootout was gonna happen. One FBI agent didn't mean shit amongst these two crowds.

Yes, it was definitely planned, *all of it.* **Understand that these men had already chosen the option of taking the law and taking morals into their own hands; that all happened the night of the rape and murder. And they were able to go undetected for a few days due to their (see points 1 and 2) isolation, which ironically ended up bringing them closer together after the murder and rape.**

**4. The ""silence and survival"" motif is meant to go beyond what you see on the screen. It's yet another beautiful (but sad) metaphor that Sheridan constantly uses.** Try to watch this movie as an allegory in it's entirely: why on a Reservation? Why the fact about statistics at the end? Why did wilderness play such a big part? Why animals, and how is Renner's relationship to them a paralleled metaphor? Why was the absence of police and FBI presence constantly brought up and treated as normal? What about the stance on feminism? **Allegory. Allegory. Allegory**. Sheridan blew it out of the water when he wrote *Hell or High Water*, and while *Wind River* may have been a bit oversaturated as his first film, I still can't help but be in awe of how he tied all of these aspects together. In my opinion, he is one of the most talented writers out there, especially in regards to contemporary westerns.

**5. One more thing to consider:** people on here have wondered why the girl or guy didn't take the main lead. While that's traditional in thrillers or possibly crime dramas, Westerns often try to play more into character dynamics, it's all planned, but with a different outcome. A big motif in westerns is having a protagonist embark on a lawless experience (FBI agent and the shootout), and then return to society and find it hard to re-integrate. One of the final scenes depicts Renner trying to ""normalize"" what happened and read her a magazine or make her laugh...but she can't. She brings up the girl again.

Renner was actually her character foil, and hers was his. And while it seemed cliché, it was a nod to the traditional storyline. They were both very different, having lived through different experiences and on different terrain; the viewer needs a comparison, so that's why they are paired up in that sense.

If you go back and watch *Cold in July* or *Hell or High Water*, you'll see similar pairings and outcomes of one of the major characters. The brothers in *Hell* are very different in terms of personality and context, and by the end of the film, the more ""innocent"" one has changed a lot once he has returned to society.

EDIT: grammar ",6ueskb
dmpaqz8,"They were doing their job, but the absolute bedlam among collegaues that happens when a police officer gets injured or killed in the real world totally goes against the total ho humness of the reaction of these two in the movie.  Particularly Renner who seemed to have a good and long term personal relationship with the tribal police chief.

https://static01.nyt.com/images/2017/07/06/nyregion/06nypd1-alt2/06nypd1-alt2-superJumbo.jpg

https://www.nytimes.com/2017/07/05/nyregion/nypd-bronx-police-shooting.html?mcubz=0

Edit:  Also the FBI agent is probably riddled with guilt for leading everyone to their deaths, especially when the other police officer had the situation pretty damn well pegged and she just proceeded with standard operating procedure.  ",6ueskb
dm8xnx5,"One of the very few artists that I could download their albums and just basically listen to them all straight through. All songs, no skipping around, etc. All 3 are on prime and are fantastic. 
",6ueskb
dm8xo6x,"One of the very few artists that I could download their albums and just basically listen to them all straight through. All songs, no skipping around, etc. All 3 are on prime and are fantastic. ",6ueskb
dpun0on,i felt deeply sad watching it,6ueskb
dnym6bx,I think what was cut out was a shot of the chest/lungs and then the coroner saying he couldn't list cause of death as a homicide because technically it was from the cold. But it cuts to right after that when she's mad and wants him to list the cause as a murder or else the fbi will recall her.,6ueskb
dqmk5cc,She could've just asked for the keys from them right?,6ueskb
dmbz432,"I thought the purpose of the scene was to show that this is all she's got.

No more FBI people.  She's got Renner and the Chief to help her out or this isn't getting solved.

Also furthers the whole ""No help for Native Americans that are victims of crime"" message that the film was trying to raise awareness for.",6ueskb
dm4e9q4,"Yea, it's such a thin line between making the audience feel stupid and adequately explaining something. I won't lie I asked myself the same thing but chose to move passed it. Didn't bother me too much.
",6ueskb
dm06di1,"I don't agree. Elizabeth Olsen's character was brave and clearly cared deeply about the investigation. Obviously she was a fish out of water but I didn't think she was weak or incompetent. I'm also glad that we got to see Natalie alive for a bit. 

However I wish we could have seen more women. I wanted to hear from Natalie's mother. ",6ueskb
dm4qhv1,"The whole point about Natalie's character was how strong she was, that was the resolution",6ueskb
dntix8c,"Yeah, these guys are completely missing the point. It wasn't her place.",6ueskb
dnpis23,"For me it was the fact that he was like ""hey I bet you wanna hear about my dead daughter"" to this person that he doesn't even know. Obviously if a character starts talking about their dead relative it'll likely be a monologue, but this monologue felt really out of place",6ueskb
dmw0yyz,No problem. I had some issues with parts of the dialogue as well. Still one of my favorite movies so far this year.,6ueskb
ds5y92r,"Haha, you have no idea where I'm coming from friend. But interesting thought! ",6ueskb
dss0fpl,"She didn't drive the snowmobile. When Matt opens the door, he says ""I didn't hear your chariot pull up"" She replies that ""my chariot wanted to catch the 8 o'clock show in Lander and dropped me off at the turn out"". Meaning she was dropped off a short distance away and walked.",6ueskb
ds38geh,The coyotes dragged it there. DUH,6ueskb
dm06j0y,"Did they? It seemed to me that they Renner was playing Native still. That is why his skin was noticeably darker in this movie, even though he lives in the Wisconsin tundra, than it is in other movies.

As a Native American, it doesn't bother me in the slightest. An actors job is make believe, they are pretending to be something they aren't every single time.",6ueskb
dmfib2c,Rifle from a hundred or so yards away so not buckshot,6ueskb
dmfnb6u,"Okay, thanks. I ended up deciding on Dunkirk, but I'll be going to see Wind Rover later this week.",6ueskb
dokel18,"whoa whoa whoa.  A person stated 'most of the violence of reservations in America is internal/domestic' and I cited the Department of Jusitce stating that natives experience a higher rate of interracial violence - meaning *the opposite* of native-on-native crime.

I think if I'm reading between the lines of your comment, you and I have very similar concerns about statistics being extrapolated for social context to disenfranchise minority groups.  I assure you that is not my intention, but to point out that folks on native reservations statistically experience loads of violence, and it's statistically not all from native folks.",6ueskb
dpunst9,"> You sound like one of those lunatics

",6ueskb
dmyw20d,"Yeah, but you can't make assertions about frequency of rape and then shrug off statistics as inaccurate.  You either have to accept the quandary of not knowing for sure and thus not make assertions, or accept that the information we have to work with is the information we have to work with is the information we have to work with.  ",6ueskb
dneoumh,"And it only seems to be about film students. If an engineering student or history major chimed in on a subject, they'd probably be listened to or at least have their opinion somewhat respected. But a film student? Lol, smarty pants nerd.",6ueskb
dlxbsto,"I thought maybe the babies were tied to the two girls. The lion didn't go after young, female calves, it went after a young bull, a symbol of masculine dominance and virility. Renner defers going after the lion and its two children in favor of a young man full of testosterone who raped Natalie.  Both Renner and the lion are hunters. 

Messy symbolism, though. ",6ueskb
dmmmzf6,"It didn't make sense. What were they going to say after the cops were killed? Can't hide that shit. 

And the rape scene, yeah, I can see your point. My bigger issue is that there were no power dynamics in that scene. They presented these villains as horny, psychopathic, sociopathic, and without morals. There wasn't an escalation of group thinking or 'gang mentality', they just all saw her on the bed and started raping her. It went from 0-60 in about five seconds.... there wasn't any build-up, or discussion amongst the security guards, or animosity brewing between Pete and the couple (other than him being drunk and annoying). I'm sorry, but I find it hard to believe that those men would have acted that way in that situation. A little more build-up, a little more backstory, and I probably would have been on board. ",6ueskb
dlxqv1i,Probably. ,6ueskb
dmb3oe2,"My theory is that yes, they hoped *if* the body was found, they would just assume it was drug-related stumbling...but they didn't really think either Matt or Natalie would be found or found quickly. If Cory hadn't been there, Ben or Jane wouldn't have noticed the trail and gone up, so Matt's body would have just been eaten and maybe someone much later would find some bones. Same with Natalie. She was miles from anything where they found her. If not for the lions, Cory wouldn't have been there...It was just random that they found her so quickly.",6ueskb
dmd7r9g,"So i think Cory went up waaay into the mountains because he wanted to be a sort of back up and sniper cover if things went wrong.  It was coincidental the mntain lions were up there.  But as he looks more carefully at the surroundings he sees the tracks, which I think lead back to the trailer area.  I think at this moment Cory puts two and two together and calls the Sheriff.  The guy that Cory then tracks down and lets die in the wilderness is the rapist of Natalie and the main reason the altercation that lead to Matt and Natalie's death occurred.  Be was the one that got so drunk and started fondling natalie",6ueskb
drxb6eb,"Given that the guys who work on the rig rotate every few months and the daughter died a few years back I doubt it was them but I think the director was making the point that this isn't an uncommon crime in these parts, kinda like a same shit different day thing. ",6ueskb
dq5qmhs,I didn't buy that part. The leader of the security detail was smart enough to smooth talk the FBI/officers into a deadly trap. But not smart enough to ask them to come back w/a warrant or make up an excuse for where Matt was? ,6ueskb
dqp2mui,It happened a day or two after the murder. Not a whole lot of time to craft a plan for something they didn't expect to happen.,6ueskb
dm2snn1,"Might just be because the film was based around a missing women, and included the story of renners daughter missing too, but no missing males. I don't think it would have hurt to say there were no statistics for males either. I found it to be an interesting fact, but I don't feel like it serviced the movie in any way. It felt very random. ",6ueskb
dm1osse,"Also, they solve the female's murder and just sorta ignore how a couple male cops got murdered.

I would imagine that the reason nobody is tracking Indian deaths is the whole semi-psudo-kinda-not really status of reservations. They're a legal mess so no one knows who should record statistics or who to send the reports to",6ueskb
dm5afdr,"Four indians were killed in this movie. Five if you count Cory's daughter. The original girl he stumbles upon at the beginning, the drug addict at the trailer, Graham Greene, and the other cop who says ""Hokahey white boy!"". The other tribal police officer may have been native too but I was under the impression he was white.",6ueskb
dmjg28r,"Pretty sure those guys had Fremont County, WY sheriff's department patches on their jackets. In any case, they seemed to be white European-Americans, kind of odd for Rez cops but I suppose not impossible.",6ueskb
dq194wx," IIRC, the movie doesnt directly say it, but we're meant to learn that the drug den trail was from the druggies driving the dead girl to the oil rig. It just so happens that the oil rig dudes dumped the boyfriend's body on the same path.",6ueskb
dq26mz3,"Ok, he saw one set of tracks from the brothers side and he saw some tracks from the oil rig side. But was it specified that there was only one set of tracks from oil side? Because I only remember that he saw some tracks, maybe there were more than one",6ueskb
dr4dty0,"But Cory (jeremy renner) explicitly says that they ""unloaded"" at the drug house and then drove off and didn't come back - if it was her, she wouldn't be ""unloading"" the sled - so for that reason I think it's the drillers who are unloading the sled and then driving up to dump the body.",6ueskb
dqexzdy,"OK I think I have it figured out. I think some dialog was cut and it made it hard to understand. From the script: 

EXT. SAM LITTLEFEATHER’S HOUSE -- DAY.
The house is the very essence of dilapidation. An old,
burgundy MINIVAN that can’t possibly run, sits beside a
lowered TOYOTA TERCEL in the driveway.
HIP-HOP pulses the windows of the flimsy house.
Cory, Jane, and Ben pull off the road. Get out. Cory looks
down -- sees snow-filled SNOWMOBILE TRACKS beside the
highway. They disappear abruptly -- as though they levitated.
Or were loaded onto a trailer ...
Cory begins walking through the snow to the back of the house
as Jane and Ben head to the front door.

----



CORY WALKS THROUGH THE SNOW. He stares at the ground, looking
for anything that tells a story. Notices SNOWMOBILE TRACKS,
almost completely filled in with fresh snow, that run west
into the mountains, disappearing into the black timber.
He stares at the tracks. Mumbles to himself.

CORY

Who goes into the mountains just
before a storm ...

--------

CORY

Natalie died over there -- seven
miles(He points north). Those
tracks lead to the mountain from
here -- that’s five miles.

He points south to tall drill rigs jutting up from the
ground.

CORY (CONT’D)

There’s West-Central’s nearest
rigs. Six miles. Someone unloaded
sleds right here and drove way the
hell out there, but there‘s no
tracks coming back -- why is that?
(Cory points at the house) Do those
assholes look like they’re up for a
trek ten miles into the snow? In
what -- that minivan? The answers
are out there.




——

Cory starts moving off. Jane gathers her strength and
follows.
CROWS can be heard cawing. The trail opens to a clearing, the
snow here is so deep, there is no evidence of any tracks.
But at the far end of the clearing, A DOZEN CROWS gather
around a DEAD SOMETHING.
Cory moves toward it, trudging through the snow. The crows
scream their frustration at having their dinner interrupted.
As Cory and Jane get closer, they relent and fly to nearby
branches.

----- 

So there it is. The guards drove a truck and trailer with a snowmobile to the drug house, unloaded it and Matt's body, and drove into the mountains with it, presumably to dump it closer to there to make it look like that's where Matt had come from. I don't think they planned for their tracks to be visible for any amount of time, as a blizzard was supposed to come in, but didn't. 

the snow around the body is so deep and windswept that Cory loses the tracks and can't follow them from there.    If he had been able to, they would have led right to the drilling rig. 

So, when he finds the mountain lion den, he picks up the single track of the snowmobile again at it's other end, near the drilling site, on the other side of the mountain. ",6ueskb
dqex2p3,Ok we must be missing something or something got cut somewhere. Anyone have the script? ,6ueskb
dtefgk4,"From [an interview with the director](https://www.npr.org/2017/08/05/541774348/investigating-a-murder-in-wind-river):

> SIMON: And I gather this film is based on an actual story.
> 
> SHERIDAN: It's based on thousands of actual stories just like it.
> 
> SIMON: How so?
> 
> SHERIDAN: This issue with sexual assault against women on the reservation - I mean, it's existed since the inception of a reservation system. But, really, in the past 15, 20 years, it's exploded. And it gets no attention, which is the motivation for writing the film.",6ueskb
dm77qa6,[deleted],6ueskb
dm61rtb,"She was superior because she wasn't a total piece of shit. Never knew that being against rape and murder was ""PC"" and ""pro-feminine"", as if those are bad things. Re-read what you have written then take a minute to think about it. If somebody can make it 6 miles versus the 75-100 feet that he made it, in the same conditions, there is no question that the one who made it further is a physically superior person. ",6ueskb
dm6m200,"Hahaha, it was throwing me off SO much during the movie. I knew it wasn't him, but that little voice in my head was all ""But... maybe...?""",6ueskb
dmcefpq,I thought he looked like Tony Romo,6ueskb
dmkk08r,If that really was Paul Rudd I probably wouldn't have been able to take that scene seriously lol,6ueskb
dpd2wua,"Right, it definitely does. And it keeps you guessing. I personally didn't quite believe these guys were bad, even after defusing that situation.",6ueskb
dpnifdb,"I agree with you, I absolutely think it was intentional. I actually rewinded back to Cory looking down on them from above to see if he was noticing the flanking from how they were walking, and I couldn’t tell. He was absolutely alarmed though, so I’d say he saw it.",6ueskb
dlvdvs3,She might have had authority but they were at risk of getting themselves killed considering the fact that these men had complete disregard for the law/ human life.,6ueskb
dmw5skb,"That's one of the themes of the movie. She was unprepared. She was unprepared for the environment, for the brutality of the crime, and for the brutality of the criminals. Despite that, she fought and she survived. Others didn't, and I think that touches on some of the nihilistic currents of the movie. Sometimes you just lose. And it's not fair.

I also think that the guilt she will face is a major part of the movie. All the survivors deal with guilt.

 ""What if we didn't go away to the motel for a weekend; would our daughter still be alive?""

""What if we had asked about the guy she was seeing, could we have warned her to stay away from the rig?""

""What if I had been more cautious in my approach; would those officers still be alive?""

Survivor's guilt and the will it takes to live with it are a big part of the movie, or at least of my reading of the movie.

",6ueskb
dq1nkm1,"Indeed. But she didn’t leave then. She stayed for some time after that. Because we see she is significantly more beat up at the beginning of the film, much more so than when we leave the trailer. Also, Pete says he raped her. And we didn’t see that either. So I guess that’s why it confused me. I guess it’s more his face when he *says* go, not his face when she leaves. ",6ueskb
i8yralp,"If you haven't seen them, I'd highly suggest any of the other movies Taylor Sheridan wrote or directed, especially Sicario and Hell or High Water. Those Who Wish Me Dead, Without Remorse, and Sicario 2 are all good, and have that same crackling energy and tension, but aren't in the same echelon as the other 3 imo.",6ueskb
dltbdmg,"Well said. 

The cops losing the shootout didn't feel cheap at all. They were outnumbered, outgunned, and weren't able to shoot first but still recognized the situation as a trap and fought well.",6ueskb
dm86pkr,Sheridan knows that a lot of soldiers become cops and soldiers don't like being flanked. I just assumed he was ex-military.,6ueskb
dmepyab,"I agree, and that's why I kind of had an issue with Jeremy Renner's lines to Elizabeth Olsen about how ""there is no luck out here, either you can survive or you can't."" It just seems inconsistent for this to be one of the stated themes of the film when the reservation police are consistently depicted throughout as being as competent and knowledgeable of the ways of life in this area as anybody.  

Relatively minor criticism, though. On the whole I thought this was another very strong screenplay from Sheridan. ",6ueskb
dlxacda,I totally thought of it as a Longmire movie. ,6ueskb
dm04co8,"I would say Longmire is far from Wind River/Hell or High Water/Sicario/No Country for Old Men/Justified in quality of writing on a consistent basis (of course, it's much harder to write quality TV for years than one film), but anyone who's seen Longmire had to be reminded of it many times while watching Wind River. Definitely similarities to be drawn all over.",6ueskb
dqjj8ft,"lol, i know this is 3 months old but I actually just started that on a whim and watched the first 20 mins before thinking it was good but decided i wanted a movie tonight and saw wind river and thought it would be perfect.  Almost the exact same intro.   Perfect feel for what i was going for.  Deff going to finish that longmire episode tmrw now.",6ueskb
dpkmgpi,"He’s only directed one of the three, and in my opinion, the one he directed is the weakest of the three. ",6ueskb
