comment_id,comment_body,submission_id
dnn7bkn,"The last time I ranked my top 10 of the year was two months ago, and this was what I had:

1. Wonder Woman
2. Split
3. John Wick: Chapter 2
4. Kong: Skull Island
5. Baby Driver
6. Guardians of the Galaxy: Vol. 2
7. Logan
8. The Fate of the Furious
9. Alien: Covenant
10. Get Out

Ranking them now, I think I'd put it in this order:

1. Dunkirk
2. Wonder Woman
3. Split
4. John Wick: Chapter 2
5. Baby Driver
6. Logan
7. Hitman's Bodyguard
8. It
9. Wind River
10. Fate of the Furious

Honestly, it's always hard for me to rank the movies I've seen 1-10, and I've seen so many this year it just gets harder and harder to rank. 

Now if I was ranking bottom five or ten, that would be easier to do...",6ueskb
dmzb19l,"From what I remember the Grandma was saying something about the long underwear riding up your butt, and then she said something like doesn't look like you'll have that problem?

I dunno, Grandma was mumbling and I was distracted by ass. By the way, being distracted by ass in a rape/murder mystery/thriller is not something that should happen.",6ueskb
dpumv9e,"> wish there were more modern indian/native movies

jason momoa show Red Road

val kilmer movie Thunderheart ",6ueskb
dpssv10,check out the tv show Longmire.,6ueskb
dp8wxpe,Hm good point. I didn't think about the fact she was also with Matt right before. I guess when the doctor described that I just assumed multiple rapists or incidents.,6ueskb
dm05ygp,How did people in the community think it depicted rez life? Any interesting insights or details you can share?,6ueskb
dmbbw4q,"I guffawed pretty hard when Renner said he found the body ""East of Boulder Flats"" which would stick him squarely in the desert, not in the mountains. Or that he took Pete to the top of Gannett in winter, ~20 miles into a wilderness area (no snowmobiles or other vehicles allowed). Getting nitpicky here, but togwotee pass is the only reasonable way to Jackson, and it doesn't go through pinedale at all.",6ueskb
dpikcls,I am currently reading The Road. Not familiar with his other work; but will definitely look into it. I did also purchase The Martian a few days ago. ,6ueskb
dpumtek,"> insomnia

the remake or the original ?",6ueskb
dqftjeu,"Also Fortitude (the TV series)
Has a similar sort of premise, without the rape, and then it gets really weird, really fast.",6ueskb
dlvt7vh,"Got it, assumed the same. But they made it seem like they were in a completely different location. ",6ueskb
dlw44co,I believe you are correct but what I didn't like was the skeleton,6ueskb
dm01s8i,[deleted],6ueskb
dm6ut3v,"I don't get this either. If the oil rig guys killed Matt and dumped his body, why was there snowmobile tracks leading from the drug house to Matt's body? Who made them and when?",6ueskb
dmenu8d,"So.. I know now it sounds like I'm just playing along, but I had an older man and woman who I thought maybe had a drink or two whisper through the entire movie when I saw it tonight.. ",6ueskb
dnamsh0,The way that guy rolled up holding his shotgun had me alert for some bullshit right off.  4 cops show up and you're going to stand there like your ready to throw down. ,6ueskb
dmuzauy,There was no backup. That was literally the entire law enforcement population of the region.,6ueskb
dpuo2df,they were all too realistic in their half laughing bully tactics ,6ueskb
dpvfokk,Yes thats the main reason I will likely not watch it again. ,6ueskb
dngxssc,I came here looking for this same answer. Were tracks the only thing he saw at the lions den? How did he know they were related to something bad happening down below?,6ueskb
dpwcmse,creepy scene ,6ueskb
dpzmqhp,Something stupid that I wondered is if when Renee shot the coyotes in the beginning if it was actual footage or some crazy good screen magic. Wasn’t a huge fan of seeing them get blasted. ,6ueskb
dsvdpxj,when he first arrived on screen i thought he was the killer ,6ueskb
dq8aixn,"Yeah they did, I believe the [surviving contractors called out a casualty count and said ""two (contractors) that won't get up"" one of which was a severely wounded contractor, who mumbled ""I can get up"" before they shot him.](#spoiler) I'm guessing they were probably planning on [fleeing after the shootout, he would've slowed them down and been a liability if found alive.](#spoiler)",6ueskb
dq87ivf,"No, I believe the guy on the ground reloading his gun was wearing a green jacket, making him a state trooper.",6ueskb
dqnidej,"I thought about it she resolved it diplomatically and naively , but everything that led to the standoff e.g the flank them knowing the name etc meant he still followed his instincts. The movie is about instinct and survival ",6ueskb
ds2ddao,"I just checked the closed captions to be sure, and it's ""you didn't see it"". He says it two times.",6ueskb
dmjfwrw,"They have a minimum age to join, I think it's 23, but most agent hires are a few years older than that. If you recall, they did briefly poke fun at her youthful appearance in the film.",6ueskb
dmllwxr,"She's actually 28 irl, so reasonably could be a rookie FBI agent. But yeah, she looks really young regardless. ",6ueskb
dlv9xvl,Thank you!,6ueskb
dm112a5,Alright try running for hours in -20 weather in no shoes and see how long you last,6ueskb
dm4tocl,"It was old seniors talking in mine too! They just don't care, it's the worst. So many verbal reactions ""oh it's his daughter"" ""oh look at that, it's a lion"". Literally just saying what's up on the screen",6ueskb
dm54ma8,"> Renner says something along the lines of ""winded"".

He said he died with a whimper.",6ueskb
dpsrwu4,You might enjoy the TV series Longmire.,6ueskb
dpun3sl,graham greene was in a great thriller with val kilmer called Thunderheart,6ueskb
dpzmjir,"That means actors, directer, script, etc. did their jobs and did them well.  The juxtaposition of before and after is striking.  I think the ""Lord of the Flies"" inhumanity of the drill crew is real and can be found out there on pretty much every college campus.  We have a very thin veneer of civilization over a very thick coat of nasty.",6ueskb
dlv4sxk,"> And then we never really talk about the native offices being killed after at all.

Those officers were White...and the movie had already ended.

As this movie demonstrates, not everything gets closure.",6ueskb
dmkeaai,"Absolutely. Thank you for bringing this up. For a movie that was trying to concern itself with Native people and the issues they face, it was really disheartening that they kill off pretty much all of them and let the two white main characters characters survive.",6ueskb
dpkcp24,I'm confused how you got so many upvotes. Only the chief and one other guy were native/tribal cops. The rest were from town as they had different uniforms. ,6ueskb
dlw7k5p,"I felt as though they purposefully didn't focus on Elizabeth Olsen in an attempt to differentiate this movie a little more from Sicario. 
 
The fish-out-of-water female FBI agent assigned to dangerous areas of the western US... the tense ""WE HAVE ALWAYS KILLED COWBOYS"" shootout seemed similar to Sicario's moments... the super-skilled and mysterious character deftly takes out the posse of the man who killed his daughter/family, and then gives him poetically appropriate justice... ",6ueskb
dlws8df,"Agreed. It was nearly two hours long, but it felt like by the time the 'twist' happened we were still only setting up the mystery.

To be a little redundant, their first real guess was 'maybe it's the oil guys' and then it just *was*.

Obviously that worked for some people, but I was expecting a little more of a dramatic arc, a story, if you will.",6ueskb
dndsphl,"Dude, it's Hollywood.', don't expect realism when it comes to casting. Beauty sells, especially in Tinseltown.",6ueskb
dmw67ps,"At least for Renner's daughter she was raised in a mixed household so there would be a reason she would adopt a more ""western"" culture. ",6ueskb
dlzhibo,"> I also could not figure out the ending blurb. Was I watching the same movie as a the filmmakers? This movie was not about missing Native American women. WTF? That was so weird. What on earth did that have to do with what we just saw? As I read the blurb, I was wondering if I had missed something huge in the movie. I was thinking that maybe Native American women rarely go missing, so it is statistically insignificant and so that is why they don't have their own category...or something.
Please, if you worked on this movie can you explain that point of that? Because I cannot for the life of me figure out how it tied in to the movie.

I.. am so baffled by this and have no idea where to begin.

The film is literally about the disappearances and unrecorded murders of two native women, which in our real world the mistreatment of is a notoriously, tragically, widely undocumented category of crime that agencies and governments largely ignore.",6ueskb
dm05qx1,"It's pretty big in the news that native women are killed and missing at a massively high rate. The movie was literally about 2 native women who were mysteriously killed, the stinger seemed to tie in pretty well imo.

",6ueskb
dlwroyk,"I'll be honest in that I've never seen an Olsen performance I've liked.

I think the hardest thing for me to believe in this about her character was that she *was* after all an FBI field agent. I mean, I understand that she's 'young' in the story but surely to be an FBI field agent you must first understand the basic principals of police work, investigative work, forensic science, etc.? Also, I'm quite sure police officers/FBI/etc. are instructed not to stand in front of doorways when knocking in case of the very thing that happens in the film.

She felt more like the Lawyer in Jurassic World than any sort of law enforcement officer.

IIRC the only thing she actually *did* that no other character did was ordering the rape kit. Besides that she basically stood around being told what to do by other characters. No actually investigative work was done by her. The scene with the coroner just seemed like Sheridan was trying to poke fun at all those silly cop movies where the coroner calls random deaths 'murder' without actual evidence.

Most of these complaints are not Olsen's fault, they are the writer's though.

I can't help but be brought back to Insomnia, a very similar film that was executed much better (both the original and the remake). The main detective might have been out of his element, he was against insurmountable odds with a disorganized police force, but he at least still had a basic understanding of police work.

Maybe someone more knowledgable about the training of FBI agents could correct me if I'm wrong in anyway, or offer some more information.",6ueskb
dm0aets,"Damn man, I agree. But you need to let other people enjoy the film if they choose to. Don't be a dick.",6ueskb
dlwr1dr,"The confrontation with the security workers is where the film really took a bad turn for me. Amongst, like we agree, them having seemingly no rational motive in any sense. I really liked the 'flanking' sequence, but it was so easily put to rest with her reminding them that she was an FBI agent... then things are straight back to normal...

Then when she's outside of the doorway we get the super obvious ""THERE IS AN *FBI* AGENT STANDING RIGHT *IN FRONT* OF THE DOOR! YOU BETTER OPEN UP!""

Plus, the bruises on the face where an obvious giveaway to the point that they basically just spell out 'yep these are the bad guys' so there was no real tension throughout the entire scene. We know they're a part of it and we get a scene that just says ""yeah, we weren't lying before, they are the bad guys"" and then a big dumb shootout.

The son could have been entirely removed. I thought when Renner promised to 'make it up to him' that would come around someway but it didn't. I thought maybe the focus Renner mentioning gun safety to his son would come around some way, but it didn't.

I think what it comes down to is a rushed feeling screenplay that needed a lot more breathing room and very poor direction.",6ueskb
dmr2bum,"At 80 miles an hour.

As someone who likes snow it'd be awesome.",6ueskb
dobyzk4,"They kind of were predators, later on they started flanking the cops just like wolves/predators do.

Wolves and predators were also a running theme in the film, and the locals were better at noticing it than Jane was. First at the house where they got pepper sprayed, and then later in the face-off with the security guards, with the deputy explicitly saying ""You didn't see it?"". ",6ueskb
dpvfpmn,"I must disagree with your dismissive point, I'm not sure if you're saying this intentionally but your statement is easily interperted as ""Oh, I'm not a rapist... but if I see an opportunity I'm going to rape"".

That's a rapist.

This whole movie is about what women (specifically indigenous women) go through. I'm part native and have heard stories my self from the rez. Those man camps are real. 

",6ueskb
doe0c8b,wtf. SPUR OF the moment my ass. no fking excuse for what they did. making a girl run through the snow without shoes. fuck you.,6ueskb
dq489gb,"I just don't at all buy that their subtle flanking movement was a bigger indicator that they were dangerous than the **guns drawn standoff** they all have immediately following. It's like stubbing your toe and and then having a stroke, but telling the paramedics to check your toe out like it's the bigger issue. The flank is all but totally irrelevant given the standoff and the reveal that they know Natalie is dead. The fact that this guy was freaking out over the flank of all things makes zero sense to me, as if had Banner seen it, they would have responded differently? You could remove the ""you didn't see it?"" line from the movie and effect *nothing*, you could actually remove the flank and replace it with any reason to instigate that standoff and the movie still doesn't change. For that reason, I think the standoff hurts the movie, it's really jarring when everybody just holsters their weapons and continue to walk to the trailer (the cops even let some of the gaurds follow and let others lead, i.e. let them surround them, wtf?!). I would have preferred them just walking to the trailer having tense and revealing discussion, get to the door, knock, cue flashback, continue the movie. I don't see how the standoff-lol-jk part of the scene does *anything* but confuse people and make the cops look like completely untrained dumbasses, becasue in real life those guards would have immediately been taken into custody. That standoff would **completely** change the situation in real life, but in the movie it doesn't effect a damn thing in the behavior of the officers. Sure, it's puts them on edge, but they were **already** on edge, and it would have made the shotgun blast more surprising and believable (because the cops would only have had conversational warning signs, not a **standoff**, which is the most incriminating thing you could have them do aside from actually attacking the officers, which they do later to nobody's surprise except the cops in this story, somehow).

The fact that they have a standoff and then pretend it never happened was just bizarre and hard to believe even without that confusing and out of place line. There is some great writing in this movie, but man, certain stuff just should have been edited out, because they don't help the movie.",6ueskb
dq3gujn,"Yeah, I mean, I don't disagree with anything you said, but it doesn't answer what the officer was referring to her not having seen. What did he see that she/we didn't? If the answer really is just the flank, then I don't think that line works well for the film, as I don't think I was the only one looking for an answer after the line. It's not a line that moves the plot forward, AND it's confusing the audience. I was literally trying to guess if maybe he saw a sniper or a bomb or something (but he wouldn't have been coy and mysterious about either of those, so wtf is he referring to?)

Overall, I think it's a great scene that has a few critical failures, and a lot of people are going to walk away incredulous because of them. In a handful of ways it's just not very believable. I'm halfway to having the insane tactical oversights + mysterious and unanswered ""you didn't see it?"" line as ruining the scene for me (and it's a crux scene, ruining it ruins the movie).",6ueskb
dq4lr0c,"Eh, you're just reiterating what I already recognized as an ineffective plot device; it's just not that plausible that the subtle flank is the main piece of evidence that they are shady and dangerous; there are two other pieces of evidence that are on orders of magnitude more relevant than the flank, and everybody is witness to them. So the emphasis on this ""seeing"" the flank is erroneous and confusing.

>The officer says that because he sees the obvious, which is that the security are not to be trusted.

Exactly, it's **obvious**, it's so obvious and NOT because of the flank. **Everybody** in the audience sees this obvious reality because it is spoon-fed to us through a guns drawn standoff, and then all the characters seem to totally forget it ever happened. The flank is the last piece of evidence that made it obvious, but Sheridan is treating it like it's the *only* thing that made it obvious, and that was very hard to see as plausible.

As for private property without a warrant, they consented to their being there, and agreed to lead them to the trailer, answered some basic questions of there own volition, etc. They never demanded to see a warrant, or asked them to obtain one; they could have, but they never did, so nothing the officers did there would have been inadmissible in court. Just because you are on private property doesn't mean to can legally pull a gun on an FBI agent who is investigating a homicide, that's not an authority a civilian holds, sorry... That's why Jane is able to (rather unrealistically) defuse the standoff: she holds the superior authority and jurisdiction. Now that I consider it, it's similarly implausible that everybody even had to argue about that. Who would ever think that some private security yokels have jurisdiction over a federal agent? That's what federal kinda means, haha! It's ridiculous, like having a mall cop challenge a highway patrolman over authority. It's where this film becomes really hard to suspend disbelief for, which is too bad because I otherwise really enjoyed it. They could have removed the weird standoff-lol-jk moment without changing the plot at all, and would have avoided this incredulity.

I really would love to see ONE real world case where something like this happened: where somebody on private property drew a gun on a federal officer, or any officer, and after some discussion, they all holster their weapons and continue on whatever path they were on before the drawing of guns. I call bullshit, that has never happened once; that person was taken into custody. Maybe they aren't charged with a crime, but they aren't just treated as if they are no longer a threat after everybody settles down, they would be disarmed and detained immediately for the safety of the officer, and then after everything is sorted out and understood be released.

Perhaps the ""You didn't see it?"" officer is supposed to be the foil for the audience, he is supposed to be the one person that has the same perspective we hold: that these are threatening men who are involved with this crime, but it's so implausible that he is the **only** one that feels that way given the context. Even if he was somehow the only one picking up on the fact these guys maybe aren't on their side, he wouldn't just say ""you didn't see it?"" and then go on his merry way to the trailer seconds later, he'd say ""no, no, everybody stop, these guys are involved and tried to attack us, they all need to drop their weapons and get on their knees! etc."" The fact that he is scared shitless one second and then just causally waltzing up to the trailer with everybody else the next is wildly inconsistent.",6ueskb
dn1d2kl,"The argue over who gets to rape her next? Christ. Thank you for filling in the missing scenes, as dark as they are. ",6ueskb
dn0qppg,"Yes! Thank you! I was wondering if they drove her somewhere and dumped her or if she was able to escape. Thanks again for taking the time to reply, I appreciate it!",6ueskb
dpungei,google the Larry Murphy case ,6ueskb
dn3mipn,"Ya but why we're the tracks one way leaving from the drug den to the body? I guess the oil workers set it up that way to frame them? But then he sees that the tracks go down from there to the oil workers camp, so that would be a horrible setup on their part. ",6ueskb
dr11uuc,"I have been perusing this thread, hoping for any references to the symbolism, and though you aren't referring to my very specific question, at least you aren't talking about the flanking/standoff/""Didn't you see it?"" part.  You raise a very good point about the theme of broken families in the film.  Shooting wolves that are minutes - maybe seconds away from attacking livestock is a long walk in the park from killing a family (of predators) chilling in their den.  My query has to do with Renner's trek to the den, and the black spider we see skittering through his freshly made tracks.  It seemed out of place, and in films such as Wind River, I figure there was a reason we see this arachnid, its black body in direct contrast with the white background.  I need someone to tell me if I am reaching, or if my theory is plausible.  I know that in some Native American lore, there exists a trickster spider.   I submit that this was a clue by the writer/director telling us that anyone expecting this movie to end with [someone being mauled by a mountain lion is going to be disappointed.  The lions actually end up helping the protagonist by pointing him in the correct direction.  They are not presented as an immediate threat to Renner, so he tells them ""End of the line for you."" I agree with you regarding the reason for his reluctance at this point. He then sees the gathering at the trailer and his directive changes.  He knows that if he executes the family, he will be alerting the suspects of his presence and also giving away his  cloistered position. ](#spoiler)  The climax of the movie did not end as many (I can't be the only one, can I?) expected. [...not with a roar, but a whimper](#spoiler)  Am I reading too much into this, or does the spider represent the writer/director giving the audience a clue that their preconceived notions of foreshadowing do not always come to fruition?  I loved the movie, and would appreciate anyone's response to my spider thesis.  Have at me, cinephiles!!!",6ueskb
dq1r4xk,Oh I thought he saw more,6ueskb
dqqq7ac,"Nah, she wouldn't ride a sled in the dark all the way up and over a mountain. Besides, we don't hear her pull up on a sled in the flashback but we hear the guys pull up. Another user found the script. It appears it was supposed to imply that the villains drove to drug house, unloaded the snow mobile, rode out to hide the body and from there rode back to the rig. Some coincidence that they chose the house of the victims brother. ",6ueskb
drdhay7,She got dropped off at his house.,6ueskb
drgtf1d,"Yeah I agree.  None of it makes any sense.  Apparently in the script it more heavily implies that they drove to the drug house to unload the sled and hide the body so that there wouldn't be tracks from the oil rig.  Which makes sense until you think about the fact that:  1. they pulled up and unloaded a sled at someone else's house without anyone noticing? 2. They happened to choose the house of the dead girls brother to unload their sled when they could have unloaded from anywhere else in the entire wilderness?. 3. they rode from the body straight back to the oil rig, leaving tracks anyway.  Just seems like, in the best case, it's a cheap plot contrivance to get the characters to do what the writer wants, with hopes the audience just buys in.",6ueskb
dpnbco0,"I just think she tends to be a little bland.

Like her Scarlet Witch, she does fill the role, but I don't feel like she brings anything extra to the table or makes it hers.
",6ueskb
dpphnh6,"She's hit and miss, but she is great in that movie.",6ueskb
dm067zj,I think she does understand and she's trying to deescalate the situation. There's a close up which illustrates her fear and awareness of the dangerousness of the situation. After getting pepper sprayed I think the character would be extra wary. ,6ueskb
dmitv9b,"I felt it was more like Jane isn't a mental health professional. She couldn't do anything to help the mother. She wanted to ask her questions about her daughter, but when she walked in and saw what tremendous grief the mom was experiencing, Jane just wals back out of the room. ",6ueskb
dmb3cw2,"would you mind explaining? 

edit: nvm got my answer a few replies down. ",6ueskb
dmj5d08,"Agreed.  But my first reaction, was, ""Baker Act her!""",6ueskb
dmbd0z2,"Mine was a weird case especially since it was midday on a Saturday, with no discounts or anything occurring to my knowledge.",6ueskb
dpvq0c0,That's neither here nor there. Jeremy Renner gave a fantastic performance in it.,6ueskb
dn36r6j,"I see your point.  But I also think that if the movie is using him as a plot device bridge between the local white people/natives, they are also using him as a narrative device to bridge the white movie audience to the native culture.  And it's a bummer that that is still a necessity.",6ueskb
