comment_id,comment_body,submission_id
dm9otot,"Just a little correction, Taylor Sheridan actually debuted as director on 2011's ""Vile"".

As for the audio issue, I had absolutely no problems hearing the dialogue.  I would have to guess it was your theatre.",6ueskb
dmmac8h,Saw it at the AMC Kips Bay (also in NYC) and had the same experience...especially during much of the first 45 minutes. It may have been the audio system there too though...,6ueskb
dn4l8mq,"Thank you (and others) for mentioning this!  I was sitting there thinking, ""Geez, I'm not going to be able to see movies in a theater any more, because I can't turn on captions.""  Turns out it wasn't just me.  I could hear Renner most of the time.  But his ex-wife, for example, was unintelligible.  I've read that directors feel they can do this now, for ""realism,"" because they know everything is captioned.  I sure hope that isn't true.

[edit] (My view is, if the characters in the movie can understand what someone is saying, then so should I.)",6ueskb
dn3tu1g,"Late reply, but I had this issue at Arclight in MD as well. Still an excellent film, but I'll need subtitles to catch a lot of this shit on blu-ray, haha. ",6ueskb
dm4uunf,It was the flanking. She thought he was just being jittery but dude was on point--he was picking up the vibes right away. ,6ueskb
dm3nen6,[deleted],6ueskb
dmd3ovr,"I thought he was referring to something other then the flanking too, but I think I was just over thinking it ",6ueskb
dpkct8s,He was referring to the flanking and also the look in their eyes like he knew they were gonna do it. Like he had experience.,6ueskb
dmlapbj,"I agree with you on all points except one:

The story about Lambert's wife/daughter was actually alluded to throughout the movie, starting from the scene in the beginning when he goes to pick up his son. It was built up subtly and gradually but so well that by the time he told the story to Elizabeth Olsen's character, the audience already knew most of it.",6ueskb
do0798d,"Sicario was a lot more cynical, but Wind River had more hopelessness in the end...Idk, they were both hard to digest.",6ueskb
dpo1urx,what were then other two movies on the top 3?,6ueskb
dq18rag,"Makes my top three right now too. Blade Runner 2049, Wind River, The Big Sick for me.",6ueskb
dqeqbzf,"Ok I'll go point by point. 

Security teams for a drilling operation (it seems like a fairly large area, they mention running the perimeter on snowmobiles. Point is, it's not like one building or on facility) would be armed the way you'd expect security guards to be armed. They each appear to have a handgun. They have two shotguns, the Mossberg 590 the rapist has in the trailer and the marinecote one the guy has in the field. If they have to monitor the perimeter, there's always the chance that they could run into a mountain lion or a bear or something else that might want to kill them and a handgun isn't much use in that situation, so that makes sense. Also I don't know if it's an oil drilling operation...I think they just say the drilling rigs...so it could be natural gas or anything.

[As for the full-auto firearm in the trailer](#spoiler)...that could have been a personal firearm or, if the security team is part of a large firm, they could have supplied them with one as a SHTF firearm. I believe there's one other rifle. In the wilds of Wyoming, that's not very much. [Frankly, the LEOs were underarmed for having no backup.](#spoiler) 

The reason for the team's presence is to prevent theft, vandalism, and likely to act as a maintenance crew during the winter when it's not operating. Same principal as a caretaker, only for a large multi-million dollar facility in the middle of nowhere, where they frequently get snowed in such that the roads are impassable. Six sounds reasonable. There's all kinds of machinery that would be stripped or stolen if not secured, not to mention portable equipment. Plus there are probably office trailers or buildings with computer equipment, files and such. And all the equipment that can be is likely barned up for the winter, which is why you don't see much. Also we only really see the trailer area of the drilling facility up close. 

Additionally, it doesn't seem like all the security team members are wearing body armor. [Actually, I only see it on chief rapist guy. The rest go down from torso shots, other than the one Jane gets in the legs and head. Again, the armor might have been a private item or it might have been supplied by the security company along with the assault weapon. Hell, you can buy a plate carrier and Level III armor for under $300 online right now. A little shitweasel like that is just the type to own an (illegal) machine gun and body armor thinking he's GI Joe working for a security outpost in the middle of nowhere.](#spoiler)

Again, the LEOs don't even have body armor [and are outmatched, other than Jane. Which was a little bit of a hole as we never see her put it on, and when she arrives, she's obviously not wearing it and explicitly states she's in a rental car, not a federal vehicle, which is why there's no cold weather gear. It's hard to swallow that she had her vest in the car but like no other luggage...though, in fairness, she could have had a bag in the car that we never see, just no cold weather gear. Since she's stationed near Vegas, and clearly came out quickly, that makes sense.](#spoiler) 

As far as the jurisdiction thing...the private security team says the property is on a lease from the reservation, meaning it's located within the reservation. 

In case you didn't realize, reservations are areas of land managed by a federally recognized Native American tribe under the US Bureau of Indian Affairs rather than the state governments of the United States in which they are physically located. Which means legally a county sheriff is no longer in their county once they enter a reservation. And since it's private property, without a warrant, the Tribal Police Chief's authority is technically limited as well. 

Certain felonies like murder fall under federal jurisdiction. That's the entire reason the FBI was called and responded. It has been the basis for a number of fish-out-of-water cop movies over the past few decades. ",6ueskb
du3enry,"This scene made no sense, it was as if they were on Mars all of a sudden. Complete fantasy. The roads to the drill rigs would be open, these operations in Wyoming are 24/7/365 weather be damned. Drill rigs and all the ancillary equipment cost far too much money to ever be left idle. Yes, there is security on these drill sites, shotguns, rifles, handguns are all very common. [The machine gun, that was beyond absurd. No way no how.](#spoiler)",6ueskb
dq0pfbz,This is the best reason I've ever seen in defense of criticizing halloween costumes. Most of it is nothing more than faux outrage and bullshit over nothing. But this is a legitimate reason to be critical of slutty native american costumes. ,6ueskb
dr53gju,[deleted],6ueskb
ds17ode,"While I agree undocumented stats is heinous, I'm not sure how non-natives in sexualised costumes is relevant to fixing the problem? Sadly, women will be sexualised no matter what they wear. :( ",6ueskb
dluu6te,"It's a directorial debut and a more niche film, so I imagine its really popular in the smaller film circuit but wouldn't necessarily make money if it had a wide distribution. That is, until the hopefully eventual Oscar noms. ",6ueskb
dlusrti,"I only saw it because I wanted to see MovieBob's take on Atomic Blonde and decided to watch his review of this.

""And now, the big-screen directorial debut of the guy who wrote both *Sicario* and *Hell or High Water*, as you might expect its a feel-good barrel of laughs. *It is not a feel-good barrel of laughs*.'

I go to the movies semi-regularly and never saw a trailer or poster. ",6ueskb
dmj43ht,Just saw the movie with my mom. My twin sister died 3 years ago and her name was Emily. Very uncomfortable. Great movie none the less,6ueskb
dncurrc,"I don't have any kids, and I was crying at that first scene between Cory and Martin. ",6ueskb
dm6j6n6,"Glad you mentioned Shepard, because this film definitely gave me a ""if Sam Shepard was 40 years old today and wrote films instead"" vibe. They're both tremendous at capturing the isolation of the ""modern"" American frontier. 

Sheridan writes the modern Western-action the way Martin McDonagh writes modern black comedy-action. ",6ueskb
dm8yeul,"Did anyone else find one of the pieces in the score deeply unsettling? I believe it plays in the scene when Jeremy Renner initially brings Olsen to Nathalie's body - it sounds like a strange hum or something? I don't know, re-listened to it and it's very unsettling...",6ueskb
dpwbhun,This is why I dont like super hero movies as much anymore.  Just all prolonged action scenes where you already know the outcome...  And the story is just as dragged out as the action scenes.,6ueskb
drggfnb,think he saw her more of his daughter imo.,6ueskb
drd9lia,Definitely. Also he started reading ten signs he's into you. Low key flirting 😉,6ueskb
drd4n2u,Definite chemistry between those two. I was also rooting for Hawkeye and Scarlet Witch to get together.,6ueskb
drwo2jj,I was actually hoping to see him get back together with his ex-wife.,6ueskb
drqecgd,Her character was saying that Jeremy Renner's character was trying to comfort her. You could tell by her next line of saying how the victim ran barefoot for six miles in the snow.,6ueskb
dmhx6kn,"Yeah how subtle things were was great. The moment the chief told the agent to get away from the door, I at first didn't get how he know until after the movie. It was because the security guy said that there was a FBI right in-front of the door, and that's when he shot through the door. ",6ueskb
dmfqn0k,Agreed! Can't wait for more of Sheridan scripts.,6ueskb
dno26a9,What was unconventional about the structure? Mind elaborating? ,6ueskb
dmj5qih,Something to the effect of [she walked 6 miles in the snow](#spoiler),6ueskb
dmjmyc6,[deleted],6ueskb
dluoshc,"Natalie. The tracks go all the way to the refinery. So she drove there the night she died, and never returned. ",6ueskb
dnolm2r,"> did we really need the shot of Elizabeth Olson's ass when she's getting dressed

I needed it.",6ueskb
dn6eudp,"I saw it as a way to articulate a few of the film's themes: the frivolousness of outsider vanity - similar to the magazine reading at the very end; by showing her body it reminded the audience that, like all women, her femininity perpetually makes her vulnerable to the male threat; and as others have mentioned - the fish out of water theme. ",6ueskb
dmz7nd3,"Yes, we definitely needed that shot.",6ueskb
dn2rm5k,"
I agree, the Son kind of disappears after the ammo making scene, but I also think they did a good job of fleshing out Jeremy Renner's character, he still feels grief, but he hasn't let it break him, he is still ""working"".


We also see Natalie, the victim, in her underwear.  I think the film was trying to remind us how all women have to live with that threat of assault, and that with the location's isolation only exacerbates that.

(I'm also curious as to what has made your top 10 2017 list so far. :)",6ueskb
dn0r5b3,"I thought it was a good way to instill the fish out of water theme. Makes perfect sense, and it's not like they lingered on it. Is there another way to show someone is wearing a thong? It helped show how much disdain the grandmother had for her. ",6ueskb
dnn6jqu,"Hi, I'm very curious about your top 10 of 2017.

I've seen some movies this year and this was one of the best ones so far (for me). Before that it was Dunkirk but mostly because I saw that in Imax and visuals and sound were really impressive (Story not so much)",6ueskb
dmzap3a,"I thought the same thing! I am really nit picky about depiction of women and she was a solid character, but I couldn’t hear what the Grandma said and it clearly had something to do with that. I liked it a lot though. Def top 10 2017 for me rn. ",6ueskb
dpunjb6,"> did we really need the shot of Elizabeth Olson's ass when she's getting dressed

ditto natalie ass in the scene ",6ueskb
doyslur,"I thought this movie was great, best I've seen in awhile. I wish there were more modern indian/native movies. I had no idea it's the same guy who wrote hell or high water, such a good movie as well. However, I do wish this one was fleshed out a bit more, especially the reveal, the family dynamic between cory and his wife, more incorporation of life on the reservation.

One scene that stuck out was when the FBI agent first went to martin's house to question him, and he's stonewalling her, I couldn't help but find it strange how unshook he was about his daughter's death. Uptil cory comes through the door, that was powerful, you can just hear that poor guy wailing outside, nothing to be seen. That was well done. ",6ueskb
dplr6zh,"I'd have to watch it again, but I'm pretty sure [Renner saw the snowmobile tracks up by the lions near where the body was found that led back to those groups of trailers. As for the warning, I think what tipped him off was how the phrase ""right in front of the door"" was used. Kinda keyed the guy inside where to shoot instead of just saying hey FBI is outside.](#spoiler)",6ueskb
dp8ff0w,"I watched the movie yesterday and also noticed some of the stuff you questioned about. Here are my two cents for this particular scene:

>Also, I don't necessarily want more assault but the coroner's story didn't really match up with the scene. He described multiple people or multiple occasions and we didn't get that.

[He described separate internal injuries at different depths and also said it could have been either more than one attacker or more than one attack. Could have been caused by the one guy. Also, she had sex with Matt right before the assault, which could also have contributed.] (#spoiler)

",6ueskb
dpphjaa,"> Alsonwhat happened to Matt? Was he the second body they found? Did they not identify it before they went looking for him?
 
Yes, they identified the body as him. They just weren't saying that to the other workers.
 
>Next, I didn't understand how Renner knew what was about to happen
 
He didn't, really, but he saw the snowmobile tracks leading from the camp up to where Matt's body was, so he knew they were involved.",6ueskb
dpumu4u,"olsen was underrated imo

same as theron in the valley of elah",6ueskb
dqftom2,"'the coroner's story didn't really match up with the scene. He described multiple people or multiple occasions and we didn't get that.'

I think considering she'd just had sex with Bernthal before she was raped, that it probably would have looked like there were multiple rapists.",6ueskb
dpp6277,Great critique. I agree with everything. ,6ueskb
drwovlo,"> Then the shootout has like 40 point blank shots going off but they all seem to be alive for a while like they were only shooting each others legs of something,

This is actually pretty realistic considering most of them had only handguns, and in an extemely stressful shoot, with basically trained people, you don't get a lot of perfect shots.

",6ueskb
dlw85mg,"Watched this yesterday on the actual Wind River Indian Reservation. The nods to Wyoming got a lot of chuckles and seemed well-received from the Wyoming audience. 

That said, the movie was shot 99% in Utah. ",6ueskb
dlttscr,"Having lived some time in Wyoming and Eastern Idaho it made me a bit homesick! Definitely captures that ""Wyoming"" feeling extremely well!",6ueskb
dq2lokj,The Terror by Dan Simmons,6ueskb
dpg2nq5,"Might like the movie called prisoners, it has a very similar feel to this movie I think. ",6ueskb
dpi3253,Read some Cormac McCarthy most of his stuff is set in super harsh settings. ,6ueskb
dpmgs50,"Blood Meridian and Cities of the Plain by Cormac McCarthy are both great. The Ploughman by Kim Zupan was also recommended to me but I read the first couple chapters and then stopped because it felt like it was trying to hard to sound like McCarthy. I also find a lot of Margaret Atwood's books with their settings in northern rural Canada to achieve this mood as well, Cat's Eye in particular, and this [short story set in the Arctic](https://www.newyorker.com/magazine/2011/12/19/stone-mattress) she wrote for the New Yorker.",6ueskb
dpzvmp3,You might like the Longmire series. They're about a sheriff in rural Wyoming. ,6ueskb
dpehcld,"Not books but a few movies I'd recommend off the top of my head:

* Fargo (The TV show is phenomenal!)
* A Simple Plan
* Insomnia
",6ueskb
dpm2jta,Yeah you just described Last of the Breed by Louis L'amour,6ueskb
dpc6pyt,"Check out the The Round House.
",6ueskb
dm922nm,"When they showed his face, I was like ""well here is another jon bernthal movie where he's this rapist / killer / scumbag"". He sure is good at it though! ",6ueskb
dlvt2e8,[deleted],6ueskb
dm10ixa,The snowmobile tracks near Matt's body led to the only place in the killer could have come from. The oil rig.,6ueskb
dm5tmql,I'm confused on some tracks too.  Renner and Olsen follow snowmobile tracks from the crackhouse up to the mountain to find Matt's body.  Was never addressed who made those tracks and why.  I understand the tracks between the den and the presumed proximity to matt's body going back to the rig but I'm not understanding the first tracks that led them to matt's body in the first place.,6ueskb
dmfqow3,I would have knocked the old man out...as long as he was smaller than me.,6ueskb
dmd5k5i,"It's weird, I had the exact same experience. An older man and woman talked in whispers through the whole movie. Great movie though.",6ueskb
dmo8pnd,MOVIE Pass is awesome!!!!! ,6ueskb
dmeaeq0,"Damn. Could have not guessed it's the same man.

Yeah, Renner was amazing. Didn't know he had it in him to do such a performance. At the end of the movie when he's looking at the pictures of Nathalie and his daughter and starts to tear up, I think he did at outstanding job at conveying his emotions. I hope he gets more roles like this.",6ueskb
dmkudqu,She didn't see the men flanking the group like he did. If you watch the scene you can watch the movements of the men from the site. They and the camera movements are predator like. This is what sets him off. ,6ueskb
dmjmoi3,[deleted],6ueskb
dpunuwx,"> that flashback scene was hard to watch

it will be too much for some people",6ueskb
dn2dmy4,He has to be. Great performances all around.,6ueskb
dnao9jw,"He realized it by the trail yea, I had the same question and then I remembered him looking at the tracks again and calling the Chief Sheriff guy.",6ueskb
dpwaonb,"""the near shootout""
Man, when they started ""flanking"" the county/state law enforcement and co. I knew this was about to get good. This movie was EXCELLENT.",6ueskb
dsv5cci,"Bernthal AMBIGIOUS performance?

What the f.. ? He was there for 5 minutes. If anyone, Renner had AMBIGUOUS performance, Oscar nomination worthy.
",6ueskb
dq7wmpc,"I am confused about one part with the contractors, and maybe you can help me out. Did the contractors [execute one of their own guys on the ground? If so, why?](#spoiler)",6ueskb
dr4cc92,"Yeah it was that he saw the other guys flanking their team, and he thinks she didn't see it.  And they started flanking right after they let slip that they knew it was Natalie even though her name wasn't said - so if you saw the flanking maneuver it was obvious that they were guilty.",6ueskb
dqlnt6g,What do you mean pull it out again? He just never put the gun down. And he asked her if she saw the security guys start flanking the cops. The tension started rising and the cop saw that the team was slowly trying to get in position to start shooting them,6ueskb
dqxv7ra,"I just finished the movie, and I *thought* he said “you didn’t say it”, referring to them not saying Natalie’s name on the radio (which started the standoff). I could be wrong though. ",6ueskb
dtcvkt5,"I would've liked to see that deputy survive just so he could tell Elizabeth Olsen's character ""I told you so"" at the end",6ueskb
dmb385w,She looks way too young. It was almost laughable. Natalie looked older than her. ,6ueskb
dlumf01,Still testing?,6ueskb
dluvi7a,"> \['Twas the butler\](#spoiler)

This is the format you need for a spoiler.
",6ueskb
dlvb1w6,"[i thought that scene was stupid , you won't die from running in -20 F , your body is naturally warm inside, we're mammals we maintain a core temp through burning calories, and air is heated up by the time it reaches the sensitive parts of your lungs, i've climbed mountains in those temps in montana(basically wyoming) that part was super ridiculous](#spoiler)
",6ueskb
dm4nstd,"The final conversation scene was interrupted for me too.  Someone started talking in the audience and another person had to yell, ""quiet.""  Then the person who was talking walked out with squishy flip flops.

The sad part was everyone in the audience aside from me and a younger couple were 70+ years old.  A local retirement center bused out a large group to see matinees today.  I have seen better behaviour from children and teenagers in the theater.  Throughout the movie I heard many murmurs and unnecessary verbal reactions to scenes.  Today was my worst theater experience in years and it was provided by an unexpected cohort.

It was still a superb movie and I will watch it again.  I'm starting to like Elizabeth Olsen more each time I see her.",6ueskb
dm52o4e,"The one between Martin and Jeremy Renner? He was saying he painted his face blue which is a sign of death or something. Then Renner asked something and Martin's response was that he made it up because there's no one to teach her. I assume they're talking about native american culture.

Then they spoke about a phone call which came from Martin's son at the station to pick him up. Renner tells Martin to be patient with him and to help him.

Martin asks about the one guy who got away. Renner says he didn't get away. Martin asks how he died. Renner says something along the lines of ""winded"". 

I think it ended there.",6ueskb
dm42axq,That really sucks I would be livid.,6ueskb
dpun77t,im afraid it may get snubbed because its produced by you know who,6ueskb
dnqb5r3,I really enjoyed the theme between the native americans and the distrust of the government that played throughout. it definitely added a layer to the film. ,6ueskb
dpun37g,i could cry thinking about matt and natalie in bed smiling and safe,6ueskb
dqclfos,And what about the tracks leading from the trailer and not coming back?,6ueskb
dqw31c7,"Because they can. Life on the res is hard and the meth heads don't give a shit about anything. I'm sure it was just a big ""fuck you"" and it just escalated",6ueskb
druwl4r,"He maced them because of the dig the sheriff made about locking his brother up. In his drugged haze it made sense. Shooting at an FBI agent simply did not though. Also, the sheriff says they are evil but he stands on their front porch without his gun in easy reach and needles a drugged out ""evil"" man? ",6ueskb
dltfafc,"I see what you are saying, but I don't think it's a White Saviour trope at all. It would have been a cliche had the movie not spent a good portion of its time establishing the relationship between Renner and Gil Birmingham. Also, for Renner it's not about ""saving"" Birmingham as much, it's about avenging his own daughter who's experienced the same fate as Birmingham's. Even if the previous perpetrator is different, it's a symbolic vengeance.

edit: confused the actors' names",6ueskb
dltr23e,"I did think it was a bit of an uncomfortable note that all the Tribal Police are killed in the shootout, every last one including the chief who we've spent a lot of screen time with, but Renner saves Olsen's character... And then we never really talk about the native offices being killed after at all. On the whole I felt the movie's handling of some sensitive material was pretty good and respectful, but that struck me as kinda weird.  ",6ueskb
dm05wiy,"I feel you on this - thought renner was amazing but it's a cop out to have a film about native issues starring two white people imo. He could have been a native guy, or olsen's character could have been played by a native person from another area in the usa. That would have been pretty cool actually! 

That being said, I really appreciated the realistic warm friendship between natalie's dad and jeremy renner's character (can't remember names). One of the best roles i've seen for a native person in a film in awhile. ",6ueskb
dlw3509,"I think minimizing Renner's backstory (as well as all his unnecessary metaphors) and having Elizabeth Olsen as the main character would have fixed most of my complaints with this film.

I certainly enjoyed it more than you and definitely didn't dislike the flashback sequence but Renner's character seemed like an endless resource for obvious, tired and stoic asides that take away from his elusiveness rather than exemplifying it, in addition to undercutting a lot of the tension.

I will also say your criticism of how they portrayed the ""harsh"" environment was something I glossed over. I really agree with your assessment that for how much they talked about the wilderness being a place of indifference toward human life, it only came in effect once at the beginning (the set up) and once at the end (the pay off) rather than showcasing it's potential to demolish you throughout the course of the narrative.",6ueskb
