comment_id,comment_body,submission_id
dlsn4wc,"Went in expecting Jon Bernthal to be like the head bad guy or some shit. He absolutely killed it in his little part and I felt for him so much. He died fighting and even though it wasn't enough, it shows just how genuine/good his character was. When they reveal Natalie(?) is dating an older guy I ultimately assumed he was a manipulative asshole. I was wrong and now my heart hurts.",6ueskb
dlue393,"The ""WHY ARE YOU FLANKING ME?"" Mexican standoff was awesome. ",6ueskb
dlt2aa4,"How good was the reveal of Jon Bernthal? When we think he's the Pete character, and then he opens the door and we realize it's a flashback. That was a small moment that was perfectly executed from a writing and directing standpoint. ",6ueskb
dls6fds,"The tension building up when they visit the oil rig followed by the shootout... holy shit.

Really good film overall. Loving all of Taylor Sheridan's work so far. He really nails the modern western feel, even when he is trying something different - like a thriller set in the Winds.

The dialogue was a little over the top with the whole ""we are in wyoming"" thing but it didnt really bother me.

Fantastic acting all around.           ",6ueskb
dls6lp9,"Really solid crime story here. Very smartly written; all the performances were great. Especially Elizabeth Olsen. Probably her best performance since *Martha Marcy May Marlene*. 

Taylor Sheridan has written three great movies and this was a very strong directorial debut. I can't wait to see what's next for him, because thus far he's been killing it. 

I'm really glad they didn't go the serial killer route. It was just a terrible set of circumstances and some downright evil decisions made by some drunk guys. Nothing premeditated, no connection to the death of Jeremy Renner's daughter, no super creepy killer who stalks the police, just a really sad and fucked up situation.",6ueskb
dlsvpbe,"I absolutely love the way he handled the reveal of what actually happened to Matt and Natalie.

Cutting away from Jane knocking at the door to go to the flashback, where you see the awful things that happened within those sleeping quarters.  The tension building up as you watch that flashback and know that Jane is walking right into a trap, and then cutting back to the present where you're extremely on edge because you know something awful is about to happen.

That whole sequence was perfect.   ",6ueskb
dlswanu,"They really made James Jordan (Pete) look like a completely depraved, disgusting, and pathetic man.",6ueskb
dlut6dj,Jon Bernthal showing why he's best for the punisher role.,6ueskb
dlsbsgp,"Solid flick. This man sure knows how to build suspense. The border scene in Sicario and the ""flanking"" scene in this? Wonder what he could do with a horror movie. 

Anyway, it was cool to see the twist play out with the boyfriend actually turning out to be a good guy. I'd highly recommend this movie. Reminded me of Prisoners just a lot shorter. ",6ueskb
dlsqyve,"Goddamn, that shootout was the most satisfying I have ever seen in my entire life. He just annihilated them! 

Any idea what caliber his rifle was?",6ueskb
dls6nxe,Got back from this an hour ago and it's one of the best films of the year. Everything from the acting to the characterization to the dialogue to the cinematography to the tension to the atmosphere works perfectly. Another home run from Taylor Sheridan.,6ueskb
dlsef49,"I actually went to watch this yesterday(& Logan Lucky tonight) and man... this was a solid flick.  It felt like part-thriller & part-drama with a few dark moments here and there but strong acting, dialogue and overall storytelling.  



- The line that hit me the most was Cory's ""Steer from the pain"" speech.  Even though I've never experienced the pain of loss myself, that talk he gave to Natalie's father hit me hard and I started to tear up right in the middle of that scene.  


- Renner and Olsen did really well.  She really sold it as the rookie agent and Renner played the hell out of the silent, level-headed, badass game-hunter.


- A very satisfying conclusion seeing those assholes getting snuffed by Cory and helping find justice and answers for Natalie, even if it meant sacrificing him finding closure for Emily.


It's sad to see the turnout was so low and that only two theaters(not just in my city but my whole area) were playing this film.  This is definitely worth a viewing and Taylor Sheridan deserves more work.. Very well made.",6ueskb
dlsbhzd,"Wasn't really sure what to expect from Sheridan's directorial debut but this movie really blew me away. The screenplay was top notch as usual and he was able to build some great tension during the action scenes and even during simple conversations. The cinematography is also very beautiful with a lot of landscape shots. 

This is a career best performance from Elizabeth Olsen and one of Jeremy Renner's best over the last few years. 

I also appreciated how some of the darker aspects of this situation weren't shied away from and the character's actions did have consequences. Since this is the last movie in his unofficial western trilogy, Sheridan is going out on a very high note. 

I still can't believe the cop from Sons of Anarchy is directing movies now. ",6ueskb
dlsd8a2,"All I have to say is wow. I'm going to be recommending this movie to a lot of people. Fantastic performances from Jeremy Renner and Elizabeth Olson, Graham Greene was great as always, and while I always love Gil Birmingham he went above and beyond. His scenes were very emotional and I really felt his pain.

The cinematography was phenomenal as well. I can't say enough good things about this movie.",6ueskb
dltduvv,"I don't think I've ever experienced tension as I did in the climax of this movie. I just clenched my chest with my fingers harder and harder, and couldn't let go. 

I love the kind of modern western theme Sheridan went for in his last two movies, and I love how he uses political and social climate in the US as a setting for the movies, as reasons for the conflict. The atmosphere and structure/pacing seem to be his strongest abilities.

Also, holy shit, Olsen and Renner. Between this mediocre blockbuster and that mediocre blockbuster, I forgot these people can act. They just blew me away with their performances (especially Renner).

A stunning achievement of a debut.",6ueskb
dlu0uhn,"Man, there was some cool editing in this movie!! I love when Cory stomping on the guy's face outside the trailer cuts into Jane kicking in the door. I also really loved the first person perspective after she was maced.

I also really loved the [tension building between the federal agents and the workers. All hell broke loose once Jane was shot through the door and flew back, it was like an erupting volcano](#spoiler)

I hadn't seen a single trailer for this film before I saw it and decided to see it because I liked Hell or High Water and it seemed like a great story. Ended up being one of the best movies I've seen all year.",6ueskb
dls6ot1,How the fuck is this movie not getting a bigger release? Sicario was an amazing film and Hell or High Water was nominated for Best Picture. The third film of this brilliant trilogy is getting a very slow limited release. This film is hopefully going to get a buzz like Hell or High Water. I don't get why studios would bury this film in the dreck of summer rather than in fall. This movie is almost guaranteed a Screenwriting nomination.,6ueskb
dm8s7oj,"The way that the cabin scene was introduced (Matt opening the door to let Natalie in, when you thought you would see Olsen's character) was amazingly clever and a surprise to me. Excellent editing. ",6ueskb
dlshf9v,Turns out Sheridan can direct a hell of a shootout.,6ueskb
dlwccgn,"I loved this film. My take: if you were looking for a mystery/thriller film, you probably ended up disappointed, as it was a pretty straight forward story that lacked intensity, save for a scene or two. However, I thought the film did an incredible job of using a run of the mill double homicide as a vehicle to transport its central themes: the static and trapped life on a Native American Reservation and how suffering is the best way to acknowledge loss. Every character touched my the central conflict in the story showed these themes in some way, but you really just needed to see the final scene to get the essence of the film. 

[When Jeremy Renner turns to the father and says ""I'm going nowhere"" or something to that affect he really got at the crux of the film: the people on this reservation are stuck, both in their traditions, lack of social mobility, and physical distance from the outside world. I thought it was especially telling how the camera panned behind them afterwards, and the way the swing set was positioned around the two of them, it looked like they were in a teepee overlooking the desolate landscape](#spoiler) Really impressive film, did an amazing job portraying its central themes, thoroughly enjoyed it. Interested to hear if others found it as powerful.",6ueskb
dmf5kb6,this movie gave me a revenge boner,6ueskb
dltm76l,Can someone tell me...when Cory saw the tracks leading to Matt from the drug house...who left them.,6ueskb
dmf5ta8,nobody has mentioned how well they choreographed the slow escalation of the fight/rape scene. each person kept escalating until it turned into a full out melee,6ueskb
dlt6ppr,Gil Birmingham was fantastic in his smaller role. I'm starting to love this guy. I didn't really know him before Hell or Highwater (where he was hilarious). Started watching House of Cards last week and I was pleased to see him in season two. Then he makes me weep like a baby at the end of Wind River. Anyone have any recommendations for projects he's in?,6ueskb
dlt8nck,"Absolutely loved it. Favorite movie of the year. Renner's ex-wife was a little too stoic for her part, but loved everyone else. Wasn't expecting Bernthal's character to actually be a good guy, but as soon as the other guys came back it was pretty obvious what was going to happen to her. He sure put up a hell of a fight though. Renner nailed his part too . I would say all of Sheridan's 3 movies are probably my favorites of the years they came out. ",6ueskb
dm2ug6c,"My favorite was Graham Greene quietly stealing every scene he was in.

Actually, can we just take a moment to appreciate all the excellent Native actors in this? Gil Birmingham, obviously, and Martin Sensmeier and Kelsey Chow gave really powerful performances.",6ueskb
dlv7n36,"I mostly enjoyed the film quite a bit. It was certainly thrilling in the parts where it was supposed to be but . . .

I had a big problem with how often Renner's backstory came up. It seemed like they were pounding us in the face with it when I felt it would have been much more effective had it been elusive. Less is more here.

Instead, among other moments, I got to roll my eyes in scenes like when the drug addict brother was arrested. ""I wanna fight the whole world! Do you have any idea what that's like?"" with Renner's character responding ""Yeah . . . I do. But I'd rather fight the feeling.""

Even Renner's ex-wife just felt like a stereotype of a begrudged widow who stands in the doorway always reminding Renner ""this won't solve what you're looking for.""

Those moments were just too on the nose. Too hammy and could have used some paring down. 

THAT SAID, the rest of it was well done. I enjoyed the Graham Greene character and Elizabeth Olsen. The whole backdrop of this Native reservation withering away was quite enthralling. The shootouts were exhilarating. And the rape scene . . . was terrifying.

Would certainly recommend this to friends of mine.",6ueskb
dn951sy,"Just saw this movie yesterday. I liked this movie a lot. While it wasn’t perfect for a few reasons, I thought it was a great film. However, there was one thing that really bothered me about the movie. I really think they made a big mistake in regard to casting. I'll just come out and say it. Renner's role should have been played by a Native American. And not simply for the sake of the lost opportunity for representation, but more importantly because the narrative suffered a bit because of it.

For example, as presented in the movie, the subplot where [Renner's character and the father of the murdered girl grapple with the loss of their children is extremely powerful. However, if Renner's character was casted as a Native American, the scene would have taken on a more meaningful and darker subtext. Instead of the two men just bonding over the loss of their daughters, it would have been two men, grappling with the reality that their community and culture is deteriorating, with the rape and murder of their child only playing a part of that grim reality. And now picture these two men staring off in the distance while the movie fades to black. ](#spoiler)

Another scene that would have worked so much better was the scene where [Renner scolds the brother in the back of the cop car and lays out the options he eschewed in favor of living his life as a junkie. The scene is played relatively straight with Renner showing a measure of sympathy for the brother. But were the character a Native American, there would be a deeper subtext and a more interesting dynamic between the two characters. From one older cynical Native American to another younger jaded Native American, the conversation becomes much more meaningful, and can go in many different directions.] (#spoiler)

In the film, they had a brief window of opportunity to add depth to the scene, and even add more thematic depth to the plot as a whole, when [the brother calls out Renner's character for coming from outside the community. ] (#spoiler) Unfortunately they chose not to flesh that theme out more, and it remained one of the few, if not the only allusion to the characters’ background.

Every scene I imagine with a Native American Actor is far more powerful in my head. [Even the speech Renner gives at the end to Olsen’s character about surviving](#spoiler), would have taken on a darker subtext. Every time Renner referred to “his family’s struggles” it would remind me of how unnecessary the casting was. Instead of having Renner defer his struggles to “his family’s” struggles, they could simply be his struggles. 

The most frustrating part about the casting decision, is that it felt unnecessary. If they had used Renners’ character to add depth to the role and plot, the movie would have been fine. But as written, the role didn’t lend itself to a non-Native American character, and would have suited a Native American actor more cleanly. It would have been at least a little better, albeit controversial and hard to pass off, to have the character played by Renner be Native American. At times, it can feel that Hollywood has trouble believing that white audience members can empathize with non-white actors. However, it is more likely that there just aren't enough big name Native American Actors they can put on the playbill. It is also possible, they just couldn't find a Native American Actor to audition for the part that was up to snuff. Whatever the case, I feel like they really missed an opportunity to take this movie to the next level simply for the sake of making a few extra dollars in the box office.
",6ueskb
dndujb2,"As soon as the brother mentioned the ""cracker boyfriend"" I was guessing who they had casted to be the murderer. I didn't look up the cast list beforehand so when we see inside the trailer and it's Jon Bernthal I was like, yep there we go. But I was bummed because I LOVE Bernthal and didn't want him to be the killer.

Well, my happiness that he wasn't the killer did. Not. Last. God, what a hard scene to watch. ",6ueskb
dlv8k8t,"I liked it right up until the confrontation with the oil rig security guys. I don't understand what exactly their plan was. Did they really think that they could kill 5 police officers from multiple jurisdictions and an FBI agent and that would be the end of it? Or that it would make this less bad for them somehow? I get that people don't always think clearly when they are under stress, but their actions made no sense to me. I think it would have been better if they acted suspicious but non threateningly until the guy in the trailer shoots Banner, then all hell breaks loose. ",6ueskb
dm584ut,The scene where Renner is looking at the photo of his daughter and Natalie together was just phenomenal acting. Fantastic moment that felt so earned. Probably my favorite Sheridan film so far.,6ueskb
dnsc8d3,"My only nitpicks- the men being thrown into the air when Renner shoots them, and the lack of sadness or even addressing the deaths of the police chief/ officers afterwards.",6ueskb
dmb9frr,"I've lived in Lander. I won't pretend to speak for anyone else from the area, especially people from the reservation, but this movie was a true thing, very powerful and well done. ",6ueskb
droza87,just finished watching this last night. i have to say the “why are you flanking me” scene and gun fight that ensued after was just as intense as the tollway scene in sicario. loved both movies and im finishing up with hell or high water tonight!,6ueskb
dlse4sv,"Taylor Sheridan has quickly become someone that I would watch anything that he writes and/or directs in the future from now on, regardless of what the story is about. The man is incredibly talented. 

Incredible character driven film and I hope the studio doesn't screw up the release of this film to wider audiences. ",6ueskb
dlthrtc,"I loved the film. I'll admit there were some moments that felt a little bit off, likely due to Sheridan's first time in the director's chair (perhaps that's unfair but it's the impression I got). But they didn't drag down the movie as a whole. Overall a very engaging thriller. And to Sheridan's credit, he nails it when it matters most. The tension leading up to the finale was just incredible. And learning the truth about what happened was heartbreaking. Renner absolutely kills it in this movie. Olsen too. And they're surrounded by a fantastic supporting cast. I can't wait to see what Sheridan does next. This, Sicario, and Hell or High Water are among my favorite films of the past several years. ",6ueskb
dnqeuyc,This movie is so golden because people are generally used to garbage CGI Hollywood lights and magic movies. This is a film that decides to not use trashy effects and instead real acting from actors and actresses who not only know how to present themselves on a visual medium but a mental medium as well. Its so nice and refreshing because we have something that holds ambiguity and real meaning not explosions on a feel good level. ,6ueskb
dm06yj3,"I loved the movie, I thought it was better than any other film I've seen this year. Honestly its probably the best performance Renner has given since *The Town*. Hope he gets another Oscar nomination for this film.",6ueskb
dq894o6,"Just watched the movie this evening, and it may not be the tightest movie in a narrative sense, but it establishes its atmosphere fairly well.

Some performances of the Natives seem a little too on-the-nose in describing the issues they face. While others (notably the older men) have better dialogue and act logically within the narrative.

I really the tribal police captain, because he had a bit of a small story arc with how I perceived him. At the beginning, I thought he was a ""hump"" that was going to be an obstacle for the main characters trying to solve the murder. I thought he doesn't want to mess with the status quo, and he doesn't care.

But then my perception of him starts changing, because you see that he is quietly jaded. He's understaffed, and overmatched, and he's seen too much failure in his line of work throughout all of these years, and he's just become numb to it even though he still cares inside.

He immediately sees the young FBI detective and thinks that he's knows this is going to end the same way as all the other times. He tries to stop Elizabeth Olsen from pushing the locals too hard, not because he doesn't like the outsider pushing, but he knows that she doesn't understand just how rough a condition the locals are in.

They make some progress, and he's still apprehensive about the effort. And then you begin to see him have hope that they could get a decent lead towards solving this case.

And by the end, he's a believer in the two partners he's got, and he went out of his way to get a couple more State Troopers because he thinks that they are close to nailing it. He ends up being fully awake and being a cop with fight in him near the end. I really liked that guy's performance.",6ueskb
dn38ob8,Didn't any of the cops wonder why *all* of the armed security guards had to come?,6ueskb
dq4r1yo,The ending made me mad. No missing statistics for native american in rez land. Fuck this country :(,6ueskb
dlsftqr,"Wow I really liked this movie. Strong acting, writing, directing, just an all around great movie. This movie made me a feel a lot of emotions and made me feel for the characters. I loved the way he told the story too, especially towards the end when she knocked on the trailer door. A nice simple plot as well. Sometimes these crime/dramas get overly complicated but Sheridan kept it simple which I loved. I really recommend this one. 

Edit: Also, I was surprised at how poetic some of the dialogue felt. I didn't expect that from Taylor Sheridan, but he did a great job of it.",6ueskb
dmkitlr,the sound mixer deserves a raise,6ueskb
dn2bjf8,Great film. I was absolutely gutted after they showed what really happened. That stand off between the refinery guys and cops before that was so tense and just a great scene. ,6ueskb
dnqw4ma,"I just finished it and I really enjoyed it. One of the best films this year anyway. Sure you can tell it's made by a new director but that director has a strong future if he continues at this kind of level and gains experience along the way. 

I tend to stay away from the silly CGI filled Hollywood blockbusters anyway so this films makes it feel like it's made just for me. By the sounds of it a few other people here also liked that it's not another big CGI blockbuster. Just actors, landscape and acting.",6ueskb
dlt5eq5,What a fucking amazing movie. What this film does better than any other I've seen is portray the isolation and abandonment of the Native American community. We've done so many terrible things to them over the centuries and now we just sit back and let them suffer their situation.,6ueskb
dluqtb8,"Holy hell this movie was good. My #1 for the year without a doubt, and I’ve seen all the biggest releases. 

Haven’t read through the thread yet to see if it was mentioned, but there was one small moment that really stuck out to me. When they are first meeting with the family and the father (played by Gil Birmingham) answers the door to Jeremy Renner, that was a **fantastic** moment of acting. ",6ueskb
dls5xyb,"My 2nd favorite of the year so far. Fantastic script - it's a very introspective and character-driven crime story. One of Jeremy Renner's best performances, and Graham Greene is good as always, but Elizabeth Olsen really surprised me. Good work all around.

Great atmosphere, driven by the cinematography (landscapes for days) and unnerving score.

Just a really smart, interesting crime movie. Go see it, even if you have to travel a bit.   ",6ueskb
dlthqwc,"At the beginning of the movie, there is a title card that says, ""inspired by true events."" Does anyone know what the true events were that inspired this movie, other than the unsolved disappearances of Native women, in general?",6ueskb
dpkh25t,[deleted],6ueskb
dlzo8mu,"Enjoyed it a lot. There were definitely a few moments that felt like they suffered from Sheridan being a first-time director though, like walking in to see the guy's wife just slitting her wrists. The staging of the whole scene was really awkward and clumsy and made a serious scene somewhat unintentionally comical. It just seemed too coincidental and made me wonder why the fuck a guy would let his wife just cut herself.",6ueskb
do1507m,"It was a good film, the performances by pete was great, did not expect that. Not a big fan of Olsen she is a shaky actress but outside of that some good acting.

Btw is it only me who thought the ex-wife was a a-hole?",6ueskb
ds1of9b,"Watched it and loved it. First things first, Elizabeth Olsen was beautiful in this movie, watching her in that white snow was just perfect.

The opening prologue was great, at first I got confused and thought it was Cory's daughter that he himself found dead. Made sense later. 

That scene towards in the end when Jane is in the hospital and feels the pain and says she ran 6 miles in the snow was powerful and sad at the same time.

The shootout scene was well done, when Elizabeth got shotgunned, I was expecting a bomb there for some reason, but it was so sudden. Later, everyone getting sniped. 

Some great and well played scenes in the movie. Deserves its praise. ",6ueskb
dnpfwh9,"Does anyone know what the cop was referring to right after Elisabeth Olsen told everyone to drop their guns when he asked ""did you see it???""",6ueskb
