comment_id,comment_body,submission_id
dvm3o6z,"I also noticed the reference to Algebra II, but I wonder how much thought Gerwig put into that line.  If she was on the honors track herself (which seems likely since she got into Barnard), her memory almost twenty years later about what courses people in the next track down took in what year might be blurry.  She might also have just thought Algebra II would sound more relatable to the audience than Trigonometry or Pre-Calculus, even if they might be more accurate. ",7doxvl
dq5l2f2,"I didn't think so. 

Going in, my guess was that it would be either sweet but generic (like Brooklyn -- by-the-numbers but well-done), or something special and genre changing. I don't think it ended up being fully either, although I would say it was closer to the latter.",7doxvl
dq7eyww,"Yes, it's so freaking overrated. Do not see it, it'll be a waste of time and a waste of money.",7doxvl
dqhql4p,"It's still a good movie, but overrated. It's well executed but otherwise is a kind of cliche coming of age film in white suburbia...",7doxvl
dq56cfm,[deleted],7doxvl
dtfqxir,"Thank you. As a woman, even I had a hard time with this film. I can see why plenty of people connect to it though. Laurie Metcalf (Lady Bird's mother) and Ronan absolutely deserved nominations, but on the whole I wanted to tell people to watch Starter for 10 with James McAvoy to see the male version of this coming-of-age story. Same deal, an intelligent quirky young person, feeling ashamed of being poor, treats his friend badly and learns life lessons about the importance of family and where you come from.  Absolutely didn't deserve a best picture nomination. That Blade Runner was excluded in Directing and Best Picture - but Get Out and Lady Bird made the cut - is still really bothering me. -__- ",7doxvl
dtfizk0,"I agree with almost everything you said
",7doxvl
dpzwwl2,These are my thoughts exactly. Great movie that could have been given a bit more love in the cutting room.,7doxvl
drfrmoo,The two movies were very similar. Right down to the 'swimming in the rich friends pool' scene. Both written by young-ish women. I think liked this one a little better too. But they're both excellent.,7doxvl
dri6jpw,"Ditto about being a “townie” for college. Hated it. Add to that, the school was a commuter college so even if I wasn’t commuting, campus life was non-existent. This movie definitely resonated with me too and although I didn’t necessarily experience a lot of those “classic” teenage experiences I still felt connected to them. 

Waiting for Edge of Seventeen to hopefully come onto one of the streaming services. Somehow missed out on it during its theatrical run and I’m not really big on digital renting.",7doxvl
ds4u0qs,"I found it very comparable to Boyhood as well, but I think I enjoyed Lady Bird more despite Boyhood being more relatable (me being a boy and the time period fitting better). I liked that it mostly took place over a single year, but still gave a great picture of what it was like for Lady Bird to grow up where she did. Boyhoods time jumps were a bit jarring even if they were a great nostalgia trip.

That being said I was expecting a bit more from a 99% fresh movie, (I know 99% doesn't mean everyone is rating it as perfect just that 99% of critics there liked it) it was by no means bad and I enjoyed it, but I think I hyped it up for myself a bit too much.",7doxvl
ds3kde5,Hahah are you me? I wasn't crazy about Lady Bird but as a male in my 20s I'm sure it wasn't made for me. Loved 3 Billboards.,7doxvl
dx0he7p,"Does every 'storyline' in your life get wrapped up with a perfect little bow?

The film is very much 'slice of life' - a snapshot of a year in the life of one teenage girl in Sacramento. The film flows in and out of specific and 'memorable' moments in Lady Bird's life.

Sort of similar to Boyhood, but with a much better execution. ",7doxvl
dwkblfp,"the movie is actually fast-paced. it was a good technique actually, i thought it was useful, it made the movie more ""feel-good"" and heart-warming",7doxvl
dq8pvsy,Welcome to reddit where going against the hive mind leads to no discussion and downvotes. ,7doxvl
dq73nhm,"I saw it last night in Michigan with over 20 people in a small theater. Trust me, this movie is doing fine.",7doxvl
dq5cslh,"A24 are creating a lot of movies and are taking risks,some of them pay off and some of them don't,   
but they are still profiting a lot so they keep taking these risks.",7doxvl
dq7a5ed,It's a slow rollout to build word of mouth. It will gradually get a wider and wider release as more people hear about it.,7doxvl
dqhabim,"the old fashioned way, which is to build over a long period of time, and have a healthy life on rental/streaming/dvd sales. the trick with smaller films seems to be to not overextend in marketing or in theaters, but to instead target audiences that are likely to appreciate it, and let word of mouth keep the movies in theaters for long enough to recoup the costs. 

Its not the same RoI as big films, but it also lacks the same risks ($10 million is very small should the film bomb). ",7doxvl
dq5duzz,It's still continuing to expand. ,7doxvl
dqotqx6,As of now Lady Bird has made back 13 million against it's 10 million budget. Not bad at all!,7doxvl
dq5ktgd,"If I started a business and then concluded halfway into the first day that it's unprofitable, I might be drawing that conclusion a bit too early. You may be doing the same here, considering how few screens it's showing on and the amount of steam it's gaining heading into wider release and awards season.",7doxvl
dqesjne,"It took 12 years to make.

",7doxvl
drn8wp4,My heart broke for Danny!  Finding out your highschool boyfriend is gay is not fun but being a gay teenager is a lot less fun.  I was so glad that the movie recognized that and made Danny a sympathetic and lovable character and not a horrible person for cheating on Lady Bird.,7doxvl
dutj02x,"that was the end of her character arc, realizing she shouldn't be ashamed of who she is or where she came from. ",7doxvl
dq6jpnk,I took it that he had cancer/a disease or depression since the mom worked in a psychiatric setting.,7doxvl
dq98heb,"She's looking at colleges with her mom. They get into a tiff and she basically opens her car door when they're driving, and flings herself out. Then it cuts to her at Catholic school with the cast on her arm. Hope you like it! :) ",7doxvl
dqc6z0x,[deleted],7doxvl
dqdntox,"I agree, though I'm so happy she was able to include the sequence with Lady Bird driving around Sacramento, with the quick cut to her mom doing the same. Beautiful way to end things, wish she could have got to that point in a different way. ",7doxvl
drn9b1o,"Every interaction the mother has with anyone in the movie is a positive one.  Miguel loves her, Shelley loves her, the dad loves her, her patients love her, her coworkers love her, the lady who works at the thrift shop loves her.  I think we are meant to understand that she is a good person with lots of fine qualities but that doesn't translate to being the mother her daughter needs.  I thought the scene with the priest was just another way to show that she is a good, decent, competent person.  And we do seem him again briefly later looking happy so I think we are supposed to know he came out the other side.  At least I like to believe he did since I loved him!",7doxvl
dqzpymy,It's to show us more about Mamma Bird than it is to develop the Fr.'s character.,7doxvl
dr108ty,"He does appear again during the Tempest play scene. He cheers loudly during the applause, but I can't remember exactly what he says.",7doxvl
dsl9go5,I think he was just cumming and was on the climax,7doxvl
dso208q,Iirc that was Crash Into Me by the Dave Matthews Band,7doxvl
dsylytt,"""A People's History of the United States"" by Howard Zinn

The book is essentially an exploration and discussion of how the U.S. was/continues to be shaped by the wealthy elite. This ties into the hypocrisy of how Kyle himself is part of an upper social class while striving to be aloof and critical of current events, though on a superficial level, ex. ""Do you have any awareness of how many civilians we've killed since the invasion of Iraq?"" while continuing to indulge in the privileges afforded to him by his status.

",7doxvl
dq2y30a,I couldn’t disagree more. I thought it was easily the most genuine coming of age film I’ve seen in a while.,7doxvl
drwo92q,Have to agree with you. I thought it was dull. The only character I cared about was the father as he seemed the only one who wasn't an asshole.,7doxvl
dsajusd,Lmao you should go for a walk! It might cheer you up you never know ,7doxvl
dq16oct,"""turns out to be gay"".  The writing was on the wall from the get go man.",7doxvl
dq5iutu,"When I was growing up in the suburbs, I used to think the 'gay actor' thing was a cliche and unfair stereotype - then I went to college and took some theater classes and came to find there was some basis for the 'stereotype'.",7doxvl
dr0r5qr,"I think I like The Edge of Seventeen better. But this is awesome, too. ",7doxvl
dqtw3q4,Napoleon Dynamite was legit better.,7doxvl
dqt1nfk,"heya, sounds really promising, where did you see it?  ",7doxvl
ds3wtei,"What about the ""cool kids"" made them ""bad people"", though?",7doxvl
dshmenv,"maybe another way to think about it is like this.

an abusive mother picks one of her children to leave alone, picks another child to drive into the ground with insults. The father is left in the middle unable to change or help the situation.

How does the insulted child grow up when the mother is around vs when the mother isn't around.

GO

",7doxvl
dslshnf,She is a teenager.,7doxvl
dswtpg7,she's supposed to be annoying she's 17. its slice of life. life moves slowly and the plot is subtle and character driven. it's not the best movie ever but it isn't garbage. it's a 6.8-7.3,7doxvl
dtqgxcd,"i like slices of life that don't have anything going for them except characters. as long as it's smart, nostalgic, witty and charming. i would rather see real humans being real humans than jedis fighting with light sabers. i just don't call that genre garbage because i don't connect with it.",7doxvl
dswkglv,"""Yeah. Hopefully there's a version that takes all of female actors out of the movie. And that gay dude. And the Hispanic girl who looks like Mila Kunis. I guess she counts as a female actor, but I'd let it go if it was Mila Kunis, but it isn't.""

Did I just read your mind? I totally read your mind.

",7doxvl
dqqcxf9,"I felt the exact same way. I saw this with my girlfriend and she took away so much more than I did. She related to ladybird and the relationship with her mother, where as I could only commiserate as a third party to both my gf's relationship with her mother, and my sister with my mother. ",7doxvl
dq2yaqs,"I can try to answer several of your questions. I just saw it this afternoon, so it's still fresh in my mind.

> Has Lady Bird never heard of student loans?

Yes. She mentions loans at one point as a possible way to afford college in New York.

> Is the writer aware that you don't fill out a FAFSA for specific schools?

I don't think her dad was saying he filled out different forms for different schools. He just handed her the envelope with the completed forms in it for her to submit.

> Why was Julie crying on the night of prom?

This wasn't explored that much throughout the movie, or at least I didn't catch it if it was, but I think Julie suffered from depression. She says something to the effect of ""not everyone is built/made happy"" when Lady Bird asks her why she's crying.

> Why was Father Leviatch at the hospital ...

It seemed to me like he was having suicidal thoughts stemming from the death of his wife and son. And he asked Lady Bird's mom not to mention it to Lady Bird or Julie.

> ... and why do we care?

This I'm actually not entirely sure about. Maybe because he was a positive influence for Lady Bird and Julie?

> What did the mother actually write in those letters?

I can't give you a transcript, but they were each different attempts to explain why their relationship was so strained and why she loved Lady Bird despite that strain. Multiple letters began ""Dear Lady Bird,"" and at least one started ""Dear Christine,"" so you could tell she was having a hard time deciding how best to say what she wanted to say.",7doxvl
dq5d2y3,"Interesting; I didn't see the movie as shrugging or laughing off the abuse. I thought it actually did a great job of showing how an abusive relationship like that can be much more nuanced than ""parent emotionally degrades child in every interaction"". Many relationships like the one between Lady Bird and her mother, while certainly abusive and destructive, are borne out of misguided or tragically failed attempts to have healthy, loving relationships. And quite often there will be days or weeks at a time where the relationship seems healthy, fixed, normal. I thought that the back and forth with them wanting to scream at each other one scene and then a couple scenes later seeming to reconcile really portrayed the subtleties of everyday toxic relationship cycles very well.",7doxvl
dr1scb1,"Thank you. You managed to nail every problem I felt with this movie. I kept struggling to figure out why I didn't like it as much as everyone else. Her mother IS abusive. It's not even close. I hated her every second. As someone who came from an emotionally neglectful household, I can't sympathize with abusive parents.",7doxvl
dq3li55,"the funny thing about you're reaction to the film is, you sound like a bit of a ""Ladybird"" yourself.",7doxvl
dq2uztz,"Didn't even consider the abuse angle. I think you nailed it. It also felt inconsistent. First half of the movie, the mom is relatively fine and then midway through becomes a complete asshole. ",7doxvl
dqzq2ds,Degrees != money especially in Sacramento.,7doxvl
dr2g94k,"They did send her to private school. My mother is regaling me with stories of when she went to the same private religious school setup that Lady Bird went to, it seems to amount to my grandparents being unable to spend lackadaisically and reminding my mother that they send her to private school each time. ""Uhh, you are the ones sending us, *we* don't want to go.""",7doxvl
dqb52ug,Lol 8 and 9's are pretty damned good scores.,7doxvl
dqf3zqm,I think you misheard. They said Jim Morrison.,7doxvl
dqf3sw7,"He says Jim Morrisson hair, not Morrissey. That's why when she walks away and asks her brother who Jim Morrisson is he tells her he's from The Doors.",7doxvl
dqqgyle,The excitement was mostly media narrative that shouldn't take away from anyone's experience of the film.,7doxvl
du6j6h1,"very similar sentiments here.  It's a real pleaser for those ""love to watch paint dry"" crowd.",7doxvl
dq0avly,"I can agree on this, wish I had gone into it fully blind",7doxvl
dsvbv2g,"That's how many parents act, whether they like it/want to believe it or not.

As a parent, it's hard to let your child grow up and lose control, especially when you feel like you've sacrificed everything for that child. Ladybird's mom watched her daughter reject their family, the food, her clothes, everything.",7doxvl
dv7tqzy,"Was she? I sided with her in almost every argument. Lady Bird is unlikeable (probably by design) and her mother is over worked and the sole breadwinner for the family for a time being, of course she's going to be frustrated by an ungrateful, whining, pretentious child. ",7doxvl
dq7o6iz,"I wont down vote your opinion, but could you put words to your thoughts though? Curious what you didnt like and maybe some movies this year you did like.",7doxvl
dq7k8le,Interesting! What are some films that you liked this year?,7doxvl
dq0u3dg,Yes.,7doxvl
dq1qzss,Why is Juno the standard we should be comparing Lady Bird to? They are very different movies. It's a bit reductive to only view them as coming-of-age teenage girl movies.,7doxvl
dq13vr3,Yes Saoirse Ronan is playing in a different league than Ellen Page.,7doxvl
dq0t0ng,"I personally feel like Juno is a better film, although I did love both.  Juno is a much more tightly constructed film that is arguably better acted.  However, I don't think that should take away from Lady Bird.  This is still a great film.",7doxvl
dq2dmnc,"It really depends on who you ask (though, that is a statement that exists with all art, isn't it?)

I personally HATED ""Edge of Seventeen"". For myself, it was one of the worst films I watched in 2016. Now, I do think it was a well crafted film; it was scripted well, and all of the roles, INCLUDING the lead character, were acted well. My favorite characters in the film were the teacher (so wonderfully played by Woody Harrelson), the brother, and the main character's best friend.

All of that being said, I still HATED the film. The reason being, I couldn't get behind the protagonist of the film in any way. Now, I understand that rather is the point. It's a coming of age film with a lead female character who is so supremely self involved, as most teenagers are in some capacity, that she is destroying everything around her. She's quick to anger, conceited, woefully ignorant and simultaneously a ""know it all"" in all regards, that she is sort of like a hurricane who is creating tsunamis destroying everything else within her view, while being devoid of really any redeeming qualities until the last 10 minutes of the film, which at that point I didn't care.

Due to everything I mentioned (and much more which I won't go into so as not to belabor the point), the film, again to me, was a sweeping two hours of negativity and conceitedness that just felt so disgusting and venomous. And for that, I just could not enjoy the film at all.

However, I thoroughly enjoyed Lady Bird. The lead character, while also exhibiting many of the ""I am the center of the universe"" traits of typical teenagers, still exuded a warmth to her character. Much of that is also probably due to the pacing of the film, which I felt was allowed to breathe much more than ""Edge of Seventeen"". Lady Bird never felt deliberately destructive and self-destructive, but rather just lost with her genuine goodness still having sway on her. She had the same naivete about sexuality, but the film presented it as something she misunderstood about the situation and the other guy, whereas ""Edge of Seventeen"" presented it as the lead character making assumptions about the other person based on nothing but a dream.

Also throughout the film, we had the Mom, played so terrifically by Laurie Metcalf. She was ""antagonistic"" in the sense of just being a parent, albeit one more on the stern side. We saw the conflict between mother and daughter, but so quickly understood that the two really care about each other, do get along at times, and that the conflict in the film between them was quite a bit ideological and borne out of the teenage desire for independence, not purely just from a standpoint of Lady Bird being difficult.",7doxvl
dq4pyhq,"Haha I'm going to go against all the other responses and actually say that 'Edge of Seventeen' was my favourite movie of 2016. Nothing groundbreaking, but very well written, likable characters, charming, and Steinfeld was incredible. The main character is so very flawed but I found myself relating my own character faults to hers, which made it ring true. So I loved it.

What's crazy though is I just watched Lady Bird tonight and I walked out thinking that a.)Would make a great double feature with Edge of Seventeen and covers some of the same territory and b.)Makes Edge of Seventeen look like a sitcom in comparison. Watching Lady Bird makes me like Edge of Seventeen less lol. It was so good.",7doxvl
dq42ybf,"Edge of Seventeen was okay, and largely forgettable 6 months on. Lady Bird is brilliantly written, shot, chopped, and acted. Nothing alike, technically and artistically speaking, beyond a shared genre. ",7doxvl
dq2v2gu,"Not really. Edge of Seventeen had some interesting elements and didn't do anything with them. It felt like a Lifetime movie. I'd say Lady Bird is worse, though, because I remember at least enjoying some parts of Edge of Seventeen. ",7doxvl
dqdnk7z,"It's not explained in the movie. Gerwig discussed this in her interview with Terri Gross the other day and she said it just kinda came to her out of nowhere. She later found out about this nursery rhyme: https://www.poetryfoundation.org/poems/46960/ladybird-ladybird

To me it just worked, it does seem like the kind of thing a rebellious teenage girl would insist upon being called. ",7doxvl
dqd74pf,Well she wants to “fly away” far from home doesn’t she? I’m not sure if that’s why she chooses that name but for movie purposes it’s very meaningful. Lady Bird’s mother’s “empty nest” conflict connects as well. ,7doxvl
dv6s5x2,"Funny. I'm Black and the relationship she has with her mother reminded me ALOT of me and my own mother. Very relatable for me.

Are you really generalizing all black and latinos out here? Since when are we a monolith? ",7doxvl
dv8n7le,I don't get why you would feel the need to drag race into this. It's actually sad that you think this way. ,7doxvl
dv6tnlz,"Her mom talked back to her like that, though. They both had a really unhealthy relationship in a lot of ways.",7doxvl
dyz73ps,"LOL.  Q: Why do white teens feel so entitled yet make themselves out to be the victims of society?  A: Lady Bird the Movie.


PS Love your name.  Now write me a prescription.",7doxvl
dpzwopg,"Standing in front of the blue house was totally Wes Anderson. Going house hunting was too, as a concept, though the cinematography was different.",7doxvl
dq3vthn,"> mom (who should definitely get a supporting actress nom)

I think Metcalf and Ronan are a lock for nominations. Probably Gerwig as well.",7doxvl
dpzpue9,yes yes love that scene as well. the amount of emotions running across her face during that scene was just heartbreaking. metcalf and saoirse ronan were just amazing,7doxvl
dq1ckjq,"Same here. Was very disappointed to see the lack of Larry Bird in the trailer, and had to read the title again before it clicked that it wasn't about him. ",7doxvl
dq3y7x2,"""What's wrong with that? They're the greatest!""",7doxvl
dq3j3up,"THAT is how I feel ABOUT ANY INDIE INTERNATIONAL FILM (im in the US) I have to wait sometimes YEARS before I GET TO WATCH IT.

I feel your pain ;___; ",7doxvl
dq40zsg,"It's got a very small showing even in the US. I think it's going to expand more in the next few weeks, so don't give up hope.",7doxvl
dq71y5k,"It isn't getting a European release until next year, you can keep an eye on the dates [here.](http://www.imdb.com/title/tt4925292/releaseinfo?ref_=tt_dt_dt)

Poland isn't currently listed, but it was just screened at a film festival there so it might get a wider release. ",7doxvl
dqvr3n1,"It is definitely hyperbole. How does Greta Gerwig’s Lady Bird stand up to:

Brad Bird, The Iron Giant 

Michael Mann, Thief

Jean-Pierre Melville, Le silence de la mer 

Quentin Tarantino, Reservoir Dogs

Francois Truffaut, 400 Blows",7doxvl
dq8ygqu,So since 1941 you can't think of a better writer/director debut?  ,7doxvl
dq3v3qb,It's really hard to think of a better one. ,7doxvl
dq840t9,"Which scenes struck you as ""messy?"" ",7doxvl
dq73wlc,I had this same exact thought about the movie. It wasn't as polished as it could've been and some characters should have been fleshed out a little more. But it was a damn good debut.,7doxvl
dqc7wav,[deleted],7doxvl
dwo4kfh,Have you ever met a teenager? or remember what it was like being that age?,7doxvl
dvj5a31,"its so sad that your post is at negative points.  you are 100% correct.
and this movie is hyped as **** . all due respect to talent actors. the movie was so needless and pointless. and i felt like smacking lady bird on the nose at her tantrums
(for those a***** who might think im sexist or something. I LOVE REY from star wars so stfu) ",7doxvl
dyz6pb3,"Same!!  At the end of the movie my final thought was, ""Wow Lady Bird, you finally achieved your dream but your life still sucks because you are a shitty person.""  Even when she is ""doing well"" by her standards (being invited to the nice house, being with the popular kids, being in NY) she doesn't try to genuinely connect to anyone.  I am pretty picky about the movies I watch these days, and I felt like my time was wasted.  Disclaimer: the actors did a great job portraying these characters I disliked.",7doxvl
dqieiyc,"Uh, by your scale a ""7/10"" is considered positive, and therefore if it was aggregated into Rotten Tomatoes, it would be considered ""fresh."" 

The Rotten Tomatoes 100% score doesn't mean everyone gave it 10/10, it means everyone gave it a ""positive"" score. You would be included in that.",7doxvl
dqj14d7,"I think the unfocused narrative might've been more about how different people are all affected in the same way. For example, her theater teacher has what I think was an implied depressive episode, and the last shot we see of him was the 'nobody for support' scene, then later, it's revealed that her 'not the badguy' dad has been dealing with depression for years, but has somewhat of a support system in place, and then finally her friend Julie saying 'some people just aren't built happy', but getting back with her best friend. Same with the boys in her life, each one gets progressively less special, validating the 'you're ganna have a lot of unspecial sex in your life'. Its probably just arthouse bullshit but thats the way I looked at it.",7doxvl
dq3ory3,Interesting. I've always thought Saoirse has one of those ever adaptable faces: she can look mature but can also be made to look quite young; I found her age in the film believable. ,7doxvl
dq46wn0,"TV often had people in their late 20s playing high schoolers so a six year difference is pretty trivial.

",7doxvl
