comment_id,comment_body,submission_id
dq3owfn,"Man. The whole movie is great, but that scene where Lady Bird finally confronts Danny about being gay and instead he just breaks down crying and she comforts him was the moment I fell in love with it. Such a 180 of where I thought that scene would go. ",7doxvl
dq0doa6,"""Are you and mom going to get a divorce?""

""No. We can't afford to.""

I don't know why but i thought it was the funniest joke in the whole movie.",7doxvl
dq0bco6,"""Some people aren't built happy."" Floored me.",7doxvl
dq3d8if,"Half way through the movie the older couple sitting next to me had this exchange.

Man: ""I don't know what this film is about""
Woman: ""yes i agree, i'm sorry honey this was a bad choice""

At the end of the film they were both sobbing. ",7doxvl
dpzg48l,timothee's character Kyle had my audience in stitches with every word he said. one of my favourites of the year! ,7doxvl
dq0swpb,"The first act kinda felt like Wes Anderson doing ""Napoleon Dynamite"", I loved it ",7doxvl
dpzs3qq,"I love that we are now getting at a point where we can have early 2000s period pieces. This movie perfectly encapsulated that time in so many scenes throughout the movie, doing it hilariously so every time.

My favorite example of it was the use of ""Crash Into Me"". It reminded me a lot of the use of ""Drops of Jupiter"" in the movie Other People. Taking a song that we've heard before and using it in a stereotypical way at first and then using it later on in the film to help get to the emotional core. It's a welcome trend for me and has changed my opinion on both of those songs.

It was also just a surprising hilarious film altogether. I was expecting it to be funny, but not nearly as funny as it actually was. The awkward scenes at the Catholic school, the way that Kyle first mentions his father's cancer, and the scene where Lady Bird's dad was just playing solitare while Lady Bird and her mom fought all had me bent over laughing.

Just a beautifully orchestrated, loving, tender film about growing up and realizing that your parents are people too.",7doxvl
dpzrb7g,"Loved everything about it. I would have watched 8 more hours of it. The scene with Lucas Hedges crying into Ronan was the best  highlight for me (in a movie full of highlights). Almost started crying myself. The Ronan/Metcalf relationship was unbelievably real & familiar.

The most laughs I've had at a theater this year (mixed in with teary-eyed moments). Just a great script, direction, performances.

Greta Gerwig can do no wrong at this point. Ronan's accent was super impressive and she jumped to number one on my Best Actress prediction so far. Chalamet's character was great, his delivery gave me a Nicolas Cage vibe for some reason (no idea why, doesn't make sense, but made me laugh a bit).

Also, what a year for Tracy Letts. The Post, Lady Bird, The Lovers. Didn't like that last one at all, but that's an impressive year.

Easily top 5 of the year, 9/10.",7doxvl
dqb19i7,The scene with Lady Bird and Danny outside the back of the coffee shop broke my heart. So well acted on both side.,7doxvl
dq1arci,"Cried my eyes out. One of the best debuts of all time.

""I'm sorry I wanted more.""",7doxvl
dqalbge,"When Timothee Chamelet's character said ""that's hella tight"" I was the loudest laugh in the theater.",7doxvl
dpze38b,"This is a beautiful movie, easily the best I've seen this year and one of my favourite coming-of-age movies period.

Every part is perfectly cast and expertly played. Ronan and Metcalf will get the Oscar attention, but the whole ensemble deserves recognition. 

The scene where Lady Bird is in Sister Sarah Joan's office and they discuss how there's no difference between love and paying attention is a perfect way to encapsulate the entire movie.

An actual 10/10. See this movie. ",7doxvl
dq1bhx8,"Lucas Hedges is absolutely killing it right now. Played a major role in three straight releases that will likely be Best Picture nominations (Manchester by the Sea, Lady Bird, Three Billboards). And an Oscar nomination for himself in there, as well. ",7doxvl
dr3pyfy,I liked that we didn't get the cliche airport scene at the end. The Mom got there too late and that was that. That's life sometimes...,7doxvl
dq5iule,"Honestly was surprised by the powerful punch at the end of the film.  As a guy, I don't know what relationships are like between mother and daughter, so it was refreshing to see a film that seemed pretty authentic in it's depiction of a mother and daughter.  Loved the performances and hope it picks up a few Oscar nods so more people will see this wonderful film.",7doxvl
dpze0an,Wow. Hope this gets all the recognition it deserves. Absolutely in the top three movies I've seen this year. Saorise Ronan is amazing. What a debut for Greta Gerwig. ,7doxvl
dqenftz,"This film is one of two things:

1. For the people who relate to it: painful, cuttingly real, upsetting, difficult, emotionally triggering to the point that someone might relive the emotional abuse of their adolescent years...

2. For the people who don't relate to it: a pretty good movie, yeah like the acting is good and stuff, interesting...",7doxvl
dpzdn7v,"Man having gone to Catholic high school, everything was just so dead on perfect. I laughed so hard at the JV coach becoming the drama teacher and they way he was still like a coach to them. Or the anarchist kid who’s still going to a private high school. So many great little touches like that.

Yeah I’ll admit it, I cried at the end. Wasn’t even expecting it, just a very perfect kind of melancholy. I also grew up in kind of a boring town but they way she talked about driving it for the first time and relating it her mom was so touching. What a perfect way to end a film.

Can we just point out we are in a quiet amazing time for teen movies this decade? Easy A, The Spectacular Now, Diary of a Teenage Girl, The Edge of Seventeen and now I think the best of them yet Lady Bird. I think we are finally having directors reflecting on the more poppy teen romances and trying to make something more grounded and honest. 

Last thing this is probably my favorite film of the year (check back with me in a week to see where I feel then) and if Saoirse and Gerwig could make do like a Before Trilogy thing and just make a film Lady Bird about Lady Bird every 10 years that would just be the best. Or at least please work together again.

Okay serious last thing but who knew the guy who wrote Bug and Killer Joe could play like the most charming, cuddly dad in movie history?",7doxvl
dpztk4z,"As someone who was in the orbit of several people who went to Catholic high school in Sacramento in the late 90s and early 00s this movie is dead on.

The movie is near-perfect at encapsulating all the things that make Sacramento unique and the things that always annoyed you, but you didn't realize you love until you leave the city.

I loved the little bits of local character like New Hel and The American Market on 24th.

The only way it could have been more nostalgic for me is if they recreated the back patio of the True Love.",7doxvl
dq08sa5,"Lady Bird walking to the church in New York and making that call to her mom is probably my favorite moment of 2017. The cuts between her and her mom driving though Sacramento gave me the biggest smile. Just everything about it was perfect.

Movie really is something special. So happy Greta is getting all this love, and Saoirse was amazing. Probably my fav of 2017",7doxvl
dq7wd66,"When I was in high school, I wanted more than anything to go to Sarah Lawrence. I wasn't so much searching-for-culture as Lady Bird was, more of a ""this is the kind of place where writers come from"" sort of a thing. By the time my senior year came by, I didn't even apply, for two reasons. One was a sudden fear of being so far from literally everyone and everything I knew. The other was the realization that my parents had not only never HEARD of application fees, but that coming up with them suddenly was genuinely a hardship. I graduated in 2007, not 2003, I went to public school and not Catholic school, and I was honestly a lot more like Julie than Lady Bird, but goddamn did this movie hit on more than a few unexpected tender spots. 

On an aside, the tears started at the climax, because, God, my mom's favorite punishment was the silent treatment. Often inflicted on the whole family, who usually honestly couldn't tell you who did what. ",7doxvl
dqi3vw0,"A lot of scenes between Lady Bird and her mother are just stories right out of my own book. It brought back bad memories and made me feel absolutely awful. I almost cried when they were in the fitting room and she asked “but do you like me?” 

My mother is exactly the same: passive aggressive and never satisfied with what I do. She also didn’t want me to go to a university far from home because she was almost obsessed with the idea of me never leaving her side, and I fought for it just like Lady Bird. And like Lady Bird, I love her and know how much she loves me but can’t help admitting that she doesn’t like me as a person and we will likely never truly understand each other. 

As the only 20 year old girl in the theatre, I felt I might be the only person who really empathized and understood Lady Bird’s entire perceptive. The old ladies around me were all kind of amused.",7doxvl
dpze45i,"This was an awesome movie. Having just entered Freshman year of college, it's weird now to be older than the kids going through these coming of age stories. I hope that unique stories like these continue to be relatable as I get older. Movies like these make me really not want to be a grown up. ",7doxvl
dqqlwlm,"This film was a barrage of these small moments that were relatable, sad and funny (often all at once). The scene where Christine is just begging her mother to talk to her stands out for me as absolutely heartwrenching. Saoirse perfectly captured that desperate, fearful need of a child finally experiencing a parent's withholding of attention. That scene alone I'd give her an award for, and that goes without mentioning her superb job all through the film, with great supporting performances as well.",7doxvl
dq9nr5o,"You know who I liked? The dopey dad. Just seeing him staring down at the ground, pausing his inane card game on the family Dell, while his wife and only daughter dig their heels in a particularly nasty spat, was such a memorable image.",7doxvl
dsy1v3e,The football coach trying to direct the show was brilliant.,7doxvl
dpzdv1d,"Holy shit, 100% on RT from 146 reviews and rightfully so",7doxvl
dqx8nic,"So, as a straight guy from a pretty accepting family I've never really known how terrifying it must be for people who need to come out. I mean, we all *know* it can be a scary thing, and for some it can be emotionally painful. 

After seeing Danny break down in tears, asking Lady Bird to not tell his parents he was gay I think I understand a little more. ",7doxvl
dpzempw,"Loved it. Random thoughts:

* *Rushmore* is one of my all-time favorites, and I kept drawing comparisons as I watched *Lady Bird*. Then, about halfway through, we see a Rushmore poster in her bedroom!

* Holy crap some of this stuff was achingly relatable (particularly because I went to Catholic school). The idea a lot of kids have growing up that *life is happening elsewhere*, and more than anything else they need to *get to where life is happening*. I couldn't have better summed up my outlook when I was in high school (and beyond...)

* I'm 27 and I'm *just* getting to that point where I'm beginning to realize how much I owe my parents and how much they did for me. As Lady Bird learns (in her first week of college, no less) it takes becoming an adult to appreciate the adults in your life.

* Like *Rushmore*, this is a lot more clever than meets the eye. People may need multiple viewings, but there is a lot of really subtle set-up and payoff.

* Also like *Rushmore*, it's not necessarily laugh-out-loud funny (though, I laughed a lot); it's more funny in the content-smile-on-your-face-the-whole-time sort of way. 

I don't *love* Noah Baumbach, so I wasn't sure what to expect from Gerwig, but goddamn I loved it.",7doxvl
dpzg8h7,"I enjoyed the movie a lot, I gave it an 8 in the poll, but I definitely feel underwhelmed.

Based on the comments and the reviews I've read, I expected to be completely blown away by Lady Bird.  I expected to watch a masterpiece.

Instead, what I got is a coming of age story done very well.  It's charming, it has funny moments, dramatic moments, great characters and dialogue, exceptional acting - but it's still just a normal coming of age story.  The beats were familiar enough that it was fairly predictable.

I definitely would still recommend it, but I'm a bit disappointed. ",7doxvl
dq0sst8,"My top-line review: This was a really fantastic ""coming of age"" story, that doesn't re-write the genre, but provided some fantastic performances from Ronan, Metcalf, and Feldstein.  Beanie Feldstein really is an emerging star; her comedic timing and genuinely heartfelt interactions with Ronan were by-far the best parts of the film. The dialogue and reactions to events that happened throughout the film were so damn believable.  It truly should be seen as one of the best films of this year.

However, I also had a much stronger connection to this film beyond just the general themes of the film.  I was raised in Sacramento, and there is just SO DAMN MUCH this film gets correctly.  Whether it be the just general terminology (""The fab 40s"") or the general struggles kids growing up in Sacramento constantly deal with [(""UC Davis IS wayy too close to go to college"" - such a perfect little interaction I totally had when I was selecting which college I would attend)](#spoiler).  It just gets so much right.  I think perhaps my favorite line of dialogue was when Lady Bird was talking to Jenna about how her family house in the Fab 40s was ""their starter home"" and now they live in Granite Bay. Just too damn perfect.  Also, I will say, I am glad that Sacramento is finally starting to find a bit of it's own culture, but the line about escaping this suburban sprawl for some place with a history and culture that is unique to it's own was something I've been saying my entire childhood.  However, just like Lady Bird, I too left Sacramento for greener pastors, and decided to come back home :) There's just something special about this place.    

I know that as a stand-alone film about a girl coming of age, it's fantastic.  But I didn't think I'd see in my lifetime a film that so aptly understood Sacramento and the people here. A true love letter that understands it's strengths and flaws. 9/10.",7doxvl
dq26b4n,"Wow, I can understand why people could feel slightly underwhelmed about the movie after all the hype and flawless reviews, but it definitely made me feel in a way no other movie has this year. The last 20 minutes were especially emotional to watch, as I have been emotionally estranged from my mother since high school. Also Saoirse Ronan has the most expressive and striking eyes!",7doxvl
dqn8hvm,"Holy hell, this movie. A pretty simple movie that was incredibly well executed. I wanted it to go on for so much longer than it did. Saoirse Ronan is a major league actress and absolutely deserves any of the accolades she ends up getting from this one. 

Laurie Metcalf was amazing too. Hell, everyone who appeared in this movie was amazing. But I'm hard-pressed to think of a movie that did a better job with the portrayal of a genuine mother-daughter relationship. It captures perfectly how frustrating that relationship can be for both the mother and the daughter while also showing how much love there is, regardless.

The fact that it was a love letter to the early 2000s was an unexpected surprise too.

10/10.

On a side note, I posted about this movie on Facebook, and my dad left a comment about the great things Lady Bird Johnson did for the country. Oh Dad.",7doxvl
dpzwion,"I liked pretty much everything about this except the editing. Scene transitions felt very abrupt in some places, like I was watching a series of vignettes instead of a continuous story.

I know that sounds negative, like I didn't like the movie, but I did. A lot. It was both funny and heartwarming, and I felt like it was training me to have empathy for someone that in real life I would give pretty short shrift to. It's just that I don't have a lot of insight to contribute on the positive side.",7doxvl
dqf9fws,"One of the best movies I've ever seen. I went to a small Catholic all-girls private school growing up, and this movie was ridiculously accurate. No one's ever made a movie that showed my life and my environment so realistically as this one did.",7doxvl
dpznnup,personally the mother-daughter relationship absolutely hit the mark. fighting one moment and then bonding the next. the ending also nearly brought me to tears. this film is truly special and captures the very meaning of home so beautifully and in the most poignant way. as someone dreaming of going to school far away from home i feel like i’m going to have an epiphany like lady bird did.,7doxvl
dvlk3wm,"The moment the nun asked lady bird ""isn't attention and love the same?"", Me and the dude sitting beside me cried out the same time 🤷🏻‍♂️",7doxvl
dqb0ijn,"Saorise Ronan is the best actress going right now, such a flawless performance made to look so effortless and nuanced. Perfect.",7doxvl
dr2gg9s,"I saw this with my mom. She kept staring at me! Ugh, mooom 🙄",7doxvl
dq107bu,Best coming of age comedy I've seen in years.  Maybe my favorite in the genre full stop.  I highly recommend this movie.,7doxvl
dpzrbl4,"I would have enjoyed this movie so much more if I hadn’t seen it in a packed theater here in Sacramento. Honestly, it was like watching a movie with a crowd from 1895 who were utterly aghast that the things they saw right outside were magically appearing on the screen before them. Every single time there was a shot of a local landmark, people audibly gasped, laughed, and cheered. 

I mean, it’s cute and I’m glad they felt represented, but it made the movie feel cheap. 

Still very well written and acted, but I just couldn’t remove myself from the experience. ",7doxvl
dqrsen6,"For the record, Kyle *did* say he was a virgin right? I swear he said that.",7doxvl
dqzq5jp,"Sister Sarah Joan: Attention is love.

*hits blunt*",7doxvl
ds2eowg,"""I'm not keeping a list.""

""Why not you're in high school!""

Best joke in the whole movie. ",7doxvl
dtk5w3y,"My favorite part of this movie is when Lady Bird and the nun are talking about Lady Bird's college essay, and the nun asks if Lady Bird thinks love and attention are the same thing.

I'm pretty sure that line right there is the *entire* point of the movie. The whole fucking thing connects right there, at least for me. I like to *get* something out of my movies, and that gave me something to think about long after the credits were over. 

I know a lot of these coming of age movies have really hipster characters, and that's definitely present here, but it's not jarring like it is in a lot of those movies. These could all be real people, and they act like real people. That seems like a low bar, but in the age of stuff like The Fault In Our Stars, it's really not.",7doxvl
dv9adnf,"What I loved about this movie was how real and non-cynical it was. Most coming of age movies see the protagonist going from being an innocent child to having sex, drinking, doing tons of drugs, and becoming extremely rebellious. And sure this movie had some of this, but it also had a lot of restraint and balance that I found refreshing: Lady Bird doesn't just jump straight into bed with the first guy she meets, and even when she does get physical with her boyfriend, she tells him she isn't ready yet; she gets drunk with her friends but it's not a way to cope or act out, and her mom doesn't get mad at her for it; she goes to Catholic school and does act out against the strictness occasionally, but she still is friends with the teachers/nuns that work there and doesn't completely revoke religion when she goes to college; she fights with her mom but it's always between moments of them laughing about something and never results in her running away or taking some other drastic action; etc.

I just love that this film flies in the face of every BS standard that it's been decided a film needs to meet in order to be dramatic or entertaining, and it ends up being just as dramatic and entertaining. It's real, it's cathartic and heart-wrenching at times, but it's also optimistic and positive and I love that so much. ",7doxvl
dqr7g15,"The movie did kind of lack urgency especially with the overall conflict(getting into a desired college/relationship with her mom). Nevertheless, I still really enjoyed the film. 

I suspect that a lot of people will be turned off by the protagonist. She's selfish, self-centered, and willing to lie or ditch her friends to be with someone. However, Christine's bluntness(which her mom shares), unpredictability, and willingness to fight for what she wants gives her charm. Her flaws give her room to develop(coming of age story after all); all of which she recognize at the end when she pours out to her mother in a very poignant scene. 

Something else I want to mention is the supporting cast. They feel a bit more realistic compared to other movies or TV shows on the CW. Julie is a normal girl instead of being a fat BFF comedic relief. You don't see any bullying stereotypes. The catholic school doesn't seem that stereotyped at all aside from the ""leave room for Jesus.""  

Laurie Metcalf and Saoirse Ronan definitely deserve honors for their performances. I also looked Larue Metcalf and realized she plays Andy's mom in Toy Story. ",7doxvl
dqs272q,"It was a nice little film. I can tell a lot of thought and love was put into it.

I think it was over-hyped to me though, because I left feeling a little bit of ""that was it?"". It wasn't anything groundbreaking, I've seen that story a hundred times of awkward teenager coming into herself/over-bearing mom does it out of love, etc etc.

It was a good film, though. A solid 7/10 for me.",7doxvl
dv2s83v,"Loved the part where Lady Bird's mum asks the priest/father if he had *support* and he said no, and also please don't tell your daughter. ",7doxvl
dvg4m5f,"I appreciated how they portray the Catholic School environment as a completely ordinary and typical high school. It just felt very realistic.  For whatever reason, Hollywood frequently represents Catholic Schools as over-the-top oppressive institutions, and that’s just not true. Catholic high schools are just like any other high school, except with a religion class.  Some you couldn’t pay to go back, some it was the best years of their life and they’d pay *you* to go back.",7doxvl
dpze1nr,"Glad I went out of my way to see this. Greta Gerwig can now add ""director"" to her resume as she slowly conquers indie cinema, and based on this, I am so on board for anything else she does behind the camera. I could feel a lot of Baumbach and even Wes Anderson in here, but this is so undeniably Gerwig to the point that Lady Bird feels like a role she herself might've played had this been made 10 years ago. Ronan is charming as hell, I could've watched hours of her doing her thing, and her scenes with Laurie Metcalf were simultaneously hilarious and heartbreaking. One of the best of the year, hoping this can find some luck at the Oscars.",7doxvl
drecaqc,"This was my favorite Laurie Metcalf performance of all time.  I've laughed at her work many many many times- Roseanne and Big Bang Theory. But she always felt kind of stage-y and broad  to me.  Here she was just .... tired.  

I know lots of people here are hating on her, but as someone closer to Marion's age than Lady Bird's age, I can see that they are just very similar women.  Marion is not a great mom, but, she does have a wonderful connection with her daughter (starting with crying together over the Grapes of Wrath), and is a victim of abuse, and is dealing with the dad, and works basically two jobs.  And we see she is nice in general. Just not with Lady Bird, who she sees so much of herself in.  It's hard to be kind to the reflection in the mirror sometimes.",7doxvl
dq1xlyt,[deleted],7doxvl
dq6lxa9,"Why do I feel like the only person who wasn’t blown away by this movie? I liked the movie, not saying I didn’t. But the quirkiness and coming-of-age narrative was typical, Lady Bird was almost unlikeable, Sacramento was not part of the story outside of exposition, and the most interesting characters were supporting cast/had minimal screen time. Additionally, the moment at the end with the discarded letters should have hit harder.

Is it because it was Gerwig’s debut? ",7doxvl
dvh5mbt,"I felt like it really captured the mundanity and boringness of Northern California in the early 00's. Too many other movies stick the characters in a small town and act like it's hell on earth, as if the West Coast is so glamorous, and in reality, it's really the same with one day rolling into another, yet there's an economic disparity and all these expensive lifestyles to compare yourself to that makes it almost worse than a midwest town where everyone is equal. ",7doxvl
dq19vfw,[deleted],7doxvl
