comment_id,comment_body,submission_id
dqdhk97,"Really enjoyed this movie. Great solo writing/directing debut from Gerwig. It's one of those movies that feels so honest, and is coming from such a personal place. I think this will certainly be one of those movies that people will discover and cherish for decades to come. ",7doxvl
dqk2gsv,I'm really looking forward to seeing this movie soon.,7doxvl
dqs79or,"I really loved this.  It felt raw and visceral in a way that too few films do. Some of the scenes have stayed with me since I saw it, especially scenes like The Apology and Not Made Happy.

Ronan and Metcalfe were amazing, really the whole cast was great. I really dug the Brion score and I thought it was pretty beautifully shot too, especially the bit at the end.

Up there with Blade Runner 2049 for my favorite so far this year. ",7doxvl
dumyu9d,Lady Bird= Excelent acting + Bad (or none) history,7doxvl
dv60exj,I mean it’s a cool movie for white people i guess. Because ain’t no way a Latino or black daughter would talk to their mom that way and just get away wit it like nothing happened ,7doxvl
dqi1kcq,I can't imagine a more boring way to spend 90 minutes.,7doxvl
dpzeozq,"Great coming of age movie.

Reminded me a lot of Rushmore, minus the Wes Andersen feel (but there still was a bit of that).


Hits a lot of the coming of age movie cliches, but it does everything so well, and the writing and acting are fantastic.

Saoirse Ronan and Laurie Metcalf really knock it out of the park.

There's a lot of stuff that's familiar here, but it's a great watch, and it had me laughing and feeling things the whole time.",7doxvl
dpzj8eh,"This is a wonderfully gorgeous film, and I think has to be my favorite of the year, and that doesn't seem likely to change. 

Lady Bird captures what a lot of teenagers feel especially as they are getting ready to go to college, and her parents are perfect as well - one wanting her to stay close, the other just wanting the best even if that means moving away, but knowing what that means as well. The emotions going through the mom (who should definitely get a supporting actress nom) after finding out Lady Bird is going to NYC, and then realizing at the airport she won't see her daughter for a while. How Lady Bird realizes she can't do everything herself and can't always be the center of attention.

I feel this movie is basically the perfect movie, especially in the coming-of-age genre, and I can't wait to see more from Greta and Saoirse as well.",7doxvl
dpzoj21,What a sweet coming of age movie. The actress who played the mother deserves a nomination for the academy. Especially for the scene at the end [when she’s crying alone in her car after dropping lady bird](#spoiler),7doxvl
dpzroxs,[deleted],7doxvl
dq0qqpw,"They used the same damn song at their prom as at my prom in 2011. Did not see that coming and it really made me relate to it

That being said, the Edge of Seventeen was my favorite movie of last year and this was somehow probably even better so it vaulted right to the top of my list alongside Logan Lucky and the Big Sick",7doxvl
dq1s3t1,Feels like the movie version of a greatest hits album. But instead of a band it’s a person’s life. Absolutely wonderful. ,7doxvl
dq3gz3o,"I hate it when I can't see movies like this, because they didn't bother to release it in my country (Poland). I can't even find if they will ever show it in theartre. Fuck that shit.",7doxvl
dq3n0s0,"This is probably going to sound like hyperbole, but I'm hard pressed to think of better Directing/Writing debuts than this. Off the top of my head, the only one I can think of is Orson Wells with Citizen Kane.",7doxvl
dq5425b,As much as I liked it and loved the performances I thought it was very apparent it was directorial debut. There were scenes that were just kind of messy. Saoirse and Metcalf were extraordinary. ,7doxvl
drvrx92,"I feel the same about Lady Bird as I did about Dredd. If I hadn't seen pretty much the same film (in this case, Edge of Seventeen, in Dredd's case, The Raid) within the year, I'd have thought it was incredible.

Lady Bird is good, but as a coming of age film, I think it isn't as good as EoS, albeit a lot more 'real'.

",7doxvl
dvhh77q,"Feels like this movie got over hyped a looot due to the revent #metoo stuff and focus on women in hollywood. It was a solid film but in the end very insignificant and lacking any depth and substance or meaning.
The main character was also a way too self obsessed and cringey girl, insisting on being called Lady Bird was just too cringe inducing. She was also a pretty annoying insecure person, with no real principles, selling out and dumping her good friends to be with the cool and popular kids. 
Again it wasn't bad as such, but it was just kind of a pointless movie about a pointless character that thought she was unique and special, but she was just very insignificant and average. Maybe it was more like the writer/director's own youth she felt she wanted to express.",7doxvl
dqhq9dt,"This movie is definitely overrated. Don't get me wrong, it's a good movie, but not 10/10 material. I think the critics are giving it a free pass for having a female director. Personally, I'd give it a 7/10. The aesthetics were good, but otherwise the movie felt really unfocused and was just a random string of events that could happen to any senior in high school. The supporting characters should have been developed a little bit better instead of just getting a ""sampling"" of many different characters. Also, I felt like the movie should have been more focused on certain plots rather than just meandering around everywhere (which made the film seem way too rushed). The movie also ended very abruptly. They should have either ended the movie before Lady Bird when to NYC or extended the time in NYC. It's weird for a film to introduce a new environment for a character and then suddenly end...

Also, good luck with the loans, Lady Bird, when you graduate in 2008 ;)",7doxvl
dq1qbyc,"That's a bit of complainer question, but honestly was anyone bothered by Saoirse's age in this movie? When I graduated high school I was 17 and Saoirse Ronan doesn't look 17. I know she's is only 23, but I've seen her in adult roles and that's how I see her. When watching the Lady Bird trailer I kind of cringe like I'm watching an adult playing a teenager stereotype.",7doxvl
dpzsfu8,This movie's perfection. I would NOT be surprised if it wins best picture. There is nothing that's not flawless about it. My god I can't wait to see it again.,7doxvl
dqhvioz,"Not sure why it was advertised as a mother daughter thing. The whole movie is Lady Bird ditzing around with fights with her mother mixed in... then at the end it seemed like the creators remembered it was supposed to be about the two, which was why the ending about the mother felt so out of place. Lady Bird and her mom yelling at each other isn't character development, I would of rather it been more focused on just Lady Bird.",7doxvl
dpzgzz1,"I've seen almost 90 movies released this year, and Lady Bird is probably my favorite all What a lovely, warm, humble and authentic movie with a lot of genuine emotion and humor! Every performance is perfect and the characters all feel like real people and are given a lot of nuance and depth. This is a movie with a lot of love, for its characters, for Sacramento, and for Gerwig's Catholic upbringing. See it as soon as it comes to your town.",7doxvl
dpzhjv7,"I really want to see this movie, but it won't be released in Australia until 15th February -- 3 months away. Fuck that.",7doxvl
dslaj9e,"Perks of being a wallflower 2 , nothing that special like people talked about.",7doxvl
dpzvkd3,Loved it. Really really good film. I hope it gets the attention it deserves from audiences and the Academy. ,7doxvl
dq3qkxo,Easily one of the best films of the year. Found myself tearing up at multiple points. Saoirse Ronan is so good she has even the smaller nuances of Greta Gerwig's tics nailed down. ,7doxvl
dqiqt4u,"This movie sucks.  The critics f*ed us once again. Any piece of crap movie that has anything to do with theater gets five stared by the critics.  Birdman, Shakespeare in Love, and now this piece of crap film.  Granted Shakespeare in Love was not as bad, I just list it as Blood Diamonds should have been best picture the year it won.   

Anyhow, save your money.  This movie sucks!

Boring, not funny.  I give it 4 out of 10.",7doxvl
dpzewel,A great story of two strong women accidentally verbally damaging each other.  It is very funny and emotionally touching movie.,7doxvl
dpzky2i,This film is spectacular. I loved everything about the cast and more! Definitely recommend!,7doxvl
dpzlg9r,Nice one !,7doxvl
dpzly9j,"Saw it today, couldn't think of any faults, fantastic",7doxvl
dpzolwx,Really wishing it was playing in my area.,7doxvl
dpzq8y4,"Beautiful, beautiful movie. Loved it. 10/10. Gerwig somehow makes you feel an incredible range of emotions so deeply. I cared so much about every character, major and minor. I don't even know how to describe how great it is, but please, please watch it.",7doxvl
dpzqbn3,I saw this earlier this year and it's absolutely amazing. My girlfriend had no idea about it at all except the name and she was blown away. She said it nailed the mother/daughter relationship so well. And as a guy I also felt like it did a such a good job with mothers and their kids despite their gender! So well written! ,7doxvl
dqnax4d,Laurie Metcalf broke my heart in internal affairs (1990),7doxvl
dsd4fxy,I saw Brooklyn couple of days back and saw Lady Bird today. Loved both movies. Saoirse Ronan is so talented! ,7doxvl
dujevt2,[deleted],7doxvl
dpzg1b9,"I’m a big fan of the movie but there is one thing that makes me nervous: Saoirse Ronan is copying Greta Gerwig’s mannerisms. Do we have another Woody Allen on our hands who has an avatar of themselves in every movie they direct? Only time will tell.

Edit: I'm thinking I might be underwater because people are using the downvote as a disagree button. But for the next person who is thinking of downvoting because this ""doesn't contribute to the conversation"": this really was my experience, I'm not joking. I'd rather someone tell my why I'm wrong.",7doxvl
dvsvn0g,The mom was mean. I thought she'd be fun like Laurie Metcalf's Aunt Jackie character on Roseanne. I was disappointed.,7doxvl
dq0wlgq,"Is this better than ""Boyhood""?",7doxvl
dpzeiwf,"Caught it last week, loved it. Felt like a very genuine movie about young adults, not schmaltzy and overly cute like so many Hollywood films. I liked that Gerwig wasn't afraid to make Lady Bird self-centered and an asshole, because that's exactly how teenagers are. Ronan will likely get an Oscar nomination here (don't she'll win against McDormand, though), and I think Metcalf will get nominated and possibly win Supporting Actress, as she was also fantastic.",7doxvl
dq0jp9s,Why do we have to wait 3 months for this in the UK? ,7doxvl
dq53qi3,"Is this better than ""Three Billboards Outside Ebbing, Missouri""? ",7doxvl
dq1af53,So proud Sacramento turns out great art without being filled with vile pedo scum like the Bay Area and Hollywood.,7doxvl
dqi8yip,This movie sucks dick.  I only watched it because I am trying to pork an artsy chick.  ,7doxvl
dqk48um,[deleted],7doxvl
dqhp5yc,[deleted],7doxvl
dqlr1xm,"[She died of alcohol poisoning. The last few minutes of the film and her response to her mom are her letting go and moving on to the afterlife. Look at the clues, you know it to be true.](#spoiler)",7doxvl
dqow5gz,"I was pleasantly surprised for how much I liked it. One of my tests of how much I enjoy a movie is how often, if at all I put my phone away. Yes. I know this is pathetic. My phone died 10 minutes in and I didn’t long for it for a second. 

I’m sure this comment has been made 28 times in this thread, but it was nice seeing realistic conversations in a coming of age story, vs the usual insane ideas that Hollywood has of teenage conversations. I don’t think I was familiar with anyone in the cast, outside of Manchester Jr, and I think much like with The Wire, that made ur incredibly easy for me to just get drawn into this film’s world. Oscar contender for me. ",7doxvl
hs0l9zi,Is it just me or is lady bird kind of super mean? Like she has one friend abs constantly takes small digs at her and is so unsupportive despite her friend always being there for lady bird. She also is kind of rude and manipulative towards her family and her brothers girl friend and guilt trips everyone all the time while never Introspecting on her own actions. I dont know if I’m way off the mark or just sensitive but I just hate seeing people being so unkind to people they consider friends/family… just wish she wasn’t so melodramatic and unkind overall,7doxvl
ieffte1,"I think a lot of people are too hard on the mom. I saw a lot of my grandma in Lady Bird’s mom. She took in my sister and I when she was 50 after our parents died, and she had to deal with the trauma of losing a child in addition to suddenly being a parental figure of a 5 year old and disabled 2 year old. My grandma was hella overprotective of me for the next sixteen years until I went to college. Her brand wasn’t telling me where I could go, but telling me she needed to be at every single event I attended in high school until I put my foot down for senior prom. At the time, we fought a LOT. I didn’t want her around all the time, and she didn’t want to let my mom down raising me. She was so worried I’d get hurt. I lost my grandma this year, and this movie just reminded me how much I fucking miss her. I cried at the happy moments between Lady Bird and her mom. I cried at the sad moments, too. It just feels so truthful. Idk. Love your moms while you can, folks. (Unless your mom is awful, then insert parental figure/role model/mentor in that place.)",7doxvl
dq1dek3,"I want to see this.  It has 100% on Rotten Tomatoes.  But this is when a female writer/director should get work and get praised.  When she is that genuinely talented, not to make up some kind of discriminatory quota.",7doxvl
dqz2z89,[deleted],7doxvl
dq9poba,"And I loved that her mom acted similarly when Lady Bird broke down outside of boyfriend #2's house. They're both strong, loving women who support the same people they aren't particularly happy with when it matters the most. ",7doxvl
dq3y5ie,"Agreed, that hit me hard as well. I didn't expect it, but when it happened it felt so right. ",7doxvl
dqtqvdv,I loved that. It's her first good deed she doesn't feed to her ego. She's not playing up the role of Danny's cool friend who supports him and keeps his secret. She's just being a good friend.,7doxvl
ds4na14,"The way Saoirse Ronan whispered ""I won't tell"" and the way the anger on her face just melts away when she realizes what's happening. Goddamn that scene floored me.",7doxvl
dt78rs1,"I thought the whole film was very good, but that was the scene that really made me tear up. Excellent performance by both actors in that scene. ",7doxvl
duuovz5,In a single moment you (and she) realise that what he's going through and is about to go through is really awful and eclipses what he did to her.,7doxvl
dq15uar,Haha his delivery was great. ,7doxvl
dsks2h6,that was literally why my parents didn't get divorced lmao i had a giggle,7doxvl
dq1nu7i,I watched it with a group of friends and that whole third act had me trembling in tears. It took everything I had in me to stay inaduible so I wouldn't ruin the movie for the rest of the audience.,7doxvl
dsnmqnu,"Yes. I completely lost it at this line. 

Is anyone built happy?",7doxvl
dsg9ha4,Wait when was this said exactly?,7doxvl
drt45b6,favorite line in the film by far,7doxvl
dq2egwb,There’s no way you’re not built happy. ,7doxvl
dqmo5tg,"This is a super late reply because I barely had a chance to see it in my local theater but this is a movie that seems to meander but does so in the right ways to build the narrative it wants to tell.

I can see how a lot of people might not understand it right away and be turned off, but I hope anyone who does so gives it a fair chance because it's fantastic overall.  ",7doxvl
dqoi5vn,"I thought the movie was so funny. I was laughing pretty often, but I went by myself and most of the people in my theatre were older couples so I couldn't tell if I was a psychopath or just that nobody else was getting it.",7doxvl
dpzimdz,"""Yeah I don't really believe in money. I just barter for everything now.""",7doxvl
dq10vko,"I'm in NorCal and his line, ""That's hella tight"" had the entire audience rolling. I'm so glad there was a ""hella"" in the film. Wouldn't be accurate without it.",7doxvl
dpzk0je,As soon as I saw him reading Zinn i started laughing ,7doxvl
drv6c7v,"Haha I was like ""omg I was that guy when I was in high school!""  Except not cool!",7doxvl
dq1dxsc,Definitely felt that,7doxvl
dqkuqph,"Damn, I'm glad someone else got that vibe too. ",7doxvl
dr4wivd,"I was thinking *Napoleon Dynamite* as well.

I also got a slightly *Easy A* vibe, but what I loved even more is the incredible flaws in every character whereas Emma Stone was a perfect student. Obviously these are different movies, but I drew a couple of parallels. 

We need more well-done, coming-of-age, female-lead stories. ",7doxvl
drzf2y4,I got some Rushmore flashbacks too,7doxvl
dqpx9f9,I have been trying to figure out what that vibe was and you described it perfectly,7doxvl
dr4v8af,Much better than Napoleon Dynamite. I've never been able to sit through all of that movie . ,7doxvl
dr6fuik,"Wow, I said this exact thing to my friend after watching the movie!",7doxvl
dsk9hwf,It’s that ultra-realism you get with mumblecore with a dash of tweet for Lady Bird’s quirkiness.,7doxvl
dqcksm7,"> I love that we are now getting at a point where we can have early 2000s period pieces.

And this is how you know you're old.",7doxvl
dqvqfnd,I fucking lost it when it cut to them listening to DMB. So funny,7doxvl
drv98cu,"And call me crazy, but I feel like so little has changed since 2002.  Don't get me wrong, I am sure things have, but to me it feels like if someone fell asleep in a coma in 2002 and woke up today they would be able to get right back into the swing of things.",7doxvl
dqcj2gr,"The crying scene was what really solidified for me that Greta Gerwig has a real visual talent for directing. Most first time directors would have shot coverage to death on that, and almost ALL first time directors who were previously actors would punch in for the emotional close-ups, but choosing to stay in the medium/wide shot the way she did was a fantastic choice. She never let the audience get comfortable by editing into the scene, she just holds back and lets us experience it all at once, in real time. Heartbreaking, raw, touching, and most importantly, simple.

There was lots of little visual stuff all through the movie that makes me excited for her future as a filmmaker.",7doxvl
dq4p2xg,"> The scene with Lucas Hedges crying into Ronan was the best highlight for me

This is the first scene that made me cry. And it was crazy cause I was literally laughing with no hint of it seconds earlier and I went from 0-60 in no time.

This was a remarkable movie.",7doxvl
dq98jys,"I TOTALLY started crying when they were in the alley and Lucas was sobbing. Oh my gosh that was the saddest part for me, and it kept GOING which I almost appreciated because I've noticed, in recent films, they cut the emotional scene short. Glad they let us feel it out.",7doxvl
dq03ff4,[deleted],7doxvl
drv21c7,you say most laughs. just curious what other movies you've seen this year?,7doxvl
dqbmb13,"That moment was the one that got me the most, as well.  When I was in high school, I could never understand how two mutual friends of mine remained friends after a similar thing happened. I couldn't figure out how the woman in the relationship got over that situation.  It just never clicked that my male friend needed support in such a difficult time in his life and she was willing to look past the heartbreak and be there for him.  13 years later a movie I'm seeing when I'm 30 finally helps me get it.  I almost started crying right there. ",7doxvl
dqiurqo,Easily the most powerful moment in the movie for me. ,7doxvl
dqckrqq,"She did co-direct Nights and Weekends... though very, very different films.",7doxvl
dqlbx4y,Exactly. One of the best debuts I’ve ever seen. It was incredibly touching. ,7doxvl
dqatw3r,"He was so funny. The line about bartering made me laugh so hard.

Also ""I think what you do is very baller. It's very anarchist.""",7doxvl
dqb0qad,"It's funny, I'm from northern California so that line just seemed like throwaway dialogue to me. ",7doxvl
dqzwps1,I abused the shit out of that in 2002. I am so sorry.,7doxvl
dpzlz3u,I was so happy when the Sister wasn't mad about her vandalizing her car. I thought for sure we were going to a cliche one small mistake ruins her life angle but they just laughed it off.,7doxvl
dq9bcbm,"> no difference between love and paying attention

Man, that line cut me *bitterly*.",7doxvl
dqaq89e,[Lucas Hedges](http://d2fz9dc0ngozcr.cloudfront.net/images/zoolander-paris-fashion-1.jpg),7doxvl
dqol59t,Him and Caleb Landry Jones have been in a lot of movies in the past year it feels like,7doxvl
dqsc4t3,"Just to be somewhat contrarian:

While j thought he was remarkable in Lady Bird, and brilliant in Manchester, I dont think his performance in Three Billboards was at the same level. He certainly wasn't bad, but it wasn't remarkable in the same way those other two roles were.

(Which isn't to take away from his performance in Three Billboards, or from his growing and dazzling resume.)",7doxvl
dq8nby2,One hell of a resume so far,7doxvl
dr4vax9,I watched Lady Bird yesterday and 3 billboards this past Friday. He really is on a roll with his roles.,7doxvl
ibeu2re,He was great in Waves and Mid90s too. He fits the A24 vibe so well,7doxvl
dr4m10m,Ya the film was so starkly real throughout it'd be weird to suddenly have a hokey moment like that,7doxvl
dq5tup3,"It'll definitely continue to get a wider release as awards season picks up. But I think this film is a lock for Original Screenplay, at the very least. ",7doxvl
dsjrjbb,"I'm a guy and I still related to my relationship with my mother. I resonated with the disconnect they both had, how they couldn't quite communicate their feelings without being stubborn. I also related to having a disagreement with my mom, and her thinking I'm ungrateful because of it, and suddenly I both feel guilty that she feels that way but upset that she throws her sacrifices in my face over an unrelated issue. Christine's mom didn't know how to healthily communicate her feelings, so she resorted to writing a letter that she didn't even end up sending. But the final scene shows that they've evolved in their communication of their love to each other. ",7doxvl
duxwxrs,"As a brother with a younger sister, the mother-daughter fights seemed painfully realistic.",7doxvl
dpzh9xt,"If this wins all the awards, I would be very happy. Definitely deserves nominations for Best Actress and Best Director. I think it could lose either one to Three Billboards.
",7doxvl
dpzypwu,"I like Gerwig but I never really got the hype until this. Frances Ha is not made for me, the whole time I thought ""get your shit together"" but Lady Bird was phenomenal. Absolutely loved this movie. ",7doxvl
dq3e1gw,"not her directing debut. solo, yeah. ",7doxvl
dqp105d,Just curious what would some of your others be for this past year,7doxvl
dqr0oya,"It is,  I went to a 3pm showing yesterday and the theater was sold out.  The employees there said that showings were surprisingly full.  ",7doxvl
dqfbdig,"I'm not a girl so maybe I'm not intended as its target audience, but I did relate to it in that it did remind me of my own relationship with my parents, and certainly my sister's. But I also saw it with a girl who's right in the target demo and she seemed to absolutely hate it, which I found odd considering how universally praised it's been.

Overall I feel like I fall more into #2. It's a solid movie with stellar performances, performances that lift it passed the mediocrity of the script and directing. I have some pretty big pacing and writing problems with it, especially in the last act of the movie where, at one point, they seemingly drop every single subplot and rush through Lady Bird going off to college and having her first New York experience. 

It's a relatable, fun movie but I don't see why it's getting so much high praise compared to, for example, The Big Sick (which is getting high praise in its own right but like isn't breaking RT records despite being more original and just as relatable to certain crowds)",7doxvl
dqhpd1g,"I didn't really relate to it but I thought it was very good. The best parts of it in my opinions were the callbacks, which we might think of as unnecessary but really build the world of the story. Like when the play director cries first, it's a comedic moment (at least in my theatre people laughed), but then they show him later really suffering. That is some of the best movie-making I have ever seen.

Also the callback with the water and the bathtub - that's something I definitely can't relate to, but I always enjoy a good callback.",7doxvl
dv99yc8,"I didn't view it as nearly as negative as you, but I would still say I related strongly to it. I just don't see it as being an upsetting and triggering movie as much as a real and hopeful one.",7doxvl
dpzmifu,Tracy Letts is said to be one of the nicest and sweetest actor and playwright in Broadway.,7doxvl
