comment_id,comment_body,submission_id
dq3561k,Don't think it matters if it isn't released properly as long as it's been premiered (was at LFF). Was the same this year with Moonlight as it didn't release until near the end of February ,7doxvl
dqit0a3,more like her bone mate.  I gave her my special sauce.  ,7doxvl
duuqjhs,liberal girls are super easy,7doxvl
dqk8eh0,[deleted],7doxvl
dqpbnfm,You are correct in that I shouldn’t. I acknowledge this is a problem. I also only do it when I’m the only person in the theater. And I usually pick out 1030-11 (am or pm) showings because I enjoy having the theater to myself. ,7doxvl
ds7qdra,I thought it was pretty aggressive myself. I tend to be the only person in the theater. I’m not bothering anyone. ,7doxvl
dq1ss9a,"> Which critics have to give good reviews to female lead films - and what happens to them if they don't?
> Can you give examples of which films qualified for false reviews and also can you tell us how you know about this.

Yes I'll spend the rest of my weekend research this all for you and putting together a comprehensive list.",7doxvl
dxohi5y,It's not my fault you are not perceptive.,7doxvl
dqz4pbc,[deleted],7doxvl
dr8hjht,Was that what was going on there. Didn't really understand what his problem was or why that scene was brought up. It was never really touched upon later. It seemed a bit tangential at that point. ,7doxvl
dsb66ii,"A parallel of the mother comforting her daughter just as Lady Bird comforted Danny. Also referenced in the final scene of Lady Bird driving and then her mother driving on the streets in Sacramento. These both symbolize how similar they are to each other, truly mother and daughter.",7doxvl
dqph9a1,Loved his role in The Big Short.,7doxvl
du72oe7,"Just wanted to comment the exact same thing you did, and again, a month after you left your comment! pretty neat.

That line hit me hard. Pretty sure I'll have to rewatch this movie because I feel like there were so many more hidden pearls that I wasn't paying close attention to that probably will make the experience so much better. ",7doxvl
dszj09u,"My theater literally flooded from all the tears and mucus coming out of my body. I'm not even joking, they did an emergency evacuation and it was in the news.",7doxvl
hm0n3tg,"happiness is linked to genetics, ur dna can tell if u are more predisposed to happiness",7doxvl
dsnlnya,"I just watched it, and to me it seemed to show that she was out of place. The drinking was just to get her into the hospital, where she saw the kid with the eyepatch. Seeing him showed her that she didn’t belong in that hospital, which was a parallel showing that she didn’t belong in New York, she belonged back in Sacramento. Just my two cents. ",7doxvl
dsjq55y,"I felt the party scene at the end was to show how absurd NY life could be as well, it wasn’t the dream life she was expecting.

So in the end she realizes how much she actually had at home in Sacramento. ",7doxvl
dsggddg,"He's the one charachter that I couldn't empathize, but still found him totally believable. I also just saw Call Me By Your Name two days ago and he plays a much more grounded, realistic personality. It's awesome how different he is in both movies",7doxvl
dq4ozph,We were saying hella in middle school back at the turn of the century. It's in our blood.,7doxvl
dqcal79,"Born in 86 I’ve been saying hella tight since elementary school. (Not trying to sound cool,  but I remember my older cousin always saying it, and copying him.)",7doxvl
dq9sgi1,The song Hella Good by No Doubt was released in 2001 so yeah it was in use a year later for sure. ,7doxvl
dqci3mz,I'm the exact age as the characters in the movie and can confirm with a resounding HELLLAAAAAAA,7doxvl
dq9b7pa,I knew a Californian girl who was saying it regularly around 2004 at the latest (and long after that). So I can confirm it is at least that old.,7doxvl
dqr0k98,"It was,  I graduated in 2002.  ",7doxvl
dsk9g0z,"Yes, I’m 24 and from the Bay Area and I grew up on “hella”.",7doxvl
dtccna8,Yes,7doxvl
dscv61q,"Back in two thousand ought oh three, I lived in a small city about an hour or so north of Sacramento and there was a young lady from Oakland who worked in the back office of where I worked and she used hella all the time, so it wouldn't surprise me if a 'cultured' Sacramentoan teen used hella regularly back in late 2002, early 2003.",7doxvl
dv8xb7f,Was in high school in 2002. We said hella.,7doxvl
dr1s518,"The people's history of the United States is an entry level ""this is what REALLY happened"" history book, one of those you'd get from a teacher that wasn't quite on board with the schools sugar coated curriculum but didn't want to go fully away from it. It's a book choice that fits in really well with the character of Kyle, sort of an ""of course he'd read that"" moment",7doxvl
dvsq9lt,It might be but it doesn't feel that way. I was 7 in 2002 and 1987 felt as long ago or as different of a time as it does now. ,7doxvl
dsb67vf,And vice versa.,7doxvl
dvtx1dz,"I just saw it for the first time tonight. That scene had a strong resemblance to the scene in *Three Billboards* where Woody and Frances are having a tense conversation and then he coughs on her. Both were very powerful scenes, in a very similar way.",7doxvl
dsmq13c,You almost believe him when he says it so casually.,7doxvl
dqlr9zh,[deleted],7doxvl
dq0d6w9,#whodrewthedicks,7doxvl
dtclu4m,"That what I felt about the abortion joke scene. I mean, she got punished, but I thought it was going to lead to not getting into college.",7doxvl
drz00b6,"For me, it was because it sort of parallels the love we get from our parents, which does not strike us at first as being obviously love??

",7doxvl
drnxq47,"I was thinking the same thing. I wish I knew the exact quote. My recollection:

“It seems from your writing that you really love Sacramento.”


“I guess I was just paying attention.”


“Wouldn’t you say that maybe they’re the same thing? Love and attention?”",7doxvl
dpzqzd8,I think this movie is better than Brooklyn. Saoirse really leveled up in this movie. ,7doxvl
dpzl0cm,ronan was easily better than mcdormand honestly,7doxvl
dqcouvh,Her performance is one of the most raved performances of the year.,7doxvl
dqurylw,"The Big Sick is relatable to anyone with pushy parents, or frankly anyone who has experienced a relationship (male or female). But it's especially relatable to people with pushy immigrant parents, even if they're not Pakistani like Kumail's family is. I don't really think that there's any male or female slant since Kumail wrote it with his wife, even though it's from the male perspective it's pretty gender neutral in terms of storytelling. It would be pretty easy to gender swap the roles if they wanted to. 

Not really sure why you're passive-aggressively trying to lump me in as the ""average reddit male"", Lady Bird was clearly written from a female perspective. It's a very narrow slice of life movie about a very specific kind of person growing up in a particular time in American history, and as a period piece (weird to say about a movie set in like 2002 but nevertheless...) it makes specific references to people growing up in that era. It's a movie about what it was like for Greta Gerwig to grow up in a post-9/11 Sacramento Catholic school. Don't get me wrong, it portrays that topic very well, thanks in large part to its performances, I just don't know if what the characters are going through is meant to speak to me personally outside of the more general ""parents just don't understand"" kind of thing.

Like, the scene near the end of The Big Sick where [Kumail is leaving for New York and has a moment with his dad, but his mom won't come out of the car because she's still super mad at him](#spoiler) hit me really hard, man. That was a perfect representation of what it feels like to have immigrant parents and how they react to their kids dropping the traditions they tried bringing over to North America. And while it's a moment between ['Twas the butlerfather and son](#spoiler), I don't think you need to be a [son of a father](#spoiler) to relate to it, because it also reminded me of shit my sister's gone through with my parents too, and [I've been in similar situations like that where the parental roles have been reversed and it's my dad's that's pissed and my mom consoling me](#spoiler). So I really don't think it's a gender thing.

Whereas in Lady Bird, it's very much about a daughter's relationship with her parents. The closest I came to relating to that movie is seeing basically exact conversations I've witnessed my sister have with my parents, and I know for a fact that it's really not the same thing for boys. Greta is unabashed about it being about her experience as a woman, and from a narrative perspective it's one of the film's strengths, because it's uncompromising, and I don't necessarily need to relate to the characters too much to see that, but for me it just takes it down from like the 9/9.5 that it seems to be for a lot of people to like an 8, because it's like I'm looking at it from the other side of a window, peering into this house, and it makes me feel more detached from the story than I probably could have been. 

Does that make more sense?",7doxvl
dq0phr9,I tweeted her asking her to tell Tracy I loved his performance and she liked my tweet!,7doxvl
dq9bfur,"> Carrie Coon

I feel like that woman can more than handle herself.

EDIT: She's faced off against Russian mobsters, been through the portal to Hell and back, and murdered Virginia Woolf.
",7doxvl
dq4m0k9,"oklahoma is his first i think, but i get what you're saying",7doxvl
dq2lkrg,"Bro, that hospital scene... onions bro, onions",7doxvl
dq1anas,2.5M,7doxvl
dqrm5uy,Just be glad it's not Bakersfield or Fresno. But yeah. I'm usually in Sacramento once or twice a year and after growing up in the Midwest I agree. The biggest difference is being only about two hours away from SF. Most of the Midwest isn't even remotely close to someplace decent.,7doxvl
dsb47p8,"As in she is constantly on the move to provide for her family, much as a Mother Bird would provide for her Lady Bird?",7doxvl
dqjhgvr,"No, it was all flashbacks of Lady Bird (and her mom) driving in and reminiscing about Sacramento",7doxvl
dt1p1f0,"The problem is that they can connect, and they do until the mother makes her decision the important on even when the situation is ladybird.

Daughter graduated, ""you did something wrong"".. like, why say anything negative 

And she is the only one she does that to.. which makes it totes more crazy.",7doxvl
dslwv42,"I'm not even that much older than the whole ""coming of age"" period that people go through.  even though I agree that they sometime are over exaggerated I feel like it's an accurate representation of how someone who is at that age might feel. I remember being 17 and trying to decide on a college, thinking that it was really life or death and could control the entire course of the future. I also remember being in that first relationship all the emotions that come with it. Feeling all of that for the first time. Looking back at that time period in my life I think that everything felt much more important than it is now.",7doxvl
ds3oh27,"> Lady Bird did a pretty good job of making the experience seem almost realistic

The sex scene perfectly encapsulates this for me. It’s not some steamy, drawn-out, 5 minute-long fuck fest. It was 5 seconds and then she has a nosebleed right after – nothing sexy about that. The entire film just felt very authentic to me in every way. ",7doxvl
durc692,"agree, high school is the best, i totally regret that i didn't appreciate it enough back then.",7doxvl
druijzo,"I maybe wouldn't use the word ""fetishize"", because that makes it seem so negative, but I get what he means. There were certainly hardships shown in the movie, but it also showed the experiences of having a lifelong best friend, young love and it's associated awkwardness, and the excitement of feeling like you're about to move forward into the best part of your life where anything is possible.

For a lot of people watching it, they miss those experiences, or maybe they never experienced those things in the first place in high school. So there's a strong sense of nostalgia and/or regret.",7doxvl
drimpax,"So her mom is like your mom.

Going into debt but guilting and shaming you for it?  
Trying to literally stop you from going to college by not filling out the school paper work, discouraging you from applying, and then when you are accepted to a college... Your mom doesn't talk to you for months and you have to apologize.

A parent who can't parent, even though she could to her son. A woman that can't say anything nice, even though she is show to do so to literally everyone else .

",7doxvl
dsd8399,"Comforting her after she lost her virginity... you mean the scene where the female teenager is yelled at for shutting the bathroom door during a shower, then a parent comes into the bathroom with their nearly naked adult child?

Do you know why the first scene is like that? why ladybird LITERALLY throws herself from the car? she has no control. this child has no control in what happens in their life, they don't even get to control someone busting into their room.  This mother then BLAMES the child for the parent's own actions.

ok, here is something fun. What bad things does lady bird do?   

",7doxvl
dt1ow52,"Ding ding ding.

Yes, there are and should be allowances for the mother's behavior. But that negative behaviors are there..but only seemingly towards her bit strange but average daughter.",7doxvl
dqzwdwq,I wish I could love my future wife and kids even half as much as he does. The scene where he congratulates his son left me speechless. This father was full of love even when he was struggling.,7doxvl
dtv91rv,I loved him swallowing his pride while also showing it in his son and  wishing him luck at the job interview that they both were applying for,7doxvl
dpzpt8r,Armond White HATES Noah Baumbach. He once said his mother should have aborted him. They have a longstanding feud.,7doxvl
dpzubrs,"Poor examples.  Seven percent of critics gave *Meyerowitz Stories* a bad review (which is not a lot, but it is also far from being the lone dissenting voice for *Toy Story 3* or something), and *Tom of Finland* has a **54** on Metacritic.",7doxvl
dpzt1w8,"It's not a movie I could ever re-create myself. It's a masterclass in writing, directing, and editing. Really from a truly creative mind. ",7doxvl
dq0rqj9,"The fantasy part doesn't really play a large role in the film, so I doubt you'd be bothered by it. It's just a beautifully made movie about the kind of subjects you'd never really stop to think about otherwise.",7doxvl
dq4oxi4,"Minority opinion (which I'll freely admit may or may not be rational): I did not think Beasts of the Southern Wild was a good movie. I felt like the film fetishised slum life and poverty in a way to make it seem like it was a good thing. I went in with high expectations and was kind of taken aback at the perspective of the film.

I did happen to have just returned from a third world country and witnessed *a lot* of truly awful poverty, and seeing a movie almost celebrate it struck me as gross.

That being said, I know it's a view held by few, so I've been hoping for an opportunity to see it again and see if maybe I jumped to conclusions.",7doxvl
dq10eq2,"Gosh it’s been such a long time since I’ve seen Beasts, but it has remained a top favorite since. It’s wonderful and touching and it makes my brain tingle with happiness. Would recommend to nearly anyone. ",7doxvl
dpzny61,"not really, there are plenty of bad/mediocre movies with good rt scores",7doxvl
dqlc85x,"I actually don’t think this is what OP of this comment is talking about at all. To me, all of that seemed obvious. There were a few things that were a bit more subtle, if you ask me. 

For me, Gerwig set up a few things that were there for the audience to decide. Her criticizing Miguel for his piercings and then him not having the piercings didn’t scream subtle, in my opinion.  

Maybe /u/MarcusHalberstram88 can clear up what he or she means? ",7doxvl
dsb8iho,"> all the little details that clue you in on Danny being gay - Wanting to go to France, curling hair, loving theater, etc

And, you know, not touching her boobs...  Hahaha.",7doxvl
dqug1g7,You really don't have any idea what foreshadowing is do you? These irrelevant details are not anything what OP was asking for. ,7doxvl
dqdy0nv,"Couldn’t agree more about the non traditional editing. There were so many moments like him being gay that I thought would dominate the next part of the movie, but then it just kept moving on. ",7doxvl
dsgh2xz,"True. It's such an honest film, it's not meant to blow your mind. It's meant to make you feel and relate. It's all just so incredibly genuine. All the characters, all their interaction, are so authentic it's impossible not to empathize and relate with them. This is one of those movies where the characters are fully realized. They all feel like real honest-to-god people and it's because the film itself treats every character with respect. I don't agree with the mom in a lot of things, but I absolutely empathized with her. I saw my own mother in her, and I completely felt and understood the underlying love between lady bird and her mom despite all the bickering and mean shit they said
",7doxvl
dqsgof2,but he hasn't lied in 2 years,7doxvl
dughvqb,And a 2 pump chump to boot,7doxvl
drl9615,"I think it resonated with me because my last bf would say it to me all the time and I always hated when he said it. However, as I look back, I see that I didn’t give him my attention like I should have. He felt very unloved. ",7doxvl
dqsa83b,"FYI: I think the word you're going for is ""clique"", not cliche. ",7doxvl
dq9pxdo,I felt that way about Get Out. Just keep trying to have an open mind about the ones you dislike and you'll be doing better than most. ,7doxvl
dq7mrl7,That sounds wonderful and fluffy.  In what way was it poignant for you?,7doxvl
dr0kn7x,"Here take a look;

https://www.youtube.com/watch?v=0ya73UP7NZU

",7doxvl
dt2d3x6,Yeah. It's polarizing. I dug it but understand why others may not have. ,7doxvl
dsb7npl,"Symbolic of leaving her home of Sacramento and comforting ""self-""given name of ""Lady Bird"" behind, much as a young bird will fly and leave its nest home behind, just as this occurs while Christine is now in New York City.",7doxvl
dqb65s1,"> Like I’ve never met anyone who lies for no reason about where she lives

Seriously? Poor kids at private schools are in situations like that constantly. I 100% knew kids who would be dodgy about saying exactly where they lived, or get dropped off a block away so the rich kids didn't see their parent's shitty car. I guess you can knock it for whatever you don't like, but that part is undeniably a thing that happens. ",7doxvl
dq07d5a,¯\\\_(ツ)_/¯ ,7doxvl
drv2mm4,"i enjoyed this movie, but all your points are true and also the reasons i was meh about this movie.  it really seems like you have to 1. been around private school or 2. been from smallish town to know the nuances.

",7doxvl
dv4i6ze,A kid at my elementary school came over to my house one day and my mom ended up driving him home.  He directed her to drop him off at the biggest house in town.  I remember watching him slowly walk through the front yard as we drove away and then turn around and run across the street somewhere else.  He also told me he was a werewolf.,7doxvl
dq1604r,"Oh yeah I definitely get where you're coming from. I *did* think it was that good but coming-of-age stories are a little hard. If you don't connect with the main character then some aspects can fall a little flat. 

I felt that way about Boyhood.",7doxvl
dq03w3b,[deleted],7doxvl
dq07u3z,That happens a lot with reddit. And in most cases nothing lives up to the hype.,7doxvl
dq61tlw,"Yes, I feel like with internet there is a tendency of hype. Same for Arrival. Everyone says it's very good but I find it rather blend and predictable.",7doxvl
dq0ebvh,[deleted],7doxvl
dq0nsrz,[deleted],7doxvl
dsdzeka,"It's hard when you are 90 minutes away from arguably the best city in the world. We've got a little sister complex...
Everyone refers to Sacramento as ""downtown"".",7doxvl
dqapkam,"It's possible that the ending would have felt  a little too perfect if it ended at her departure. It's just a weird feeling when your internal clock and experience with movies tells you that the plot is likely wrapping up only to find yourself in a new situation. The movie uses the final New York scenes to good effect, it's just a little disorienting and left me aware of the real passage of time within the theater.

Also, I found those final Sacramento scenes ridiculously difficult to watch with dry eyes, which is *not* a common problem for me and I may have just been overwhelmed past the point of enjoying the promise of more story. I was seriously ready to tap out lol",7doxvl
dr2ws27," The using guilt to manipulate, and control is a clear red flag of abuse. That shit is textbook emotional abuse.",7doxvl
drrz21n,"She seemed very loving, caring and involved in her daughters life, dunno what's your benchmark is, guess your mothers were better than mine if you think that was very manipulative and not warmth or caring. 

the lack of boundaries and wanting to make a drama of everything is what i noticed more. ",7doxvl
dq9prmy,"Thanks for reading that note for me, because  I honestly had to look away to minimize the tears that were forming as she held those crumpled pages. ",7doxvl
dqbmjho,"Thank you. I was going to wait until it came out on video to pause and read that letter if I had to. In the theater all I could see was Miguel's name, but I knew the answer was right there.

I really appreciated that the film just let it be and didn't find the need to over-explain it. It was obvious he was either adopted or from a previous marriage.  I am very eager to go back and read those letters when given the opportunity. ",7doxvl
dqmr7gx,"Then do you think Ladybird was lying about going to Brazil when she was younger? They must of adopted Miguel before she realized she was having a baby? Just curious. That would be funny if she was bragging about going to Brazil because she wanted to seem cool. Plus she did say she only remembers it because of the pictures. 
Or she was born in Brazil? I don't know...",7doxvl
dvisku1,"I mean, it wasn't transformers but they still used classic archetypes.",7doxvl
dqbr7b2,Blade Runner was visually stunning but the story was lacking.  It was very uninteresting and just flat out long winded.  The acting was average at best.  It was basically style over substance.  At least Lady Bird had a story worth following.,7doxvl
dqkmr3q,"Ha, I do the same with movies. But, I gave this an 8.5/10!",7doxvl
dr4mi9z,"She's also finally.away from home so this also is her first ""I'm really out of there, on my own"" moment",7doxvl
dslzikj,"Not everything ""resolves itself"" in real life, which made these parts feel pretty authentic imo. I don't think real life plays out like a dramatized movie, which made this one's relatively undramatic coverage of ""standard"" events feel fresh and kind of deadpan in a way",7doxvl
dso2erc,"In life, not everything is resolved in a time period. What more did you want? Her dad saying ""I've defeated my depression!""?? Keep in mind, this movie is mostly all from Lady Bird's perspective.",7doxvl
dtrrpno,"Just picking one example but the teacher's notebook thing wasn't a subplot really, it was a bit of character building.",7doxvl
dsm8dfw,"Exactly i was extremely disappointed in this movie

Yeh it tugged on your strings a bit here and there but the whole relationship with her mother was done completely wrong

There didnt need to be a follow thru so to speak but come on. Her mom and Ladybird really were the focus throughout most of the story and all we get is a mom crying in the airport and a thankyou call from her cell phone?

Honestly at the end i was expecting her to drive back into Sacramento and back home where she felt she belonged

Straight up someone said it, a less funnier, more depressing, Napoleon Dynamite with a shit ending

Maybe others liked it and i can see some merit to it but still the ending and just the last 1/3 of the movie left a bad taste in my mouth

99% on rotten tomatoes GIVE ME A FUCKING BREAK

99? thats like the pinnacle of a rating, go take a look at what movies received 99....i dont watch movies by the rotten scores but this is just mind boggling to me

Was it the director, the actresses, the studio? How in the FUCK did this movie get a 99%?
",7doxvl
duuora3,"yep, definitely meant protagonist!",7doxvl
dwwj1jg,"Hehe thank you, that honestly made me laugh out loud and brightened up my day! :D",7doxvl
dqlekbx,"Merrily We Roll Along

https://en.wikipedia.org/wiki/Merrily_We_Roll_Along_(musical)",7doxvl
dtqhe0y,"i did that when i was 16-17. back then i used to make new year resolutions regarding it; you know when people promise they would go on diets or give up smoking? well i promised myself to give up being gay. went out with a friend whose company i enjoyed and had my first kiss with her. ghosted her that night for a month because i was pissed at myself for not feeling anything. casually texted her a hello later and all i got was ""what the fuck is this text supposed to mean?"". it was then that i understood that i shouldn't toy with people just because i cannot get over myself and resolved to staying single until i could live my sexuality as i please.

life is tough what can i say.",7doxvl
