comment_id,comment_body,submission_id
dsxyhkm,"I'll be honest, I'm not sure where I stand on this film but I'm leaning towards disappointment.

I've seen a number of LGBT films, it's a genre I'm trying to dive into more and more each year, and this is the first LGBT film I've seen that hasn't relied on angst and drama to push its story forward. Which is great, it's about time that gay romances are allowed to have something light and easy, but at the same time without any drama the film was just sort of there, being all light and pretty and honestly rather dull.

I had the same problem with Guadagnino's last film, A Bigger Splash, it felt like something was suppose to happen but instead he made a very pretty but very hollow experience. Call Me By Your Name isn't as hollow, thanks mainly to Chalamet who has already mastered the art of subtle emotions, but without a central drama all I got was a by-the-numbers love story.

I guess that's equality in a way, romance can be dull regardless of orientation. I still recommend it, but the Awards talks are lost on me.",7rfed5
dtapw0z,I feel this is Kevin Spacey's favourite movie. ,7rfed5
dt26wnb,"This movie should have been called: Swimming, Biking, and Gay Sex",7rfed5
dsy7fe9,"This movie fucking blew my mind. I saw it weeks ago and I literally can't get it off my mind. That scene when Elio watches Oliver dance made me realize this movie is like no other. Intimate, raw, beautiful.. CMBYN easily became one of my favorite movies of all time, not just 2017. I was so skeptical I started watching it online out of boredom, but then a fourth of the way in, I felt like I needed to watch this beautiful movie on the big screen. Luca did such a great job at capturing at Italy and how beautiful it is, as well as this relationship. I saw some folks think it was just a summer fling.. For those that have been in love, or had something close to it, this just makes you reminisce and miss that. It made me so nostalgic. Timothee was so charming and real, I loved it. I already got the vinyl and poster, and rewatched the movie so many times. It was one of the last movies I saw to dust off 2017 ... along with The Florida Project, Three Billboards in Ebbing, Missouri, Phantom Thread, Lady Bird, The Shape of Water.. all great stuff but CMBYN just lingers with me. I can't stop thinking about the movie. Don't let the seemingly cliche, dull plot fool you, or Timothee's age.",7rfed5
dsye3o7,this movie was a 6 at best. ,7rfed5
dsyh0gv,All I have to say is....I can’t wait to see this movie again good heavens. ,7rfed5
dsyw3t2,By far one of the best films of 2017. Strikingly beautiful and utterly heart-wrenching.,7rfed5
dsyztc5,So in Stuhlbarg’s monologue was he implying that he too had had a love affair with a man or just that he had true love once upon a time and lost it?,7rfed5
dsz8d2h,"wow, this was SUCH a good-looking, visually rich movie. took this digital disciple to film church.",7rfed5
dszjorq,"This FINALLY opened here on Thursday and I’ve already seen it twice, likely with more to follow.

This film has devastated me in the best and worst of ways and, after my second viewing, has become my favorite film of 2017. Timothée Chalamet deserves all of the praise he’s received and though Oldman is the one to beat, I would be thrilled to see him take home Best Actor.

As much as I loved this, it was not a perfect film and having just finished the novel, there are many, many small omissions I wish hadn’t been lost in translation and that the intimate scenes between Elio and Oliver didn’t feel as sanitized as they did; I didn’t need explicit, ‘9 Songs’- or ‘Love’-style sex scenes, but they came across as much more tame than I felt the film (and audience) deserved, especially after an hour-plus of build up. Still, for the most part, I am rather pleased with the way it was adapted.

Unlikely though it may be, I would love for this to receive a 4K release. I plan to revisit this as often as my heart can bear it.",7rfed5
dt1wlli,"Best Actor is more than likely going to go to Oldman or Day Lewis, but I wouldn't consider a win for Timothee an upset by any margin.

I loved the juxtaposition between Elio's ahead of his time maturity to his typical teenage heartbreak, it was thoroughly honest and devoid of cliche. 

This movie didn't awe or inspire but it smashed its depiction of love lost out of the park. ",7rfed5
dt23uim,"Goddamn, this movie is just so good. ",7rfed5
dtd7ban,"Probably an unpopular opinion, but as a gay dude watching this movie, I really feel it allowed me to empathise with the characters a lot, namely Elio. I had a similar experience, but that's neither here nor there

I had a bit of an alternate character interpretation of Oliver. I spent a lot of the beginning of the movie seeing things from Elio's perspective and being infatuated by Oliver and rooting for the romance. I found myself wishing that a good-looking friend of my father's had moved in when I was 17 and my hormones were going wild all the time, that would have been heaven. As the movie went on, however, I started to remember how immature I truly was at 17 and it changed my perspective on things. I don't see this as a tragic love story, though I do empathize with Elio and the heartbreak he feels at the end after Oliver gets done using him for his own pleasure, but to me, this is a man clearly taking advantage of an immature young adult who is still struggling to come to terms with his own sexuality. I think Oliver kind of realized that at points and so pulled away, which redeems him somewhat, but I still didn't find myself rooting for them to end up together anymore after probably the halfway point. 

Sidenote, Also felt really bad for Marzia. She got screwed over more than almost anybody. Haha. 

I also know that the age of consent is different in Italy, but going strictly off of what I know from interacting with 17 year olds and remembering what I do about myself at that age, I feel Oliver took advantage of Elio at some points. ",7rfed5
dv42ap5,"So if this was a ~30 year old Armie Hammer and a high school girl, we all still love this movie just as much right?

I'm being snarky, but honestly their age dynamic kind of weirded me out throughout the movie. I realize the character is supposed to be like 24ish and Hammer is only 29, but just the maturity, build, look, presence, etc of Hammer he might as well have been 30-35 in the movie, especially contrasting with Chalamet who was clearly like a high school age boy. And the way the parents were just kind of like ""oh look how cute they are, y'all are sweet, you're prolly gonna fuck my high school son tonight, maybe you guys should take a trip together..."" It just kind of made me uncomfortable. If it had been a more ""college looking"" kid I don't think that dynamic would have been as stark.

For example, go read the Good Time thread and plenty of people were grossed out by Pattisons character kissing a 16 year old girl in that movie. It's just interesting to me the different reaction.

All that said, Chalamet was excellent, that kid can act. Tons of subtlety and under the surface emotions you could feel. Pretty great. The setting was awesome too, makes me want to spend my summer in Italy and eat apricots and swim and read all day and ride my bike. The movie wasn't my favorite. I can't give it the same praise it gets around here although I thought it was good. Just kind of dragged in the middle for me. Beginning was interesting, ending was excellent, but when the hooking up was happening it got kind of boring for me. Like nothing really happened, just scene after scene of flirting and hooking up, I don't k is I guess I just wanted something to happen.",7rfed5
dteamxl,Easily the most overrated film of the year. The acting was meh. Story was average. Switch the story from homosexual to hetero and this film goes unnoticed. Also I couldn't take the end serious with Elio looking like he came from a Flock of Seagulls shoot.,7rfed5
dsz65l0,"Beautiful movie, was never bored for a second. And that final scene... God damn the acting. 9/10",7rfed5
dsxf7ex,"So, I absolutely loved this movie (had a longer post about it [here](https://www.reddit.com/r/movies/comments/7rfed5/official_discussion_call_me_by_your_name_spoilers/dswk6a7/)), so PLEASE don't interpret this as me being a hater, but I have to ask you guys this question:

How do you guys deal with the fact that, despite everything, this movie depicts a relationship that, at least we here in many parts of the US, consider to be illegal? 

I understand that Elio is particularly precocious and mature; that he is the one who pursues Oliver; that his parents know and approve of the relationship; that he is at no point coerced into sex; that the age of consent in Italy is lower. 

But from an American legal perspective, this relationship is still illegal.

How do we square this with how beautiful the film is? I have to admit, it's the biggest issue I have with the movie.",7rfed5
dte09hg,"Elio is 17, and Oliver is much older than this. Am I the only one slightly creeped out by this?",7rfed5
dtlvzql,"Am I the only one that was pretty creeped out by the age gap and resulting power dynamic?  I’m worried that people will call me a homophobe (or bi-phobe?) by saying that, but the genders honestly have nothing to do with it.  I was thinking I could just look past the age gap and see the beauty of the relationship, which I did for the most part, but Oliver clearly relished in the dominant role and that just made me uncomfortable considering that Elio was still fairly immature.",7rfed5
dsyo0qf,"Chalamet carried the film. Hammer didn’t really cut it to me other than looking good tbh. 

",7rfed5
dtcs60d,"Wow. Really disappointed by this one. After all the hype and praise I thought it really really sucked and was super pretentious.

The pacing was painfully slow, and I didn't think there was anything particularly memorable about the cinematography that it was in service of. I never bought the relationship. The film never presented anything that made me believe Oliver and Elio were falling in love. That killed what I'm assuming was supposed to be a emotional 3rd act. I was really bothered by how their age gap was never mentioned, that undercut the father's speech at the end. I don't buy that any parent would be so nonchalant about their child in a relationship with an adult like that, regardless of the sexual orientation of it. Also there were tons of scenes that just felt straight up awkward. All of the dancing scenes, the weird cut to thermal cam, and the fish just to name a few. These things didn't add anything to film IMO and just had me asking WTF was that? Pulling me out of the movie.

About an hour in the only other couple in the theater walked out, I wish I would have followed their lead. I really wouldn't recommend this and think it's by far the weakest of the best picture candidates.",7rfed5
dt1tzmy,"This movie was just 'meh', I liked the atmosphere and music but there wasn't really a climax or emotional connection felt between Elio and Oliver. It's like they only physically liked each other and that's why they mostly just had sex on their free time, they never had a good conversation. They barely touched on the subject of Elio being so young as most couples would with an age gap like that, and when Oliver says the line ""call me by your name and I'll call you by mine"" It felt extremely forced, random, and cheesy. 

All in all the movie felt like a very awkward porno with a big emotional breakthrough in the actors. It wasn't all bad but it definitely wasn't enjoyable, for me at least.",7rfed5
dtc713l,thought it was kinda gay,7rfed5
dswqp9n,I ended up liking it. If it wasn't for the last 20 mins I would've strongly disliked it. ,7rfed5
dtayufe,Why Oliver married another one? can not be acceptable. Does he love Elio not so much?,7rfed5
dt1tzct,"Count me in the meh crowd for this. It was supremely slow and choppy. 

Unfortunately, I think it sends the wrong messages in a few places as well. Both men cheat on their girlfriends. There's female nudity, but no male nudity? There's the very uncomfortable age gap. Typical bisexual male stereotypes abound. 

It's by no means a bad movie but, given the praise it's getting, I feel like people need to watch more LGBTQ movies.",7rfed5
du0nwe5,This was very disappointing. I was expecting to see the best movie of the year and instead I was bored out of my mind. Predictable and banal. I couldn’t wait for it to end. I really don’t get what people are seeing in this film. ,7rfed5
dt13imk,This is the most overrated film of the year in my opinion. It just seemed like a high quality hallmark movie that takes place in Italy. ,7rfed5
dswwk7y,"This movie promotes and condones ~~pedophilia~~ pedalphilia and ~~homosexuality~~ fruitphilia

Stop pushing propaganda down our throats, Hollywood /s",7rfed5
dswm5o5,Who needs warm apple pie when you have....,7rfed5
dswsi48,https://www.reddit.com/r/IAmA/comments/7qxyok/iama_request_the_cast_from_call_me_by_your_name,7rfed5
dswvxdt,"For the first half an hour I thought I'd make a mistake and that I'd be bored by the film, and then by the end it became one of my favourite films in recent years. Absolutely brilliant performances by Chalamet and Hammer, and the film even made me like Sufjan Stevens who I don't normally listen to (bought Mystery of Love and Visions of Gideon off iTunes). Now I can never listen to Love My Way by The Psychedelic Furs without thinking of Hammer's dance moves and feeling melancholy.

I just watched A Bigger Splash and it was pretty good but Call Me By Your Name is on a whole other level.",7rfed5
dsx1kcq,"Wait does this mean the film just got an expanded release? Cause it's been playing at Regal here but I haven't had a chance to see it yet and was starting to worry it'll leave before I did. 

Hopefully this means it's going to the AMC closer to me. ",7rfed5
dsxltns,"I've not seen the movie yet, but I plan to, so I won't be perusing the comments here, other than any responses to this.

I noticed that it's rated R in the USA, and here in Norway it's a 12+. Are there any french people here who can tell me what age rating it got it France? I'm very interested in international rating-systems, but I cannot for the life of me make sense of the CNC site.  

Thanks!",7rfed5
dsxocjl,"Saw this a couple of week ago, honestly idk how i feel about this movie i wasn't  *too* into it. started off kinda slow, i went in completely blind so i wasn't really sure what was gonna happen. I had an idea Oliver and elio were gay but i wasn't sure, then it happened and it started to pick up quite a bit, maybe i should check it out again, my gf Seemed to really like it though",7rfed5
dsxu3rn,"I got to the theater just a few moments late, I came in when Elio was upstairs in his room and he looks out the window as Oliver is getting out of the car and it says ""Somewhere in northern Italy"". Did I miss anything? ",7rfed5
dsy4bwc,"Timothée his performance was incredible, deserved nomination in the golden globe",7rfed5
dszyrio,"Has anyone here seen ""Death in Venice"" by Luchino Visconti?",7rfed5
dt1vh7g,Did anybody else notice the flashback scene of Elio and Oliver and the fact that the colors were inverted? This was while they were in Bergamo,7rfed5
dt3cm96,"Why is everyone so obsessed with Stuhlbarg's monologue? I've seen much more moving moments in film. Also, the ending. I wasn't emotionally moved at all, maybe I need to see it again.",7rfed5
dtcfmxn,Ugh. The theater that I watched this in had it cropped out the edges so I couldn't see most of the subtitles and the full impact of the framing. So goddamn annoying. I did get a refund though so I hope to see this again soon. ,7rfed5
dtj5rdo,Touching. Indulgent ,7rfed5
dtm9r1c,It was pretty shocking when he f***ed a pear,7rfed5
du7q7vo,"I haven't seen one person mention that scene where everything turned red and yellow for like two seconds. This was when Oliver was looking at Elio sleeping the night before Oliver had to depart. It was sort of like a flashback, but it abruptly inverts into red and yellow. It was so jarring. No one's mentioned it. ",7rfed5
dvi3fuw,That was a beautiful movie but anyone else thinks it was too long?,7rfed5
dvw6cy6,"Could someone explain to me the falling in love process between Elio and Oliver? Because I could not really see it even though I know it is evident in the movie (I have whatever eye for these cues) 

",7rfed5
dvy9ghn,People keep talking about the flies but no one seems to be asking Mafalda about the flies. Maybe she just isn't doing that great of a job.,7rfed5
e0b68rb,"watched it last night. i just cried in the middle of the day remembering the last scene where Elio just goes ""elio elio elio elio"" ",7rfed5
dswjj5c,"I was underwhelmed until the third act tbh, but after letting it digest I realize how well the story worked as a whole. Great performances all around and wish we saw even more of the dad. ",7rfed5
dt24u37,This film is not getting enough recognition,7rfed5
dszfvr3,I loved the film. Loved the soundtrack. Weirded out by the age difference of the two. ,7rfed5
dswi7oc,"I have some flaws regarding pacing but the emotional journey you go on with Emilio is incredible! I felt his growth, his pain, and his passion. Also between this and Master of none season 2 I really need to move to Italy for love huh? Visions of Gideon is also the definition of melancholy. The dad's speech was one of the most poignant moments in cinema in years for me, the weight of all his words resonated with me and his words on slowly shutting your emotions out until you don't mind settling rang all to true. ",7rfed5
dt1t79m,"I couldn't get into this movie.  It's a shame, since so many others seem to love it. 

The age difference made me uncomfortable (especially with how childish Timothee Chalamet acts) and I found myself frequently bored, waiting for things to happen.  Plus, nothing about Chalamet or Hammer's performances dazzled me. 

The soundtrack and Stuhlbarg were great though. ",7rfed5
dszkfn8,"So I knew very little about this movie going into, as I don't like to watch trailers. Was not prepared for the couple of proper gay sex scenes I watched whilst sitting next to a complete stranger!

Great movie though, thought it was very beautiful and nice to watch a movie about a gay relationship that doesn't treat it like it's a gimmick and respects the humanity of it.",7rfed5
dt0e77r,"Saw this film a few months ago in London, and it really stuck with me afterwards. Really glad to see others enjoyed it too. Hope the blogger on Buzzfeed who wrote that hatchet job on Armie will have to eat her words when he's nominated for an oscar. ",7rfed5
dswzebx,"Easily the best movie of 2017, I don't see how The Shape of Water/3 Billboards would even come close",7rfed5
dswky9v,"I've mentioned this before but I really have no idea why the critics are saying Timotheé's performance is the best of the year. It wasn't even the best performance in the film. I much preferred Armie's performance. Sure I very much enjoyed the acting during the credits... But that's the only part that stuck out to me.

I've seen Phantom Thread and Darkest Hour, and I prefer both Oldman's and DDL's performances.

Anyway... CMBYN is a wonderful heartfelt story. I really would recommend it. ",7rfed5
dswwnmb,"Can someone please explain why Elio was still hooking up with Marzi even though he was head over heels for Oliver?

Made him across as a bit of a douche.


Also please explain why Elio pukes when Oliver is dancing? Was he pregnant with Oliver's baby?",7rfed5
dswiq9s,Kept thinking Michael Stuhlbarg was PTA  smh,7rfed5
dswqtrm,"Ive seen a lot of gay cinema, and i feel pretty comfortable saying that this is the best gay romance ever filmed. And its precisely because it isn't a *gay* romance at all. The fact that will and oliver are both male is wholly ancillary to the story.",7rfed5
dswwhfg,*dat peach tho*,7rfed5
dsy6zp2,"Just from the title, I'd assume this was a new Bond movie.",7rfed5
dsyofz6,"It was pretty good, some very good acting from Struhlberg and Chalamet and some relateable moments but not really any scene or moment that sticks with me afterwards or something I would have to rewatch.",7rfed5
dt2gvhe,"Honestly, I thought this movie was generally just fine until the end, which admittedly I thought was excellent, even if I thought Master of None did it better. Timothee and Armie had good chemistry, but it took too long to get off the ground and I know they were going for organic character development but I think the pacing was too off to feel natural. It's definitely good, but it's not the frontrunner that I had gone in thinking it would be. ",7rfed5
dswmhoj,the best thing I can say about the movie was it was incredibly deliberate and it flowed. slow scenes didn't feel slow. ,7rfed5
dsws9j0,"I loved it so much. The last scene is very powerful and now I can't even listen to Visions of Gideon without crying. But there's something that's bugging me, what does the red part near the end mean? When Elio is dreaming and suddenly that scene is red. I know it's a dream but I just don't know why it's red or why it features Elio's cousin. ",7rfed5
dsww2rj,"This film was just so endearing and affectionate yet sad and heartbreaking. I still can’t get it out of my mind.

",7rfed5
dsx0p2n,"Needless to say,  I loved it. It has become one of my favorite movies. I feel so happy reading these comments and realizing a lot of you guys felt the same. I felt heartbroken when the movie ended. Like I literally went through a break up, as if Oliver and Elio were real, flesh and blood. I remeber I fell in love with the movie instantly. I caught myself thinking ""wow I am enyoing this movie and I hope it never ends"". Everything has been said obut CMBYN I'd just like to add that the mom should get praised as well. She came up with the idea Elio shoud join Oliver on his trip. I thought it was a beautiful moment. Even though she didn't vocalize herself in such a powerful manner like his dad, everything a parent should be is also shown in that detail. ",7rfed5
dsx3ogb,[deleted],7rfed5
dsxcum9,Is Olivers appreciation for greek statues and their bodies an obvious hint at his love for the male body? Am i reaching?,7rfed5
dsy11wo,"I thought it was a really well made film, acting was great all around and I really enjoyed it. The emotional moments definitely stuck with me a few weeks after. What makes Chalamet's performance even more impressive to me is that watching a few of his interviews he comes off quite shy, completely different from his personality in the movie. Like everyone else I loved the dialogue at the end even though I didn't necessarily disagree with the whole message. 

In the pantheon of movies about gay men, I still think the obvious comparison to this is Moonlight, and Moonlight is a little better than Call Me By Your Name, which is no shame. Maybe I felt a little larger connection with the characters in Moonlight, they seemed more real to everyday people, while CMBYN did have an air of extremely rich people problems, or maybe I am just jealous of the amazing lifestyle the movie portrayed, having a villa in the Italian countryside is my lifelong dream.",7rfed5
dsy582i,"It was supposed to open in Sac this weekend but apparently got pulled (luckily i still have Phantom Thread) 

But I've seen this twice already. It might be tied with Everything is Free and The Florida Project as my absolute favorites of last year. 

And as much as I love Mystery of Love and Visions of Gideon, the doveman remix of Futile Devices is a true gift. ",7rfed5
dszj2n8,"I loved the film! I respect it even more knowing the budget they had to work with. Gotta admit I still never forgot that it was a teenager and a man, I mean I wasn't disturbed or anything, but Timothée Chalamet really does look like a 16-17 year old.",7rfed5
dt0sgum,Anyone know what backpack Timothée was wearing? The yellow and blue one,7rfed5
dt29j1v,Is Mr Perlman gay? On my second viewing my one friend thought he implied it during the monologue but I never really picked up on that ,7rfed5
dt8c3md,Not that it was important to the film but....how exactly does Elio's dad get American students involved to work with him? does he teach at an italian university with some sort of agreement with one in the US? ,7rfed5
dtb6hss,I wonder if all those close-up shots of Timothee Chalamet's face came about during filming as opposed to planned from the start - when they realised just how incredibly expressive his face is.,7rfed5
dti1x7k,[deleted],7rfed5
dts0kjw,"I loved this movie, although it felt too much like watching gay porn from time to time. ",7rfed5
dtu5l03,"For me it really all comes together with the final shot of the movie. A lot of it seemed kind of awkward. I'm going to read the book to see if that makes it any smoother, but the ending of the movie was gut wrenching and beautifully shot",7rfed5
du2e92m,"Boring, boring, sort by controversial... Ah just lovely ",7rfed5
dua8lwt,"Just saw the film right then. Absolutely loved it, favourite film of 2017 easily for me. But one question, did the film about midway get some kinda blue haze/film celluloid thing briefly appear on screen? During when the ending credits song first plays and it's at night. I wasn't sure if this was a technical fault of the cinema or part of the film, but then again I saw it at an outdoor cinema. ",7rfed5
duj5r72,"Good Landscape combined with Good Acting is a timeless recipe for the success of a film.

More filmmakers need to understand that.",7rfed5
duy9i23,Context is everything. Teenager sticks his dick in apple pie and it’s a gag. Teenager sticks his dick in an apricot and it’s foreplay to sensual scene that ends with vulnerability instead of consumption. INCREDIBLE story-telling.  ,7rfed5
