comment_id,comment_body,submission_id
dswna3z,Wouldn’t it be nice to spend a whole summer reading books and listening to music in your underwear? I’m jealous.,7rfed5
dswjxmu,"Has anyone here actually stuck their thing into a peach/apricot before? Is that actually a thing teenagers did/do and I just missed the memo at the time? I absolutely love this one, however I was deeply offended when Timothée, without a single care, allowed the juices from the peach to drip onto the bed sheets. I mean, good heavens, that was wrong.",7rfed5
dszvujz,"“To feel nothing so as not to feel anything, what a waste”. Damn. That quote is gonna stay with me a while",7rfed5
dswlgy1,Armie Hammer needs to make more movies where he dances.,7rfed5
dt4brg7,"There were many scenes in this movie that stuck with me, most of which have probably been discussed to death here (the dad, the peach, the sheer pleasure of sitting around reading, swimming, and doing whatever you want unsupervised).

I think as an American, one of the things that stuck to my bones was how the parents reacted to their son's sexuality. I don't mean his homosexuality. I mean, sexuality as a whole. Despite most of the key characters being American, they all have a European sensibility that it very rare to see here in the US. One could argue that the movie itself could be making a social comment about open, honest European views of sex vs. moralizing, restrictive American views.

First, the parents see their son is attracted to a man, so they do things to help facilitate that attraction by giving them the idea to travel alone together. They also let Elio and Oliver have their space in the house - they aren't monitoring Elio or ""checking up on him,"" which I found refreshing.

Second, the parents are genuinely always there for Elio in helping him discuss sexual relationships. He is able to say to his parents out loud, ""I could never be that open,"" a vulnerable statement I have trouble imagining expressing to my parents. They simply reassure him; they don't nag or moralize him about sex. Of course, there's the scene with the father discussing his own sexual past and desires, openly and without judgment that exemplifies this behavior.

Third, the adults in the movie treat Elio respectfully with regards to his sexual encounters. For example, when Elio greets the older gay couple with Marzia and quickly gives her a kiss and loving pat, the adults simply maturely greet her and say hello. No one says ""Ohhhhhhh! You have a GIRRRLFRIENND!!!!!!!!!"" In the US, I find it typical that adults make teasing comments and condescending ""jokes"" about ""how cute it is to have a crush"" to teenagers. This moralizing can make teens internalize that they are doing something wrong, when they are actually doing something natural.

To see adults treat Elio respectfully and collegially, like a mature young adult for whom sex is one of many natural, positive experiences, filled me with hope, jealousy, and a strong feeling about the kind of parent I'd like to be if/when I have teenagers. It's not very common you walk out of a movie thinking, ""This movie has changed or informed the way I want to live my life"" but this one has for me.

Last, I think we are in a particular time where we are really looking back on the 1980s with a specific nostalgia for a time when kids could just be kids, ride their bikes everywhere, have adventures, be home for dinner, then go out again and have more unsupervised adventures. Stranger Things, It, and CMBYN all are really tapping in to that nostalgia, albeit in slightly different ways.",7rfed5
dswo3qb,That brief 4th wall break at the end of Visions of Gideon... it just hit something very emotionally raw in me.,7rfed5
dswiuvu,The monologue from Michael Stuhlbarg is probably my favourite scene in any movie this year. I think about it a lot. It affected me so much I had to call my dad after to talk.,7rfed5
dswjai4,"While I thought Elio and Oliver make the perfect couple, I did feel bad for Marzia. The moment Elio gets Oliver he completely forgets about her and when she confronts him about it, he's like ¯\\\_(ツ)_/¯ ",7rfed5
dswzr3l,"Fun Fact: Armie Hammer and Timothee Chalamet stayed and bonded on location a month before the actual filming. They got ample time to know each other very well and spend time with each other doing most of what happened in the movie too. 

And they admittedly said that this is the primary reason why their on-screen chemistry really worked and felt so genuine.

In my opinion, their on-screen chemistry is one of the best and most authentic I’ve ever seen. You can really feel their intimacy especially during the sensual scenes. And that’s why them parting really affected me deeply. ",7rfed5
dswhzo0,that final shot is going to stay with me for a very long time ,7rfed5
dswwwuk,"This is one of the most **A E S T H E T I C** movies I've seen.

Not just in the sense that it's sensually arresting and just beautiful to look at but that all the Greek sculptures and 80s setting reminds me of Macintosh Plus.",7rfed5
dswnl7n,"My favourite scene is when Elio is sitting at the station trying not to cry. A lot of Timothee's performance comes from trying not to show his emotions, that's what makes it so great.",7rfed5
dswnd79,"Was Elio joking when he asked Oliver on the phone if he's getting married? 

 Like Oliver says ""I've got good News"" and Elio says ""What, you're getting married?"". I took that to believe Elio was looking for an answer like... ""I'm coming back next summer"". Anyone else? ",7rfed5
dswk03w,"Did anyone else feel like the story kept baiting and switching typical romance/gay tropes.

I thought the notebook Elio left on the bed would get discovered, it didn’t.

I thought maybe Oliver and Elio’s papers would get mixed up in the backpack but they didn’t.

I thought they would get caught having sex but they didn’t.

Maybe this last one is a stretch but I kinda expected that call at the end to be about AIDS but it wasn’t (I’m blaming that on watching Dallas Buyers Club a couple days prior).",7rfed5
dswj2al,This may fall on deaf ears but I thought the costume design was great. ,7rfed5
dswlq4g,"Sorry Cum Peach... Cum Turkey Baster still has you beat in the cum isn't supposed to go in there Award.

Also... My favorite piece of CMBYN trivia

> Regarding the peach scene, Luca Guadagnino went to Timothée Chalamet and told him that he had tried it out himself and it was in deed possible to do, so therefore he thought they should do the scene. Chalamet responded by saying he had also tried it and agreed to do the scene.

",7rfed5
dswn9bl,I loved all of the random side characters and scenes (like the fish scene). Such a great way to establish the environment more fully.,7rfed5
dswi2ua,Beautiful movie Sufjan is one of my favorites artist and seeing his music fit so well with it’s heartbreaking scenes ,7rfed5
dswi3wg,"“Not a straight body in these statues, they’re all gay.”",7rfed5
dswiitw,"My pick for best movie of 2017. 

I just loved the whole atmosphere of this film, from the music to the pacing to the naturalistic acting. I think it was refreshing to see an LGBT romance that was allowed to be just that, a romance, without focusing on any sort of overt obstacle like violent aggressors, disapproving parents, AIDS, etc. (Although I would understand if people think that makes the film disingenuous). 

Everyone always talks about Timothee's last scene, and deservedly so, but I was super impressed with his physical acting throughout the whole film, as he clearly has some strong instincts as an actor that are rare for someone his age. ",7rfed5
dswjwok,"Can we please talk about the flies? Those weren't coincidental. Anyone have any take away from them?

My biggest was the way in which they represented us the audience. I truly felt like a fly on the wall just observing someone's experience similarly to how I did when I saw Boyhood. I was almost uncomfortable during the sex scenes because it felt like something I shouldn't be seeing because it's their moment and they should be able to have it without spectators.",7rfed5
dswk6a7,"Just got out of this movie. It was...devastatingly beautiful. It’s a movie that I’ll be thinking about for a while. 

I’m a bisexual Indian-American guy who didn’t grow up in the cultured natural paradise that Elio lives in, or with parents as open-minded as his are. What’s more, I haven’t ever felt ~~true love~~ powerful, intense, passionate obsessive infatuation like Elio did. His experience should have felt totally alien to me. Yet, I felt his infatuation, frustration, passion, heartbreak as if they were my own. Chalamet did a phenomenal job. 

The cinematography was great. The languid and lingering shots, and even the abrupt jumps, made it feel like a long yet fleeting summer. 

The father’s monologue at the end nearly had me in tears, especially when he told Elio not to suppress his sadness. And that credit sequence...oh man.

There were parts that fell a bit flat for me. The pacing was a bit off at times, and the romance did seem a bit rushed initially. However, overall, I am very happy I saw this movie, and have a feeling I’ll revisit it time and again.",7rfed5
dswibjt,"I could watch Michael Stuhlbarg read an encyclopedia. 

Easily my favorite film of the year. ",7rfed5
dswpcll,"As a gay man, I had a very hard time watching this movie the first time through. The ""moment of discovery"" is so ubiquitous in gay romances like this, that I spent the whole film anxious waiting for the shoe to drop. I went back and watched it again with the knowledge that it never does and enjoyed the film even more the second time.

It truly is one of the greatest ""first love""  movies I've ever seen. The phone call at the end was the standout for me. Timothy Chalamet deserves an oscar nod for that scene alone. You can physically see all his feelings slamming into him. It's a truly outstanding showcase of subtle physicality. He's officially added to my list of must-watch actors.",7rfed5
dswlr6p,"Well, I've been sitting on this for about a month and having seen the movie twice now I can say it's one of my favorite movies of all time. I was excited for this movie for a while, but still didn't expect to be completely floored by the entire thing.

This movie is a masterpiece and the best portrayal of firsts (sex, love, heartbreak) I have ever seen. Everything in the movie felt so real, it truly brings you back to your first love. It makes you feel the wave of emotions that you felt the first time you fell in love.

Timothee Chalamet gives an absolutely mesmerizing performance in this movie. I can't begin to express how talented he is. He completely encompasses Elio. Honestly the first time around I barely even took note of the other amazing performances here because my eyes were glued to Timothee the whole time. Armie Hammer is fantastic as well, I was able to relate to him and his role in the situation. He is very conflicted, sometimes warm, sometimes cold. And Michael Stuhlbarg is great as well, he has such a presence on screen.

The music in this movie is what I can only describe as beautiful, Sufjans songs in particular stand out as incredibly moving. Visions of Gideon is an absolute soul crusher. The music added to the atmosphere of the movie, which was so warm and peaceful. It was so refreshing to see a movie about two men in a relationship that didnt end with one of them dying or angry parents, nothing of the sort. Time is the villain here, and I think that makes it all the more tragic.

I will say while I love the movie, it didn't have the profound effect it did on me until the scene with Mr. Perlman near the end. I'm not someone who is easily affected by movies and shows but that monologue destroyed me. It's a universal message to anyone feeling pain and on a more personal note something I needed to hear. I had been pushing away and trying to just forget certain things in my life but after seeing this movie I felt a whirlwind of emotions that led me to finally being able to be happy about past relationships rather than bitter. I guess you could say this movie changed my life and how I view relationships going forward.

Overall, Call Me By Your Name is a deeply moving film about love with a fantastic performances, amazing atmosphere, and a few scenes that will stick with you (the monologue, Elio by the fire). I can't recommend it enough. ",7rfed5
dswituf,"This movie really shows how universal love is. It doesn't matter your sexuality, love is the same no matter what. My girlfriend and I saw this together and talked about how much of our own relationship we saw in these two.",7rfed5
dswiiu8,FINALLY a discussion thread for this movie. What an amazing experience. I need to see it again before I say it’s the best of 2017 but my God this movie not only captures the nuances of summer romance but also male friendship so well. I love this movie so so so much. ,7rfed5
dswk1r5,"What do we think of the title 'Call Me By Your Name?' What's the significance? I have my thoughts, but I've been trying to find what other people think, and I haven't seen too much discussion on it. I'm wondering if I've been reading too much into it or if I'm being too obvious. What is the significance of the act of calling each other by their own name mean? I would love to hear some opinions.",7rfed5
dsx6mat,"Did anyone see that interview where Armie Hammer talks about how the director was like ""okay we're going to do this scene."" And they flipped through the script and all it said was ""Oliver and Elio roll in the grass and make out."" 

And they were like ... ok, here we go. So they start to make out and Luca is like ""no, no, get into it"". 

So they go at it again and they're rolling around and making out. And they're still making out ... and finally one of them looks up and Luca had walked away. I dont know why but I just about died laughing! They also said it was great to film bc they only film like 7, 8 hour days (not like the US where they film 12 hour days). So they got to spend a lot of time hanging out and walking through the city they were filming in. 

edit: also when the dad talks to Elio at the end, I was bawling. And I personally would say this film feels more coming-of-age than LGBTQ ... I'm not quite sure why. Probably because it doesnt match the tone of the LGBTQ movies I've seen (Boys Dont Cry, anyone?) and the focus is on Elio, with his age and the pain of losing that first love ... the bisexual part seemed to be an accessory to all those other things. ",7rfed5
dswj5el,The end conversation with dad was really profound. I usually find dialogue that tries to be deep a little difficult to take seriously but for some reason the dialogue in that scene felt meaningful. ,7rfed5
dswjy8h,At speech at the end... fuck that was powerful. ,7rfed5
dt1r768,"I did some searching and..I can’t be the only one who noticed the continuous take statue scene..?

The take starts when Elio and Oliver pull up to the shop on their bikes. Oliver goes in and buys a pack of cigarettes and comes back out, offering one to Elio. They walk the bikes over to the statue and rest them on the gate. They talk about the statue and their feelings as they circle it. Oliver then goes into (I believe) a printing shop and comes back out saying how they misprinted his work. They get back onto their bikes and ride away and the take ends.

There are most likely cuts whenever the camera pans up to the statue and building, but still..it was beautifully done.

THIS is the scene everyone should be talking about. ",7rfed5
dswm2j1,"sorry, but timothee chalamet deserves the oscar over gary oldman!",7rfed5
dswj3c6,"This film easily has the best final act of movie from 2017. 

And honestly, it might be my favorite final act from any film I've ever seen.",7rfed5
dswn79d,"""Love My Way"" by ""The Psychedelic Furs"" is a fucking fantastic song. ",7rfed5
dswiu9v,I just got out of this movie. It was one of the most stylish and well directed movies I can remember seeing. The party/dancing scene midway through the first half of the film was one of the most well shot scenes I have ever seen. ,7rfed5
dswl1c1,[deleted],7rfed5
dsxey4q,"This film caused me to start rethinking my lifestyle for awhile. I’m a college student but most of my time last semester was spent at work, studying for classes I’m uninterested in, working on extracurriculars that I’m only slightly more interested in, or trying to fix a relationship that ultimately failed.

I can’t decide if I thought this movie was good or not, but watching people live a lifestyle that I’m overwhelmingly jealous of was very moving.",7rfed5
dswsanv,"At its best, this is the best movie of the year. Excellent performances, beautiful photography, great music. The visual storytelling and the visual motifs/metaphors (The fly, the apricots) were all very well done. Technically speaking, the film is a triumph.

But!

It just wasn't interesting. I tried engaging with this movie for two hours and it never spoke to me. Which is a shame because everyone seems to have found something truly special speaking to them, and I'm left scratching my head wondering if I missed something or if I'm just broken.",7rfed5
dswkat1,"I was OBSESSED with this film for days after watching it. The last time a film triggered such a reaction in me was when I watched Blue Valentine and the Before Sunset trilogy. CMBYN tells such a straightforward but intimate coming-of-age story about many firsts - our first crush, our first kiss, our first sexual experience and our first heartbreak. Whether watching it as a gay or straight person, the film is universal in that aspect, and it is so easy to relate with Elio and his yearning for Oliver. There were many misty eyes in my theatre during Elio’s chat with his dad towards the end, including mine. The soundtrack only amplified what is already a wonderful film on its own.

For what it’s worth, the book is an equally excellent read and a personal recommendation of mine. I devoured it within a day and found it a good way to get a better understanding of Elio’s thoughts and feelings, which were often left unspoken during the film. If you’re into audiobooks, Armie Hammer also does a reading of it.",7rfed5
dswoibp,I could watch that scene of Armie Hammer dancing to Love My Way for hours.,7rfed5
dswnmiv,"After I first saw it, I listened to the soundtrack for a week. I watched interviews about the film whether it was from the actors or directors or both. ",7rfed5
dsxjv36,Stuhlbarg's monologue made me a broken man and I'm okay with that,7rfed5
dsyaup2,"My favorite film of the last 10 years. Probably one of my top 5 all time.  Universal and beautiful on every level.

Something I haven't seen much comment on:  the brief breaking of the 4th wall when Elio looks right at the camera during the final scene and smiles. He does this right after his mother calls him to dinner, saying ""Elio"". I think he does this because he realizes that from now on every time someone calls him by his name he'll be reminded of Oliver.  And by breaking the 4th wall he's letting us in on that fact.  Thoughts?",7rfed5
dswtf94,"I read the book about two weeks before Christmas, as I like to read the book before I see the movie when it comes to adaptations (if I can that is) and read it in one sitting.

For days after reading it I couldn't get it out of my mind. I'm gay (although I don't remotely think you need to be to enjoy and appreciate this book/movie) and both the book and movie just moved me so damn much.

Timothée Chalamet and Armie Hammer really done the characters justice in bringing them to life, I felt as if I knew them. Every sideways glance, slight smirk or quick look away said so much.

And Michael Stuhlbarg's speech had me in tears, not to mention the final shot. 

CMBYN is quite possibly the closest I've ever come to seeing a perfect movie.",7rfed5
dswyuw1,Sufjan needs a song nomination. ,7rfed5
dt1501f,"I love this as being a bit of a gay fairytale. We have the opening text about it being “Somewhere in Northern Italy” and the series of scenes discussing French fairy tales all coupled with a narrative that especially from a queer perspective feels almost fantastical with all the highs of a great first love and *gasp* incredibly accepting parents. 

There is a sense of magical realism that is undercut by the harsh realties of life in the end, but damn if I don’t want to live in the world of Elio and Oliver’s Italian summer for forever. ",7rfed5
dt4qmgy,"Man that scene where Elio's father comforts him when he comes back from seeing Oliver off fucked me up. 

That's the kind of father I'd strive to be.  ",7rfed5
dta3asb,Armie Hammer should have been nominated for the sweet dismount from his bike when they go down to the river alone.,7rfed5
dswo4um,"The setting and the intimacy in this film had me smiling constantly for the first two thirds. Then of course I was crying by the end but it just felt so genuine and touching across the board. I really hope it gets some award recognition somewhere down the line- all great performances, great music, great script, etc. It was quite an experience and my favorite film of 2017.",7rfed5
dt1kok8,Scene around the fountain was masterful. ,7rfed5
dt4n2w7,"Saw this two days ago. Loved it. Langorous pacing, which Brokeback Mountain had as well. I'm 50 and gay and did not find this to be an eternal love story of two soulmates, but a pretty accurate portrayal of first lust/love. That first time in your life when the object of your affection consumes your thoughts and your libido.  Brought back some great memories for me, and also having lived in Tuscany, it makes me long to go back. Great Italian summer idyll.",7rfed5
dswj5j8,"Holy mackerel, the characters felt so real to me. Elio, Oliver, Elio's father.... even their over-talkative houseguests. I felt like I knew them or versions of them in my own life.

I've never struggled with my sexuality, but it seemed like some of the journey of finding yourself resonated with my own young adulthood.",7rfed5
dswwab6,"What really made this film was Timothee and Armie’s undeniably genuine chemistry. 

They are both straight actors but you couldn’t deny that their affection for each other portraying these characters were so authentic that you almost believed it was real being fully immersed in the film. 

And, in real life, Timothee and Armie have a really cute and special friendly relationship. This is evident on their interviews and press junket. I guess that’s why their portrayal of their respective characters translated so well in the film. ",7rfed5
dswjcj4,"Michael Stuhlbarg’s speech to Elio on the couch nearly brought me to tears. That was some really hard dialogue to sell but man, he made it feel so damn genuine. 

My favorite love story of 2017 by far. I was really moved.",7rfed5
dswi528,"Wait, so, someone rated this film a 1, and still said they would recommend it?

Has anyone ever been nominated for Best Actor and Best Supporting Actor in the same year? I think Chalamet deserves it, for this and Lady Bird. His ability to use his accents to transform his character - both in each film separately, but also in this one on its own - is remarkable. What I mean by this, in CMBYN, is that he has a very distinct personality when speaking Italian with his friends, and speaking English with Oliver.",7rfed5
dswxkd7,"I'm so happy for Armie Hammer. I really liked him every since I saw Social Network and it's great he's getting the acclaim now.

",7rfed5
du86hqx,"God damn I wanted to see more Marzia ass and titties, instead I saw a dude nearly eat another dude’s cum-fruit.",7rfed5
dswo64a,"This is one of the few film adaptations where the movie is just as great, if not better, as the book. ",7rfed5
dt4a8tm,"This might be the best movie I’ve ever seen. It really hits me because everything is so REAL to Elio, and Oliver just goes back home to his now-fiancée. ",7rfed5
dswj3th,"Easily movie of the year for me, and the only movie I've ever cried at in theaters.

Then again, between sufjan, greek drama, the lgbt focus, and the bittersweet appreciation of a love with a set expiration date, this movie was pretty much tailor-made to make me cry, so... might not be unbiased here.",7rfed5
dsxz773,"After watching this film I thought it was a good film. However, it stayed with me. I couldn’t stop thinking about it. Upon reflection, It’s the best film of the year for me. It’s strange that the best love story told this year is a homosexual romance. It made me think about sexuality in a broad sense and how I believe that in probably 150 years there will be no gay/straight/bi. Sexuality will be fluid.",7rfed5
