comment_id,comment_body,submission_id
dswr4qx,"In the book, Elio is massively jealous of how intelligent, mature, and confident Oliver is. In reverse, Oliver wishes he had Elio’s lax life and youthful innocence. In a way, Elio and Oliver were projecting themselves onto the other, because one of their greatest desires was to be like the other.

Also, since the parents basically know about the relationship, calling each other by their names in the heat of the moment is one of the only secrets they share. The book further crushes the reader at the very end by having only Elio remember it. Oliver has no idea what Elio is talking about when he calls him “Elio”, which means that the relationship was much more significant to Elio than Oliver.",7rfed5
dswlsow,I believe it's way of seeing each other as equals. If I remember correctly Elio thinks he's not good enough for Oliver and his father mentions to Elio that Oliver probably feels the same way. ,7rfed5
dswnkcx,"I think it goes to show how deeply they care for one another. By calling themselves by each other's names, they're recognizing the other as a piece of themselves, sort of like two sides of the same coin maybe or more like they are ""one."" ",7rfed5
dswqav6,"The idea behind the line, is that their connection is so intense that they see themselves inside one another, or that they are now part of each other. Calling each other by ine anothers names is a way to aknowledge that.

At least that's my interpretation.",7rfed5
dt13e0m,"My friend related it to an ancient roman marriage vows (""ubi tu Gaius, ego Gaia""). It's probablly not correct, but I like it, and it fits the themes of the movie.",7rfed5
dt3l6ag,">Probably because it doesnt match the tone of the LGBTQ movies I've seen (Boys Dont Cry, anyone?) and the focus is on Elio, with his age and the pain of losing that first love 

As someone who's gay, it's honestly one of the reasons this film after one viewing has frog leaped over so many to be one of my all-time favorites. This is the kind of LGBT film I want more of. The others are good, and it's important to tell those stories so people see and experience the realities some of us go through that's specific to being LGBT, but it feels really good to just have an amazing movie where the LGBT factor isn't THE story. Amazing stories are told when we get to focus on the universality of relationships between characters and the emotions shared. ",7rfed5
dt03h7z,"That story reminds me of the one Ewan McGregor told (I think it was on the Jonathan Ross Show) about filming a scene in Velvet Goldmine in which he's having sex with Jonathan Rhys-Meyers' character on a rooftop.

The cameras/crew were on a neighbouring rooftop and the actors couldn't hear the director shout cut so they were stuck faux-bumming for a long while until a crew member finally reached them.",7rfed5
dsxuvyg,"Yeah, I rolled when I read that story haha.",7rfed5
dvy8qmr,Just joining this discussion because I barely saw it but damn 8 hour days? Well I'm a little more jealous of Italy now. Working in film can get tedious at times. ,7rfed5
dswjrrb,I think it's because they set him up as this incredibly intelligent and well spoken man so it felt natural for him to say all that to his son.,7rfed5
dswjaxw,"> but for some reason 

Michael Stuhlbarg.",7rfed5
dswm2o3,[deleted],7rfed5
dswwwv8,"I think it is profound, because how many parents would you know that would (even if they have no problem with their child being queer) support a relationship to develop between their 17 year old child and someone who 8 years their senior and at such a different point in their life that they knew it was going to end in heartbreak. Most would say ""Watch out, you'll get hurt. This is a bad idea.""",7rfed5
dsx3m48,"While it's beautifully written as can be, I really think it's Stuhblarg's delivery that makes it as effective as it is. The pauses he gives, the inflections, the silence he allows to linger while smoking his cigarette, etc. He's fatherly in a commanding sense while still being delicate and sincere with his words.",7rfed5
dt5o0b5,"I enjoyed how when he asks ""Does Mom Know""

His father replies ""Probably not""

But this goes back to the scene earlier when he gives Oliver some wrong interpretation just to test him. I think he knows that Elio really knows but he said that anyway. 
",7rfed5
dt2iu3f,I’ve seen the film 5 times now and I actually think there are no cuts. I specifically looked out for them the last 2 viewings. Incredible scene. ,7rfed5
dt26da4,"I literally responded to a similar comment on another forum just this morning.

I thought the entire scene was beautiful but didn’t realize it was a single (or carefully edited) shot until my second viewing. I’ve seen a few complaints about it being “too staged” but I thought it to be perfect; for Elio to gather the courage to speak of his feelings to Oliver, it made sense to me that he would do so with a little distance between them and given the language they were using, there were no concerns of anyone overhearing and knowing what they were actually saying.",7rfed5
dt2ybu1,"Luca Guadagnino does an anatomy of a scene video on this, definitely worth checking out.",7rfed5
dsx3omt,"Agreed, it was more nuanced IMO and he had to express his characters feelings in subtle ways. The role of Churchill in Darkest Hour isn't a particularly tough one, in some respects it's an actor's dream. I mean he gets scenery chewing monologues, killer speeches, these big crippling moments of doubt, it's all really meaty material. But I don't know if I felt there was a ton in it where Oldman was particularly stretching himself, you know? Chalamet had to convey so much with glances, silences, these quiet moments in between, and he does it in this incredible and heartbreaking manner. Oldman crushes the big moments, sure, and he's solid when the film dips into an minor key too, but I dunno. I saw Call Me By Your Name the day after I saw Darkest Hour and it just felt like Chalamet had given a much stronger, more nuanced, and daring performance that even a month later I'm still thinking about a lot. Oldman was good to be sure, but I don't think the role asks as much of his abilities as Elio does of Chalamet and just hasn't stayed with me in the same way.",7rfed5
dsxvd3o,"Finally, someone agrees! Oldman was great, but it was run-of-the-mill lead actor in a biopic acting. Chalamet’s performance was so much more complex and moving.",7rfed5
dt0earn,"Just saw Darkest Hour and I couldn't agree more.  I liked it and Gary Oldman was great, but Timothée Chalamet absolutely floored me with his performance.  It's a shame that Oldman has been snubbed so many times because I think a lot of people are giving him consolation votes.",7rfed5
dsyni7b,"I understand this, I really do. I thought the same thing, but I just got out of Phantom Thread and Daniel Day Lewis absolutely DESTROYED that role. I can't see anyone else taking it.",7rfed5
dsyhwo3,That movie was incredibly dull.,7rfed5
dv5ok44,"I totally thought Timothee was far better! He was so nuanced, and so physically fluid, and awkward, and sexy, and cheeky, and rude and so so realistic! Unfortunately I don’t think the Academy will reward that over scene chewing material but I really thought his was the best performance this year. ",7rfed5
dt9ceh0,he might pull off the upset...adrien brody did it!,7rfed5
dswmwed,"I thought Gary Oldman was far better. Chalamet was good, but Oldman managed to single-handedly carry a mediocre movie while convincingly playing a complex historical figure and giving a wide range of emotions. That's worth a lot in my book. Of course, if I had my way Hugh Jackman would win for Logan, but obviously that isn't going to happen.",7rfed5
dswn58k,I much preferred Armie's performance than Timotheé's. ,7rfed5
dswje1x,Poor Elio :'(,7rfed5
dsx3cae,"From the train scene to the final frame, I was an absolute wreck. It heightened a movie I already liked a lot to a status I wasn't at all anticipating. That shot of Chalamet's back against the camera while on the phone with his mother, trying to be composed as ever, hit like a punch in the gut.",7rfed5
dsxjoym,"I was confused why he suddenly got married tho. It made it seem like he had some feeling for Elio, but it was just as long as Elio was there. He pulled that kid wayyy in too deep just to leave him drowing by his revelation. 

Elio deserves better",7rfed5
dswm2zn,"I liked it a lot but it didn't floor me like I thought it would. The dad's monologue and elios last scene were good but seemed a bit too on the nose, especially the monologue. 

Get Out and Wind River had better final acts, IMO. They were really emotional ",7rfed5
dswn80c,">This film easily has the best final act of movie from 2017.

It was good, but I'd say the final scenes of Blade Runner 2049, Get Out, and Logan were better.

Edit: Really? If you people are gonna downvote me, tell me why I'm wrong.",7rfed5
dsx02v4,Does anyone  else think it’s purposely chosen because the first line is “there’s an army on the dance floor”? And then the director chose to open with a long shot of Armie Hammer on the dance floor going crazy to the song. ,7rfed5
dswx73q,I WISH I COULD MOVE LIKE OLIVER IN THAT DANCING SCENE,7rfed5
dsx1fgx,I’ve had it pretty much on repeat since I first saw the film a month ago. Amazing song.,7rfed5
dt1phnh,"Seriously.  So fucking fantastic that it causes spontaneous late night Italian dance parties in the street - I just loved that scene.  Saw the film a while ago and I still can't shake this song, I'm not even mad.",7rfed5
dsy8b2a,"I went on to buy it on [vinyl](https://i.imgur.com/pLGp2Q3.jpg)... as well as the soundtrack. No better song for such a fucking fantastic scene. It was easily my favorite of the movie, I was as mesmerized as Elio in Oliver.",7rfed5
dswp1p3,"Agreed. Perfection. My favorite shot of the movie. Timothee sitting there, leaning forward, sitting back, his cigarette, his swig of wine...contemplating. What he says without saying a single word is masterful. Gotta give Luca credit on that one too though. The direction and cinematography in this film are amazing. ",7rfed5
dswr64d,he eats it in the book,7rfed5
dt0edy2,"Apparently they filmed takes with him eating it, but Timothée started crying before he ate it in the one that ended up being the best.",7rfed5
dt1ovh7,"I just read that they filmed the scene with Oliver eating the peach, but the shot that ended up in the movie was an alternate take. It was shot near the end of filming and Chalamet’s performance was very much driven by the fact that they’d all be parting ways soon. Luca liked this version better and ultimately kept it.",7rfed5
dt19vd0,"I can relate to this. For some time now, I've thought about teaching overseas and just really bouncing from place to place rather than working my banal jobs I have now. I'm grateful for this and many aspects of my life but this movie really made me think and confront the fact that I'm no longer 20 and really have to get moving. ",7rfed5
dtzizk0,"Exactly. I've watched the film a couple of days ago and I can't get that exact feeling out of me.

I'd really like to be able to talk to someone who feels the same.

""We rip out so much of ourselves to be cured of things faster, that we go bankrupt by the age of thirty""",7rfed5
dt1n0r1,"I know you shouldn’t have to watch movies twice, but I will say my fiancé and I watched this twice and his perspective definitely flipped. After the first viewing I was a ball of tears and screaming “that was so good!” and he just shrugged while saying “Yeah, like it was pretty good.” We got to see it again yesterday and when it ended he looked at me (again, I was a ball of tears) and he was like “ok, I get it now. That was amazing.” ",7rfed5
dtb2j4p,"Glad I found this comment, just saw it and thought I was losing my mind reading this thread. Technically brilliant and very well acted but the story just didn’t do it for me. ",7rfed5
dszfhsa,I'm glad I'm not the only one. I felt bored for many little stretches throughout the film but I did enjoy a lot as well. The speech at the end was definitely my biggest takeaway and most impactful moment of the film for me.,7rfed5
dtddyyr,Wholly agreed there... and I'm gay. Maybe **I** am broken.,7rfed5
dswkkv5,I was obsessed with it from the moment I saw the trailer. In the time that I waited to see it (and it was such a long wait) I heard the audiobook in it's entirety thrice. I don't even like audiobooks but I just couldn't wait to get whatever information about it. I think I even managed to see almost all the interviews of  Armie and Timothy have done that are available on YouTube. ,7rfed5
dsxc1t7,Man you nailed it when comparing this to the before trilogy and blue valentine.,7rfed5
dt1ofar,"I’ve been obsessed since seeing the Mystery of Love video about 3 weeks ago. It showed up randomly in a Facebook ad. I promptly bought the novel and devoured it, as the film wasn’t showing in Detroit yet.

Finally saw the film last Monday and can’t stop thinking about it or seeking out clips, stills, etc. Playing the Sufjan songs every day now, and that’s when I’m not listening to the book on Audible (it was stupidly expensive but I have no regrets). It’s starting to interfere with my life haha. I see comments all over about this and I’m glad I’m not alone. It was just such a sensual experience, and it got deep under my skin.

Last movie that affected me this way was Atonement. They’re both heartbreakingly beautiful stories with such painful conclusions. Difficult to move on from that.",7rfed5
dswlg7z,I second your recommendation for the book. It's an excellent companion piece to the movie. I was obsessed as well. Bought the book immediately after watching the movie and finished it in two days. I regret missing the chance to pick up the limited edition vinyl.,7rfed5
dsxwr60,Is the book true to the film? I was going to grab a copy from the library but they are all out and already on hold so I might just buy a copy.,7rfed5
dvmn0qg,"If you love this film, you may like James Ivory's ""Maurice"", from 1987.  It's all about class structure and longing, the journey of a young gay man in the 1910's England.  It's as gorgeously filmed as ""Call Me..."", no surprise as it's a Merchant/Ivory production, and the performances are wonderful and understated.  A young Hugh Grant co-stars (and he's brilliant as the repressed Clive), but the movie belongs to James Wilby in the title role, and the gorgeous Rupert Graves as Alec.  Check it out.",7rfed5
e1p72tp,Armie Hammer's voice alone is reason enough to get me an audible account.,7rfed5
dtns7vc,"Well, I hear they are making a sequel so maybe it will just be that.  Fingers crossed!",7rfed5
dtafqg8,"It's based on a book, so you might want to check that out. I haven't read it, but supposed to be good.",7rfed5
dsxk4nx,"Stuhlbarg is a chameleon.  Think of his role here, compare it to his role in Arrival, and compare that to his role in Steve Jobs (where he plays Andy Hertzfeld).  It's hard to believe it's the same guy.",7rfed5
dt0dp8f,Yeah...it just about wrecked me.  ,7rfed5
dt1mtq3,Oh shit. That idea literally just gave me chills. That will be with him for the rest of his life.,7rfed5
dvb0hh7,"Reading your comment months later...this is a really brilliant interpretation. Thank you for sharing this.

That fourth-wall break shook my soul. It still gives me goosebumps just to think of it. Chalamet is so fucking talented.",7rfed5
dszemm6,Good thought,7rfed5
dtcmi94,"Wow I didn't catch that at all. I really have to rewatch this movie, that's a beautiful interpretation.",7rfed5
dthc7la,That's a great point!  It ties in with his father's speech about remembering the joy you had as well as the sorrow.  And with Oliver saying he remembers everything.,7rfed5
dt0kabq,"I completely agree.  I saw it two weeks ago and can't get it out of my head.  I usually like to give it a few years and a few rewatches before I call a movie perfect or one of my favorites, but this was one where I just felt it immediately",7rfed5
dt7nrgc,Wish granted,7rfed5
dta5157,my favorite scene of the whole movie. I was bawling.,7rfed5
dt7bv00,"I *loved* how Italian the film was. I studied abroad in Rome for a couple months, then returned last year for vacation, and there are so many little Italian details that had me absolutely aching to go back.",7rfed5
dsxto4u,"The first time I saw it I was almost brought to tears as well. I spent the following week thinking about that dialogue, trying to understand it better. The second time... oh boy I was a mess. Shaking, whimpering in my seat. Was embaraased at first but heard other people around me sniffling as well and we all just let it out.",7rfed5
dswnc7y,"Al Pacino was nominated for Best Actor for Scent of a Woman and Best Supporting Actor for Glengarry Glen Ross in the same year.

As for Chalamet deserving nominations for both, I definitely disagree. Lucas Hedges gave a much stronger performance in Lady Bird than Chalamet did IMO.",7rfed5
dswk27z,"And then in Lady Bird he has that moment where corrects Lady Bird and pronounces his band's name in a French accent, which I thought did so much to develop his character in .2 seconds. 

~

Also to answer your question, yes it has happened. The example that pops into my head is Julianne Moore got nominated for lead in Far from Heaven and supporting for The Hours in the same year (and lost both). ",7rfed5
dsxkrkb,"Jamie Foxx for Ray and Collateral, which is an especially strange case because both should have been lead, but Collateral was put in supporting.",7rfed5
dswmewx,Cate Blanchett was nominated for Best Actress and Best Supporting Actress in 2007 for the Elizabeth sequel and I'm Not There (where she plays Bob Dylan).,7rfed5
dswlzy6,"He truly delivered the greatest performance of the year. All of his mannerisms, each little inflection in his line delivery, and such are so lived in and just full of naturalism",7rfed5
dsxh8m7,"1993: Emma Thompson was nominated for Best Actress (*The Remains of the Day*) and Best Supporting Actress (*In the Name of the Father*)

...she was just getting warmed up...

1995: She was nominated for Best Actress **and** Best Adapted Screenplay (both for *Sense and Sensibility*)

",7rfed5
dt24zpi,I loved him in CMBYN. I don't think his character in ladybird deserves a nomination though it was enjoyable seeing such a smug oblivious stupid teenager,7rfed5
dt03j6y,"I really want a Man From U.N.C.L.E 2. :( 

I'd seen him in TSN but MFU was the film that made me love him. His chemistry with Alicia Vikander and Henry Cavill was insane.",7rfed5
dtpkpz2,"wow. i have no clue who Armie Hammer is and he isn't really recognizable from his previous films. upon googling, found out he has worked with some very famous people like, David Fincher, Clint Eastwood, Tom Ford, Guy Ritchie, Johnny Depp... why isn't he more famous!!?",7rfed5
dudr3e6,"I couldn't disagree with you more, but that was legitimately hilarious.",7rfed5
dswsqlu,This for me was the biggest take away. I've never watched a film that gave me the same connection to characters like reading a great book. After watching the movie I listened to the audiobook to further the experience. I went to watch it again and enjoyed it even more which I didn't think was possible. ,7rfed5
dt0klq9,"Agreed.  Listening to the book after seeing the movie was a perfect experience.  I loved going into the movie unspoiled, getting to watch the relationship play out, letting the actors so brilliantly convey all the emotions.  And then you get to the book and Elio's inner monologue adds another layer to it all and ties it all together perfectly.  They each stand beautifully on their own but also complement each other perfectly, and that's a rare thing for an adaptation.",7rfed5
dv5orr4,So you’d say the movie is better than the book? ,7rfed5
dt2jozf,">they filmed him as if he was some kind of Greek God at some angles, all golden hair and muscles, and it was appreciated.

The angles were perfect especially when Elio observed Oliver in the whole apricot etymology scene. Glad I'm not the only one who noticed. 
",7rfed5
du4jslx,[deleted],7rfed5
dt2r7lh,"> And on a shallow note: they filmed him as if he was some kind of Greek God at some angles, all golden hair and muscles, and it was appreciated.

Ironically this movie dispelled most of the physical attraction I'd previously held for Hammer. Too lanky for my taste, and the short shorts and sockless loafers drove home that he has scrawny chicken legs in contrast to his upper body development.",7rfed5
dt2r0h2,"This is why I'm glad I was never attracted to most of my friends growing up (only a couple of exceptions), it avoided making things awkward.",7rfed5
dv98ijm,Are you me? I'll just call you by name then.,7rfed5
dt0lqhn,"The book is from Elio's perspective and makes this very clear as well.  It's a refreshingly open and new story that we so very rarely get to see.  Heterosexual love stories can be whatever kind of story they want, but LGBT love stories are automatically just ""LGBT stories"" as if that's a genre.  But this book/movie says no, this is just a love story between two men and doesn't need to get pigeonholed, just like these characters don't need to have their sexualities pigeonholed.",7rfed5
dswiztw,Their relationship was so light & heavy at the same time. Hard to explain but I loved every minute.,7rfed5
dswxlyw,Peach rape> hologram threesome,7rfed5
dt1ask6,In the same boat. I was also left with the same exact feeling after both movies. They’re each very cerebral and you get this v palatable feeling of being stoned after each ,7rfed5
dtzzwxi,Those were my two favorites this year as well. SO glad someone else agrees. The book wrecked me as well...,7rfed5
dsycfra,"Ahhh I came here looking for this. I was having so much trouble articulating my issue with the first half of the movie. And you captured it perfectly: 

“The film feels like it substitutes sex for intimacy, and that's this film's biggest problem for me - I never felt the bond between these two people, I felt like I was just told it.”",7rfed5
dswob07,"I'm a huge fan of the film and it's my favorite of the year, but in some ways I do agree with you that they could have showed more to establish their bond. 

There were actually a few conversations between Elio and Oliver that were in the script but didn't make it into the film that would have addressed your problems, and I have no idea why they were cut. ",7rfed5
dt08vv9,"> The film feels like it substitutes sex for intimacy, and that's this film's biggest problem for me - I never felt the bond between these two people, I felt like I was just told it. 

I felt the same way through the first half of the film, they didn't really click for me as a romantic couple with genuine feelings for one another (rather than just two horny guys who found each other attractive) until the nighttime balcony scene.",7rfed5
dszbo90,"Yeah, I'm in the same boat. I enjoyed it, but I don't get the outpouring of praise for this movie. It's decent. Not life-changing. I thought both Moonlight and LaLa Land from last year packed more punch that this movie.

here are some of my points-

* It doesn't feel earned, as this great love story I mean. The two guys barely get to know each other. 
Oliver is just this objectified adonis, and Elio is horny teenager. Who's kind of loli. It doesn't feel like love, only lust. 

* Does the age difference matter to anybody? At 17 you're still basically a kid. Oliver at 24, you're an adult. Maybe a barely functioning adult but you're still an adult. Oliver is going to have more experience and emotional wherewithal, to separate and compartmentalize their affair, while Elio is basically a child. 
  
* Both men are selfish and careless with their dicks. (You know what I mean) Elio with Marzia and Oliver with Elio. Elio knew he loved Oliver when he fucked w/ Marzia. Oliver knew he had a probably fiancé to return to when he fucked Elio. Are we really supposed to root for them without reservation? 

* despite my complaints, I fucking love the sentiments behind these two moments:


*""Do you think I'm sick?""*
*""I wish everybody was as sick as you""*

And

""Call me by your name and I'll call you by mine""

And the music/setting/photography/aesthetics were delightful in every way. 

Film felt like a case in style over substance.   ",7rfed5
dtwjjp5,"I was destroyed by the ending scene and the fathers speech was great, but agreed. I genuinely thought there were scenes missing or something that explained how it got from point a to point b because I just didn't see it.",7rfed5
dt2lhni,"I agree, I'm very confused as to why people state this is the best romance movie of all time. The romance between Elio and Oliver was replaced by barely talking and a ton of making out/sex.",7rfed5
dt1wx0u,"Thank you for expressing the very problems I have with this film and how I felt after I had finished watching it. I went into this super excited and came out feeling like I had seen a completely different film to the one people were raving about. 

Like you, I never found the core relationship convincing or compelling and the way you described its issues with intimacy hit the nail exactly on the head. It's funny that you mentioned Carol because when I was trying to figure out why the film didn't work for me, I couldn't help thinking about how breathless Carol had left me and how flat I felt after watching CMBYN.

In fact, I can't say any scene from CMBYN has actually stuck with me. I enjoyed the Sufjan songs and sadly, those were probably my favourite parts of the film. But yeah, unfortunately this is one of my biggest disappointments as well.",7rfed5
