comment_id,comment_body,submission_id
dt37pni,"It was, to quote the peach from Call Me By Your Name, the pits. ",7rfed5
dv9qu7d,That's fine by me.,7rfed5
dv97rkz,Say it louder for the people in the back!!!,7rfed5
dswmrks,"Yes! Their attraction (both physical and intellectual) to each other was just so intense, and yet when they're together there's this sense of freedom and levity that's so raw and pure at the same time.",7rfed5
dsx9hdv,Hah made me laugh out loud.,7rfed5
dt0yr62,"Why did Elio resented a bit after the first time they had sex? (well, both sexually and emotionally confronted) This really confused Oliver at first (and me). I read it again in the book and still can't figure it out. The reason i'm so bothered by this detail is because me myself have once felt ""sick of"" my ex after a few days dating him, but that is because I had a false infatuated idea of him (which is unfair to him, not to me). 
So if anyone is kind enough please elaborate.(#spoiler)
",7rfed5
dsy8ut5,I personally thought that no more dialogue was necessary. The sexual tension built up by subtle eye and body contact was enough for me. Elio is young and him not speaking up that much was so realistic imho. More conversations certainly would've been nice to haves.,7rfed5
dv3tx0x,"I'm surprised this is the first comment I've seen discussing the age difference. I just couldnt really get past that. It turned so many of the ""romantic"" scenes into something somewhat predatory (at least in my view). ",7rfed5
dv5ote5,I felt it was just lust. ,7rfed5
dv3tymk,Exactly. Like how many meaningful conversations did they have? It never felt like it got past flirtation.,7rfed5
dswqedu,"Based on what?

It seems to be the clear frontrunner from where im sitting. Lady Bird and I Tonya are the only other one's that ive seen much best-picture buzz about, and best picture has historically been a tough wall to climb for comedies.",7rfed5
dt7pzkm,that's interesting. i had thought that it was Oliver's memories and they were inverted because the majority of the film was from Elio's perspective. either way i really loved that moment in the film.,7rfed5
duafmhd,"The inverted film footage baffled me as well until I read Luca explaining it as Elio's dream, then it all made sense to me:

While Elio is blissfully dreaming of a happy future with Oliver, Oliver is ruefully pondering the inevitable heartbreak awaiting Elio. 

There's so much beautiful nuance in the movie that demands repeated viewings and contemplation. And bless that guy with the Tumblr for un-inverting that footage!",7rfed5
dt6smq4,[removed],7rfed5
dudoy0x,"That can't be. The final shot, especially after his conversation with his father, Elio is specifically and intentionally reflecting on his relationship with Oliver.",7rfed5
dw6a37c,"Thanks for the very kind words. It really means a lot. I still haven't gotten over the movie though, but this time it's becoming a nice lingering feeling. I've really made some great improvements mentally and emotionally. And now all I'm doing is obsess with Timothée. Well, i just can't help it. Big thanks really.😊",7rfed5
dsxuf29,"When I saw it, there were three people sitting in front of me - 2 men in their late 50s or early 60s on either side of a young man probably in his early 20s. We were all headed the same way after the movie and I overheard their conversation. It came off to me like the older men saw the movie as their fantasy with the younger boy pushing the idea and being sort of relentless in his pursuit.",7rfed5
dsy9cyc,except there has been countless movies with similar romances and received no backlash lol. stop trying this ,7rfed5
dswnmnr,"It wasn't overall, there were just bits here and there that made my eyes roll. Poems and some blocking. Like, I could see vividly in my mind the director (in my mind he has a french accent) explaining: ""Nou you walk around ze fountain in different directions becauze of inner turmoil! But zen you talk and meet at ze ozer side and you connect!"".",7rfed5
dt0fxrq,"Oh, man the ending, I mean did he turn around? Did he called him Oliver? Am not even attached to anyone and I feel as if I was Elio.",7rfed5
dt6x86h,It was two different groups. They left at separate times. I just don’t get why they would pay to see a movie knowing the subject matter and then just leave..,7rfed5
dtbkemc,But it was!!,7rfed5
dsx19t9,"Did you not see what I wrote? THEY DON'T LOOK THE AGE THEIR SAYING THEY ARE. Elio Looks like a fucking preteen, and Oliver looks old as fuck. Also college students, especially ones who are in a post grad can be in their late twenties/early thirties.

It made me uncomfortable. I totally get the point of the movie. Still can't control my reaction to it.

",7rfed5
dswr1l0,"It might be missing the point, but Oliver looking twice Elio's age just feels wrong, regardless of what their stated ages are.",7rfed5
dsxc9zr,"It's more of an issue of the adapting a book where you take the characters by their word and then casting two actors who have a significant age gap. Armie Hammer fits because he is an Adonis who would be very enchanting to someone discovering their sexuality. The book probably never has a discussion about the age because it wasn't by that much and in Italy where the age of consent is lower. 

However, you can't help but notice it when the relationship is put in movie form. Michael Stuhlbarg never even seems uncomfortable with the idea of his son and this older man have a relationship. It gives the movie an irresponsible attitude (and even the father's speech at the end) without actually addressing the issue. ",7rfed5
dsydatl,Not if they were cast wrong. Sorry. ,7rfed5
dszezh3,Isn't this pretty much exactly what Kevin Spacey got in trouble for? Or am I mistaken?,7rfed5
dtk0dhq,"""Context doesn't matter when it comes to sjw virtue signalling.""
",7rfed5
dt0fw32,[deleted],7rfed5
dt2ldpv,"A friend and I were swooning over her the whole time. Excellently played and we got to know her very well by different little situations. Especially when the argument was going down at the table and she's like ""He's American!!"".

Weirdly, I think that both parents knew but they were also dancing around it with each other. ",7rfed5
dta66lo,She knew from the very beginning. Probably even before the dad,7rfed5
dt5h4nz,It is definitely a bittersweet film,7rfed5
dsxfhpf,"IMO if reading the book is necessary to pull emotion out of the film, a film is unsuccessful. ",7rfed5
dswn3t1,"If people are going to keep discussing the same film, I'm going to post the same opinion on it. It happens all the time with The Last Jedi, Blade Runner 2049, and other films that Reddit loves arguing about, so why can't I post this in different threads?",7rfed5
dswn0tv,I knew I remembered this comment! ,7rfed5
dt2lyu1,"As a bisexual man myself, I think context is important here. Given the amount of sexual abuse of young men that has been uncovered in the last year, we are clearly in different territory. It's hard to think about the premise of this film and not think about the Spacey / Singer scandals, just to name a few. 

I thinks it's hard for Hollywood to say ""we're cleaning out the sexual predators"" and honor a movie where there a kid at the edge of consent and the male is at least 7 years his senior (but oddly plays it much older). It's just not a good time. 


",7rfed5
dsy9hs2,"I think the woody Allen ones are regarded as creepy.  

This is a very interesting list to look back on. 

I really loved the film. Just curious in today’s climate because I do think that a 17 year old and a 31 year old is problem",7rfed5
dv9rcox,BUT THE LGBT COMMUNITY NEVER GETS TO HAVE THESE. IT'S OK TO LET US HAVE NICE THINGS. ,7rfed5
dvv2id6,https://www.reddit.com/r/movies/comments/7hiroq/disappointed_with_call_me_by_your_name/?st=JEVUNQ4Z&sh=10980e7c,7rfed5
dt2dzij,"Interesting idea. I had not even thought about the fly but now that you mention it - the fly is obviously present and intentional. 

I noticed it was crawling around on him at the final crying scene, which was in winter. 

>The average natural life span of fruit fly adults in optimal temperatures is 40 to 50 days.

like.... their relationship? ",7rfed5
dt2y4th,"And if you don't have time to read, get the audiobook.  It's incredible.",7rfed5
dt2i05b,"Can recommend the book as well. I read the book in one sitting because it's so hard to put down after having seen the movie, knowing all the stuff that's going on in Elio's head. Few hours later, watched the movie again as well. Couldn't recommend one without the other.",7rfed5
dsx63h6,"That sound design, tho...",7rfed5
dt090i3,"Two scenes actually, he tastes the peach before he sees it.",7rfed5
dswn0sh,Several sex scenes huh? Are they like good to watch with my parents?,7rfed5
dt09026,"Both guys have brief rear nude scenes separately, and Hammer's ass is on display when they're lying in bed together after a love scene. I'd say those are at least as revealing as the scene you mention, though the only penises shown in the movie are those of ancient bronze statues.",7rfed5
dswn2lr,You are wrong... You see Marzia's breasts during the sex scene ,7rfed5
dtd9jc9,"Oh damn. I really thought Oliver was supposed to be in his mid 30's at least. Idk if that really changes the dynamic though because I'm twenty one and I feel like a completely different person, maturity wise, than how I did at 17. ",7rfed5
dtf30pk,A film shouldn't be better because it's taboo. The homosexuality aspect doesn't change the fact the film was mundane. Take Moonlight or Brokeback Mountain. Both had homosexual content and were great films because the story was good. I didn't take anything away from this film aside from Oscar bait. ,7rfed5
dtf7gi6,It made perfect sense to me. I just couldn't take the ending seriously after I had lost complete interest about half way though. ,7rfed5
dteouh7,"It's very possible. Then again Lolita gets praise. But Lolita is actually a good story and not boring, mundane and long winded. ",7rfed5
dtorzjz,THANK YOU! I don't think the movie would get as much positive attention if it was an underage girl and a grown man or even an underage boy and a grown woman.,7rfed5
dsxksyz,"I haven't seen American Beauty. After reading the synopsis on Wiki, I feel like I'd feel more explicitly uncomfortable about AB, given the much bigger age gap (completely illegal in all US states) and lopsided power dynamic between Spacey's character and the cheerleader.",7rfed5
dtb45nx,"? I know that, which is why I said *many* parts of the US, not *all*.",7rfed5
dtiqxb1,"Not *allegedly*. Oliver's age is explicitly stated in the novel.
[Edited for typo.]",7rfed5
dvfgifa,I agree. Great performance but he looked in his thirties. ,7rfed5
dtqgog3,Yeah but the age gap is much more significant when it’s 17 and 23 versus like 34 and 40,7rfed5
dusxtv2,"Yeah, I am, and I wouldn’t be surprised if the societal differences contributed to my interpretation.  I still loved the movie but every so often I’d feel uncomfortable due to the age difference ",7rfed5
dtct8kb,I strongly disagree.,7rfed5
dteaq6q,Lol no way. And I thought get out was average. ,7rfed5
dtit0q0,So......you couldn't be bothered to read what I wrote. Read the rest of the chain of my comment and you'll see that another redditor and I discussed Lolita specifically. ,7rfed5
dtehbrc,"yeah, Elio's parents are very understanding.",7rfed5
dtfykiv,"""/s""",7rfed5
dtg7dbb,/s buddy,7rfed5
dsx6o5e,"[I can eat a peach for hours...](https://www.youtube.com/watch?v=C3S0QZeDGdE)
",7rfed5
dsxx711,Fascinating. Thanks for enlightening me.,7rfed5
dtw9zdw,Amazing! Thank you ,7rfed5
dt3lfkk,[deleted],7rfed5
dswj8pr,It flew by like summer. I would've easily taken another 132 minutes.,7rfed5
dt29pzw,[Ten Long Years of Trying to Make Armie Hammer Happen](https://www.buzzfeed.com/annehelenpetersen/ten-long-years-of-trying-to-make-armie-hammer-happen?utm_term=.qyGKdrN9v#.tipEW1Dg0),7rfed5
dsy9r9x,"Agreed, I loved both films and to compare them is bizarre because they are of completely different genres. But I gotta say, CMBYN is just unforgettable to me, one of my favorites of all time.",7rfed5
dt0fr2q,"3 Billboards was a fantastic movie.  Loved every second of it.  

...but it's not a movie that lingers in my mind the way CMBYN has.",7rfed5
dtb3wxo,Three Billboards is one of the most overrated films I've ever seen,7rfed5
dt2k1er,Okay that's what I got out of it too,7rfed5
dt2qd2x,He had a comment to Oliver about Classical statues inspiring desire that made me think he could have leanings that way as well.,7rfed5
dtiow53,"The apricot etymology test, which is not in the novel, confuses things for me, because in other respects, Oliver seems to be on very familiar terms with the professor; he calls him ""Pro"" and the professor lets him despite the fact that he normally doesn't like being called that. Doesn't that hint at the fact that Oliver had been the professor's student before?",7rfed5
dt2lhhu,"Essentially, yeah. My brother, who's straight, said ""It was so well acted. The dialogue was not over the top. Overall, it was a great movie. Although, it may be an LGBT film, I found a way to connect to it.""

He even asked a lot of LGBT related questions. Personally it's the first LGBT movie I've seen that didn't fall into every terrible trope you could find. 
",7rfed5
dt0kwos,"I'm gay.  I'm tired of mediocre ripoff trash getting inflated praise because of the inclusion of a gay romance.  This movie has been done a hundred times and better.  This is 2017 ('18 now).  It isn't (and shouldn't be) daring or impressive to make a move about gay people anymore.

Last year's moonlight, on the other hand, was brilliant.  Light years better than Call Me By Your Name.",7rfed5
dtgmstl,"How old was the Hammer character? And the boy? 

I rest my case.",7rfed5
dt06jy2,"Yeah, my VR heaven is going to be *Under the Tuscan Sun*.",7rfed5
dsyk4p5,"But on the other hand, you get to roll around in meadows and swim in beautiful creeks while looking gorgeous, so that's got to be nice, right?
",7rfed5
dsyk2jv,My question was: how the hell is Ellio's family that rich given that the father is a professor? Even a tenured one is not going to have that kind of lifestyle. Maybe the mom came from money? ,7rfed5
dswx2yo,link please,7rfed5
dtx4g8e,I really hate that I thought of this during that scene,7rfed5
dvxkq7d,"I just finished watching this movie and I cried like a little bitch and this 1 month old comment made me giggle like a little girl, thank you. ",7rfed5
dt0ovfk,Every. Fucking. Thread.,7rfed5
dt0fkpn,"Yes, it was. I caught this on second viewing.",7rfed5
du3o64u,Hahaha same! But i felt better knowing it wasn’t actually his bed.,7rfed5
iw17bph,what the hell this is 4 years old,7rfed5
dus01z1,"Because I let years of depression wear me thin, and used her as a crutch to try to work through it ",7rfed5
dudc4ka,"Sure, thanks. The point still stands. ",7rfed5
dv2wg3m,Pretty sure he's looking just off camera. ,7rfed5
dtvt6kq,"The very last shot, [the kid looks at the camera](https://inalonelyplacefilm.files.wordpress.com/2015/02/the-end.jpg)        
[Full scene](https://youtu.be/a4jGNoag_1g) ",7rfed5
duijc6v,"Thanks, I sure loved the film, even though I missed that look. As said, the ever-chattering slightly homophobic crowd was already starting to leave...",7rfed5
dtaekiw,I couldn't help but think of the diner scene from Shape of Water during the speech.,7rfed5
dtclvaf,"Yeah, I managed to keep it together throughout the entire movie until I got to the speech scene, and then I just crumbled. It especially struck a chord with me being part of the LGBT community myself, since my parents are pretty conservative and could never be so accepting of my sexuality.",7rfed5
dusuicd,"Indeed, a beautiful speech.

What I liked from the interview with these two, was how Armie Hammer put it, what was nice about the movie was that nobody had to pay for it--there was no shame, nobody needed to hide anything, the family was accepting and understanding, so it just turned out to be a relaxed study of desire, coming-of-age, whatever you like to call it--all in the lavish Italian landscapes, beautiful cinematography and wonderful music by Sufjan Stevens. 

A highlight of a movie of the year, for sure.",7rfed5
dt9h4no,"It's weird. I felt sad, I loved the scene, I am somewhat LGBT, hell I am going through an identity crises about my gender and really reacted to the line ""How you live
your life is your business.
Remember, our hearts and our bodies
are given to us only once. "", but this movie didn't make me even close to cry. And this year I have cried in more movies than any other year. Granted it was only 2, The Big Sick and Coco, but both of those stemmed from real life experienced.",7rfed5
dtfhcqf,">I can only imagine how much worse this erosion can be for some in the LGBT community as they get rejected for expressing love throughout their life.

Huh. Is it weird that most of the gay guys I know seem to always be dating or at least banging someone whereas the straight guys always seem to be looking for a girlfriend or hookup? Is this anecdote not actually an accurate representation of reality? ",7rfed5
e1azqtv,I loved the monologue but I just couldn't agree that is seemed like Elio's and Oliver's relationship after 6 weeks was more than what he had with is mother ,7rfed5
dw0047h,Wow I am speechless.,7rfed5
dvfci8b,"Ms. Is for women

It should be Mr. Chalamet",7rfed5
dszyzd8,"I think it was supposed to highlight the coming-of-age themes in the movie.  It wasn't really expected in the movie because the film if from Ellio's perspective, and he wouldn't expect his dad to say something like that.  But when that speech comes, he realizes his dad knows a lot more than he lets on and is more empathetic than Ellio had known.",7rfed5
dsx2ey4,> Wilson Dafoe,7rfed5
dsy7ym1,"Damn I'm torn but Dafoe was absolutely wonderful in The Florida Project, I gotta give it to him.",7rfed5
dt2eh7i,Most likely Rockwell. ,7rfed5
dsydog9,It's gonna be between Dafoe and Rockwell this year.,7rfed5
dswpa5j,He's in The Shape of Water? One more reason for me to look forward to that movie. Been a fan of him since A Serious Man.,7rfed5
dsy4z2s,"It isn't unheard of to be nominated for one incredible scene though. Viola Davis in Doubt being one of the more recent examples. 

But I do think it'll come down to Hammer vs. Stuhlbarg for one of the last 2 spots and Stuhlbarg is probably going to lose that fight. But with Dafoe, Jenkins, and Rockwell the only 3 sure things and Hammer, Stuhlbarg, Harrelson, and Plummer fighting for those last 2, he still has a chance. But you're right, it's probably a long shot. ",7rfed5
dsws4l9,"I'm not sure why you were being downvoted. I couldn't agree with you more. The whole movie, I was wondering where the hype for his performance was coming from, then we got the monologue at the end.",7rfed5
dszs9l2,"I understand, so you felt some shared experiences with the characters in the movie. Thanks for sharing.",7rfed5
dt1gvxf,A Ghost Story was one of my favorite films of the year until the last 30 minutes fucked it all up lol,7rfed5
dswkj0d,"Then Elio asks why Oliver hurts him, or something like that. 

I remember that parallel being pretty awesome.",7rfed5
dt9bq24,"I really felt Elio was an asshole at that point. He kind of just said, Oh well. And in the end, she forgave him. I didn't like that part.",7rfed5
dt0e5j9,Luca (the director) said the scene at the end between the two was lifted from one of Ester's dad's (Philippe Garrel) film,7rfed5
dsz6k8e,[deleted],7rfed5
dto0zqv,"I agree with you. The film is a guide-book on parenting in some ways. The essence and code of parenting is support (which is meant to be a loaded word). To me, this was another example of Elio’s parents displaying good parenting: supporting both girls with love, attention, and food. What an example to set. ",7rfed5
dunru7w,"""Adult boys"" is a good way to put it.",7rfed5
dsx64rh,[deleted],7rfed5
dt5a13z,[REEK! REEK! REEK!](https://gfycat.com/AnnualImperturbableKitty),7rfed5
dt1r8wb,"He was only 29? I would have thought 39. Not a dig, he's hot; he just seemed older to me

Edit: omg he's 10 days younger than me. I'm so old",7rfed5
dt0kfdz,It really is incredible.  You can see in all the interviews they've done together that their chemistry is very real and is unlike any straight actors playing same sex lovers I've ever seen.,7rfed5
dt2tci2,"Some of that is if they're going to be paying millions of dollars to name Hollywood stars, the producers want them in front of the camera working every minute possible.",7rfed5
dswmob5,"Same, him getting a nomination would mean he might perform at the Oscars and that would be amazing!",7rfed5
dswomfs,Me too but being realistic I think they'll likely split votes and neither will get nominated :(,7rfed5
dswwl2d,"I know Remember Me will win but I want Sufjan on stage atleast.

But then again maybe the Oscars will get Charlie Puth or Zain Malik  to actual perform the Sufjan song on stage ",7rfed5
dsxw7a4,Before I knew anything about the movie I figured I had to see it since Sufjan was being featured on the soundtrack. The whole soundtrack was pretty great but those two songs really added a lot for me.,7rfed5
dt6581w,welp,7rfed5
dt1pkm6,"They're both so, so good.  I can't decide which one I like more, great songs!",7rfed5
dtz1kdv,oh you,7rfed5
dszl5e2,"Agreed. I have never had that experience before, listening to multiple different people literally crying in the theater. Incredible.",7rfed5
dsxgqfb,"I haven't seen the film, but it's such an emotional song. I'd imagine it brings that much more to the scene. ",7rfed5
dswkb4f,"Walking out during one of the best scenes of the film.

Shame on them.",7rfed5
dsztl0i,"My theater was full of idiots who were talking and using their phones and filing out. I was able to block them out and still appreciate the greatness of that scene, but it is a must to watch that film when there is the least amount of people in the theater. The lights also turned on at the beginning of it which probably encouraged more of the dumbasses to get up and talk. ",7rfed5
dsx84fw,Yep I was in the same position when I saw this a month ago. I’m still pissed.,7rfed5
dswt8tk,"I seen this movie last night and unfortunately ended up sitting at the front, so during the ending scene I was totally engrossed, mind running a mile a minute... then people started walking by, right in front of me :/",7rfed5
dt5p3ss,Lights were down where I was and people still got up. I was half-tempted to say to them when I left “why’d you leave early? Oliver came back!”,7rfed5
dt2ytpf,I would pay 4 dollars to give you negative gold,7rfed5
dswph9r,The theater lights turned on in the beginning of this scene :/ I was so chocked that lots of people were leaving. My friend and I stayed and I almost cried during this scene. ,7rfed5
dsx3pu1,"Oh right. Thanks. It wasn't that impactful for me cus Master of None did the same thing, and I definitely appreciated it a lot there.",7rfed5
dsyjsqq,"I honestly thought it was going to end with him saying ""Later."" ",7rfed5
dusbiv9,"I know I’m a little late to the party but I just got out of a screening and this part broke me as I had been in a somewhat similar experience. I broke up with my ex because he moved away. Unfortunately, definitive words were never said but we kept flirting. I knew he was visiting home for the holiday season and he casually mentioned a girl he attempted seeing or something of the sort and that made me realize we probably wouldn’t have anything further and our long distance flirting didn’t mean much. ",7rfed5
dt12ho8,how did it end? also they're planning a sequel to the movie right,7rfed5
dsww2yp,I’m glad they didn’t replace them with Christopher Plummer’s balls. ,7rfed5
dswwshq,"Imagine being Luca

Imaging setting up the perfect shot, waiting for the right light and weather conditions for 
*MAXIMUM AESTHETIC* , having everyone act their heart out and it's all perfection. And thinking to yourself that this is the one they'll remember your for.

And then you notices it......",7rfed5
dswkn9y,Can't wait for the ***X-RATED UNEDITED ULTIMATE EDITION***,7rfed5
dswlmyx,Why do they gotta do us dirty like that ,7rfed5
dswlrma,Oh god... I forgot about that,7rfed5
dutvubx,Boo editing,7rfed5
dswonpk,Did they really?,7rfed5
dt11y7u,that was a quite interesting read,7rfed5
i80ynmw,Marketing nonsense. They run this story with every other super hero film too.,7rfed5
dtlvu54,Do you have a link?? Or a pic of the jacket? I need it too,7rfed5
dsys9g5,"No I mean there’s a scene where he’s wearing a shirt from the band Talking Heads, and they’re one of my favourite bands so I loved that inclusion. ",7rfed5
dt20pnx,"where did you find that/ hear about it? im interested in trying to find all the outfits in the movie, more specifically the necklace he wears throughout.",7rfed5
dt06wom,It's why he retired.,7rfed5
dsydwr5,Imagine if DDL ever did a biopic on Alfred Kinsey and really got into character.,7rfed5
dt0msoj,Wow. Now that’s an interesting bit of trivia. Next time I watch it I’ll have a new appreciation for that scene. Thanks for that!,7rfed5
dsxfp24,"> *weird hand signal*

I thought he was making the sign of the cross, as if ""blessing"" Oliver (blessing him with his approval, in this case)",7rfed5
dt125b3,"I can literally hear his voice because I saw the trailer tons of time too, especially because of the wonderful music in it ",7rfed5
dswq4do,"Ah ok. Loved the film, haven't memorized it, yet.",7rfed5
dsxwey6,Gets.me.every.time.,7rfed5
dt2qp2q,"Chalamet says the line in French as well and because of his crying, it just comes out like a bunch of random sounds, but that scene doesn't even need subtitles, as his performance transcends language. Everyone knows what the scene means and what he needs.",7rfed5
