comment_id,comment_body,submission_id
eddnk3e,"Objectively, it was an amazing movie. Cinematography, acting, dialogue all as perfect. But holy shit how boring is it to watch",a4rv1y
ec3xqir,"Gravity is my favourite movie though. And I love this movie as well. They're actually very thematically similar. 

And Cuaron is my favourite director. ",a4rv1y
egv1ox8,Oh come on... leave the man alone. ,a4rv1y
ec3xsxw,"You can't call the symbolism phoney, just because you didn't get it. Or scenes pointless when they obviously weren't. Or the cinematography irrelevant when you have no idea what you're talking about ",a4rv1y
ebtyhfj,"> Remember the way she stared at the NICU? She looked pretty freaked out.


I think she took the earthquake as an ill omen. Same with the New Year's drink.
",a4rv1y
edml6tm,"I think they were talking about the scene where Cleo looks at the babies in the infirmary. A little girl with her grandma were talking about a newborn baby girl. Then there was an earthquake, and a piece of ceiling landed on one of the incubators. Considering Cleo's baby was a stillborn girl, the mentioned scene could be considered as heavy foreshadowing.",a4rv1y
ebslksp,"I've tried that and it wants me to enter a ZIP and then it says nothing is playing close. I don't care about that. I just want to see ALL locations it's playing.

I'll try again though. Thanks!",a4rv1y
ebtswg0,Gotcha. Thanks,a4rv1y
ebtswxa,"Colonia Roma, also called La Roma or simply, Roma, is a district located in the Cuauhtémoc borough of Mexico City just west of the city’s historic center, and in fact is no longer a single colonia (neighbourhood) but now two officially defined ones, Roma Norte and Roma Sur, divided by Coahuila street. Currently Roma and neighbouring Condesa are known for being the epicenter of hipster subculture in the city, and rivals Polanco as the center of the city's culinary scene. Besides residential buildings, the neighbourhood streets are lined with restaurants, bars, clubs, shops, cultural centers, churches and galleries. Many are housed in former French-style mansions dating from the Porfiriato period at the beginning of the 20th century. Roma was designated as a ""Barrio Mágico"" (""magical neighborhood"") by the city in 2011.",a4rv1y
ebsw7aw,[deleted],a4rv1y
ebt7p6z,I see it on TV but not mobile/browser.,a4rv1y
ebu24ol,Can you? Netflix didn’t allow me on my PS4 or computer.,a4rv1y
ef4jgto,Ya i liked Roma more,a4rv1y
efi3byj,I like Roma better. The Favourite isn't as strong.,a4rv1y
efjohh6,"I'm team Favourite. I usually can't get into foreign films, but I also have a really hard time with movies from the 18th century time period in England. They might as well be speaking a foreign language. However, I was able to thoroughly enjoy Favourite while Roma was decent, but not to special to me. ",a4rv1y
eg6pe1x,Team Roma. ,a4rv1y
eh310f6,Team neither. I hated both.,a4rv1y
eh30ziu,"Green Book and Black Panther are the only two I actually enjoyed. BP in no way deserves to even be nominated for best picture though.

What a shit year.",a4rv1y
ed2fl3v,"Absolutely. There was actually a lot of plot in this between the miscarriage, the protests and the dissolution of the marriage. More than it needed, in fact. ",a4rv1y
ecx5qyo,Interesting! Expand please,a4rv1y
ed0fihx,I agree.  You could probably replace every character except Cleo with a piece of paper with their name written on it and the film would be the same.,a4rv1y
edh201z,Can you give some reasoning? An opinion without any rationale for it is not useful.,a4rv1y
ed76fg1,How crazy is your life that a riot occurring while you’re shopping with your employers mom causes you to go into premature labor isn’t “something happening.” ,a4rv1y
ecs8aeh,"Same. Cuaron is my favorite director and I totally respect this film. But at the end of the day I need a strong and fairly straightforward narrative.

Maybe that makes me a simpleton but it's just the way I'm built.",a4rv1y
ed8w1z7,"This point was also reinforced near the end of the movie where Cleo saves Sofia from the tide, and when they are back in the house she just asks her for a smoothie (I think). sticks out like a punch in the face. she literally saved them from drowning but once they are home, its back to being their servant.",a4rv1y
eby50uh,"Also the cinema scene and the training were pretty cool in black & white  
But I would be very curious to see the whole ""family in vacation"" segment in color (the party, the fire, the countryside shot), although they looked amazing anyway",a4rv1y
ec0b224,"But then shouldn't it be from the perspective of one of the kids? We're following the maid, whose story he only knew peripherally (though I think before he made Roma, he talked with her to get more info).

For instance, the whole sequence involving the death of the baby - the kids know nothing about it. I guess they know she lost the child, but the actual, harrowing experience would have had no recognizable effect on the kids.",a4rv1y
ebzvg92,">examining for example,  everything in the children's ' bedrooms for possible references

One of the things that really caught my eye was all the ""product placement"" of the film. They used the same logos, packages, mascots, fonts and other visual elements belonging to that time as seen in the beer bottles, the cereal boxes, the sodas, the toys, the chocolate milk can, the magazines. That was a great plus in attention to detail ",a4rv1y
ebyjyhm,What were the other ones?,a4rv1y
ehwbp60,"I didn’t have any issue with the pace at all.  My issue was since I was concerned going in that the movie would be an ideological moral statement designed to check those Oscar boxes, I knew exactly what was going to happen almost every step of the way.  ",a4rv1y
ei3ge7a,Using film or story to make a contrived moral point rather than creating an organic natural piece of art.  There’s no exploration into the creative unknown when you’re trying to “make a moral point.”,a4rv1y
eo0e6uc,"The key is whether or not the ideological or propagandistic themes are consciously, or unconsciously inserted, and this film fell firmly on the side of its propagandistic themes being deliberately inserted, therefore it made for poor storytelling and art from a purity standpoint.",a4rv1y
ebtbimf,End credits too?,a4rv1y
ed5ncq4,"I think Sofia is not trying to remind Cloe that she is not part of the family. Ask for the tea, is anther way to recreate a patriarchy context. The mom is ""serving the man of the house"" through Cloe.",a4rv1y
ed6srba,"Yep, that was my take on it.  
*""Who the hell does this peasant think she is bonding with my son?""*",a4rv1y
efju3gs,This is the exact moment I said “no mas”,a4rv1y
efjmup6,"I was both trying not to stare at his dick, and very entertained by it flopping around. Is it normal for people to practice martial arts naked?",a4rv1y
efmckye,"So, you gave up after 20 minutes?",a4rv1y
ef427iw,Lol black and white makes you think of Instagram. Good lord. ,a4rv1y
ebwzjo1,"Saw it at theater last night and I've never noticed the surround sound so prominently separated before. I kept getting the urge to turn around and tell those damn kids behind me to shut the fuck up before remembering, ""Hey, that's the soundtrack!"". ",a4rv1y
ebxf1z8,"I think this is also it. I have a huge 4k tv, but just a sound bar for audio. I was in my living room surrounded by christmas lights and decorations. Sound's not bad, but I just KNOW this would be so much more immersive if I could see it in theaters. It's meant to be seen that way. So it kind of pisses me off that Netflix is my only option, even though it's nice having it available so easily. ",a4rv1y
egir5je,"I’m aware that people watch movies for different reasons I stated that before by saying we all view movies to experience something different whether it be past, present or future concept or based on true events, facts, history, etc. That’s not the point. The point is that lately mainstream media, education, and pop culture has been pushing ( more like forcing down our throats ) a this singlar messages “ if your not either a minority, homosexual, or female or all together “ then you can’t be considered a work of art. Forget about quality, story or inspirational message... that doesn’t matter, what matter is what’s stirring up the pot, to make a diverse impact in society. So if you’re not putting ethic/race character or homosexual characters/sexual scene then you’re closed minded and don’t understand what is hot and considered to be unable to see why it’s a masterpiece. BS! I have gay friends and friend from all walks of life and to be honest they don’t like to be used as a propaganda. Also before you @d0ubl decide to label me, maybe you should ask before making comments. I do indeed enjoy a good slice of life movies, my most recent one which was worth watch was “wonder,” another old one “Crash” you want some more, how about “secret life of Walter Mitty”, “Slumdog Millionaire”, “Manchester by Sea,” “Life of Pi”,  “The man who knew infinity,” “Black Swan,” “Joy Luck club,” to name a few. You know what they have in common? Deep rich story one that grabs you and leave you with inspiration thought/meaning. I’m not trying to get political here, that’s just how our current state is world wide. For example the latest blockbuster movie coming up “Captain Marvel” with the narrative being pushed “The Future is Female.” Huh... 🤔",a4rv1y
ehq4gr8,"My name's Oscar, but this movie certainly did not give me a boner!",a4rv1y
egxnvgs,"Couldn't have said it better. It will probably win everything, the lobbying for the movie has been relentless according to this NYT article: https://www.nytimes.com/2019/02/17/business/media/netflix-movies-oscars.html",a4rv1y
ehotu5d,I didn't see any overexposure on my TV. Did you watch it on a set that's calibrated?,a4rv1y
ebuz6js,"My husband is a chef. Probably that is why I made that comparison. Subtletly is different to blandness. Or ""mono-tasting"" for that matter. Roma is one note. The spinning camera over and over. The close ups to shit, cigarettes, ring, toys. A succession of takes on stuff where we are suppose to find meaning. It's pretention without substance. I dislike it because it is forcibly trying to teach me something I already know. Maybe because I am Mexican and all too familiar with the scenes.

BTW, it is not translation. For reference, use ""Y tu mamá también"", ""El laberinto del Fauno"", ""Matando Cabos"", ""La Ley de Herodes"". ""Como agua para chocolate"" is incredible (kind of funny in Spanish because the love interest of the protagonist is an Italian actor that had to be doubled in Spanish, lol). Those were fantastically acted with good dialogue, interesting stories. I bet there are more. When a movie is well acted, you can convey that in whatever language. 

My biggest problem with Roma is the hype. The sentimentalism without actual resolution. Doesn't it bother you she remains a maid and that is all she is ever gonna be? It is a swing at the Mexican middle class and a self-defeating one. In my family, we have had one cleaning lady throughout my life (not a live-in one, that is for the pseudo-rich). She has helped my family in ways I cannot even explain, my family, in turn, helped her build her house, put her kids through school, sent her to take some nursing studies, she is insured and my mom bought a sewing machine for her when she wanted to start sewing as means to earn more money (she goes to our house 4 times a week for 3 hours). We are better because she is there and she is better because we are there. We love her beyond words (when she had it rough my mom and I talked to her for hours on end, day after day, like the friend she is) she returns that love. It has been a healthy employer/employee relationship. This portrayal is patronizing trying to be sold as ""a love letter""... I say to Cuaron: f\*\*\* off, we are not all like you and your family.

&#x200B;

&#x200B;",a4rv1y
edglt96,"> the dark-skinned servants who spoke the ""lower-class"" Mexican dialect


It's not a Mexican dialect.  It's Mixteco language, completely different from the Spanish language that most mexicans have as mother tounge. In fact Mixteco is older than Spanish.",a4rv1y
eddom71,I'm only an intermediate Spanish learner and I'm a bit embarrassed to say I didn't realize a huge difference in how Cleo and the family spoke aside from her speaking Mixteco. What makes their Spanish more proper than hers?,a4rv1y
edg5lze,"I am not Afgan.  I'm sure I experienced and related to Kite Runner differently than you; you would have so many points of reference, recognition and memory that a U.S. reader would not, but these are universal themes; the people, systems, issues, in Kite Runner were absolutely relatable and moving to me.",a4rv1y
ed8l202,"Coming from a middle class Chinese family who emigrated to the US to a lower middle class status, this movie speaks nothing to me. I didn't have or know anyone with a servant, pregnancy out of wetlock is very looked down upon in the culture, abandoning family is also very looked down upon in the culture (formal divorces is not the same), never been in a violent student protest before, and my parents actually parented properly and watched me when I was at the beach playing.

I have never seen kite runner, but I love slices of life movies so I might check it out. Lost in Translation is one of my favorite films. I also enjoyed Lady Bird. I couldn't exactly relate to Ladybird either, but at least there is a narrative there that made me care about the characters. After 2 hours I still didn't care about Cleo. She showed almost no emotion, subtle or not, except for the birth and beach scenes but the movie is already over by that time. She was just...kind of there. Just not an interesting character in my perspective.  I cared more about the fact that the dog shits way too much and that no one is picking it up making me think she is a terrible housekeeper.",a4rv1y
ed8zqq0,"Thanks for the useless reply. I guess I need to have shitty parents, a troubled family, and throw some rocks at cops in order to live my life with excitement.
",a4rv1y
eby9hzb,[deleted],a4rv1y
ec7u5vo,What? Oh man I missed it. Netflix cut out ,a4rv1y
ebyam1a,"Thanks for your input. A lot of the things went over my head, but the way Cuaron creates a world is second to none. ",a4rv1y
ebrp7gp,"This is a very thorough answer, thank you!",a4rv1y
ebrnual,"I tested it for a few minutes this morning and got a 7.1 soundtrack from a 4K AppleTV running the latest Netflix app and TVos.  I don’t have height channels but my receiver shows up as Atmos capable on the AppleTV.  They’re doing multichannel sound on at least some platforms.

The sound design in this demands Atmos but 7.1 sounded really good and the soundtrack is completely immersive.",a4rv1y
ebsahb1,I saw this in a theatre with 4K projection and Dolby Atmos sound. It looked and sounded PHENOMENAL!,a4rv1y
ebx1cip,Thanks i didn't know that it was his neighborhood. ,a4rv1y
ebszqz9,That's so cool. I had no idea that was a real film. I'll have to search for it. It looks really interesting.,a4rv1y
ebvx6gi,"I really appreciate your perspective! As an African American woman, I did notice the juxtaposition in how Cleo and the working class differed physically from those who employed them. Especially Fermin calling Cleo a servant with such disdain, as if it were a slur. It's something I'd love to see touched on more directly in another film by Cuarón. 

It's really distressing to hear that people have made such vulgar comments about Aparicio. I thought she was so striking and it's really unfortunate that others can't see past their narrow views of beauty. I can't wait to see her during the awards circuit. I'm sure this will win many. ",a4rv1y
ec8raf3,"maybe, I'm just in denial ",a4rv1y
eccpog4,"Hahahaha yes, I got to know that after posting. Still, I stand for my interpretation, as it suits the themes of the film.

Plus, art is interpretative. That's the beauty of it: even though it's not the intended meaning, we can build others on it. Cheers :)",a4rv1y
ebwq1pn,"They had an emotional reaction to a piece of art, nothing wrong there.",a4rv1y
ebxhezs,"Happened the same to me. It wasn’t a particular scene that made me cry but an accumulation of feelings that just made start sobbing and from that point on I couldn’t stop. The last 3 scenes, riot, hospital, beach are so good that I didn’t stop.",a4rv1y
ebybmeq,"Nail on the head. Political takeaways aren't a priority for the film, yet I don't think it ignores a lot of details its main topics bring up -- I think it's a very observed and nuanced movie that isn't meant for easy didacticism. 

Sofia and Cleo (and the grandma) are definitely meant to mirror and contrast each other in various ways as matriarchs of the family. Sofia may have greater authority than Cleo as her employer, but her privileged socioeconomic status has made her complacent to a fault. Conversely, Cleo is stronger and more resilient because of her poor upbringing.

I don't know enough about '70s Mexican society and politics or the specific protest it portrayed, so can't really speak on those. But I think Fermin was an interesting character who mirrors a lot of people driven to violent political causes -- his ultra-seriousness comes from a life of hardship, and his passion/dedication to training that he claims to have given him guidance in life nevertheless fails to alleviate other faults like his bitterness and cruelty. He's a naive, idealistic warrior seeking war for a messy/contradictory notion of purpose.",a4rv1y
ed2hwwz,"I wish I could have been a fly on the wall and then I might have actually understood what was happening to this family. We are given such small slices that none of it really makes any sense, and I’m left without really caring about any of the characters.

If context is a spectrum with nothing on one side, and spoon fed on the other, I’m looking for something in the middle. Anywhere in the middle.

I wouldn’t care at all, but this movie is getting such high praise and I just don’t get it. I understand that the technical aspects of the movie are amazing, and I’m not going to deny any of that. The scenes and settings are wonderfully done. But the story takes such a back seat to the rest of it and I’m wondering if it’s a giant troll job.",a4rv1y
ed2fe9z,"If anything I thought there was too much plot, the Fermin encounter at the shooting was the silliest part of the movie. I would agree with the comment that real life is not character development and narrative, but this type of movie is also not for everyone. 

I thought it was beautifully shot and staged and well worth seeing. I perhaps liked 'The Florida Project' better for this type of movie but they were both very good.",a4rv1y
ei8jw38,Oof this comment didn’t age well. Nice of you spamming it,a4rv1y
ebrq4bs,What a weird assumption.  Netflix has films across all demographics.  ,a4rv1y
ebro21u,"Netflix has 60 million subscribers, so I'm going to say the Netflix demo is ""everyone"". ",a4rv1y
ebssthi,Netflix people are probably too busy watching the Sabrina Christmas special,a4rv1y
ebugzzr,A director shouldn't alienate an entire gender from fully appreciating his film. ,a4rv1y
ebw2eex,How does that make sense? Its a male director.,a4rv1y
eh7hktz,"Yup, wholeheartedly agree",a4rv1y
ebt0n50,[deleted],a4rv1y
ebt4s19,[deleted],a4rv1y
ebsxxft,[deleted],a4rv1y
efdlm5r,A vast majority of the most upvoted posts do not.,a4rv1y
eh4kcis,"I work in professional theatre too, and I'm surprised your career path clearly hasn't taught you empathy. The responses in this thread include many Latin American people connecting with the film and seeing aspects of their culture delicately depicted on screen. It's fine that you didn't like it, but acting like you're better than people who do is quite a bad look. ",a4rv1y
eh4g6ab,Okay.. sorry you didn’t share my energy for it. I also went in with razor low expectations since I’m not normally good at foreign films given my add lol.. I liked it a lot. I hope you can watch again and enjoy,a4rv1y
ehvgmiu,"People that haven't seriously watched movies that were created before the 1970's will not understand what you're saying. This movie was literally made before, just different geographical and ethnic subjects, and with the same cinematography!  

My main complaint is that I have no clue who the intended audience is, nor what the creator expected them to take away from this motion picture.  

I predict that ten years from now this film will serve as fodder in discussions about the affects of sexism in mid-20th century Mexico. The one thing that was absolutely concrete about this film is the role sexism, subtle or not, played in the life of Cleo.  

Basically, I would recommend people to watch something like Elia Kazan's _America, America_ to get an idea of what this film could have been.",a4rv1y
ec7yi8p,"Film major here that loves slow shit, I personally didn’t see the appeal but I found it beautifully shot ",a4rv1y
ebt85b7,this? https://en.wikipedia.org/wiki/Corpus_Christi_massacre ,a4rv1y
ebtoql7,"The people who can appreciate long, over-drawn close ups of car tyres running over wild droppings of dog turd, of course.

I'm sorry, but did we not see the same movie here?! The cinematography was to die for. I'm rewatching this for the 5th time just to fully appreciate Fermín's flying karate penis and how it symbolises the turmoil of Mexican society in the 70s.

Get out of here with your primitive, uncultured views!",a4rv1y
ebry504,"Haven't seen Spider-Man: Into The Spider-Verse yet, so trust me!",a4rv1y
ecoc6wl,"Most of the people in that scene are real doctors/nurses not actors, which actually added so much for the realistic aspect of it.",a4rv1y
ecsdkmn,"I missed what she said, do you remember?",a4rv1y
ebygesa,To show up exactly there where Cleo was? Come on. ,a4rv1y
ebsls2v,"Yup, basically is a set-up. Corpus Christie massacre was 3 years after another bigger massacre in Tlatelolco, another neighborhood of Mexico City. 

The movie foreshadows that since the beginning not just with Fermín character but overall with the excessive PRI/LEA propaganda, when i saw it i realised where everything was going to when Cleo goes to find him and is implicitly said that the place and the training is owned and financed by State since there's PRI propaganda in a wall and on the mountain you read LEA (Luis Echeverría Álvarez, the president at that time). 

Coincidental? Maybe, it's convenient for the story but it's all set up pretty well.",a4rv1y
ebrstfn,"Just wondering, what would your pick be? Havent seen too many incredible movies this year personally",a4rv1y
ebt32w9,"Sometimes you have to sacrifice that for thematic reasons. Take out those two scenes and maybe the movie feels more ""real"" (if that's even possible), but you also have a fundamentally different narrative, one that probably is less rewarding if you ask me.  *Especially* without the beach scene.",a4rv1y
ebuev92,"As evidenced by this quote: ""We are alone. No matter what they tell you, we women are always alone.""",a4rv1y
ec3c760,[removed],a4rv1y
egyutkh,I saw this in a few different ways. The dog was obviously kept outside so it shows how different their experiences are. We keep dogs inside. They still love to have dogs but they don't live with them. They're dogs. This also made me think something was going to happen to the dog. Run over. Run away. Almost did at one point. So many American movies use the dead dog thing as a tear jerker. He didn't and that became a red herring. We were looking but it never came. I think the dog shit also represented how messy life is and can be. You can't fix everything and we're constantly wondering if and when someone is going to step in the shit. Only the dad does though.,a4rv1y
edvaaji,"Totally agree with Xenu_RulerofUniverse.

Bad acting, lousy scene blocking, terrible dialogues, wafer thin plot.",a4rv1y
ebuc2le,Thank you!!!!!!,a4rv1y
egryml2,Ever? You must not read a lot then.,a4rv1y
ebrtikp,"I can’t wrap my head around a month where we get Infinity War, ROMA, Black Mirror, Andy Dermis’ Jungle Book, Chilling Adventures of Sabrina Holiday special, Springsteen on Broadway and the Taylor Swift Reputation concert film. 

The amount of insanely high profile stuff in combination with their now usual holiday fare is ridiculous.",a4rv1y
ecol1cw,Thank You,a4rv1y
eclkclr,[deleted],a4rv1y
ebyi6ig,"God, that comes across as so condescending.",a4rv1y
ebtbynd,don't remember mentioning anything about pace. learn to recognize a good script.,a4rv1y
ecqkvb1,he's trolling,a4rv1y
ebtforw,"Black and white, nothing happens for 40 min, unrealistically""deep"" dialog from the kids about death/past lives, gratuitous artistic nudity. Maybe the second half is good but I didn't make it that far.",a4rv1y
ebt86x7,Seriously? I’m not even gonna answer lol,a4rv1y
ebyhk5f,Interesting that you didn't mention it in your review where you were at a loss to find *any* meaning it.,a4rv1y
ebsb052,When a film like Roma is too mainstream then you know you're dealing with someone whose tastes are far too sophisticated for us plebs.,a4rv1y
ebs7zzy,"no, it's because i dont like middle of the road and save movies who are nice to look at but spoon feed the audience and apparently offer nothing interesting enough to divide audiences at least somewhat ",a4rv1y
ebyhemp,Except Boyhood was entertaining and a hell of an achievement. ,a4rv1y
