comment_id,comment_body,submission_id
ebtsngt,"Pretty film. Dull at times, but largely engrossing. I will definitely rewatch it. Some things that stood out: 1) When Cleo told her boo that she was preggars and he went to go pee and get ice cream, the screen started to show a plane crashing.  I knew then that she was going to go through hell. 2) When Cleo hopped on a bus and went looking for boo, there were caskets being sold on the side of the road, including small ones for kids and even an infant. Brilliant bit of foreshadowing. Guess the ceiling falling on the incubator was, too, but that was less subtle. 3) When they were eating ice cream after the dinner where the kids found out dad was not coming back, there was a happy couple getting married in the background. On the left of the screen, you had the end of one marriage unfolding while on the right you had the beginning of a new one. Nicely done. I also like how Cleo didn't immediately eat her ice cream. I wonder if she was thinking of the night she was left alone at the theater? 4) That dog really did shit a lot. It was unbelievable. 5) I love the disdain that woman had for the Galaxy car. It obviously represented her husband and she just kept beating up with reckless abandon. Hilarious! 6) What is up with those airplanes? What were they supposed to represent? Us, the viewers? Can anyone here explain that to me?",a4rv1y
ebxchok,"Am I the only one who wished the movie was not in b&w sometimes?  
I mean, I'm all for b&w, but some shots were so beautiful I wish I could see the colors ",a4rv1y
ebyeyck,"Maybe the oddest aspect of this movie is the direct references to his previous films. I haven't seen his three films before Y Tu Mama Tambien, but there was of course the two astronauts in space from Gravity, and then the shot of the pregnant, crying Cleo being escorted through the riots accompanied by the pieta imagery of the woman holding her dead lover, which is almost verbatim from Children of Men.

What is he trying to say with this? Is it just an inside joke? Or is he saying he has no influences any more or has moved beyond all other influences? This has been said of Kubrick - after a certain point, he was totally on his own, unique path.

Did anyone spot other references?",a4rv1y
ed1axgc,"I notice a common complaint is lack of character development, which may be true, but that likely was never intended. It's more like the whole film is a character developing. It's a slice someone else's life we get to partake in. We can only assume what life was like before and what it will be after for those characters on screen, and that's fine with me. Those types of films stick with me longer.",a4rv1y
ebwh3we,"The way Cuaron crafts a world is absolutely mesmerizing. The films I've seen from him (Children of Men, Prisoner of Azkaban, and this one) are so absurdly detailed and built with love. He captures that feeling that these things have existed and will exist from there on out. Like you could go up to any background character in that world, and the stories they'd tell you would be as mesmerizing as the one on screen. Maybe I'm being a bit too romantic, but it's something I feel whenever I put one of his films on. ",a4rv1y
ebx0zbk,Watched last night and can’t process what I watched. Unbelievable .,a4rv1y
eg9o3pv,[deleted],a4rv1y
ehtd424,"While the visuals and cinematography were just dripping in vivid richness, Roma's ideological ""mission"" and oscar-bait propaganda completely got in the way of telling a good story and presenting a piece of art.  The movie was clueless ideology masquerading as a beautiful piece of verite film.  It was aiming at a moral statement and felt very contrived.",a4rv1y
eh317r0,"What a pointless bore. Visually great. That's about it. I could watch random peoples home videos if this is the level of storytelling I wanted. 

",a4rv1y
ebt5ytt,[deleted],a4rv1y
ebt68d0,[deleted],a4rv1y
ebto9of,I can watch that intro all day ,a4rv1y
ebtoh3s,"I’m praying to gods this gets played at AMC’s Best Picture Showcase this year. I watched it at home, and it was beautiful, but experiencing that sound mixing anywhere but a theater is sinful. ",a4rv1y
ebtsela,[deleted],a4rv1y
ectvi6k,"I feel the need to point out something.

In the very beginning, when they were all watching a movie together and the youngest son affectionately put his arm around Cleo, Sofia told her to ""get the doctor some milk."" It was a clear disruption of her son and servant's tender moment. After all of the trauma they experienced, the only things that changed were:

* The doctor/father left with his bookshelves
* The mother changed careers
* The servant's boyfriend left her
* They have a new family car
* They are closer together

The first and third tie in with Sofia's statement that ""we women are all alone."" Correct me if I'm wrong, but weren't they all watching a movie together at the very end? As far as I'm concerned, *Roma* has quite the happy ending (once audiences accept the trauma).

&nbsp;

*Note: Quotes may be a bit loose.*",a4rv1y
efq8e9e,"I've exhausted my google skills to try and find what hospital Antonio worked at. The artwork out front was amazing. Does anyone know? [https://imgur.com/a/tRWqmYM](https://imgur.com/a/tRWqmYM)  


Edit- Found it, incase anybody else wants to know: [https://en.wikipedia.org/wiki/General\_Hospital\_of\_Mexico](https://en.wikipedia.org/wiki/General_Hospital_of_Mexico)",a4rv1y
efev5ee,"/r/unpopularopinion

I thought this movie was a complete bore",a4rv1y
egppu4l,"I had to find a place to vent this:

&#x200B;

We just watched the film tonight and it made me nauseous.

&#x200B;

I know this director is well known for his long takes but why is every single shot just a rotating camera?? It literally made me nauseous the entire film.  Every time the camera started to spin around, which was every 2 minutes, I started to get nauseous and had to look away or close my eyes.  Why was this director such a one trick pony that they couldn't do anything but spin a camera around for every goddamn shot in the 8 hour film!!!  It was just way too much of the same filming style every... single... camera spinning scene.  Ugh I'm getting sick thinking about it again.

Watching this movie looked like it was a cookie cutter ""art film""

it was black and white... check

it had unnecessary nudity... check

it had subtitles... check

it had no plot but a random series of events... check

over the top obvious symbolism (car)  ... check

common relatable tragedy done in a generic manner and very expected... check

it had random weird moments (man in costume singing at camera during a fire) ... check

it went waaaay overkill on the sound design where you heard every wave, clink, and clank at the highest mixable level usually hurting ears to oh surprise! it was trying to make you feel uncomfortable and uneasy or would just abruptly cut scene from super loud to quiet... check.

&#x200B;

I mean every aspect of this movie was just checking boxes on what an art film is supposed to look like and it was horribly shot, nauseating, and unnecessarily loud while trying to throw the fact that it was an art film in your face!

&#x200B;

Now with that being said I think the idea was well formed.  I do think the performances were beautifully depicted.  I think the window into the life of this family was well done.  I just wish the sound design was toned down significantly or maybe used in a more creative manner than just kicking the volume up to 11.  I also deeply wish this guy knew how to shoot a camera in more than ONE STYLE.  That one style literally made me feel sick and I had to keep my eyes closed for a majority of the movie so I would not vomit on my wife next to me.

&#x200B;

Holy hell though the cinematography, the sound design, and its cookie cutter art film form left me disgusted and with a deep hatred for such a cheaply made ""art film"".  I do not understand how people are calling this generic college film project a masterpiece even a little.",a4rv1y
ec372ab,"I didn’t know what I was getting myself into when the movie started, or even half way through, but by the end I knew I watched something special. 

A few scenes that stuck with me were all the parking scenes in their drive way, especially the first time the husband pulled into the driveway. There was just something so menacing about that car, it was so evil and it was so great.

The second was the earthquake and the shot of the baby with the rubble on its incubator (I think that’s what it is). It hit me so hard to see that and ultimately was foreshadowing the end. Cleo was such a beautiful character and it was a really beautiful story and movie. ",a4rv1y
ecx14kd,"Technical marvel but very disappointing storytelling. Being that the story is first and foremost, I have to say I didn't like the film.",a4rv1y
ef2cglr,"It was beautifully acted ,with incredible cinematography  for a boring and depressing movie.",a4rv1y
ef1vvme,"My mum and I agreed to watch Roma . She's watching it now. I'm here writing this.
Just a boring movie with not much to say besides this... Beautiful, yes. Entertaining no.",a4rv1y
ebt6twk,I really thought the movie was going to end in the beach because it would be a way of circling back to the opening shot.,a4rv1y
ebtufcq,"It was good, 8/10 for me. 

More of a retelling of events, rather than a narrative movie. The pacing was slow but it worked to absorb us even if there was no major plot driving it.  Nothings spectacular stands out visually, maybe the dad scene. But I expected a little more than the slow panning from Cuaron.

The story was beautiful and worked as a memoir rather than a film, although there were no stakes and we weren’t sure of Cleo’s desires at times. In Indonesia, my Chinese-Indo relatives have a similar situation with the disconnect between them and their Native-Indo servants. 

The acting really surprised me, the actress who played Cleo has this long gaze that almost portrays longing, sadness, and wonder.

I feel like it would not work if it were a lesser established director. This is Alfonso’s love letter to his nanny; if it were a lesser known director and most people wouldn’t care.

Edited: The narrative movie part",a4rv1y
ebwn297,"Ugh, I hate to admit this, but I'm a bit underwhelmed. If considering strictly its technical merits and Cuaron's craft as a director, it's an easy 10 out of 10. It's undeniably an astounding experience when it comes to visuals and sound design. The performances are tender and organic, and Aparicio is a true natural. She's heartbreaking.

But I found myself curiously detached from the experience story and character wise. While there are many standout sequences (the fire, the earthquake, the political war in the streets, the beach sequence, even the opening credits with the plane reflected in the water. All outstanding) I just simply wasn't all too engaged in it very deeply.

I'm hoping it's because I just wasn't in the proper mood to watch it (slightly hungover, a bit distracted, and restless) because I love slow-burns. I do plan on giving a rewatch this weekend that will hopefully win me over. It's by no means a bad film, and I'd recommend it. But as I stand now, I was just slightly disappointed, despite how gorgeous it is.",a4rv1y
egidisu,"I’m sorry but someone please help me understand what am I missing to see? How is it that critics ( who are human beings) call Roma to be a “masterpiece” or “tear jerker?” The movie has unmistakable great visual high quality fidelity and fantastic sound. But I watch movies for escapism and can even watch documentaries but this just high quality shit! The whole point of movies is to capture time that we can’t experience and see it through a artistic lenses, but this movie, it’s called life! And?! I’m tired of directors and actors trying to pull the ethic / sexism repression card on us and expect to be called masterpiece because of fear of being doxed or criticized. For real look at the nomination and you’ll see that half of the list is simply pushed for minority reasons. Is this what we come to, forget about quality and simply allow shit to pass through as long as it’s not going to bring SJW topics to the oscars or anything in life?   So if you can and what to please feel free to explain why critics are awwed by Roma, I’m open mined... I mean come on I saw Roma. ",a4rv1y
ebs5j6f,Beautiful film but also kind of dull at times. I actually fell asleep for about 30 seconds at one point. ,a4rv1y
ebtfzad,"I really wanted to like it. I mean, Alfonso Cuarón is a fellow Mexican. The recreation of the 70's is beautiful. The shots incredible. But there is no story, no juice, no excitement, but above all, there is no dialogue. I find that unforgivable. And, in some way, I get it, these aren't actors. If you speak Spanish, you can tell there is stiffness in the scarce dialogue, obvious one. I belive that is how he could get away with it. The performances are terrible when you pay attention to the pace of the dialogue. It is really forced, like a telenovela. He was really careful to show his mastery with the camera, to try and fool you on how poorly acted this is. I think it is a sick joke on the Academy and on all no-Spanish speakers. I feel like he tried to fool me, that every single person who said this was awesome, is a aestheticist more than a wholesome critic. It is pretty, like that gorgeous dish served in a fancy restaurant, the same dish of which a spoonfull tastes of nothing.",a4rv1y
ebrhjj2,"I saw this two weeks ago have thought about it daily ever since. Saw it on a huge screen and got so thoroughly transported that I've had pangs of nostalgia just remembering certain sequences. Such is the mastery of Alfonso Cuarón that he managed to transfer his own memories to the audience seamlessly and with pure grace via Yalitza Aparicio who managed to outperform most trained actors, it looks effortless. 


Looking forward to many years of rewatching this just to experience a little more time in the dreamy world.


And fuck Fermin.",a4rv1y
ed7b2wn,"After watching the movie and reading many reviews and after comments, I still don't understand why this movie is some people's movie of the year. It was beautiful no doubt Cinematography wise, but that is about it.

I think I simply cannot relate to it. Unfortunately, I don't think I will ever have the experience of a mid-aged middle class Mexican to understand why this movie is considered good.",a4rv1y
ebuoa3k,"Im watching this on Netflix. Is the narrative voice supposed to be in the movie?

There's a voice which narrates everything in spanish from the color of the logo of Netflix to reading the credits",a4rv1y
ebwh7e8,[deleted],a4rv1y
ec3kzkb,"Holy shit I couldn’t believe the similarities with Children of Men towards the end there, using Pieta by Michelangelo again, the grandmother praying for Cleo like Miriam did with Kee, Cleo going in labour with pure chaos in the background, just like Kee in the refugee revolt. 

I love Cuaron. ",a4rv1y
ebtncgm,"Goddamn twin movie phenomenon. Deep Impact/Armageddon. Dante's Peak/Volcano. Jungle Book/Mowgli. Olympus Has Fallen/White House Down.

And now Roma/Mary Poppins Returns. 

When will it end? When will Hollywood learn to be original?",a4rv1y
ebthmea,"Cinematography was gorgeous. Otherwise, it didn't move me. 

I'm sure a lot of the references and customs shown have to be known for full effect.",a4rv1y
eczqski,"Just watched this and I honestly don’t get all the hype.  It was a fine enough movie, I didn’t dislike it, the story just seemed pedestrian.

Really confused by this huge push behind it as a Best Picture contender.   It wasn’t even the best foreign language film I saw this year (or the best one on the shortlist). ",a4rv1y
ebrh6q8,"I think it’s an absolute great film, but I’m lucky enough to have seen it on the big screen. If you watched or streamed it at home, I’m curious to know what you think. ",a4rv1y
ebtqq39,Absolutely beautiful film. ,a4rv1y
ebv8gpu,After watching it I didn't realize the connection between the title and the movie. So gorgeous though. ,a4rv1y
ecap4vw,Did anyone see this in 70mm in Toronto? Curious to see how experience was,a4rv1y
ecfx22q,Visually amazing movie,a4rv1y
edaatk1,"Great movie! So many questions being asked, but I need to know where the giant crab hotel/restaurant is that they visited in Tuxpan.",a4rv1y
ehqolye,What was that space man scene in the movie about? ,a4rv1y
efceyds,Watching Roma and the children are just the worst.  Constant screaming and arguing and fighting and just making noise.  I could hardly stand it.  This is the sound design that y'all gush over?  It's just loud and obnoxious kids.  Hard pass.  ,a4rv1y
ebsbn4u,"TIL *middle-class* in 70s Mexico City can afford you four kids, two live-in nannies, and a driver.

Edit: That Christmas/New Year's party was lit. Booze, presents, food, DOGS everywhere....that's my kinda party.

Edit 2: I loved the reference to *Gravity* at the movie theater.",a4rv1y
ebthjo2,Netflix should be a pal and include the link for r/childfree after viewing. ,a4rv1y
ebtq95q,"I'd been looking forward to this film all year! While it didn't disappoint, I'm not sure I'd call it my favorite of the year. 

Either way, the good far outweighed any qualms I might have had with the story telling. I'd say as a protagonist, Cleo is incredible. So stoic around her employers but bursting with empathy all the same. I know I could speak to death about how well choreographed this film is in terms of extras, the confident direction and the SOUND. But I have to give props to Yalitza Aparicio for carrying this film and making me wish I could spend more time with Cleo when it ended. 

I will also say I was pleased that they allowed her that honest confession - that she didn't want that child. I can't imagine how conflicted she felt after it was a still born. 

In any case, while I enjoyed Cleo and her obvious joy in her employers children, I did feel conflicted at the possible implication that Cleo's life is basically complete because of the love of the family she serves. I'm not sure I'd read read the film that way as some others might but that may be due to my conflicting feelings on it.

Either way, very good film. I pray it comes to a theater near me. ",a4rv1y
ebtuvwk,What was the symblosism of the planes? I absolutely loved this movie. Made me uncomfortable at times and just felt like a real story of someone I know. Im Mexican and I'm proud of Cuaron who continues to make all of us proud with his brilliant work. The planes tho? lol ,a4rv1y
edbjl50,"The movie is good, the plot is a bit weak.

Not for those who wants to jump the hype train and is expecting a 'blew-me-off' movie.

Relax your mind and watch. You'll have a great time.",a4rv1y
ebtmv9n,I think that Cleo's illegitimate stillborn baby is a metaphor for modern Mexico. Born and dead during a massacre. Poetic and sad at the same time.,a4rv1y
eewh1px,Wow this was a disappointing film.  Easily one of Cuaron's worst.,a4rv1y
ebrtwkk,"I saw this film at my local independent theater last weekend, and it was magical.

I was fully transported into this world and enthralled throughout. I can't think of the last time I was so emotionally attached to a character like I was with Cleo.

A couple scenes will be forever etched into my memory. I can still feel the tears welling up.

Please see this movie. It deserves all the recognition.",a4rv1y
ebrrrdz,Best film of the year is an understatement. His masterpiece honestly. Speaks volumes that no one is calling the film overrated because it deserves all the hype its getting.,a4rv1y
ebwasn4,"So many layers to this film! As the movement of the camera, the character development is nuanced, subtle. I started crying and I didn't realize why - that's how well the characters were established. in this film They were relatable, real. I felt *for* them and *with* them without any effort.

&#x200B;

About the title, the first thing that came to my mind was ROMA = AMOR, backwards.

&#x200B;

Backwards love. I got this feeling in the film. Not only it was a portrait of social and power dynamics, but, throughout the film, many characters experienced this ""backwards love"" - not ""hate"", necessarily. It was lack of love. Lack of connection. Lack of perception of the people around them.

&#x200B;

The doctor and Fermín being selfish and turning their backs to the women/families their actions impacted. The bizarre absence of self-awareness of the rich people towards their employees (that fire in the woods scene... the workers were getting desperate, while the ""Richards"" were just having fun, not caring and even singing). Even Cleo saying that she didn't want her baby - showing the guilt that she felt for not wanting a child that was a product of this ""backwards love"".

&#x200B;

In the end, the cure to this ""roma"" was ""amor"". It was love that united the characters, that gave strength to Sofia and peace and acceptance to Cleo.

&#x200B;

Amazing film. Cuarón is a legend. I myself didn't like *Gravity* that much, but *Children of Men* still is one of the best films I have ever seen. That and, of course, *Roma*.",a4rv1y
ebuqmc1,"I loved it on first watch (last night in theaters) but the politics of the movie has me feeling conflicted.

At the end of the day, Cleo is an employee. She is there to make sure the house is clean and the kids are taken care of. They say they love her, and I'm sure the kids do love Cleo. I'm sure Cuaron still loves the housekeeper Cleo was based on. But the movie does a good job at ignoring a lot of the class issues. The family was well-off and white, while the servants were indigenous and poor. With Fermin and the CIA-trained mercenaries, I understand the commentary about how the poor were used to murder for the interest of the rich, but that same commentary felt missing from Cleo's storyline. 

I don't believe that the mother loved Cleo, even though she said she did. She is her employer, not her friend. I understand why Cleo didn't want her child, but I don't think a servant would be satisfied working for her family. That's not a family. That's a job.

I enjoyed the experience and it was a beautiful movie, but the politics have me feeling iffy. I'll look for more on my next watch sometime next week.",a4rv1y
ecyqt1d,"I know next to nothing about the technical aspects of filmmaking. I'm told that this movie is a technical masterpiece. Fine, I'll accept that. In regards to the story, I guess I'm really missing something that others get. Maid gets knocked up by her boyfriend and he wants nothing to do with her anymore. A wealthy family has their father walk out on them. Unless I missed something, those were the 2 main storylines... and meh.

To top off overdone storylines, none of the characters are developed in any way that let me care about them. We are given little to no context for anything that happens in the movie (which isn't much). Therefore, we have no idea why the characters are making the decisions that they are making.

In the end, my wife and I just felt bad for the dog. We wanted to take him for a walk to the park. Seriously, the dog shit in the courtyard/driveway was one of the most developed aspects of the movie.",a4rv1y
eghbrmr,I will be shocked if this wins Best Picture. Artistic yes. Incredibly boring and not entertaining. ,a4rv1y
ehnw218,[deleted],a4rv1y
ebridy5,[deleted],a4rv1y
ebu9car,"Alright. Cut the hyperbole. I love Cuarón. But Roma is an overhyped simple tale with some lovely cinematography, amazing sound, and a couple of phenomenal scenes (Shopping for the crib, baby deliver and the beach). Other than that this really has nothing else going on for me. It felt like I was waiting for something. 

I see some value in it but I would never watch it again. This is coming from a man whose parents went through a similar divorce when I was 10. I should have connected to the story in some way but at times I felt like I was trying to force myself to see the greatness of the movie. If I am forcing myself, then it ain’t great. Disappointing.",a4rv1y
ebriap6,"I've been waiting for this official discussion for weeks. This was as absolutely breathtaking film, which at times can be heartbreaking and awe inspiring. Everyone sat in silence for a couple minutes as the credits rolled at the end of the film. I love Children of Men and found Gravity to be entertaining, but this film is on another level. Children of Men is still my favorite from Cuaron, but this is better. Go see it on the big screen if you still can.",a4rv1y
ebycfk8,Am I the only one that thought there were three children in the ocean when they were swimming?  I mentioned it to a friend and she thought the same...?,a4rv1y
ebsvo6m,"Best movie this year hands down. Just absolutely crushes everything in every department - acting, story, cinematography, sound design, set design, and so much more. The little details everywhere...the fact that every object in the movie had its own story...man, just so much in this film. So rich. Just amazing.",a4rv1y
eh6lxd7,"I am genuinely baffled that this film is being praised the way it is, and is in the Best Picture discussion, let alone the favorite. I can't find a single thing about this film that was enjoyable or endearing.  ",a4rv1y
edp9g08,"Wasted 40 minutes on this apparent masterpiece. Not going to waste twice that to finish it.  
Shows that you need to shoot in B/W to be hailed a genius these days.",a4rv1y
ebsgcka,[deleted],a4rv1y
ec7hpmo,What does the title mean? It spells Amor (love in Spanish) backwards. ,a4rv1y
eh3awjb,"This movie lit my heart up. What an amazing masterpiece of cinematography, sound editing, it was electric on loud speaker. Also lol @ the dog pooping bear sized dumps.

What a great emotionally deep movie. 
[She lost a child and gained a family](#spoiler)",a4rv1y
