comment_id,comment_body,submission_id
eco8dqr,I feel the exact same way,a4rv1y
ef2tie0,True story of the writer/director's housekeeper/nanny and family growing up.  Love letter to Mexico in the 70s.,a4rv1y
ebs2e60,"Nope. If anything, this movie can serve as a small introduction to those things.",a4rv1y
ebspbw3,"Just to get some of the underlying symbols, but nothing esential to the movie, the story is universal.",a4rv1y
ebs29c1,No.,a4rv1y
ebs1xn1,Just the last 200 years and you'll be fine.,a4rv1y
ebsig3c,"Definitely impressive, but I wouldn't say amateur's game; that car chase long take and the newborn baby corridor scenes are still some of the most impressive technical feats recorded on film.",a4rv1y
ebsyr7m,"Cuarón just had to step up his game. So many movies these days have that one token long take with with lots of camera movement and stuff going on, no doubt in part because of how impressed everyone was with the action scenes in *Children of Men*. It's almost gotten obnoxious and kind of stale. *Roma* is the first movie in a while that actually impressed me again with long takes. It's not just there for the wow factor. The long takes really allow us to drink up all the details of the wonderful set designs and get a good slice-of-life in Mexico city during the 70s. And there is a good mix of pans, tracking-shots, and stills that makes it all feel organic and purposeful rather than pretentious. Cuarón is actually committed to this technique and how it can tell a story unlike so many other directors who use it for money shots.  ",a4rv1y
ebtpu90,"Yes, I think from day 1 she was very apprehensive about the pregnancy. Remember the way she stared at the NICU? She looked pretty freaked out. I think, having to care for all the other kids and seeing them grow over the years, all the fighting and maintenance and etc... that kids require- she wasn't all that thrilled to have to become a mother herself since she witnessed first hand that it isn't exactly all sunshine and rainbows and smiles (even for a well-off family). After the beach scene, I think she was just finally ready to admit it, or absolve herself from feeling that way when she was faced with her own mortality (plus the kids) I'll have to watch it a few more times, but that's the initial impression I got. ",a4rv1y
edmg655,What foreshadowing? I had no idea what to expect,a4rv1y
eeodpxe,"Also the movie reminding us twice that Cleo didn’t know how to swim and then the little boy started monologging about being a sailor that drowned, they don’t need to beat us over the head with the fact that someone is gonna almost drown in a few seconds ",a4rv1y
ebskgui,Fandango > Search > Roma,a4rv1y
ebtsuro,"It's the name of the area where the director grew up and I think the family in the movie also reside there.
",a4rv1y
ebtsvh6,It's the name of the colony in Mexico City. ,a4rv1y
ebtsv3z,I believe it’s the neighborhood of Mexico City it takes place in ,a4rv1y
ebtsw1x,https://en.wikipedia.org/wiki/Colonia_Roma,a4rv1y
ebsurh1,"Huh, on my Netflix app on Apple TV, the profile selection screen is currently monochrome with a picture from the film as background.

Pretty heavy promotion right there.",a4rv1y
ebselyz,Give it time. I'm sure it will make it there once enough people search for it,a4rv1y
ebssger,In surprised they didn’t put “golden globe nominated” movie on Roma ,a4rv1y
ebt6pvj,It is in mine and parents' home screen,a4rv1y
ebuilvu,"Got to say, I found this really difficult to sit through. I like black and white if there is stylized cinematography, but the way this was shot felt kind of flat. I watched it until the end because of the critical acclaim, but it wasn't my kind of movie. ",a4rv1y
ebtnuy2,you can change the color of subutiles..I used yellow its perfect.,a4rv1y
ed0ewf6,"It was shot like one of the old classics, in black and white and impeccably composed, but with none of the writing prowess that makes the classics, well, classic.",a4rv1y
ef4j3ea,"Go see The Favourite, then come back and tell me if you think Roma's still better. ",a4rv1y
efjo2gn,"Hahaha, I really feel like it's down to those two. They're the only one's that are almost unanimously good. All of the other ""best picture"" noms have people pretty split.",a4rv1y
ecsc8h4,">  But at the end of the day, it’s still a movie and still needs to tell a story

Hard disagree.",a4rv1y
ecupggb,"I completely agree. It was visually gorgeous and atmospherically rich, but the characters were 1 dimensional and nothing much changed from beginning to end.",a4rv1y
edgo9k4,"> it’s still a movie and still **needs** to tell a story


No, it does not.",a4rv1y
ecq7iip,"Cuaron's style is story through atmosphere, and imo this is what makes his films so unique. ",a4rv1y
ecprdsm,"I felt like I was watching Boyhood again. I know that movie got tons of accolades and was considered a masterpiece, but I was bored senseless and just wanted something to happen. I got the same feeling watching Roma.",a4rv1y
ebudvx7,"Also, I am way too ignorant on Mexican history. I wish I had known more about it before watching this movie",a4rv1y
ebutxbe,"I didn't love the first half very much, but I think I'll like it more the second time. ",a4rv1y
ed75vy1,I think the way we gradually learn about the problems the couple is having is very deftly done. And the way we see how easily Cleo goes from being part of the family (watching TV/saving them on the beach) to being given orders to make a drink is excellent. No character ever says “I can’t believe you had to miss the end of the episode to make a drink” but the point of the scene clearly comes across. A lot of the pacing and how we learn about the characters and their positions in life all comes from the screenplay. ,a4rv1y
ed4c6xk,"I couldn't agree more. When directors undertake projects of deep personal significance to themselves they often forget that the audience is not the director. Yes: it is a beautifully shot and realizes film. However, I cannot understand critics falling over themselves to praise it as the best thing since apple pie. Frankly, this story of class and domesticity was not compelling or revelatory in any way. For the director, it was obviously deeply personal since he experienced it. For the viewer, it becomes a gorgeous tableau with little connective tissue.",a4rv1y
ebzttrh,"in la roma (the city location) airplanes fly all over the place, so what i got of the planes like the marching band(?) the garbage man with the bell its just part of the city.",a4rv1y
ebxzzgq,I agree but some of the shots were probably enhanced by being in black and white. The riot scene and when she saves the kids. The lighting on those waves man,a4rv1y
ec0ask6,Roma is his memory - he's telling the story of how he grew up and by putting those references in he's telling you where he drew the inspiration later to make Children of Men and Gravity. ,a4rv1y
ebyqpu1,"The two astronauts in space scene is taken from the 1969 film *Marooned*, which Cuaron has said he watched many times as a child and was an inspiration for *Gravity*. ",a4rv1y
ebz8c0k,"People are going to study this film for years to come. They'll study it, looking for the references to his other films. They will freeze the frames, examining for example,  everything in the children's ' bedrooms for possible references, meaning, significance.

My take: we influence ourselves. We are all artists, creating our own lives. I think this is why he chose an unknown with no prior acting experience to star as Cleo. We don't need a huge star to portray a character brilliantly. We are all stars, actors, creators. ",a4rv1y
ec615cw,The floor washing scene is an oblique reference to a similar scene in A Little Princess (his best movie imo),a4rv1y
ebyjazv,[deleted],a4rv1y
eh46f7k,">Cleo doesn’t get to have a doctor who speaks the same first language as her or someone who perhaps practices medicine in a less westernized/ Americanized way.

I must apologize, but this remark is not in touch with reality. Her boss took her to the same hospital where her husband worked (you can see him arriving in his home at the beginning), so she knew Cleo would have great medical attention because she knew the OB/GYN personally. It's 1971, after all.

&#x200B;",a4rv1y
egay0ta,"Cleo is a horrible person to be around. She is shit at her job, she gives up at a drop of a hat and her ambition is non existent. 

When Cleo went to Sofia she implicitly wanted to be taken care of by a western physician. Her husband was a doctor and she knew full well she would be taken care of without social pressure.

As a native Cleo is a foreigner in her own land. That is sad. But she doesn't do anything with it. 

As for her medical treatment it was fine, better than she could have ever hoped for. I don't get the animal reference but let's not forget this is a movie and not reality.
",a4rv1y
ehwafl5,"I respect your opinion but I find it amazing because I had the exact opposite reaction. I grew up like one of the kids in this film with maids before moving to the states. I still think about the young girl who took care of me when I was a child. I think this is a lifestyle that is so far removed from a lot americans and that is why this movie may seemed slower paced. To me, everything about it felt genuine and I loved the film for allowing me the space to reflect on these strange sociological connections where family and work start to blur. ",a4rv1y
ei3d267,What are you talking about? What ideological mission?,a4rv1y
eo0acqb,[deleted],a4rv1y
ebtb3qr,It was white for me in theaters,a4rv1y
ebtsjv8,It already is.,a4rv1y
ed2fhwb,"It was tea. The Mom also, in my opinion, asked for Cleo to leave to remind her that she is not part of the family and not entitled to their most intimate moments.",a4rv1y
efjk6xl,[deleted],a4rv1y
eh75161,"I'm truly baffled that people in here are calling it a ""masterpiece"".",a4rv1y
egxozc3,"Agree... it's an overrated ""jewel"" of a film. But don't say that or the cinema hipster snobs will mob you. But remember, it's all about popularity and political correctness, not merit. And there's a reason behind all the hype, as this NYT article says: https://www.nytimes.com/2019/02/17/business/media/netflix-movies-oscars.html",a4rv1y
ek7raph,"Why tf are subtitles a box to check for an art film?? 
",a4rv1y
ehq4dqz,Exactly how I felt about it.,a4rv1y
eo0azst,"Notwithstanding the politicality of the Oscars or whatever awards, your questions are great and I would encourage you to answer them hopefully with the goal of understanding the otherwise perspective that this is a masterpiece. I think it's like having a taste for wine, some people think all wine is the same yet there are still institutions that can back up having a palette or whatever.",a4rv1y
efjnwji,Probably the comment I've related to the most so far. It's by no means a bad movie. I just couldn't really get into it emotionally.,a4rv1y
ef684qf,I sort of agree.. it's beautiful and artistic but most probably would not find it entertaining.. ,a4rv1y
ef3tuzw,"I didn't find it beautiful either. Looked like a pretentious Instagram account that uploads b&w photos of the city and his noveau rich house.

A film made by a white man feeling guilty.",a4rv1y
ebtl5vj,it still did by ending on the plane,a4rv1y
ebupwn1,"> if it were a lesser known director and most people wouldn’t care. 

Agree with this, I also think that this is a film that most people will alter their opinions of it in a couple of years time, similar to how The Revenant went from being a great movie to an okay movie with great cinematography.",a4rv1y
ebtxom2,Roma is most definitely a movie per se ,a4rv1y
ebwxp78,I also heard it’s better to watch in theaters compared to your TV (unless you have an amazing surround sound system and a big ass TV)—did you watch it on Netflix? I just watched it on my TV which is a 55-inch and kept wishing I watched it on the big screen. ,a4rv1y
eby9wlu,"I shared some of your issues while I watched the movie, but it won me over by its end. The detached and distant observer aspect is very much a foundation of the movie -- from Cleo's stoic character and her perspective on the family to its aesthetic design of how it consistently frames many scenes. 

Not that your issues are invalid (its loose pacing asks a lot too), but I think the film would definitely benefit from a rewatch.",a4rv1y
egiozne,"People watch movies for different reasons. Sounds like this movie, and slice of life movies in general, aren't for you. There's no need to bring politics into this. Boyhood was nominated for a bunch of Oscars, it was a similar movie to Roma, and received similar complaints, but it starred all white people. ",a4rv1y
egj12q5,"Yep. Boring Movie + Black and White + Spanish = Oscar Boner

Also, Alfonso Cuaron has a big Hollywood profile. If an unknown Mexican director made the same movie, it would have flown completely under the radar.",a4rv1y
egxo7v7,"Maybe the relentless lobbying and promotion done by Roma has to do a lot with the hype:

https://www.nytimes.com/2019/02/17/business/media/netflix-movies-oscars.html. 

Let's not forget it's usually not about merit but popularity and a politically correct agenda. To me it's one of the most overrated movies to ever receive so much attention. I see a lot of praise for its cinematography which is laughable, there are overexposed whites all over the movie, so at least the ASC got it right giving best cinematography to Cold War instead of Roma, which I saw as a movie set in the 70s but done in 2018, I never felt it took me back in time.",a4rv1y
egiehg9,Totally agree!,a4rv1y
ecr8i7t,"Spanish is my first language. The only bad acting is from the kids. But that's understandable. They didn't have any meaningful scene besides the beach one, so it doesn't matter.",a4rv1y
ebu98we,"Just like that gorgeous dish served at a fancy restaurant, the flavors in Roma are more subtle and satisfying than your average meal. Not everything has to be in-your-face. Sometimes less is more. 

Having said that, I’m not a native Spanish speaker, so I appreciate your insight on the Mexican actors. I always wonder the level of acting from foreign language actors. I agree that this is marketed for American audiences, so I don’t see a problem with it. I did however notice the bad acting (maybe translation) in certain scenes. The pediatrician’s dialogue in the birth scene was atrocious. Like I said, maybe it was lost in translation. ",a4rv1y
ed7ro7x,"Not really. I come from the Philippines and it might as well have been filmed here and set in the same time period and it would still make sense.

The class difference between the dark-skinned servants who spoke the ""lower-class"" Mexican dialect to the light-skinned European family who spoke proper Spanish, juxtaposed with the rising working-class tensions in the background. The way Cleo is treated as family most of the time but as a servant first and foremost. The parallel story between Cleo and Sofia, both facing heartbreak and coping in different ways, but due to their class differences, are unable to realize they're in the same boat.

Of course, the universal story of the importance of family, knowing one's place in society, and how we learn to move on from personal tragedies.",a4rv1y
ed7qhgb,"That’s interesting, I thought it was a universal story. I’m Afghan, don’t know much about Mexican culture, but I could understand all of the cultural aspects in one way or another. A servant’s relationship with her employers, a close-knit family, a pregnancy out of wedlock, men abandoning their families, a forest fire, students protesting, political violence, a family trip to the beach.... these are all things we’ve seen before or read about or heard about. You should be able to get it. And the emotional gut punches really moved me, I found myself thinking about them for days. You didn't experience that? Now I’m starting to think that people such as yourself didn’t get the Kite Runner either. I thought that was a universal story too, but now I’m thinking maybe a lot of non-Afghans didn’t get it.",a4rv1y
ed8vumq,That is such a shallow and boring way to watch movies/live your life,a4rv1y
ee2gp4l,"I saw it as a eulogy to the Mexico that was never allowed to grow into being, under the influence of an authoritarian government.",a4rv1y
ebuqlko,"No, check your settings.",a4rv1y
ebupf5n,"I think you are watching it with commentary on there, there's no narration in the actual movie. ",a4rv1y
ebvpm2c,"It has an original audio and a descriptive one, I think for deaf or hard of hering person. Also, a Closed Captions subs to provide aditional or interpretive information, as barks or songs.",a4rv1y
ebxegr6,"It was supposed to be a doll, they might have to do it a little more obvious to avoid confusions but yeah.",a4rv1y
ebxfa5t, that had to have been one of the kids play dolls. Funny you mention that I noticed that also.,a4rv1y
eby8jgy,"Medical Student here, unfortunately fairly realistic for what an actual floppy dead baby looks like.",a4rv1y
ebxgufn,"Same, I started sobbing at the beginning of that scene and didn’t stop for the whole remaining of the movie.",a4rv1y
ec4pbsk,"Yeah, that was supposed to be a doll.",a4rv1y
ecayfug,Mehhh. Page out of the Almodóvar playbook from Carne Tremula. Very reminiscent.,a4rv1y
ec7fnc6,Also *shantih shantih shantih* in the end credits.,a4rv1y
ebu210k,Is..is this serious?,a4rv1y
eby9uez,"For what it's worth I grew up in a Latin American country and saw a lot of stuff I recognized from my own childhood in the film. It was kind of neat like catching Easter eggs, but the film was still not my cup of tea. Gorgeously shot, but kind of lacking otherwise.",a4rv1y
ec1ccru,"That’s interesting, I thought it was a universal story. I’m Afghan, don’t know much about Mexican culture, but I could relate to all of the cultural aspects in one way or another. A servant’s relationship with her employers, a close-knit family, a pregnancy out of wedlock, men abandoning their families, a forest fire, students protesting, political violence, a family trip to the beach.... these are all things we’ve seen before or read about or heard about. Now I’m starting to think that people such as yourself didn’t get the Kite Runner either. I thought that was a universal story too, but now I’m thinking maybe a lot of non-Afghans didn’t get it. ",a4rv1y
ed7qvyw,"The movie started off showing you all these people and how their lives are, kind of like a character study or documentary. Then it just hits you with a succession of exciting moments, big sequences, and emotional gut punches. The way they quietly set it up and then knock it out of the park was amazing. Loved it.",a4rv1y
ebrmuxo,"I watched it in 4K HDR on a 55 inch TV and I couldn't stop staring at how clear the image quality was. Netflix compresses the shit out of a lot of their films but this looked so damn crisp. Obviously it's a lot smaller than a cinema screen but I was still constantly wowed by it.

Sound design is another matter. I listened to it with an expensive pair of surround sound headphones but I don't believe Netflix transmit movies in Atmos (nor would my headphones be compatible) so I'm sure a lot of the experience was inferior there.

While I think a lot of people oversell how much is ""lost"" watching at home if you have a good setup, clearly the cinema is the best way to watch this, and if it was showing in my city today I would've watched it there. But at the same time if you have a 4K TV this is a damn good way to watch the film.",a4rv1y
ebrihk6,"Same here. The sound design is what makes this film a must see in theaters. All of the panning shots with the audio circling the audience was a great touch that added to the immersion. I don't know if the cinematography and audio will translate well to the small screen, unless you have a great home theater setup.",a4rv1y
ebtajrh,"Watched it on a laptop at home on Netflix (not showing anywhere near in cinemas). Absolutely loved it (my #2 of the year after *First Man*), would love to see Cuaron win the Oscar. The
sound design was amazing, and most importantly for a film it really connected with me on an emotional level, particularly the department store and beach scene. ",a4rv1y
ebvjdax,Roma is the name of the iconic neighborhood in Mexico City where Cuaron grew up. The movie is based on his own childhood.,a4rv1y
edg53w2,"I also want to know some of the locations.  I lived in DF and in Ver. Ver for a while so the film, even though before my time, was nostalgic.  I could really hear my kids with their friends arguing and bickering and playing in the DF Spanish in the scenes with the kids!  The Earthquake scene shook me (pun is acknowledged but was not my original intent) because I later experienced the quake of 85, and destruction in Col. Roma, not far from me at the time,  was devastating.

Anyway, does anyone know the location of the hacienda?  I haven't found anything on line to tell me, except it's replication of a place Cuaron visited, but does not say where it is.

&#x200B;

btw the line that Ver. beaches are ugly.... funny, kinda true, but lovely enough to live across the street from.  Good times.

&#x200B;

edit - corrected a sentence.",a4rv1y
ek2vuw7,"It was a reference to Cuaron making Gravity, that films like that inspired him.",a4rv1y
egcxb6l,"That's pretty much kids. The cars, the dogs, the band, the background noise was just very realistic throughout.",a4rv1y
efwvwrj,If a dog is pinned in a cage all day of it's own shit and piss than it will constantly bark and jump at the gate.,a4rv1y
eg7b4pb,I found the dialogue really quiet and hard to hear  ,a4rv1y
ebsl7re,"*Marooned* is a real film and Cuarón has said that he watched it alot as a kid and it was a major inspiration for *Gravity*. Also, *Marooned* and *Roma* are both 134 minutes long.",a4rv1y
ebt3yke,">hat, that make it feel real in every way. The way Cleo makes coffee, the way the movie theater is recreated, the way one character says to another that the Cowboys won the Super Bowl because the Baltimore Colts got cocky, then sticks to that statement even when reminded that Baltimore still won. Even the sound mix feels incredibly immersive. If you can't see this in a theater or e

That's why the kid is dressed as an austronaut as well. ",a4rv1y
eckk95f,"They are more upper middle class.

&#x200B;

My dad is also a doctor, five kids, but he couldn't afford (or wouldn't want to afford) two live-in nannies. That was what my mom did. We were more like true middle class (my dad refused to charge too much and mainly treated lower income people). Our house was also way smaller and in a much less centric neighborhood than the one in the movie.",a4rv1y
ebvjmze,"It's conflicting! Yes, but it's a reality that has never been told in Latin America, and I think that is really strong, because it's is because we see the movie with our eyes that we have finally started to see the implications on racism, class, when rights etc.



And what is strong I that it shows all that, to let us ask those questions, and in Latin America, it has many questions raised, like how many people have still the idea that Yalitsia Aparicio is ""not classy or worthy of appearing on red carpets with beautiful dresses, because she is a ugly Indian""



Those issues exist and the movie has raised them again. Good for them!!


",a4rv1y
ebtw1gy,"I'm fresh off the movie, but think of it this way: a plane is carefully prepped, tested and has a ton of security measures (i know there is much, much more than just this) that helps get it up and running on the safest and most calculated path witj the passengers safely on board. Cleo is in charge of the family before, during and after being abandoned by the husband, making sure each member is accommodated to the best of her abilities because, other than just being their servant, she cares for them.

The planes can also be cues for different points Cleo's life. If im not mistaken there's a plane that's about to crash (if I remember correctly?), and that correlates to the pregnancy and some of the hardships she will endure during it. ",a4rv1y
ebuf3b8,"I think the planes both foreshadow and remember the characters (and the audience) of the father's abandonment, but also it points to the existence of other worlds out there, not only full of people that have the resources to travel by plane but also that live in other countries with different cultures.",a4rv1y
efmcsl6,"I, on the other hand, think this is the best piece I've seen from him.",a4rv1y
ec7ywif,Someone didn’t sort by controversial,a4rv1y
eccpc2d,"Not to burst your bubble (that was an interesting interpretation) but it’s called Roma as it’s named after Colonia Roma, Mexico City (where the majority of the film is set)",a4rv1y
ebwl3b7,You started crying for no reason? What's wrong with you?,a4rv1y
ebuui69,I'm pretty sure that Cuarón wanted you to notice the things that you noticed.,a4rv1y
