comment_id,comment_body,submission_id
ebt4m2g,"Honestly, she could have done a better job cleaning up the dog poo.  Just an observation.  ",a4rv1y
ebsd026,"One scene that really sticks with me is when [Cleo went to find Fermin at the karate training ground, and the odd martial arts teacher did the pose that he said only the strongest people could do... but Cleo did it with ease.] (#spoiler)   I took this as a sign that she had the internal strength to deal with everything she was going to experience throughout the rest of the film.

Anyways, completely immersive movie. So beautifully shot. My favorite of the year.",a4rv1y
ebui19d,"I really enjoyed it. I read somewhere that this film was the director/creator’s “love letter to the women in his life.”

I am a woman, and a mother, so certain things I was able to understand and feel deeply.

I was raised by a maid in Venezuela, so I really connected with Cleo and how much she loved the kids, who in turn also loved her very much. Those women work very hard, for little pay, from sun up til sun down. Not a glamorous job, but a very important one.

Several things I noticed....the whole concept of women being all alone...it was the women who ran the family. The husband just showed up when he felt like it. The fact that everyone babied the youngest child made me think of how women might have a bit of a hand in raising these “spoiled” men.

I was struck by the fact that even though the family claimed to love Cleo, they don’t treat her equally. In the scene where they are sitting in the bench eating ice cream, Cleo is standing while everyone is sitting. A sign of how her struggle and pain is unacknowledged. She is there to work.

The dogs throughout the film made me think of the loyalty of women, especially the maids. They put up with a lot of shit from their husbands/employers.

The ocean scene showed me that Cleo loved those kids enough to risk her own life for them. As I watched them bobbing up and down it made me think that the family (Cleo included) could weather any storm, as long as they were together.

I thought it was funny that the husband took the bookcases. What’s a bookcase without books? Nothing. Just empty space. The heart of the bookcase are the books.  The heart of the home is the family. The husband left and took only the empty shell, leaving behind the one thing that gave his life any value—his family.",a4rv1y
ebs4uwy,I saw this in theaters almost two weeks ago and I firmly believe that the *spoiler* the riot scene is one of the best shots of recent history. The way the riot breaks out through the window and then transitions into the inside of the mattress store all in one shot is masterful.,a4rv1y
ebssizx,"I have never sobbed because of a movie before but Cleo's delivery scene reduced me to shambles. It wasn't just the fact that her baby girl was born dead, but the casual, almost anesthetized manner in which the doctors and nurses talked to her. I completely lost it when they asked Cleo if she would like to meet her daughter and then that it was time to say goodbye almost immediately after.   


On a lighter note, one of my favorite shots was the single take, 360 degree pan of Cleo turning off all the lights in the house before going to bed. It was a beautiful, nuanced scene, showing all of the little things that servants do to keep a household running. We often forget how much work it takes to maintain a home, from doing the dishes to cleaning up after children and pets. ",a4rv1y
ebsld6r,"I watched this movie with my mother in theaters, and it was one of best bonding moments we had recently. She was raised near Colonia Roma, where this movie takes place. She cried three times in this movie. According to her, how this movie sets the 1970s setting was beautiful. She told me that watching this film was like watching a memory of hers play on the screen. ",a4rv1y
ebtli1b,For the first half you’re like ok this is going to be a really well-shot art film slash character study then Cuarón is like bitch you thought,a4rv1y
ebt9yzo,"I loved Cleo’s dynamic with little Pepe. He was such a sweetie. Also really liked how the mother had these outbursts and flaws but ultimately was such a kind, compassionate, and strong figure. ",a4rv1y
ebscbn2,"There's so many shots in this film that make you think ""How the hell did they pull this off?"" Not just the big, showy long takes, like the fire or the massacre. But the little things, too, like the reflection of an airplane framed perfectly in a puddle of water during the opening credits, or a little horned frog skittering along the ground in close-up.

This movie is filled with little touches like that, that make it feel real in every way. The way Cleo makes coffee, the way the movie theater is recreated, the way one character says to another that the Cowboys won the Super Bowl because the Baltimore Colts got cocky, then sticks to that statement even when reminded that Baltimore still won. Even the sound mix feels incredibly immersive. If you can't see this in a theater or even on a TV, make sure to watch it with headphones. This is clearly a passion project for Cuarón, and it shows.

Yes, I know I haven't talked about the story yet. It's a slowly-paced slice-of-life movie, with no big showy scenes until the last half-hour. And if you're not into that, you probably won't like it as much. But while it has nowhere near the tension of Cuarón's last two films (and really, which films do?), it's still a great screenplay about domestic life, women's struggles, class issues, political turmoil, childhood, and the movies, and that's just off the top of my head. 

If the ending didn't land for you, for me it can be summed up by the inscription that appears at the end of the credits. ""Shantih Shantih Shantih"" (please tell me if I get the following explanation horribly wrong). It's a Sanskrit mantra that also appears at the end of T.S. Eliot's ""The Waste Land"", and is a prayer used to signify the end of an Upanishad. It represents peace, rest, calmness, tranquility, or bliss. There's some big changes going on, in Cléo's life, in the family, and in the world, but everything's gonna be all right. She's at peace with everything that's happened to her over the course of the year. Shantih Shantih Shantih.",a4rv1y
eby81jx,I knew something bad was going to happen to Celo's baby when her glass broke for the toast. ,a4rv1y
ebtu9it,"It's very hard as a Mexican to describe Roma. It's a love letter to Mexico, encapsulated in Mexico City. It's a letter to the country we are, from the tenderss of our abuelitas to the oppressive regime we had for 70 years and now threatens to return. The upper classes shooting guns in the woods and the lower classes living in the slums of Neza. Going for a baby crib and being a witness of incredible repression from the government.

What we are. For better or worse

But most of all, Roma is the most loving letter to women and the loneliness that can result from feeling abandoned, like Sofia said ""at the end, us women are alone"" this doesn't mean that as a gender they have gained tremendous ground but at the end of it, a lot of our moms can mirror themselves in Sofia and Cleo.  Whle Sofia was a mess her husband was bumping shoulders with his lover, while Cleo made a long trip to see Fermin, he was literally kung fu fighting.

And at the end, Cleo had the love of her kids (because they were as much as Sofias) to power through, and Cuaron ends it with ""Para Libo"" which was his Cleo.

I didn't see a better film this year. It deserves every bit of praise and I don't see how Cuaron can lose best director.",a4rv1y
ebshy5r,"The first shot of this movie is what film is all about. Cuaron managed to make a maid cleaning dog shit be the most beautiful intro to a film I've seen in a long time. I remember it was really quiet and I was a bit like ""okay....floor shot for awhile I guess"" but as soon as it clicked what was going on I was fucking in. FUCK this movie is so beautiful.",a4rv1y
ebsnpxc,"The symbolism in this film was incredible. As a son coming from a split family, the shot of the Cleo and the family sitting silently eating ice cream after announcing what their father did, with a wedding in the backdrop, had me in tears. Made me admire the beauty that love pushes on regardless of the loss of it, that it isn't as singular an emotion as we can selfishly think.",a4rv1y
ebvb48h,I just wanted someone to take that poor dog for a walk.,a4rv1y
ec48az6,y'all saw those two ducks having sexual intercourse ,a4rv1y
ebwkuo3,"“When I was older I used to be a sailor, but I drowned in a storm…”",a4rv1y
ebremmn,"In time I might be able to adequately organise my thoughts about why *Roma* is the best movie I’ve seen in god-knows-how-long, but for now I’ll  say that I got a real kick out of Cuaron including that scene from *Marooned*, which was basically *Gravity* before *Gravity*.",a4rv1y
ed9opc8,I wish I could have found out what this movie was about before watching it with my 4 month pregnant wife.,a4rv1y
ebrqsjr,"I think it's absolutely amazing how much this movie sounds like the real Mexico City. You can put your head out of a window at anytime during the day and you'll most certainly hear a guys selling honey, the loud-as-fuck cart selling sweet potatoes, the garbage truck with the guy who walks by with the bell, all of them were, and still are, part of this city. A day Downtown actually sounds like in the movie with all the street vendors yelling trying to get peoples attention. It really sounds like the actual Mexico City, it's amazing.


Everyone's talking about Cleo, but the scene that really got me was the scene with Sofia and the kids at the restaurant near the end.

The day my father left, my mom took me to a restaurant and, just like in the movie, she told me, with a smile on her face and a look that was a mix of fear and bravery, that from now on it would only be the two of us and that things would be better. And they were. Just because of her. I love my mom",a4rv1y
ebrhden,Fuck Fermín,a4rv1y
ebrdiem,"I found Roma absolutely incredible. The best filmgoing experience I’ve had this year, maybe one of the best ever. It’s so hard for me to describe what made this special to me, but I think it comes down to just how alive it was. It was a little slice of a normal, happy and sad life of Cleo, and the people around her.

There’s so much to unpack in this, but what really stood out was the acting, direction, sound design and especially cinematography. Roma represents Cuarón at his best and most confident as a storyteller, and the intimacy of Roma is almost too hard to bear.

I do want to touch on the hospital scene, though. It’s the tensest I’ve been in the cinema in a long time, and it was all done in masterfully choreographed single-angle takes that ended up lasting well beyond several minutes. When I saw the liveless little baby body, I broke down, harder than I think I’ve ever done at a film. The brutality of seeing the doctors cover the child in the background while Cleo was still in her birthgiving position was too much to handle.

When she finally makes peace with herself at the beach, saying that she didn’t really want the child, and the family all hug her, it almost hit me even more than the hospital. The fact that she realised that she has more love from the family than she could ever need, and that she loves them just as much was the perfect wrap-up of such a beautiful character arc.

Roma is a masterpiece. I can’t wait to see it again. I had to call both my parents after seeing it. It reminds you (much like Children of Men) of what a precious gift life is, and that each one matters as much as the next one. ",a4rv1y
ebt0oba,I guess its good that I saw on netflix and not in theaters cause I hate crying in public and walking around after crying.,a4rv1y
ebsqqez,"I don't know if anyone else had this experience, but it took a good 30-45 minutes for me to fall into rhythm with Roma. Saw it in theaters and by an hour in I was 100% with Cuarón. Definitely going to see it again, so I can let the movie and the longer scenes fully wash over me.

Also, as many have said, the sound design was exquisite. I thought people behind me were whispering. I turned around ready to shush them. It turned out to be the children in the movie whispering off-screen. ",a4rv1y
ebsfwsp,"What an incredible work of art. For something relatively small-scale, it feels so *big.* Focusing on this little microcosm of characters living their lives against change and heartache gives it this gravitas that I can't quite pin down. Cuaron's direction is sublime, and the actors are so good it doesn't feel like they're acting.

That beach scene near the end. So powerful and cathartic. 

**Watch this movie with people you love.** ",a4rv1y
ebrej7w,"Honestly, that birth/dead birth scene is one of the biggest gut punches I have ever seen. Shot brilliantly in this one take and with so much emotion coming out of Yalitza Aparicio.

A neorealistic masterpiece",a4rv1y
ebszww9,"This film was so immersive for being a largely plotless film. It's absolutely beautiful in the way it portrays its characters and the way the world is presented. The movie is such a complex and detailed look at the lives of domestic workers. It shows them as strong and loving individuals (which is why I think Cleo could do the one leg stand thing with her eyes closed). I didn't really cry but I shed a few scenes in the beach scene and the delivery scene. The last few scenes are so full of love and just thinking about them gets me somewhat emotional. Probably my favourite film from the past 2 years after Paddington 2. Maybe not as emotionally invested as I was with Children of Men but this is surely Cuaron's most well-made film yet.


I think Netflix did an amazing job with the film also. From advertising it as soon as you log in to the amazing subtitles (with the brackets and everything) to actually letting you watch the end credits, it's clear that they see this as something monumental and gave it respect.

Also, Fermin is a massive piece of shit.",a4rv1y
ebwdwx7,"Protest. Hospital. Beach. 3 scenes that absolutely make this movie worth the slow burn.

I think I want to focus on the character of the mother, Sofia. At first, I think the first notable scene was her telling the daughter not to eat too much. It sets the perception that we might have preconceived about a wealthy, upper-middle class woman. But then as the movie slowly unravels, you start to see her for all of her faults and her strengths. The juxtaposition of her compassion versus her failures highlights the human element and great directing. For example, as discovers her son spying on her, within 2 seconds, she immediate slaps him, and then realizes what she has done (especially in the previous scene where he witnessed his father and the mistress). It shows that not everyone's perfect. Even at the end, we learn that she's willing to take a job and sacrifices to improve her children lives. 

This movie, man. It packs so much emotions and nuances that it's worth multiple viewings to fully comprehend. I saw it with some friends on their television but I really want to see it again on the big screen.",a4rv1y
ec0n40t,Every man in this film was a fucking coward.,a4rv1y
ebsdhdk,"Planes flying overhead is a recurring motif in this film; I think I understood a lot of the symbolism but I'm not sure what the planes mean. They may simply be there to add to the atmosphere, but I felt like there was some meaning that perhaps I'm missing, anyone have any ideas?  

Anyway, this movie was beautiful, intimate and heartbreaking. I loved the lack of score, it really made me appreciate the sound design within the film. This may be my favourite Cuarón film to date, but that may change after I finally watch Y Tu Mamá También. ",a4rv1y
ebrzuwc,"I have never sobbed harder watching a film. It hit too close to home for me. My mom was/is essentially Cleo. Cleo’s story mirrored a lot of what I know of what my mom went through back in her home country, but the difference is, I was born.

Aside from my personal bias, it truly is beautiful and intimate storytelling at its finest. Watching it in theaters was an experience I’ll never forget.",a4rv1y
ebt01zq,"Can we talk about how when Cleo goes into labor, it’s just like that scene from Children of Men? Where Theo and Kee are going through the slums and there’s a mother with her dead son? Looked like more Mary/Jesus/Pieta imagery to me.",a4rv1y
ebsyxym,The dance scene at the New Years  party was so well directed how the music just started and everbody started dancing as the cameras pans was great,a4rv1y
ecqm325,"You either love it or you found it boring, period. 

Because it's available to everyone with a Netflix subscription, curious people that are not fan of this style of storytelling that is common in foreign movies from the 60s and 70s will trash it online.",a4rv1y
ebrdk5m,"The cinematography is some of the best I've ever seen and the mis en scene is masterful.  Cuaron will definitely will best director again.

I just can't get this movie out of my head, despite seeing it 2 months ago.  The final 30 minutes are so emotional.  I love that the movie takes it's time to bring conflict into the story.

>!I do wonder if a film that has a guy helicoptering his dick can win Best Picture though lol!  On a serious note, I'm really fascinated about why Cuaron put this in the movie.  Thoughts?<",a4rv1y
ec1weuo,The film had way more penis than I expected. ,a4rv1y
ebt5q4b,"Cuarón is concerned with birth and water (Y Tu Mama Tambien, Children of Men, Gravity) and in ROMA, he brings it all together. What a joy it is to see a filmmaker at the peak of his powers. ",a4rv1y
ebyz0sp,"I'm still thinking about it. The full frontal male nude scene, absolutely no female nudity in the film....it seemed to me Cuaron did this on purpose. This, after all, is a film that is a tribute to the strength of women. Let women watch an exposed man, just like Cleo is watching him, covered, from the bed. I want to study this film. And i think this film will be studied for generations to come. Each scene, each movement of the camera, is a study in filmmaking. Why did Cuaron choose to do it this way? I am not at all a student of the craft of film making, but this movie has made me want to study the craft. Brilliant. ",a4rv1y
ebsn7pd,"Oh my, that birth scene.. ",a4rv1y
ec0zz48,"One thing I thought was fascinating was that the camera was almost totally locked down. Nearly every shot was either static or a simple pan or tilt. There was some dolly shots that were great very fluid and not distracting. For a director known for amazing camera moves, it's fascinating how Cuaron brought life through framing and blocking rather than crazy camera moves.

It reminded me a lot of one of my favorites of all time Andrei Rublev, which often has these insane scenes of violence or insanity with very little camera movement. I definitely think it was a purposeful rule for Cuaron (who was his own DP, that show off) and it creates this excellent ghostly, observational feeling to the whole thing. Just so well done.

Also how did he make a dolly shot that went OVER the ocean?! It's crazy enough to build a dolly on sand but holy shit.

**Edit:** The Hollywood Reporter just did a piece on how [the beach sequence was done.](https://www.hollywoodreporter.com/behind-screen/how-romas-visual-effects-team-created-intense-ocean-sequence-1169264)",a4rv1y
ebtg920,[deleted],a4rv1y
ebuhy6b,"I saw this in Dolby Atmos and it was probably the most immersive film going experience I’ve ever had (more than 3D, HFR or VR)

What struck me was how quietly affecting this film was. I was deeply moved, but couldn’t figure out why... or at least couldn’t articulate why. 

The best way i can summarize is, this movie is a love letter to the woman who raised Cuaron. It’s sincere, respectful and honest about her life and the occasional indifference people have to her. The technical craftsmanship is staggering, but what remains prevalent is how lovingly he paints her portrait. 

I also love this quote from Nick Pinkerton of Sight and Sound:

“Roma is the sort of movie that successful pop filmmakers say they’d like to use their clout to make but almost never do.”

",a4rv1y
ebz797t,"I wonder if it's all about separation. The unity, peace and balance of the womb, when we were grand, which we lose at birth, and then struggle all our lives with the separation. Why was only Cleo, with child, able to do the yoga pose?

So many issues of separation and distance in the movie. The distant airplane. The car squeezing into the courtyard, between the trucks, fermin ritualistically forcing distance with his dance of threat. Separating books from bookcases. Class.  Brothers. 

Denying the separation is like trying to squeeze between the two trucks. Doesn't work. Better to acknowledge,  accept, deal. Love, even with the difference, the distance. That's the path to peace.",a4rv1y
ecz1hud,"Honestly, there's a lot here that would turn folks off quick; It's black and white, subtitled, long runtime, and we're not given much backstory or exposition to understand the characters. It's a slow burn, and some people might just be too bored to feel like it pays off.

With that said, I think this film is masterful in it's subtlety. The tension evoked in the Labor and Beach scenes is absolutely palpable. The subject matter really hit home for me in many ways - and my eyes watered during the more dramatic moments, which doesn't happen for me often in film. 

Unfortunately, I think a lot of people are going to find this film pretentious - but it really moved me and is definitely among my favorite films of the year. ",a4rv1y
efnr5sq,that random guy singing at the fire tho,a4rv1y
ebso8ky,"I saw this in theaters last week. I think, without a doubt, it is Curon's best film, because it's probably his most personal film. Feels like he ripped his heart out and spread it out on the celluloid. 

I'm really interested in how casual filmgoers/Netflix users will receive this. It's got that ""prestige"" film feel (black & white, auteur director, subtitles), but I actually think it's a pretty approachable experience overall. 

&#x200B;

Also, I ugly cried through the last 45 minutes. No shame. ",a4rv1y
ebtrbmf,"I finished the movie maybe an hour ago and still speechless. The last time I remember having this sensation is when I saw Blade Runner 2049. Very overwhelmed from the roller coaster ride of emotions that is ROMA. I was broken when Cleos water broke. Felt like Children of Men with the riot going on and then Fermin has the gun to her face. I am really bummed there was nobody close playing this movie but thankfully I have a pretty big tv with healthy sound so I got a similar experience. we are so far into award season and well aware of the core players but Yalitza Aparicio should seriously be considered for her work here, just because she is a non professional shouldn't mean she's should be nullified. if Barkhad Abdi does for Captian Phillips then it is a crime not to recognize Yalitza's work here

&#x200B;

But enough bullshit, one of the best films of the year, decade and ever made ",a4rv1y
ebxrtt9,"Fuck Fermín.

Edit: already beat to it",a4rv1y
ee3vl44,"The juxtaposition of Cleo’s face in the hotel room, the absolute infatuation and “first love” in her eyes, versus the deep sadness and loss when she waits, alone, for Fermín at the theatre. So simple, yet so profound.",a4rv1y
efaha97,"I don't know if anyone else felt this sense of dread throughout the movie. Especially while Cleo was pregnant. I kept thinking something was going to go wrong. but it all ended up okay in the end. From minor to major (the dog always almost getting out, the car being scratched, the boys fighting, threats of physical violence, the fire, the beach, climbing up steep stairs). I feel it ties into the theme of perseverance and found it very effective.",a4rv1y
ecbjr86,"Having a toast to the new year and Cleo’s new baby’s health, only to then have a close up of her cup shattering after falling from her hands was a fucking gut punch of flawless foreshadowing.",a4rv1y
ee2veip,"This film felt personal, as if I was looking through old family pictures. As a little girl my mother would tell me stories of my grandmother in Mexico City, D.F. who worked as a maid for a wealthy doctor.. Roma to me depicts the reality of women and the social unrest that was  prevalent and continues to this day in Mexico. This story could have been my grandmother's, or even mine. The fact that there was no score allowed me to feel each scene organically without being lead to feel a certain way. The dog shit to me symbolizes the daily shit we all have to deal with. No matter  how many times you clean it up the world and life will continue to shit on you. Cleo for much of the movie maneuvers around it and cleans it up but she can't seem to keep up. Much like her station in life, she just maneuvers around her circumstances.   There's so many beautiful scenes but the beach ties everything together for me. The movie opens to the scene of water and the suds which foreshadow the ocean. As she wades in to save the children, the sea cleanses her. When she emerges clean from all the shit she just she experienced. She is finally able to verbalize that she did not want the baby to be born. She is finally able to allow herself to feel human. This movie might not be for everyone, but to me it is important. Stories of Mexican maids are nothing new we see them in cheesy novelas, but we  have not seen a story this raw on the world stage or at least I haven't. ",a4rv1y
