comment_id,comment_body,submission_id
f72zu6h,Hitler's bullet wound made it ten times funnier.,dpqt2y
fepj6gf,I thought he was going to kick him in his four balls.,dpqt2y
fdz9ffx,"IDK, where I'm from gesundheit is kinda understood as a response to sneezing. And I'm from the US",dpqt2y
fg9q8k3,"Oh god, why did you make me remember that? That shit was brutal. But true, now I think about it, it does feel similar.",dpqt2y
fh1u70o,Or pretty much all of Seven Psychopaths,dpqt2y
fhntb5e,Hey there fellow late watcher. Good to see I'm not alone here.,dpqt2y
ffce8p2,I missed the shoes. What about them?,dpqt2y
ffizi6y,"there were shots of scarlett's shoes a lot throughout the film, and we find out about her death because of a shot of her shoes",dpqt2y
f7owvhs,he saw her hanging then grabbed her bike and then hauled ass over,dpqt2y
fhu16rn,"That’s right, they were a couple! I noticed it when he apologized to him after the German Shepard thing (bloody hilarious bit)",dpqt2y
fci758c,And he was very obviously gay + dating his assistant.,dpqt2y
fhhekpu,That's just the colloquial short version I think. The full name would still be German Shepherd's Dog.,dpqt2y
f86iccb,He didn't say otherwise,dpqt2y
fcrm0cr,"I loved the Rosie bit ""It's even worse for me, now I have to live with a crazy person.""",dpqt2y
f70knl4,"I feel like he was also channeling the bad guy in the original Charlie and the Chocolate factory movie. Both tall, wiry, with those glasses with the perfect touch of gentle and evil.",dpqt2y
fgomdyt,One of the greatest achievements of this movie was making Stephen Merchant look terrifying.,dpqt2y
f6yk95e,When he’s flipping through the book it hit me that watching both of those scenes back to back would be a great companion piece.,dpqt2y
f8d64g5,"That's exactly it! I couldn't put my finger on who he reminded on, but you nailed it. Thank you.",dpqt2y
fh43vyq,I definitely had the same vibe.,dpqt2y
f78523l,"Yeah I mean, I do realize the outfit was the uniform that all members of the Gestapo wore, but the glasses and the general appearance of their faces really reminded me of him too",dpqt2y
f788q78,Doctor.,dpqt2y
f7xd656,/r/rimjob_steve,dpqt2y
ht4mhc9,Mind blown 🤯,dpqt2y
f7g8yum,"Yeah to me her death was a bit predictable, but I'm a cinephile, YMMV on this one. Nevertheless I enjoyed the heck out of the film, and figuring out what was coming didn't stop it from being emotional for me.",dpqt2y
feb9omf,"I'm in the UK where it's only been in cinemas a week but saw it a few days ago and thought she deserved the nomination but didn't expect her to get it. Also thought it deserved nomination for best picture and, whilst I doubt it'll win, well deserved.",dpqt2y
f6xp3re,Such a fantastic scene. Completely subverted my expectation of what their initial meeting would be like.,dpqt2y
f6kl5jd,"Yeah, that’s how I took it.",dpqt2y
f7owbh1,he a smart mutha fucka he right!,dpqt2y
fj7d8jq,There are plenty of people (read: idiots) who make statements like this completely unironically and not sarcastically.,dpqt2y
f6k57a5,Same with the German version of I Want To Hold Your Hand in the beginning,dpqt2y
felyew7,Nein; both Bowie and The Beatles sang in German,dpqt2y
fgi5z4y,Both lived in Germany at one point and recorded in German. The Beatles lived in Hamburg and Bowie in Berlin,dpqt2y
ffb9exm,"I, I can remember (I remember)  
And the guns shot above our heads (over our heads)  
And we kissed as though nothing could fall (nothing could fall)  
And the shame was on the other side

Oh we can beat them, for ever and ever  
Then we could be Heroes, just for one day",dpqt2y
f5zfndv,It's easily one of her best performances. The sequence where she played both mother and father made the film for me. I'm glad she's having such a strong year with this and Marriage Story.,dpqt2y
f70ujed,"I was surprised with how much she stole the movie for me. I saw it in previews a month before it came out, but I'm getting tempted to see it again.",dpqt2y
f5zu2ow,"You know, that scene did not work for me. I loved ScarJo as a mom but seeing her die off camera felt a little cheap to me. I get what he was going for and on paper it makes sense but it just didn't hit me.   

Really enjoyed the film, surprisingly sweet. But Rockwell sacrificing himself for JoJo got me harder than the mom hanging.",dpqt2y
f6abdcc,So pretty much just watch movies and analyze them instead of wasting four years on a useless degree,dpqt2y
f72np9w,Me too....me too. 😢,dpqt2y
f6nbhit,"And then at the end, when Jojo's in front of the mirror again like in the opening scene:

""Today, just do what you can.""",dpqt2y
f6hf8eo,Holy shit,dpqt2y
fke8wsk,I have kept those words with me...,dpqt2y
flzg9xo,Right! That's exactly how I felt I wanted to be her son. In like a family strokes movie.,dpqt2y
f66jr7y,"He was gay, so he had a canonically good reason to hate the Nazis.",dpqt2y
f7av8vs,"The biggest giveaway that he immediately came to help Jojo: he came in carrying Jojo mother's bicycle. Him and theon were either there to tell him the news, prepare him for the arrival of the gestapo. They had his mother's bicycle... They knew and came to him. 

Looks like the arrest/execution happened sometime that afternoon  when kid was chillin+cooking with Elsa at home (feet were quite blue by the time kid found them). The gestapo likely came in after Rosie was caught to search the home for any clues to the resistance+hideaways but were instead vouched for by Sam Rockwell as true nazis unlike their mom + the book. 

Man when he was chasing the butterfly, I was literally ""we haven't seen ScarJo in awhile, guess she's just a minor minor character"" then my heart sank",dpqt2y
f7doq1i,Ohhhhh that's why he came to the house! And that's why the gestapo was there. Oh wowww. All I caught was that he told him to stay inside.,dpqt2y
fdrwu8a,"> he also immediately comes to help Jojo when he finds out about his mom, which is why he shows up at his house in the first place.

I didn't even put that together, good catch",dpqt2y
f72o97w,How does that imply he helped the allies? I don't follow,dpqt2y
fgemf4x,"(Sorry it's been months but I just saw the movie)

There's also the part when Jojo blows himself up and what he says when he sees him in the hospital is ""his dad is gonna kill me"" when we find out later his dad is a resistance leader off somewhere",dpqt2y
ff4nnix,Yeah i thought it was pretty clear from the beginning that he hated the Nazi party,dpqt2y
fh88eme,"That's pretty obvious he was protecting city from Soviet, to let Americans capture the city from the other side, their part was intact",dpqt2y
ffexe1w,I think you're mostly right but I don't think he helped the allies.  He was shooting them and then shot by them in the end.,dpqt2y
fdtahjt,[deleted],dpqt2y
f6ji425,"Bush in *Vice*

Dixon in *Three Billboards*

A literal Nazi in *JoJo Rabbit*

Damn!",dpqt2y
f60fpuh,There's more to it than him being a Nazi.  He was hiding too.,dpqt2y
f6b8ipf,"It wasn’t a redemption arc though.

It was revealing that he is a gay man in hiding from the Nazis. It’s hinted that he wounded himself and his troops he either help the Allies, or to get out of fighting. He was never a Nazi, he was simply trying not to be killed.",dpqt2y
f60i9u6,Gay Nazis need love too,dpqt2y
f66jw2w,Did you even watch the movie?,dpqt2y
f6166bq,"captain k and finkel were absolutely gay, there's no way they werent",dpqt2y
f61kwzj,Another thing I noticed is that when JoJo and his mom Rosie were at the courtyard where they were staring at the one group being hung the person that the mother focuses on has the same paper that she is shown leaving on on a table later on in the movie. That means they were probably friends. Also Rosie was wearing sun glasses at the time to probably hide her red eyes and tears.,dpqt2y
f611fnh,I love that performance because it feels like he was channeling his emotions when Philip Seymour Hoffman died. His close friend and mentor.,dpqt2y
f65xqpm,Rockwell is so great in that. And in this.,dpqt2y
fg3wirm,AND 7 psychopaths,dpqt2y
fdrx67i,Got a new one to add to my to watch list,dpqt2y
f6k4bqw,Pretty much all the characters in charge of the Hitler youth camp were acting like they were working for a company that they knew was about to go bankrupt and were just collecting their paychecks until the hammer came down.,dpqt2y
f7792lp,"Yup, he was basically mocking Jojo, and thought it was funny that he didn;t know his mom was hanging in the town square.",dpqt2y
fh2ah5z,"""I need a cuddle""",dpqt2y
f6l7pe7,"I suppose that's possible but I didn't take it that way at all. I think she just got caught putting the ""Free Germany"" notes or w/e they said out. If Jojo could happen across her doing it, I don't think its unreasonable to assume people that don't want her to be would too.",dpqt2y
f77ek6k,For me both Jojo and Yorkie reminded me of Simon Pegg and Nick Frost.,dpqt2y
fijg63z,Rebel Wilson's character gives him a gun and tells him to shoot anyone who doesn't look like us at the end.,dpqt2y
fg3p71d,"Wowi don't actually remember seeing anyone interacting with him lol. I feel like he's a real person though, since imaginary Hitler was the main focus",dpqt2y
f7qalb0,"Yeah i feel like every movie needs a good ""fuck off, hitler"", I'll be disappointed if we don't get one in frozen 2",dpqt2y
fg4e5j6,Yeah he did but its a minor swear word so it gets a pass,dpqt2y
f6ac4st,She was pretty good with the small scene she has playing timothee sister in the king,dpqt2y
fh2fg4n,good bot,dpqt2y
fj672n7,great bot,dpqt2y
fcwd0wn,"I agree! The critics and the awards for GoT always seemed to focus on the same few cast members over and over, while Alfie was there giving one of the best performances, once of the best character arcs. Some of the work he did was just an absolute transformation, but nobody ever seemed to be like rooting for or promoting him. HBO wouldn’t even submit him for nomination at the Emmys last year, he had to do it himself.",dpqt2y
fd9262n,I thought he was great in John Wick the only other thing I seen him in. Or at least the club scene. His acting of pure terror as he tries to escape is one of the most memorable scenes for me,dpqt2y
fgik3wa,"One of the things that always frustrated me about GOT was just the continual award recognition for the same people over and over. Alfie Allen is SO talented, and he still had to submit himself for an Emmy. Plus Theon had one of the actually great, fully-realized actual character arcs.",dpqt2y
f91fxdx,"He yelled one or two words out in his first scene when Jojo first went to the camp, but otherwise yes, he could have been mute. I wondered if something was up with him.",dpqt2y
f62oteg,"That's fair. He was most likely just there because he had heard about the hanging and he got there at the same as merchant who had also heard about the hanging at the same time. Stephen was there because he heard she had rebelled and sam was there to check on jojo.

Something about Sam's character (who I cant remember for the life of me) made me think he knew rosie before. Their interaction at the pool and the one I mentioned earlier. Plus he seemed to have a soft spot for jojo. Maybe he knew his dad, idk.",dpqt2y
f72dwrm,"My best guess is that they both helped the resistence and she may have been pretty ""high ranking""/important in it. Their interaction at the start of the movie was no way a ""good aquaintances"" interaction. Those are two people who know each other very well, and their dynamic spoke to her having some kind of role above him. She definitely held the power in that entire scene.",dpqt2y
fhmofg4,They were both in the resistance.,dpqt2y
fhc0tfz,"Pink triangles? I must have missed that detail. If it was explicitly pink triangles yeah they were gay. 

Which makes sense with when he helped cover for them when the Gestapo showed up...",dpqt2y
fai812p,Why leave after that scene? That’s weird.,dpqt2y
fiidze5,I'm so glad I wasn't the only one who thought of jojolion,dpqt2y
f76s579,I'm the guy that started the cry train in my row,dpqt2y
fcy11h1,That or he knows Tarantino is on the jury for the Palme d'Or or something this year,dpqt2y
fhv52qp,There’s this thing in it,dpqt2y
f6xxxn9,"You’re right - maybe humanize is a better word for Captain K. He just wasn’t 100% evil and did a few decent things. 

“Sympathize with a nazi” was from the same review. Just clarifying because I didn’t make that clear at all. (I was exhausted.) That alone makes it obvious they missed the point.",dpqt2y
f72suvz,"And Rockwell is literally executed as a POW. Even if you believe the film redeems him, it also metes out the ultimate punishment.",dpqt2y
ff7ss45,Yes.,dpqt2y
fmhrpzp,Yeah it was hard for us to laugh at that because ok screen everything she did seemed utterly absurd but in reality at that time it seemed fine and normal.,dpqt2y
f7dnm6w,The two of them at the pool and then the part when he yells at him and they almost kiss after gives it away.,dpqt2y
fe6p7tq,I know it's 2 months late but I only just saw the movie. Another clue to them being gay is Alfie Allen's Cape was covered in pink triangles which was what was put on gay people's clothes in concentration camps to identify them as gay,dpqt2y
f62ar53,"Seriously. Anyone that would give this movie a bad review is either an idiot, or an outright monster.",dpqt2y
f723za0,">But giving it 2 stars for a minute that was largely successful in what it was trying to convey

What minute are you referring to here?",dpqt2y
f67kgi3,">I think it's moreso with Film Twitter than professional critics.

I don't really keep up with ""Film Twitter,"" but I'm interested in this -- can you say more? Like, why do think it's Film Twitter hurting the RT score, and what's the distinction there?",dpqt2y
f6kirbd,And 96% for Wilderpeople,dpqt2y
f62nics,[deleted],dpqt2y
fjb2ln8,"I missed this. How did you pick up that he was actively part of the resistance?

Some headcanon based on this: he keeps grumbling about being demoted all the time. This could be because his superiors have suspicions about his loyalties, and don't want him in important roles where he could have greater effect in undermining Nazi efforts.",dpqt2y
flfrsam,He also already had jojos innocence figured out by then. He showed him that uniform days before the battle. He knew jojo wasnt hateful and showed him his true self in the only real way he could.,dpqt2y
fk7le0u,Don't even have to go that far. You can take an example from the middle east 😂,dpqt2y
fj62w2d,"They also said ""огонь"" right before the shooting started, the russian word for fire.",dpqt2y
fk0i4i5,Yorki's paper uniform fell apart. You can see he's running around in underwear. So it's likely the allies saw him as a harmless kid.,dpqt2y
f61d0vf,"> I mean, it shows you the horrors of Nazi rule by literally showing the kids mom hanging and him, a child, having to deal with it. He loses both his parents to Nazi's 

It literally does not because you never see Jojo's father, and only part of his mother's body. Waititi cuts away from the horrors of Nazism, while better WW2 films do not.

>  I had never seen a film like this. 

That's because it's in poor taste to depict Nazism this way. That being said, Life Is Beautiful and Au Revoirs Les Enfants are somewhat similar.

>  It's possible to still be poignant and also be light hearted.

Not about the Holocaust.

> I didn't find this film sympathetic to Nazism at all, the opposite really.

I never said it was!

> Anti-hate movie

He calls it an ""anti-hate satire,"" which to me is kind of redundant. A pro-hate satire would be propaganda.

> I guess I can see your point of view.

I can see yours! I can see why it worked for some people, but it REALLY didn't for me.",dpqt2y
f79ftsw,"Right? I could picture this being that scene that is just so absurd and great that people cherish.

Like airplane has a lot of them but the one that always sticks out is ""I am serious...and dont call me shirley"". This felt right up there with that.",dpqt2y
f77f58a,"That's surprising then.  I'm not religious, but I was born and raised Jewish (definitely culturally Jewish), and I've heard the joke now and then.  I haven't heard it in years though.",dpqt2y
f8v8oxb,"The interview I saw was a YouTube one, but I found a written article interviewing the film’s editor, Tom Eagles. 

https://www.awardsdaily.com/2019/10/25/interview-tom-eagles-on-creating-the-tone-of-taika-waititis-jojo-rabbit/



- Edit -

When I was searching for the above link, I found a different article by the [Hollywood Reporter](https://www.hollywoodreporter.com/features/making-jojo-rabbit-how-taika-waititi-scored-beatles-music-his-hitler-satire-1252528) 

“Once the 40-day production wrapped, Waititi placed a cold call to Oscar-winning composer Michael Giacchino, who'd scored projects ranging from Ratatouille to Jurassic World. Recalls Giacchino, ""He was like, 'Do you remember what you did for Up?' And I go, 'Yeah, I remember that.' And he goes, 'Just do that.' "" While Waititi and his editor, Tom Eagles, spliced together footage, Giacchino and a 35-piece orchestra recorded about 45 minutes of fairy-tale-style music at Abbey Road Studios in London. But Waititi also wanted the soundtrack filled with more contemporary music, like Beatles songs. During research for the script, while watching documentaries on the Hitler Youth, Waititi couldn't help but notice a creepy historical echo. ""It struck me, the similarities between the crowd at Hitler's rallies and the frenzy at Beatles concerts,"" he says. Wrangling the rights to German-language Beatles songs for a comedy about Nazism proved to be difficult, though. ""The first response is, 'Um, I don't think we want to do that,' "" says Giacchino. But, having previously worked with Paul McCartney, the composer made a direct plea. ""Once his people saw the film and understood, they made it happen,"" he says.

The first assemblage of Jojo ran two hours and 40 minutes, way too long for a comedy. ""We didn't want it to turn into Titanic,"" says Eagles. 


This doesn’t really talk explicitly about the footage, the first article I linked does, but I think I love how when they wanted to get the rights to the Beatles songs, Michael Giacchino, was like “...yeah.... we can’t do that...” and then they did it!!",dpqt2y
f79krdm,"Yeah, that's exactly my point. Even though we're hearing English, the characters are all supposed to be speaking German. Which makes this and the ""Shitler"" joke impossible. You have to just ignore this fact and not think about the language situation.",dpqt2y
f6ycbay,"Between *Parasite* and *The Lighthouse*? Definitely *Parasite*! I loved them both, but *Parasite* is a 10/10 movie for me. Even my parents, who are in their 50s and don't watch many foreign films, loved it. Plus, it'll probably get a Best Picture nom.",dpqt2y
f62mzwe,I could see it.. but I'm thinking they start just nominating everyone from little women if they actually run out of spots before double nominating scarjo,dpqt2y
f68o8zv,I can see Thomasin sneaking in too. It isn’t as flashy as Scarlett but the subtlety of her performance is pretty good. Two supporting Oscar noms for Jojo might happen,dpqt2y
f68oz3h,Letterboxd is 10 times worse they comparing it to the goldfinch like wtf. Snobby “cinephiles” imo,dpqt2y
f6blzyk,During the dance scene and after the credits,dpqt2y
f70a26n,Oh maybe! I figured they had to have some sort of understanding with each other.,dpqt2y
f6zw9td,"Oh yea theon, that's what I meant. Ahhhh didn't catch that",dpqt2y
f77a3fh,"> So Sam Rockwell as a leader of whatever he was the leader of made a bad call on purpose which made him lose his eye and get demoted.

I took it as he had been a good soldier, but his injury and decommission gave him the opportunity to think about the war more closely, and he turned after that.",dpqt2y
f71o3ic,"He specifically calls her one of the few truly good people he's met. She had his respect, and he had her trust or she wouldn't have put Jojo with him to work.",dpqt2y
fiu4dtw,Oh my. Even cuter.,dpqt2y
fmhs479,That was such a precious line.,dpqt2y
fhsicsp,Fucking sad,dpqt2y
fmyrv1f,"The captain was a closeted gay man. He would've been killed for that under the Third Reich as well, and so he hid it. That is why he had sympathies for JoJo.",dpqt2y
fkkzlmr,"That makes sense. I guess that's also why he said ""Your mother was a good person. Like, an *actual* good person."" at the end.",dpqt2y
flfqy1o,"Yeah i think the captian was a bit more complicated than people give credit for.

He seemed like he might have seen real war (and lost an eye for it) and just couldnt deal with it. Always seemed to have a death wish/lazy attitude to anything that he was assigned.

He probably did know because in the end with that line and then his lies to get jojo out of there as well as encouraging him to look after that sister of his (calling him a jew aswell).

He seemed like the only really tragic adult nazi portrayed (which is hard to do but they were just people who became evil by 'just following orders'l",dpqt2y
f86qmee,"That's a single review from an n0-name publication, and generally, video games lack swastikas in order to sell in Germany. Lots of leftist and ""PC"" publications love this movie.",dpqt2y
fdda6fv,The acting chops on that kid in that scene... sheesh.,dpqt2y
ffvrq4v,That was before Captain K and Jojo meet. At that point the war is over. K is alone at that point in the movie I'm talking about.,dpqt2y
f6e7xio,"It's still a fairly short list, in fairness.",dpqt2y
fn0zb1e,"See 1917 when you can. It’s really damn good. The bigger the screen you can see it on, the better the experience will be.",dpqt2y
fmzjkhk,That's what I think too. I doubt she just left him there alone. They probably both eventually reunited with other family.,dpqt2y
ffxyftr,Yeah I saw it last night. I think she is more likely to win for Marriage Story than JoJo Rabbit.  I think Sam Rockwell should have got a nomination.,dpqt2y
fdi7e4w,Darkest?,dpqt2y
fcu7vsd,Ah yes... now I remember. Cheers,dpqt2y
fg5xrbk,"Berlin in 45 was mostly destroyed

You have to go back 3-5 years were it was at it's prime.

Yea also because the ns regime was build on other peoples money.",dpqt2y
f7xckkx,"Definitely, there were pink triangles incorporated into their new uniforms",dpqt2y
f78a1hc,I loved that the German Shepards ended up in the fight after all,dpqt2y
f75reut,"I caught onto it almost immediately, but I'm also massively Queer so maybe my sensitivity to it is just heightened.",dpqt2y
f77h00u,"I’ve just seen other comments on this thread asking if he was gay or saying something like “oh was he? I didn’t catch that”. I just think it would have been more affective if it was obvious enough that there was no question to it. With that being said, I still think the film was perfect and that little nitpick is just a personal qualm.",dpqt2y
f76gm9e,"^God ^dammit
They were never in any real danger, it was the *implication* of danger",dpqt2y
fg2v7rv,Im actually really sorry to hear that friend. Hope you're doing okay ♥,dpqt2y
fglfk3z,"Maybe more like authority or fear or respect, because he gay man",dpqt2y
fgv8bv7,"“Free Germany, fight the party”",dpqt2y
fgpon1s,"> ""Free Germany""",dpqt2y
fh1h3jn,"It was a bit more than hinted. In the last battle, Sam Rockwell had a pink triangle on his uniform and was wearing heavy mascara, and Alfie Allen had a cape completely covered in pink triangles. So it was quite obvious that they were gay.",dpqt2y
fb3sko8,"Yes, when Jojo gets hurt early on, K says, ""Your mother is going to kill me for this...""",dpqt2y
fe3mi2y,I dont think they ever said his dad was jewish,dpqt2y
fcv6qlk,"Agreed. Thor 3 is great for a marvel film, but lacks the heart of HFTWP, Boy has a lot of heart but is sadder and less funny, good in its own way.",dpqt2y
fcm4eo3,"I thought I was the only person who saw that movie. 

It was weirdly good. I don't find it as good as JoJo Rabbit, but still a great movie and worth a few watches.",dpqt2y
ficearr,Oh ok. Why didnt they kill jojo too?,dpqt2y
f6xctn8,From the perspective of JoJo Captain K is the tallest man we've seen and then he's just dwarfed in that shot with the Gestapo and it's chilling.,dpqt2y
f74i8nt,"Even as someone who isn’t big into horror, I think that’s a problem.",dpqt2y
fep8mmx,"TBH awards season is basically Hollywood's season long self wank session to whatever satisfies *their* kinks at the moment. At least this year, they did give accolades to movies that a good portion of the public has seen and have given good reviews to.",dpqt2y
f77fb6g,"thanks for the response! haha, i forgot about that unicorn scene. yeah, i can definitely see why it would get to him.


thinking more about hitler's change throughout the movie, it's probably meant to represent jojo's cognitive dissonance after befriending elsa. tho now i'm also seeing it as taika saying, ""yeah, we can poke fun at this historical figure but let's not forget he was huge fucking cunt.""",dpqt2y
fetrim7,It can also be seen as him not being alone but with all the other Jews hiding in attics looking at him. He's not the only one experiencing this loss even though he thinks he is alone.,dpqt2y
fg802qy,I mean. You’re allowed to have opinions that are wrong.,dpqt2y
fgngtso,[It's this scene.](https://youtu.be/mCXBbb4g1NM?t=40) Those red shoes belong to Jojo's mother. She was hanged for being involved with the resistance.,dpqt2y
fgl7mc8,"I don't know how I didn't notice the butterfly in this scene. Mind must've wandered for a moment.

Thanks for the response!",dpqt2y
f6qsko5,"Presumably after the execution, and that's why he went to JoJo's house",dpqt2y
f6x2v4w,Didn't she put one of her papers on a table and Jojo saw her doing so? It's possible someone else spotted her. At least that's what I assumed coming out of the theater.,dpqt2y
