comment_id,comment_body,submission_id
f5zm9gt,The shoe scene was goddamn devastating.,dpqt2y
f74tobr,"""The only ones on our side are the Japanese, who, if we're being honest, don't look all that Aryan"" 

Best line of the movie. Hilarious, and also captures the idiocy of the Nazi ideology.",dpqt2y
f620fwt,"When Jojo started chasing the butterfly, I started thinking, ""Oho, he's going to get such a life lesson when that butterfly gets run over - life is fragile or something poetic like that.""

And then... yeah. Almost fell out of my seat there.",dpqt2y
f5zrxx0,The scene where Rosie wipes the ashes to her face and pretends to be Jojo’s father is fucking amazing. Scarlett’s best work that I’ve seen (Haven’t seen Marriage Story tho),dpqt2y
f60n6x0,Definitely going to be a mainstay of when people ask what PG-13 movie had the best single use of the F-bomb,dpqt2y
f60obji,"""...sorry, am I interrupting something?""

""No, no. We were just here, 'Heil Hitler-ing' the boy.""

""When I asked for german Shepard's I didnt mean actual German Shepards!""

I loved this film. I just didn't get how neighbors, the state or anybody offered to take care of the kid after his mom died. 

I'm assuming its because they were preoccupied with other things at the time but they literally just said ""oh well"" and left him to his own devices.",dpqt2y
f6a9z17,Jojo reminded me that Scarlett Johanssen can act. Something that they didn't let her do in the MCU.,dpqt2y
f6ebclq,I loved the film’s intro. Beatlemania but for Hitler with “I Want to Hold Your Hand” in German playing. Absolutely brilliant.,dpqt2y
f7da88p,"Saw it tonight and loved it. Just wanted to share my theater experience as I thought I witnessed something really sweet:

So I was in a really small theater and directly in front of me was a mom and her probably 13 year old son. As the previews began they started going back and forth arguing because the son wanted to get popcorn and the mom was telling him no. This went on for what seemed like 5 straight minutes as he kept persisting and it got to the point where she just goes, “I will drag you out of this theater right now if you don’t stop and watch the movie.” Needless to say he was pissed but finally gave up when the movie started and I just laughed to myself.

Fast forward to the end of the movie, and we obviously just sat through this very deep and emotional story centering around a close mother-son relationship. As soon as the closing credits started rolling, I look down and see the boy leaned over tightly hugging his mom. 

It was a small thing to witness, but I just found it really touching to see how the story clearly moved this boy.",dpqt2y
f6vfi6k,"i didnt see much comment on this, but i loved the scene where the older hitler youth kids are being sent off to die on the front and still acting like stupid teens, mocking some dumb kid. it really drives home how young and immature they are and makes even those guys sympathetic.",dpqt2y
f621nil,"I think the movie did a great job capturing how silly Nazi ideology is, while also showing the damage and human suffering it causes.",dpqt2y
f6ha6ke,"The shot where Jojo sees his mother's shoes is probably now one of my favourite shots in film ever.

I expected the laughter. I didn't expect so much crying. What a fantastic film.",dpqt2y
f6tv52c,Something I haven't seen many people talking about yet is how immediately after the butterfly scene as Jojo is mourning Waititi lets the camera sit on the roof dormers (like the one Elsa can look out of in her hiding spot) looking over the hanging. The thought of other Jews hiding in all those homes mourning with Jojo brought the scene up to 11 for me.,dpqt2y
f5zjj5h,"I needed way more Yorki. That kid had me dying every line he had.

In all honesty though, one of my favorite movies of the year.",dpqt2y
f7qjxfy,Sam Rockwell yelling at Jojo calling him a Jew and thus saving him really was amazing.,dpqt2y
f6ivmij,I really enjoyed the scene where Elsa and Jojo were competing trying to see if there were more famous Jews or Christians,dpqt2y
f5zxze6,"elsa: “you know what i am. say it.”

jojo: “a jew” 

elsa: “gesundheit” 


perfect.",dpqt2y
f5ztqmz,Sam Rockwell's last scene had me sobbing into my popcorn,dpqt2y
f60unxh,"Considering the current climate, this movie could've really been mishandled but Taika nailed the perfect balance between comedy and seriousness by always having the brutality of the Nazi regime bubbling underneath the surface ready to pop out at any moment. Two scenes in particular really highlight this (the Rabbit scene and that OTHER one, I'm sure I don't have to describe).",dpqt2y
f5zqw40,That German Shepard bit was worth it alone,dpqt2y
f6l380b,"having trouble digesting the content of the critics’ negative reviews - i thought this was a blithely beautiful melding of comedy and the atrocities of war. scarjo and rockwell were excellent, but my god, the kids. a lot of good child performances are created in the editing room... but not here. raw and honest and hysterical. sweetness without sappiness.

one of my favorite movies of the year.",dpqt2y
f5zdrh5,"Captain Deertz having his whole group saying ""Heil Hitler"" one by one killed me, despite the suspense of Elsa getting caught.

I love how gradual Jojo's respect and love for Elsa grows throughout the movie (despite the extreme adversity between the two), the chemistry between them was fantastic. By the time they were dancing at the end, I had a huge smile on my face; it felt like the true beginning of a beautiful friendship",dpqt2y
f694war,"While a lot of people have pointed out the focus that was put on Rosie's shoes and how it sets up the future gut punch I feel like I haven't seen anyone discuss the relationship between Jojo learning to tie his shoes, how it parallels his evolving worldview, and how it relates to one of the over-arching themes of the movie.

At the beginning of the movie, Jojo doesn't know how to tie his shoes and needs his mother to do it for him. At this same point in time his worldview is immature (you could even argue that it's non-existent); he's entirely bought into Nazi propaganda and parrots all their beliefs. He needs someone to tell him what/how to think as he doesn't have the experience to form his own ideas. 

As the movie goes on he takes these beliefs and ideas out into the world where they begin to be challenged. He sees the bodies of Germans being hung, bonds with Elsa, and discusses the war with his mother. Ultimately, he discovers her body as a result of her involvement in the resistance. He tries to tie her shoes for her as he mourns but ends up failing halfway through. 

To me this represented the true test of his beliefs. There's an internal conflict between his support of Nazi-ism and the love of his mother & Elsa. He's struggling to reconcile his support of the war with the horrors he's seen.  How can his mother, his caretaker, the best person he knows, be will to sacrifice everything to fight against everything he believes in? While he doesn't completely denounce Nazi-ism at this point you can tell that, at the very least, he's halfway there. While he couldn't tie his mother's shoes, he was able to get halfway done.

His disillusionment continues to grow through out the battle preparations, his discussion regarding Jews with Yorki, and the conclusion of the war itself, culminating with him yeeting imaginary Hitler out of a window.  It's only after this that we finally see him successfully tie Elsa's shoes.

Tying your shoes requires a base level of coordination, dexterity, and fine motor skills and is considered a developmental milestone. It's one of the first things you learn that requires actual effort and practice; it requires trial & error. It marks the transition between infancy and childhood.

In the same vein, a nuanced and mature out look on life isn't something that you're born with or can be given. It's something that is constantly evolving, refined by life experience; it's something that you have to be open to and to continue to work on/towards. Realizing this is a milestone and marks the transition between childhood and adolescence. 

To me Waititi is saying that Nazi-ism and other worldviews based on massive generalizations and hatred of those who are different than oneself are immature and childish. Recognizing this is so fundamental; so incredibly basic; that it can be compared to learning tie your shoes. Much like how tying your shoes is a key marker in growing up, hate-based ideology is similarly juvenile and must be left behind.",dpqt2y
f7domu1,"Scarlett Johansson dying in this film gave me a far greater gut punch than her death in Endgame ever did.

She was really charismatic in this film, the characters were all written great!!",dpqt2y
f7khpsx,I’m thinking the recurring motif of shoes is also a reference to the thousands of shoes on display at various Holocaust museums that were taken away from those arriving to the concentration camps. It’s always a startling image.,dpqt2y
f67phbc,"I did not expect to love this movie as much as I did.

I went in only knowing the logline but my expectations were completely exceeded. I loved the humor, the heart, the performances, the satire, it was honestly my favorite movie this year since Booksmart.

But holy shit that Butterfly scene still haunts me. I initially thought ""Oh I bet a Nazi is gonna crush the butterfly, being a cheesy metaphor for Elsa's imminent danger."" But then the camera fucking panned up to the reveal and my jaw literally dropped, that brilliant, subtle reveal felt like a punch in the gut. What I love about movies is the roller coaster-ride of emotions -- joy, love, anger, sadness, triumph -- and this movie definitely made me feel all of them. 

Overall solid 10/10 movie and I'd bet money that it's gonna be at least nominated for Best Adapted Screenplay",dpqt2y
f78af0z,Underrated line...when Hitler refers to her as a Jesse Owens/Jack the Ripper Jew 🤣,dpqt2y
f6e55z6,This is one of my favorite movies of all time.,dpqt2y
f60l8nd,"One thing I appreciated was how many good visual jokes there were in this movie. So much of comedy today is just dialogue driven but this used framing a lot to create laughs. 

The way Hitler entered the frame usually got a laugh, Rebel Wilson sliding down the bench, lots of good stuff",dpqt2y
f6tmjns,"So many good one liners and funny moments in this movie intertwined in the serious coming of age movie. I really like it. Some favorites:

- Elsa: You know what I am, say it""

""A Jew""

""gesundheit""

- Several of the ""Heil Hitler"" scenes

- ""I just need a cuddle""

- Jojo defending himself as a Nazi because ""I'm massively into swastikas""

- The German Shephard bit was hilarious",dpqt2y
f60zeb7,[deleted],dpqt2y
f61nbhl,I was in near tears when they’re dancing at the end to a German version of “Heroes.” There’s just so many layers there.,dpqt2y
f8a0c9a,Waititi is always great with child actors but Roman Griffin Davis had such a gargantuan task here of carrying so many of the film’s blending tones on his shoulders and he succeeded entirely.,dpqt2y
f5ze4gq,"I love how Taika established the shoes of Jojo's mom, by the time we saw them hanging we already knew who it was.",dpqt2y
f60u3qr,"The part where Yorki hugs Jojo in the metal costume was too cute. I loved their friendship, I wish there was a little more screentime with them together. Jojo's reading letters to Elsa were also some of my favorite moments. Solid coming-of-age movie, overall. I like how they made fun of blind fanaticism and hatred, without it feeling preachy to me. I want to recommend this movie to more of my friends and family, but I mention nazi youth, Hitler, and satire, and I kinda lose people.",dpqt2y
f85s9f0,"In the final scenes of the movie, when Jojo is flipping through his book, one of the pages is illustrated with a key and a caged rabbit. After seeing the page, Jojo decided to free Elsa, so arguably the caged rabbit symbolized Elsa. The beginning of camp showed that Jojo was not capable of killing a rabbit,  foreshadowing his inability to betray Elsa.

However, the film is called ""Jojo Rabbit,"" Jojo had been ridiculed as JoJo the rabbit, and even the imaginary Hitler friend tells Jojo to embrace his identity as a ""rabbit."" What I took away from the movie is that the rabbit symbolized childhood innocence, full of friendship and love.

Jojo is only 10, and despite his efforts in trying to be a Nazi, his innocence prevents him from killing the rabbit. His imaginary Hitler friend, although at times supportive, is corrupting Jojo's innocence; he is told that the rabbit is cunning and vengeful. Jojo doesn't know how to tie his shoelaces (a process in which Rosie described as making rabbit ears), a skill expected from a child at his age.

When Jojo witnesses the death of Rosie, he tries to tie her shoelaces, but couldn't. Only in the final scenes, when Jojo decides to free Elsa, and evicts imaginary Hitler from his mind, does he bend down and tie Elsa's shoelaces. Jojo embraces his childhood innocence and shares it with Elsa.",dpqt2y
f5zdsob,"Sam Rockwell saving the “sister” made the movie so much better, and then he saved JoJo. Such amazing emotional moments for a comedy, by far my favorite movie of the year.",dpqt2y
f6hiot1,"yorki was totally, wonderfully played. every time he came on screen the audience was squealing. i wish there was more discovery in rosie and the captain, it's clear he knew to step in when jojo was getting inspected but we never figure out why or how he knew. also i should've known about the mom's death they allude to it with shoe shots throughout!!! overall very sweet, and also.....just kept getting darker and darker. wow.",dpqt2y
f61ltzd,To say that this movie is an emotional roller coaster is an understatement. I think Taika Waititi is one of the few people to be able to pull of a coming of age story that’s morbidly funny at the same time.,dpqt2y
f703vr7,"Towards the end of the movie the scene where the Germans are making their last stand and you see children and businessmen and soldiers charging into battle is so fucking good. Like it may be one of my favorite scenes from any movie ever. Also the buildup where Yorki (I think it was him) lists all the countries that are against Germany and concludes they must all just be wrong is so cleverly done.

It's just so poignant in how tragically funny it is. The war effort is clearly lost but we see shot after shot of the absurdity of the final stand. I also think that despite this being a semi-comedic movie it does a great job depicting just how much the order and structure breaks down in the final moments. Earlier in the movie we see characters getting scolded for raising ideas like recruiting ""German Shepards"" or designing new uniforms but in the end both of these play out on the battlefield as there is no longer anyone there to maintain the Nazi party's order and calm they tried to maintain even in the final days.

Really fantastic movie.",dpqt2y
f5zoeb0,"I can’t remember the last movie I saw where the credits rolled and I was both in tears and smiling at the same time.

Fantastic movie.",dpqt2y
f5zjwfb,[deleted],dpqt2y
f6e91yj,Do you think Sam Rockwell character sabotaged himself to avoid combating in the front lines. I remember he said something like he lost his eye in a totally avoidable accident or sth like that. Does anyone else remember what he said and does this theory make sense given his actions at the end of the movie?,dpqt2y
f8au92z,"""What did they do?""

""What they could.""",dpqt2y
f7kfc7e,"Just saw it today. Wow. There's so much. 

I think people have talked up Sam Rockwell's character in significant length already so it's hard to find much to ad there. Or at how hard of a gutpunch Rose's death was. 

I guess one that stood out for me was Elsa's 'strength' speech. I'm not religious, but her delivering that line ('we fought giants' or whatever the exact wording was) with such obvious strength of faith was really something. Her actress' performance was intense and amazing.

And not that it needs to be said, but 'fuck off, Hitler' is never *not* a perfect way to cap off a film.",dpqt2y
f5znw3h,"I’m amazed by this film. I can’t believe how Taika combined absurdly dark humor with a legit Coming of Age story. Also, I had no idea how deep the cast was. Scar Jo, Sam Rockwell, and
Rebel Wilson all turned in hilarious but profound performances. I still can’t believe Taika invoked Saving Private Ryan coupled with hilarity. This film is incredible. 

Also, FUCK OFF HITLER.",dpqt2y
fc27gw0,"Our only friends are the Japanese and just between you and me they don't look very Aryan   


So much depth and nuance within that one single line. Taika you genius, you've done it again",dpqt2y
f6046tq,"I was laughing so hard I was screaming during the Beatlemania opening. It was so fucking insane, but it worked. (Just wish the rest of the movie had that kind of fire.) The reveal on Scarlett's shoes was brutal and I loved Elsa's monologue about how Jews are stronger than Nazis. That was powerful.

Also loved watching Alfie Allen. His body language was just like a 1930s actress. Kind of sad too when you realize he and Sam Rockwell were probably just trying to stay alive when they otherwise would have been sent to the camps.",dpqt2y
f69sm8y,"Holy shit this took a turn. I expected the comedy to continue all the way through, not that. Damn. 10/10",dpqt2y
f61s3st,"I love how Jojo based his imaginary Hitler on his mom. All the nice uplifting things he said and his goofy actions were just like how she acted.

Until he learned what a monster his hero really was.",dpqt2y
f6tr8ic,"This movie is quite possibly one of my new favorite movies of all time! Everybody did such a fantastic job! My only pet peeve was Hitler and the cigarettes since he was very much against smoking, but then again I remembered that this is a child’s imaginary friend. Scarlett Johansson did phenomenal! Possibly the best I’ve seen her act! The scene with her acting as the father made me cry a bit but I broke down when Jojo found her. By the end of the movie I really fell for Elsa😍

This movie made me rediscover why I loved going to the movies as a kid. It made me laugh, cry, and overall just reflect on my own life. There is such a disconnect between critics and general audiences nowadays, I’m so glad I ignored the reviews.",dpqt2y
f6kfz1d,Sam Rockwell gotta stop playing people who I hate and sympathize with. Damn 3 dimensional characters paired with great actors.,dpqt2y
f6zbavl,"Thought this movie was fantastic. 

""My people wrestle with God and kill Giants with stones!"" 

God I loved that line.",dpqt2y
f6jzz0w,"Fascists love to imagine themselves bigger than they really are. *Ahhh*, they drawl, dragging on a cigarette, *yes, we call for blood and personality cults and rigidly stratified hierarchies and death to the enemy race, but you see: we speak to the people, and we bring prosperity, and now the trains run on time.* So goes the myth. In this telling, fascism may be bad, but it’s the *cool* kind of bad. You know: the grand, rugged, glamorous kind of bad; the kind that knows what it wants and takes it and maybe deserves to have it on sheer strength of will alone. So often fascism gets to be the Byronic hero of political systems. Such is the power of the myth. Individually and collectively, many historical dramas feed its glow.

*Jojo Rabbit* cuts it off at the knees. It takes the Nazis’ proudest win — the total mobilization of Germany, men and women and children alike — and skewers the inefficient absurdity of its design. Militarizing kids sounds big until you see them walking around in boy scout gear, tripping into grenades, lugging guns they’ve only fired in their dreams, getting under their teachers’ skin. That’s the silly part. Then you see them shipped off to die in a losing war because there are no more men left to burn, and that’s just sad. The myth shrivels in the face of those images. There’s no way to take this so-called efficiency seriously when it’s so painfully clear that their tactics come down to desperation.

Taika Waititi finds plenty of jokes on these grounds. He’s never without a barb for the Nazis’ delusional grandiosity, which is funny and also politically helpful: nothing kills a glamour like laughter. But he doesn’t laugh at everything, either, because he knows where the power lies. The economy slows; the trains go to shambles; the fascists never deliver on their promises of plenty — but there is one thing they can do, and that’s the myth.

Waititi is deadly serious about the power of myth: the fantasy of being a somebody, a part of a bigger something, and never wanting for glory or purpose or love. Jojo Betzler aches to belong to something, as children do. He joins the Nazis for the myth. He becomes a fanatic in a desperate stab at being more than an ugly, lonely boy. And he believes it all the more fiercely because he’s afraid he’ll be empty when it’s gone. (Why does this sound familiar?) No wonder his imaginary Adolf Hitler is such a dream friend, silly to play with and too strong to knock around and deeply fascinated by the daily turnings of his ten-year-old life. The story of fascism is that it’s always there for you. Jojo’s challenge in growing up is learning to let that comfort go.

This is not to say the movie casts all stories as childish things. Elsa has her own: a dead boyfriend she pretends alive, a raft of Jewish monsters to scare her Nazi housemate stiff. These stories sustain her. She has every right to tell them. What Jojo needs to do is shake off the evil tales — the myths handed down with pictures of devil-Jews — and learn to tell his own off a blank page.

I could rattle on more about the honey-colored light, the saturated tableaux, the punchy costumes, every bit with the shoes, the expert seeding and pacing, the feeling in that kid’s face… but then I’d be here for hours, and all of that is fluff anyway. Craft is just a vessel for ideas, and *Jojo Rabbit* is sweetly, sincerely, unpretentiously full of them. It reclaims fantasy from authority and presses us to dream up something more real. I think that’s rad.",dpqt2y
f5znmmi,"I absolutely loved this movie when I watched it last week, funnier than I thought it was going to be. I think my favorite part was the “Go hug that American” while putting a grenade on them, our theater laughed for awhile on that one.",dpqt2y
fhsb6dp,Can we all take a moment and truely appreciate and acknowledge the size of Taika Watiti’s balls for even attempting to make this film.,dpqt2y
f5znoh7,"I kept thinking “Man, it’s weird how Taika keeps focusing on Rosie’s feet” 

Then that scene happened. Fuck.",dpqt2y
f765rk1,"'What did they do?'

'All that they could...'",dpqt2y
fi9cydg,"""Now she's got *two* knives! How are you going to chop up stuff??""",dpqt2y
f5zvktd,"The Stephen merchant scene is the best scene, also super fucked up. Fuck nazis",dpqt2y
f69ylah,"I really loved this movie, it reminded me a lot of the Death of Stalin in its tone. The performances were powerful, and I wanted to cry both in the shoes scene and the Sam Rockwell execution scene. 

I get the feeling this movie is going to be panned just because it is “making light” of hitler in a time when nazism is politically pertinent again, but just like springtime for hitler it is the absurdity that makes it work. We are never put in a position to be sympathetic to nazism, only to a child nazi and a gay nazi who hates his own cause, and a woman nazi forced to be a baby machine. They are all hiding in a way, hiding sympathy, hiding love, and the movie asks for empathy for them. It goes beyond the typical “surviving nazism” story for those reasons. 

I was very sad and also laughing the whole time. Loved this movie",dpqt2y
f6t84kc,"I have to wonder if the people who graded this movie poorly managed to sit through the whole of it. I could see someone walking away upset if they only caught the first ten or fifteen minutes.

The film isn't shy about the absurdity of Nazi Germany as a concept. And it wants you to know that it's okay to laugh at that absurdity. But  it never strays far from the fact that there was also a clear, present, imminent danger to the society's scapegoats and those who would protect them.

This film almost always presents the world through the eyes of its protagonist. Only in rare times are we taken away from Jojo. And so it makes sense that the film starts with an indoctrinated child's view of the reich and the war. But the film takes care to bring the audience on a journey as those rosy lenses are pushed aside, and the protagonist is confronted with the reality of a morally and physically crumbling society.

The film also presents well the banality of evil. Some of the Nazis are rabid psychopaths, yes. Others are social climbers or hangers-on. And others still are potential victims who hide in plain sight. The film shows you how people will join up in such a movement for all manner of reasons.

But it also takes care to show you that none of those reasons absolve them of the responsibility that they have for the things they have done. None of them are let off the hook. And the film makes no attempt to say that they should be. Only that there is always time and space left to do some good, and that we therefore must do what we can.",dpqt2y
fcum70z,"Using the opening montage to jokingly compare Nazi fanaticism to Beetles Mania was pretty hilarious.

Very enjoyable film, will likely watch again in the very near future.",dpqt2y
