comment_id,comment_body,submission_id
fe3kq4a,"They would be really silly to put her forward for the oscar for this as it would split the vote with marriage story. A bit like when amy Adams had two amazing performances in one year, two nominations and then didnt win anything. 

I did think her performance in this was very good though and if I watch it again it'll be her character I'll pay most attention too. I think she subtly got a lot of different emotions across",dpqt2y
f702jwp,"I interpreted it as her following what she truly believes in.

The whole movie we see Jojo and other members of Nazi Germany doing what they feel they are supposed to do. Jojo is 10 years old and spends the whole movie trying to become a soldier even though he clearly doesn't fully believe the Nazi ideals, he just wants to belong and fit in. You can see even in the end when the cause is lost and hopeless Fraulein finally gives him the uniform and gun he's wanted through the whole movie but Jojo is finally so disillusioned with the entire cause and scared that he turns around and runs away instead.

The overwhelming majority of the characters in the movie are ""Doing what they can"" i.e. just trying to blindly follow their nation into the fight without stopping to question why it exists. There's even a scene at the end of the movie where one of the characters (I forget who) lists the countries closing in and fighting against Germany and it's pretty much the entire world. Yet instead of questioning why everyone else in the entire world is against Germany, he concludes they must all be evil wretched baby eaters and monsters.

So Scarjo handing out the papers is, I feel, an important scene because it shows the quiet acts of resistance that exist in Germany. It's one of two or three times in the entire movie (the other one being Captain K) where we see someone outside of Jojo question the war effort and stand up to the personality cult of Hitler. And it falls much in line with Scarjo's beliefs and ideals, her ""free spirit"" if you will.

That's just my take anyways.",dpqt2y
f71a0o5,"That scene is for the viewer so they really understand what she eventually dies for. 

It wasn’t for harbouring elsa.",dpqt2y
fh4qv5p,"The SS bought the sister story, but still caught Rosie working with the resistance.",dpqt2y
fhfyqm9,I think the fact that JoJo’s room was a nazi wet dream helped. Also they found the book on elsa’s room.  “An expose on Nazis” they were amused by it and I guess they didn’t felt that inclined to kill kids just because.,dpqt2y
fh978x6,"klenzendorf had already known rosie was hanged by the time he arrived to the house with the bike (why he came in the first place), and decided to spare the kids knowing they had nobody to take care of them.",dpqt2y
f6rloxv,Without impetus? You must not have watched closely enough. I would say it was almost predictable really.,dpqt2y
f6vs8vy,I thought it was just okay as well. I liked it but maybe my expectations were too high.,dpqt2y
fg8kbqz,What... the... fuck...?!,dpqt2y
f5zr57s,"I can see where you’re coming from like a lot of reviewers but I’m fine with Taika deciding not to soap box and make a bunch of parallels with nationalism today



It’s just a funny/touching coming of age movie with a bizarre backdrop",dpqt2y
f60rjgg,"satire about nationalism is a cheap and easy target. Taika's vision was much better. Naziism was bad, but most germans were just people co-opted into something they couldn't escape.

we have a bajillion ""nazis are so stupid and ridiculous! nationalists are so stupid! I would never be stupid like that hahaha"" movies. theyre low brow. Im glad this movie wasnt like that.",dpqt2y
f5zoexj,"I agree with you on almost everything except I’m the opposite on the friend and ScarJo. I’ve never been a big fan of her, but thought she was fantastic. I guess that’s the beauty of subjectivity.",dpqt2y
fdcxh0q,"Just finished it myself, gave you an upvote for your opinion. Honestly it started out quite similar to a Wes Anderson film but with less dry humor and without his signature film making (which is fine). I really enjoyed the humor and when I got to the bit with the mother I was extremely gutted.  

The final act of the film I was scared the whole time. There are now clearly very real consequences and I didn't want to hate a ""bad ending"" but I knew if he went that route it would have been similar to One Flew Over the Cukoo's Nest. I love that movie dearly but have only ever watched it one time. I hated the ending but it's really a great ending. It shows how much I was pulled in. I am glad I got the ending I wanted with this and will enjoy watching it again I'm sure. It's very odd for me to have this love/hate relationship with bad endings as everything I write seems to have a horrible ending. But really deep down I want that fairy tale to make all the bad feelings go away.  

For me, Jojo Rabbit was a great mix of both. I was hurt but then I was happy. I might have to bump one of my top 50 movies for this one.",dpqt2y
fdi4cw0,"I mean, that’s probably why the last half of the movie wasn’t really a comedy.",dpqt2y
f6bxf58,"Let everything happen to you     
Beauty and terror    
Just keep going     
No feeling is final      

- Rainer Maria Rilke

----
Complete poem

[Go to the Limits of Your Longing](https://onbeing.org/poetry/go-to-the-limits-of-your-longing/)


God speaks to each of us as he makes us,   
then walks with us silently out of the night.

These are the words we dimly hear:

You, sent out beyond your recall,   
go to the limits of your longing.    
Embody me.

Flare up like a flame   
and make big shadows I can move in.

Let everything happen to you:    
beauty and terror.    
Just keep going. No feeling is final.    
Don’t let yourself lose me.

Nearby is the country they call life.   
You will know it by its seriousness.

Give me your hand.

Book of Hours, I 59",dpqt2y
fhqrivo,My impression was that she was caught spreading anti-nazi propaganda,dpqt2y
fhsi3kw,She's handing out propaganda (when Jojo's in the red robot suit he picked one of those paper up),dpqt2y
fht0z23,She was furtively working for The Resistance.,dpqt2y
ficcypb,"If she was working for the resistance then why didnt they kill her son JOJO as well?  

Also why was Sam Rockwells character sympathetic and not jew kill crazy like he should have been?",dpqt2y
fiphr36,I kind of thought that she was found out after Jojo started speaking of his book to those guys as they were questioning him pretty specifically for his source.  Not sure if that led to his mom getting questioned and ultimately found out but it seemed awfully coincidental. On the other hand she really wasn't very low key on the whole dropping off pamphlets task either if Jojo was able to stumble upon one so maybe she had become careless and complacent with her routines.,dpqt2y
f73zl0u,I think maybe your not vibin’ with Taika. That’s no problem.,dpqt2y
f6y2aq8,"i upvoted u, dude. u got a right to your opinion",dpqt2y
f6yj1co,I really liked it but I agree about the Hitler antics. It poured on a little thick after we got the point.,dpqt2y
fmgtj5e,I was tired of hitler from the opening scene. Taika jokes were way too obvious and he runs them into the ground. He thinks he’s more clever than he actually is.,dpqt2y
f6e6kif,"I was really hesitant to see this movie, as a Jewish person who still remembers all the bullshit Borat stirred up for years. Making a satirical comedy about Hitler is delicate work...

At the end of the day, though, I didn't find this to be a movie about a kid whose imaginary best friend is funny Hitler. I took is as a movie about how we identify and relate to people different from ourselves, and how we process the identities of ourselves and the people around us. Nazi Germany was a convenient backdrop for that analysis that could have been neutral at best, but the addition of some of the other characters and the way they were handled (Rockwell's and Wilson's in particular) towards the end of the movie added context that would have been lost in a pure comedy.

There really aren't any full-blown Nazi characters who get a free pass in this movie and come out looking like good guys or pure comedic characters. Even Rahm strapping grenades to kids makes sure you can't look at her as just a funny side character.

So I don't even think that the movie was necessarily pointing out the absurdity of Nazi Germany at the time. I don't think the movie was really about Nazis at all. It was about how we see other people and how important it is to challenge our worldviews and our assumptions about other people.",dpqt2y
f6almx2,Why do you feel the need to single out Jewish film critics?,dpqt2y
f6cytmj,">  but the whole goofy Hitler thing stops being funny halfway in.

To be fair, Hitler became increasingly less goofy and more desperate/threatening as the film went on. The movie was about what happens when your ideals clash with reality, and what you'll choose to do. Jojo saw his ""idealized"" Hitler and his insane rhetoric about the dehumanization of the Jews become more and more at odds with the reality of his Jewish friend, and in the end he kicked his ideals out the window and settled in reality.",dpqt2y
f60xonr,Watch What We Do in the Shadows,dpqt2y
f604evh,November 8th is the nationwide release,dpqt2y
f60o0uc,I see it's it more theaters this week compared to last but when I check next week's schedule I see nothing. So hopefully they just haven't updated it for the 8th,dpqt2y
f6kk2ec,“Let everything happen to you. Beauty and terror. Just keep going. No feeling is final.” -Rainer Maria Rilke,dpqt2y
f6yidh6,"I am not European so I might be very wrong, but I would imagine it has to be checked for offensive material first, as it is very easy and common for a comedy movie to cross the line of what is considered appropriate to areas that actually experienced World War 2 and the Holocaust.",dpqt2y
f6vijqj,Brexit.,dpqt2y
f74gee1,I'm guessing because it's a satire about Nazi Germany and therefore requires a bit more scrutiny than it needs in most other parts of the world,dpqt2y
f702p3c,NO STABBING,dpqt2y
f74etnp,"He says something in almost every scene he's in, it's all just mainly inconsequential stuff. Like he yells ""No stabbing"" for the intro of Captain K, responds to the effect of ""Yes a book would make things a lot easier"" when Jojo asks Captain K about Jewish people, says he feels like a fool when he brings in the German shepherds, etc.",dpqt2y
f6vv4gc,Yes.,dpqt2y
f70exb7,"“Let everything happen to you,
Beauty and terror.
Just keep going,
No feeling is final.”

by Rilke, the poet mentioned in the film. https://onbeing.org/poetry/go-to-the-limits-of-your-longing/",dpqt2y
fegdn5b,"They hanged her for treason/insubordination as she was leaving anti nazi notes around town along with her friends, it was only referenced in one scene when jojo was following her.",dpqt2y
ffgmncl,She distributed anti-nazi leaflets and probably was a member of some underground resistance,dpqt2y
fgf6hfb,Definitely blue at the end...,dpqt2y
ff7miwy,Not sure why you are downvoted.  We are all entitled to our opinion. I personally loved the movie.  For me the jokes and the dramatic parts hit the mark perfectly.,dpqt2y
ff1ugpn,"Man, I loved the movie. I feel sorry for you.",dpqt2y
f76n35z,"I mean, its historically accurate, no?",dpqt2y
f7p5fob,Soviet troops were not good to the Nazis. Americans not so much either tbh,dpqt2y
fiil538,breaking news: things can happen offscreen,dpqt2y
fjorhc7,I though he was guessing cause she was a bit icy,dpqt2y
f62cw2d,"The movie cannot avoid this so called ""infantilization"".  It is supposed to be from the perspective of a 10 year old boy.  How else is the protagonist supposed to see the Holocaust?  The character would have no knowledge of the gravity of the Holocaust, nor would he be able to understand it.  

I saw the movie as everything being seen through the lens of a child.  The silliness and goofiness of it all were part of that, not to mention the caricature of Hitler as portrayed by Waititi.",dpqt2y
ffhvjmn,"Crying about downvotes is the pathetic thing to do lmao. Get over yourself. Also, downvoted. ;)",dpqt2y
ffx2ifs,"How is the message muddled, the message was pretty much Nazis are bad and you shouldnt judge people based on prejudices",dpqt2y
f7cox07,I disagree completely but I'm annoyed that honest opinions get downvoted.,dpqt2y
f624gba,Foolishness.,dpqt2y
f837e8x,You’re not wrong.  It was insulting garbage,dpqt2y
fhb2tfd,"Only just seen the movie recently and was going through the discussion thread, but it does strike me as a bit odd and hypocritical that you agree with Guy Lodge but then you say Jojo Rabbit reminds you of better more heartbreaking movies, and then you name Life is Beautiful which critics consider extremely mediocre as well and criticise it for also infantilising the Holocaust.",dpqt2y
f5zpksq,What a tonal mess,dpqt2y
f5zkaz4,Eh it was pretty cool but just writing him off in Stalingrad was such a gut punch.,dpqt2y
f8756d2,Yeah this brought the movie from an 8/10 to a 3/10 imo,dpqt2y
f7wx3fb,What an odd thing to fixate on. I didn't even notice lmao.,dpqt2y
f872dek,Lol I noticed this too.,dpqt2y
f7n5uap,"I think the Soviets were more well renowned for summarily executing Germans, as a consequence of the brutal war between the Germans and Soviets.  Also, in the movie it is mentioned that both the Americans and Soviets (among others) have surrounded the town.

You're looking for something that ain't there Chief.

Also let's not get into a prolonged argument about American war crimes in WW2.  Yeah we already know Americans committed war crimes.",dpqt2y
f80t9i4,They met in the middle.,dpqt2y
f63cdra,They are similar but not exactly the same. They are supposed to be reminiscent.,dpqt2y
f65zdte,"Different, but they resembled them. Less of a heel, different kind of tie.",dpqt2y
f62rtlj,"No, they were different. I want to say they were more brown",dpqt2y
f65x911,It’s evocative but I don’t think it’s the same.,dpqt2y
fd5huun,Not for Germany :-),dpqt2y
f6hiq3z,Eh. I preferred Hunt for the Wilder people but I would put it over Thor Ragnarok. The Asgard scenes really dragged and didn't mesh well with the Sakar stuff. Still a great film but Jojo was better.,dpqt2y
f6cmqp8,"Dude you need to get your empathy gland checked out, it's broken.",dpqt2y
f62bbqr,He was so afraid that she would leave him all alone...,dpqt2y
fgy4iht,"1. Sam Rockwell's character was a good example of the people who were serving in the German army under Nazi power, but who never bought into the propaganda. He was bitter and jaded, but not hateful. Jojo mentioned learning about Jews and when Rosie was hanged he probably put it together that there was one at the house. His instinct was to protect Jojo, and when he got there, he improvised. He was both a loyal soldier who fought other soldiers, but there were some things he risked himself for.
2. Jojo saw his mother distributing the fliers, and when he found her in the square, he looked around at the houses with windows that looked like eyes. I think that was basically to indicate that her neighbors had turned her in after seeing her distribute the flyer. The Gestapo would have killed Elsa and Jojo if they knew about her. They were searching desks and papers for anti-Nazi fliers, they weren't expecting Elsa. 
3. Jojo was a good person who fell for propaganda without truly knowing what the ideation meant. Despite his personal growth, Jojo still believed innately that the Nazi party was good. Seeing his mother's dead body left him devastated by grief, shock, and anger. He reacted the way many people do when their loved one is taken from them. They look for someone to blame. His mind won't let him accept that he was wrong and his heroes are really the villains, so he regressed to a 'safer' belief. As a boy camping with Yorki, he vowed to kill a Jew if he met one. He clings to this belief that Jews are the reasons bad things happen and that it's their fault his mother is dead. He lashes out at her because he is in pain, but he his nature is not to kill, so he just breaks down,",dpqt2y
fh1sx42,"I think Rockwell helped out for two reasons. First and most importantly he liked JoJo and his mother, he knew JoJos mom had just been killed and went to his house specifically to protect him even before he knew about Elsa. Second, I think he was gay, so he was sympathetic with the Jews. Additionally, he knew they were about to lose and everything the gestapo were doing was pointless.",dpqt2y
fh1o1oz,"I think at the beginning of the movie it is heavily implied that Sam Rockwell is conflicted about Nazism, the horrors of war or even himself. This can be guessed from his alcoholism and the back handed comments that he threw towards the Nazi Youth. So yes, I believed that it stayed in character that he would help Jojo's friend",dpqt2y
f8gve9q,"I disagree about sam Rockwell’s character - his motivation for protecting jojo and the girl made sense with that context as he was also someone the nazis wanted to rid the world of. But he wasn’t a hero, he was just a survivor. He has a very human reaction to this completely awful reality. Survive.",dpqt2y
f8h6fpt,I felt like his character was there to show just how many people that were involved in high ranking positions in 1940's Germany were sympathizers to the victims of the Holocaust (ScarJo) or were the very thing that the Nazi's were condemning (homosexuality). It also explains why he protected JoJo.,dpqt2y
f98pl0l,"This is more or less where I’m at too. A lot of humor is just “very silly exaggerated thing happens”, and a lot of that stuff was too over-the-top for me. I DID really like ScarJo though, she’s basically carrying the movie. Stephen Merchant as the Gestapo leader was also hilarious, and that kid Yorki just got funnier and funnier as the movie went on.

Sam Rockwell just...wasn’t funny. Not to me at least. It’s the same joke every time that he’s disillusioned and not taking this seriously, and it wasn’t really delivered right the first several times so it doesn’t come back on later either. To make matters worse, his goofy outfit ruins the otherwise very impactful battle scene near the end. Rebel Wilson was in a similar boat, her “dumb propaganda swallower” bit fell flat the first few times and then didn’t improve.

Taika’s Hitler might have been the weakest part of the movie to me. He’s merely silly without being clever or funny, and all of his scenes are really about TELLING us what Jojo is thinking or feeling when the movie should be SHOWING us. I think you’d have something much stronger if you took all of that imaginary Hitler stuff out, especially since only a few early scenes make it anything that other characters notice (Yorki noticing how Jojo talks to himself). It’s not even really a plot point, it feels like something they put in so they build misleading trailers around it. You’d shorten the movie significantly too, which I think would be to its benefit.

The drama worked MUCH better, when it wasn’t undermined by the comedy. Even then though, it feels like the movie’s tone is just whiplashing all over the place all the time.",dpqt2y
f7022cn,"Jojo's Bizzare Adventure in WWII Germany. Also, Captain Klenzendorf and Finkel's costumes during the battle in the final act just screams JJBA.",dpqt2y
f7qb39f,Do you care to elaborate on what didn't work for you?,dpqt2y
f7r52fy,[deleted],dpqt2y
f71y98m,Dont worry Star Wars will be out next month,dpqt2y
f5zrgib,Oh get over yourself. Nobody likes a critic that tries too hard.,dpqt2y
fg3av5s,"At first I thought it was a shallow movie, using fake german accents with very american expressions, and dumb ""haha, nazis"" jokes. As it progressed, though, particularly when it was made clear that Hitler was a figment of Jojo's imagination, I found it to be a fascinating depiction of the Nazi regime as seen from Jojo's eyes.

Just like the Hitler character wasn't real and yet Jojo saw him and interacted with him, we don't know how many of the characters and their silly behavior, how many of the colors and the pretty or ridiculous uniforms, etc, were created or exaggerated by his 10-year-old mind that was delusional enough to depict a beautiful and glorious Germany only days before they lost the war. 

What was powerful was every time (which was pretty often) the cruel reality of the situation managed to break through his mind and even in his silly little world, the regime showed how devastating or terrifying it could be.

I'm not sure it said anything new about blind nationalism, but I thought it was a beautiful and original way to depict it. Granted, I haven't seen another movie that does a similar thing, but point me in the direction of one if there is, because I want to watch it then :D",dpqt2y
fg5dued,I did think that that dancing ending was a little weird. I kind of expected a different kind of dance like the one Jojo did with his mother; that would have been a better way to end it than the awkward swaying and snapping.,dpqt2y
f69b8uc,Yeah it was weird how there wasn't much Taika in the movie considering that's the pitch but it made sense. As he grows up over the course of the movie he no longer needs an imaginary friend.,dpqt2y
fhfxjv4,"Maybe. I was sure Yorkie was going to be killed. A chubby kid with no skill or training... 

Maybe Yorkie is just the representation of innocence and endurance.",dpqt2y
fhwol1s,Rebel wilson gives yorkie a gun in the final battle,dpqt2y
fhe0vat,Doesn't Rebel Wilson's character address Yorki towards the end though? When she gives him a gun?,dpqt2y
fhe04u3,He does say he can't seem to die at the end so I kind of agree with you on that.,dpqt2y
f6a643j,I don't think it's intentionally directed at trump quite as much as it may seem. Supposedly he wrote the script in 2011.,dpqt2y
f6pr86j,What was it?,dpqt2y
fguhquy,"Wasn't it the same notes that Rosie spread around town? Something with ""... Fight the party""",dpqt2y
fh1sbp5,"When she was hanged she had the ""free Germany"" flyer pinned to her pants. It was implied by the shots of the windows all around the gallows that the neighbors were the eyes that exposed her being with the Resistance. JoJo and Elsa only survived the Gestapo visit because Sam Rockwell's character fudged verifying the ID.",dpqt2y
fgv0k6y,"She was spreading ""free germany"" propaganda",dpqt2y
fgv7pet,"With the way things were setup, I think they wanted to mislead and have Yorkie be implicated in the gestapo/SS showing up. But realistically, it’s probably because someone else also saw her spreading propaganda much like Jojo did",dpqt2y
fh775ow,"His dad was supposed to be coming back. So maybe not, if he’s still alive.",dpqt2y
f838lni,I wouldn't exactly argue this is a mainstream film.,dpqt2y
ffs19gn,"I actually thing it's right in the middle for me, like a solid 5/10. It's decent but nowhere near the best of the year.",dpqt2y
fdgb0nk,And? Have you seen it? What side are you on?,dpqt2y
f6eb8bk,"The whole point of the movie is that we are more alike than different.  We want the same things - acceptance, happiness, and love especially. So what would it matter if she was played by a Jewish woman or not.",dpqt2y
f6hhud9,She is not. The director and actor of Hitler however is. So I don't think it matters that the Jewish character wasn't played by a Jew. There was plenty of representation. (Scar Jo is also Jewish),dpqt2y
f6e8rjt,Shes not Jewish but she did a great job who cares it's not like its blackface,dpqt2y
f6nbipq,"The main complaint against satire of Nazism is that it ""makes light"" of a serious subject matter. I don't personally think this movie ""makes light"" of Nazism--I think the dramatic aspect of the story ensures that the consequences of Nazi ideology are pretty soundly felt, at least on an individual level.  Other people just think Nazism is something too serious to ever overlap with comedy, satirical or otherwise, which is their prerogative.  I will say I think the satire component of the story appropriately punches up (I would argue that satire that punches down is not actually satire), and demonstrates the silliness of Nazi ideology, propaganda, and self-aggrandizement while (in my opinion) still clearly showing how powerful and dangerous it was/is, despite it being so (literally) ridiculous and fragile.

Talk to your friend about the movie and see if she's interested.  Show her a trailer if she wants a feel for it.  I'd do that for any movie before seeing it with a friend--it's not going to be fun if one of us isn't enjoying it.",dpqt2y
f6qr4zr,"I am Jewish and this movie shot immediately to the top of my favorite movie list. Period. Like, top 10 all time. I'm definitely going to agree with showing your friend the trailer first, but unless she's the type to get offended over any perceived slight she wont find it offensive. You're more at risk of it just not being her type of movie, than her finding it offensive.",dpqt2y
f6mvc88,"Of course it depends on a person, different Jews will have different opinions on this movie, but in general it's not offensive. Actually all the shit said about Jews in the movie was pretty much what Nazi propaganda said about Jews, so it comes as no surprise if you're familiar with the history of Holocaust or visited Yad VaShem, Jewish Museum in Berlin, or other museum of the kind.

Bear in mind that this movie will be released in Israel. If the distributors don't hesitate to show it to the audiences which are up to 100% Jewish, it tells you something, doesn't it?",dpqt2y
