comment_id,comment_body,submission_id
f66e3mj,"Movie was great. 

Its weird going through the reviews and seeing jewish film critics pan the movie because ""this is no laughing matter.""

Its pretty obvious to me that the entire movie pointed out the absurdity of Nazi Germany at that time. But these cricitcs feel guilty about laughing at the situation, i guess.",dpqt2y
f60vqcl,"I couldn't help but feel a bit disappointed. This was my second Watiti movie after Ragnarok, and I was pretty excited based on that and the trailer. The humor is very funny at times(Jojos friend and Rockwell were fantastic), but the whole goofy Hitler thing stops being funny halfway in. Felt like a gimmick. Never felt very attatached to the characters, it felt very predictable and drawn out with Jojo and Elsa eventually becoming friends. The only part that really got me was Jojos moms death, that was very well done. Felt like it dragged a bit.

Definitely not a bad movie, lots of funny moments and well directed scenes. Just wasn't amazing to me.",dpqt2y
f5zwxco,Anyone know if it's going to get a wider release?,dpqt2y
f6keu4k,Can anyone remember the quote at the end of the movie or the author attributed to it?,dpqt2y
f6tcebf,Anyone know why the release is so delayed in europe? We have to wait till 2020,dpqt2y
f6vtexe,Does [Alfie Allen](https://youtu.be/ioW8VBi631Q) speak a single word in the movie?,dpqt2y
f7024yq,Does anyone remember what the quote was at the end of the movie?,dpqt2y
fegadt3,I don’t understand why they hung only Rosie and not Elsa. Wasn’t the reason for the hanging because Rosie kept Elsa hidden? Why didn’t they come after Elsa?,dpqt2y
fgetsir,"anyone else notice he red, white, and blue imagery? tin the first shot we get of his mom she is in red, white and blue, and from there i noticed ( but probably there the whole time) was red, white and blue on almost every other scene.

what say you folk?",dpqt2y
fetr2kb,"I really did not enjoy this movie at all, and I was totally expecting to. I love Stephen Merchant and Sam Rockwell, and thought Waititi would be a sure fire hit. But in the end the humor all fell flat/was too predictable and the level of drama didn't fit to me. It all felt like a try hard black comedy for me, with all the hitler scenes completely forced.",dpqt2y
f5zx22k,"This was always gonna be a tough balance... interposing ridiculous humor with the tragedy of the holocaust.  But by golly I think Taika actually managed to pull it off.

I really enjoyed the film, great acting all round and I thought the pacing and script was really good too.  I like my history and while obviously there are things in there intentionally to play for a laugh, he has obviously done his research as well.  (As much as he sent up playing Hitler, Waititi go some mannerisms  terrifyingly spot on in some of his rants)

I'm not sure it's exactly Oscar worthy and I appreciate it's not gonna be everyones cup of tea, but I am certainly going back for a second viewing.",dpqt2y
f76iueh,"Not sure what to make of the fact that they had the allies committing war crimes at the end there. Something of a ""both sides"" message?",dpqt2y
fifj4fs,How did Jojo know that the name of the girl was Elsa?? I dont remember a scene where she introduced herself.,dpqt2y
f61b8dl,"Ultimately I was not a fan of this movie. Its message was muddled, and ScarJo's performance was flat-out bad. The kids are only ones who emerge unscathed, but the movie reminded me of better, more heartbreaking WW2 movies like The Pianist, Life is Beautiful, Lore, Au Revoirs Les Enfants, and The Captain.

Critic Guy Lodge said it best: ""[JOJO RABBIT doesn't satirise Nazism, it infantilises the Holocaust](https://twitter.com/GuyLodge/status/1190312073877688321).""

Edit: downvoting me because I disagree. For an official discussion thread, you’re all fucking pathetic.",dpqt2y
f5zp75x,Severely disappointing,dpqt2y
f5zk7g7,"I thought the nazi guy coming back from the dead as a cyborg and allying with JoJo was weird, other than that I liked it",dpqt2y
f7w7ani,"The only thing wrong with this movie in my opinion is a continuity error when Jojo and his mom are at the table. When Scarlett says something like “you want your father?” they show the bread by her, but this is after Jojo has already slid the bread to himself. Other than that, I loved it completely, definitely a new favorite.",dpqt2y
f7mzpc9,"I liked it a lot, but one thing that bugged me was that the Americans took the town, yet the soldiers who gunned down Captain K and the other were wearing Red Army uniforms. Did they just not want to show US troops killing unarmed prisoners?",dpqt2y
f62qwhd,[removed],dpqt2y
f67iidh,"This and the farewell are probably my two favorite movies of the year. Personally, I havent been a fan of the past year of movies but i'm really liking this year's movies.",dpqt2y
f6xz7zq,"I absolutely adored the music. This is probably my favorite score of the year.

I suggest pairing Jojo Rabbit with Grave of the Fireflies. They're very thematically similar.",dpqt2y
fd5b568,[deleted],dpqt2y
f6376s3,"Good movie, but it's Taika's worst just above Eagle vs Shark. 

The humor was pretty broad and obvious. Doesn't feel as sharp as his previous films.",dpqt2y
f5zkgkc,"Absolutely amazing. I’ve been waiting for this movie for so long. The fact all I had to see were the shoes- both unexpected and completely brilliant! What a tone change! Jojo was also extremely flawed, but a good soul. Perhaps cliche but even at the ending he still has a problem with often lying. Loved this film. I was worried it wouldn’t live up to the hype but honestly I wasn’t hyped enough!",dpqt2y
f60kaph,"Some thoughts: the most obvious comparison to be made is to *Life is Beautiful*. Both movies use humor to confront the horrors of the Second World War, and depict a lens through which a child grapples with politics, racism, nationalism, genocide. I think the child actors in this movie were exceptional, and Thomasin McKenzie in particular shines. The scene in the town square when Jojo learns his mother's fate was heartbreaking, but like some reviewers, I felt the movie didn't live up to its full potential. The Nazis were portrayed as buffoons, and their antisemitism exaggerated to the nth degree, but I feel it might have been more effective to show either a) a gradual descent into chaos, or b) some subtlety and nuance in the depiction. Essentially, the Nazis were too unbelievable, and aside from the scene with Stephen Merchant's character, we never take them seriously.  
  
Overall, I think it was a good movie with great acting, but I think *Life is Beautiful* was more effective in delivering its message.",dpqt2y
fgxk8ee,"Ill start by saying that i absolutely love this movie but i have a few questions that i didnt feel were cleared up for me:
1. Why did sam rockwell’s character help jojo and else knowing she was a jew. Was a supposed to just be a good guy and show that nazi’s are to be sympathised with aswell?
2. Wen rosie was killed, was she killed for hanging up the free germany posters or was she killed because they found out she was hiding elsa?
3. Why does jojo stab elsa’s shoulder after his mother died. I dont quite understand the symbolism there",dpqt2y
f8gc9yo,I felt the movie works as a drama better than a comedy. i thought the second half in particular was a lot stronger than the first. I think a lot of the humor didn’t land and some of the better bits were in the various trailers. I dug the performances. I think my biggest issue with the film was the implied homoeroticism between Sam Rockwell’s character and Theon Greyjoy...it felt cheap and completely fell flat..i also felt it subtly implied why he allied himself with Jojo towards the end and that felt odd to me. I think the humor was in the children and i felt like we didn’t need the same “Jews can read minds” joke every ten or so minutes,dpqt2y
f6y97ta,"Weirdest season of Jojo's Bizarre Adventure yet, but it was great! Hilarious and emotional!",dpqt2y
fdl1tua,I love how they have some Death Note-style mindgames with Jojo trying to psych out his mum with the bread and trying to get her to admit she's keeping Elsa.,dpqt2y
f7fxbn4,Really disappointed by this. Huge fan of Taika and I don't think I've been more sold of a premise alone before. Just didn't work for me at all.,dpqt2y
f5zk0nc,"Like JoJo himself, I feel a lot of those who are praising this film are being blinded by it's gimmick and failing to realize just how shallow this film really is. All of the humor is lame slapstick gags and ""oh look, its a goofy version of Hitler and Nazis, so isn't it funny!??"" and it isn't saying anything new or insightful about blind nationalism. It's not nearly as original or clever as it thinks it is.

And don't even get me started on how cringey and lame that ending scene was. This is one of the worst and most disappointing films I've seen this year.",dpqt2y
f6y7pi8,"This movie is SO AMAZING, funny, sad, all sorts of emotions. It shows how evil the nazis were, but from a kids standpoint. Overall amazing",dpqt2y
fgtqez7,Loved this movie so damn much!! Taika is a genius!,dpqt2y
f5zkr4z,"I was only mildly interested by the trailer since although it was funny and had some fantastic set and costume design, it seemed to be bit hokey and one-note.

But I ended up liking it much more than I thought. It’s not a straight up satire as it does have some very dramatic and serious scenes to give you a heads up. I think this was needed in order to give the subject matter some respect and an appropriate level of seriousness. These scenes are some of the best in the film and elevate it as a whole. 

Although I do think he could’ve balanced the tone just a bit better and held back on a few jokes so as to not undercut the drama, specifically towards the end. To give a mildly spoilery example, the funniest scene in the trailer with Yorkie and the explosion comes at a very awkward time in the film. It’s not as egregious as Thor: Ragnarok’s overuse of humor though, so I appreciated that.

I think pretty much all of the cast did very well. Particularly impressive were the kids. But I do think the imaginary Hitler character was underutilized. There are long periods of time without him where you kind of forget about him so it makes that storyline feel a bit weak and almost unnecessary. Not sure if they had to cut a lot of it out or what but as it stands in the movie, he weirdly felt like he had very little presence.

The production and costume design were top knotch. It felt accurate enough but colorful enough to match the varying tone the movie needed and the cinematography has a whimsical charm to it with framing very reminiscent of Wes Anderson films. 

Overall I found it pretty funny which goes a long way in making you care about the characters so when things do get serious, it packs a punch even if the tone is uneven at times. It may not be a super sharp satire bringing a ton of depth and insight, but what it lacks in edge it makes up for in heart.",dpqt2y
f5zl59n,One of my favorites of the year and by far the funniest,dpqt2y
fhdwrhj,I have a jojo rabbit theory that I’m sure will be disputed. In the entire film none of the other characters seem to make reference to or acknowledge his presence. What if yorki was an imaginary character. Think about it. Rewatching the movie i couldn’t seem to find yorki mentioned by any characters other than jojo and the same way he fantasized hitler being his imaginary friend maybe he fantasiced about having an imaginary best friend in the form of yorki aswell because yorki also only shows up during difficult times in jojo’s journey,dpqt2y
f6eb0n9,I wish the movie was R rated so we coulda seen rebel get blown up by that tank shell,dpqt2y
f68qmnw,"Looking at the lukewarm critical reception for this film, I really think this film will be completely re-evaluated in 5-10 years. I thought it was kind of tonally inconsistent and a misfire until we got to the third act, which completely changed my feeling about the film. I've got to say, the final part of this film was the most moving thing I've seen in the movie theater all year. While I was initially cringing at anything I thought to be an easy jab at Trump, I think this movie is a lot more than that. 

Taika continues to write kids better anyone else out there. None of the ""sentimental' parts in the final scenes seemed fake or hokey, and given the lighthearted first three-quarters of the movie, everything was set up so well that everything felt true to the characters.",dpqt2y
f692n72,So did it get a full release yet or no,dpqt2y
f6a9b1u,"I'm not 'avin a go, Captain Deertz. He could be your brother.",dpqt2y
f6fqdx7,Did anybody else catch that Danger 5 reference?,dpqt2y
fgu0e9y,"In the shoe scene, does anyone know what the slip of paper pinned to the leg said?",dpqt2y
fgutc2k,Why did Rosie die but JoJo and the Jewish girl didn’t ?,dpqt2y
fh2be2j,"So since they are both underage, will they be put in an orphanage?",dpqt2y
f60gtsr,"I love how divisive this is - some people love it, some people really hate it. Kinda like the Joker (which I was mezzo-mezzo on). Good to see mainstream films shake it up from time to time. Can't wait to see it and pick a side!",dpqt2y
f6e4f6k,"Does anyone know if the actress who played Elsa is actually Jewish? I tried looking and only found interviews where she talks about doing research on Judaism and what was going on at the time, expressing she felt a responsibility for Jewish representation in the movie. Which makes me think she's not. Not a big deal, she was amazing. But it seems like maybe a Jewish person should've played the only Jewish character in the film?",dpqt2y
f6medb9,"i've heard both that this is kind of controversial but also that it plays it safe on that front and isn't controversial enough. What i'm wondering though, is this a good or a bad choice of a movie to take a Jewish friend to? I don't want her to be offended",dpqt2y
f79j8or,What was the quote at the end of the movie?,dpqt2y
faf6um1,Boring. About as fun as a pub crawl with a bunch of teatotalers. Tepid and meandering. The makers of this flick didn't have the balls to really push the material.,dpqt2y
f639w0x,"Ok, seeing the cast list, who is Herr Jotaro? Is he a reference to another franchise who also features characters named “Jojo?”",dpqt2y
f6gm7rf,"What an emotional rollercoaster. I wouldn't call it a great movie, but I had a lot of fun watching it - the last two movies I had watched were ""Parasite"" and ""The Lighthouse,"" and neither of those two movies were really focused on packing an emotional punch like Jojo Rabbit. 

This is the kind of movie that will be a hit or miss. The premise is funny and the movie has its moments, but once the Nazi jokes start getting old, the movie does lose some of its charm. It has some scenes that are painfully unoriginal (the last confrontation scene with ""Hitler"") and fails to dwell long enough in certain moments. I am directly talking about the scene between Jojo and Elsa after Jojo finds out about his mother - I wanted some more time there between the two of them. But had ""Jojo Rabbit"" done that, it would have been a very different movie.

Great performances all around from Scarlett Johansen, Sam Rockwell, and Archie Yates. If they ever do end up doing another Lord of the Flies movie, Yorky (Archie Yates) would make a great ""Piggy."" For some reason I couldn't shake that thought throughout the film.",dpqt2y
f7k22zp,I’m surprised no one is talking about how funny the part where the older Hitlerjugend yeeted the rabbit was.,dpqt2y
ffomk0v,"Found the film enjoyable and funny, however it felt relatively empty at times and also didn't particularly explore much in death. As such, I felt like it's attempts at emotion were rather weak and immersion breaking.

7/10",dpqt2y
f60m743,"I don't suppose anyone knows a place to watch this on streaming? Dying to see this movie, but there's only one theater within 100 miles showing it, and it's at the far end of those 100 miles.",dpqt2y
f6027q8,Loved the movie and i know its a comedy but after scar jo was hung wouldn't the local nazi's of searched jojos house? Like you dont execute someone for helping jews then leave their family and home alone,dpqt2y
f6pjb8t,"What is the quote at the end, just before the credits? Who is it from and can anyone remember?",dpqt2y
f6xjjqn,Does anyone know the quote that was in the scene before the credits?,dpqt2y
f6xtmim,Thank YOU,dpqt2y
fgplsz8,[deleted],dpqt2y
f6ahdvn,Man I was waiting for a good Jojo “case closed” line again at the end!,dpqt2y
fgl54xc,Are Nazi suppose to scream “Jesus Christ!” Like JoJo did in the movie? Lol,dpqt2y
fgot9l4,way way too sad not watching end.,dpqt2y
f78k787,"It looks like I'll be solidly in the minority, but I came out of the theater really angry at this movie.

I'm sorry, but a universe in which Scarlett Johanssen is executed by the Nazis, orphaning her 10-year-old son is not a world in which Rebel Wilson's cartoon character can actually be a person who is in power.

Also, this is the first movie I've seen in memory that features a ""child suicide bomber joke"", and hopefully it'll be the last.

Sam Rockwell's character was pretty well played until he became Liberace.

Stephen Merchant was a the rare highlight that I think nailed the intended tone perfectly, but I was already a fan so I might be biased.

The switch from pure pathos to halfass humor to magic-universe cartoonishness was jarring and unwelcome for me.",dpqt2y
f5zna8n,[deleted],dpqt2y
f5zowvt,"Sam rockwell went from the good character actor who always stood out in bad-mediocre movies to the “racist guy thats not a bad guy, surprise!” in every oscar bait movie",dpqt2y
fhk0rtz,I don’t think i’ve ever seen a satire where none of the jokes were funny and the satire itself has nothing interesting to say about the subject it’s satirizing. Expected much better out of Taika.,dpqt2y
fde3ns6,[removed],dpqt2y
f600jcz,Fuck this movie. Exploiting the holocaust for profit is gross.,dpqt2y
fh2mfdj,"I can't believe the Academy considers this one of the top ten movies of the year.

It's not bad by any means. It's just... Ok. Too safe. It's not ""outrageously funny"". At the hands of someone more irreverent like Sascha Baron Cohen, it could have been special.

EDIT: lol, you suckers think Joker is a deep movie that has a lot to say about society. I wasted my time writing this.",dpqt2y
f7atk9w,"Why was the mother hanged? They didn’t really explain it well, other than Jojo telling the big tall guy that she was busy",dpqt2y
fjxe295,"This was a bad movie in my opinion. There were some good elements in it (captain k and others), but it didn't work as a whole for me. The fact that I see many people taking it seriously, acting like it represents what nazi germany was actually like, amuses and saddens me.

edit: By serious I mean people acting like there was a message in the movie, like it had something to say. Which it unfortunately doesn't.",dpqt2y
fgayi08,"I was really looking forward to this movie, but oh boy, was it a disappointment. The more I think about it the angrier I get. Shallow, derivative, misguided, carried by a gimmick that quickly gets old. The story is a lie on every level - historical, political, emotional and human. Plot is of something of a cartoon with cute animals as protagonists.
It is exactly what it is - a passion project of a quirky comedian, that went waaay over his head.",dpqt2y
f61wm7r,I am glad that I don’t get up early to see that Oscar nominations live since when Best Picture is announced I would be chanting “Please skip the Js.”  Jojo Rabbit and a Joker are the two movies I will be rooting strongly against.,dpqt2y
f602m4s,Worst movie of the year potentially? After endgame of course,dpqt2y
f5zvbkj,"Sam Rockwell's character must have been one of those ""very fine people"" I heard about at the Charlottesville rally!",dpqt2y
fgh59z2,[deleted],dpqt2y
ffeuf3j,Americans shouldn't make a comedy movie about nazi Germany. They just shouldn't.,dpqt2y
fdomtkc,[removed],dpqt2y
f5zuyn3,"Lmao please don't tell me that this movie makes Sam Rockwell's character a ""good Nazi"" oh God this is going to be fucking awful. Can't wait to see it.",dpqt2y
f5zv4s3,"Making a movie about good Nazis in 2019 is unbelievable. I thought Watiti might be a hack but this is some next level shit. It's like ""Cop plays basketball with black kids instead of shooting them!"" dialed up to 11.",dpqt2y
f5zsiz7,Why is this even a movie? Director just wants kids to sympatize with nazis. Basically pushing for kids to become racist,dpqt2y
f67zj9w,"oh my God,  and pretty much out of nowhere.  they foreshadowed it a lot, but when it actually happened it was a shock.",dpqt2y
f6aas4i,"Jojo chasing the beautiful butterfly—this creature who is truly free. Then, suddenly, there’s mom. Victim of this oppressive machine. 

Hit me like a hammer.",dpqt2y
f6ezhnh,I pretty much had tears falling down my face until the end of the movie every time I blinked after this. I was not expecting it.,dpqt2y
f6l71f0,"Yeah such an unexpected moment, it fucked me up a little not gonna lie. Truly such a brilliant movie, I really hope it catches on and finds a big audience.",dpqt2y
fbwlbma,I think Jojo got her killed by talking about how shes always busy to the SS (I think that is the right term).,dpqt2y
fhfr3qj,"My brain went ""There's no way they'll do the 'it gets hit by a truck' bit"", but then **I** got hit by a truck.

Fuck.",dpqt2y
fghr3yf,"I felt physically ill when I saw her shoes. I was not expecting that, even though it seems kind of obvious in retrospect with all the foreshadowing.",dpqt2y
ffjzkwf,Hello I loved the scene.. but can someone explain to me why she died? And how come Jojo was allowed to live “alone” in his house?? Hehe,dpqt2y
fgqge5b,Loved how the Gestapo-scene was a red herring.,dpqt2y
fgr8rx8,"I was so shocked. I instantly started crying with Jojo, and it that moment I knew this was one of the best movies I’ve seen",dpqt2y
fax1eth,"Yeah, and everyone knew it was coming.",dpqt2y
fjo1f76,I've never gone from crying to laughing hysterically so fast in a movie. Emotional whiplash,dpqt2y
fiw996x,shoe scene?,dpqt2y
fh2xcb3,Am I the only one who felt nothing? It didn't have the emotional gut punch for me. I guess it's because of the tonal clash.,dpqt2y
f769hvd,That line had me laughing so much! The movie as a whole is genuinely a great example of how ridiculously stupid racism is.,dpqt2y
f75q0u0,Everyone laughed at that scene! Honestly this movie was incredible! Why are critics giving it low ratings?,dpqt2y
fhtw9uv,Yorkie was so cute... I need a cuddle,dpqt2y
fh6z5vh,"Reminded me of the line in Hunt for the Wilderpeople “it says here your cauc... cauc... Caucasian, well that’s wrong cause you’re clearly white”",dpqt2y
fepjj39,https://en.wikipedia.org/wiki/Honorary_Aryan,dpqt2y
f67z41f,I thought it was going to get crushed by a boot. Turns out it was actually our hearts that got crushed by a boot.,dpqt2y
f6228z6,It is a widespread legend that the spirits of the dead can visit the living through butterflies. The second i saw it I knew shit was about to get real.,dpqt2y
f68f9yv,"I was thinking he was going to get hit by a truck.

Instead it was me that got hit by a truck...of emotions",dpqt2y
f6jghya,"Same, the way it was shot with the camera following the butterfly across the street, it definitely looked like it was going to get hit by a truck.",dpqt2y
f8nv1bs,I thought that at first too but also saw it as him reconnecting with the child in him he's been ignoring and just playing.,dpqt2y
f6hbqgm,[deleted],dpqt2y
f68niyt,Scar jo gonna get the double Oscar nom,dpqt2y
f7n6566,"She fucking killed it in this movie. Everyone did. I used to be on the fence about her but I recently saw Lost in Translation and I was totally on board. And now this, she is fuckin great. God damn incredible movie imo.",dpqt2y
f6quik0,"Gotta be honest, her in Under The Skin was probably my favorite, and may very well always remain that way.",dpqt2y
fdrya2s,"> Haven’t seen Marriage Story tho)

It is phenomenal, favorite movie of the year, JoJo comes in second, well worth it, emotionally taxing, but in a good way",dpqt2y
f6vpls8,"Yeah, what the hell, lady has really gone off the deep end of powerhouse actoring the last little bit. Did not see that coming from her. Pleased and impressed with her performance in Jojo and can't wait to see Marriage Story!",dpqt2y
fcx1f4g,I just spent like a week so disappointed in Marriage Story and how flat she was for that whole film then she absolutely kills it in this one.,dpqt2y
fkmdnun,I was rly confused at first because I thought she wiped the dad's ashes on her face and was mocking the kid,dpqt2y
f68p1ql,"Yeah, I am convinced the gif of that moment will become a common response to heated political discussions within a week.",dpqt2y
f6a94no,"Alita had a pretty cool one with ""Fuck your mercy,"" but ""Fuck off, Hitler!"" is great.",dpqt2y
f6o7m28,"""When the FUCK did we get ice cream?"" Is still my favorite.",dpqt2y
f6jff8q,Honestly I didn't know until now that this was PG-13 and while watching I assumed it was an R,dpqt2y
ffkgz8u,"Love, Simon had a pretty great one.

It wasn't very funny, but it was impactful.",dpqt2y
f6yf8ye,This one and Alita are definitely up there,dpqt2y
f627sc1,It was one day before berlin was invaded by the allies... the reason the Seargent showed up at his house was because he already knew that she had been executed.,dpqt2y
f6226dw,There were tens of thousands of orphans by the end of the war. He was just a statistic.,dpqt2y
