comment_id,comment_body,submission_id
ge3qegr,"Thank you for putting this into words. It was an awful movie and it’s a bummer how relatively popular it is- this is NOT the message we want to convey. 

Awful writing, awful characters, disappointing and sad.",k2ctta
geejdn9,"I did not see Jane as ASD at all, curious to know why you think that? I'm also aspie, btw. I do not think she was created as a tokenized version of aspergers at all",k2ctta
gducuul,It’s disappointing that this type of toxicity is so commonplace that queers think they just have to accept this kind of behavior to find love.,k2ctta
gdu7q28,"Thank you for writing something that so accurately captured what I felt about the movie. 

I’m so frustrated by the lack of adequate representation in movies that we’re supposed to accept the outright toxicity of this movie.",k2ctta
gekjteh,"Yes yes yes. One of my red flags right away but it seemed to have gone unnoticed, I've been looking for comments so I don't feel like I'm crazy in feeling upset how they wrote Jane's character. i realize I'm biased and probably notice ASD characters more because of personal experience but I noticed it right away and felt offended.",k2ctta
geejouf,"Also, isn't the ex-gf non-white? She's one of the main characters (and probably the best delineated one)",k2ctta
ger39gh,"do you think it would have been less racist feeling if they had an all white cast? I kinda think it would have, it felt forced how they did it",k2ctta
ggbs9bo,"Yeah, having been in a situation like this with a partner before, this is NOT okay. Harper has so many moments to redeem herself but how the movie went with it is NOT okay in my book. I turned to my husband and said “if Harper doesn’t come out BEFORE the big fancy party, shes dead in my eyes”. And well, she took a lot longer than that and a lot of shitty treatment of Abby later.

I was so happy when Abby said “it’s too late” but then the bull shit of “oh, well she drove in a car to me and begged, so lol guess it’s okay”",k2ctta
ge3zenu,"Yeah also why wouldn't Mackenzie Davis have just come to her room instead, it being her family home and all? lmao",k2ctta
gdv4cun,"Thank you, I feel like I'm taking crazy pills here about how hard people are going in on Harper. We have no reason to believe she's a full time asshole - outside of this trip, she's presented as a pretty awesome girlfriend Abby is head over heels about, and this is just a weird blip.

We have LOTS of ways to understand her family did a major number on her for a long time though, I kinda think people aren't connecting the dots between *her* weird thing and how weird her sisters are too. 

I felt a little like DuVall wanted to be gracious about not presenting Harper’s parents as monsters just because they're conservative, but maybe she needed to be a bit more explicit in how shitty they've really been. I feel like a lot of people are missing the markers dropped here and there about why Harper thinks she has no other options.",k2ctta
gdu5ip9,"I totally agree — but then, don’t bring your girlfriend and force her to lie and ignore her! Obviously then there wouldn’t be a movie. But in real life, you don’t need to shove your girlfriend back into the closet and re-traumatize her because you aren’t out to your family yet.",k2ctta
gdud1v9,For me I didn't mind the closeted arc I just hate how Harper treated Abby the whole time. First she lied about coming out (the first time). Then she asked Abby to come knowing full well that she would have to pretend to be straight. She then ignored Abby to flirt with Conner(?) and said that Abby was suffocating her even though Harper had been ignoring her. It definitely did not help that they had no chemistry at all nor did she have any character traits. Having dated in closeted situations neither my partners nor I ever acted the way Harper did.  I think a lot of this also boils down to subpar writing. If they had taken out the Conner part they'd have more time to flesh out their relationship and Harper's actions would feel a little more understandable.,k2ctta
gduzpf6,"> Another thing I noticed: There is a lot of criticism towards Harper's character (i.e., ditching Abby to hang out with her straight friends), which some sense, and the manner that she prioritized her family over Abby for a good part of the film. I want to share that coming out to family is so complicated—it is not a linear process. I am trying to see Harper's perspective with compassion and patience. I know some queer people who are incredibly close to their family, and they have put their queerness aside to maintain that connection and not lose their family. It's not my place to judge.

Yeah, I am glad that you try to empathize with Harper, and I really appreciate your perspective.",k2ctta
gdve2l4,"I quite agree - I have the pleasure of being so blatantly queer that the closet isn't really a thing, and even I got uncharacteristically choked up at that conversation about coming out. My biggest fear with the direction was the way they would approach the choice to be closeted, but thankfully they actually tackled how intensely toxic it can be to that person and everyone in their radius, and created space where it's an understandable decision",k2ctta
ggjwksf,Ehh Harper treated her like trash even when the parental pressure wasn't there.. I didnt think that was a happy ending,k2ctta
ge0lqgs,">	I've never seen Dan Levy in anything before and he was easily my favourite character. He's hilarious and his monologue was really moving.

Please do yourself a favour and check out Schitt’s Creek!",k2ctta
ge6i2ma,"Even if the family is 100% accepting, you don't blindside someone you care about like that.  If she couldn't have been open with her family than she shouldn't have invited her...period.  I honestly can't understand how anyone can accept the ending of this movie after all the putrid self-centered awful things Harper did.",k2ctta
gezyer4,"Harper didn't so muck -ask- Abby to go into that situation as she did completely railroaded her into it.  Harper lied to Abby & told her she was out, got Abby halfway through like an eight hour car ride where Abby had no chance to turn back or escape, -then- hit her with the surprise. Harper both tricked & forced Abby into a situation she did not consent to & it was skeevy as hell. Made me really mad. Abby literally could not escape (1000 dollar uber ride) & was essentially imprisoned in an abusive house until her friend came to rescue her. 

I also agree with the 2020 thing. I could understand the desperation to stay in the closet if it was the 80s, 90s, 00s, but 2020? No. It felt anachronistic. Harper lives in a place/time where she would face no consequences for coming out but she acted like she was living in Russia next door to a Gulag or something. That evil lady's speech at the end wouldn't even hold up because in that state you could be sued into the ground for discriminating against homosexuality. 

Then when she was forced out of the closet, what happened to her? Absolutely nothing. Five minutes later she was cuddling with her girlfriend on the sofa  & the world continued to turn. Harper put multiple people through emotional trauma for years (Riley, the boyfriend, abby & who knows who else) for -absolutely no reason- other than her own cowardice. 

TL;DR I don't like Harper",k2ctta
gdv4min,"If you haven't seen Black Mirror's San Junipero I can't recommend it enough. Mackenzie Davis is also in it. It's a self contained hour long story, so treat it as a movie.",k2ctta
gdz0xf2,Imagine Me and You is a good one,k2ctta
ggpi8k2,This isn't really a kids movie or Santa movie.,k2ctta
ggjc1o9,I don’t see why kids that still believe in Santa would want to watch this,k2ctta
gg7txws,"I think the only two parts are when the grandma tells the mom to make sure to take the kids to see Santa bc ""this may be the last year they get to see Santa"" and then later after they see Santa the mom asks Kristen to watch the kids (who are right there) bc they just asked him for a new gift and does a winking motion",k2ctta
gg7k6xa,There is a scene where the topic of believing in Santa too long comes up.,k2ctta
gh1jgmv,"There's two scenes referring to santa not being real.  One outright states ""when I stopped believing in Santa"", one kind of alludes without directly saying it.

Regardless, I don't think this movie would appeal to anyone who's not at least a teenager yet.",k2ctta
ggjw83p,"Just watched.. Can't agree more. Bad acting, rewarding toxicity, just bad.",k2ctta
gf54z2u,"Aside from Harper being physically attracted to Abbie, I know nothing about their relationship dynamic. The first real thing we get from their relationship is Harper kicking herself for inviting Abbie to Christmas and trying to gaslight her into not going. 


Almost the entire movie was spent showing Harper neglecting Abbie and treating her like trash, even if it was out of fear of being rejected by her family, that’s not how you treat the person you love. I didn’t think Harper was on the same page as Abbie so it just didn’t seem like a good fit. Also, aside from the chemistry between Aubrey Plaza and Kristen Stewart, Riley was shown being there for Abbie and being supportive to her so it definitely seemed like there was something there. 


A toxic relationship riddled with red flags is bad, gay or straight and I’m saying that as a bisexual in a queer relationship.",k2ctta
gg529kk,"I’m queer and I still think Harper acted horribly. I understand how difficult and scary it is to come out, and Dan Levy’s character explained it so beautifully.

But it wasn’t just about her not coming out. If that had been the only big thing it would have been forgivable. It was the fact that Harper spent the *entire* movie being inconsiderate of her girlfriend’s feelings. She lied in the first place about having already come out to her parents, and then didn’t tell Abby until they were on the way there? And instead of ever making time for Abby, she abandons her at every social gathering and then gets jealous when she becomes friends with Riley. When she decided to spend a whole night with her ex and then lashed out at Abby for smothering her I lost it. I wish they’d shown more of Harper’s perspective and her fear of coming out but instead I just watched her treat her partner like shit for over an hour and it became impossible to sympathize. If they sprinkled in some redeemable moments throughout I would’ve felt better about the ending.",k2ctta
geaagvt,"I've been thinking about this. There are some elements I feel like people are confused about because the movie glazed over them, and I'm wondering if Clea just took it for granted that the main audience would ""get"" it without her having to work through it on screen. The little jabs from the mom about what a shame it is for Riley etc, Harper comes from a real shitshow family and the person she reverts to around them is the person she had to be to grow up with them. All of that feels pretty real and recognisable to me, I don't have to see Victor Garber fundraising with Westboro Baptist to get it.

I just don't find her behaviour as baffling as a lot of others. Not that I think it's good or fine or excusable, but I didn't find it puzzling and the complete write off she's getting under the circumstances is just ??? to me.",k2ctta
gellrng,">everyone assuming that Abbie and Riley should have been together really do not understand queer relationships and it’s borderline insulting that any two queer people who are together and have good chemistry must automatically be shipped together

Straight people are also nice to each other even when they don't want sex, so it's equally true that two straight people being nice to each other doesn't automatically mean sparks are flying; but it's obviously a common thing for people to ship people together who seem like they'd make a good couple even if they're not one and there's no reason to think they'd make a good couple other than that they're cute together/people want to see the drama that would ensure. I think rather than people not understanding queer relationships, you just don't understand ship culture.",k2ctta
gf54bnl,"Had this same experience watching the movie. My parents accepted me, but coming out was so hard and I truly didn't know if they would. Harper's situation hit home for me, and I thought it was very realistic, if not slightly hyperbolic for the fact that it's a freaking movie. People are so quick to get their torches on the internet.",k2ctta
gfnqfs0,"If this was a straight relationship and all of that came about, no one would be defending this couple. There would be more articles talking about how Happiest Season endorses abusive relationships in a post-Me Too world.",k2ctta
gdvuiss,"Definitely watch Schitts Creek. Dan Levy and Co. have been pumping out great comedy for years. Also, the show has some dramatic beats that really work.",k2ctta
ggjbuh9,And Aubrey,k2ctta
gdyzkxc,I kept thinking similar. It had all the plot points I'd expect out of a Hallmark movie.,k2ctta
gdzw8f6,"What does that even mean?  Hallmark is known for its Christmas stories, not so much their gay coming out stories.

Mackenzie Davis is pretty, but I didn't feel like her acting her was particularly strong.",k2ctta
gh2zvp7,"Nah, you just don’t speak Lesbian.",k2ctta
gdzbsbr,I was saying the same thing the whole time. She’s so shitty.,k2ctta
gexn6fm,"Admitting attraction and being a Lesbian are two different things. One is usually seen as a quirk and innocent, the other is a sin, confusion, or a mental disorder. Being in the closet is usually centered around fear and as progressive as we like to think the world is, it's far from being a safe place for those who go against the grain.

I myself have never come out to a family member and never will. My traditional caribbean family isn't the one to test the waters with and I know my safety and well-being being will definitely be in jeopardy if I did. I know far too many Jamaicans and Trinis who made the mistake of coming out and have had it used against them (a friend couldn't go to school after dad refused to pay tuition one semester because she cut her hair and looked ""like a dyke"" so she had to get box braids until it grew out and isn't aloud to wear pants anymore.)

I know like more than a handful of guys and girls, who have been kicked out and completely disowned without a penny in their name.

Covid took my job and both of my roommates so I had to move all the way back home while trying to get on my feet and I for sure have taken steps to ensure no one would dare to question me being straight because I'm not in a place where I could pick myself up if they were to toss me out on my ass.

Sometimes, coming out is far more worse than being in the closet.",k2ctta
gg5184i,"Lesbians still deal with plenty of stigma, it just looks a little different than it does for men. People tend to be chill with women being attracted to other women, if it’s seen as a fun cute sexy thing, but that doesn’t mean they’re accepting of actual lesbian relationships once they’re explicitly refusing to cater to men in any way.

Either way Harper’s an asshole",k2ctta
gezzb2v,"It mostly depends on which country/area you're in. In many parts of the world it's dangerous & a potential death sentence to come out, but this film was not in one of them. Harper was just being a selfish manipulative ass.",k2ctta
ggyh664,"""The movie makes the point repeatedly that Harper's behaviour is WAY out of the ordinary""

They literally tell us that she did this to another girl in high school lol",k2ctta
ge36oin,I actually liked Kristen Stewart in this movie. She comes across more believable as a lesbian than a straight girl.,k2ctta
geeb0m6,Kristen was great in this film. And she looked hot.,k2ctta
ge2vlas,"I don’t understand why you got downvoted. Kristen Stewart is not a good actress, someone else could’ve played the role so much better. 

I really enjoyed Dan and Aubrey, but the movie was OK.",k2ctta
gdtxeo5,"Dumb. 

Edit: ok, it was dumb but I don’t condone it being deleted.  It said something like “it should have been called ‘homo for the holidays’.” And I speak for no more than one homo when I say: it’s dumb, but not offensive. To me. Just saying.",k2ctta
gdu8567,That makes more sense. I was a bit confused on why and how he ended up being included not only with the book but in Harper’s family in general besides being Abby’s best friend,k2ctta
gdvb9el,"Oh that's so funny, I noted that early line as clunky exposition but failed to connect it to Jane's ending",k2ctta
gest63q,I really do think the Twilight series were the worst movies she has made. Same with Robert Pattinson.,k2ctta
ge7wrn9,"> At the end of the movie I had hope that they could regain some of what they'd lost, and maybe become friends again.

I think in the end Riley became friends again with Harper, I think it is implied from [this photo](https://www.metroweekly.com/wp-content/uploads/2020/09/Happiest-Season-Photo-by-Lacey-Terrell-1.jpg\)) that Tipper posted on her Instagram, you can see it during the credit.",k2ctta
ge53jmg,"Yes exactly, this. Maybe even just a conversation at the start showing that Harper understood why coming home for Christmas was such a big deal for Abbie",k2ctta
gdymnqw,"Yes! And the guy mall cop was played by Timothy Simons, whose character in Veep married Mary Holland’s character.",k2ctta
ge4s5ya,Mary Holland also co-wrote the movie and Jane was definitely the role she wrote for herself even though she could have played anyone else in the film.,k2ctta
geg902j,Tagging this for myself,k2ctta
ge9oh0s,"Totally agree, glad you said this. I was hoping she would be with Riley after that. The speech from Harper was all talk no action. I thought it would be a great message if she left Harper and stood her ground. Having her go back to her anyway just seemed weak to me. It reminded me of all the times Ive had girl friends that go back to their toxic exes and get hurt all over again.",k2ctta
get2dzr,"Yup, 100% agree. I was hoping Riley and Abby would be together at the end of the movie because of how selfish and terrible Harper was, she never redeemed herself imo. I liked the movie but I just feel sad for Abby.",k2ctta
gessm8t,"Maybe I’m more shallow than Abby, but honestly, asking what someone sees in *Mackenzie Davis*?

I agree though, it would have been nice to see at least one scene in the movie where Harper actually acts as a positive, supportive partner. There’s the intro sequence with the paintings, but it’s not quite enough. Maybe a director’s cut?",k2ctta
ge6wzpv,Dan Levy handles queerness excellently. His wine metaphor was phenomenal in Schitt's Creek.,k2ctta
ghafin4,"Oh my god when Patrick’s parents are like “where did we go wrong?” And David’s like “I’m sorry?” And they says “where did we go wrong that he felt he needed to hide?” And David wipes away a tear and is like “oh I thought that was gonna go a different way”?!That shit destroyed me 

Dan is a national treasure",k2ctta
gf060s6,This comment right here.,k2ctta
gela2de,Pretty sure they didn't need to add a 5 minute scene just to show some kids getting yelled at.,k2ctta
gdyp9ju,"I disagree, I really think he doesn’t have range and that I felt like I was watching David Rose in a movie. And I have a strong feeling that’s what we’ll always get with Dan Levy

BUT

I really don’t want to dismiss him as a writer and a personality going forward in Hollywood. I think he can do a lot of amazing things and I love his work. I just don’t see him as an amazing actor.",k2ctta
ge9jkf3,This was the highlight of the movie for me. I rewound a few times just for this scene.,k2ctta
gf3xdeu,Captain Holt level pretending to be gay.,k2ctta
gdu9u4g,Yeah after Plaza’s character got a few scenes I knew she was cool. But when she was first introduced I expected them to make her play the part of “crazy ex-girlfriend”.,k2ctta
ggydhzy,That intro also included Harper letting Abby fall off a roof because SHE thought it would be fun to go up there lol,k2ctta
gdxvqrn,The quick rehabilitation of the parents was the worst. They were absolute monsters who should have been shunned by the sisters at the end.,k2ctta
ge9qu4w,"Queer people find solace, solidarity, and acceptance among other queer people. Showing kindness and empathy does nothing equate to “leave the partner you love and have a life together with who you were also planning just 2 days ago to propose to because someone else was nice to you when you were in the middle of a fight with your partner” 

I find it irritating that people think any two queer people who have good chemistry together must automatically be paired together. It’s so limiting, small minded, and puts all queer people in a box. Queer people have vastly different relationships among each other and it’s clear many people in this thread don’t have queer relationships. I didn’t find anything inherently sexual between between Abbie and Riley because they to me looked like two queer woman who finding comfort among each other’s company during a difficult time of the year for many and finding a friendly shoulder to lean on. That is what sparks amazing friendships. Not every queer person needs to be romantically linked because they were nice to each other",k2ctta
gf8y24p,Have you met people? People do a lot of stupid stuff. Not everyone always acts rational.,k2ctta
gdty9u4,And pretends it's okay. No problem. I do this all the time. It's nothing.,k2ctta
gdwqipt,You know I'm something of an engineer myself.,k2ctta
gdu2l8h,Always!,k2ctta
gdxoeql,That family did not deserve that girl,k2ctta
ger2rdu,hey I know you,k2ctta
ge5y06m,"Agreed! Honestly I cried quite a bit at the end watching all Abby was going through. When I came out to my family, I’m Bi, they were all like okay cool. But my cousin, his parents are so unsupportive (and they don’t even know for sure they just heard rumors ) and I’ve watched him struggle so hard to try to come out. It breaks my heart.

So I get Harper’s fear, I’ve seen it in real life. But she still really messed up with a lot of their actions and she was forgiven way too easy. They needed to actually work it out.",k2ctta
ge3t5ws,Every film I’ve seen her in she looks *giant* even though I have a few 5’10 girl friends and it’s no big deal.,k2ctta
gi10taz,"Agreed. I empathized with Harper for Harper’s situation, so I was never on the whole “leave her for Riley” camp that a lot of people seemed to be on. Totally agree that the ending was wrapped up too cleanly - it seemed that it suddenly shifted from their family being homophobic to her family all being under pressure from each other (which I guess makes sense but is a bit convenient to wrap it all up). 

I also wish the movie hadn’t also framed her friends as being homophobic too. They had Harper throw Riley under the bus in high school (which was an incredibly shitty thing to do that I don’t feel Riley would be okay with by the end when Harper got outed), when it would’ve been a tough enough situation already for Harper to come out to her family.",k2ctta
gdw86wk,"I don’t know about that entirely. I have seen people change their bigotries pretty quick when their child is involved. Of course, that does tend to be a minority of those types of people, but it is possible. I had a friend in high school who was adamant that if he had a child who was gay he “would disown them in a heartbeat.” It was a Sochi king and disgusting flaw in someone who was overall a decent guy. 

Well, many years later, whose son just came out as gay? Not his—he doesn’t have kids yet. But his nephew did! I can’t speak to how quickly his viewpoints changed, but I do know he is very vocally supportive of the lgbtq+ community now.",k2ctta
gg7938v,The movie just wanted a tidy ending but I have seen it play out like that. The parent wanted to keep their child in their life over their belief system.,k2ctta
gfues79,Completely agree,k2ctta
ggc0gfo,Straight up mental abuse from Harper and her parents. Unbelievable,k2ctta
ge3qyvq,I do wonder if the chemistry between Aubrey plaza and Kristen Stewart elevated those few scenes from something flat that it was intended to be- sooooo much spark,k2ctta
gdtn4fw,Agreed. It was fitting for her to see karma come back and bite front and center. Nice seeing civility displayed in regards to an ex lover.,k2ctta
gdu48c4,yea if they wanted to end it with kristen/aubrey they couldve made it a 2 hr movie and spent like 20 minutes building up their romance before pulling the trigger on it but it is what it is,k2ctta
geobe84,"I think this is the problem with the whole movie.  I hated Harper.  There was no reason for us to want Abby to take her back.  I think her terrible behavior could be explained, but we didn’t see enough of good Harper to root for her in the first place.

That, and the fact that the family of psychopaths turns warm and loving in a matter of hours.",k2ctta
