comment_id,comment_body,submission_id
gdu9uvu,"yeah the ending was a bit over the top for me. Not the main couple getting back together, thats expected for the genre, but the family getting past all their biases and feuds in like 2 days was too much for me. The parents ended up having no hangups at all (at least not on camera) about their daughter's sexuality, and then the sisters make up 100% and are buddy buddy all of a sudden? They were at eachothers throats all movie and Allison Brie crossed some major lines. 

It felt too much like the mega happy ending from Waynes World",k2ctta
gdu86tj,ehhh there are a lot of romcoms that end on that note but like you said they more than likely didnt because of christmas,k2ctta
ggbqwb0,Agreed. Harper was very clearly not the right partner. That is one of the shittiest things a person in the closet can do to their partner. Abby deserved much better. I don’t get why the movie wanted us to root for the two of them to be together. I don’t agree,k2ctta
geojt2c,"This movie was ""Get Out"" for the gays.",k2ctta
geoki09,I don't think I could've handled Kristen Stewart and Mary Elizabeth Winstead playing a lesbian couple. Or Stewart and Plaza.,k2ctta
gdtraox,"Mackenzie Davis really looked like Mary Elizabeth Winstead in this film. I kept thinking it was her, honestly.",k2ctta
gewviq6,"100% of the film. She got away with so much abuse and gaslighting.

Also, she's a narcissist, sadly, which is what happens to a lot of children of narcissists cuz trauma. And they don't change overnight. Actually, they don't change ever. It's a personality disorder and a big part of it is refusing to admit fault. Horrible ending",k2ctta
ggbre7s,"So true. It was painful to watch. It just pissed me off how Abby gets treated the whole movie, but then all is magically forgiven and wow Harper really is a keeper isn’t she? 🙄",k2ctta
ggjmkh2,"Aubrey Plaza was a good support character, too.",k2ctta
gdtm5wk,"Mackenzie Davies was really flat, but also wasn't given any character outside of 'closeted'",k2ctta
gdtxp9x,"In the Instagram photos during the credits, there’s one pic (I think when they were at Pride?) where you can see Riley and she’s with another woman - it’s actually a cameo by Clea DuVall who wrote & directed the movie!",k2ctta
gdu09ym,Harper was extremely toxic and manipulative. It feels like the ending was completely changed to fit something happy.,k2ctta
gewxjos,This movie didn’t know what wanted to be and the two worst actors were the leads.,k2ctta
geoeqpa,"I think you make good points, but as viewers the movie absolutely needed to show us more of them in a healthy relationship before showing us the toxic shit Harper started doing.  We need to know what they’re usual flow is so we can root for them to get back together. 

They failed us by making Riley more likable in every way and showing us nothing but a toxic Harper.",k2ctta
ger3nbe,"> I guess equality in its ultimate form is letting gays have the same generic slop the straights have had for decades

lmao",k2ctta
gfgobxn,that was my favorite scene i started crying with them,k2ctta
gg5g5o2,Holy crap lesbian Get Out is the perfect description. Except get out was actually entertaining. I couldn’t even finish the movie and even skipped through the half that I saw to the Aubrey plaza parts lol. I wanted to like it because I like some of the actors but nah.,k2ctta
ggyd7tn,"I actually thought the mom's little jabs worked, especially with rushing people to open presents.",k2ctta
gdz6i69,">She said she would try to get Abby to love Christmas, then she does nothing at all to make Christmas special.

I think the idea was that when Harper spontaneously invited Abby to visit her family over Christmas, she was happy and confident and in love, in a place where she felt comfortable and could be herself, and just said what she was feeling. She really wanted to do those things, and she momentarily forgot that her situation was different at home.

By the next day, reality had set in and she tried to dissuade Abby from coming, because I think she realised that her optimistic vision of getting Abby to love Christmas again with her family was not how it was going to go. It stopped being about what she wanted (to enjoy Christmas with her girlfriend), and just became a matter of surviving the situation. Then once they got there, she unconsciously regressed into unhealthy behaviours that she learned during childhood, repressing her true feelings at every turn, and lashing out when the guilt became too much. She overcompensated and distanced herself completely.

If she were thinking more rationally I think she could have found a way to keep her secret without being so neglectful, and they could have at least enjoyed Christmas events together as ""friends"", but she was making some very poor decisions due to fear.",k2ctta
gi5ucir,Exactly how I envisioned a better version too,k2ctta
hnyoyh4,"I really enjoyed reading this.

That's a great point: Sometimes, saying ""no"" is more about yourself than whomever is being told ""no."" If that person is someone you love, it's incredibly painful (another example would be the movie trope where a character must leave the love of his life because he doesn't want to endanger her life). I've never cried so hard and for so long in any movie, and it's largely because there's so much in this movie that resonated with me and I could relate to.

Yeah, both Harper and Abby had good reasons behind their choices. It's just unfortunate that the choices weren't compatible. That's how life is and maturity can be measured by how one deals with challenge—loss and  misfortunes included—and thereby how one adapts; do you face and accept reality or do you deny and evade it? This is grit applied to relationships.

I actually enjoyed the happy ending. I probably would also enjoy the tragic ending.

After this movie, I have a total crush on Kristen Stewart too. 🥰 Her outfits were also on point. 😆😍",k2ctta
gfwabvm,"Perfect ending would've been Abby and Harper taking a break to let Harper actually think about her actions then coming back together later on ***or*** them just not getting back together at all: a fast forward to next Christmas with John meeting up with Abby and Riley, Harper spending time with her family who have mended things between themselves and came to terms.",k2ctta
gfrmhfk,City council jobs are typically not a full time job. I assume Ted had a high-paying executive job or something akin to that prior to running for Mayor.,k2ctta
gg48ohv,Their sister was pretty nice,k2ctta
ggbwyxk,"Right? I was in pain the whole movie because of the mistreatment and abuse on Abby. But then I thought “oh, if she realizes she deserves better than that and sticks up for herself then that could be very satisfying!”

Nope, just go back to the awful partner just cuz she begged and things didn’t go her way. Just awful. Not cute, not heartwarming. Just... god",k2ctta
gewtd00,Im actually saddened by the ending because it seemed like they were setting it up to be a movie about cutting out abusers. Like Harper is dealing with trauma but so is every abuser. People shouldn't be taught to just deal with it -- especially queer people!! It's pretty sick ending actually. :+(,k2ctta
gf02mpa,"Agreed, Harper's bad traits alone could fill a novel yet she's meant to be seen as the protagonist. Let's see - 

She lied to Abby about her home life & didn't tell her until they were halfway through a long car ride & Abby literally could not escape. She blindsided her into that house & gave her like 30 minutes to prepare to live a lie, then cracked jokes at her expense for being a bad liar. Like..bitch. 

Harper let her family accuse Abby of being a thief & didn't lift a finger to correct them. That ""well if my brooch does show up on my dresser there'll be no questions asked"" line boiled my piss & I would have lost it. 

Harper clearly hurt people in her past, she threw Riley to the wolves & let an entire high school believe she was an unwelcome stalker rather than tell the truth. Fucking. Yikes. It's implied she hurt the ex boyfriend & left him without closure too, as he seems pretty hurt when he goes to her & asks her to explain what happened to him. She probably hurt more people that we don't even know about. 

Harper, after literally trapping her girlfriend in an abusive household, abandoned her & threw her under the bus. Just left her to fend for herself in a confusing new environment where the shining twins are doing their best to give her a criminal record & the parents of the house literally won't look her in the eye. Went & hung around with everyone except abby. 

Then after soft-ghosting her in this terrible situation Abby reaches out to her for help for the first time, she says 'you're suffocating me.' Like damn Abby didn't even consent to being there, you literally tricked & trapped her there under false pretences & you then have the audacity to call her suffocating? No. Just no. 

When Harper finds out that her sister was going through a divorce, literally the first thing she did was say ""yeeessss, I can use this to blackmail you!"" Not 'oh god that's awful' or 'I'm sorry' but ""I'm going to use this against you."" I know that Sloane was a bitch but come on girl that's your sister

Harper would prefer to literally fistfight her own sister in front of Abby than she would to come out. That fight scene was so heartbreaking. Imagine it from Abby's perspective, she's looking at the woman she loves rolling around on the floor beating her sister with various household objects because she doesn't want to admit she's with her. Yikes man. Yikes. Is that going to come up in the wedding speech? ""Haha honey remember that time I garrotted my sister with tinsel because I didn't want anyone to know I was with you? Ah, memories.""

The painting. I went back & rewatched the ending scene & when Harper slams that painting that the pure sweet innocent sister spent a hundred hours earnestly making over Sloane's head, she wasn't even provoked. There was a minute or two of silence & stillness then Harper just goes from 0-100 cavewoman  & whams it over Sloane's head for no other reason than..she's a bitch. Again, imagine physically seeing the woman you love do that in front of you do that rather than admit she's with you. 

& at the end of all this? It was all 100% completely fucking unnecessary. Harper lives in a state where she can face no bad consequences for coming out. She did all this not because she had to, but because she was a coward. It's 2020 in pittsburgh. Not Russia. Girl you can come out you idiot there is literally nothing stopping you

& when she is forced out of the closet? Absolutely nothing happens. She's cuddling on the sofa with her girlfriend five minutes later, accepted by everyone. They get engaged because that's been legal there for ages. Like...what the fuck girl you just emotionally traumatised about 4 people for Absolutely. No. Reason. 

So after spending an hour thirty minutes gaslighting, manipulating, lying, mentally/emotionally abusing, blindsiding, railroading, abandoning, blackmailing, literally beating up, dismissing, extorting, & generally fucking with people..Harper gets a happy ending. 

Aaaaaaaaaaaaaaaaaaaaaaaaaaaaaaaa

I don't even think Harper's constant assertions that she was going to come out 'after Christmas' were true. I think she would have found a way to weasel out of it. She's such a casual liar, dropping big lies & little lies with every breath, there's no reason to believe she was actually going to do the right thing. 

& even if she did, how is it acceptable to place more value on not 'spoiling' the parents precious Christmas than on your apparent partner's right to live openly as their true identity? To Harper, Xmas was more important than her girlfriend's identity. Literally. Priorities? 

Gay people have spent thousands of years having our identities stomped into the dust, we don't really want to see a movie where for 1 hour 30 mins Xmas cheer > our existence. 

Okay I think I'm done now",k2ctta
gfhlbu8,"I haven’t finished trying to ignore this movie while my partner watches, and I’m bummed that Abby doesn’t leave Harper for Riley!",k2ctta
ghaey55,"THANK YOU for the last part. I have toxic parents who are pretty similar to Harper's, and I dreamed for most of my life that they would have a moment where they realized how terrible they were. I'm 46, and it's taken years of therapy to understand that's never going to happen. To see it happen in this movie was absolutely ridiculous, especially when so much of the movie was spent showing how deeply embedded the fucked up family dynamics were.",k2ctta
ge98109,I can see having her painting thoughtlessly destroyed being the tipping point for Jane. Of course the movie then has her easily forgive her family like the rest.,k2ctta
gewv0dh,"It seems like the writers took it in one direction the whole movie, and then the ending got changed or something..

The scene where Harper is, in classic narcissist fashion, saying ""I did it!"" And expecting Abby to take her back, and Abby says no. I was like ""yes!"" -- it was so triumphant and I was so excited to get a movie that says NO to abusers, with a main character who has supportive friends who come to help remove them from abuse with no questions asked.

Then the ending is completely off the rails. I legit think that those pigs in hollywood said, ""this movie is too radical"" and changed the ending because it has nothing to do with what they set up. And you're exactly right that queer kids will see this and think they should also rush into abusive relationships and recreate patriarchal oppressions and all that shit. And I think that was the point of the ending. To recreate a culture of abuse",k2ctta
ggnqh5s,"I was a little annoyed when Abby took Harper back after begging in a gas station parking lot for 30 seconds. Like clearly Harper needed some more time to grow. 

It seemed like Harper’s entire personality changed from one 5 day vacation. I would be worried what the next situation would be in which my girlfriend would treat me like such shit. It was so natural for her, it might only be a matter of time.",k2ctta
gftaxp0,I think she's just making a joke because previously at the party Aubrey Plaza's character mentions how everyone wants to tell her about and have her diagnose their ailments. Kristen's character is making up a fictional ailment to ask her about since Aubrey's character is in medical school.,k2ctta
gxvgofr,It's just an ice breaker in reference to their previous conversation at the party when Aubrey complained everyone was asking her to diagnose random illnesses.,k2ctta
gkx7s35,Mood,k2ctta
hnuymt1,I've never cried so hard and for so long in any movie. I was completely bawling. 🥺🥺🥺,k2ctta
gdu564u,"It felt like it needed an extra 15 minutes to convince me that Harper deserved forgiveness after that final denial, which was fucking awful. I dunno how to do that, plot wise. Maybe like they spend a few weeks apart and then Abby sees Harper talk about her sexuality on the campaign trail for her dad and talk about how she loves her. I guess then it wouldn’t be a ~Christmas movie~ but..... the happy ending didn’t feel earned, it felt rushed!",k2ctta
gfxrxvi,"As someone on the spectrum I think she did have a few ASD traits. The fixation on her worldbuilding & being unable to tell when the person she's talking to about it being uncomfortable is one. Her social awkwardness & prowess with technology being another. The occasional inappropriate action or sentence. The fact that she was mentioned as biting people in her childhood, which can be another trait. 

The parents mentioned 'giving up on her' which when you think about how -old- & ignorant they were, is absolutely in keeping with the fact that Jane is probably an autistic female who went undiagnosed into adulthood - it happens a lot with women. They are far more often passed off as 'quirky' rather than being given the tests that they need by their parents. Given how shitty the parents were overall, I can absolutely see Jane not being given the evaluation she needs & her parents not having the faintest clue what ASD is. 

She's still my favourite character, after Riley. She was the most sympathetic character in the whole film.",k2ctta
gfhp9ch,No she's just the only freaking normal person in that family. Anyone would look autistic next to those neat freaks haha.,k2ctta
hnv3kyd,"I would say that it's very, very likely.",k2ctta
gdu0q50,">Her character and her performance is the heart and soul of the film.

Jane, too.",k2ctta
gdtrp9k,[deleted],k2ctta
ge3t6ef,"Yes! That's the thing for me too. I have no problem with Harper being closeted, as Levy's speech says so beautifully that is a different journey for every person and not an any way a character flaw. Like you said, the problem is Harper's only other character traits were terrible. She lies to and manipulates Abby throughout and even if Abby had just been her roommate Harper still treated her terribly.",k2ctta
gfmml8z,"> I were Abby and my partner told me the second before we left that she had lied about coming out and I needed to hang out in the closet to protect that lie I would have simply not gone on the trip 

Crazy thing is she doesn't even do that much. She waits until they're already in the car and half way there before she tells her that.",k2ctta
gdughcz,I started to dislike Harper at that point and it only got worse from there.,k2ctta
genqn6g,Trespassing on a neighbor's roof is also a terrible way to get the audience to like your main characters.,k2ctta
ggnptrl,"For me, it was when Abby was saying how she really just enjoys taking care of animals around Christmas and Harper interrupts her to drag her on a roof.",k2ctta
ghfctyd,"Also I don't think Harper would have come out had Sloane not outed her. It wasn't even ""she was too late,"" it was ""she waited until she didn't have a choice.""",k2ctta
ggjwaot,Yeah I don't see them together as a happy ending at all,k2ctta
ghaixkm,AMEN!!!,k2ctta
gdyyrpr,"Or at least had Harper have to work for it more. It's like Abby instantly forgave her after a final apology at the gas station. I thought it would have been more cute if Abby had still been saying no and then maybe Harper do the big thing of proposing. Little too Hallmark movie, but the whole thing read a bit like one anyways. They could have even went as far as Abby and Harper returning and Tipper giving Harper a family ring for Abby as a symbol of acceptance.",k2ctta
gdwbzbc,"I just about bought it, because throughout the movie it seemed like the parents' toxic behaviour was based in obliviousness and being slaves to conformity, rather than genuine bigotry. I think they just didn't have a clue how shitty they were.",k2ctta
gdwfahm,"A lot of people don’t really consider these things until it affects them directly, like their kids being gay/lesbian.",k2ctta
ge2zc77,"Yeah, it seemed very rushed in service of a happy ending, even with the two minute mystery about the dad being accepting or not. I told my parents I was trans about 4 years ago and I've been on HRT for almost as long; they still won't acknowledge it at all and while I'm out to my friends, it's really hard to fully come out when you still love your parents and want a somewhat-functional relationship with them and your family.

Think the film might have been better served by having the same epilogue with them being supportive, but not showing them immediately being perfect in days. Trying to be nice, maybe.  

Happiest Season gave me a lot of complicated feelings in general, since I pretend to be a completely normal dude in a fair bit of my life, and that naturally extends to asking my girlfriend to 'play along' in family situations. I still prefer the Riley/Abby idea, but I can empathise with Harper a lot (barring the times where she's going above and beyond being scared to come out by being uncaring/nasty towards Abby).",k2ctta
gdw9haa,"I think, with the best of intentions, DuVall was maybe a little too kind to conservatives. She was trying too hard to resist depicting them as cruel as they usually seem to be in this context, because she didn't want anybody to be the villain, but the upshot is that people with a little less first person perspective on these kinds of scenarios might not pick up on the cues about what Harper is so scared of.",k2ctta
ghi0o63,I can't say for sure but I know he has his own line of glasses so could be those?,k2ctta
gi5uwu4,"Honestly yeah they could have cut out one or two of the shitty things Harper brought upon abby and used it to set up a dynamic in the beginning, or any number of other things to balance the film out more.",k2ctta
gewtlsb,I think it's a movie about accepting and loving your abusers. It's super sad actually,k2ctta
gehmvbf,"I don’t think her backstory was needlessly tragic, they just mention her parents being dead and they don’t elaborate on the details, the whole joke there for me was her family are the ones beating her over the head with it. I think if they were going full tragedy it would’ve laboured the sad details and also had her parents rejecting her or something.",k2ctta
ggf2ay7,"I did and thought that would've been the better ending, still not too bad.",k2ctta
gf91fv3,"And, honestly, they needed to make Harper far more likeable. If we had had more redeemable scenes with her pov or focus, I think it would've flown a bit better. I absolutely despised her character the whole way through.",k2ctta
gf546pe,"This is pretty much my take as well. I enjoyed it way more than I thought I would. It's not perfect from a story structure or writing standpoint, but loved that the representation felt natural and that they got such good actresses for all the roles. Harper could be very unlikeable, but the actress did such a phenomenal job. You could see her code switch with her body language and tone when she was back with her friends. Also, Jane is the hero of the story.",k2ctta
ghaftwc,"I totally agree. In reality, in order for Harper to salvage her relationship with Abby in the B scenario, they would've needed to leave immediately and most likely go no contact with Harper's parents.",k2ctta
gehma5s,"Tbf I think that was really what clea Duvall was after, IIRC her quote was something like she just wanted to make a gay Christmas film, and to me that’s what this is. It’s just cutesy and silly and there’s the odd quite touching moment, in its own way I think it’s great for that though. It’s not setting out to be a hard hitting Film About Being LGBT.",k2ctta
gea2odc,I'm glad to hear this. I was worried they were going to play to their personas and try to out-bland each other. I really like them both.,k2ctta
ger3jil,cast was def 10/10,k2ctta
gdweyz7,"If you liked the ex husband:

https://youtu.be/Xs-UEqJ85KE",k2ctta
gfxvhgi,"Yeah, I pointed out the phone call plot hole too. In the time & location this film was set, the 'villain' could be sued into the ground for suggesting the don't ask don't tell mentality. It just doesn't hold up. 

I got bollocked by a bunch of tumblrites who babbled about how i was living in a privileged bubble because coming out can get you killed in Russia. Uh, this is set in Pittsburgh. You can't make this stuff up. 

I was wondering about the tracker thing too. Just what did the friend put on her phone that allows him to easily know exactly where she is? Is it a chip? Is it software? I'm genuinely curious, & how did Harper get it too? Shouldn't Abby be saying 'um guys how are you all doing this'",k2ctta
gfsuivw,"Lol just because Dave ""All Lives Matter"" Rubin has discovered he can make more money simping for billionaires as a gay man doesn't mean that pretty much all homophobes aren't conservative, if not all. The movie never even specified if the dad was an R, plenty of Dems act all stuffy just like he did. I mean, it probably helps that modern ""centrist"" Dems are just R's from 30 years ago with a couple of social issues sprinkled in, but that's beside the point.",k2ctta
ge8t6ya,Plaza was there to give background into how horrible Harper was and to have chemistry with K Stew.,k2ctta
gdz1k5r,"The cynic in me wants to think, ""What could be more iconic than two queer folks remaining in an obviously toxic relationship despite hundreds of red flags? \*sips wine\*""

Then I remind myself that it was made for a primarily heterosexual audience that in all likelihood would have no clue how common this is, and that the movie portrays a wlw relationship just like a heteronormative relationship would be shown in other similar Christmas feel-good movies. Romcoms are by and large not meant to show healthy relationships, because those don't sell as many tickets. It's a problem endemic to the genre, not this movie in particular. Granted, it could have tried to do better, but to paraphrase us both, toxic relationships put butts in seats.

I didn't catch that Jane was ASD-coded, but I'm not too great at picking up things like that. It does make a bit of sense now that you mention it. Still, if it was enough for people to miss, that may allow for some plausible deniability. One could say that some people act differently because they're autistic, and some other people act differently because they're just odd.",k2ctta
gdyenc4,the sisters were SO abusive. by the end of the movie i despised harper and was disappointed that the couple ended up together. how could you want to be with someone who treats their lovable sister in such a dismissive and cruel way?,k2ctta
gdu56u2,Thank you for writing this. I'm fuming after watching it and you perfectly expressed why.,k2ctta
