comment_id,comment_body,submission_id
gdtwjsz,"I really enjoyed the movie, the first part of the movie felt like typical romcom, predictable but very comforting. And the second part, especially when the sisters argued, it felt really heavy and cathartic in a positive way.

The redemption part felt little bit rushed for me and I kinda wished Riley (Aubrey Plaza) arc got resolved. That being said I really like the chemistry of between her and Kristen Stewart, it was really charming. Also, I think Mackenzie Davies and Kristen Stewart chemistry was pretty good, especially in the beginning of the movie.

In the end, pretty refreshing romcom and I think Kristen Stewart should be in more romance and comedy movies.


Side Note: 

* I saw [this photo](https://www.metroweekly.com/wp-content/uploads/2020/09/Happiest-Season-Photo-by-Lacey-Terrell-1.jpg) few months ago, and it showed up again on Tipper's instagram I assume that Riley is seeing someone new and Clea Duvall is portrayed her.

* I also like that Jane (Mary Holland) and John (Dan Levy) became BFF.",k2ctta
gdtyci9,"I really enjoyed this movie. Great cast (including smaller cameo parts), and a lot of very funny moments mixed into a cute feel good story. Wanted to get that out of the way so that my minor complaints don’t come off as too negative. However...

I *hated* that Harper repeatedly left Abby alone at parties where she didn’t know anyone, or sent on outings with family members she’d just met, or ditched her to stay out late at a bar with her old friends. It made me so uncomfortable. Separately and independently from everything about her family issues and closetedness, she was just an inattentive partner and bad friend to Abby, who she’d brought into this very awkward and uncomfortable situation in the first place. I feel like they spent too much screen time showing her being a bad partner to strain their relationship and not enough showing why they were good together in a relationship to begin with. 

Also, Jane was very clearly the best member of that family from the start. The most heartbreaking moment wasn’t about any of the romantic or family relationships, it was when Jane’s absolutely beautiful painting got destroyed. And the most gratifying (albeit heavily telegraphed) moment was after the time jump when her novel was a bestseller.",k2ctta
gdtvzu5,Dan Levy’s scene about coming out to your family was such an emotional scene. He stole any scene he was in.,k2ctta
gdz1q8g,"I just read [this article](https://www.indiewire.com/2020/11/happiest-season-clea-duvall-queer-rom-com-1234599465/)

> Late in the film, Harper’s sexuality is unmasked — without her consent — to her entire family, the kind of big revelation scene that has populated many a rom-com, but “Happiest Season” gives it a painful twist. Harper doesn’t use the moment to finally come out, but to pull herself deeper into the closet. It’s heartbreaking for Abby, and the kind of disruption to genre expectations that makes the film so special.
> 
> “We all have our baggage, we all have our main triggers and our fight or flight responses, and I think Harper is someone who was like operating in this certain way for a long time,” DuVall said. “It’s this devastating moment where your instincts kick in and you realize that you have not come as far as you thought you have, because you haven’t really confronted yourself. It’s a very humbling moment and something that I think we can all relate to, no matter what it is we’re overcoming. You don’t overcome it on the first try.”

Yeah, this made me understand that reveal your queerness is not as easy as you think, especially when you can't predict their reaction

> As Abby flees from the scene, it’s John who catches up with her. Instead of tossing off some sassy witticisms, Levy’s character instead offers an emotional and introspective assessment of the situation, one that leans heavily on some necessary empathy.
> 
> “I wrote this speech about coming out, because I was thinking about how we can have compassion for Harper in that moment,” DuVall said. “She does do something that is pretty bad and I can see why an audience would be upset with her, but it’s also about wanting to have compassion for people who are going through that. Coming out is so different for everybody. For some people, it’s super easy and I think that’s great for them, but for a lot of people, it’s really not.”

Yeah, glad that she gave Dan Levy (John) one of the most gut-punching moment in the movie, he really delivered on that.",k2ctta
gdttjqo,"I think I’m too used to seeing Plaza in an evil/crazy role...I fully expected her to tell everyone they were lesbians. Glad she didn’t. I wish there was more of her in this film. 

Also 

“Did you celebrate Christmas at the orphanage?”",k2ctta
gf3peqv,"Yo... the closet is rough, I get that. But the closet doesn't make you ignore your girlfriend, spend all night with an ex, and then call her ""smothering"" when she calls you on it. The hell was this movie

Like, it sets up the premise like it's gonna be a lot of wacky misunderstandings, but all the conflicts and misunderstandings are not even remotely played like they're supposed to be funny. Weirdly dark movie, just weird all around.",k2ctta
gdyyxp7,"The movie suffered from making Harper too evil and the parents too nice. We're constantly told how horrible the dad is and I just didn't see it. He's not depicted as a good person, but if you want to justify Harper's awfulness, you needed to make the parents worse.  Also you can't have Harper be the favorite child, I feel like Harper's behavior would have been slightly more justifiable if the parents kept fawning over Allison Brie and ignoring Harper. 

I'm not the first person to say this, but this needed to be a braver movie where Harper and Abby just break up. A lot of Harper being a bad partner had little to do with her parents. Leaving Abby at all the parties, being jealous and hypocritical, etc.  

If you have to end this movie with Harper and Abby together, cut out some moments of Harper being cruel to Abby, change the whole beginning to flesh out Harper and Abby and show why they are together, and have Allison Brie be the favorite child and not Harper.",k2ctta
gdtoayf,I really want to see the movie Kristen Stewart and Aubrey Plaza thought they were making,k2ctta
gg6w3dj,"I think the biggest problem is they didn't do enough to get people invested in Abby and Harper's relationship. All they get you to do is like Abby (you know, she doesn't like Christmas but is willing to put that aside, shes gonna propose) but then you spend over an hour watching her get dumped on by a never ending parade of shitty, toxic assholes. So you could give a rat's ass about them fixing their relationship, you'd rather just see Abby get the hell out of there. Then they rushed into trying to tie a little bow into redeeming this crappy family before it felt earned.

I spent the entire back half of the movie hoping Kristen Stewart and Aubrey Plaza would run off together. Let them bond over what an asshole Harper is.

(But I liked Dan Levy)",k2ctta
gh04tbk,Personally wanted Abbey to get with Riley. Hated Harper and she didn't do enough to redeem her behaviour imo. Thought that family was terrible and felt so sorry for Jane. I'm so glad her book got published.,k2ctta
gdtlxfa,“I have a way with routers”,k2ctta
gdy3i5d,"Overall I really enjoyed it but where they lost me was at the very end. There was so much toxic build up, Abby was hurt so much. If they wanted Abby and Harper to stay together, they should have at least did a small time jump...something like— Abby does leave and goes home. Stays with a friend and she runs back into Harper on NYE..

We see Harper working things out with her parents before then and really digesting her behavior and how she fucked up. Then they agree to try again and we see them all happy and together again next Christmas. 

I did still feel for Harper, coming out can be so incredibly scary and painful as Levy’s character so aptly pointed out. But Harper needed some time to work on it instead of them just going “Oh cool, poof it’s all better now”.",k2ctta
gdzvl9s,"Thoughtful/constructive commentary aside, I just really liked the height difference between Kristen Stewart and Mackenzie Davis. Either Kristen is tinier than I've realised, or Mackenzie is basically an Amazon.",k2ctta
ggvbj0r,"I wonder if anyone (while filming) brought up the fact that they made Harper almost too unlikable in this. 

They kind of kept piling on reasons for people to dislike her. I can see why everyone was rooting for the Abby/Riley pairing, simply because Abby was consistently being hosed by the writers throughout the movie.",k2ctta
ggk2t3y,"This movie had the chance to be great and it blew it. It needed to make the bold move and it settled for the sappy ending instead.

Abbey deserved so much better and Harper was legit awful. I know it’s about her struggle feeling like she has to choose between her family or her girlfriend, but that’s just like... I don’t know.

Abbey should’ve ended up going home with John and starting over completely or she should have gotten with Riley.",k2ctta
gdtzzuw,"Harpers parents were straight up shitty people with no redeeming qualities and them suddenly being ok with everything at the end was absurd and also makes Harpers feeling extremely stupid, Harper was a selfish asshole too, she constantly treated Abby like shit and was completely oblivious to how her parents were treating her. Doesn’t matter if she’s terrified of her parents disowning her. Fuck them anyway they were extremely toxic and writhe with mental abuse.",k2ctta
gdu1e4v,"There's something about Christmas movies having the worst families, they were all terrible to each other. I loved the supporting cast and mostly had fun, but I think everyone in the family ended up a bit too unlikeable. Overall, not an awful way to spend a lazy Friday and better than a lot of the Christmas romcom garbage out there.",k2ctta
gdthbgy,This is one of the better Christmas movies in awhile in my opinion. Side note: is it bad that I wanted Kristen Stewart and Aubrey Plazas characters to get together instead?,k2ctta
gf3wvys,"Can we get a sequel around the best characters, John (Dan Levy) Riley (Aubrey Plaza) and Jane (Mary Holland), the latter of whom deserved SO MUCH better? They can all wingman/wingwoman each other. 

Like it can be around Harper and Abby hosting Christmas or having a Christmas wedding, whatever.",k2ctta
gfk3wfm,"I liked it. And I feel like a lot of folks in this comment section are falling prey to that most Reddit of behaviours, looking at one bad time and suggesting someone throw their entire relationship out.

The opening picture montage tells us that Abby and Harper have been together, and happy, for over a year; Abby moved in six months ago, and things have gone so well she's planning to propose. Aside from a bit of awkwardness on their date, every indication is that this is a happy, functional couple. 

And then they visit Harper's family. After just a couple of days of being closeted and surrounded by toxic people Abby wants to get out of there, and who can blame her? These people suck! She's not at all wrong to leave that party, or to tell Harper it's over at that point. But Abby's feeling punchy and angry and off-balance after just a few days of hiding herself around strangers; why are we surprised that Harper is an even worse mess when she's doing it with her family? Of course she's acting shitty, look at the environment she was raised in! When she's in the city with Abby and John she can be her actual self, but in her parents house she reverts to being the paranoid closeted lying teenage trainwreck she was.

And if she'd stayed that way, Abby would've been entirely right to walk away and never look back. But, and this is the important part, Harper doesn't stay that way; she recognizes that she's been shitty to Abby, she admits her mistakes and apologizes and promises to do better. And as we see literally the next day, when she's openly cuddling with Abby on the couch, and when Abby is invited into the family picture, there is change and their is improvement. And if someone is working to change, is it really so wrong to give them another chance?

I liked Happiest Season because it does what romcoms so rarely do; show a couple actually working through a problem and coming out the other side. 

Also, because Dan Levy. But who doesn't like Dan Levy?",k2ctta
ggubn5r,Jane stole every scene. Which is impressive when she’s the only actress I hadn’t seen anything of beforehand.,k2ctta
ggydd78,"Harper failing to save Abby from falling off the roof was basically a spoiler for how the rest of the movie would go. Consistently failing her girlfriend in like every department lol, really wish they went for a bold ending where they broke up.",k2ctta
gdtog5o,"I was really happy when Kristen Stewart's character walked out and her girlfriend thought everything would be better when she told everyone.

I kind of wish they ended on that. I know it wouldn't be very christmassy, but I feel like rom coms should end that way sometimes.",k2ctta
gfi9sxs,"first of all can i just point out how GOOD kristen looked during the white elephant party. like the half buttoned shirt and eye makeup and hair and everything holy crap she shouldve left harper to date ME!

yeah anyways i loved abby john and jane but harper? ew no gross!

sloane did not need to be redeemed shes an asshole who outed her own sister outta jealousy..

harper also did not need to be redeemed at all. shes terrible, toxic, manipulative, mean, a hypocrite and bitchy. like yeah being closeted is hard but thats no excuse?! for being a terrible gf??!

honestly i really hoped abby would’ve left harper for riley. they have wayyyy more chemistry! also john and janes friendship is everything i love them so much

overall funny movie but the ending was super unrealistic so 6/10",k2ctta
gg1u9wi,Jane's reaction to her painting getting destroyed was the biggest gut punch. I teared up.,k2ctta
gdtjmfa,"have the major gripe with it as everyone else but all will be forgiven when Kristen Stewart and Aubrey Plaza make out in some indie in a couple years

onto the positives: like all the best rom-coms it’s a secret horror movie, Mary Steenburgen is hilarious, few actors are as good at Kristen Stewart at communicating emotional devastation without making a big show of it, Mary Holland rules, Dan Levy made me cry once again, and Aubrey Plaza/Kristen Stewart at the drag bar was one of my favorite scenes of the year.

Mackenzie Davis continues to be weirdly used in movies but when her character wasn’t being a rom-com monster she was quite good, and she had some terrific moments at the end. still seemed a little bit miscast though - for some reason Mary Elizabeth Winstead kept coming to mind as someone who might've been a better fit.",k2ctta
gewmdkn,Harper was unlikeable for 80% of this film lol,k2ctta
gdu8ppr,"This movie was just watching poor Abby be treated like absolute trash by the entire family. Harper was so mean and selfish the entire time, there was nothing redeeming about her character or chemistry in that relationship. But damn did Aubrey plaza and Kirsten Stewart have chemistry I knew it would have been a weird pivot but I still was hoping they would get together. They should just take out all the lame characters and make a movie with Riley Abby John, and Jane.",k2ctta
gdxmegt,"Pretty fun movie, had some issues with it. I felt like KStews character had so much more chemistry with Aubrey Plaza. 

Also I feel like Allison Brie's character got off light for outing MacKenzie Davis. Outside of that, pretty nice movie.",k2ctta
gfwxpwp,I cried a little bit when they broke poor Jane’s painting. It was so cute and she was so proud of of :(,k2ctta
gg6k1is,"John's line towards, when he told Abby that Harper not coming out had nothing to do with her love for Abby. And then explaining how everyone's experience is different. Besides that moment and the parts with Jane, very few saving graces for this film tbh.",k2ctta
gdtlkey,It was okay. I know it was going for that situational family comedy but the whole family was really unlikable and not in a quirky way. I also didn't think Kristen Stewart and Mackenzie Davis had the best chemistry but Harper was also hard to root for at times so that probably didn't help. I actually agree with everyone else praising Aubrey Plaza. I wouldn't have been upset if the film took a turn and the lead got with her instead. Even at the end I was hoping they'd show her character one more time for a resolution.,k2ctta
gdv1khm,"I think the early romcom framing is throwing people *way* off in how to process Harper's stuff later on. You're not meant to like her decisions - she doesn't even like them! - you're meant to understand they're way out of character compared to the usual flow of their relationship, that's the point. The movie could maybe have done a little more to show us their relationship before that stage to catch any stragglers, but I was surprised it seemed to be lost on so many commenters.


I still keep seeing people get hung up on the ""suffocating me"" bit though for example, but that was very obviously about her and her family rather than Abby? 

Idk, it just feels like a lot of people wailing on Harper haven't really given much thought before to what being in the closet actually costs or does to somebody. It does make them do lots of unsympathetic things, and they don't like themselves much for it either. Harper clearly isn't enjoying the person she's making herself here any more than Abby is. And the fact her family fucked Sloane up so much too makes me inclined to think she wasn't actually being that irrational in her fears about them.",k2ctta
gdx3vdo,"Critics went reaaally easy on this. So many lousy sitcom-y set pieces and Gags that make no sense or could be easily solved by basic communication. 

Also thought it let the family off way too easy in the end. Would've been better if the dad's financier decided to use the gay angle to virtue signal how ""progressive"" the dad was.

Also Kristen shouldn't have taken her back. 

Acting was good though and some good laughs.

I guess equality in its ultimate form is letting gays have the same generic slop the straights have had for decades lmao",k2ctta
geazoes,"Sloane is an absolute piece of crap, though. If she was my sister, she'd be dead to me.",k2ctta
gem08ng,"I got dragged into this movie on a date and I gotta admit I thought it was great.  Dan Levy crushed the scene about coming out to your parents, particularly when it was so heartfelt and serious after he'd been established as the goofy friend for most of the movie.",k2ctta
gfhxiiv,Dan Levy acting straight at the party was literally the only joke I laughed at. I thought people calling it lesbian Get Out were exaggerating but they really weren’t. Rose and Harper even look the same lol,k2ctta
gdyiw8r,[deleted],k2ctta
gel8eip,"I wouldn’t mind the movie ending with Abby and Harper breaking up but not for Abby to end up with Riley, a person she just met, right after almost proposing to someone else. I wouldn’t mind it to be revealed during the time jump montage, though.",k2ctta
ghafbwm,"I absolutely understand Dan’s speech to Abby about how coming out is such a personal experience and that it varies from being supported to getting kicked out and everything in between. I believe it’s so important to understand that many times someone’s inability to come out has nothing to do with their partner and everything to do with themselves. 

Harper wasn’t wrong for wanting to stay in the closet, it’s such a personal choice (she was absolutely wrong for outing Riley’s character though) but I also think Abby wasn’t wrong either. Her line “I want to be with someone that’s ready” is such a fucking important one. Often times were made to feel guilty for not wanting to date someone in the closet. And while you are not allowed to tell someone when and how they should come out, you most certainly are allowed to choose whom you love and “out” is an acceptable standard to have. I think that needs to be talked about more.

Harper coming out to her partners and telling Abby “no wait look see I did it I love you” and Abby responding with “I’m sorry it’s too late” was so...painful. But fair. I really wish Abby had left and Harper had had to deal with that. I think it would have made for a more impactful story if Harper was made to truly feel the effects of the pain she caused not only Abby, but Riley as well. Her “I’m so sorry” to Riley does not, in any way, make up for outing a teenager. Harpers character fell flat for me. 

I know it’s a movie and everything but I just feel they dropped the ball in the last 30 minutes. 

But I’m also a sucker for cheesy rom coms that take place during the holidays. And I’ve had a major crush on Kristen Stewart since she was in Twilight so I’ll take what I can get.",k2ctta
ge8asr7,"A side thing I really enjoyed about this movie is how they tackle that Sloane's divorce.  She and her husband clearly love and admire each other but know it won't work.  You get that whole story and dynamic with a few looks they share, it's just really sweet.",k2ctta
gf9d7ev,I enjoyed it for the most part but man it really could've used another 15 minutes redeeming Harper and her family,k2ctta
ge4031d,"i think harper is very flawed in some aspects but i also think that people are entirely too harsh on her. fear does crazy things to someone and i can empathize with that her fear of being outed in an unaccepting family. this film also ignited my love for kristen stewart again and i think about the line “stay out of it, sappho” all the fucking time.",k2ctta
genrqra,Why is winning this mayoral campaign in this small town such a big deal? How did the Dad afford that enormous house? Surely that didn't come from being part of the town council.,k2ctta
gf94s6m,"Wasted potential: the movie 

I like complex, flawed characters but after the first 5 minutes Harper has basically an hour+ of treating her girlfriend like shit. Where’s the balance? Why are we supposed to root for them? They overdid it with the ex bf, leaving her alone at parties, staying out at night, the fight and smashing her sweet sister’s painting. If they’d just gone with the “lies to her parents cause she’s scared, but they’re in it together” it would’ve been a way better movie. That, or change the ending. 

Also, it’s somewhere stuck between comedy and drama. It’s not funny enough and people act too shit for it to be a pleasant romcom, but there’s too many ridiculous moments for it to be an effective drama. 

On the plus side, great cast, chemistry and a couple of laugh-out-louds, mostly from Dan Levy. 

6/10",k2ctta
gfam5g0,[removed],k2ctta
gecvenm,"Meh.

It felt like a reverse The Family Stone. They didn’t flesh out enough of the characters, so most seemed flat. Toxic relationship that the abuser gets away with their shittiness. Dan Levy’s monologue was the high point of the film. That ending was unrealistic and rushed. Not good at all. I wanted to like this, so much so I didn’t even watch the trailer. I figured it would be good, so no point spoiling jokes. But I’m walking away with no desire to rewatch.",k2ctta
gek7k0v,Great First and Second Acts. The third act was TERRIBLE. Completely rushed and poorly written. Everyone has a happy ending and completely abandon their irredeemable traits within 24 hours? Just a few more scenes showing the main characters grappling with a difficult choice before choosing the happy ending might’ve saved it.,k2ctta
gex79cd,[deleted],k2ctta
ge2vdjt,"Okay I went into this expecting it to be really bad and was very pleasantly surprised. It would actually be among my top holiday movies if it weren't for all the b.s. that it pulls in the last twenty minutes or so:

- Harper was forgiven *much* too easily after spending about 95 per cent of the movie being absolutely thoughtless and borderline cruel to the woman she supposedly loves, starting with putting her in that horrible situation in the first place. You can easily feel sorry for her (as a child of narcissistic parents, I know all too well the deeply-ingrained feeling that keeping them happy has to be your number-one focus at the cost of everything else) but it would have been better character development to have Abby leave her in the end (and get together with Riley, imo).

- Harper's sister was also forgiven too easily for forcing her out of the closet.

- After the brilliant conversation between Abby and John about the reality of coming out to your parents, having Harper's parents' homophobia magically cured to the point of them suddenly being written as different people felt *too* fairytale-y. Trying to redeem her mother who's been a monster the whole time by having her be like 'Oh I actually hate flowers and want to learn karate'? And the dad being like 'wow forget my lifelong ambition to become mayor, I've just realised my family is more important' felt right out of a bad 90s children's movie.

- Jane's realisation of 'I deserve better' came out of absolutley nowhere.

Ultimately I guess I wanted to see a relatable ending where the sisters bonded and realised they are valid and don't need the approval of their abusive parents, and waving a magic wand to have them turn into great parents on the spot instead was a bit disappointing.

Still cute though! 4/5.",k2ctta
