comment_id,comment_body,submission_id
gdux9mv,"The movie was really enjoyable.

Harper and her family suuuuuuck, except for Jane who was precious and i want to hug

Dan Levy was a surprise joy for me in this, especially his coming out story really got me

I hope we get a sequel or a spin off with more of Aubrey plaza’s character",k2ctta
gdw30g2,"Gave it a 7 overall.  After about 30 minutes I was close to turning it off, but thankfully did not.  Wasn't really a fan of the comedy scenes, didn't really laugh at them.  What saved the movie for me were the more serious scenes, like Riley telling Abby about her past relationship with Harper, or Dan Levy's character talking to Abby about coming out.  I'm  not gay, but that scene made me cry a bit.   I wanted Abby to end up with Riley, but can see why they had her end up with Harper in the end, but if Abby hadn't taken her back, etc... I might have given it a higher rating, since people wouldn't have expected that ending.

Overall, enjoyed, could have been VERY good though.",k2ctta
ge08z59,"I really really did not like that first half I thought ""wow! I don't care at all"" because it's the same ""hide from family, but have to balance if you're ashamed of showing to family??"" and I don't think anyone... was likable. Daniel Levy's character was clearly just written to fit as David from Schitt's Creek so eh, didn't work for me, didn't seem genuine.

Second half was a little better. I liked the commentary it made in standing up for family and fhat coming out can be as normalized as marriage problems. I found myself not wanting to turn it off because I at least wanted to see what happened.

Overall, just a little better than mediocre, I guess?",k2ctta
gdua4o7,Solid romcom. I just feel like the title really misses the mark. It does nothing to tell you what the movie is about and sounds like a bland Hallmark channel movie. Luckily some great performances elevated it out of Hallmark territory. Dan Levi steals a lot of scenes,k2ctta
gdvdq2b,It's a hallmark movie with better acting lol. Mackenzie Davis is a very good actress.,k2ctta
gdu4uqb,"What a cute Christmas movie! I want more LGBTQ films that aren’t surrounding trauma or cheating on your significant other to figure out you’re gay or over sexualizing lesbian characters. Just a good solid romantic comedy, seems like too much to ask now a days.",k2ctta
gdtgj7d,It’s actually good.,k2ctta
gduedyb,I'm just here for Jinkx and Dela.,k2ctta
gdu6pvn,"Enjoyed the movie overall, felt that the family with the exception of Jane were too unlikable to be able to be rescued and redeemed in the last 15 minutes. It's a Chrismas movie so I get that they can't have a more compromise ending where maybe the sister and the mother is redeemed but the dad still hasn't come around.",k2ctta
gduaul0,There’s a lot to like about this movie but Harper is not one of them. I can’t imagine a straight rom com where the lead would end up with someone so shitty. Really really weird plot development.,k2ctta
gdwj89s,Aubrey plaza,k2ctta
ggyf1ns,Kristen Stewart is really bad at acting and emoting and delivering lines,k2ctta
gdu9r41,I'm watching this now. Please someone tells me that Kristen dumps her GF. She's a bitch and hooks up with the ex gf from HS. Im sorry. Not only Haper told her to lied but she basically abandoned abby when she got home and let her fend for herself with her shitty family.,k2ctta
gewvwjo,[deleted],k2ctta
gdwpib6,"Folks, a few bad days in a long term relationship with someone you otherwise love enough to move in with and propose to does not a ""toxic"" situation make.

The movie makes the point repeatedly that Harper's behaviour is WAY out of the ordinary and that their relationship is usually great. Not saying the movie couldn't have done more to *show* that, but calling her abusive or toxic is more than a little extra.",k2ctta
gdww58p,"Kristen Stewart wasn’t the right choice for the role. She was pretty lifeless and didn’t bring much to the character.

Movie was blah. Dan’s scene at the end was the best part of the movie and the fact that Abby still wanted to leave afterwards setting up Harpers apologize at the gas station. 

Pretty mediocre. Jane was great though!",k2ctta
gdwuzbp,"I thought I liked the movie until I got to the last 20 minutes or so. ""Oh, it's a Christmas movie, everything good hehe nice"" was super cringe. Apart from the ending and those 20 minutes of pure pain, the movie was cute. Kristen & Aubrey were fantastic. Worth a watch!",k2ctta
gdtt5uq,[removed],k2ctta
gdtyvtj,"John had an offhand comment early in the movie about managing authors, so I think it was implied that he had a role in getting Jane’s book published and so successful. I thought that was a nice little way of completing that arc.",k2ctta
gdzv442,"Kristen Stewart is great, she should absolutely do more comedies. Her comedic timing was the redeeming feature of the recent-ish Charlie's Angels reboot which was otherwise a dumpster fire.",k2ctta
ge7t6gr,"I think Riley's arc got resolved. She got closure with Harper when Harper finally voiced the regret that she'd held onto for so long, and apologised for what she did back in high school. It looked like they took the first step towards letting go of the hurt of their past. 

When they shook hands and Riley squeezed her hand, you could tell how close they used to be. At the end of the movie I had hope that they could regain some of what they'd lost, and maybe become friends again.",k2ctta
gdtzc0q,"> I feel like they spent too much screen time showing her being a bad partner to strain their relationship and not enough showing why they were good together in a relationship to begin with.

I really agree with this, I think it left the impression some viewers that Abby and Harper relationships are one-sided and on worst case, toxic. It shouldn't be a surprised that is one of the reason why some people are rooting for Riley and Abby.",k2ctta
gdym69y,"> Great cast (including smaller cameo parts)  

Jane and the gal cop were played by Mary Holland and Lauren Lapkus, respectively. They are part of the improv/sketch troupe Wild Horses, and they are absolutely hilarious. Here are a couple of skits they've done: [The Heist](https://www.youtube.com/watch?v=6oOzAjPxJuk), this [Wonder Woman-themed thing with Conan O'Brien](https://www.youtube.com/watch?v=AByf89Xp0W4), and this killer [podcast where they riff on Sex & the City](https://www.earwolf.com/episode/erin-whitehead-stephanie-allynne-mary-holland-sex-and-the-city/).",k2ctta
ge4yy2i,"Yeah, I am so happy to see some other people felt like this. I personally lived through something a lot like what Abby did, with the betrayals and bad treatment, which you can maybe ultimately pin on a closeted person struggling with their repression... and I ALSO forgave the person and gave her another chance... then was married to her for two years that ultimately only served to burn me down the rest of the way to the water line :/

It was such a sweet movie in lots of ways, but I SO was happy to see Abby stick up for herself, and when she finally just admitted she wanted to be with someone who was ready to BE together. And the thought that she might have even wound up with Riley also made me so happy just thinking about it <3 And to have Harper just show up, make a nice speech, and talk her into another go... I found it really traumatized me all over again having such a critical LGBTQ+ movie glorify that kind of thing.

I mean of course it isn't like someone CAN'T turn over a new leaf and just be a decent person on a dime, but I think it's crazy rare, and the idea that it's somehow a reasonable thing to bank on has seriously hurt way more people than just me. I wanna see movies that normalize that you don't HAVE to try to make it work with this same person after that big a heartbreak. There is nothing wrong with both parties trying again with someone who DIDN'T do all this shit to you, or go through this pain that you caused by being shitty (it's often best for both to just cut the cord and start again).",k2ctta
gdud5bc,"Agreed. Harper didn’t treat Abby the way any decent person would treat a roommate, let alone their girlfriend. Even if that cover story was real, Harper was pretty terrible. I wish we could have seen more of what Abby saw in her.",k2ctta
gdutdl1,Not to mention lying about coming out to your family and inviting your girlfriend to meet them without them knowing you’re gay and together. And only mentioning it when they are trapped in the car together. And then ignoring her request to leave the trip.,k2ctta
geadxtp,"Agreed.  
  
I was so happy when Harper finally came out and ""picked"" Abby only for Abby to coldly tell her it was too late. I thought the movie was really going to follow up on that -- on how Harper was a bad partner totally separate to her closetedness. I was really hoping at the gas station that Abby would really highlight this but no cigar.  
  
I still like a perfect happy ending where they make up, but this movie really could have gone either way. Abby ending up single or with Riley would have brought more depth at the expense of the feel-good happy ending. Both are equally good, I think.",k2ctta
gdyw41v,I agree. I kept hating Harper for this. She brought Abby down and then told her what five minutes from the house that she wasn't out to her family. So she shoved her girlfriend back into the closet and then proceeded to treat her worse than someone would treat a general friend. I thought Abby let her off a bit too easily at the end.,k2ctta
geberd1,"I linked an interview with the director/writer Clea Duvall. It explains in depth why Harper deserves forgiveness. 

[Clea Duvall interview](https://www.google.com/amp/s/variety.com/2020/film/news/happiest-season-director-clea-duvall-interview-1234843292/amp/)",k2ctta
gdwcjpo,"Yeah there were a lot of moments that made Harper seem like a terrible partner/person. 

They really could have resolved them by having not having Harper's friends and family basically ignore Abby and instead have Abby be the one being distant from them. Like at the first party instead of the 2 girls straight up ignoring Abby and her fake a phone call that they didn't even care about, have them be semi interested in her and have her fake the phone call because of being awkward or whatever. Then at the bar have Harper leave with Abby and be resentful that she wasn't hanging out with her high school friends she hasn't seen in a while.

That way while the main issue is still Harper not coming out to her family Abby is still not totally blameless for having a bad time there.",k2ctta
gdwq8fy,"It was a big reminder that despite living in much more accepting times,  surrounded by LGBTQ friends who have experienced nothing but support,  it's still a very scary thing to have to go through and not everyone *will* accept it.",k2ctta
gdy56qo,"I'm so glad Dan emphasizes that coming out is still a MASSIVE thing for a person, even if their parents/family are supportive. In Schitt's Creek there's an episode where his boyfriend hadn't told his parents yet after a long time and I thought it was going to go into the territory of ""why would you keep me a secret??"" But even his absolutely selfish, flamboyant character was very sensitive to the situation and knew that it's a huge moment for a person",k2ctta
gdx8mej,"Took the movie up a notch or two in my books. It was a really fun, but potentially disposable to that point, but that scene gave the movie the heart and emotional impact that it really didnt have yet. I can see this movie becoming a bit of a Christmas classic now",k2ctta
ge7uopu,"Still didn't justify her getting back with her. Even if she did finally come out and profess her love to her in front of her family. That wouldn't erase all the emotional and psychological torture that she had just put me through. 

Plus what she did to Plaza in high school. 

I would have connected with Plaza and get as far away from her family and get as far away from Harper as possible. They were all such insufferable ass holes and the one person and the one sister who actually did have a good heart but was a little awkward was flat out neglected. 

This movie had a lot of good will going for it, and then just ruined it with the false-happy ending. But loved Stewart, Levy, and Plaza. 

Oh, and then the kids finally (randomly) admit to putting the necklace in her purse, and the mother never once apologizes for basically accusing her and judging her as a thief? And the kids don't get punished? BULLSHIT",k2ctta
gdxnfs4,Dude has some range. But one of my favorite part was watching him pretend to be straight.,k2ctta
gdukk3z,"That started the waterworks and then I just cried my way through the rest of the movie. To be fair, I was aided by the help of alcohol and closeted gay angst, but still. He was amazing.",k2ctta
gdu0xgg,I teared up. Mediocre movie still got me in the guts.,k2ctta
gdww94q,Best scene in this otherwise lifeless movie.,k2ctta
gdue0gn,Fucking Eugene:,k2ctta
gdxoupe,It's good seeing her get to play sane human beings. I feel like April Ludgate kinda got her into typecasting for a stretch.,k2ctta
gdu8de0,I didn’t really get that vibe from Aubrey. I definitely got it from Alison Brie’s character though. I really expected her or her kids(accidentally) to out them as a couple.,k2ctta
ge3qdn9,"As someone who has no parents I was wincing a lot when they brought up the orphan thing- I absolutely got it (‘you’re an orphan so happy to see you’ even in your 30s can be cringe) but I thought they might address it as a plot- it just seemed a bit- nothing? I don’t know. Harper kept saying ‘you are my family’ to Abby, and I thought Abby might say, ‘well what does that mean’ back or something, I don’t know. Overall I really liked this film though",k2ctta
gefvkv6,I personally can't wait for Black Bear,k2ctta
geaee4r,"I'm really glad they didn't do that with her.  
  
This movie didn't need a spurned lesbian ex-lover outing people and forcing Abby down to Harper's moral level as a character.",k2ctta
ghbsvq7,I loved her in this. A subdued Aubrey really surprised me and killed it. I thought she was great and would love to see her play some more low key characters,k2ctta
gf952s0,"Did you not see the minute long intro where they’re happy so we’re supposed to root for them despite all the obvious red flags? Haha

Yeah, tonally this movie is all over the place.",k2ctta
ggjdu60,What got me was the Harper destroying her sister's painting without any hesitation.  That's just psychopathic.,k2ctta
gdwhxud,"This is my favorite comment in this...there's clearly a cut of this movie where Stewart ends up with Plaza. The ending with the family just suddenly coming together and being good people was pretty clearly a last minute decision that messes with the entire tone of the movie. 

I enjoyed watching this movie simply because I like yelling at stupid characters acting completely unrealistically stupid through an entire movie. There were at least 8 points where a rational woman would've been like ""Nope, screw this"" but Kristen Stewart stayed every time lol.",k2ctta
ghafy43,"I want Kristen Stewart and Aubrey Plaza to star in a movie next Christmas in which Plaza is a fancy doctor living in the big city who hates Christmas and has to go back to her small town where she runs into Kristen Stewart who is a baker who teaches plaza about the joys of Christmas. I want no painful coming out, I want no judgy families. Just a good, shitty, cheesy Christmas rom com. But gay",k2ctta
gh2x5y1,Exactly.  The movie should have invested more in their relationship.  I always wondered why Harper just couldn't tell her girlfriend early on in the relationship that she's not out to her family and that whole situation.  Someone enlighten me but if you're dating...how hard is it to give that heads up...,k2ctta
gh4g2ed,Just finished watching and completely agree. Was so disappointed at the end.,k2ctta
gdtwv8j,"I laughed at that part because it is kinda realistic. There's someone on your family who played the ""Tech Support"" part.",k2ctta
gdvcdf3,"""I don't have any secrets but I'm an ally""",k2ctta
gdu6dwq,Mary gave herself a lot of the best lines in the movie.,k2ctta
ger2spr,she wrote the movie too,k2ctta
ge4ee5u,I like that ending better. I also think we need a more fleshing out of Harper and Riley’s past and she deserved a much better apology than the one she got,k2ctta
gdzvxe1,"Davis is 5'11, but ""feels"" taller somehow. She has a naked fight scene in Terminator and just dominates the whole screen, it's really cool.

I think they play up KS's relative shortness though because she's meant to feel a little small and out of place next to the family, while Harper is the superficially confident assertive one.",k2ctta
ghyqlka,"For sure. I really feel for Harper's situation, I get just not being able to come out to your family. But the way the movie tried to almost frame Harper basically flirting with Connor as an equivalent to Abby spending time with Riley felt way off base, the two aren't comparable at all ESPECIALLY after Abby already told her at the dinner that it made her uncomfortable. 

I felt bad for Harper right until she got outed, and then tried to bury it again. You know your girlfriend wants you to come out, you've had her basically pretending to be a charity case for this family, you know she hates Christmas **because of her parents' deaths**, and when push came to shove (literally) you rebuke her. Nah, you don't get to make up for that with an apology. 

Also the turn around time on the parents just felt super forced ""have to have a happy ending for this holiday movie"". Honestly, the best case scenario is that when he got that phonecall saying that as long as Harper basically hid her gayness he could win the election is that he would think that's perfectly reasonable and then get irrationally upset when Harper / Abby tell him that's unfair, and accuse them of being selfish.",k2ctta
gh1j60r,The Connor angle was terrible.  It really seemed like she was rekindling some feelings there.,k2ctta
gh1io02,"It could have had an incredible ending like The Family Stone where they break up and she could start dating Riley. And then it shows next year at the party and everyone was doing their own thing but well meshed  and it would have been good.

That ending was just so awful.",k2ctta
gysqtpj,I know it's suppose to be a wholesome Christmas movie so it had to go with a happy ending for Abby and Harper but literally 20 minutes in I stopped rooting for them and wanted Abby to dump Harper.,k2ctta
ggycuz1,"Yeah I get that it's a Christmas movie but the whole time I was hoping they'd really go for it and keep them apart, would have been crazy honestly.",k2ctta
gdvh2xn,"Yep. People like Harper and Harper’s parents don’t suddenly have “come to Jesus” moments and then it’s all kumbaya and singing around the fire. 

It left a really bad taste in my mouth how awful they were and then they say “oh sorry” and it’s all good and fine. 

No. That’s not how ANY of that works.",k2ctta
gftnx0l,"This. In what world is this ever going to be a healthy relationship? 

Imagine Harper is a dude. He lies to his family about his girlfriend. He lies to his girlfriend about his family (and whether they know about her). He ignores her at multiple family parties, spends two or three evenings chatting with his ex, and even goes out drinking with the ex. Then he stands by as his family accuses his girlfriend of stealing and shuns her from future events. No way is this going to end with them as a happy couple.

I get it -- coming out to conservative families is hard. But you can't lie about to your partner for months and only tell her after she's in the car, on the way to Christmas with the fam. That's a big breach of consent, which is super important in the LGBT community (and should be for everyone).",k2ctta
gfjfimw,"I was really hoping the film would end with the Krampus coming for all of them except Riley, John, Abby, Jane and the boring-hot boyfriend.",k2ctta
ger2v7b,fuck her parents why would she want them in her life,k2ctta
ggbr4qp,"Couldn’t agree more. I’m supposed to feel sorry for these shitty parents who ruined their children? Oh boohoo, we just wanted to be perfect.... Give me a break!

And Harper was awfully manipulative and shitty to Abby even when the parents’ eyes weren’t on them. She could have had a good fun night with Abby but she treated her like garbage and then played the victim card. Oh and then begged her to stay together. Bad taste in my mouth for sure 🤢",k2ctta
gdxmlbq,"Nope, she seemed so much more honest and down to earth than MacKenzie Davis's character. It's also refreshing to see Aubrey take a break from playing sociopaths and play an regular human being.",k2ctta
gdtmls3,"I was shipping them as well just because their chemistry was more convincing than Abby/Harper but it would have made the most sense for Abby's character to have wound up alone. The movie did *a lot* of heavy lifting in the last 20 minutes to redeem the family's awfulness, and I'm not quite sure it stuck the landing, but I'll go along with it because it's a Christmas movie.

Jane is hands down the MVP.",k2ctta
gdxsty2,"honestly, they had much better chemistry - part of it was just the actresses but part of it was plot-related, as Riley was the only one in Harper's entire extended circle that actually paid any attention to Abby and listened to her.",k2ctta
gdtlpn4,"I was waiting for Aubrey to make a move, and the closest she got was changing seats in the booth to sit next to Kristen and I'm glad she didn't. Would have just been a tacky move for what turned out to be such a good character/person.",k2ctta
gdtz0r3,"Abby was planning on proposing to Harper and then two days later gets together with her ex instead? I don't think that would have made much sense. I do think they might have made Harper a bit too unlikable though. She was clearly not acting like herself due to the pressure of having to hide her true self from her parents, but she was also just kind of an asshole (idk if you can blame ditching your girlfriend to hang out with your ex on being in the closet). I could see Abby ending up alone, but I think they still wanted this to be a feel-good family holiday movie.",k2ctta
gdvc3d6,"If you keep an eye out during the credits then it looks like Aubrey Plaza's character lands Clea Duvall, so I think she'll be fine",k2ctta
gdtoe4c,"They're both very natural, realistic, charismatic actors in a movie where everyone around them is acting like a cartoon, it's a bit jarring at times.",k2ctta
gdupeln,"Aubrey Plazas character definitely deserved more of a pay off, she got shat on pretty bad.",k2ctta
gdthsn7,"No, you're right, that's how it should have ended instead.",k2ctta
gdutuol,"100%. They could have been really ambitious with this, but they went with the safe route, which I understand. But at the same time, Abby went through so much shit and a couple apologies won’t cut it.",k2ctta
gdxzo99,"No, there are a bunch of people (me included) who felt the exact same way. I loved it honestly all the way up until the end.",k2ctta
gdu55fr,"Yes, definitely wanted them to end up together instead.",k2ctta
gdu9vsk,Ugh I came for spoiler just to see of they do. I do not like her gf at all.,k2ctta
gdtz5ka,I thought that was going to happen. Harper was a total self centered bitch.,k2ctta
gdwynxy,You and the rest of the internet!,k2ctta
ggubfb9,I oddly shipped both Kristen/Aubrey and Kristen/Mackenzie. But I shipped Kristen/Aubrey more.,k2ctta
gfsuue2,Woah I just realized Lady Gaga has a song called Mary Jane Holland... Mary Holland playing a Jane? Odd coincidence,k2ctta
gfq3t6q,"> Also, because Dan Levy. But who doesn't like Dan Levy?  
  
He's an utter treasure",k2ctta
gg0f5nt,I wish they’d given a little more exposition on their relationship being really solid and worth getting back! I felt like there was 3 minutes of happiness before the I’ve been lying to you for 6 months revelation and had a bit of whiplash,k2ctta
ggfflmr,"I agree with most of your points. 

There are a few things I didn't like about Harper's behaviour (spending all night with an ex without a good explanation and when they're still into you is a big no no), but they got it right when they mentioned that her behaviour was 99% about her and her relationship with her parents. It affects Abby, for sure, but it wasn't about her. I'm not excusing her behaviour, but it's not necessarily a reason to run away.

This is what a complex relationship looks like. There are a lot of moving parts, they're figuring it out, and are growing together. I'm surprised they showed this in a whitish family (a lot of gay and straight people I've been around have been judgemental about grown women who haven't come out to their parents yet) to be honest. But I think it's important to see the different kinds of people out there.",k2ctta
gjpz87s,"of all characters in that movie, I felt reflected in Jane.",k2ctta
hnv346w,"I suspect that she fulfilled the autistic (particularly Asperger's syndrome) character role, and I thought the filmmakers presented autism with justice and respect. There's a lot of people who don't know that they're on the spectrum and will find Jane's character to resonate with them.

This film was great at capturing such a wide berth of today's culture in a hilarious but still respectful manner. I appreciate films like this where views from different sides are treated with equal respect and satire.",k2ctta
ggytvbt,Mary Holland is on a ton of podcasts if you're into the sort of thing,k2ctta
