comment_id,comment_body,submission_id
gjnvin6,"Thought it was mediocre drivel. I'm baffled by its critical acclaim.

*One Night in Miami* is too aware of how it's a film adaptation of a stage play that is less about the psychology of its characters than how they can speak to the present moment. What the audience gets is less penetrating insight into Malcolm X, Cassius Clay, Jim Brown, and Sam Cooke than characters who're aware of what their futures hold. Similar to how Joseph Gordon-Levitt's character in *The Dark Knight Rises* is revealed to be named ""Robin,"" *One Night in Miami* telegraphs each character's future in unimaginative ways. Malcolm is not long for the world, but he's meeting with ""a writer"" to get his life down; Cassius Clay is the greatest boxer of all time, but he's soon to become an icon transcending sports; Jim Brown is a football player but he's soon to be an actor; Sam Cooke is about to author ""A Change is Gonna Come."" C'mon, how is this interesting? Each hint at these characters' futures takes a page from the *Dewey Cox* school of biopics.

The greatest sin of the movie is how it lacks actual drama. The drama imposed by King and Powers is from the present. Neither Clay nor Brown are vessels of the present but X and Cooke are, and what uninteresting vessels they are. The performers don't reveal anything new about the past or present to us. Their arguments can be read in the pages of *The New York Times* or on Twitter.

Eli Goree is horrible as Cassius Clay, by the way, a caricature of old video reels and interviews.

I have one good thing to say about it: X the amateur photographer is wonderful subtle characterization. Too bad the rest of the movie doesn't go for that.",ky96b8
gjibcd5,"Wish they had chosen a different musical artist since Cooke was killed after trying to rape a woman in a hotel but I get why they needed it narratively at the end to string it all together. Still a great performance by Leslie Odom, and enjoyed the movie overall.",ky96b8
gtwa7hb,Did not expect to cry.,ky96b8
hnm7md6,Aldis Hodge was my favorite. Captured that silent/strong vibe of Jim Brown.,ky96b8
gjfivxa,I’m not ready for that ending. Doubt if family still has rights to his life story they sign off on the real life death.,ky96b8
gjngl95,I second this!,ky96b8
gjfiule,">I really should watch more stage adaptations.

Most stage adaptations are terrible. They're usually the main characters talking in a room while the camera sort of just swivels around.

This movie though is a notable exception and a welcome departure. Not just because of the scenes that don't take place in the room, but because of how the plot stays dynamic. They go to the roof at one point. Cooke and Ali make that detour to the liquor store, etc. This is how you do it. Phenomenal movie. Odom's monologue about the Rolling Stones is such a brilliant fuck you to Malcolm. Incredible all around. The Boston Concert is probably my favorite scene of the year. also I had no idea Cookie died IRL 10 months later. Surprised they didn't include a note about that.

Also what a hell of a year for Kemp Powers. SOUL and then this? He has a long career ahead of him.",ky96b8
gjewv0g,My favorite is Night Mother. Trigger warnings but it actually works and it's devasting to watch.,ky96b8
gjh1u61,Stage adaptations can be good especially if you go in treating it like watching a play which was pretty much how I watched Ma Rainey's Black Bottom but for me nothing beats the real thing but obviously that's not always accessible for most people depending on where they live. It seems thanks to lockdown things might be moving in a more accessible direction though with streaming services like ntathome being created.,ky96b8
gjfiqzq,It took me so long to not see him as mad dog. He killed it though! Did great. Glad the boxing he learned in prison as a teenager in riverdale prepped him for this role lol,ky96b8
gjj9zc1,">Shoutout to Mad Dog from Riverdale, he was a great Cassius Clay. Movin on up! Haha

I knew him as Wells Jaha from The 100 (another CW show). It’s always cool seeing small time actors in bigger things.",ky96b8
gjlxqb8,Check out Fences,ky96b8
gjr89rv,"Every nailed it, but Kingsley and Leslie Odom Jr brought it. Would be very happy to see them both earn accolades along with most of the cast of Ma Rainey’s because these films were like masterclasses in acting.",ky96b8
gk56zqu,The Boys in the Band is another great one,ky96b8
gk7w2fp,You may like Rope and Dial M for Murder by Alfred Hitchcock! Both are basically set in one room and I believe Rope is a stage adaptations.,ky96b8
gjf7v2p,"Oh wow, he was Mad Dog! Haha, good to see him in better stuff.",ky96b8
gjioyv6,"I highly recommend *night, mother*.",ky96b8
gkxmup9,Check out Doubt and Glengarry Glenn Ross.,ky96b8
gljtrbe,"Oh wtf, didn’t even realize it was Mad Dog. He needs to get himself off Riverdale ASAP then.",ky96b8
gjhsaar,I kept expecting him to say something nice but racist the whole time like “you’re a credit to your kind” and then I was like “oh I guess he isn’t”. I had the biggest audible gasp and look of shock on my face.,ky96b8
gjipceb,I almost fell off the couch my gasp was so loud.,ky96b8
gjskroq,"Talk about a shocked, but not surprised moment. They really helped lay it on thick with Bridge's character really driving home how he'd help him out no matter what, blah, blah...temporarily tricks your brain into thinking, ""ah, maybe he's not so bad then,"" and then they hit you with that line, and you're like, ""of course, it couldn't have ended any other way.""

So finely played, even if I did curse him out, aloud only to myself, haha.",ky96b8
gjf9hxd,Same I think everyone’s watching it right now lol. Friday night and it’s all over Netflix and Amazon Prime.,ky96b8
gjngpvi,That scene said a lot. I wasn’t expecting it either and that’s why it is so powerful.,ky96b8
glc7eqf,"I thought he was going to make some flimsy, obvious excuse. My sheltered self was not expecting to hear the words that came out of that man's mouth.",ky96b8
gtvejyk,"General Landry what an asshole!

I wanted him to deck the racist fuck so bad.",ky96b8
gjfj8nh,"I think it’s due to the range in portraying Cooke. Musical aspects aside, you see the vibrant star side of Sam, the underlying want to tell his truth, and everything in between. Malcom was very much on one mission and laser focused on it. Don’t get me wrong though, the performance was great.",ky96b8
gjficzj,"Same. Leslie Odom Jr. was great, but Kingsley Ben-Adir was the standout of the movie IMO.

I wonder if Leslie Odom Jr. is getting more love because he’s already a big name.",ky96b8
gkxpuha,"I agree that Kingsley was incredible! I do not agree that he was BETTER than Leslie. Leslie needs to drop music for acting imo, he is a force(if he prefers musing then more power to him). Leslie transcends in his ability to act while not talking. 

Kingsley was absolutely incredible as well. When he first appeared on screen i critiqued his lack of physical resemblance to Malcolm(usually not a huge deal but Malcolm had a very powerful physical appearance). I was pleased to forget that thought quickly once Kingsley really got into character. Man, that verbal bout between Cooke and Malcolm was some of the best writing/directing/acting combination on a long time. It played like a prize fight. I hope to see more of Kingsley in the future as well.",ky96b8
gkvseca,"I’m with you. I was utterly captivated, gonna pay real close attention to everything he does going forward. Even the scene where he’s watching the fight from the crowd, the way he reacts or adjusts his glasses — all pitch perfect.",ky96b8
gjr48vw,"I was waiting for the rug to be pulled from under my feet during that conversation, but boy did it take my breath away",ky96b8
gk0jf4n,"As soon as he said something about how ""our peoples have always looked out for each other"" the hairs on the back of my neck stood on end and I had strong bad vibes coming from that guy. Still gasped at the n-word quote though I thought he was a fly under the radar you're one of the good ones type of racist.",ky96b8
gjozlam,"I honestly don’t know if I could choose who was best in this movie. They all did so well and I think they all played off of each other. It was like a symphony. Like if one of the actors had mot been as good, the others may not have seemed as good.",ky96b8
gks5aq1,I been a fan of his since the show Leverage. He's going to be playing Hawkman in the Black Adam movie.,ky96b8
gjx09o0,Right? I have a man crush.,ky96b8
gkb2svx,I was just waiting for him to speak in the motel room and once he did.... thank you honey. You killed it. Everyone was so good in this film so it’s hard because that spotlight is shining on them all.,ky96b8
gjfceqv,"I perfectly agree with that last statement, and I think it adequately captures why I loved this movie so much. I was enthralled by everything they were saying and I kept reevaluating how I felt and thinking “yes, he’s definitely got a point.” Awesome dialogues",ky96b8
gjqhf8h,"I love when movies do this. A lot of movies that explore political/cultural issues are content with having one clear point of view and argument scenes tend to have an obvious ""right"" person and ""wrong"" person. It makes sense if the movie is taking a firm stand on something, and those scenes can totally be entertaining or satisfying, but it's also pretty easy to pick out writer surrogate characters and it can feel condescending if it's not executed well.   


It's rare to see a script that is willing to leave big questions up in the air instead of trying to answer them. It's much more rewarding to have something to actually *think* about or a moral question to ponder rather than have the movie tell you how to feel.",ky96b8
gjf9exj,Their back-and-forth was so thought-provoking. The perspectives each one had was so well portrayed and really made me appreciate where each one came from.,ky96b8
gkxtbus,">What's funny is that I agreed with both of them.

A sign of a brilliant confrontation, for real",ky96b8
gl2l50r,"I love how the film for the most part just let's you sit back and listen to all of them, and think about it.",ky96b8
gmrqogn,"That’s the greatest part of getting a stage-to-film adaptation. Of course it’d be better to actually watch that unfold on stage, but getting it in this movie is a great second choice",ky96b8
gk2t27l,"> But the idea of tying in that history/inspiration of ""A Change is Gonna Come"" and giving it to Malcolm X was brilliant.

What I find fascinating is something that didn't come up in the movie, but the author surely knew. I'm curious how it was incorporated into the director's and the actors' portrayal:

By the time of the Liston fight, *Sam had already recorded ""A Change is Gonna Come""* but it wouldn't be released for another few days. So, in the reality of the play/movie, Sam knew that Malcolm was about to get what he wanted from him, but didn't even mention it.

(I know the events of the movie are fictional, so of course the timeline doesn't work out perfectly. The real life Tonight Show debut of the song had already happened by the time of the Liston fight.)",ky96b8
gjjqjuc,Felt the same way,ky96b8
gjxemd3,"Regina is unbelievably talented, I've only seen her in The Leftovers and Watchmen (she crushed it in both) but it's amazing how she's also making a niche for herself as an accomplished director.",ky96b8
gk3fu63,"Also, it would be easy to carried away with a Muhammad Ali impression in a role like that and go overboard, but he measured the cadence out just right throughout.",ky96b8
gket7vr,That's Ali though. Credit to Gore too though.,ky96b8
gjfngpc,The Oscars are a lot further out this year so I think we still have some time before the race settles. I still view this one as being a probable Best Picture nomination along with some performance noms.,ky96b8
gjf3wbq,"Regarding your fun fact, I think back then studios would often not keep an archive of tv tapings, look at what happened with Dr Who",ky96b8
gjf9pef,Oh wow! I was wondering about that when he performed it live at the end. I was almost certain he never did it live in real life since the song itself was released posthumously. That’s a really great little detail. Thanks for sharing that!,ky96b8
gjhf9b4,"I still think it wins Best Adapted Screenplay and picks up some other nominations. The Oscars aren’t till April this year, so there’s still time.",ky96b8
gjghvvi,It’s a terrific movie and the performances are first rate.,ky96b8
gjgi0l5,A beautifully done final sequence.,ky96b8
gjiyoz1,"His voice is incredible, but the performance was mesmerising, and held my attention so well. He could be onto an EGOT if this film gets enough buzz.",ky96b8
gjf4yhs,Live at Harlem square is one of my favorite albums ever.  So good,ky96b8
gk5um64,"Copacabana always gets a lot of hate, because Harlem Square is so good and the crowd is so energetic. But Sam kills it at the Copa too. The arrangement of Tennessee Waltz goes hard.",ky96b8
gjotxl0,"Surprised I had to scroll so far down to see him mentioned. He was my main reason for watching and I love to see him killing it in bigger and bigger movies. 

I can kind of see why he's not mentioned as much - he was the only character who didn't have an emotional outburst in the movie. His reactions were definitely more understated, like him escaping to the bathroom for a minute or quietly accepting the disrespect at the beginning of the movie.",ky96b8
gkswy14,He was the highlight for me too. One of my favorite scenes was him and Malcolm talking alone in the hotel room.,ky96b8
gjjtyfg,"First movie I watched with a VR, fine choice. Just like being at the theater.",ky96b8
gjjxt8a,"I think the lack of fresh air in Mama Rainey’s was appropriate. The lack of change in scenery created the feeling of being trapped and suffocated. So did the constant commentary on how hot the place was.

It was set in 1927. A brutal decade for anyone who was Black in America. Probably why the story is also so much darker and leaves you rather hopeless. The opposite of One Night which is set in the birth of the Black power movement.",ky96b8
gjovwy3,Beau Bridges. You just confused the hell out of me thinking the dude was in this movie,ky96b8
gjoxp1l,That wasn’t Jeff Bridges,ky96b8
gkxhfqs,"I felt the scene did a great job being incredibly uncomfortable right from the first moment and the way the dialogue danced around their family's ""shared"" past just cranked it up even more, so I wasn't shocked when Bridges showed who he really was, but it still hit hard.",ky96b8
gl0lwyp,The best part about that scene is that you go into it with that tension of something bad is going to happen. But as it goes on you start to let your guard down just like Brown does and then *bam* they hit you with that brutally casual n-word. Couldn't have opened the movie in a better way. Perfectly crafted.,ky96b8
gjf5esg,The Chain Gang recounting by Malcolm X may have been the best part of the movie,ky96b8
gjhtwjd,He’s been on a streak of acclaimed movies lately,ky96b8
gjgwrc8,"I cried a lot as well and also as it played over all the other subsequent events. It was so powerful. Also so sad to think also that he would have died later that year in a terrible and senseless way, when it would have been amazing to see what else he could have done had he lived. 

It also helps that he absolutely nails Sam Cooke’s singing voice, holy crap. Sent chills down my spine.",ky96b8
gluq3yb,"Agreed. I'm definitely really intrigued with where she goes from here as a director, but you're right. This movie was not incredibly cinematic. But being able to direct actors to get these types of performances... well there's definitely something to be said for that.",ky96b8
gl26e05,maybe don’t judge stuff based on the title?,ky96b8
gka80sa,"I encourage you to watch some of the footage of these guys - Malcolm and Ali were like that and dialogue was ripped right from their mouthed, if taken from other parts of their story and transposed onto this night",ky96b8
gjxn208,I'm not alone!!!! I think I just had way too high expectations for this film... so I am partly to blame.,ky96b8
gjhel2w,same here. felt it flowed much better whereas Ma Rainey felt like a stage adaptation,ky96b8
gjncjnj,"Definitely had a low budget, TV show kinda vibe to it. Strong acting from all four leads and great first directing debut by Regina King. I was excited to watch it, but kinda zoned out in a few scenes that didn’t grab my attention. It probably will be nominated for Best Picture this year. But, in a stronger non Covid year, I don’t think it would make the cut.",ky96b8
gjozyvy,"Yeah I noticed this too. It didn’t detract enough for me to think this movie was less than great, but there were parts, especially in the hotel, where it would switch to Malcolm X, the lighting would be fine, and then it would shift darker. Wasnt sure if it was just my screen or TV settings.",ky96b8
gjqolc4,"I noticed this as well - but I watched the film on my phone in a dark room, and every time I would adjust the volume, my phone would brighten the screen while the volume controls were on the screen and then darken it again when the controls disappeared.  At one point the brightness seemed to switch very dramatically for no reason, which made me rewind and replay the scene without adjusting the volume and things seemed okay.",ky96b8
gkg8m0d,They were all in Miami that night together (I'm not sure about Jim brown) but whatever went on in that room no one knows,ky96b8
gjqpnv8,It didn't resonate with you. Not everything will.,ky96b8
gjoy0kf,"What was wrong with the portrayal of Malcolm?  I dont know much about his history other he was cooler than I was taught. 

That and he was the bright spot in the Nation of Islam.  Compared to the others.",ky96b8
gkyhwfd,"These are legends who each have entire wikipedia entries and are all the legends they were portrayed as..

Don't pretend to be like ""who dis""

Edit: yeah there are also books...",ky96b8
gjfrcyi,"Well, one of the oldest ways to approach writing in general is to consider 'what if?' questions. What if a shark terrorized a resort town? What if a kid found an alien in his closet? And so on. The approach here was just a version of that, asking 'what if' four famous/significant Black men met up on this real night (when Ali fought Liston in Miami). What would they have talked about? As for what it accomplishes, I wasn't looking for it to do anything for Black people, just simply that the conversations they have are important to the time period, but also still timely - for civil rights struggles, personal identity conflicts, friendship and loyalty, etc.",ky96b8
gjjlmwu,lmao,ky96b8
gjjahk5,"Jim Brown used to beat up lots of women, maybe that's what they were referring to.

[https://deadspin.com/jim-brown-did-great-things-he-also-beat-woman-1784269329](https://deadspin.com/jim-brown-did-great-things-he-also-beat-woman-1784269329)",ky96b8
gjk6rez,"“Black culture cash grab”... damn those are the perfect words to describe what I saw, I completely agree. Like dude playing keep away with Malcolm camera? Do the people who made this film even understand how much respect Malcolm garnered at that time? He was practically a living walking prophet, it didn’t matter who you were, you could never approach Malcolm like that , he was bigger than life.",ky96b8
gjfy3q6,"If sophisticated projects are not your thing, then just wait for the next Fast & the Furious while others watch this",ky96b8
gkyhc8q,Didn't feel it like that at all,ky96b8
gjjtb4e,"If you believe that was rape after reading the account of that night, then I question your intelligence.",ky96b8
gjhs53z,Wasn’t there some kind of conspiracy suspected? They could play it that way...,ky96b8
gjsdojk,What do you mean real life death? The only eyewitness story we have of Sam Cooke’s death comes from someone who got convicted of murder and prostitution a few years later. Plus her story has tons of inconsistencies and LAPD barely even investigated. I don’t think anyone has a great answer about what happened to him.,ky96b8
gtlywn3,I wasn't aware you needed permission to portray the life of a public figure.,ky96b8
gwwziny,This movie was produced by his old manager... who was the person they suspected of the conspiracy.  That's probably why they didn't even mention his death.,ky96b8
gjfjh98,"Regarding Cooke’s death, it’s likely due to the crazy circumstances around it, but even “Sam Cooke died 10 months later” would have been fine",ky96b8
gkpqsgz,"And Malcolm's Bob Dylan monologue is such a grrat clapback. They kept the tension of thst conversation going for the whole film, powerfully and palpably.",ky96b8
gjk568j,I haven't watched many stage adaptions but Americian son imo was pretty good too.,ky96b8
gjr7smm,It’s not exactly a trigger warning if you don’t tell people what’s in it that might trigger somebody,ky96b8
gjip6k6,"Fucking hell, I just recommended that to someone above before I saw this! What a coincidence, an obscure little two person flick from 100 years ago! :) Amazing.",ky96b8
gjngiof,"I like stage adaptations even if they’re a little static because it give me a chance to see something I wouldn’t have otherwise seen. I thought Ma Rainey’s Black Bottom was great. It definitely had the feeling of being a play on film. Same with American Son. It was excellent. Felt like a play because of the way the dialogue is delivered and how they pretty much never leave one room. Excellent nonetheless. 

One Night In Miami didn’t feel like a play to me. It transcended that and became a movie. Truly great adaptation.",ky96b8
gjp1b3o,"I always thought they got rid of his character way too soon. But then again, better to have died early than stuck around for that weird ass conclusion lol",ky96b8
gk2gijx,I absolutely loved fences.,ky96b8
gpb589q,Denzel and Viola kill it in that movie,ky96b8
gjhtqfp,"You could see Jim brown/aldis hodge expecting it the whole time too, then letting his guard down for a moment to offer to help, then just tired resignation as he walked away",ky96b8
gjsfck8,"The timing was *chef's kiss*

But for real, fuck that guy if he's a real person",ky96b8
gkoxyko,[deleted],ky96b8
gjhnpus,"It's because hes in a different category than Ben Adir, who is in Lead and has much tougher competition this year, while Odom in supporting has a much more varied range of competition he can stand out in",ky96b8
gkysicq,"im assuming that Browns family used to work for that guy? Idk if saying they were his families slaves is to much of a stretch, but it is the south, and that was a old school plantation house...",ky96b8
gkoxrkw,[deleted],ky96b8
gkddrgk,"It reminded me of Cohen and Redmayne going at it in trial of the chicago 7, but way better.",ky96b8
gkxthty,All of the leads were right. That was awesome!,ky96b8
gkdeo3c,">Sam knew that Malcolm was about to get what he wanted from him, but didn't even mention it.

Maybe this is just my take, but that's almost better, like he didn't want to give him the satisfaction.",ky96b8
gmo9uvg,"I'm thinking maybe the Tonight Show performance could actually be a flashback, and what Malcolm watched was a re-run. So maybe Sam had already performed it live, but didn't tell the others. That would make it fit within the timeline of the real history.",ky96b8
gk2f8xo,She also did Riley’s voice on the boondocks!,ky96b8
gk56oo5,She won an Academy Award for If Beale Street Could Talk.,ky96b8
gkvrrt7,"Just a fucking powerhouse. Reminds me a bit of the final shot in Nocturnal Animals, which if you haven’t seen it, is some of the best acting I’ve ever seen. There’s something in the way she emotes without expressing that is so captivating.",ky96b8
gketcoy,I thought he went a tad bit overboard but maybe that's just because I thought Will Smith was so damn perfect as him.,ky96b8
gjpd9hy,Oscars is pretty narrative based so I could see it winning because of that too.,ky96b8
gjfd1kg,"Yes it was the norm, but considering it was Sam Cooke, performing that song for the first, last, and only time, you can see why someone may feel the need to hold onto it. Alas, Twas not to be",ky96b8
gjwta5v,"Which is especially impressive given that they're playing people whose mannerisms are so famous. Malcolm X is one of the most famous American orators of the 20th century and Ben-Adir managed to not only capture his speaking skills but to create a softer, more vulnerable layer of his personality. Well done all around imo",ky96b8
gjqhw57,"Not only does he have a chance to win for acting, he co-wrote an original song so he has a pretty solid chance of winning for that too.",ky96b8
gkapely,Live at Harlem Square is one of the best live albums ever. It’s electric.,ky96b8
gmrtjql,"He doesn’t have the large outbursts, but anytime he talks he carries so much weight behind every word. He’s just a very strong actor",ky96b8
gr8lqny,I was glued to his reactions the entire time. His face said so much in every moment and I was tearing up during his speech about how white people don't see him as a hero but just want a medal for doing the bare minimum.,ky96b8
gjsg6ea,How does that work? Do you have a virtual theatre where you can pick a seat?,ky96b8
gjl4sgu,That’s a really good point. I can definitely see why Ma Raineys was done that way. Instead of the movies compared against each other you could say they compliment in each other in the aspect of the long road that African Americans have traveled. Makes me want to watch both movies back to back!,ky96b8
gjpo5gv,I stand corrected.,ky96b8
gjpo4pg,I stand corrected.,ky96b8
gl38qxl,I absolutely agree with your analysis of this scene.,ky96b8
gjipk8d,You really felt the love and friendship between all four of them in this scene.,ky96b8
