comment_id,comment_body,submission_id
gjsgib2,"Seriously, one of the few songs that can still somehow make me year up, and he nailed his voice perfectly",ky96b8
gjx139c,"That was Odom singing? Damn, I assumed they used a recording of Sam. That's amazing.",ky96b8
gl5jlgm,Yeah I didn't judge anything by the title lmao I watched the movie didn't I? This has been on my radar for a while and I was excited to watch it. I am allowed to criticize a shitty title. Probably could have reached a wider audience if the title was better,ky96b8
gl0nds1,Jim Brown was there too.,ky96b8
gkz7p2g,I was asking about book recs for more details on their relationships w each other lol relax,ky96b8
gjirhvk,"> The approach here was just a version of that, asking 'what if' four famous/significant Black men met up on this real night (when Ali fought Liston in Miami). 

They did really meet up at that hotel, in that room.  All that's fictional is the conversation",ky96b8
gjhbj7p,"This is a good take and thanks for the comment. It was entertaining. Oddly, it kind of reminded me of My Dinner with Andre just more fantasy and exaggeration.",ky96b8
gjr8led,"> Do the people who made this film even understand how much respect Malcolm garnered at that time?

Not necessarily true, according to this article: 

> According to an early [1968 Harris Poll](https://time.com/5042070/donald-trump-martin-luther-king-mlk), the man whose half-century of martyrdom we celebrate this week died with a public disapproval rating of nearly 75 percent, a figure shocking in its own day and still striking even in today’s highly polarized political climate.

Source: [Even Though He Is Revered Today, MLK Was Widely Disliked by the American Public When He Was Killed -  SmithsonianMag.com - April 4, 2018](https://www.smithsonianmag.com/history/why-martin-luther-king-had-75-percent-disapproval-rating-year-he-died-180968664)",ky96b8
gjm1efs,"Yes! That moment was so strange. Like, oh, shiit! When do the yo momma jokes start?!",ky96b8
gjg128w,"That's a rude and condescending reply to that guy's comment.

I agree with the other guy. What is the point of this movie?

I've watched tons of Malcolm X speeches. While the guy's a decent actor, he's not really very close to the real guy. This movie is actually kind of bullshit revisionism that just makes him look like a stick in the mud bigot. It completely twists his words.

He wasn't all 'white people are the devil'. This movie is very short on nuance.

Here's a good interview with Malcolm X shortly before he was murdered.

https://youtu.be/C7IJ7npTYrU",ky96b8
gjh82yw,Santa Jaws was the sleeper hhit of the xmas season and I am so excited that Orcs! Is getting a sequel. What a time to  be alive!,ky96b8
gjiw62h,"i feel like if there every was a biopic about him they wouldnt show that night he got killed, they would probably just show some text about how he was killed yk?",ky96b8
gk1pts7,I think the story the girl gave contradicted itself in some ways and some think she robbed him,ky96b8
gwto7zf,You do if you want the music rights. The Jimi Hendrix biopic with Andre Benjamin couldn’t get the music rights and was a terribly mediocre movie. The Sasha Baron Cohen Queen biopic couldn’t and was never made.,ky96b8
gk19blx,What do you mean?,ky96b8
gjrbd4x,I don't want to spoil it,ky96b8
gjizso3,"I think about it all the time. I mentioned to Max Brooks at a signing how much I dug his mother's performance. Fucking wrecks me.  ""I'd sing all night to keep you alive"".",ky96b8
gjug55r,"Ma Rainey's was an interesting one. Although I did enjoy the theatricality to it, I wish they used more camera movement and some actual focus on staging and blocking, helping the audience give more of a sense of space, when they mostly just used shot-reverse-shots, which just made it feel a lot more bland.",ky96b8
gjnkdfr,Definitely agree this felt much less theatrical than most stage adaptations!,ky96b8
gkddap6,The shot from inside the house as he's just standing in the doorway is incredible.,ky96b8
gka1twz,"Live in the South for any real amount time, that is definitely a real person.",ky96b8
gn5gd5a,"It’s funny cause this is all I could think of throughout the movie. I loved the guys playing Ali, Brown and Cooke but Malcolm just didn’t do it for me cause I watched Denzel in the same role pretty recently.",ky96b8
gnd31ii,"I think Denzel was such a perfect Malcolm that it will be really hard for me to ever see anyone do it better.
But definitely a great take on him.",ky96b8
gm78xm6,I love his performance in this hut I also wonder if the fact he can’t get Oscar nominated for Hamilton a reason why he’s getting such a huge push for this (which I still think is very well deserved but his Aaron burr is out of this world),ky96b8
gnarrhs,"Yeah, Spike Lee's movie is a masterpiece and much better than this movie even though I did like One Night in Miami. To no surprise, Denzel was a much better Malcolm. 

I like this movie's Malcolm in spots, but at times he seemed nerdy, awkward, and stumbling. Not to say they can't show him being flustered, but as someone who watched him talk for hours and hours, he's one of the best speakers ever and had a certain charisma, which Denzel nailed - that wasn't the case here. 

I think Malcolm and Brown should've had flashback scenes like Cooke had during his Boston concert. That would've helped flesh them out. When it comes to Malcolm vs Sam, I think Malcolm was proven right since A Change is Gonna Come was and is a huge hit. He wanted his music to have a message sometimes, he wasn't against him making money.

Fittingly, Spike Lee uses that song as Malcolm is walking to his final sermon.",ky96b8
gojs13o,"When it's just them in the room near the end Sam says to Jim that he hasn't performed it for a crowd yet. 

But that's fine because it""s a movie not a documentary.",ky96b8
gtujgjd,She was both Huey and Riley in Boondocks,ky96b8
gk59jmr,"Yeah, I want to see both that and American Crime.",ky96b8
gkw1nnp,"You might be thinking of a different movie (or just on the wrong thread), Regina isn't in Nocturnal Animals. Incredible movie though, seen it twice.",ky96b8
gjv5wy9,Uhh not too mention Hollywood is already eager to award a movie that is in some way tied to the black lives matter movement of this year. I loved the movie but even if it was half is good Hollywood still throw it some noms. I know its cynical but Hollywood be like that.,ky96b8
gjfdr2d,"Agreed, it may have been mundane at the time but so important in hindsight",ky96b8
gjg0h0x,"Part of the issue is that programs with a popular-music focus were particularly susceptible to being wiped, as they often had limited to no rerun value due to the rules that the AFM had established at that time and also tended to lack the cache that led to some programming without rerun potential being preserved.",ky96b8
gjox6vo,"One also has to remember the time; pop music in the mid-60s was considered disposable , of it's time entertainment.  Before rock and roll hit hard, and the advent of the durable LP made collecting music more widespread, pretty much each generation had their own musical style that was completely abandoned by the next.",ky96b8
gk7cszq,And that song is AMAZING,ky96b8
gjsyhtf,"Yes, you can pick any seat  be it alone or with friends/public or at a living room. Search bigscreen vr on youtube to get an idea.",ky96b8
gjl5cb1,"Haha I have no desire to watch Mama again (too sad, but also cuz Boseman’s scenes are too raw for me; so is his very realistic anger and condemnation of God; that scene was emotionally brutal especially if he knew was terminally ill when doing it). 

But yes, they are great to watch in sequence. But I think something is missing in the middle. A new film a adaptation of Raisin in the Sun which is set in 1959 would be a perfect addition to watch in between these two.",ky96b8
gjjbncs,"Yes, then the 'what if' here is speculating about what they might have spoken about, and how it could have affected them and their friendships.",ky96b8
gjhlqni,"When I first read @nonsupportivecup comment I thought “uh oh, this isn’t going to sit well on this thread” I don’t necessarily agree with your comment but respect the opinion and couldn’t articulate how to respond. Then reading @ladysynth comment it was worded perfectly. Overall, I just wanted to say it’s nice to see two people discuss a topic on reddit without getting angry and throwing jabs (no pun intended)",ky96b8
gjx9hz5,You think MLK and Malcom X were the same person??,ky96b8
gjqpmaw,[deleted],ky96b8
gjh7ejg,"I'm glad you get what I am saying. It was entertaining but just kind of pointless. It doesn't teach people much about the real-life people behind the characterizations. 

It is like The Hangover but with U.S. presidents and Lincoln won't stop being a damn stick in the mud.

100% agree with you on their portrayal of Malcolm X.

Edit: Mostly for other comment readers! I just dont get what building this mythos about already interesting people serves.",ky96b8
gjhjo41,Did you really have to hop on your alternate account to post that?,ky96b8
gk3p39v,"Go look up his death. A lot of question marks, but also could be as simple as 'he was being a dick to the hotel manager'",ky96b8
gk56u84,"Murdered in ""self defense"". Stories don't add up. Only one police report.",ky96b8
gjryhi7,but like...why say trigger warning if you don't specify the trigger,ky96b8
gjktr96,"That movie made me fall in love with Anne Bancroft. She was also incredible in Home For the Holidays, as was RDJ and Holly Hunter. Great movie.",ky96b8
gkog2ts,Agreed! The opening shot should've been one take until they get inside Ma Rainey's tent.,ky96b8
gkw5kwq,"No sorry, I meant Amy Adams’ performance in that movie. In the last shot she seems to melt but without actually moving her expression. I feel like Regina is able to do a similar thing.",ky96b8
glsznol,"I think, Judas and the Black Messiah may have a better shot at winning BP. It just got stellar reviews at Sundance and is about the killing of the Black Panther leader Fred Hampton.",ky96b8
gk2jn4v,"God, no. I was saying that if MLK didn't get that much respect during his time, unlikely that Malcolm X would get that much as well. My fault for not articulating well, but thanks for checking. 

No doubt that both were deeply respected by those who understood what they were fighting for, though.",ky96b8
gky3ue8,"Yeah those other dudes were looking to party, if we wanna get too disbelieved, they wouldn't have wound up in that motel room for long to begin with",ky96b8
gjhq3zq,The hell are you talking about?,ky96b8
gl3yhh5,Highly recommend watching The Two Killings of Sam Cooke. It’s a great documentary that goes into detail on the sketchy circumstances of his death.,ky96b8
gkifb1d,Plus the same woman killed someone else years later and was convicted for it which added more doubt.,ky96b8
gkvrz7c,He was definitely murdered. People who saw the body later said he had been beaten beyond recognition. It’s a really tragic end for an icon of 20th century music that isn’t widely enough known.,ky96b8
gkogeo5,What's the trigger??,ky96b8
gkvtxeg,"Definitely. I meant to say that the reason for his murder is BS and was never looked into beyond 2 ""witnesses"".",ky96b8
gkp3gv7,idk i’ve never seen Night Mother,ky96b8
