comment_id,comment_body,submission_id
go60ab6,"Lots of feelings for me.
She used to be somebody, a member of a community that treated her as an equal. We see her meet the family in the store and realize that she is no longer part of their community. She is someone they have whispered about “are you homeless?” instead of calling on directly to ask how she is. 
She used to work in a place that she was proud of. She used to have a home that she loved and in which she felt at home. Now she is pooping in a van while people knock. She is in constant fear of being told to move on. 
She used to own her space, it was her space. Now she is offered spaces that will never be hers. The only space that she can feel ownership of and be at peace in is nature, and her van. 
If you have ever had the rug pulled out from under you, and you look back on what you used to have, what you used to be, the silent spaces will be completely filled.",lnwuxa
go8rorq,"My favorite scene was when Swankie was telling Fern about all the amazing moments in her life that make her feel fulfilled. Her description was so vivid; she felt so alive. I was afraid she won’t be able to make it to Alaska, and almost cried when Fern saw the video she sent.",lnwuxa
go3bcdz,"I really, really liked it. What a beautiful little film about life, connection, the American struggle and how so many have been left behind/forgetten, and more.

This is my first exposure to a Chloe Zhao film but I will definitley be seeking out *The Rider* now (and hoping she's allowed by Marvel to bring her own flair to *Eternals*). Beautiful cinematography of sweeping landscapes, fantastic score. There may not be much semblance of a plot as we typically know it, but I was enraptured nonetheless.",lnwuxa
go3c963,Did anyone see the shitting into a bucket in IMAX?,lnwuxa
go46b5g,"I wasn’t sure where the story was going and I was waiting for some kind of plot twist but I’m glad that never happened. I teared up a few times during this movie and it left me thinking all night about it. Some of my favorite imagery/directing I’ve ever seen. Some of those places made me really want to travel the country just for the fun of it.

If you told me the lead actor was some random person off the street, I would have believed it. She did an amazing job and made the movie feel so human. It didn’t even feel like a movie is the thing- it felt like watching humans be humans. Watching what poverty and homelessness does to a person and how they cope with it. It never had any moments of “woah I never saw that coming” and I’m totally fine with that. Just human interaction and a look into a world that most people have probably never seen before. 

I give this film a 4.5/5 easy and will be watching it again. Amazing movie",lnwuxa
go6h7nk,[deleted],lnwuxa
go60z6t,"I get that the movie is actually literally repetitive and thus can get boring to watch, but every scene made sense to me and the movie is absolutely meaningful— It’s about Fern learning to cope with the grief of losing her husband and old life, and more broadly it’s about learning to accept loss and still finding meaning and beauty in the vast expanse of the world. Every experience Fern has in the movie allows her to piece together a way forward from the holding pattern that had her completely disconnected from her surroundings. For her, the nomad lifestyle turns from an escape to an embrace of the earth’s small treasures and the transient beauty of the human experience.

Even though it’s like The Florida Project in that it’s about  “poverty”, I would say it’s more focused on the general concept of loss— loss of home, loss of loved ones, loss of meaning, loss of the American dream. It sort of made me think of synecdoche New York, just grounded in a ‘Florida project’ type world.",lnwuxa
gob3q89,I strangely am glad I didn’t get to see this in theaters and instead watched it on Hulu at home. What a perfect setting to watch a movie that makes you rethink the very definition of what it means to have a home.,lnwuxa
go5i8wi,"I've seen people be nominated for Oscars for far less than what Swankie gave us. I mean, even if this were the type of awards juggernaut that sweeps up every nomination it could plausibly get, I still don't think she'd be nominated. But her scene talking about the simple majesties of the natural world is one of my favorite moments on film in the past calendar year. 

It was such a small role but so unbelievably potent, and she stuck with me through the film more than just about any other aspect outside Chloe Zhao's direction.",lnwuxa
gocyjer,"I love the focus on objects in this film and how when you live a minimal lifestyle, the smallest things and the value a person puts into them can mean so much. When her plates that she emphasized early on break, it’s absolutely heartbreaking. The chair that Swankie gives to her is just a chair, but even after Swankie exits the movie, when ever you see that chair you think of her. The lighter she gives the kid and then when she sees him later, that's how she remembers him. 

Because of the value people put into these objects, scenes like Swankie selling her stuff and Fern being unable to sell the van are just heartbreaking. When Swankie sells something to a passerby, she says, ""my grandmother made that, so take good care of it."" This object that has a history and meant the world to one person, is simply just a thing to someone else, until they put their own value to it.",lnwuxa
goeu6xl,"The fact that so much discussion here is about the director possibly being rich and how that would exclude her from telling a truthful story is such a aharp indicator of the level of discussion had in this sub. Very little conversation on the storytelling techniques, blend of docu-narrative, performances by non-actors or elements of light and framing. Just...she's rich and didn't deserve to tell this story. Fuck cancel culture and fuck anyone who comes to this conclusion based on rumors and devalues a beautiful story with TMZ level gossip.",lnwuxa
go5022p,"Fern, quoting her dad: “What’s remembered, lives.” Reveals that her husband Bo didn’t know his parents, nor did they have kids together.

“I may have spent too much of my life remembering.” Hit me like a truck.",lnwuxa
goakpmo,"I didn't like it. It's clearly a good movie, but I found myself more drawn to the directing than anything else.

It almost seemed like a documentary. Using some real life nomads helped, I didn't know that beforehand but it seemed like they were telling stories more than acting.

The visuals are great, the music was good, and Frances McDormand deserves her praise (that scene with the alligator was my favorite of her performance).

But something about the movie seemed off for me, I found the beginning to be very difficult to get through and towards the end I started to appreciate the film, but it just wasn't for me.

Maybe it's my mood, my mindset, or my pandemic brain? It's frustrating watching what you know is good filmmaking in many different ways but just not enjoying it.",lnwuxa
go5dnmk,"JEFF DANIELS: I'm the the star of the greatest sudden on-screen poop scene of all time!

FRANCES McDORMAND: Hold my flute.",lnwuxa
go82aqt,"This film will really affect some and not others. 
 Beautifully done, Frances McDormand was amazing in her immersion in to Fern.  It hits on many different angles: grief, economics, aging, pride, friendships, hardships, and beauty.  It is a peek in to an alternative lifestyle.  Whether forced or voluntary, this film resonates with those in this lifestyle or those seeking options.  There are so many stories that can be told, this was just one.  It doesn't explain a lot, but the film is one of those where you can feel 'in between the lines'.    

I may be biased, I have been there.  Have met a few of the nomads in the film, they are exactly how they appear, good people.  Hit the RTR a few years back, just a group of real people doing the best they can while sharing experiences and helping each other.  I am glad the film touched on this in a positive aspect.  Although nomads often feel alone, there is community out there.  I saw the beauty in this film.",lnwuxa
goaxr5b,"There were several moments in this where I just started crying. It’s a deeply emotional film that feels like it can resonate with damn near anybody, and it does so by really sneaking up on you in very natural ways. When she’s saying bye to her friend Linda and they hug was just UGH. Really loved everything about this movie.",lnwuxa
go2wiyf,[deleted],lnwuxa
gq1re1e,I wish I could have enjoyed it as much as everyone else did but just couldn’t get into it. Couldn’t shake the feeling that with the quasi documentary nature of the film this wasn’t more than a vanity project for Frances with some poverty porn on the side. Very compelling stories that I would have loved to see in a documentary rather than this film.,lnwuxa
go35rpu,"I enjoyed the film.  It kind of reminds me of The Florida Project in the way they tell the story of poverty.  It felt a little slow at the last 3rd, but a beautiful film overall.",lnwuxa
go2tkxx,Just finished it. I have tears in my eyes and I'm not 100% sure why. I didn't want that to end. I could have watched that for the rest of my life.,lnwuxa
gogbi0u,Would anyone be mad if McDormand won her third best actress Oscar for this? Because I wouldn't. She's perfect in everything and she blends in perfectly here.,lnwuxa
gq1v09i,"I was really looking forward to this movie.  I love Francis McDormand.  The movie felt like it was almost a documentary.  I found that having all these real Nomads and their stories in the movie mixed around Frances McDormand's fictional character to be really off-putting.  Like after each shoot, Francis just says ""See you guys later, time to go back to my mansion"".   I just could not get over the fiction mixed in with all the real elements.

Also, I found the movie to be too slow paced and boring.",lnwuxa
gqri3ow,"Wow. It's so interesting reading all of these comments. I don't think very many people got the movie. Some of you see it as poverty glorification. Other seem to see it as just a woman down-on-her-luck by economic disaster, who finds peace by letting go of the past, through the storytelling lens of homelessness in American landscapes. But I didn't see any of that. 

I saw a story of a woman finding happiness. Its a feminist anthem. I saw a woman who has always been capable, independent and comfortable in her situation, no matter the situation, as long as it was a ""choice"" she actively made for herself. Its about freedom. She's always lived her life away from the traditional, ""rational"" choices. 

She left her happy family young and somewhat spontaneously got married, moved to a middle of nowhere town and lived out the majority of her life there, with seemingly few complaints. She wasnt starstruck in love, because that's not how most relationships work, and she's not that kind of person. She prides herself on self-sufficiency and likes to keep things simple - no drama, if you will. She made a choice to leave home and be this other person in Nevada. 

Then Beau died, and that wasn't her choice, and was the first thing she couldn't control. 

Her solution to dealing with that was to simply stick it out and try to maintain her life as best she could. 

But then the town and economy went under and that was also not her choice. The world around her kept taking away her freedoms, and her ability to be self-sufficient. 

And since she's always been a survivor that likes to get by on her own independence, she felt like her only option was vanlife. Which, at first, wasnt a choice to her (at least not consciously). She thought it was thrust upon her, that she was a pure victim in its decision. 

But as the story reveals, vanlife WAS a conscious choice she made. 

She was a victim of some things, sure, we all are, but living in a van was NOT one of them. 

She did have friends and family to lean on. But going to them would be choosing against self sufficiency, independence and freedom. So, she doesnt consider those options as realistic. She even had a potential love interest (a rich hot guy too, might I add!!) to make a life with, and a home on the pac nw coast to maybe grow old in. But she also turned that down. She was also relatively healthy, young and educated with a good work ethic and could easily get a job and rent an apartment somewhere else. But she never even considered those options. 

She DID choose vanlife. 

And for some reason, accepting this reality, seems to offend everyone. 

If you think she's a victim of economic evils, you're happy to tell the sad narrative of the aging nomads as a FU to capitalists. If you think she's an aging hippy or slack jaw yokel making bad decisions, you're happy to accept her choices as fleeting ""alternative lifestyles"" or bad choices that uneducated people ""make"". 

But really, she's just a woman doing her own thing. And guess what? It does not need a justification. 

The ask for it to be justified by her family, old friends, society, movie goers, etc is the very problem and the thing that takes her sense of freedom away. And the very point that the movie is making. Stop asking so hard for a REASON as it devalues her choices and makes her happiness seem questionable. 

People are trying so hard to politicize her choices, they're forgetting that its a movie about a person, not a situation. 

And to be clear, this expectation of who she COULD be and what she SHOULD do is what led her to think she was unhappy for portion of the film. Even she didn't realize her happiness was already available to her until she had the opportunity to make a CONCIOUS choice to vanlife, confidently. In other words, her situation never changed throughout the whole movie, but her perception did as her confidence of her choices to live this way changed. 

Yes, letting go of her past memories is part of this, but even without that whole plot point, her real catharsis moment was walking away from the free guest house and choosing the van and solo life. 

The film is consistent in showing this narrative. 

Its about being a woman that is happy being alone, as aloneness isnt loneliness. And peaceful aloneness isnt only acceptable for men living out their ""Into The Wild"" dreams of adventure and romanticism. As society makes it okay for men to make these choices. The movie even showed this as none of the male characters had conversations justifying their homelessness, but all the main female characters did in one way or another.

My other favorite depiction of this truth is Sparky. Sparky told a lovely story of her happiness as adventures in nature she experienced in solitude. She didn't go on and on about how you need partners, droves of friends, children, etc, or how she missed out on these things, or how she was rushing back to those things in her final moments. No, she talked about flying with birds while kayaking in Alaska and seeing a moose alongside the road. She and Fern were both the same. 

And that's okay. That's the moral of the story.",lnwuxa
go4fry8,I liked the first half and was into it until I realized it was just doing the same loop over and over again with different locations. Then it just became too samey and started to lose me. Like they got the point across I feel like pretty early then didn’t really know what else to do for the rest of the movie so they just repeated themselves to fill the runtime. It wasn’t bad but after all the awards and hype I just expected it to be better. But I seem to be in the minority so maybe I just missed something,lnwuxa
gobad6e,"Great film, very beautiful and very human. Felt like a documentary at times. I would have preferred a more robust score or soundtrack, though maybe that would have altered the mood too much.

One thing, is this movie rated R solely for the brief nude swimming scene? Apart from that and a few mild swears, I feel like this could be a PG movie.",lnwuxa
go3b5bf,Fern(s) can g(r)o(w) anywhere.,lnwuxa
godxv8l,"I watched this last night and it's been on my mind all day. I almost feel a little obsessed with it. Just absolutely mesmerizing and human and relatable. I guess personally it speaks to me because I feel like I am at a similar point in my life and I am so like her. I just love this movie more than I can even say. Wow! Also, stunning scenery, I do love the desert landscape. Frances McDormand was wonderful.",lnwuxa
go4owwg,Overall solid but it really drags in the second half,lnwuxa
go2tjl8,"I’ve seen this movie 5 times and I’m still fascinated by its frank, honest, realistic look into life. Beautifully shot, directed and acted - this movie is definitely one of the best I’ve ever seen.",lnwuxa
go77l9y,Just finished it on Hulu and thought it was absolutely gorgeous. An instant classic.,lnwuxa
goajyk0,"Couldn't disagree more with takes on this film as romanticising poverty. It is an optimistic film and beautiful in that regard, but I don't think it shies away from many of the difficulties that Fern and the other nomads face in their 'houseless' situation. Sure their predicament doesn't reflect and represent everyone, but in the specific stories it chooses I think it was perfectly executed. I really, really hope this wins Best Picture - especially considering its main contender *Trial of the Chicago 7* which actually does romanticise/Sorkinize history to a dangerous extent.",lnwuxa
go2txly,"A wildly beautiful movie. The shot of Frances walking along the big nomad gathering for the first time, sunset in the background and the simple score with just a piano and a violin (maybe a cello?) really summarizes this movie to me. Simple, beautiful, poignant, and real.

As someone who has considered van life, not due to hardships but more for the seasonal travel, I thought this movie really did a great job of showing us the pros and cons of such a life without wallowing in any sort of pity. Never really a moment where Fern was doomed or without resources. She struggled but was never threatened or left without the ability to go on. I thought that was nice, to not make this about one extremely sad story but more about the idea of nomadic people in modern day society as a whole. This movie is about Fern, but through her we see so many more stories. Some about people who wanted the freedom, some about people who were forced into a more economic lifestyle, some who didn't want to spend their lives punching a clock. 

We see Fern's ability to live this life in everything she does. How easily she walks away from the dog and from every opportunity to put down roots, how proud she is of her van which she always personifies. This movie becomes less about an economic recession and more about a way of life that is in no way lacking or unproud, despite how the rest of society sees it. And yet, we are constantly reminded that it is an economic depression that put some people in this lifestyle. We see how seasonal workers move across the country looking for gigs, Amazon paying for trailer park spots for them and in a way acknowledging that they aren't paying someone enough to live ""The American dream"". 

It's both a sad and beautiful film. But it's not sad in the sense that it feels hopeless or pathetic. It's sad in a sense that these people have to give up so much for their freedom. Their life seems almost envious to us as we watch them travel and see the sights and be fully independent, yet the movie shows us the small sacrifices like not being able to eat dinner and be vulnerable without someone walking up and peering in your window or having the luxury of starting a family. 

This is an easy 8/10. The music, the visuals, the acting, the very real people telling their real stories. This movie will live rent free in my mind for quite some time.",lnwuxa
goakgi0,"I highly recommend anyone who isn't aware of Zhao's work and is going into this under the presumption of the Reddit hive mind, check out her previous work *Songs My Brothers Taught Me* and *The Rider*. This is her style, she likes to focus on the smaller details, smaller communities, the little things in life. What she tries to do is not romanticise them, she finds the beauty within them while also acknowledging the struggles they may face honestly.",lnwuxa
go7fjqb,"No matter how much I like SF and big ideas in my movies something like this I’ll be happy to watch all day and would hope to see the 5 hour cut one day. 

Seeing behind the scenes footage they use a lot of non-actors in the scenes including some well known people in the community. I think this set the tone for the movie and forced the actors to *act less and be more*. 

I also need to give credit to the director. I usually expect movies like this to be more Robert Altman slice of life with introductions where the actors shine and a lot of heavy handed directing even though it’s meant to be a low key movie but you can’t get away from the director’s auteur. 

Another movie that champions this style is *The Assistant*.",lnwuxa
goi1m6y," 

>Makenzie: ""My mom says that you’re homeless. Is that true?""  
Fern: ""No, I’m not homeless. I’m just houseless. Not the same thing, right?""  
Makenzie: ""No.""

*Nomadland* is a surprisingly balanced look at the van living, nomadic life within America. It is hauntingly beautiful, beguiling and poetic while not sugar coating a difficult lifestyle.

Frances McDormand has become a legend. From her debut in *Blood Simple* to her iconic role in *Fargo* to her latest gritty, down-to-earth performance in *Nomadland*, she disappears into her roles like a perfectly fit glove.

*Nomadland* is comprised mostly of actual American nomads. If it wasn't for her star factor, McDormand could be mistaken for her real-life counterparts. She is mesmerizing in a few scenes where she flits around in gorgeous natural settings like an eight year old beholding these views for the first time.

The third act is a bit jarring tonally as it shifts towards scenes of a ""normal"" suburban life, which I'm not sure were necessary, but thankfully it was short.

Another fascinating real-life character is Bob Wells who apparently is the face of this lifestyle. While not an actor, he is so charismatic and authentic. I plan to check [his story out next.](https://www.pbs.org/independentlens/videos/how-bob-wells-lives-his-best-life-in-a-van-american-nomads-ep-1/)",lnwuxa
go3h29x,"I really wanted to love this movie but I think I was hoping much more for a movie about community, like the vibe the trailers give off, and this movie is actually much more focused on the self. It reminded me of ""A Ghost Story"" in a lot of ways, at least thematically. That said, I think this movie will resonate with a lot of people.",lnwuxa
goc9jfp,"Something that was jarring was the realism of the other characters that are non-actors compared to Frances who, no matter how talented, looked as though she was acting.

Edit: most of what I watch is documentaries and everyone, except the professional actors, spoke and moved like a documentary.",lnwuxa
goazis7,Frances is just so great.,lnwuxa
gohrk0w,"Frances Mcdormand is amazing. Her charm when she runs into the canyon or how she celebrates new years eve. Finding little joys in things and learning to  become part of a tribe. 

Swankie with her explanation of her accomplishments was a revelation. Loved her character and how she really lived in those moments. My heart cried when she finally made it back to kayaking with swallows nest. 

This movie keeps wanting you more of it. Felt like you are on a fleeting journey too. This was my first Chloe Zhao movie and now I am going to watch The Rider. Hope the movie gets all the attention it deserves.",lnwuxa
gqsbit2,"I was earnestly surprised to see the criticism on here. I thought it was a beautiful thought provoking movie that made me think and feel a multitude of emotions through its journey. I just dont agree with the criticisms of this movie at all, although I can kind understand it. It is maybe a little long/slow towards the end but I think that chloe zhao wanted to really drive the point home on the b plot of the movie if you will. (which was ferns turmoil of nomadic life versus normal life). I didn't feel like it was poverty porn at all. Maybe it wasn't in your face this is absolutely horrible lifestyle but its pretty clear that this isn't a great lifestyle. I dont agree that it would've been better as a documentary, I feel like then it would've definitely been poverty porn. There's no conflict? Its a movie about the journey of loss. Its reflective, therapeutic. I think its supposed to be an ""empty"" movie to really exemplify the nomadic lifestyle these people live. Same for not being too ""invested"" in the side characters (although I was). Its a movie about nomads, they really just form summer camp esque relationships where they drift in and out of each others lives but intensity of the relationship in those moments are heightened due to their circumstances. Yea some of these relationships dont get closure, some of these relationships are incomplete, most dont get a happy ending but that's life right? People drift in and out of your life but you still cherish the time you had with them.",lnwuxa
go396nt,Nomadland was somehow sent from a reality where Terrence Malick directed Into The Wild. Nobody can convince me otherwise.,lnwuxa
go2xk58,"Curious to see what people think of the Amazon aspect - the film mentions that the company pays quite well IIRC (been a few months since I've seen it), which clashes a bit with how thoroughly badly they treat their employees in reality.",lnwuxa
