comment_id,comment_body,submission_id
gvyqtha,"I had such a hard time watching this. Matter of fact, it's one of the only movies ever that I just couldn't finish. It feels pointless, meaningless, shallow, empty and just... why ? What's the point ? What is it trying to do ? Who is this movie for ? Was there a need for this movie ? 

I have rarely felt so little connection to a movie and its ""characters"" (yeah most of the ""actors"" are just real life people that were kinda tricked into playing in this from what I've seen), I was just genuinely bored and I didn't care about any of it. McDormand is great as usual but this movie just doesn't go anywhere, and doesn't say anything. 

It's.... just not good, I am genuinely shocked it won Best Picture. I do have to say that the sound engineering and the soundtrack are pretty great.",lnwuxa
gw0qqgv,"I’m really surprised to see a lot of the new comments on this movie’s
win. I decided to watch it and was completely blown away. 

I don’t agree with the ‘nothing happening’ aspect, nor the ‘romanticization’ aspect of the story. Although the blows of living a harsh reality were softened, it was because we started watching the movie while already accepting this reality. The people in this movie already made peace with their lifestyle regardless of reason. 

But this movie showed the beauty of healing while going through the grieving process, and learning to move on. It was exceptionally done.",lnwuxa
go50ong,"When did the movie start? I kept waiting for the movie to start and McDormand would have a random conversation with a random person.

This is /r/iamverysmart the movie. It makes the viewers feel smart that they got when there really isnt much to get.",lnwuxa
go4vgod,"I really wanted to love this film, but I was quite disappointed.  Nomadland seemed to want to say something profound, but it’s message was muddled.  It lacked focus.  

Was Fern on the road because she was poor?  I don’t think so.  She had an incredible work ethic and she would have been able to afford a modest apartment in another Podunk town if she wanted to settle down.  

Was Fern on the road because she had mental illness or was suffering from PTSD after her husband died prematurely and they lost their home?  Maybe, but that was only hinted at, and if that was her plight, it was lost among the preachy sermons about economics and politics.  

Was Fern on the road because she was drawn to the freedom of living unshackled by a house and    a 2 car garage?  Maybe?  

Obviously, people and characters in movies are multi-faceted, but a well written character, in a character-study film, should have a “spine” or central thread that moves the narrative forward.  Otherwise, you end up with just a series of random scenes following a person moving through different situations with no clear purpose or narrative arc...

Did Fern triumph over something?  It seemed so, but what did she triumph over?  Poverty?  Mental illness?  Shyness?  Loneliness?  Amazon?  Grief?  Trump?  Capitalism?  Society?  All of the above?  It was too muddled to know for sure.",lnwuxa
gocvkmg,"NOMANDLAND is an underwhelming and listless film set in a world that would have been better served as a documentary instead of this hybrid docu drama. The film's thinly drawn characters suffer too from the lack of motivation, story and plot

Frances McDormand is a fine actor, but we get very little about her character or motivation to live in a van as a nomad.  As the New Yorker review points out....

*""Fern and David also tend to speak in one-liners, or, like the other characters, offer brief (albeit poignant, pain-filled) anecdotes that hit the motivic nail on the head and drive it quickly into its place in the script, explaining with little give or detail what traumas or difficulties spurred them to choose the nomadic life.""*

Also, the film offers a Pollyannaish view of homelessness that is now typical of Hollywood. We don't meet a single ""houseless"" person who has issues with alcoholism, addiction or mental illness. There is no chaos here. We see no crime of any kind. Everyone is just a poor victim of capitalism. All it took was one bad break and now they're living in their vans and cars. 

The cinematography was quite good, as was the film's score. But there isn't enough here in terms of story, character or depth for me to recommend NOMADLAND.",lnwuxa
go9m0b0,I know this movie has so much hype and Oscar buzz. I couldn’t get into and was pretty bored throughout. I found myself checking the clock a lot. Even coming here I was expecting there to be more dissenters but it seems like I’m in the minority.,lnwuxa
go34kej,[deleted],lnwuxa
go5pcet,Couldn’t get through it. Bored.,lnwuxa
go8j7bo,[deleted],lnwuxa
godt1pp,"Something that I found incredibly fascinating about this movie is that it is based not just on a book, but a nonfiction book that's all about Van Dwelling. Frances McDormand came up with the character of Fern so they could have more of a narrative. 

Nomadland is an incredible film. I've become very leery of poverty porn material since it can feel so disingenuous and judgment but this is so not that. It's human beings as their most realistic as they all come together to survive. I so love that many of the Van Dwellers reappear within the narrative like the guy she gave the lighter to. I really teared up with the scenes about Swankee and Bob Wells. Even though no a whole lot happens within the movie, I was so compelled in the lifestyle that Fern had to adjust herself too.

This was such a perfect role for Frances McDormand. Like not everyone can just walk through a field, casually talking to people and make that feel real but she just 100% nails this character. She knows her life can't be the same after her husband has died and although she's happy to be with a community that understands her, they are not always there. Her crushing sense of loneliness is captured so perfectly like when she walks through some of the quiet towns at nice or even being in that arcade she had to work for. 

Joshua James Richards who did the cinematography also deserves so much fucking credit for capturing every aspect of America. It's fucked up, it's individualistic, it's a structure but it's also fucking beautiful in the way we can be with people and nature. 

It's definitely my favorite non-documentary film of the year and the movie I really hope that takes the Best Picture Oscar.",lnwuxa
go3ijzl,Nomadland is a great movie.  At first I thought it wasn’t going to as good as The Rider but it improved greatly after the first half hour.  I agree with the NYT review that David Strathairn character wasn’t needed and they should have stuck with the amateurs who were way more interesting.  Zhao’s boyfriend cinematographer has sure improved his work in the three movies they have done together.  I hope she wins four Oscars for Nomadland and he wins one.,lnwuxa
go2zvv8,Chloé Zhao has made a stunningly beautiful movie. Super excited to see what she brings to Eternals.,lnwuxa
grghjez,"The ultimate cinema sin... it was boring. Painfully so. Why anyone felt invested in any of this, idk? Maybe it’s me. I’m starting to not enjoy newer films anymore.",lnwuxa
go49oq0,This felt like a documentary turned into a movie. I’ve been to the Badlands etc. and it’s just as breathtaking in film. But that’s really that. The scenery. Good movie but not jaw dropping at all. A “film auteur” would love this movie though.,lnwuxa
go64ehn,"I overall landed in the positive end, but I wanted to love it so bad and just mildly liked it. It setup was very well done and the it did very well getting me on board but I feel as if it didn’t really go anywhere with the concept. I just didn’t feel what everyone else is praising it for. 

I sensed the realism with the scenes of the non actors but I don’t think Frances Mcdormand really blended in. She was great, but it felt like Frances Mcdormand and a bunch of non-actors and not fern and the nomads.

I see why people love it, and I appreciate some aspects. It just didn’t connect overall.

6/10",lnwuxa
gokt5u4,"Feels like if Into the Wild had a baby with Terrance Malick...but with nothing that makes either of those great. 

Not to say I hated it or anything but it didn’t feel like it had heart. It *watched* people who had heart and occasionally gave glimpses into the multitudes of people who are trying to find happiness in the world and photographed excessively beautiful places at the golden hour but...it felt empty. 

Like, it felt like it never gave a real thought to anyone except maybe Swankie. The rest just said a couple of lines of dialogue and Frances McDormand would give a small side smile or a wave and the scene would end. Either that or the camera would just wistfully follow along while they told Frances McDormand to go stand next to something or some backdrop and just think a little bit and hopefully the audience fills in the gaps of the enigma of this nomad. 

I feel like it would’ve been better to just delete Frances McDormand entirely from the whole movie and just do a documentary. Cause the movie felt...at war with itself? Like kept trying to make an inherently sad premise really romantic and like it’s something to...look up to? But she seemed resigned to a lonely life. 

And you can say “well you can lead the same lonely life living in the modern hustle and bustle” but this felt like she was running from it all but couldn’t escape that feeling. And it never really dealt with or did anything much with that central conflict. 

But I really didn’t care for how sparse it felt on content. Anytime someone would talk (besides maybe that one scene with David), it felt like it started the 7 second countdown for when it’ll cut away before anything could be absorbed. You can say it was being unconventional and challenging but I’d posit that it’s the exact opposite. It made it feel dry and afraid to *be* challenging. Just blurt out a few sentences that are vaguely uplifting or really precisely sad and do nothing with it and then move on. 

I feel like it was trying to hit the mark of trying to be a celebration of the tiny inbetween moments of life that Roma was, but instead of making everything feel grand and majestic, it felt small and empty. 

And not that it was ever unimpressive visually or anything but it almost felt understated in its camerawork. Almost like it took the awe out of the locations and made it seem pedestrian. And that tilt up when she tosses the rock in the fire for Swanky felt so abrupt and uneven. 

I don’t know. I wouldn’t say I hated it and it certainly was very different than most things made ever. So that’s commendable. But I came away from it feeling cold. And the last few scenes all felt like they were designed to be the ending shot but it would just keep going. 

The awkward tilt up for Swanky. 

The storage place. 

Wandering in the factory place. 

Wandering in he home and backyard. 

Then finally on the road. 

Like, it doesn’t feel right when you keep thinking it’s gonna end and take it all in and then it keeps going repeatedly. 

I don’t know. I was underwhelmed and would’ve been happier with a documentary instead of a pseudo documentary that would keep cutting away from the real life perspectives to Frances McDormand doing a tiny smile or a wave or a wandering shot. Or even just do mostly the same movie but from Swanky’s perspective since she was really the heart of the movie. 

Also, not that it matters much but Tumbling Tumbleweeds had to have been intentional reference right? You can’t just put the opening song of The Big Lebowski in a movie starring the wife of The Big Lebowski’s director and call it a coincidence. Right? 

Yeah I don’t know. 5/10. I love Frances McDormand but I really hope this doesn’t win best actress. Not when there’s been such overwhelmingly strong and utterly fearless performances this year.",lnwuxa
gofn2zm,"All across this country there are people who have lived and worked in company towns. The town exists because the company is there. And when the company leaves, there is no work. People in Fern’s town had to move, and it seems like she is one of the last to go. Except the guy who owns or runs the storage units. My parents and grandparents lived in a town like that. Of my entire extended family, I think only three people are left there.",lnwuxa
gofnjdk,"Once Fern has revisited the plant, and the house she shared with her husband, and all the stuff she saved and realized she didnt need, I wonder where she was headed next. She was in her van but was weighted down with memories. Could she have let go of her old life and baggage to go find Dave again? To go see Alaska like her friend? 

Personally, I cannot imagine revisiting a house I had lived in, and finding it empty, abandoned since I had lived there. Every apartment and home was rented or sold to others after I moved out.",lnwuxa
gosmwu7,Would the Academy dare given FM a third win before Meryl?,lnwuxa
gp4dlpm,"Wow. This is a movie you just want to talk about. It's not perfect by any stretch of the imagination, but it does things that have never been done before, and is so worth watching. For those that have seen it, Swankie deserves a Best Supporting Actress nom on the strength of her short monologue about her most memorable experiences of a life on the road—don't you agree? Beautiful movie.",lnwuxa
gp9fnyh,"Just finished and wow. I hadn't read any of the hype or chatter about the film, just the occasional trailer on whatever program I was watching. The landscape. The shots. The acting( non-acting?). I was completely captivated. Thoroughly enjoyed how nature was a supporting character throughout the film. The scene that got me was at the end, going back to her old house, after we have learned that she basically stayed their for Bo. When she begins to walk up to her sink and in the distance you can see the mountains. The house felt like an enclosure keeping her trapped from what she desired. And then you see her go to the backyard and walk through the opening of the fence. Just a beautifully shot film.",lnwuxa
gp9o0so,"Chiming in late....came here to read what others thought of the movie after Golden Globes tonight. Well deserved win IMO! 

This movie choked me up and made me ugly cry! I felt Fern was loneliest during the scenes where she was at Daves’s family’s home. The idea of being loved and being part of a family was too much for her to bear. Same when she was at her sister’s home. Grief can have such an impact and sometimes it leaves you afraid of accepting love again for fear you’ll have to bear another heartbreaking loss. 

Also loved the Swankie storyline and hearing her tales of travel and nature, so beautiful. When they all started pitching rocks into the fire I couldn’t catch my breath from sobbing. It was cathartic in the best way!",lnwuxa
gqiyz5j,"Something about it made both my fiancé and me not want to peel our eyes away. So real, so touching. Thoughtful. The music was just spot on some of the best this year.",lnwuxa
gqvsf2m,"This movie was amazing. I went through a period for 2 years where I was just bombarded with ""van life"" Youtubers and subscribed to them to see their rig and of course most of the time, they were done after about 3 months. But it was a whole big thing for a while, maybe still is... but I remember seeing tutorials done by a man that looked like Santa Claus, maybe the same man asked to do the part again or an actor that can do a good impression of this Youtuber. Anyway, it felt very contemporary even though it was set during the recession over a decade ago. I didn't feel any connection to it being 2008/09 other than blatantly mentioning it twice during the movie, and the absence of iPhones and iPads for which as ""nomads"", she certainly wouldn't have cared either way due to her age. She did at one point  have a home screen on her phone(android I'm guessing?) that gave her the message about the woman(btw deserves a Best Supporting Actress nomination but she probably wont get it cause she's not super famous) dying of brain cancer.

I noticed a lot of big instrumental music large beautiful backgrounds and then a very obvious cut to the super quiet next scene that in film studies is basically non-diegetic to diegetic sound with additionally abrupt jump cut which was obviously an intentional choices made by the director. If she had a Q&A today, I would like to ask her about those choices because they are obviously choices. Doesn't make me hate the film, it just makes me wonder what was going through her head. I guess the disruption and disconnection was a running theme for the film itself but that's just my opinion.

I'm glad not to see so many big stars as it could have been too distracting, you see Joseph Gordon Levitt but he's almost in a cameo role and I'm sure with his pull, he could have asked for something bigger but chose to be small but memorable in the role. I did look at Frances and think, omg she still has that cute ""midwestern"" accent that's obviously not going to be Fargo but I see glimpses of a very cute midwestern cold accent pop in from time to time since she's not playing a city girl.... doncha you know ;)

I was almost thinking when she was working for Amazon(which is why I thought this was more contemporary) she wasn't exactly treated like crap or anything, the employees and the supervisors are shown as pretty optimistic and decent. Maybe that's to suggest that over time, it got worse.

EDIT: I wanted to add to the ""I didn't see how it was 2008....."" well the Razr phone was a good hint it was from an earlier time period but I still see old people with older flip phones.... my dad literally had one up until 2020 and then he finally ""upgraded"" to iPhone 6 Plus

EDIT 2: Okay it is that dude from CheapRVLiving channel on Youtube.... I knew I recognized him! Super cool that he's in a big critically acclaimed film even if in short scenes.",lnwuxa
grmnieu,"Felt boring to me, somewhat predictable and between the line of a documentary and a indie movie",lnwuxa
grqiegk,"It was OK. 

I definitely don't understand what the fuzz is all about. It isn't groundbreaking or original and while Frances McDormand's acting is superb, the plot itself isn't amazing nor is her character memorable.

Judas and the Black Messiah, Promising Young Woman, and Minari are definitely in my top 3 when it comes to Oscar nominated films (haven't watched The Father yet tho).",lnwuxa
gsl3a9j,"I’m on the fence with this movie. I thought it was very poignant. I also found it to be a slog in places. But worst of all, I’ve read that some of the real nomads they have in the movie were never made aware of who Frances McDormand was. They thought her name was Fern, and that she was trying to find her place amidst the grief of her (fictional) dead husband. The man at the end that opens up about his dead son does so to try to comfort this woman whom he thinks is actually grieving. I found that to be extremely exploitative, and I feel so sorry that he was manipulated into opening up about something he doesn’t normally like to talk about — all for a movie.",lnwuxa
gvbyjcn,"I feel like the odd man out with all the reviews and accolades during award season but I wasn't that impressed with this film to the point I'll be disappointed when it inevitably wins best picture. Really hoping for an upset this year.

One thing I didn't like was the Amazon scene. Not how everyone else is commenting about it but just the blatant product placement was distracting an unnecessary. The same vibe could have been given if it was a fictional warehouse. Someone on Twitter tried to make a point and compare it to how Cassie from Promising Young Woman works at the coffee shop throughout the movie but they kind of made an argument against the point they were trying to make. She didn't work at a Starbucks or any chain. The name of the coffee shop had no impact on the movie and didn't distract from the meaning of the movie like Amazon is for this one (the multiple articles and controversy online.) Some people even got a positive feeling about working at Amazon because she enjoyed it, said it paid well and looked really clean and organized (but totally misses the fact she still doesn't get paid enough to pay for the parking spot but whatever.)

I do feel like this would have been better in theaters. Maybe it had an unfair disadvantage there. The scenery was beautiful and I kept thinking how lucky Francis was to be able to film in those locations even if the movie was a complete bomb. I feel like the supporting characters outshoned Francis who didn't feel as authentic as them (which is hard to do when they're actually authentic) but for that reason, I'm hoping she doesn't win best actress. I'll be watching Ma Rainey's this week and I'm excited to see Viola Davis crush the role but I thought Carey Mulligan is also already a step over Francis.

Overall, it was OK. It made me want to explore out west and the universal grief message was somehow comforting. I'll definitely check out the book.",lnwuxa
gvubqta,"So from what I understand about this, almost everyone in this was playing themselves, most lines were unscripted, and people weren't acting, they were just being themselves, with a few actors delivering lines and playing roles to fill out the plot of this movie. There weren't cuts, or non-actors running through the same scene again, they just rolled with it.

Does that mean that this movie is sad Borat?",lnwuxa
gwfrtsa,Movie was super boring with not much story. Plus it made actual nomads look like a joke. 3/10,lnwuxa
gxoe3ij,I enjoyed it but thought Fern was the most boring part of the whole movie.,lnwuxa
go2vj8h,"Finally watched Nomadland and absolutely loved every minute of it. Just finally ended up watching The Rider. Can’t believe this is only Zhao’s 3rd full film. She’s such a brilliant director because she makes everything feel so honest and it’s almost poetic without ever feeling pretentious. Frances Mcdormand can do anything and hope her, and Chloe Zhao win academy awards this year.",lnwuxa
go36nk5,"Beautiful cinematography, great acting and a well of emotions. Frances’s mannerisms were amazing. Can’t describe how I feel at the moment but it made me quite emotional while watching. One of my favorite films in a while.

It really left quite an impression on me and I hope it did the same for others. From tears and despair to high optimism and looking forward to the rest of it.

I’ll see you down the road...",lnwuxa
go3ckwy,"I loved it, and I’m sure I’ll watch it again and enjoy it again. But The Rider is still the superior film. This felt like the spiritual follow-up to The Rider but less interesting, with less of a plot, lower stakes, but an A-list Oscar-winner to give it more buzz.",lnwuxa
go2ug3o,I noticed that there is a scene in the beginning where Frances McDormand has to show her real I.D. and break character for a scene with a real clerk at an RV Park. It became a subtle reminder of the challenges they faced while filming this masterpiece and the realism that the film surrounds itself within. Absolutely genius.,lnwuxa
go8r5e8,[deleted],lnwuxa
go5epk6,"Honestly, it’s a very beautiful film that I think gets a little too repetitive. The soundtrack and visuals are stunning, and Frances McDormand is fantastic, but I just feel like it would’ve worked better as a short film. 

I cannot wait to see what Chloé Zhao does with Eternals, though.

Edit: maybe not a short film but I definitely feel at least 15 minutes could have been cut",lnwuxa
go5q9zz,[deleted],lnwuxa
go3qhbu,"Its the most 2020 movie that ever 2020'd. Frances is a queen, she's so good. might've benefited from being 15-25 mins shorter.",lnwuxa
gvuuyf9,Great cinematography with zero substance. Planet Earth for best picture?,lnwuxa
gvxnr0z,"This movie genuinely sucks. I thought people saying this was an Oscar favorite was a sarcastic joke. I'm usually a movie snob and would think to myself ""these people don't get it"" to highly praised films that sometimes land weird to the general population. This is not one of them. 

I never fell for the characters, the storyline was barely existent, and logistical errors everywhere (with working full-time or ss benefits). I don't understand McDormands character fleeing at the end. Are we supposed to gather that these are institutionalized people that can't live outside the van life? Bc she denied an escape from a shitty situation which I thought was supposed to be tugging at our heart strings. 

Whatever I don't really care. I won't be watching this one again",lnwuxa
go4qcnd,"Beautiful film. I liked the documentary style of it. The characters all felt very authentic. 

My only criticism is it went on too long. Every time I thought it was ending, it wasn't.

Any idea what Fern was thinking when she ran away from the tour group and immediately got lost among the rocks? I don't know what they were trying to convey with that scene.",lnwuxa
goay1gk,"Horribly boring piece of shit movie. Waste of time. Wow. Amazed this garbage was so hyped and picked up by Hulu. Fuck this movie. I’ve seriously seen Lifetime and Hallmark movies that deserve awards over this boring, horrible film.",lnwuxa
go3sk9q,"Lovely film. beautifully shot, well-acted, and incredibly human.  It reminded me a lot of Leave No Trace (2018), both in its visuals and its themes. I highly recommend both.",lnwuxa
