comment_id,comment_body,submission_id
go685s9,Her dad abandoned her mother and her to a barely middle class life. He eventually felt guilty and paid for her very expensive foreign schools.  There is no indication that she got much from him after that.   This myth that she is rich is total crap.,lnwuxa
goyfdw9,"You're focusing on all the wrong things in nomadland.... The movie isn't meant to be some exploration of poverty or economic hardship. That is more catalyst than anything else. You're judging it for something it's not trying to be. 


This is a much more subtle look at some pieces of the human condition. Relationships, grief, acceptance, regret, life, death, contentment. A lot of what you complain about is touched upon through the conversations she has, but it's never spelled out for you and shoved in your face - because it rarely ever is in real life. We all take bits and pieces of our experiences to try and make sense of our world and bring joy to ourselves.


Florida project is a great movie too but comparing that to this is like comparing every movie set in space or every movie set in prison. Movies can have similar settings without trying to do the same thing.",lnwuxa
go4kzmv,Yeah I feel like a lot of people missed the whole plot of the movie.,lnwuxa
go4p4lu,"How was it lonely as hell? She literally tripped over people and events. They spent more time on her on weird dates and social gatherings than on the numbness of working alone from a van. 

We get one scene of her wearing a New Years crown that’s ruined by her rolling around in a golf cart, eating supper with her mans (literally several different times) and visiting her family (with the most hamfisted-ass social commentary dialogue ever)

This movie just rubs in your face “SHES SAD SHES LONELY” while never actually SHOWING us that. 

The main character from Submarine was more lonely. Pattinson in Good Time, was more lonely. Fuck. They demonstrated loneliness better in Interstellar - which is literally a movie about connection. 

Sound of Metal has Riz Ahmed newly deaf, in room full of people signing, eating food and completely unable to hear them or speak to them. THATS unbearable loneliness. 

You have to REALLY reach to get the themes here. That or you just superimposed meaning on scenes that deliberately avoided making a point.",lnwuxa
go5n96k,"> She didn’t process anything though. They didn’t give her a moment for that. 

All she did in the movie was process through her grief. And try to survive the best she could. It's been 20 years, but I was right with her.  I FELT that movie.",lnwuxa
go4ez53,I disagree the plate was her still trying to hold on to that past. At the end she let go of that life by selling the stuff in her storage locker finally moving forward to where she could stay in a house.  Everyone was running from something in their past but eventually you have to deal with it.,lnwuxa
go562f6,"That's fair. After having read the book (which is more journalistic/documentarian) I was a bit confused by the format the movie took, but enjoyed it nonetheless. If you're a reader at all, though, I'd give the original version a try!",lnwuxa
go4c5ay,[deleted],lnwuxa
go3mm0m,"i dont see your criticism. the whole story revolves around the economic turmoil that thrusted frances mcdormands character into that life. it even ends with a resolution to that. in fact, id go as far as to say that it explored those economic concepts better than the florida project did, so again im not seeing where youre coming from",lnwuxa
godte4u,"You didn't realize how lonely these people were did you? Like yeah they'd sometimes meet up again but most of the year they are separate and working some kind of deadend seasonal job until it expires.

The Florida Project is a different version of this though let's not dismiss that that film also uses ""the innocent view of children"" to teach it's message.",lnwuxa
go4xfqt,"Yes I realize that, but those directors cast them in actual roles. This felt like she was just taking these people and having them talk to the camera about their *actual* struggles in life",lnwuxa
go3p4pa,I felt like the emptiness was the point.,lnwuxa
gogkpdp,"They really should have explored what it was like for her to make connections at the jobs or the camps, and then leaving them behind to move on more.  Instead it was more ""hey, you're that guy from that place. cool."" 

Even the Bob storyline she seemed emotionally detached.  

I think that was the main failing of the film.",lnwuxa
go3ic9i,"I loved the overall vibe of the movie, but I do agree with your comment about the characters. I *should* have been crying multiple times during the film, but I wasn’t. Your comment made me realize why. There was no background the majority of them - just random stories here and there. The audience needs something for the emotional appeal / connection.",lnwuxa
go3y3eo,One of the problems here is that you're putting so much expectation on the movie to be an emotional experience that it could never possibly reach those heights.,lnwuxa
go380s0,Nailed it.,lnwuxa
goe0uff,"I disagree. I thought it was in line with what the movie was about, always moving on to the next place. If it'd ended in her old backyard, Fern would've been right back where she started. I thought the scene of her driving off really cemented that she'd let go of her old life in Empire.",lnwuxa
go5k5qa,Not really. Nearly every critics group awarded it BP. It’s just the facts.,lnwuxa
go8j7wx,Lots of snobs signing on right now,lnwuxa
gsn6sq8,The Youtube format is NOT the same as the theatrical format. That’s the main difference here. I’m sure Tom Green is entertaining and all but it’s no match for Fern’s introspective journey.,lnwuxa
gofavao,Do you typically have to think super hard to experience basic emotion lol,lnwuxa
go5agxi,You nailed it.  I have been there.  Her lifestyle was all about working through her grief.,lnwuxa
go3dsah,Whoa! The scene where Bob talks about the loss of his son was my favorite scene in the movie!,lnwuxa
go2wc23,"Makes sense. I didn't do too much research and only just watched it a few minutes ago, but I did notice it was based on a novel so I wasn't sure where the story ended and real life began. But you could definitely tell those were real people and real stories, which made it so much better. Frances' acting, as always, is on point but some of the best moments were when they just let those people talk.",lnwuxa
gsn1zw5,To show the parts we don't think about... The fact that she has no privacy and has to shit in the car actually shows a lot about her situation and daily life struggles.,lnwuxa
gzaya4p,Incredibly late to this thread but my interpretation was that they didn’t complain about it because they found a better way of living outside of the hustle and bustle where that was more of a determining factor.,lnwuxa
gvxanoc,"While not explicitly lamenting loss, the themes of economic hardship are present as a leading factor for quite a few characters in the film. There's Linda May talking about how she worked her whole life since she was 12 and only had about $550 in her social security by the end of it, which made van living enticing. The camp's organizer's first scene is him talking about the ""tyranny of the dollar,"" how they're all tied to it, and how they're all workhorses ""sent out to pasture"" by society and have to work together as a result. Some others mention medical hardships for themselves or family members as driving forces for them to go into van life. Fern's own catalyst was the mining town shutting down and her husband dying, with her retirement benefits being unable to sustain her on its own. 

The film doesn't go to critique capitalism, instead presenting a lifestyle where everyone who partakes in it ends up loving it and do relatively well for themselves, but it's clear that if many of these people didn't fall into economic hardships, especially prudent given the film set shortly after the Great Recession, many wouldn't have needed to buy a van to live in.",lnwuxa
gyc7919,"“Before I moved into the Squeeze Inn, I was out looking for work, and putting in applications 2008, and it was just tough. And I got to a really, really low point. And I thought about suicide, and I decided I was going to go buy a bottle of booze, turn on the propane stove, and I was going to drink that booze until I passed out. And if I woke up, I was going to light a cigarette, and I was going to blow us all up.”",lnwuxa
gw27tbh,I didn't imply that.,lnwuxa
gxtwvzh,That’s not at all what he/she was saying.,lnwuxa
goive8q,"Same, I was really impressed with Charlie Plummer. I've seen him in a couple things since then, but I hope he gets more work in the future",lnwuxa
gwqltfa,It is which is why black widow lost a director they had attached,lnwuxa
gr0dqim,"Fern is definitely not the polar opposite of Olive by any means.  She can be cold at times.  But she’s way more into walking around and waving to people she knows and smiling and stuff like that.  I think they are both great characters, and I talk about the differences in part to give credit to McDormand for nuanced acting performances.",lnwuxa
grs1un6,Too many people don’t even realize when the tv is in that awful “sports” smooth motion mode or whatever it is.  I’ve had to secretly change the settings on multiple friend’s TVs,lnwuxa
gq2f5hc,"Your comment reminded me of this David Lynch clip

[https://www.youtube.com/watch?v=wKiIroiCvZ0](https://www.youtube.com/watch?v=wKiIroiCvZ0)",lnwuxa
gq1x6ue,"Definitely gave me Cast Away vibes, although I appreciated this movie a bit more for letting the quiet parts be quiet.  It's  a moving tableau that gently and poignantly washes over you..",lnwuxa
gooxadb,[deleted],lnwuxa
gp7zz27,That RV park is next door to a pretty nice housing development on a golf course that is full of kids that would beg their parents to keep it.,lnwuxa
gqrdwhh,Lots of em,lnwuxa
gofohxi,"Similar to The Rider. I think this is what Chloe Zhao brings to the table, bringing out these ""performances"".",lnwuxa
gof2tmc,they killed being themselves?,lnwuxa
gpbasmj,It was.  :'(,lnwuxa
h98zkon,"Oh really? I thought I read he was actually deaf and not an actor, that his wife was working on casting and encouraged him to try the role because it was similar to what he did in real life ?",lnwuxa
gqcwoxx,It does amuse me but I'm also sad for you. That this kind of conversation is how you choose to spend your time. Be well little dove. Don't forget to meditate <3,lnwuxa
gtbpxr2,"Yea that's true actually. She didn't really have any struggles in the movie. She needed cash—her sister gives her money. Flat tire—friend gives her a lift into town. Some scenes she seemed to struggle to find a job but always seemed to have one. One scene she appeared to have a stomach bug and diarrhea—but was gone in the next scene.

It didn't really show any harsh realities of the lifestyle, nor did it attempt to glorify it. It kind of just stayed in this tame middle zone. I also found it weird and pointless that the director included real van dwellers. I guess it makes for easy set design and cheap casting. But it didn't really add anything, I wasn't exactly immersed in their world.",lnwuxa
gyhd652,"And maybe that’s why she didn’t have children, or accept her sister’s offer to stay with her. She doesn’t want to depend on someone or have people depend on her. In some ways, that’s what the nomadic lifestyle style is, being “free” to up and leave whenever you want, not having to depend of being depended on. But it’s also a false fallacy as well, because we see that nomads, like all people, depend on each other all the time: when they are sick, van breaks down, need something, they have to be okay with depending on someone or having someone depend on them, even if it’s just for a brief while. We all need other people in our lives. But nomads want to do this on their own terms.",lnwuxa
gr5aqzr,"I’m late here, but I agree with you. 

It doesn’t really show the consequences of what this lifestyle would be like, and very little commentary on it either. 

It doesn’t have the depth of similar movies because I just couldn’t find it very realistic (I think that’s the issue?). Everyone she meets is great. Never runs into trouble, except a flat tire someone saves her from. The only actual problem, she just gets bailed out by her sister. 

It felt more like someone’s wishful take on this lifestyle, than one that would actually result in some truly trying moments. I think that’s what you’re getting at, that she would need to overcome certain challenges, the character would have to develop, and her decision to stay with this lifestyle would make more sense. 

I liked the movie a lot, I just didn’t love it.",lnwuxa
gobp7zz,"But Fran doesn't see her life as depressing. Why do you?  


Edit: Her name is ""Fern"" not ""Fran.""",lnwuxa
godeg4e,"I've reduced my small book collection to a Kindle plus a few books that are not on Kindle--- Comic books are more than just the words, so they cannot have their crucial essence boiled down into a Kindle device.  


But I understand that for some people, each physical book may also carry a nostalgia and memory of people and places. And if that's the case, the physical book becomes more than words, too. So, it's okay to have a massive book collection.",lnwuxa
gp56b8h,"She started the movie going into New year 2020 (confirmed by the scene were they are looking at Vega and saying it was 24 light years away) so the second New Years means in Fran's world, Covid never happened. Thinking about that made me break out of the movie and smile a bit that at least Fran's world has some positives.",lnwuxa
gs91ox3,"This one word comment has me dying laughing 🤣 

Thank you for taking the time to write it",lnwuxa
go4ej1e,"That’s fair but I guess I didn’t need a lot of reinforcement that being old, working bad jobs and freezing in a van sucks and obviously these people would rather be retired in Florida if they could and they were just trying to survive/make the best of it.",lnwuxa
go7k6i6,"I disagree. They get into conversations about how abysmal social security is and how these people literally cannot afford real housing and are thus relegated to this lifestyle multiple times in a variety of ways. They’re making the best of their situation, but I never saw it as glamorized. I mean they’re shitting in buckets in their back seat...",lnwuxa
go6r8zv,"I wouldn't say it's a harsh criticism of capitalism either, apart from the scene with her sister and her sister's husband and their real estate friends where she says something about how bizarre it is to sell a house to someone who can't afford it, putting them into debt in the hope that it pays off (or something like that). I also felt like it wasn't grim enough, and I wasn't sure of the point of her van breaking down and her visit with her sister to get the money to repair it.

I'm really not sure what to get from this movie other than this how some people live, and some of them in order to process grief. It was nice to look at though, and makes me want to visit some of the locations.  Maybe it'll click when I'm older. I usually like these character studies.",lnwuxa
go6de28,"Speaking as someone who actually is nomadic, there's lots of us out here and we all have our different reasons, motivations and ways of supporting ourselves. I think the movie is a good counterbalance to the overly glamorous nomads you see on social media, and there's a whole spectrum of us between those two points.",lnwuxa
gofpuxh,I live in my van. I've been parked for almost two months saving money to travel again.,lnwuxa
go3x7y4,You do realize most people in this movie are living this life because they're forced to and not because it's a lifestyle right? The fact that the movie focuses on the character who specifically makes living as a nomad a choice when the same can't be said for the supporting characters (many of whom are real nomads) further shows my point about how this is a romanticized tale of being a nomad.,lnwuxa
go3obk8,"What? Houseless isn’t a euphemism for homeless. It describes people who could be in housing if they wanted, but who choose to do things like live in a van or couch surf. Choose being the operative word.",lnwuxa
go2zngj,[deleted],lnwuxa
go365t3,Damn dude no need to shit on my lifestyle lmao,lnwuxa
go3c9px,"You have no idea what you're talking about tbh. The ""Malich-isms"" that your speaking of is just beautiful landscapes, wide lenses and hand held camera movement. Literally 90% of the people in this movie were not actors but people who actually live this life. There is a freedom to living in a van, not being tethered somewhere, having to pay rent, etc. and this movie did not shy away at all about the hardships of a van life. Misery porn or even a grim movie is not what the director had in mind when making this movie. All of her previous works have been about showing the beauty in these midwest, small tribes of people. Who the fuck cares if she comes from a wealthy family? Shes using that wealth to create intimate stories about people you wouldn't ever hear about otherwise, and trying to capture the beauty within their lives. Almost every filmmaker comes from a wealthy family so it's nice that we have one that isnt interested in the things most are and is showing us a different perspective and different lives. You clearly did not understand that movie one bit and I feel bad for you because it was really beautiful.",lnwuxa
go4qhk9,This is goofy there is certainly more nuance to the term homeless. People who crash couches or living in their car is a far cry from literally having no where to hang your hat at all.,lnwuxa
go55mi2,"The movie neither has to agree nor disagree with it characters, it simply tells the story. Agreeing and disagreeing (and relying on context clues and body language) is up to the viewer.",lnwuxa
go7dalf,"I'm sorry. Do you need a movie character to tell you how to feel about the movie? LOL Never heard that.

To me, a film is like a painting or sculpture in a sense. It's not supposed to painstakingly explain to the audience what it's saying. I don't need to be spoonfed every single message in a movie any more than I need to be told what a painting ""means"" as I look at it.

But, that's just me. Maybe this is an old person's movie as it's more introspective and slow-paced. As a 60+ year old, I so related to the spinning back around to another new year, even if things *seemed* the same to some viewers.

The movie's slow pace combined with another year arriving so soon is kind of like old age. Ha.

Anyhoo, appreciate a different view, but I never needed a movie to explain to me how I should feel about it or explicitly tell me what its views on capitalism are. 

It's art, not a doctoral dissertation.",lnwuxa
go7aj0f,"It's pretty damn clear she was in an embarrassing situation, an aging woman lashing out like a child toward adults talking about the real estate market, and her sister said the quickest thing she could think of to try to defend her and also change the subject. Nobody reasonable would interpret that shoddy defense as the point of the film.",lnwuxa
gpryfeb,It’s really not fair to say Nomadland doesn’t focus on politics to avoid alienating prospective audience members. It doesn’t focus on politics because that’s not the story it’s telling. Nobody involved with this or the original book are seeking to recreate Steinbeck.,lnwuxa
go5en41,Kinda sounds like you had your mind made up on how to feel about this before you even watched it.,lnwuxa
go4e9tx,"No offense but you're making a shitton of assumptions based on one article, top executive could mean anything, this article here says her father was a manager.

https://www.vogue.com/article/chloe-zhao-the-rider-vogue-april-2018

There is a huge difference between what a CEO and a manager makes.

>married a moderately famous Chinese actress.

Not sure what that has to do with anything, the article mentions that Zhao's mother was a hospital worker and her father divorced her and then married the actress. 

I'm sure she's well off, but calling her super rich or a billionaire is just making massive assumptions. Especially since you're using it as a fact to criticize her movie.",lnwuxa
go6teu5,"And besides, I haven't seen many other films depicting this other side of America so respectfully before. it's not like any of the people were the butt of a joke.",lnwuxa
gozft0d,"It’s not subtle. It’s *empty*. 

You’re assigning value to a very, very poorly made film.",lnwuxa
gogjpg1,"I think the idea she was processing grief (and imo also regret) gets missed because it’s barely mentioned or said in the most passing of ways in the midst of a character telling a more interesting story or tidbit. She mentions her husband passed away to the lady talking about her ring, but that lady’s monologue took over imo.",lnwuxa
go5ofi1,"> This movie just rubs in your face “SHES SAD SHES LONELY” while never actually SHOWING us that.

The movie shows you at least 100 shots of Frances McDormand far away from the camera",lnwuxa
go4f8v5,"That was obvious. But it also ultimately meant nothing. 

She glued it back together, dusted off her hands, and went back to staring at the horizon.",lnwuxa
go4ca9n,"They didn’t show me that at all, actually. 

They focused on the town shutting down, she seemed pretty chill to dip out and had NO problems finding work. 

Literally none of the screen time was spent on her struggling. Which places it firmly in “poverty porn” territory.",lnwuxa
go4clxt,"Florida Project showed us a hotel full of people at the end of their rope, kicking and screaming against going back into the the streets. 

Willed Dafoes character literally existed to show us the compassion and understanding needed when working with people with nothing left to lose. 

We saw Frances McDormand running around the country side, easily getting jobs, easily getting her van fixed, easily finding people and experiences like a post card. 

NOTHING was struggle. We didn’t see her hurting at any point in the film. 

The main character of the Florida Project literally turns to theft and prostitution and ACTUAL things that happen to people who live in poverty with nothing to lose. 

This is the white fantasy of poverty. It’s not realistic in the slightest.",lnwuxa
godtj8j,"But they didn’t show that to us at all. 

Instead of giving us up close and interesting looks, having dialogue talking about it, we got montages and interviews. Hurray.",lnwuxa
go5q17s,thats exactly what the safdie brothers did tho. they made an entire movie that was a near autobiography of a girl who was homeless in nyc,lnwuxa
go4cy83,"There’s a host of films where that is actually used to be the point, instead of implied window dressing. 

For someone that’s supposedly alone she doesn’t spend much time working through it. She has a TON of friends and even a love interest. 

Pattinson in Good Time was more alone - which served to be an actual focal point of the film.",lnwuxa
gohb55y,"She ran into the same people most places she went. 

It doesn't scream lonely to me.",lnwuxa
go4d14k,"I didn’t expect an emotional experience. I expected ANY emotion. 

I wanted this film to make me give a shit about these people. But it didn’t bother to try. It was too busy diatribing at me.",lnwuxa
go5l9j4,I mean unfair to generalize that people are liking it cause it makes them feel more refined or smart.,lnwuxa
gsnagzj,"Are you sure? Have you watched them? 

This one won a bunch of awards. 

https://www.youtube.com/watch?v=F-0i2l3sqno&t=1108s

Try this one. 

https://www.youtube.com/watch?v=v8A0ad_2mPc

This one is about a guy trying complete the Barkley marathons. It shows him go through two runs. This one is fucking great. 

https://www.youtube.com/watch?v=NDZdsqbcGTU

There are so many videos filled with real people talking about their journeys. Some people have an entire channel for it. And most of them are as artsy as can be. Trust me this same movie exists a hundred different times on youtube. 

Oh and I chose hiking videos because they are essentially the same mind sets with less fake shit.",lnwuxa
gofay5s,We werent talking about emotions but the literal plot holes in the film.,lnwuxa
go3s9p7,"I've been grieving and I think Nomadland helped me find some peace. When Fern is cutting Swankie's hair and telling her how she thought about euthanizing her dying husband, I remember wishing that the person I love could stop suffering too. But when Swankie responded, you know maybe he wanted to stay with you as long as he could, that gave me solace. 

The second was that scene with Bob when he says he's on the road living this lifestyle because one day he knows he'll see his son again. Beautiful.",lnwuxa
go2wkz2,"Absolutely. I’ve seen this movie 5 times already and I remember my first watch I just felt absolutely drained. It felt like I went on a 5 year journey with Fern and there was so much emotion and stories told. I gave it a 4.5/5. After the next watch - I was just fascinated by the process, the technicalities and that it all fit together so well and is just so impactful in telling the story of these nomads and their lives. So now it’s at a 5/5 and after watching it 5 times, no regrets haha",lnwuxa
gsnakpo,"https://www.youtube.com/results?search_query=foresty+forest


I have seen every episode and not once did I need to see him shit into a bucket to understand how difficult his life is. 

We already see her pissing on the side of the road in the beginning of the movies.",lnwuxa
