comment_id,comment_body,submission_id
gu0fzvb,Bang on.,lnwuxa
gpqp3sb,"Ayyy. I also got vibes of the Assistant while watching this and glad to see another commenter who felt the same. 

Not sure if you’ve seen Leave No Trace but I felt similar vibes with that one in Nomadland too.",lnwuxa
gp412u3,Yoooo good point. Misleading trailers/marketing/etc. it was just harsher than I was prepared for,lnwuxa
go9hwka,Definitely reminded me of Ghost Story in how long and drawn out and pointless it was,lnwuxa
gr5cidu,"I mostly see your points, and do agree with them. 

Still, I think the film is too unrealistic in how it portrays the lifestyle. It presents a lens that I just couldn’t “buy” into. I don’t think it clearly shows that it “isn’t a great lifestyle”. It shows drawbacks, but plays to the note that these drawbacks are “worth it”. 

I didn’t need clear conflict. But I did need to see more to make this more compelling. Her choice to stay in this lifestyle, to reject her sister and Dave’s invitations, would be much more meaningful if we saw how challenging this actually was. It would show that DESPITE the difficulties, her choice was rooted in something profound. 

Throughout the whole movie, I don’t think she meets a single person who isn’t kind or nice. How realistic is this? I can think of one character, the 5 second appearance of the guy telling her she can’t park there. Everyone else? Kind, even if misguided a little. The woman saying it’s cold and there’s a shelter (you can sleep here though! Comes from a place of kindness). The woman in Walmart, not understanding the lifestyle, but offering to let a non relative to stay with her. Dave’s family, letting a pretty much complete stranger just live on their farm. 

This lifestyle would be so much harder than shitting in a bucket. It would be nights of no food. It would be constant stress about finding employment. It would be problems of health, etc. the only trouble she ever TRULY faces, when her van breaks down? I’ll just have my sister give me 3k in cash. 

I thought the movie was beautifully done, but it has a certain shallowness for me. It’s not honest to what that lifestyle would be, which wouldn’t just be “kind understanding Americans”, and “occasional difficulties”. It would be much, much, harder, which if shown, would make her decision to continue it that much more meaningful.",lnwuxa
gvkjpof,Well said,lnwuxa
go7f2jh,It was definitely a lot like Into the Wild with a less naive main character.,lnwuxa
goa412l,"Zhao likes Malick a lot, so that makes sense
https://youtu.be/7Ces4ZqX75o",lnwuxa
go8t36f,"I got strong Malick and Into the Wild vibes, along with Debra Granik’s Leave No Trace, Steinbeck and Springsteen’s Nebraska and Ghost of Tom Joan, but really all of Springsteen.",lnwuxa
gpy6ghq,"I liked it so much more than into the wild,  if that matters any.",lnwuxa
go3jtqo,"A big part of the movie is examining (its idea of) late-stage capitalism, and part of that is the Stockholm syndrome of being super grateful to get a seasonal job that, for a few months, pays you well enough that you can afford to have a home. That's the secret horror of it: in the context of Fern's situation, Amazon is *good.* But in the context of human beings actually trying to survive in the lower echelons of hypercapitalist America, we quickly see how little Amazon really does for her.",lnwuxa
go2zyvo,I don’t want to be the defend Amazon guy by any means but I believe all the warehouse workers get at least $15/hour which is probably a decent amount more than the other jobs she had throughout the movie.,lnwuxa
go2z0m1,"In that scene she was talking to someone ""well"" off from her past that was obviously worried about her. I think it's clear that Fern does not want an attachment to anyone, nor for anyone to question or worry about what she's doing. It could have been fern wanting to make sure that woman didn't worry about her as opposed to the money actually being good.",lnwuxa
godvnmu,"I felt like Amazon was treated simply as another job they could temporarily work. I've heard that getting access to Amazon that closely took some real steps so they couldn't criticize it too much but I do think it stands as another puzzle piece of what Nomadland is. You have to go where there's work, even only temporarily. And you can adapt to the schedule but it's a lifestyle/workstyle that doesn't work for everyone. 

I think Nomadland would be a very different movie if its focus was about the terrible nature of late-stage capitalism and how it crushes people. The movie is more about Fern and how she uses this lifestyle to process how she's feeling.",lnwuxa
gocxdwi,"I was so curious about this too mostly because I was wondering if they actually shot in an Amazon warehouse or if they dressed up a different warehouse to look like it. Turns out, Zhao wanted to do it and McDormand wrote a personal letter to Amazon to get permission. Zhao basically didn't want to use the moment to attack Amazon, but to more show how this type of work (along with the farm and Fern's other odd jobs) are all that is available to people like her and it shouldn't be that way. She's doing back breaking work at the point in her life when she should be slowing down. Even if working the Amazon job isn't ""hard"", she is still someone in her 60's (with bad knees, as she mentioned) standing and doing manual labor all day.",lnwuxa
go9hkqj,"I was depressed by the reality of the Amazon scenes and holiday only economy they have, I already knew the workers get paid decent compared to most jobs.",lnwuxa
gs5c419,This was almost definitely a stipulation by Amazon to be included in the film. And it's my only real complaint.,lnwuxa
hkkap4j,"Amazon pays over minimum wage and gives you solid forty hour work week. That's better than most other entry level unskilled jobs. It's hard work but the media has overblown it Amazon isn't that bad compared to other low skilled jobs, I worked there and I'd still take it hands down over fast food or retail. But Mickey Ds horror stories don't have the same cultural cachet.",lnwuxa
in1dost,"I don't know anything about Amazons pay, or conditions.  However, perhaps the concept of 'good pay' is different when you don't have all the burden of a mortgage, children, netflix, annual holidays and all the other trappings of modern life.

If all you have to worry about is fuel for your van and food for yourself then maybe Amazon does 'pay well'.",lnwuxa
go3ityj,Zhao loves the amateurs she has used in her three films.  She essentially became one with the rural people of South Dakota where she shot her first two films.  She is not detached in any sense of the word.,lnwuxa
go9h3vi,How do you think they could have changed it to make it feel less like poverty tourism?,lnwuxa
go6ea15,Youre huffing paint.,lnwuxa
go57560,">She couldn’t move on from her husband

This really tugged at my heartstrings.  He passed and she couldn't bring herself to leave where they had lived together, even though he wasn't there anymore.  Then the town shut down and cut that last lifeline to him.  I felt this throughout the whole movie yesterday and am still  feeling it today.  Have been in that nearly-exact frame of mind.

I've seen people saying ""She had a chance to have another relationship with a nice guy, why didn't she do that?""  ""She had offers of a place to live, why didn't she do that?""  Because she's grieving and what she's doing is how she's working through it.  It speaks to me.",lnwuxa
go6rjcj,"And not just her husband, her whole town.  Her job.  Her friends, her community, her colleagues, her students.  All gone within a matter of months.  How do you recover from that?  How do you start again?  And do you even want to start again?",lnwuxa
go9ixml,Makes me never want to fall in love. I'll never feel that pain or inflict it in another,lnwuxa
go9i678,Do you feel like that lifestyle is a good option for someone around retirement age that hasn't bought a house,lnwuxa
gos9rkw,"Same! 

I understand what the film is trying to portray, but it was so flat and outright boring. I desperately wanted there to be something more to draw me in emotionally, but everything felt detached. I get that is in a way part of the intent, but it was so incredibly boring I lost interest.",lnwuxa
gocvd7m,"I don’t necessarily agree with you about Fern’s intentions. I don’t see it as a tragedy. As she says at the end of the movie, her and her husband married young and he moved them to Empire and he loved the people and his job there. She sort of accepted this reality and made the best of it cause she was her husband’s only family. It made it seem like she regretted not having more life experiences so when the town closed down it afforded her the opportunity to hit the road, move on with her life to make new memories and to stop living in the past.",lnwuxa
gp5btzg,"I liked this movie a lot more than Into The Wild, which did leave me with a bad aftertaste. I never understood why he had to leave and what kept him out there searching. He was privileged and considered himself better than everyone and at the end it just made him, to me at least,  a pompous jerk (and I read the book, was hoping the movie would change my mind after hearing rave reviews, but no). On the other hand, Nomadland paints a much more understandable relatable narrative from all the characters who have a hole that is filled my constantly moving. 

I think I understand that her moving is not because she is ""better"" or ""discovered the truth about evil society"" like Into The Wild, but instead she (and all the others) move so that their grief can't consume them and that movement, no roots, becomes like breathing,  it is just normal and has to be done.  There is no pretension nor trying to convince anyone that traveling/tramping/vanlife is something everyone should do (and looking down on those who don't do it - Fran even trys to tell the young guy with the lighter to go back home) it's just what works for them and keeps them going.  There is no search for a solution (like the Secret Life of Walter Mitty - another movie I detest), meaning that piece that will fix everything, it's just surviving with yourself. I completely understand her reluctance to become a lodger in someone else's life, especially that late in her life. 

I think the sunsets are important to showcase that there are different perspectives to life and that one choice isn't necessarily better or worse. Did you go look at the pretty sunset today or were you watching tv or working or driving home or...? For these people the sunset matters,  for others maybe not so much.  In the end, they do their thing and deal with their issues themselves,  so they can continue to be self contained.  Maybe I'm just older now and relate to the Nomads but I definitely felt like I understood them a lot better than Chris McCandless/Alexander Supertramp.",lnwuxa
gr9xart,Which copypasta is this?,lnwuxa
go4ce83,"It's fine that it didn't hit for you but I saw it as someone processing through grief.  Both her life with her husband and city they built a life were taken away.  Due to our shitty system she could not retire or afford to live, and she was too proud to confide or rely on others too much.  That's why she finds this lifestyle it's built for people to come in and out of your life. When someone tried to get close she could just drive away.  The end she finally started to face and process this grief.  I enjoyed the film, but it wasn't her best work.  3 billboards and Fargo show her range. But still felt it was worth my time.",lnwuxa
goobzse,"Jesus, people really need to learn the beauty of silence in film. Some folks have a serious ADD problem.",lnwuxa
go52v4k,"I'm curious if you (and others here, too) are aware that [Nomadland](https://www.esquire.com/entertainment/movies/a35538486/nomadland-fern-true-story-jessica-bruder-linda-bob-swankie-now/) is actually based on a book about real people, real struggles, and real life? 'Fern' is real, Bob is real, Swankie is real; [Empire, Nevada](https://en.wikipedia.org/wiki/Empire,_Nevada), is real, and so are the mining plant that closed and the people who lost their jobs and homes that were provided by the company. There are hundreds of (real) older Americans who, after working their whole lives, feel they have been failed by the system and as though have no other purpose, nowhere else to go. So they become Nomads. 

This film wasn't meant to be dramatic; it was meant to be, to use your word, a mediation on grief, confusion, loss, and, above all else, acceptance. These aren't just ""old people,"" these are humans trying to not give up on themselves the way society has given up on them. In addition—and you may not like this, and I'm prepared for that—Fern and most of her close (platonic) friendships are women; all the other movies you listed have male leads.

I will admit that something that irked me about the film was that Fern did, actually, have not one not two but three places and friends with whom she could comfortably reside, as I'm really not sure if that's the case for many real-life Nomads. I also didn't really like how she, in her sister's words, was ""always seen"" as eccentric; I'm certain that a lot of Nomads always lived and craved a comfortable life, and then became nomadic not because they love ""being free,"" but because they felt short of options.

That all said, this is a fairly niche film addressing similarly niche issues, so yeah, it make sense that it's not everyone's cup of tea.",lnwuxa
go397kp,"I agree. This felt like it should’ve been a documentary. The real people giving exposition basically to the camera was so strange and ironically felt scripted.

It definitely seems like it wanted to be deep but... what’s deep about it? Like you said, better films have handled these themes much better and many times over.

Also, does anyone else feel kinda weird that the movie, directed by an ultra rich foreign heiress, used real people talking about the actual struggles of their impoverished lives essentially as props to support a fictional character played by a rich and famous actress? A lot of movies are accused of being poverty porn but this one used actual poor people.",lnwuxa
go3676r,"It’s been a long time since I’ve been this disappointed and underwhelmed by a movie I’d been looking forward to and that was getting acclaim from so many sources. 

I can do slow, I can do unconventional, and I can do experimental. This was just aimless and pretty pointless. A documentary could have been fascinating and moving. This felt....like it didn’t know what it wanted to be.  

Gorgeous cinematography, but without anything even close to a plot beyond “Nomads doing nomad things,” it just felt like an art school montage. 

And the pacing was simultaneously sloth-like and too quick. Like, the “vignettes” or whatever they could be called felt like 10 minute movies that had been cut down to 2 minutes...while also feeling like 20 minutes. 

I’m truly baffled by the hype for this one.",lnwuxa
gojssd4,"I 100% agree! I felt unmoved because it’s a story that’s already been told. For me, it was not compelling. I didn’t care about the characters, in fact I felt indifferent and bored. The nature photography was nice. However, it is very familiar and not presented in any way that’s unique or interesting. Maybe someone who has never explored the inner life, connected with nature, or observed this strain of poverty and lifestyle found it moving. I don’t get it, I kept thinking “this is it?”",lnwuxa
gursme1,"I know it's been a month but I just wanted to say thank you. I'm over 30 and in my whole life there was so few movies I didn't watch to the end I can't even remember more than 3. Well, now it's 4. 

It was just... empty. Like I was waiting for the plot to start and it never did, it was like a fake 'living a life of...' documentary. Sure the sunsets are great and all, but this film is just about nothing in particular and I was shocked so many here are praising it this high. Maybe it's an american thing and I have to be american to understand it, but I really tried to get into it and it just kept dragging. 90 minutes felt like 180 and I just realized I don't want this anymore.",lnwuxa
gsn056q,I agree. I can watch real people doing this same stuff on youtube in short videos. Why sit through this?,lnwuxa
go9gru9,Did you see Leave No Trace and what were your thoughts if so,lnwuxa
guiussz,"> One story related question though - was Empire a ghost town her whole life, or did it seriously fall apart after Bo died?
> 
> 

The latter, it seems.",lnwuxa
gvx32ri,"thats because they tricked real people to open up themselves with no pay, and then sell it as a feature film to the general public

its a exploit bad directors use to pump their movies 

no actors is better then the real deal, so they trick the real deal",lnwuxa
go3jzc0,Yeah that’s a pretty iconic shot,lnwuxa
go4rzr5,"It was hard to miss, after seeing the Searchers. I kinda wish the movie would have ended with her walking off-frame.",lnwuxa
gpb4fce,I think he was a cowboy. A real one. Did you notice the lariat on his backpack. His clothes the first time you see him. Cowboys still exist.,lnwuxa
guxheue,That’s when it lost me as well 🥺,lnwuxa
gwc0713,"It’s far worse than that. It’s shot as a documentary only it’s not, which means it’s the interpretation of a Hollywood elite of a particular subculture. You learn nothing real or new.",lnwuxa
go8x2ob,"I think the movie is meant to portray the people that have ""figured out"" this lifestyle and are somewhat outliers. Even then their lives are difficult.",lnwuxa
gob8cd9,"The movie dealt with some of the negative aspects of the Nomad lifestyle, but it did seem to shy away from portraying any of the nastiness that people can bring to it. Honestly, I’m glad it does. It’s a film focused on the beauty found in regular people. We all know racists, sexual predators, and just general assholes are out there, I don’t think the film needed to remind us.",lnwuxa
go5dsei,">  I trust that Chloe Zhao made the movie she wanted, but there has to be a way to tell a story about class in America that isn’t afraid of a little polish (Five Easy Pieces?).

I think that might be a main reason people have an issue with the film, but also that is maybe more of a viewer ""problem""? I certainly thought the movie was going to be mainly about class struggle in the US post financial collapse aftermath from the brief things I'd read about the movie and before I was familiar with the director's work, but I don't think that was the movie Zhao was trying to make. If that's the movie people want, Nomadland isn't going to deliver.

If you look at her previous movies, poverty and the harsh realities of the modern US economy are certainly the backdrops and parts of her movies, but they are not the defining elements or central plot points.",lnwuxa
go2yqkk,"Yeah, this feels like a film that would've worked so much better if they went fully into documentary territory. I mean many of the secondary characters in the movie are real nomads and I'd have loved a much more deep and honest look into their lives rather than Fern's.

Also, although it's a pretty different film, something like NRSA feels so real because there's a sense of anxiety and horror behind every scene, even with its moments of beauty (such as its moments of female camaraderie, which was very beautiful). This needed that, or at least a little bit more of anger.",lnwuxa
goduqzq,"I have no idea how you can call this movie forced. Like how do you even define ""forced"" in that matter when it comes to something that isn't highly dramatized movie. 

Never Rarely Sometimes Always is probably a more immersive film since it's 100% from the girls' perspective with no breakaway, but I would say Nomadland is going for far more thematically and scale wise.",lnwuxa
goe7928,"> clearly non-actors, the clunky dialogue 

This was actually what I came away most impressed with, the dialogue and performances by non-actors. Swankie felt like a real person, watching her felt like a documentary. Many of the other characters felt similar, they outshined the few actual actors in the film IMO.",lnwuxa
gp421qy,I AGREE. Thanks so much for putting it into words. Sheesh.,lnwuxa
go9ilcn,"I was also thinking ""is magic hour cliche now?"" Like is it cheating or something idk",lnwuxa
go6gulv,So what's your take on Malick lmao,lnwuxa
go5170b,Same here. I know why they are. It's a critics bait film thats makes them feel smarter for having enjoyed it. Its pure film snobbery.,lnwuxa
go9i87o,Just like real life,lnwuxa
go8bwqf,Im guessing you’ll be gushing over what a masterpiece Zach Synder’s JL is soon enough.,lnwuxa
gpr07jg,See Spotlight and Shape of Water,lnwuxa
gpzmjdf,The film is giving me a real “poverty porn” vibe too.,lnwuxa
h1afg31,"I agree with you completely. On its own I wouldnt have mentioned it, but the way she approaches this subect in combination with her extreme wealth and elite private school upbringing this really does leave a sour taste in my mouth. Besides that it's so incredibly obvious oscar bait as well, it's almost like a goup of suits trew  a few mil at a focus group to decide what movie would sell most while appearing ""artsy"".",lnwuxa
gqvt7cx,"Yeah that was so off putting for me because NO Amazon warehouses are probably rated as the worst places to work in. But then I forgot it was ""based"" in 2008/09 so I figured, well maybe it was slightly less traffic or better back then?

Anyway, the whole image still plays out pretty badly for me as it's released in 2021.",lnwuxa
gwc0hkc,Oh I can tell you who this movie is for. It’s for Hollywood elites to circle jerk on how “in contact with the poor and desolate” are,lnwuxa
go5mqae,I like it because there wasn't much to get in the first place. Seeing Fern interact with a lot of people paired with the music and locations was enough for me.,lnwuxa
go5wh1j,My brain never stopped filling in the spaces with all the feelings for the entire movie.,lnwuxa
go5tk70,"I didn’t see her triumphing over anything. She was grieving and made her own routine life on the road to cope. There was no real plot but I saw that as the entire point of the film. She was lost and circling back around to the same jobs, the same people, the same places, she only wanted to sleep in her van. She was trying to escape grief, something inescapable.",lnwuxa
go5115a,I was just pointing that out! A few tracking shots backed by a score alone does not make a movie great.,lnwuxa
gpl21h5,Totally agree with this one. It felt like Into the Wild but for seniors. A nice looking film with a nice score but kind of hollow.,lnwuxa
go5o15l,"do you mean by moving in with Dave and his family? or her sister? she just wasn't ready -- it meant giving up her independence, her nomadic lifestyle, and moving on from her grief. it terrified her. the scenes where she moves around Dave's son's house in the early morning, as if trying it on, were so poignant. also when she crawled back into her van to sleep.

but I found the ending beautifully hopeful. she heads back to Empire. she empties out her storage space. she walks though her house and into the desert beyond. as she drives away, for the first time, she is truly beginning to move on.",lnwuxa
go3nqki,"Yo me too. I'm halfway and every scene and conversation feels like a mundane day. Im getting the feeling itll be one those movies that'll end with nothing ever happening and nothing ever being resolved. It'll end and Im just suppose to feel deep about it. Yea no, maybe I'll come back to this when Im stoned.",lnwuxa
go8wfpq,I think Fern was portrayed as self destructive in a way. She believes in her lifestyle so much that she's reluctant to accept help or admit that it's unsustainable.,lnwuxa
go5obss,After seeing so many amateur and unknown actors it really pulled me out of the movie when Straithairn showed up.,lnwuxa
go3jnrw,Ngl cut his character out and it improves the time length too. This as an under 100 min film would’ve been awesome,lnwuxa
gsmzy24,Go watch Kid Detective. Let me know what you think about it. Trust this internet stranger.,lnwuxa
gofadbf,Holy shit,lnwuxa
gqvtio6,"I know she won for Fargo, but am I completely missing what she won before?",lnwuxa
grh2nsk,"i totally didnt notice Joseph Gordon Levitt, who did he play?",lnwuxa
gvx2rwq,"best comment iv read so far, the director and team should be ashamed that they exploited people like this",lnwuxa
gwpkrbj,1000% better in theaters. it was just stunning.,lnwuxa
go2vl24,"I noticed while making this thread that every character name was the same as the actor name. Obviously for all the smaller parts that's purposeful, wouldn't even be surprised if the testimonials we heard were real stories from those actors, but I found it interesting that Frances and David Strathairn also used their real names for their characters. Kinda breaks down the divide between the character and the actor in a way.",lnwuxa
goaihsx,Hopefully in the future directors will think of you and your dinner as they shoot their film.,lnwuxa
gqvujjq,"your review feels a little, lacking and like you didn't even give a shit to bother doing a whole paragraph. Next time you are going to be doing a mostly negative review(go a little longer in content, it helps and I've actually upvoted other people's criticisms)",lnwuxa
godzurn,It's interesting. I felt like I could have watched more. I wanted to see what happened to her next or who she would meet.,lnwuxa
go5qs8o,Bittersweet to hopeful. That was actually the thing that threw me off with the commercials. It’s light.,lnwuxa
