comment_id,comment_body,submission_id
gvn7ql0,"Wow. I *fucking* loved it.

I've never seen another movie like this. I never got around to watching Hardcore Henry? Is it anything like this? I loved the fighting style. I've always admired the John Wick movies, but there aren't my thing. This is what I want in an action movie.

Odenkirk is a freak. Is there anything he can't do? It's been an honor to follow his career from the start.

Edit: I didn't read the other comments first. If you think this is a John Wick rip off, you aren't paying attention. Enjoy your Corona, ya basic fuck.",me3za3
gvqmv3f,This is my guilty pleasure.,me3za3
gvqn2o4,This easily beats John Wick 3 imo.,me3za3
gvse6r0,"Equal parts Taken (older super-abled hitman guy with mysterious past,) * John Wick (waves of guys for the the super-abled hitman guy) * new Rambo (crazy death trap preparation plus plenty gory death.)

Loved it.",me3za3
gvsh08a,How much were his gold bricks worth?,me3za3
gvtrgdf,Someone please tell me why it was clever for Hutch to not take the thief with the gold stick just because she had an empty gun,me3za3
gvuk89v,"I understand why everybody is comparing it to John Wick, but while watching Nobody, I thought of True Lies",me3za3
gwhzimo,Where can I watch it for free,me3za3
gwphlxw,"Teddy - Russian boss brother spoke Polish in the bus. Weird, considering everybody speaking pure Russian later on.

ps. Which phones were used both by Russian boss 1h:05 & real estate lady at the end of the movie?",me3za3
gwu5fp0,"interesting movie... but i feel the portrayal of russian gang bangers on the bus is inaccurate.  Aren't 95% of public transit attackers POC.  75% black, 20 latino?  Just want it to be statistically accurate.",me3za3
gx8wbx9,"Really enjoyed this movie. Great dark humor. I think my favorite part was the money burning montage. Moved around all the tropes and cliches to make something really fun. Like Antman meets John Wick. Proof you dont need an absurd budget to make a really great film. 

Im glad the movie profited, now the director gets to make more movies.",me3za3
gxcvstl,"Not gonna lie was half expecting to hear ""Yes, Mr. Wick"" when talking on the phone at the end",me3za3
gyzmzgi,"that was so so good but the title and posters kinda put me off, as well as underestimating bob odenkirk",me3za3
gz0nfxh,This is what kinsman and John Wick tried it be. But this was actually good.,me3za3
gzqi2f4,I love this movie more than John Wick.,me3za3
h002g23,"Turns out there are way more people in the comments who are okay with a bunch of drunk mobsters raping a girl than I'm comfortable with. Just wanted to read some discussion ffs, not ruin my mood.",me3za3
h00zr1v,"The first two thirds I was thinking that it was enjoyable enough - considering how much I despised Polar and thought Atomic Blonde was dull and convoluted, I thought that it was okay enough as a discount John Wick-lite type movie. Then it sort of switches gears and goes from grounded into over stylized around when he tells his family to stay in the basement after he cooked lasagna and it won me over, even before RZA and Christopher Lloyd, which made for a really fun final act.",me3za3
h0rhbl7,"#Nobody2
Nobody 2: The Basement Tapes
Nobody 2: The Quickening
Nobody 2: Nobody Knows
No2ody
Nobo2y
Nobody 2: Better Call Nobody
Somebody",me3za3
h1b2nxp,Why did he use all the gold to buy the business just to destroy it and disappear?,me3za3
h1rkq7l,What will happen to all the people working at that factory. Those owners won't give them a cut of the gold.,me3za3
h2bw91j,This is basically just a big revenge fantasy for Odenkirk. It's what he wished he could have done when his house got broken into. The action was good but the actual plot just wasn't.,me3za3
h40neyq,It even had a Home Alone booby trap scene at the end.,me3za3
h63ukra,Loved it.,me3za3
h6moa24,I feel like I'm going mad but I'm almost certain I've seen this film on Netflix or somewhere last year.,me3za3
h6ojzxz,Loved it ! Hopefully they branch out like John Wick,me3za3
h91o9vz,I don't like how this movie turns into RED halfway through although I still enjoyed it I felt the first half was stronger,me3za3
h9ql3hp,So why did his “bosses” call the realtor and not him in the end?,me3za3
h9xk49k,"Can anyone tell me why the Russian wanted Odenkirk alive once he found out he was ""Nobody""?

It's my one complaint about this movie because that plot-point seemed to only exist to get to the car scene, rather than actually be a character-driven decision.",me3za3
ha2b964,Did anyone notice how the dad had the same tattoo as Hutch in the scene where he kills the two mobsters and lowers the TV volume.,me3za3
hb89ilq,Hated it. Was expecting something different. Still at least Bob Odenkirk didn't die IRL last month so whatever.,me3za3
hcjxrac,I have a question. Why did those 2 cops go silent when they got the call?,me3za3
hhblcdg,"Movie detail, he talks in a flashback about having a HK USP .45. It it's really a 9MM",me3za3
hpiklfp,"Gave this movie a 9. It was surprisingly good. The movie exceeded all my expectations.

For context, I loved John Wick but John Wick Parabellum made me yawn because it was just too repetitive and made me wait until the movie was done. 

This movie added a little spice that John Wick lacks. It's like John Wick and Breaking Bad had a baby and they gave it steroids.",me3za3
hpsk4nv,"This is Ilya Nasishuller's first non-first person movie/video that I've watched. The story is kind of a knock off of John Wick, even the action started out just pretty normal, but when he actually got caught in the house raid and just escaped, things starts to escalate and got interesting. Ilya still has his video game FPS style even in third person, the explosive traps and the triple shot are some cool moves. I actually just watched Matrix Resurrections yesterday, I wish they would've had Ilya to direct that instead. With that level of budget, the fight scenes probably would be outlandish but cool.",me3za3
hs2t7oq,those cards tatoo is a bad hand,me3za3
ht0m32a,"I didn't and still don't know what to make of this film. I was fascinated while watching, mostly because the film's goal was so unclear. It started out as a movie about a midlife crisis, became a John Wick movie, and ended like a black comedy. It's very well made and seems to have accomplished exactly what it wanted to, but I can't help but feel like there's something inherently contradictory about it. 

The point of a John Wick movie is to vicariously experience spectacular violence, suspending whatever disbelief nessisary to get there. Nobody acts like a John Wick movie, but just when you settle in to gawk at the violence it sticks its thumb in your eye with a self aware joke. You can't properly experience an action movie that is laughing at itself, and by extension the viewer. By the end of the film I started skipping through the beautifully choreographed action scenes because I couldn't bring myself to take them seriously. I was waiting for the next joke. I almost feel like I watched a parody of modern action movies, one that critiques the viewer for failing to see obvious silliness behind the production values. John Wick is ridiculous, and we are ridiculous for trying to ignore it.",me3za3
i2famzd,Home alone for adults. I liked it!,me3za3
ia9fcqf,"I loved this movie!  Bob was great.  The characters reminded me of Breaking Bad.  His dad= Mike, Hutch =Walter, Becca =Skyler, etc… even the interrogator at the end reminded me of Lydia… 😂",me3za3
id6309j,"Just watched it...I dunno, I don't think I enjoyed that as much as I thought I would. It sets itself up to be a very gritty, realistic movie about a guy going over the edge, but then after the halfway point, Oderkirk is just a plot-armour invincible super special ops soldier assassin guy and even his soldier buddy and father are just as capable of his skills, it seems.

The plot just got so, so ridiculous, Yulian's antics didn't help, his character was so painstakingly ""bad guy you should feel nothing for"" that it was laughable.

Some truly awesome action scenes, a goof with a disappearing and reappearing suppressor on a rifle, and a lot of parody.

It's hard to escape the thought that this wanted to be John Wick really badly, and fell right on its face.",me3za3
ijot7di,"Just watched (little late to the party) and it was great. Enjoyed it a lot

Couple questions:  who called the two cops at the end?  And who called the real estate agent?",me3za3
imgnqxz,"Soon to be classic. There, I said it.",me3za3
int3ql9,"Something i just noticed about the bus fight scene.  At the part where the stunt man is tossed out of the window, the stunt goes wrong, clearly he was suppose to go throw cleanly and land rolling on the VERY THIN mat that you can see below (they left it in, and on the first viewing you don't even consider its there because of how thin it is, all the other stuff around and how the fall and non-cut glass shattering distracts you).  But it goes wrong and the end of his foot catches the bottom of the pull away window on his way out and he always falls directly onto his head.  

It makes it looked more brutal and gives it a sense of realistic chaos, which honestly makes the fall better, but also he could have died.  I think at the very end he barely manages to turn and land shoulder first, or at least have some of his shoulder share the impact, but it is a very close thing, and he was arguably an inch or two away from permanent injury or death.  I'd love to see an interview from the guy who did that stunt.",me3za3
isirjny,"Hang on, so if he found the kat bracelet in basement when his daughter asked, the nothing would have happened lol?",me3za3
isx5546,"Question 
Was anyone confused on where their location was? I figured Hutch and his family lived in the United States and Yulian in Russia but clearly they all lived in the same city. Was it supposed to be New York? The all Russian club threw me off too I figured for sure they were in Moscow or something but I’m not from a big city so can someone explain",me3za3
iul6n9r,Perfect for 78 iq diehard fans,me3za3
ix7lio2,"It started out good, then once I realized it was basically just John wick with Bob odenkirk I kind of lost interest",me3za3
gsfl7ax,where is godzilla vs kong? It was supposed to release 25th in us adn 26th in eu. So why is it not on Hbo or anywhere else?,me3za3
gsj3nia,"Nobody:“I’ve never met a Black Russian.”

Russian:“Yea, I get that a lot.”",me3za3
gsjs9fx,Good humor in this.,me3za3
gunhvkt,Those scenes were hilarious,me3za3
gt6lnum,"I didn't pick up on that while watching the film but looking back, that's really funny. Good script!",me3za3
gv0xlf3,I thought the sneaky devil was in reference to Death taking  those people without him noticing.  Then he follows it up with the kitty cat bracelet.,me3za3
gsdk08e,"By ""strangest"" you mean ""best,"" I would hope.",me3za3
gssq74q,"Even weirder as I initially thought Christopher Lloyd was the grandfather from *Everyone Loves Raymond*, aka Peter Boyle.",me3za3
gtb9xgo,"Sam Rockwell, Collin Ferrel, and Christopher Walken in 7 Psychopaths was a similarly wacky trio.",me3za3
gsv9u07,I just saw it. It was an unexpected treat. Lloyd was great.,me3za3
h1bgg7n,I reckon it won't be long until a sequel featuring 3 working together is greenlit.,me3za3
gvyxjuk,For a Russian viewer there are even stranger combos in there.,me3za3
gwphbru,"You mean, like epic?",me3za3
hl30y4y,"Saul Goodman, Doc Brown, and Prince Rakeem.",me3za3
gt6eqan,"I expected discount John Wick. But got one of the most fun, over the top movies ice seen in awhile.",me3za3
gvnj2oq,"> There is no: “all hope is lost moment” 

That was THE most refreshing thing about this movie. Every single American movie has that beat near the end of the second act. You know it's coming. Everyone knows it's coming. It's inevitable and predictable.

This movie just said fuck it and raged on. Loved it.",me3za3
gveyh6s,The writer of Nobody also wrote all the John Wick films (and the upcoming ones as well) [https://www.imdb.com/name/nm4401003/?ref\_=tt\_ov\_wr](https://www.imdb.com/name/nm4401003/?ref_=tt_ov_wr),me3za3
h3p3qgi,"I absolutely loved the first scene where his face turns into a bloodlust as he is about the bash the skull of the female robber in with a golfclub, but represses that itch, world class acting.

Then to finish it off with the crossed fingers looking in the rear view mirror of the stolen mustang (which does 0 to 60 in bout to find the fuck out), like, come on - make my fucking day and chase me after i just walked out with a claymore to the chest",me3za3
huefc1v,"> There is no: “all hope is lost moment” everytime you settle in for the familiar it says: “fuck it” and has more fun. Tropes are introduced but cast aside.

Yeah, I kind of started to internally grown and prepare myself for the scene where he gets tied to a chair and tortured after they stun him and toss him in the trunk.  It was such a moment of triumph and joy when he sticks his head through the back seat cushion and curbs that whole story tangent.

Though I’d say the beginning basically tells the story that he is basically living a life of hopeless desperation.",me3za3
gsrb66i,"Is this thread astroturfed? The movie is boring and does absolutely nothing new. The only good choreography is during the bus scene and the rest is just nonsense. It's soooorta fun, but I also just saw the original Total Recall and had more fun there. 

Christopher Lloyed was great, and Odenkirk did fine. But this one coulda easily been sent to streaming services",me3za3
hb52i8g,Sorry!  Late to the party!! It’s a perfect cross between John Wick/Home Alone/Deadpool!,me3za3
h7a0mkv,I know this comment is old but I watched it for the second time last night.  It was even better the second time,me3za3
hxwg5on,"This hits the nail on the head as to why I liked it so much. Just non-stop brutal, fun action that doesn't have to 'make sense'.",me3za3
guoku0g,"Say what you want about Ilya Naishuller, but he always gets gore and action right",me3za3
guq0v49,"I sort of took this fight as Hutch shaking off the rust.  He was clearly out of practice at first but as the film goes on his skills become more and more dialed in to what they once were.  
  
I also really loved that, for once the wife wasn't just clueless and in the dark.   She knew who he was and accepted him for it and supported him, going so far as to patch him up when he came home wounded.  I thought that was a nice touch, to have the family be on board instead of just being an anchor dragging the character down.",me3za3
gse94el,"Yeah, that scene was amazing. 

I enjoyed the whole film, but I'll admit that I'm kind of disappointed that it quickly became an over-the-top action comedy where the main character could single-handedly go to war with the Russian mob.",me3za3
guww66f,Yeah was very reminescent of Jackie Chan movies,me3za3
gusvk99,Then miraculously not be stiff and sore and unable to move rhe next morning like a real 55 year old man,me3za3
gv0goeg,"You should watch The Raid 2, my bro",me3za3
gxormg8,I liked the first third of the movie. It felt grounded. The bus scene was good. After that it really went off the rails. Nothing that happened made any sense. For me it would have been a really good movie if they kept going with the first part of the movie. Not sure why they went over the top all of the sudden. It was very confusing like it wanted to be a Wick movie but somehow made it even worse than that. Odenkirk was amazing so that was the saving grace for me.,me3za3
hut2bh7,I'm glad someone else noticed this. I liked how realistic it was. And then there was a scene where they came to his house. They look like he was kicking older asses and he was going to win easily but he got caught. Out of nowhere the girl came out with the taser and got him.,me3za3
gsdo85e,I think the scenes were well insanely good too. A ton of people probably missed that flick with the sniper,me3za3
gshikto,dang I missed the recoil hit part,me3za3
gsjs73z,That kicked ass.,me3za3
gv3evjr,Did you catch the mid-credits scene where he is bragging about the triple headshot to Christopher Lloyd's character and he doesn't believe him?,me3za3
guox1v0,OOOOOOH BABY,me3za3
guq0y32,There was a double headshot too earlier wasn't there?,me3za3
gsdkxhw,"this is identical to me.  bought the tickets when i saw bob odenkirk lead in an action and that was all i knew.  also first movie in theaters since pandemic started!

loved it as well, movie was a blast.  especially the bomb at the end, that had me giggling.",me3za3
gshly5u,Such a perfect soundtrack.,me3za3
gsvb7ng,Great soundtrack too,me3za3
gusutdj,"Damn that movie was entertaining.  Yes, the plot was predictable, the story rehashed, and the trail of bodies ridiculous but SOMEHOW IT ALL WORKS.  it doesnt try to be something its not.  You get five minutes of set up then its buckle up kiddos.  And to think....312 Russians died because that girl forgot she eft her kitty bracelet under the couch.",me3za3
hu296fg,As a diehard Chelsea fan hearing YNWA had me sighing with disappointment lol but overall I loved this movie,me3za3
hy5x741,YNWA?,me3za3
gsdjmqf,I'm mildly shocked that Christopher Lloyd made it out alive. After the nursing home surprise I expected him to bite the dust in the climax.,me3za3
gshludl,They were awesome.,me3za3
gsdkqpz,it IS christopher lloyd!  just got home and forgot to look it up to verify.  i didn't even recognize him until the fight at the shop.,me3za3
gtw4m0y,I didn't get that. Why was the pizza box holding up the garage door?,me3za3
gxkouuf,Also like why not just leave the trash out the night before?,me3za3
gvr1bzn,"I mean, that's what children are for, and for being the Boogieman he sure sucked at menial tasks",me3za3
gse8zaz,"The movie seemed pretty damn serious in the beginning, showing the brutal consequences of fighting. But as it went along it became totally over the top and fucking hilarious. 

Seeing Christopher Lloyd blow two men away with a shotgun and then strangle one while pretending to be senile made me laugh harder than I have in a long time.",me3za3
gsqe0ws,Him showing up with 10 shotguns was just wonderful.,me3za3
gurnppi,This was exactly me 🤣,me3za3
guxo78w,The amount of shotguns he had was my favorite part,me3za3
guxlz0p,Thanks for the chuckle,me3za3
gupd1mk,You’re somebody.,me3za3
gvf29m5,"Mitch Hedberg, that you?",me3za3
h0z1k1k,"Ah but because he was a somebody pretending to be a nobody, you can be a nobody pretending to be a somebody.",me3za3
gsdn9f0,"It seems like they will, the wife said we need another basement",me3za3
gshm443,"Just saw in an AMC , thought it was great . Hope it gets a sequel",me3za3
gslw9vd,Is it streaming?,me3za3
gshlxdq,That’d be great.,me3za3
gvf0zfo,In the Conan needs a friend podcast it definitely hinted at a sequel and that was definitely an open ending. It would be kind of cool if it’s tied into the john wick universe even if it’s just subtle like somebody referring to the boogeyman or vice versa somebody referring to the auditor in the wick universe,me3za3
h0z06mz,"No, I expect a Trilogy at least! End scene makes it clear he was back in.",me3za3
gshlw3c,A very very violent Home Alone.,me3za3
gsmxhtr,I guess you never saw The Equalizer?,me3za3
gsf113n,so they went the Rambo 5 style? First starting him being kind of a John Wick and then being Home Alone,me3za3
gveygmn,The writer of Nobody also wrote all the John Wick films (and the upcoming ones as well) [https://www.imdb.com/name/nm4401003/?ref\_=tt\_ov\_wr](https://www.imdb.com/name/nm4401003/?ref_=tt_ov_wr),me3za3
gvuebs2,A History of Violence/ John Wick/ Breaking Bad and American Beauty all mashed together,me3za3
gvyni4m,His end move with the claymore rocked :),me3za3
gsdxxev,That triple headshot made my jaw drop.,me3za3
gvqdxaw,"It wasn't nearly as good as john wick 1, but leagues better than 2 and 3.",me3za3
hcl6h9u,using sniper in close quarters... and that weird shot with twisted wrist would destroy his arm,me3za3
gslkhjg,His acting on Better Call Saul is phenomenal. No surprise that he can carry a movie,me3za3
gsmu8cw,Dude exactly it was a good movie but just inconsistent. LOVED the bus fight but just felt like how do we go from that to Nobody just having target practice on endless goons,me3za3
gsjsfvd,They did kill a lot,me3za3
gv7qo28,"Not really, everything was amazing until the final 20 minutes. God awful compared to the rest of the movie.",me3za3
gsfcozt,I really miss Michael Ironside’s Sam Fisher Splinter Cell voice acting.  The replacement was obvious.,me3za3
gsdj3fb,It was shocking not having subtitles after watching every movie with them at home for so long. I really didn’t know half the things Christopher Lloyd said,me3za3
gsfex9w,He turned into Wilford Brimley.,me3za3
gshbg67,"Wick, Nobody, Atomic Blonde, and RED (those actors did some great stuff and just need a better movie) assassins universe movie!

The big reveal would be that it's Joan Cusack's character from Grosse Pointe Blank that brings them together.",me3za3
gt6bgc4,Tbh I also had problems understanding some of the things the main villain said because of how thick his accent was.,me3za3
gutntam,Legit thought it was Stacy Keach at first and thought he looked great for his age.,me3za3
gtdjtie,He looked like he was having loads of fun.,me3za3
gup26p8,When I saw thar the first thing that came to mind was that the director definitely played call of duty lmao,me3za3
gxudqpn,I thought he was gonna kill himself too when he did that,me3za3
hxjxkvd,Has to be a reference to the old “oh baby a triple!” clip!,me3za3
gsfurbi,"I noticed, they didn’t feel as over the top as the John Wick fake Russians. This was directed by a Russian person so makes sense",me3za3
gstgw01,How many black russians have you met?,me3za3
gslku9l,Its something in their eyes that sets them aside for sure,me3za3
gvyyljn,"Yeah, hearing a ""Ладно — Прохладно"" interaction in a Hollywood movie is kind of a dark magic (and I won't even mention Christopher Lloyd murdering Шнур)",me3za3
guw39rq,"On the bus scene, I'm pretty sure I heard one of the guys saying ""I broke my nose"" in Polish ""Złamałem nos"" instead of Russian ""Я сломал нос"". Did you hear that too?",me3za3
gvugf2u,"deff with the eyes/ eye and eyebrow region has a “russian” look to me. but maybe i’m a racist? 😔 

the portrayal of russians in this movie were fine imo they didn’t appear to have fake accents and didn’t appear to be the normal “russian mob trope” some of those tropes were in the “background” but the actors and performances themselves felt easter european/russian (i know russia is asia)",me3za3
gvskdld,Is this a Russian bot?,me3za3
gseald2,He was in the military as mentioned during that breakfast scene. Perhaps it was a unit tattoo that everyone outside the unit heard stories of without actually *knowing* what they do.,me3za3
gsiy47g,"That old frail Vet had the eyesight to catch that it was a 20 year old expired badge despite Hutch only flashing it for a split second. And typically when an old man backs away from a fight younger tough guys chalk it up to age and press on. His three giant buddies instead freaked out when he retreated and they instantly surrendered.

I took that to imply he wasn't just a typical gulf war vet and was probably in a special operations outfit himself, where fleeting rumors about a unit of people like Hutch might make rounds.",me3za3
gu43nsl,Agree.  That was my first thought too.  Especially when he used the unusual tattoo to track down the burglars in the first place. Still... I loved the movie and it was the perfect comeback for me as this is the first movie that I've seen in the theatre since Covid. I left the theatre smiling and am really looking forward to going back to movies more often!,me3za3
ha4ly3s,It was actually a desert storm veteran.,me3za3
gvujmg7,"uhh that guy was far too young to be a vietnam veteran imo

but using logic, to be a “super spy” (it seemed more like he was just a clean up guy/last course of action) he would have had to have prior military experience to even be considered for that role. 

it was a quick and effective way to show that the character is more then he appears. someone “who knows” is quickly acknowledging that the symbol represents something “bad” 

“super spy’s” don’t go to college to become a super spy. for the most part they usually are selected from military for many obvious and not so obvious reasons. especially for roles that involve heavy action",me3za3
gsmzgw9,Does anyone know which painting it was he was carrying around in the end? Is it real or fictional?,me3za3
h027an7,did they ever show him giving that bracelet back to the daughter?,me3za3
guogt60,"Then the trilogy can end with ""Nobody's Home"" and finally a spin off mash up movie ""Nobody's Home Alone"".",me3za3
gvehwsq,"I think it'll be called ""Unknown"" since that's who was calling him",me3za3
gu7suqg,That lasagna looked damn good.,me3za3
guq0ybp,My girlfriend yelled the exact same thing ! Are we the same person ?,me3za3
h7n7f92,I was legitimately pissed he didn’t toss the lasagna and some forks into the basement with his family haha,me3za3
ic43578,"I was like, please let them finish the lasagna first before attacking the house.",me3za3
gzj9lk1,I actually lold at that and i feel like i never really lol at movies that often. Awesome choreography.,me3za3
htobp28,"I can’t imagine Lloyd having many more years of acting in him so if they’re going to sequel, they’d better rush it.",me3za3
gsejixg,[deleted],me3za3
gsdjvw7,I was reminded of good vintage Bruce Willis when I watched him. It was great.,me3za3
ia9g3x7,He was awesome and 🔥in this film. 😍😍😍😍,me3za3
