comment_id,comment_body,submission_id
gvvess2,"I have to mildly disagree.

If he really was yearning to turn on the faucet, he wouldn’t have hesitated based on the fact that the gun the burglars had wasn’t loaded. No cop or jury would have faulted him for an off label use of a five iron.

I don’t think he really lost his discipline until everyone and their mother disrespected him.

It’s possible we completely agree and I’m just misinterpreting your point.",me3za3
gv1nqjd,"Yeah the USP45 and then the conspicuous close up of **9MM** really stuck out. How did the continuity editor, director, script supervisor, props department, and the editor all miss that? It would have been trivial to reshoot or fix in post or just cut.

>gun realism is wick's thing

Eh, to a point.

The suppressor scene in JW3 is peak Hollywood cartoon gun nonsense.

All the bad guys have terrible marksmanship. Even stormtroopers aim well enough to need their shots deflected by light sabers every once in a while.

Wick gets credit for gun realism, but the only gun realism is from Wick himself. And then there's the plot armor that Iosef wears that turns Wick from a crack shot who can down 15 dudes with face shots in 2 minutes, but can't even wing Iosef when he's running away? I get it, it's *so the movie can happen*, but it seemed cliche.

Don't get me wrong, I very much appreciate the attention to detail they put into Wick, but it's still a comic book level of realism.

Lastly,

>I dont agree with comparing it with john wick.

The [same screenwriter](https://en.wikipedia.org/wiki/Derek_Kolstad#Films) wrote the Wick movies and Nobody, and if you take a look at his filmography, literally every script he's penned is about a lone wolf, who happens to be a former operator of the highest order, who is wronged by organized crime and goes on a revenge spree. So I think it's more than fair to compare the two.",me3za3
gtotcro,"I loved all three Wick films, and it’s the same writer so...? What? It’s John Wick starring Bob Odenkirk. It’s the same fucky pseudo realistic fun. Relax your taint, it was a fun movie even if it’s as far from original as it gets.",me3za3
gvoe51d,A movie that you didn't like getting praise doesn't have to be astroturfing mate lol. The movie has got good critical responses too,me3za3
gslf6zs,"Haha, try copy-paste ""Комбинация Бухгалтер"", I have it on Spotify!",me3za3
h7a29le,"I went on Youtube and the first thing I typed (Russian Song from Nobody) gave me the exact result I wanted. Then again, this wasn't four months ago, so. . . .",me3za3
guvlnyn,"I watched one of Ilya Naishuller's IGTV podcast, he said there about the reference",me3za3
gz0z6go,Also a valid interpretation given his basement collection.,me3za3
gvfkb4g,Apes strong together,me3za3
gsiww53,I think it's implying they're going on another mission (the call at the end) potentially setting up a sequel.,me3za3
gu502r2,"Why are you making excuses for lazy writing? There’s plenty of good action movies out there, this just isn’t one of them babe",me3za3
gx38cn4,"Don't know if you turned it off before he talked about or if you just didn't pay attention but he literally says that he tried everything not to be that person anymore but every small escalation provoked the other side in him to come out again.

His family also didn't know anything about his past or his skills and he didn't want them to know, so letting two small thugs that steal a few bucks and a watch go was worth it to hide his past in his opinion.",me3za3
gw7vzg2,Especially knowing the gun wasn’t loaded. I agree.,me3za3
guvxam2,"Oh shit, I knew he looked familiar!",me3za3
gsiqmh3,Idk why your being downvoted. Hardcore Henry is one of my favorite action movies of the 2010s. It’s a classic in my friend group,me3za3
guxmwj7,Every post on this thread is someone's opinion bruh,me3za3
gslgh5t,"I wouldn't go quite that harsh, but it definitely was John Wick lite (or at least JW 1), the movie equivalent of that ""hey lemme copy your homework but change a few things"" meme.

Thankfully the changes they did make (family man, more frequently darker humor) made it stand out *juuuuust* enough for me, but while I'd probably watch a second one, it's still nothing more than filler between JW4",me3za3
gtok50u,Fair nuf. I’m a gun nut but no expert.,me3za3
gtdg896,"My assumption is that you saw the same thing I saw, but missed the significance of it.  Tell ne, how do you think things went, right before the fight?",me3za3
gtqy26j,Good luck with that,me3za3
guwv0y3,what's the significance of that tattoo to the military?,me3za3
gsn6kph,"That was oversimplifying the whole events, Johns rampage was clearly deserving. Hutch’s rampage was more like “imma fuck you creeps up”",me3za3
gx8kyep,That's the plot for 80% of Steven seagal movies lol,me3za3
h323tw1,"You never seen someone in an accident and still asked ""What happened?"" Like, the wife knows some shit clearly went down. But some details would be nice to have.",me3za3
h1jv8uc,"But I want Christopher Lloyd, not someone playing his character in his youth.",me3za3
hay6kna,Nice catch. I had completely forgotten about that.,me3za3
gvsc3nt,"It was the part where bill was like ""kill"" or whatever",me3za3
gv6fc3f,Lol I was wondering why he looked familiar,me3za3
i2ha5jz,its the FAKE DEAN guys.,me3za3
h4uus0o,I think that was Saving Private Ryan actually.  Not sure if Band of Brothers showed much if any of the beach because they were paratroopers sent behind enemy lines.,me3za3
hppkq5z,">  I get the annoying feel; however; how about Spielberg not adding Polish subs to the D-day landing scenes in Band of Brothers for historical accuracies (normal viewers probably mistake it for german when they claim “we are not german, we are prisoners dont shoot us please we havent killed anyone but germans!”

Not knowing was the entire point of that scene though.",me3za3
h79za5b,"It means _yes,_ but archaically it can mean ""Not only so, but."" 

""I therein do rejoice, yea, and will rejoice."" 

""I like him, yea, I'm going to marry him."" 

You could think of it like ""indeed,"" or, ""Not only that, but—""",me3za3
gvqvxkr,"So I agree but idk I guess I just didnt find myself laughing out loud for it. It is funny, and it fits well enough.",me3za3
hbrfjf6,Yeah I agree. A few light moments but not funny for me. I think Christopher Lloyd looking badass at the end was also suppose to be funny but it was really just sort of bad ass and cool to see.,me3za3
gv4ve3x,"Yeah I agree. I again really liked this movie but I dont think we saw uncaged tiger. I wish he had been a former gang member instead of a former ""auditor"" and the movie went off that way and toned some of what he could do down a little bit maybe. That way we see the uncaged tiger and him brawling instead of trying to John Wick perfection things. 

Again doesnt ruin the movie but I think it would have been more interesting. I guess the tattoo led me to think it was more gang than government.",me3za3
gxyeuzp,"Little late to the party here but I agree. John Wick is still very much the modern Die Hard that everyone is imitating. Home invasion scene by Russians is officially at parody levels with Nobody and Without Remorse both shamelessly copying it. 

John Wick 2 was entertaining but not as good as the first and I didn't even finish half of 3 before just getting bored. I'm significantly more excited to see sequels to Nobody than anything else in the John Wick universe at this point.",me3za3
gvn8w3g,2 is my favorite John Wick movie.,me3za3
gx3sufw,"For sure. Derek Kolstad knows how to write a standalone action story, but I'm not sure that he knows how to write sequels. I hope he keeps churning out movies like this.",me3za3
gw0ptad,"They seem way more dangerous because unlike the one’s in John Wick, these guys actually had a chance to fight. John Wick very quickly shot them in the head.",me3za3
h14ek7n,no.,me3za3
h4mx93c,Us!,me3za3
gxd4umk,"Yeah I straight up side eye'ed his comment like ""pretentious much?""",me3za3
gv0hibz,“people don’t agree with me so it’s fake”,me3za3
gzg4lgz,Are you implying every adverse opinion is a paid shill?,me3za3
h5nbcrm,"To me its like a porterhouse vs a rump, they're both fucking great but a different versions of the same thing.",me3za3
h79tu0s,[deleted],me3za3
guq09ga,"I also don't really get, 'the plot makes zero sense', it was really straight-forward.  It was outlandish and over the top but obviously this was intentional. The story itself made perfect sense.  Sometimes I think people just say things and hold up these vague phrases as blanket criticism without even thinking about it.",me3za3
gusvbys,"Loved that.  Introduce the black russian, aet him up to be the movie badass....kill him in a car crash five minutes later all justbtpbset up the ""I get that a lot"" joke",me3za3
gwgrido,">realism(bus fight)

lmfao",me3za3
h38dnhz,Haha,me3za3
h0yzxru,Right? If I were a brusier in that room I'd be thinking twice about a fight off that reaction alone.,me3za3
h366r00,"I think the writer was aiming for that to be the ""fooking pencil"" or ""John Wick is the man you send to kill the Boogeyman"" moment. Same effect but in an intentionally funny and over-the-top way.",me3za3
h3zuqsm,"Odenkirk answered this in an AMA when it came out, something about being the worst possible hand in poker or blackjack or something. As in, he can be dealt the worst hand and still win.",me3za3
h3pck3i,"I don't know what means, esoterically, but its a signal Odenkirks character was some kind of special ops cleaner.

If you see someone with that tat come into your dirty business, it means death. That's why he noped out.",me3za3
gz01mbl,This is absolutely not true lol,me3za3
h36s8od,thats deep,me3za3
h14dtj7,"They made it clear she did know about his past, but maybe not in vivid detail.",me3za3
gy65oa8,With a touch of Force Majuere and Falling Down.,me3za3
gsz0n9t,"I loved the ending battle. I thought it was very well done even if it didn't make sense.

Maybe it's one of those movies were you just gotta turn your brain off, grab some popcorn and enjoy the ride.",me3za3
h3p5470,"Agreed, they shouldve made him a sniper from range, even though the close quarter rifle only (imcluding 1 shot 3 kills) was a cool flair touch",me3za3
iigwnqq,The pinky finger in between the firing pinion was the coolest thing in the movie. Hands down.,me3za3
guwsilr,Still better than Robert de Niro „beating“ that shopkeeper in The Irishman 🤷🏻‍♂️,me3za3
guwy6cm,"> but seeing Christopher Lloyd continuously mow down 10+ young Russian killers at over 80 years old was a bit much

That was bad but the triple headshot was the worst to me. Pointless and ridiculous.",me3za3
gv0sp7m,"Last Samurai, Judge Dredd, and The Rock with Nicholas Cage and Sean Connery. 

Anytime they’re shown on TV, I watch them all the way thru.",me3za3
hm4m0eg,I just finished watching the film: I busted out laughing when that happened. It looked like the actor actually took a chair to the face haha,me3za3
hut3nfz,It's a triple double.,me3za3
gseh5nk,exactly lol,me3za3
gv1wrn5,It is kind of remarkable how similar he looks to how he looked *thirty six years ago* in BTTF. It looks like he's aged maybe a decade.,me3za3
gsic86s,"Only thing I've seen him in is back to the future and he had frizzy white hair. 

He had no hair here and looked much older. 

Apologies for not recognizing him /s",me3za3
gtkuxiv,"""No, this guy's either like forty or eighty""

https://www.youtube.com/watch?v=7vkXvl5_MIc",me3za3
gus5gm2,Michael Ironside looks like shit tho,me3za3
gu82h6y,His mole would give him away in a dark room.,me3za3
gu6jd5l,Fair enough. As soon as it’s streaming I’m all in.,me3za3
gw77349,Yep,me3za3
h7n6yxa,"If you rewatch that scene, Bryan Cranston does a double take because even he wasn’t expecting to land the pizza on the roof like that haha",me3za3
hbjhcxw,Not fully decked out. The woman had a gun that wasn't even loaded. Just a desperate couple trying to seize the opportunity.,me3za3
h14f3rq,Hutch vs rocket would be a good fight,me3za3
h0z09ez,Wow amazing facts thanks,me3za3
gstaqsz,Nobodies,me3za3
gvm6zc1,Nobody I Used to Know,me3za3
gwqqpn9,Or probably his son since he tried defending his family during the break-in,me3za3
gsp38qb,"Ah. No, traditional VOD. I don't think it's on a streaming service.",me3za3
gsv4rfz,Only WB films are getting HBO Max treatment.  This was Universal,me3za3
guqq5la,Nobody is from Universal and Mortal Kombat comes out next week.,me3za3
gt77s4r,[coughs in Skyfall],me3za3
guunsou,That movie is exceptional,me3za3
gv04tnn,"It was FN 45, not FiveseveN.

&#x200B;

The movies did feel like a commercial for FN and HK, though.",me3za3
gusnfgb,that was not a five seven in the movie but same company,me3za3
gwm6ked,">Five-seveN

You might've confused it with the flashback when Nobody was telling the story?",me3za3
h14enbc,This.,me3za3
gveonq8,"First we had Ben Affleck as the Accountant, now we have Bob Odenkirk as the Auditor. Brb, I'm writing the next big action movie starring Jason Statham as HR.",me3za3
h14f3fc,It describes the situation you're in if you have a run in with him.,me3za3
gupek7a,I also loved when the hacker chick threw the info at the boss and was like fuck this shit.,me3za3
guxvfcs,Reminded me of the scene from Faster where the Samoan guy sees the Rocks “ghost” tattoo and just runs away.,me3za3
hv0snil,"exactly why I love it more than John Wick, the Baba Yaga speech took me out",me3za3
gu3geum,"It's The Bedroom. Very well-known piece. There are three versions, one in Amsterdam, another in Chicago, and another in Paris.

I noticed in the movie when they explained the Russian money stash that Yulian had one of Van Gogh's self-portraits hanging up. You could imagine like in real life that they had a huge art supply to store value, and the movie used Van Gogh for audience familiarity and humor.

And based on some other sales in auctions, that piece Nobody was hauling around would have gone for *at least* $80 million, probably more.",me3za3
gu42izc,Room at Arles,me3za3
gvcju1v,What do you call a starving Art History major?,me3za3
gyropd3,"All three versions, unfortunately, are accounted for.",me3za3
hv0t13a,50% of r/movies users have never been loved,me3za3
gsr0tz3,"They weren’t driving they were riding a bus. 

What did we see to indicate they were going to do something horrible to this girl? Other than them being drunk pricks?

No one is debating they were assholes.",me3za3
h0w0ekq,"It wasn’t apparent. That line gave the audience some indication that those guys were willing to harass that girl, but it was already way earlier when those guys were standing in front of the bus ready to enter that Hutch had decidedly (can we infer from his internal monologue) to go absolutely ape shit on those guys. At that moment there was no reason to believe those guys honestly had it coming. This justification was only given after the fact, until then they were only a bit annoying, but that can’t be a justification to go complete psycho (and yes, Hutch is a complete psychopath).",me3za3
h464xnt,[deleted],me3za3
gxqkd93,"He was crossing his fingers praying that they chase after him. That's why he was happy when they showed up. Why do you think he didn't drive off instead of praying?

If it wasn't proof enough. When during the car chase scene the bus blocks off the cars chasing him, he gets frustrated.

He 100% enjoyed it and wanted more.",me3za3
gxcnq76,I liked them not using actual rape as a catalyst.,me3za3
h79zn7t,"> He has his fingers crossed, he hopes they do, but he's fully equipped to deal with them if they don't.

On second thought, I think he was praying they _do._",me3za3
guszy8v,"Late reply but you took that scene completely out of context and it was actually a very good scene.

Hutch : you came to my house! you don't do that (referring to cliche of criminals dont touch familys which is complete bs btw in most cases.

Yulian: but you killed my brother

Hutch: He was still alive last time i checked (he was) and he kinda deserved it

Yulian tilted his head half agreeing (earlier in the movie one of his goons even says that Yulian hates his brother but Yulian replies ""you don't pick family""

The movie was not portraying your usual ""haha Russians bad"" they were actually being portrayed as Russian Mobsters just way more over the top than in real life.

The whole movie pointed to the fact that Hutch isn't a ""good guy"" Actually the opposite the kitty cat bracelet scene was basically showing that he took the most minor thing to heart just so he could justify about going back to killing which is why in one of the scenes RZA calls it ""I'm glad your relapse made you feel so good""

There is absolutely zero good versus bad in the movie, Hutch was trying to live a normal life but he was struggling with not doing what he did best which was murder and it's very obvious that Hutch isn't just an average joe but probably a psycopath or one of those similar ones, sociopath maybe not sure which one fits him the best.",me3za3
gw0l7y3,"Dude, the director is Russian, I think he gets much more of a say than you about how to portray Russians in his movie",me3za3
gyrp8sb,"He didn't say Russians sucked, he said that he left him alive and that he, in particular, sucked.",me3za3
gyrpe1b,"I think you're expecting this to be Breaking Bad, and that's not at all what it's trying to be. It's not a morality play, it's a movie about a psychopath trying to be normal and it not working on any level.",me3za3
gz8dioq,Women are not inherently good people. I'm fairly sure the wife likes the fact that he's a psychopathic murderer.,me3za3
h7a0d1h,"> If this was about how psychotic the man was, his wife should've left him and took the kids after he admitted he was unfit to live a healthy life with his family.

She doesn't _leave,_ but their relationship is obviously on the rocks, and it's so normal for a bad relationship to last for ten, fifteen, twenty years, just coasting.          
He mentions to the dead men, ""I may have over-corrected.""           
He was SO ""normal"" that he became boring and miserable. I think that, at least, is portrayed well enough.",me3za3
h7a0hwh,"It's showing that he is so entrenched in trying not to be anything close to his old self that he becomes a milquetoast, and loses the respect of his son, among others.",me3za3
gsir1wl,Almost a doctor,me3za3
gtst0e0,And a porn star on Curb.,me3za3
h14g8a1,This is the knocking song!,me3za3
gvvgvlj,"Let me expand a bit on my Dexter comparison. With psychopaths they know what they want is ""wrong"" in a moral sense, so they set boundaries, give themselves permissions so they can rationalise their actions. For Dexter, that's his code, he verifies someone is a serial killer, then waste them.


For Hutch, that permission is the person has to ""deserve"" it, then he will allow himself to flip from civilian to operator mode. Because he knows the gun was not loaded, then these aren't hardened criminals prepared to kill, so he couldn't cut loose like he wanted.


He did a reverse home invasion because his daughter lost the kitty bracelet, and in his mind that justified breaking and entering, but once there he ran out of excuse to go one step further because the couple had a sick baby, so they were more sympathetic in his eyes. Hence the frustrated wall punching once he got out.



In short, I don't think it's about justifying his actions to the justice system, it's about justifying them to himself.",me3za3
gv1opll,"> The suppressor scene in JW3 is peak Hollywood cartoon gun nonsense. 

i mean, it gets more comic booky as the movies continues to get made, but would still call it some of the best representation we have so far...

> The [same screenwriter](https://en.wikipedia.org/wiki/Derek_Kolstad#Films) wrote the Wick movies and Nobody, and if you take a look at his filmography, literally every script he's penned is about a lone wolf, who happens to be a former operator of the highest order, who is wronged by organized crime and goes on a revenge spree. So I think it's more than fair to compare the two. 

fair enough, but still bothers me a little even though i cant put finger on why aside from saying that wick feels more grounded even though both movies have the same level of one man army absurdity...",me3za3
gtp35yg,I’m glad you enjoyed it,me3za3
gslnbhq,Duh! You rock. I’d give you an award if I could. Have a great rest of your day!,me3za3
gu6pcf9,"Wait.... 81% tomatometer, 95% audience score, 7.7 on IMDb...

But random redditor says it’s bad.. who’s right here?",me3za3
hvvtjmz,">His family also didn't know anything about his past or his skills and he didn't want them to know, 

Except when his wife is patching him up and saying 'just like old times'",me3za3
guvxeee,Guess he finally got some work beyond being a Moby impersonator lol,me3za3
guxnpq4,This right man,me3za3
gu4y31v,"Really? The world of John wick has become ridiculously convoluted. The stripped down origin-story feel of this movie easily beats the overly busy plot of John wick 3. I love all actions movies like this, but I’ll easily be revisiting Nobody before I have the urge to watch JW3 again",me3za3
gtom6xv,I think I just had a better view bc i could see where it said USP on it lol,me3za3
gtdgwot,"I saw them crash a car, get on the bus, knock a book out of someone's hand, then sat down next to the girl. I think they said something to her, but I don't know what it was.",me3za3
guxeozc,"It's the worst possible hand in Texas Hold-Em, so it means that if a guy with that tattoo shows up at your door your luck has completely run out. It's not a real thing, just a fun detail for the movie.",me3za3
gsn9y6r,"There are thematic differences between the two, yes, but the story beats are very similar. You can't deny that. Nobody doesn't have to be a 1:1 comparison to be clearly inspired by John Wick. And for the record, I don't think the plots being similar hurt Nobody. I really liked this movie.",me3za3
h1k0rpm,True. CGI de-ageing?,me3za3
h4wcjd7,Could very well be that I mixed up the titles.,me3za3
h7bjqkl,"I'm pretty sure for most people who use ""yea"" today it's just slang for ""yeah."" If you know that, there's not any reason to correct someone for it.",me3za3
h79zf5c,"I don't think it's a weird take at all. I laughed the second time it happened, but I also had a pang, seeing the lead's visage.",me3za3
gv4wy26,[deleted],me3za3
gw1d3uv,Also the M4's vs just pistols helped.,me3za3
h4mxssh,Us!,me3za3
gv0jx4c,Where do you think marketing spend goes?,me3za3
h7a486j,This movie pales in comparison. That's all.,me3za3
guqj6oe,[deleted],me3za3
gw55q4c,"Late to this thread but this comment resonated with me so much. I hate how many vague phrases are thrown out that don't hold any weight whatsoever. Shit like ""nonsensical plot"", ""bad writing"", or ""style over substance"" a lot of the time it's personal preference masquerading as some objective critique.",me3za3
gwgunjq,"As in exhausted, tired, fighting.",me3za3
h0z3spi,They all did step down to be fair. I just couldn't stop laughing this movie,me3za3
hbjgz4m,2-7 offsuit is the worst starting hand in Texas Hold 'Em,me3za3
h3pillq,"Best guess I’ve had so far, guess we’ll find out in the sequel, last scene and after credit scene point out they kept that option open",me3za3
gz03rfh,"As someone who's done a fair bit of boxing, it absolutely yes. You don't want to throw yourself into a punch, but if you're not going to be able to get out of range, you want to absorb it on your terms.",me3za3
guo3yo3,"Usually I have difficulty removing myself from the absurdity of some things, but somehow my brain just did it automatically for this one. I laughed out loud multiple times in the ending and loved the way the final kill went, very unexpected.",me3za3
gvwesol,"This is always the perfect excuse for something being unrealistic dont question n enjoy. 

Battle was stupid if you think about it though",me3za3
h79yypp,"Why did you put quotes around the word _beating?_ Are you saying that he didn't beat him, or. . .?",me3za3
gv2z6vm,"""It's you. *You're* the Rocket Man.""

Fucking great movie, before Bay went completely off kilter.",me3za3
hm8ep17,"It's one of the more brutal hits in the movie, it's great",me3za3
h14e15t,Watch those movies again. He has aged a lot.,me3za3
gsicm0t,We're just kidding. He does look different but I was mainly joking about how he is old as hell now and looked old as hell in the 80s too.,me3za3
h44f5vb,Yeah man no kidding. I did a double-take. Had no idea he had gained that much weight.,me3za3
h14e57r,It's streaming now.,me3za3
gucgzby,Nobody 2: Electric Boogaloo,me3za3
gwtneqg,"Plus, we can actually get some details on the “Nobody” origin story.  I know the bad guys fell asleep or died when he tried to explain it.  But damn...I want more details.  Maybe the second part involves the family more.  I’m curious for the sequel",me3za3
gwmqoun,Which is fine by me. Quality guns.,me3za3
gwlyn4f,"""Your PTO request has been, *throws guy through a window* denied.""",me3za3
gvj9fwd,Bruce Willis could be the secretary.,me3za3
gxcn0nl,That was Person of Interest,me3za3
i1zx5cz,The milk maid of Vermeer was up there as well. Saw several familiair pieces (which are in museums and not in some Russians room. Because it belongs in a museum!),me3za3
gzl7spv,Baroque,me3za3
gsubd7o,"> They weren’t driving they were riding a bus.

...after getting out of a car that they crashed because they were driving drunk.",me3za3
gswf3e6,The indication that they were going to do something horrible is when Hutch gets back onto the bus after escorting the driver off and the thugs are mid sentence saying “a girl alone on the bus at night”,me3za3
gup03ub,Did you pay attention to the movie?,me3za3
gsrbjim,[removed],me3za3
