comment_id,comment_body,submission_id
gsdzdw1,I loved the part where he kept trying to say his backstory to people and they'd just die,me3za3
gsdep8v,"Bob Odenkirk, Christopher Lloyd, and RZA are probably the strangest action combo I can think of.",me3za3
gsdrd8r,"It’s going to be hard to beat this movie. 

It’s John Wick for the tired working class. It throws realism out of the window, and replaces it with hilariously over the top spectacle and set to a better score somehow. Odenkirk is father of the year. 

It’s like the perfect “mediocre” movie, but it does everything better than what came before. It’s violent, stylish, there’s even some brutal gore. Don’t even get me started on the comedic timing. It’s amazing. Not mediocre at all. 

There is no: “all hope is lost moment” everytime you settle in for the familiar it says: “fuck it” and has more fun. Tropes are introduced but cast aside. It never stops. It’s just great. 

Didn’t know what to expect, but with the intro I assumed it would be soooo subpar. I was very wrong. What a great movie to return to theaters for. Watch it. Watch it twice.",me3za3
gsdvqk9,"Finally, a fight that is actually anything but one-sided. That fight on the bus was amazing. Nice to see how limited space can’t keep one from getting hit, no matter how skilled he is. He was punched, stabbed, kicked, and thrown out of a window. Nice to see the hero take some damage for a change.",me3za3
gsdjgbq,I loved the final sequence. RZA's triple headshot was great as well as when he shot the rifle backwards over his shoulder and let the recoil hit the guy in front of him.,me3za3
gsde8jx,"Loved this movie. Went in not knowing or expecting anything, got an incredible action thriller that left me feeling exhilarated. Really hope a ton of people watch and enjoy it

Also was lucky enough to see in theaters. First movie since the pandemic. Fantastic

edit: also YNWA was perfect.",me3za3
gsdbryc,All I know is that I need a Christopher Lloyd x RZA buddy cop film now,me3za3
gsjlm8b,All of this could've prevented if the wife or kids took the trash out every once in a while.,me3za3
gsdo48e,"I’m not sure if it was just Bob Odenkirk doing crazy shit, but this movie had my dying laughing. Each kill got more insane and when Christopher Lloyd came out at the end to save him... tears. Amazing",me3za3
gsw5s3a,"I thought it was okay. I went to go see it because it was called ""Nobody"" and I'm a nobody. But in the end, it turned out he was actually a somebody, so I couldn't relate to it anymore.",me3za3
gsdf4vj,I loved it. I hope those who can’t make it to theaters discover it on demand. I hope it gets a sequel.,me3za3
gsdg4q0,It started out as John Wick and ended up as Home Alone.,me3za3
gsdudhw,"RZA's sniper beatdown was epic. I loved that recoil hit.

It was really quite creative for what I expected to be a John Wick copy- I might even prefer this. Also, Yulian's dancing was pretty fun.",me3za3
gsdsoz5,"This was a lot of fun. I think it works better when it's just Odenkirk brutally beating dudes to a pulp, where all you can hear are the punches and groans and whimpers, (that bus scene got me giddy in a way an action scene hasn't in quite some time) and it falters a bit with the more fast paced gunplay stuff towards the end. Christopher Lloyd is absolutely hilarious though.

Odenkirk has proved that he's a more charismatic and cooler action star than most acting today. Really would love to see him do more work like this.",me3za3
gsdhi97,This movie is fucking awesome. Christopher Lloyd's character was amazing. Bob Odenkirk and RZA killed as well. I need a sequel.,me3za3
gsdga9y,"Michael Ironsides got big, I couldn’t understand Christopher Lloyd, that fight on the bus was awesome and I want a Nobody John Wick team up movie.",me3za3
gsk6hq8,That scene where Christopher Lloyd's character pretended to be asleep when the thugs got into his nursing home room but was ready with the shotgun was pretty awesome!,me3za3
gsjh9a9,"How is nobody talking about that absolutely ridiculous amazing claymore kill at the end? 

Also I feel like the triple headshot had a very call of duty esque vibe to it. Loved it!",me3za3
gse4xog,"Saw it tonight, enjoyed it a lot. Bob and the other cast are awesome.

Also, the timing's perfect, 1,5  hours went pretty quickly.

As a Russian, also liked to see real Russian actors (their looks, with no accent, real funny speech, etc). Not sure if Americans can tell the difference - let me know, please if it was easier to believe them in comparison to 'fake bad Russians in other movies.",me3za3
gsdqsj3,Great flick!  The only question I have is that if Bob Odenkirk is supposed to be a redacted superspy then why did he have a tattoo on his wrist that was easily recognizable to the Vietnam Veteran?,me3za3
gsdjo87,I’m never going to look at a kitty cat bracelet the same way again,me3za3
gsgtmt6,"I’m calling it!

The sequel will be called “No Bodies.”",me3za3
gsvlmus,"My girlfriend yelled, ""Not the Lasagna "" and it made the movie for me!",me3za3
gsdjnby,Just came out of a drive in showing. Holy moly was this a monster of a movie. Nice sequel setup. Odenkirk was killing it all throughout. Missed big crowdpleasers like these.,me3za3
gsqekbi,When he’s got the wire wrapped around the dudes neck on the bus and every time he punches them the “stop requested” sign lights up. Comedy gold,me3za3
gsdwrwn,Holy shit I never thought I would picture Bob Odenkirk and Christopher Lloyd as complete badasses. A very welcome surprise. This movie was the tits man. Action with some subtle comedy. Odenkirk is a savage man. I hope they make a follow up of this film. Really good shit. Dad Wick is so much fun.,me3za3
gsdbr15,Just saw it tonight. Thought Bob Odenkirk played a great action star. Hope they make more,me3za3
gsddjws,"Overall solid and fun movie. I thought there was a tonal shift halfway through where it did not feel like it knew where it was going. I think the final showdown could have been executed better in terms of understanding where everyone is and not having the cliche back to back shooting. That is my only critique. Overall, solid 8",me3za3
gsdedsz,"Just got out. Solid flick. Nothing outstanding or groundbreaking but I felt it was a nice, fun adventure. The action was definitely the standout. Just felt nice to watch after months away from theaters.",me3za3
guohqi4,"""Give me the goddamn kitty cat bracelet motherfucker!""
I enjoyed it quite a bit",me3za3
gsym4sq,"Breaking Bad Call Backs:

Pizza Box in the Garage/Pizza on the Roof duality

Broken Plates

Automated Guns

Breakfast with the family.

His origin story is basically Mike's Half Measure's story with a twist.",me3za3
gse1l2b,"The antagonist, Yulian, was definitely the victim. Hutch braindeaths Yulian's son in a fight Hutch purposely escalated. Violence was reciprocated onto Hutch and his family. The Barber gives Hutch intel that Yulian wants out. Hutch guarantees Yulian's demise by burning the Russian mob's cash and taunts him, luring him and his organization to their deaths. Yulian even tells him they could have worked it out if Hutch hadn't burned the mob's money. Hutch wanted to feel alive again by committing a massacre. And he nearly got his wife, children, father, and brother killed for no good reason. Damn.

Very entertaining, though.",me3za3
gut8hod,"lot's of comparison's to John Wick, especially among critics (and, I know, some of the same pedigree; the screenwriter; Daniel Bernhardt) but if you want to reflect on the difference between these two films in terms of action-comic vocabulary, just picture Wick strapping a @#$@$ claymore to a riot shield and charging his arch nemesis and pulling the pin...

...or picture Hutch walking, looking dapper, in slow motion up to his final kill and just shooting him, like Wick does with Theon.

Both things don't quite work, do they?  John Wick's action isn't any more or less ridiculous yet entertaining, but it's different; Wick is stoic and elegant, where Hutch is a legit bloodthirsty madman with some real sadism to work out.   There's sensual glee in some of Hutch's kills.  He's horny for it.  Wick may have been as well, but it's under the surface.  This makes Nobody more acerbic and weird, even more of a guilty pleasure.  Both films are cut from the same cloth, but quite different in the end...",me3za3
gsve6yn,"The ending was done very poorly in my opinion. The first half of the movie was spectacular, especially the bus and home invasion scene. However, the ending felt like an over played power trip. When the father and brother showed it, it felt like it was a comedic parody on a john wick like movie, instead of a fleshed out action scene. Its an ok watch, would give it 8/10",me3za3
gshkqrb,"My wife and I saw it yesterday and we absolutely loved it. I’ve been a long time fan of Bob Odenkirk and he’s so great in it. He really sells playing a broken, beaten, subservient man with a secret past. The action is great. The violence is a riot. Christopher Lloyd and the RZA are great supporting cast. Overall the movie is fucking fun.",me3za3
gsrmqvk,PSA there is a mid credits scene. I missed it the first time I saw this ;),me3za3
guqabu5,"The WuTangClan, Back to the Future and Better Call Saul multiverse cross ever was lit. Would watch again 9/10",me3za3
gsdfm7h,"Can we just talk about how much of a versatile actor Bob Odenkirk is? He played a lawyer (Better Call Saul), a father (Little Women), and now he's an action star with Nobody",me3za3
guvh552,"Really love how they did a reversal of the broken mirror reflection trope. There's broken glass but you see Hutch's reflection unbroken.

Also had a good laugh when the girl was like ""I have a contact at the pentagon"" then noped the fuck out as soon as she found out who he was.",me3za3
gsdjgx0,YNWA during climatic shootout? Sign me up!,me3za3
gsg5m0f,This is what I consider a good movie. Fucking awesome and I hope we get more!,me3za3
gsdpobd,"I loved it. I expected a silly fun action movie and I got that, but more! Bob Odenkirk did great and I appreciated that the movie didn’t take itself too seriously and just had fun with the action scenes and humor. I would definitely watch again and I would be down to see a sequel.

Plus, the cinematography was really cool too. Some interesting camerawork",me3za3
gteleb5,"So when he promised his family a trip to Italy, was that because he already planned to rob the Russians (I’m assuming he sold the painting) to fund the trip...before they even attack? Lmao.",me3za3
gsr49cw,"I scrolled through this whole thread and only found 2 comments that disliked it. Damn...

I found this movie to be excruciatingly painful to sit through. If we’re comparing it to John Wick, those movies are so self aware of themselves. This movie was...not? It played itself so seriously, but yet had these weird comedic moments that weren’t earned and didn’t even make any sense. 

The 3 of them were able to take out DOZENS of villains effortlessly, but all of sudden the main baddie comes in armed with JUST a gun...and the 3 ran out of bullets THEN?!?!? REALLY??? I mean I understand movie logic, but no. 

This was TRASH writing in every single way!!!!! How are people defending this film? I know the pandemic has our choices limited, but sheesh!!  

To end on a positive note, I loved the beginning showing his mundane life, I liked the home invasion and him doing “nothing” to save his family. I can even fuck with everything up until the bus scene. That was fun. But as soon as the main villain gets introduced, it fell downhill fast.  

I enjoyed the character of the dad. And even the random (adopted and just used so they could have a badass person of color in an otherwise white washed movie?) brother was a fun addition to the last 10 minutes. 

Also the scene of him using the rear view mirror in the car was just eye rollingly stupid.",me3za3
gtagnn6,I just got out of this movie. I think its going to be a cult classic.,me3za3
gsdkx60,"Fun action packed flick, perfect first movie to see back on the big screen post-vaccination.  Looking for entertainment, not an Oscar, and it delivered.",me3za3
gsivfe8,Does anyone know the song that the Russian girl and guy were singing on stage in the club??,me3za3
gsk1f2t,[deleted],me3za3
gse8oqo,I liked the first half of the movie with the semi realistic gore and fight scenes. But once the evil Russian guy shows up the movie feels more like a live action cartoon. The Russian is way too over the top evil and the fights lose all the suspense once Hutch becomes an unkillable superhero who can wipe out hundreds of men without getting injured besides some scratches.,me3za3
gsdqvm8,"This movie was exactly what I wanted it to be, and I left the theater with a wide smile on my face. Fun and action-packed. If you like Guy Ritchie movies, you'll like this.",me3za3
gsix3bu,"Fun flick! If you liked the commercials and trailer, you will like the movie. I read some of the negative reviews, and they were pretty much garbage. If you walk into this movie looking for depth and deep characters with lots of soul searching, you are either an idiot or never did your homework. This is a fun action/comedy, goes by really fast and has some creative fight scenes. 8 out of 10",me3za3
gsdpun4,"Loved this movie. It was really fun, well paced, had an entertaining story, awesome action scenes. Can't wait to watch it again.",me3za3
gshm5z9,Fantastic action flick. Loved the set pieces especially the team up at the end. Killer soundtrack too. Does anyone remember what song Hutch used with the record player to burn down his house ?,me3za3
gsgevng,What was supposed to be in the truck that RZA and Lloyd were looking at at the very end? I think I missed something there,me3za3
gshqu2c,"Wow, a lot of praise for this movie. I thought it was pretty terrible. At least in terms of writing, characters and plot. It's perfectly fine as a bloody shoot'em up, but it fails everywhere else. The characters are paper thin, especially the villain. Odenkirk plays against type as a walking cliche. It lacks any real stakes or drive. Characters make either stupid or nonsensical decisions throughout, just to make those parts of the movie happen. This is a poorly written John Wick copycat.

All that being said, if this film had tipped just a bit into actually being a parody, it could have been pretty great.",me3za3
gundmsr,"The best part of the movie was the little girl.

After they've been robbed, ""We need a cat""

Her kitty bracelet led to the best line in the movie, ""Give me the goddamn kitty bracelet, motherfucker!""

Right before assassins break in the house, ""Is this a game? I like games!""",me3za3
guo4x3f,"So, how involved was Becca in terms of knowing what her husband did? She seemed confused after the panic room/basement scene but before that she fixed up his stab wound with krazy glue.",me3za3
gustw5k,"What the fuck is this movie!?  Bob Odenkirk as budget John Wick who decides to fuck up the Russian mob just for fun?

It wasn't amazing, but it was pretty entertaining!",me3za3
gsdk50r,"I wish this was in the same universe as John Wick. I know not everything needs to be connected, but it would be a fun story. John Wick was apart of the Russian mob, a prequel story could have been his impossible task to kill Nobody after his rampage decimated the mob. A movie with both these guys trying to outwit each other so john could get his freedom.",me3za3
gvbmat9,"My favorite part was when the Russian researcher lady looked into who Hutch was, saw his background and immediately packed her stuff and quit on the spot. Always love when other characters reaction to main character says all you need to know about their skill level.",me3za3
gse4t8n,Wasn’t expecting a doppledeaner cameo,me3za3
gse47di,I havent had that much fun with a movie in a long time. Odenkirk is crazy good and the soundtrack is awesome,me3za3
gslsvqu,"First movie I’ve seen in theaters since they’ve reopened here and I’m so glad it was this. Absolutely loved it. Great action and comedy, and a dope soundtrack too. Definitely wanna watch it again.",me3za3
gu4illk,"I really love this movie. None of Hutch's family and friends were killed and that was a nice change. There also wasn't any sexual content which was a nice change of pace too. It seems that most movies in this genre have someone close to the protagonist get murdered and/or sexual content. Sometimes, it's just nice to see people get their asses beat. The entire cast was great and the cinematography was great too. A sequel would be fine, but I feel like it would also be fine to leave it as only one movie. I would reccomend this to anyone who is a fan of action.",me3za3
gusim69,"The principal photography happening mainly in Winnipeg was a surprise for me. Kept seeing familiar places; hell I even partied in that exact same club. 

Great movie, and I can’t wait for the sequel!",me3za3
gsdn6ze,65 metacritic? Lol. This movie was great. Definitely a 9/10 for me. People who rated this poorly probably didn’t like the violence,me3za3
gsj9958,"A great movie that has Bob playing as Bob, every single thing he does and says has that whole Bob feeling.

We also need to talk about how Bob basically makes little grammar mistakes such as flashback recalls and how there’s a running joke that someone always dies while he’s monologue LMAO",me3za3
gsmvror,The claymore scene at the club reminded me the Joker/Mafia scene.,me3za3
gso2jzg,"Best way I can describe the movie is ""what John Wick wanted to be"", really.

It's just a much more polished movie with less holes and a better understanding of what it is. They balanced the action and the humor perfectly. Also, thanks to Naishuller, the Russians in the movie aren't caricatures.

Really enjoyed it overall! I'd rate it 5/5 as an action, and 4/5 as a movie. It just nails everything it set out to do and doesn't leave any loose threads, even if it's not ""movie of the year"" material or whatever.",me3za3
guyt5ms,"Are there any good writers left in Hollywood? Any at all?

First thing first, why does the movie start with a flash forward? Why would you do that in a movie where the story *already* is as pre-ordained as they come? Are they trying to get rid of every last bit of suspense? The movie sabotages itself in the first 10 seconds. Now you know not only that the character is gonna survive, but also that he's not just a regular Joe. Which ruins the whole first third of the movie because it's just time spent waiting until the character reveals himself to be a bad-ass - which you already know for a fact. Contrast that with a better crafted movie - like History of Violence for example - where you are unsure until the final act whether the main character is a former bad-ass, or if it's just a misunderstanding. 

And really, what is it with this fantasy where a guy is living a quiet suburban life and then some shit happens and it turns out that he is actually a TERMINATOR? Oh, sorry, an AUDITOR. It's a film equivalent of a youtube video titled ""My tuned Supra EMBARRASSES a cocky guy in a Ferrari!"" Once the ""bombshell"" reveal is out, where do you go from there? It's an one act play where the narrative development is always gonna stink and serve only as a paper thin setup for all the action you really want to do - but for which you were too lazy or incompetent to come up with an actual story.

Now, at this point, many of you might say that you don't really care about how shit the story is, you are here for the action. To this I must reply: how very demanding of you, be careful for your standards to not fall through the center of the Earth. But ok, let's discuss the action. Which, oopsie-daisy, is also shit. Funny how your lack of good storytelling principles happens to ruin *everything*, isn't it?

Well, sure, the choreography might be good. The special effects might be good. But that's a very small part of an action scene. I might as well have watched a video of some martial artists sparring, or behind the scenes footage of some dudes practicing and got the same thing out of it. What elevates a movie fight scene beyond just watching people going through the practiced moves, is that it forces you to put yourself in the shoes of the protagonist, it puts you right in the middle of it as if it was an actual thing happening to you in real life. In other words it again - as it always does - comes to immersion. And you know what doesn't help with immersion? You know what doesn't help with making you care about what happens? It's when the main character doesn't care. It's when the main character doesn't care and the movie has already told you that he is gonna be fine by the end no matter what.

If the main character doesn't care if he's gonna get hurt or killed, then why should you care? And how would you care if you know that he won't? I see that a lot of you thought the bus fight scene was brilliant. Well, I don't think it was *brilliant*. It was competently shot and the choreography and the special effects were decent, I will give it that. But because it was completely divorced from cause and effect, from reality if you will, it was also nothing but self-serving choreography. Completely boring. The whole setup with a bunch of assholes just happening to come by when the protagonist feels like blowing off some steam, and then fighting until they are literally unable to instead of trying to get out or cool it off - tedious. Just to make that scene happen, the world is suddenly full of crazy coincidences and suicidal, masochistic psychopaths instead of actual humans. Oh, sorry, just to make *about every scene* in this god damn movie happen. 

By the end it's devolved to a point where it's not really as much the protagonists fighting baddies, as it is extras running like brainless puppets to a spot where they will get their head blown off. Fuck me, what a suspenseful movie. Real gravitas to every scene. It's all really just a meaningless commotion, wasted energy at best, isn't it. Fight isn't just a fight, it's an extreme (and undesired, last resort) conclusion to an existing tension. That's when it is at its most gripping, effective and when the conclusion is the most enjoyable. When the stakes were at their highest. It's not just fireworks and people flailing arms around. It's not a joke, even in a movie with jokes.

Speaking of which - as a last thing to say, I promise - the movie doesn't really know how to marry violence and humor. Or rather, it can't. And that again has to do with the movie and with every individual scene being narratively fucked. You could have dark humor - but dark humor comes as a short burst of relief when in a situation that weighs heavily on you. As we know, the movie has none of that so that option is out. Or you could have comic over the top humor where you intentionally amplify whatever reaction a character might have, or whatever violence there is beyond what a reasonable expectation would be. The movie sort of tries that, but it doesn't work because it's applied inconsistently. In some scenes, it's over the top, in most others the movie tries to present itself as if it was some grounded and ""gritty"" action flick. If you are gonna go for over the top, then it has to be consistently over the top so you know that's the base line. If it's not the base line, then - from the point of the normal base line where people behave like people would - it's just characters randomly behaving crazy for no reason. Which, really, is the opposite of funny.",me3za3
gsdz0gi,"Now I wanna see a movie with Jon Bernthal from Punisher, Charlie Cox from Daredevil, Matt Damon from Bourne, Bob Odenkirk from this, Keanu Reeves from Wick, Jason Statham from Transporter, Daniel Craig from Bond, Vin Diesel from Knock Around Guys, Dwayne Johnson from Walking Tall, Josh Brolin from Oldboy, Tom Hardy from Bronson, Tom Cruise from Jack Teacher, Wes Bently from Yellowstone, Liev Schriber from Ray Donovan, Chris Meloni from Marauders, Mark Wahlberg from Shooter, and Brad Pitt from Snatch, to name a few.",me3za3
gshisnr,"I definitely had fun watching Nobody but there are some caveats.  First of all, it is straight up a John Wick copycat (yes, I'm aware it's the same writer), so it's mostly predictable apart from the occasional small deviation from the formula. I would have appreciated more creativity instead of just mostly doing what we've seen before. I was half expecting Wick to show up at the end like Nick Fury in Iron Man. 

Second, while I think there was mostly a good balanced between silly and serious aspects, I think it occasionally went just a bit too far and became straight up goofy. Like the scene with Christopher Lloyd in the retirement home taking out the two goons, to me that's a perfect balance - campy but not completely over the top. But then at the end when he's walking around with 19 shotguns and killing guys left and right, it's goofy. Also there's not a ton of tension in that scene since most of the bad guys just sort of run into frame to die, usually they don't even have their guns up. 

Third, while I do think the shorter runtime worked in the movies favour, I kind of wish the assault on the Russian mob bank or whatever was a full scene. I'm sure it was a budget thing to turn that into a montage instead though. 

Basically this is John Wick: Bob Odenkirk Edition, except they start the humour at John Wick 3 level. I'd give it a 7.5/10, this will be the perfect streaming movie when it eventually gets there (silly move to make this theatres only right now but whatever).",me3za3
gsqweqv,Fucking great although it drove me mildly insane when he’s talking about he had an H&K USP 45 but the pistol in the scene has 9x19mm stamped on it extremely prominently,me3za3
