comment_id,comment_body,submission_id
gydw0dp,You're weird bro lmao,me3za3
hvxuf5y,Still Nobody,me3za3
h1j167c,Maybe he didn't use all the gold. Maybe he had some other valuable stashed elsewhere. Maybe his father in law gave it some back because of his daughter.,me3za3
hay7bp1,"Maybe, because he wanted to them to just get out of there and not complain that he's a horrible son-in-law or brother-in-law.",me3za3
hay713v,Maybe he will rebuild the company and use it as a front for a normal life.,me3za3
hay6uhv,"No, I think he knew that he did the right thing by not attacking the lady robber because the gun was not loaded so she did not pose any harm and he knew that they were not professionals - just desperate couple who wanted some money.",me3za3
hay5rgd,Maybe his phone was deliberately off so that he could have time off to go house hunting with his wife. Romantic quality time.,me3za3
gsflvob,They pushed the US release back to march 31st,me3za3
h2m65ls,"I couldn't get subtitles for that entire damn club scene. Movies that do this piss me off to no end.

""Oh yeah, we're going to add a whole scene and a half where the only spoken language is Russian and forget to provide subtitles. English speaking individuals won't know what the hell is going on. It'll be so hilarious. Hahaha...""",me3za3
h14dfb7,"You mean ""yeah"". ""Yea"" means something different. FYI.",me3za3
guxeagc,"I dont know. I love this movie but i didnt really laugh at all. I think I saw it as more of a guy who is just dying to tell somebody his story. Has been dying inside for years and wanted to tell his family but couldnt (even though it seems like his wife knew something of it). It seemed more sad, but not depressing sad or anything just watching somebody who has been dying on the inside kind of sad.",me3za3
gup16bq,Bored them to death with an over done backstory. I feel like they were sending a message with that one,me3za3
gv1396a,[removed],me3za3
h3p3abg,"Yeah it was about the daughter sneaking into the basement to chill, while obviously not being allowed into the mancave",me3za3
gsg38ka,It can be both,me3za3
gt3hxen,Hell yes. I just got back from the theater... it was awesome!,me3za3
gu81myq,That would be strange. Rip.,me3za3
gut9a88,I actually got him confused with Jeremy Irons,me3za3
htu5wlc,"9 months late but I just got the DVD. There’s a pic on the back where Christopher Lloyd looks exactly like Peter Boyle. It took me a full 5 minutes of trying to figure out if I imagined Boyle being dead. 


Glad I’m not alone.",me3za3
h79s7t5,"Holy shit, we just watched Seven Psychopaths last night and Nobody tonight. I don't know how much more timely your comment could be than now.",me3za3
gu7lfi9,Honestly I think I liked this a little bit better than John Wick. Odenkirk is just so much fun to watch.,me3za3
gup4bw7,"Same. I expected imitation John Wick, but I got John Wick with the humor and over-the-topness of Desperado.",me3za3
gveyhq3,Same writer for this film as John Wick lol,me3za3
gwmrrtb,it's just john wick but slice of life instead of highly stylized,me3za3
gwyftrb,"Just saw the movie last night and I loved this about it.  There was a moment where it seemed like that's where they were going, but nope, trope avoided.",me3za3
h36rtcp,sorry but this movie still had it but it was for the villain haha,me3za3
hut1d5j,Idk the car scene where he goes to the machine shop. where Bob gets shot in the shoulder look like all who was lost. They were like a thousand f Russians and he was pinned down in. It even looked like he gave up from The expression on his face even the guy (Main villain) said hey what happened to you gave up this easy and then fucking rza comes out with the sniper rifle.,me3za3
hut235s,I know this is late but that was not a mustang That was a Dodge Challenger 4.9  liter V8. And it goes zero to 60 in  Well I'm about a fucking find out.,me3za3
gsvx8h7,I disagree. I’d put it up there with 80s schlock. The thing about movies like these is that they either land or they don’t.,me3za3
gtko1su,"> Is this thread astroturfed? 

Are the reviews on rotten tomatoes astroturfers as well? You didn't like it and that's fine but the overwhelming majority did (81 RT, 95% audience score). I don't really understand myself how someone found that movie boring when it was non-stop action. My only criticism was how cheesy the ending was.",me3za3
gvnj51a,"iS tHiS tHrEaD aStRoTuRfEd?

No moron, people just have different opinions.",me3za3
gw55rdr,People liking something I don't like? Must be P A I D S H I L L Z.,me3za3
gv5h6d6,[deleted],me3za3
gx3uxvn,"Man, I loved it.",me3za3
h5mdfyd,"The movie is a steak man.

You know what you're ordering and you know what you're getting but some chefs just fucking nail it.",me3za3
gsvp5kg,[deleted],me3za3
h1gmen9,"Total Recall is a classic, of course it’s more enjoyable than most other over-the-top action/sci-fi. That shouldn’t be a criticism of Nobody.",me3za3
h4ykb2s,"> Is this thread astroturfed?

Because a ton of people loved it and you didn't?",me3za3
gwgrfid,"this is one of the most overrated movies i've seen. few cool scenes / moments in the action sequences, but holy shit was a shit movie lol",me3za3
h7a13me,I agree! Have a nice night!,me3za3
guzf1m4,I loved the old vet who took one look at Mansell's tat and noped the fuck right outta there.,me3za3
gusvuf9,He walked right into a punch so he could remember what it felt like to get punched.,me3za3
gvsu5v0,"His wife being on-board with his dangerous life, him being the danger to the mob boss instead of the other way around, the character choosing to chase danger and getting into trouble on his own accord instead of being forced into it. Nobody destroys tropes left and right and I love it for that.",me3za3
gvoa4yz,Yes that's the same old trope.. wife being frieghtened because she doesn't know who her husband is anymore.,me3za3
gsgglbm,The back to back with the 3 characters shooting was a bit much. Seems like they couldn’t miss.,me3za3
gxorwjn,That bus scene was probably the best scene in the movie. I did not enjoy the over the top action. It's like 2 directors were doing the movie. The first one wanted a more realistic touch and the other one wanted to copy a Wick movie.,me3za3
gusw0jk,"he still trained everyday. Running, doing pullups at the bus stop, he kept in shape. But yea, he'd feel like shit after that beating.",me3za3
gv0i5rd,I’ve seen them both. My top 5 favorite action movies.,me3za3
gusn4c9,"The recoil shot was one of the best moments in the movie, I think, but it's really hard to pick.",me3za3
gydfngv,Triple!,me3za3
gsduky3,"Hahah oh man exact same experience, glad you enjoyed it",me3za3
h79xsqt,"By my count it was about 15 minutes of setup before anything more substantial than the botched burglary occurred. I was pleased it was taking its time, but I felt like it could have used that same amount of time to explain in more detail the main characters' relationship to his family, especially the son because we really don't get any sense of their relationship save a vague notion of ""poor,"" and his wife who again, we know is somewhat estranged but why? What's going on? She seems quite eager to engage with him at any moment, but we have no clue why they're not really getting on well.

That said, several things are explained in subtext. Not good enough for me, but it might be good enough.",me3za3
hy638im,You’ll Never Walk Alone - song by Gerry and the Pacemakers and Liverpool’s anthem,me3za3
gsee05u,Lloyd also got his wish to carry to carry those shotguns as if they were loaded with weight.,me3za3
gsjs496,It felt like it would be a darker climax for a second. Then absolutely wasn’t.,me3za3
gsv9vop,I thought he was holding a grenade,me3za3
h0yzrxd,It intentionally removes expected tropes. Plus I can't wait to see more of him in sequels.,me3za3
gsdsk8s,You're funny,me3za3
gtb6oeg,"I recognized him off the bat, but I didn’t recognize Michael Ironside until he spoke his 4th or so line. Extremely unexpected. I hope that was just makeup and a fat suit, otherwise.... yeesh he didn’t age gracefully.",me3za3
gu6gfh8,"Haven’t seen it yet, but I was sold, when I saw Bob Odenkirk and Christopher Lloyd in the trailer. If you’re saying that Doc Brown gets to kick some ass from a nursing home, I’m in.",me3za3
gv0sbl9,"Christopher Lloyds one of those weird ones where it's impossible not to recognize him because he looks the exact same as he did 35 years ago, but at the same time you can't accept it's him because he looks the exact same as he did 35 years ago.",me3za3
gv2oolq,He tried to throw it on the roof but missed.,me3za3
gup42qy,It seemed to me like it was an accident from when he missed the trash.,me3za3
guoxn6z,It’s how the burglars got in,me3za3
ht8b1ro,Or set your alarm 10 minutes earlier. If I constantly did this my wife would be annoyed as well.,me3za3
h07fahe,Raccoons?,me3za3
htq73id,HOA probably,me3za3
gvuipzv,"i wish they spent just a SMIDGEN more time in showing that while he loves his family, he has no idea how to be a “optimal parent/husband” i loved that the movie did stay relatively realistic, i imagine that’s exactly how a couple would be if one of them just refused or didn’t acknowledge their past and was obviously pushing a lot down mentally and emotionally. 

but i would have really liked some scenes showing how inept he is with social/personal interactions such as being a father. he seemed pretty level headed and still thinking of being a supportive parent. i would have liked seeing him struggle with the emotional side of parenting, he’s supposed to be the boogeyman cause he was a force of mayhem. his marriage suffered because of it but it appeared he was still able to be a good dad 🤷🏻‍♂️ which is ok imo for the tone of the movie but i could have used some more hints that he wasn’t really effective with family life",me3za3
gsqbmkx,"Just a fun fact: the guy, who was strangled by Christopher Lloyd was acted by really famous russian singer Sergey Shnurov. And fact that Christopher Lloyd shoot Shnurov with shotgun makes this moment twice more hilarious for russians.",me3za3
gsjsbuc,Especially tied with the soundtrack use.,me3za3
gsr0hoz,"""You brought a ton of shotguns, huh?"" 

""Well you brought a ton of Russians.""",me3za3
gvj99aw,"I used to be nobody. I'm still nobody, but I used to be, too.",me3za3
h14evzs,That didn't even sound like Mitch...,me3za3
gsgc7b2,2 No 2 Body,me3za3
guo0q7r,"Sequel will be shit. I guarantee it. This movie hit all the right spots and was a kinda fresh take on the whole over the top shooters like Shoot'em Up and John Wick. It worked because it was novel. A sequel will just beat a dead horse. This movie wasn't entertaining because we needed Big action (it was certainly a factor). It was it's absolutely awesome pacing, subversing of expected stereotypes and the total lack of sense to the whole movie (I completely lost it when he found the goddamn kitty bracelet under his sofa, which started this whole mess). It was unexpected, people will expect that now in the sequel, which will take the whole wind out of the sails and what made the movie good. More action will be boring. There really is nothing new they could do. John Wick got away with cranking the fantasy up to 11, which will not work in this one. It's more down to earth (while still being over the top ofc) and established itself as a cruder movie. John Wick already had dream- and fantasylike settings.  
I'd rather they leave this one alone and stand on it's own. I think sequels are unnecessary here.",me3za3
gslzi7e,No. It’ll be on VOD April 16.,me3za3
gsirotv,"I mean, Home alone was a pretty damn violent Home Alone.",me3za3
gsqcy1j,Have you seen the most recent Rambo? It's the best violent home alone out there,me3za3
gv18xgr,This movie was what *The Equalizer* should have been.,me3za3
gsg36n0,This is a much better movie than Rambo 5,me3za3
gsgekrq,That was awesome,me3za3
gsldzf6,triple collateral lmao,me3za3
gv0f28j,I was expecting a 360 no-scope after that lmao,me3za3
h1v02qy,Brings me back to my COD days.,me3za3
gusvu54,Deadpool did it better while doing a twisting backflip,me3za3
gufnl5e,That show is great and has some good actors but even if that wasn't the case he could carry that show by himself,me3za3
h79ytoc,"Even the scene after where he puts his family in the basement sort of continues the bus style, where he struggles and, in that case, eventually gets put down with a taser. It's not until the later fight that he finds his groove, and I think it's a shame that the move doesn't _convey to the audience_ that he's un-rusting. That would have eased us into the faster paced sequences.",me3za3
gslm0n8,"When he said ""I'm rooting for you Hutch"" I took a mental note so I could play it back in my head and feel like Sam Fisher was giving me support. I miss Ironside Fisher. His voice is truly unique",me3za3
gslx9b1,[deleted],me3za3
h2qnmiy,YES. Aw man seeing him gave me so much nostalgia! Now I need to replay all the splinter cell games,me3za3
gurwpkh,Right?! I thought it was just my bad hearing!,me3za3
gt74t5h,"I got the gist of it, psychotic Russian mob boss guy.",me3za3
guto8d5,I think SK has passed on.,me3za3
gtvrv2s,"Yeah, a loaded shotgun of fun lmao",me3za3
gvh223e,Have you seen hardcore Henry? Same director and there’s some *very* call of duty inspired stuff,me3za3
gvehyu5,"I nearly yelled ""COLLATT""",me3za3
gxcvf3h,"Also the hispanic actors were speaking actual native spanish, and not with the typical accent (though a lot of people probably can't tell)",me3za3
gsthfpp,"Haha, not many. We had a lot of medical students from different countries of Africa coming to Soviet Union ~40 years ago for getting education.
Some of them married to russian women and had kids. So it's rare, but I've seen different black people on the streets of Moscow/St.Petersburg.",me3za3
iwir2g8,this is my second time seeing a black russian in a tv/movie setting. first was in Durarara 😂,me3za3
hbmkiub,Vodka,me3za3
guwct6s,"I watched in the US theatre and heard ""Сломал нос"". I'm 100% sure that he said it as Alexander Pal is a Russian actor.

Maybe the sound of Polish ""Złamałem nos"" is very similar to the Russian?",me3za3
gt57zsz,"I only caught a glimpse of the tattoo but I think the playing card pair was an off-suit 7 and 2. Which, in poker (at least Texas Hold 'Em), is well known to be ""the worst hand you can get"" (i.e. most people will fold on that hand pretty quickly).

I will have to re-watch to confirm (or perhaps someone else here can confirm), but if that is indeed the tattoo then I think it's the perfect representation of the character and a genius easter egg.

Oh, and this particular hand (off-suit 7 and 2) is colloquially known as ""The Hammer"". :)",me3za3
gsz13dc,I loved the part where he just kept locking up the door and the goons in the room got more and more concerned.,me3za3
gvj9ohi,"> it was the perfect comeback

Almost as good of a comeback as the Kardashians.",me3za3
gvuxpbt,"I think it's a poor spot still for a tattoo for an elite military organization.   If you are a foreign counter intel agent, who are  you going to focus on first?   Probably the guy with secret squirrel tattoo on.",me3za3
gsnvfpe,I believe it was a Van Gogh and the movie implies that it’s real,me3za3
gu3d6ss,Real painting. My grandmother had a copy of it hanging prominently in her house.,me3za3
gv1pa2i,That would be van gogh’s “bedroom in arles” 1888,me3za3
ifswvhf,"No. I came here a year later after just watching it to see if anyone had said this. No bracelet was given back, and no kitten was given. Also the son thinking his dad was lame, sees the dead bodies before this house is burned. I know these things are implied, but I wanted to see the scenes. It was the first thing my wife said when we were done watching. But we both really enjoyed the movie, and after the credit scene, I agree that Christopher Lloyd and RZA buddy flick would be amazing.",me3za3
h14f97u,I'm so glad none of you are writers. Such limited vision.,me3za3
h14ff6y,That was a really easy joke. It's hard to believe you're not laughing at dumb shit constantly.,me3za3
gslm4ne,He was last night.,me3za3
gse7wy6,I feel that. Things haven't gotten quite back to normal as of yet where I'm at but I've just gotten the vaccine and I saw the thread about Odenkirk becoming a badass and just decided to see the movie on a whim because I've missed this. Well worth it for the experience alone honestly.,me3za3
gx38p9c,"Breaking Bad Call Backs:

Main character has a wife

They live in a house

Main character has a job

They speak english

They eat food

Villain tries to kill him.

I mean come on, it's basically Breaking Bad if Walter didn't cut his hair off.",me3za3
gwm7daj,r/breakingbad is leaking,me3za3
gwzj4ex,"The half measures parallel was the most important thing he mentioned, and it was obvious even to me, and I'm fucking dumb, man. I had to ask my wife why the Vietnam war vet was scared of his tattoo and even I saw the reference to Mike.",me3za3
gsqyxcu,Was it though? They seemed to be just drunk assholes fucking around until hutch decided to take out his frustrations on them.,me3za3
gsn7dtm,"I was kind of hoping the movie was making fun of people like his shitty macho neighbor for being bloodthirsty, but the entire movie is kind of just that attitude. 

The movie kind of took me out of it when he gets back on the bus. The fight was over essentially, the woman could have at that point just got up and walked off, but I'm supposed to root for him getting back on and brutalizing these dudes?

Maybe I'm around too many dudes at work with violent fantasies about people trying to fight them or invading their homes, either way I felt kind of gross about the movie. I did think it was pretty funny a lot of the time, and the editing was good though.",me3za3
gsoappx,">nah the Russians were bad people anyway

That's basically every American movie ever. Russia bad, upvotes please.

I loved the movie, it was so much fun. But it's also that classic American thing where the FBI/CIA/three lettered organisation is revered and killing is totally normal, especially if they're foreign.",me3za3
guo9yry,"2 weeks late but I just watched it tonight. Wasn't that the point? That he was previously just a bad dude set loose on bad people and ended up having all this pent up energy to do bad things to bad people? He even has a monologue talking about how he tried to do the normal life thing just like the guy he let live and then realized he couldn't. 

I don't think you're supposed to be rooting for him as much as sitting back and saying ""this guy is insane."" I mean he literally offers the Russian guy an out and then crosses his fingers that he won't take it. He's insane and loves killing people. He's a sociopath.",me3za3
gveoaa0,"I think that's what they were going for? The director Ilya Naishuller said the reason he got the job was because when he read the script, he told the producers he thought if John Wick came out of retirement because of revenge, then Nobody came out of his simply because he was bored. 

Nobody just wanted to fuck shit up, consequences be damned.",me3za3
guqsq0f,"If you've seen the director's other work, like Hardcore Henry (which had some homophobia) and music videos, you'll see that questioning machismo is not what he's about.

Fwiw I found Nobody less problematic than his other work, but that's probably because he didn't write this one. The attitude still leaks through a bit though.",me3za3
h0qphgm,Wait you actually are sympathetic to the Russian mob that was about to rape a young women on a late night bus?,me3za3
gt6ch7r,This is a spoilers thread bro,me3za3
gsujw9q,"Sorry, what's the etiquette here? ""Spoilers"" is in the OP and it's tagged spoiler.",me3za3
h0qq2mj,Excatly he alludes to a simple life like a facade,me3za3
gx4b2bh,I thought he was supernatural cause all his stab wounds disappeared constantly...,me3za3
gu7xrv0,It's Hutch's father and brother driving somewhere... With a whole lot of weapons!  It's a short scene but totally leaves even more open for a sequel ;),me3za3
gup1yrd,And a quick chat about the triple headshot which lloyd doesn't believe.,me3za3
h14glpk,..... How.....,me3za3
gsedc7l,Or his run on Mr. Show.,me3za3
gxd61be,"I was one of the very few people that got to watch that movie in a theater.  I don't think it saw but like 3 screen in LA outside of the test screenings (one of which I went to).

I've never laughed so god damned hard in a theater in my life.

""My name is Terry and I'm from Hollywood!  Ronnie, you are not like other men, you've got something.  Something special!  AND I WANT IT BADLY! I want to be the man, *behind* the man!

I realize, I'm coming all over you here...  But it's been building up inside of me for *weeks* and I can't control myself!  Let me show you what you've got inside of you, what could *be* inside of you!  If you could just give me the *tiniest* hole, of opportunity, we could go back to your place.  Right now, and I'll pack your shit!""

I almost peed my fucking pants right there in the theater.  I'm pretty sure I stopped breathing twice laughing so hard.  You have to remember, the only description the screening person out wandering the Block at Orange mall gave us was ""Run Ronnie Run, a comedy about a quirky reality TV star as he tries to make it in the movie business"".  No actor list nothing.  They just wander up to people shopping with a clipboard and ask ""do you want to go to a free movie?  how old are you?""

That movie is criminally under-watched.  [Here's a link](https://www.youtube.com/watch?v=v03ldhD7k-c) for those that may have not watched it.

Jack Black's musical number in it is also, one of the funniest things I think he's ever done.  Let alone Bob and David's early 90's R&B group ah la Color Me Badd.",me3za3
h14gcaa,"I guess so, but he was the top of his class there. Very few, if any, people are as skilled at sketch comedy as The Bob. The man is an absolute legend in that arena.",me3za3
gvvdz2u,">An operator has his unsuspecting family threatened by a criminal organization, forcing the protagonist to turn on the wet works.


For me, half the fun came from the twist on that premise. Hutch wasn't forced to turn on the wet works, he really really wanted this to be the case but his mundane life offered so few opportunities, even with a home invasion it turned out the robbers' gun wasn't loaded. He's pushed to the edge and the first situation came his way, he escalated into a full on brawl, even stopping the bus driver from calling 911 to make sure he's not interrupted. Turned out, he hit the jackpot, and brought down on himself an entire russian mob on whom he can work through his bloodlust.


It's a bit like Dexter, only with more action.",me3za3
gv1k8fv,"I dont agree with comparing it with john wick. gun realism is wick's thing: bullets exist, reloads matter and even the sounds are reasonable accurate. on nobody he talks about using a walter ppk then corrects to a specific gun: h&k usp .45 caliber then the movie zooms into his weapon and sure enough its a h&k usp **9mm...** even the punches dont pack as much realism as say atomic blonde: hutch got knifed in the waist handle deep and it has zero consequences...

other than that, yeah its a fucking great action popcorn movie!",me3za3
gtop6ao,But John Wick was actually good lol,me3za3
gx3910h,"Seriously, imagine being able to say that Nobody took itself too serious while all 3 John Wicks are allegedly self aware with a straight face. I couldn't stop laughing.",me3za3
gv2q4gn,there were super sappy moments with the wife that didn't hit/work at all that they were trying to quite serious about,me3za3
gzgzbxs,"1.00 ounce is 0.24 bananas heavy

I am a bot and this action was performed automatically

 conversion table

|Inferior unit|Banana Value|
|:--|:--|
|inch|0.1430|
|foot|1.7120|
|yard|5.1370|
|mile|9041.2580|
|centimetre|0.0560|
|metre|5.6180|
|kilometre|5617.9780|
|ounce|0.2403|
|pound-mass|3.8440|
|ton|7688.0017|
|gram|0.0085|
|kilogram|8.4746|
|tonne|8474.5763|",me3za3
gv2qu34,nailed it,me3za3
h4nazeg,"We don't need to see his daughter receiving the car, we don't need to see the neighbour finding out about his car - we can already infer these results and enjoy the setup of the joke without somebody explaining the punchline. 
Likewise we don't need to see how his son responds, but we do see he has some sort of a reaction - and can ponder whether he's amazed, terrified, angry (likely a mixture of all). 
The bracelet resolution was amusing - it was the catalyst for this film, and was just dropped under the sofa after all.  

The final showdown was very much over the top and likely not to everyone's taste, but I enjoyed it for how happy and joyous it was. Normally we'd expect some heroic sacrifice or tragic death but instead they were all the happiest they could be. It made for a very uplifting ending with a surprisingly supportive family dynamic.  I found that very surprising and refreshing.


As for the black Russian supposedly he's an amalgamation of black Russians that the director knows, and in part due to an influx of black Russians after the Moscow Olympics - but that's from [#18 in this unreliable source](https://filmschoolrejects.com/nobody-commentary/) so take that as you will. Not sure that excuses the film itself but it's a fun explanation!",me3za3
guwh4l2,"Yup. The whole thing was very poorly written. The tone, not to mention the pace, was all over the place and nothing felt earned - events were just slotted into the movie as needed without proper set-ups, and as you say, without payoffs.

Whole thing could have been written by a high-schooler. Worst movie I've sat through in a long time.

And this entire thread has convinced me that reddit is full of astroturfing.",me3za3
