comment_id,comment_body,submission_id
hvimxwv,"I went in expecting to see another great, scary Guillermo Del Toro monster flick, and left having seen a great, roiling Guillermo Del Toro film noir.

To be sure, this movie is a slow burn- building from a warm little ember to a huge burning pyre.",ri7edd
hvo0ocw,Bradley Cooper should’ve been the son of Indiana Jones,ri7edd
hvtgrkn,Best movie I’ve seen in awhile. Hopefully film-making is back. Tired of the crap Hollywood has been churning out lately.,ri7edd
hvz0e7a,"I loved the performances, the feel, the setting, everything but the ending. I suspected it was going to end that way when Willem Dafoe was running him through getting a new  geek. I thought the ending made sense for the character and was a nice way to wrap up his arc but it was just so obvious that it felt underwhelming to me.",ri7edd
hwn1t4j,I was extremely disappointed in this movie because of high expectations I give Guillermo del Toro. It was slow it was boring and it was very predictable in the end. Bradley Cooper's way too old to play the young man. The best thing about it where the costumes and set design. Pass that some good performances from minor roles in the movie were wasted. In the end I think the stories just not enough.,ri7edd
hwr1lri,"I think this movie had 4 or 5 Chekov guns, with only 1 being a literal gun.  My favorite being ‘I keep the poison alcohol right here next to the drinking alcohol’ lol.",ri7edd
hx4c9pg,"One complaint I have is that I don't buy that he would have left all of the money with the Physciathrist. The way it first came about didn't convince me it was justified despite their precieved ""partnership"". An obvious and sloppy setup for what was to come.",ri7edd
hxqomgk,"I think I'm in the minority and liked the first half more with the carnival stuff. All in all, pretty good movie but I definitely agree with others that it goes longer than it should.",ri7edd
hya5tuy,"As gorgeous as the film is, I found the story to be quite dull.",ri7edd
hyiwrk9,Why did the psychologist treat Stanton so badly? Was it because Snan embarassed her during his mentalism act?,ri7edd
i01v1l9,"All the actors were wasted in this movie. Rooney Mara did nothing useless character, Blanchet playing herself at this point. Defoe not enough screen time, Toni Collette does nothing. Bradly cooper is bored for half the movie then gets to emote  then back to bored. Why this long if you give your actors so little?",ri7edd
i0pmfc3,Honestly thought it would be a horror thriller type of movie but what I got was a 3 hr movie that felt like 6 hrs,ri7edd
i1gw1hi,I love the noir setting and the first half at the carnival felt like a tim burton movie i loved it was really good,ri7edd
i1qu1f2,"While the ending was more direct about him becoming an actual ""geek"", he was the geek already. Cate Blanchett's character's geek. She earned money off him while hooking and supplying him on things he desired (alcohol, power, unconditional sex) all the while making things come together for her good. And  he did more gruesome things all the while just like the geek. He ""ate the chicken"", and she exploited him and his weaknesses and tendencies.",ri7edd
i1vixxc,"That scene with the judge and his wife was pretty shocking, Mary Steenburgen really sells it.",ri7edd
i2af2h4,This movie is a really good example of one that is better on a second re-watch. Just the first 11mins alone are all foreshadowing of Coopers character turning into the Geek. One of the subtle allusion being him not talking for those first 11mins and then his first dialog being with the Geek.,ri7edd
hx0haxo,If it wasn't for Bradley Cooper slaying the last 20 minutes or so... I mean this movie was 80% boring as shit and 20% superb.,ri7edd
hq2sxrx,"My mother was in town visiting, and she wanted to see this movie, so I tagged along. I hadn't heard much about the film prior to reading the description on Fandango when booking our seats. I generally like Guillermo del Toro's work, and that surreal aesthetic he brings to all his projects, and I'm a Bradley Cooper fan, so I was cautiously optimistic.

We went to the local Cinemark theater, and I was a little disappointed that the film was playing on one of their smaller screens. We still had the nice leather power-recliners, and the sound system was suitable for the theater, but I prefer a ginormous screen when I pay to go see a movie. Anyway...

The pace and rhythm of this movie was odd. You never really knew where it was going, all the way up til the end, which I suppose was the point. I liked the film, and was pleased that I didn't anticipate the ending. Visually, it's a beautiful movie featuring the sort of nuanced technical mastery that is a del Toro trademark. The story is focused and efficient, and the ending is tidy and satisfying.

All in all, I give it a 7/10.",ri7edd
hqadwit,This was great because the man who was clearly a monster destroyed another monster and those monsters were men. The slow pace was dreadful at times and I felt restless but it was alright. I would probably watch it again.,ri7edd
howbcgn,This and late night at soho were such disappointments or maybe my expectations were too high,ri7edd
hwn2zot,Did anyone else think Enoch was Grindle’s baby?,ri7edd
hwqny33,yawn.,ri7edd
hp7irh9,Is it worth watching in the cinema?,ri7edd
hp8y5qz,Can someone explain to me the motivation for Cate Blanchett betraying Bradley. Was it for money or a personal vendetta?,ri7edd
hpdx13z,Me and my friend were the only 2 people in my screening so we had comments throughout it. I had predicted the ending within 40 minutes/ right at the end of act 1. Nonetheless a fantastic movie and worth a watch,ri7edd
hpe11x6,"First, does anyone else think that the others, except Molly, left like Stan and are on the track to returning as future geeks? Unless I missed something, I thought that was partially why we met a new character at the end.

To everyone calling this (crime) noir, I just want to say that there must be something wrong with me.

I thought it was more like slice-of-life, until we focused on Richard Jenkins, with the distinct look of a horror movie.

It might have something to do with the first act reminding me of Adventureland, and I didn't think we'd end up focusing on a single mark, and it (maybe) could've been interesting if we didn't.

Anyway, the story wasn't all the way there for me, but everything else was excellent. I'd never seen Rooney Mara play a role like that before, and hopefully she gets some notice for it. Not like awards notice because of how understated the performance is, but something because it's against type.",ri7edd
hphwz2w,"Can someone help me out, I had to go to the bathroom and missed the part between Rooney making a phone call to someone because she was upset that Stan had done the spook show for the first time and the scene with Stan in the office where Blanchett asks if he has ever been analyzed.",ri7edd
hpiigwf,"Good, not great. My least favorite deal Toro film. With such a gifted cast I expected more. His most conventional, if you will, film. Not bad, not a waste of time, but meh.",ri7edd
hpnen2y,"Interesting how the consensus seems to be “I loved it but it was way too long! Normally, if you love something, you can’t get enough of it. So I don’t know if I could say I loved it.

I will, however, say that I loved Cooper’s performance and the lies he spun. Easy to see how his character could fool so many smart and successful people—panache!

Del Toro built a beautiful world, but at no point did I want to stay in it for a second longer than I needed to. Even his fancy hotel room felt seedy and stuffy. I think a montage or two would have alleviated the visual claustrophobia.

This is one that you can wait to see on digital release.",ri7edd
hppiguq,"Really enjoyed this movie. Surprised by the gore and after reading up on the original movie, I do feel that ending is slightly better. But still, a great experience",ri7edd
hqdt46v,Anyone catch the references to *Freaks* at the carnival at the end?  He put Koo Koo (the bird woman) and Schlitze lookalikes outside in the scene where Bradley Cooper is walking up.,ri7edd
hqfc94b,"Anyone else feel the ending was too predictable? Was expecting some big twist but was just like “oh shes bad and not really in love with him? I assumed so” and was it all about just ruining him because he talked down to her at a show? That felt forced, was my only gripe though, enjoyed it, great acting.",ri7edd
hr0d4ty,How are people interpreting the 3 eyes fetus showing up several times? What did it symbolize? I had a few thoughts on it. But wanted to hear from others,ri7edd
hr1xn5r,"Plot summary was wrong, she was a psychologist not psychiatrist.",ri7edd
hr66ie6,It's always nice when Clifton Collins Jr. shows up.,ri7edd
hr9ito3,"I'm really bummed I didn't like this more. I'm a huge Del Toro fan, and I thought it was extremely well shot and all the acting was great. I just also found it super slow and boring. I don't mind seeing the ending coming from the beginning, not every movie needs a twist, just don't take two and a half hours to get there.",ri7edd
hrqrisf,"What was Bradley Cooper's motivation to become rich?

I felt this was a morality tale but was confused if it was about greed or hubris.

I also felt Cate Blanchett was miscast.",ri7edd
hruqzr7,Does anyone know the name of the song that plays in the end credits? Its not on the song track and it is driving my son crazy he wont stop talking about it.,ri7edd
hs0qkpv,"Just watched this. I felt like it was a bit too long, specifically the first half of the movie. The second half felt like the real narrative piece of the film but it was much slower paced and by that point I was kind of feeling the length of the film. 

The payoff/callback to the geek story was awesome and dark, I love endings like that. 

Overall I probably wouldn’t watch this movie again but it was very solid, felt like a really long Twilight Zone episode. The set design in the movie though was fantastic, Cate Blanchett’s office was so sick",ri7edd
hs22l8k,Mary Steenburgen took me out of the movie a bit because the Botox/face lifts on her face…screamed modern face lift to me and took me away from the film for those scenes. Sad because Del Toro does such a good job at putting you in his world.,ri7edd
ht4vp8m,"This was my first non sequel/comic book/franchise movie at the theaters in a long time. Partly thanks to covid, but it was nice to see a movie that doesn't relie on other movies. 

Having says that, the pace of the movie was hard for me. You don't know where the movie is going until like 2 hours into it. At one point i thought this has to be one of those see it again to see the clues. But no. I still liked the cinematography and acting.",ri7edd
htw6npa,"> David Hewlett as Dr. Elrood

I can't remember which character it was. Can someone help me on that ?",ri7edd
htwfm0f,"One question on the film i have is in Liliths and Stans first ""session"" in her office she says to him something about him killing the guy in the carnival but Stan definitely does not tell her this. How does she know?",ri7edd
hup7rwn,"I keep thinking, maybe Enoch was Ezra's unborn baby",ri7edd
hupxzd0,"I liked it a whole bunch, went in without knowing it was a Del Toro movie.

However, I experienced something while watching this movie which I had not experienced for a long time. Which was that I legit had no idea where the movie going for the most of the movie. Movie keeps its intentions for far too long in my opinion.


I also missed the motivation of Cate Blanchett's character. What was her scar? Was it related to the old guy? Or the fetus in a jar? Totally missed all that.

All in all, really enjoyable but probably a tad too long.",ri7edd
huusyex,"I watched the film yesterday and I am wondering if anyone else thought this:

Did Ezra Grindle give Dr Lillith the scar on her chest, and if so did she then use the information she had from the psych sessions to scout out a ""medium"" that she knows has fallen into believing he can manipulate anyone. She knows that he had previously seen other ""mediums"" which didn't end well as she warned Stan. She had been seen in the crowd of Stan's shows before and then broke him down from there. She set it up from the very beginning, she didn't need the money, she wanted to take out Grindle but have her hands clean, which compared with the scene at the end where Stan is washing his hands in her sink, he's the one with blood on his hands and she has no place in the murder. 

&#x200B;

Was she tired that the scam of contacting the dead was more legit and likely for Ezra than a proper psychological evaluation? This was a detriment to her field and made Stan seem just as in tune with people as her even though there is research and science behind what she does.",ri7edd
huz0fvr,As a fan of the book I felt like the movie missed tons of little pieces of character development that made the book so good but I saw afterwards it’s well liked so maybe I’ll just have to sit with it. Wouldn’t be the first time.,ri7edd
hvav8gi,"Late to the discussion but finally saw it in my country.

The criticisms of it being predictable or uncharacteristic turns of character surprise me because to me that almost felt like the point. I can understand that you want a twist but I almost feel like that's something we almost come to expect and instead seeing the character we know to inevitable decisions because of his past is satisfying in its own way.

I thought the film was a pretty good reflection of the American mythos and the reality of it. I'm reminded of this scene from 'The Wire' where D'Angelo gives his interpretation of Fitzgerald and his quote that ""there are no second acts in American life."" (https://youtu.be/cKlGQfvj5_g) He explains thay the past is always with us and even though we can try to reinvent ourselves, we can never escape our pasts. In that way, Stan is given multiple opportunities to escape his past and also not be like his father, but in D'Angelo's words, that shit caught up with him. He makes every mistake that we knew he would to the point that you almost want to scream at him. Stan uses an American penchant, I believe, to believe in a sort of mysticism and religion (see using religion against the sheriff to get out of trouble) on his marks, and in the end that comes back to bite him in the ass. Not only because he buys his own bullshit, but because there's another bigger dog out there to eat you as well. The only way to get out is to say no, like Molly (although how you do that in real life, I'm not sure).

In any case, loved the movie. Although I agree that the movie felt 30 minutes too long, in the face of TV shows these days that are 10 hour-long episodes for characters or subplots or whatever, I appreciate this movie for taking the time to talk about somewhat insignificant characters and wrap up everything in one movie.",ri7edd
hvfxgjd,[deleted],ri7edd
hvi1gql,"What did Zeena mean when she told Stan that he ""Earned,"" the book? Was it he earned it by spending time with Pete? Or that he earned it by being partially responsible for his death?",ri7edd
hvmotxp,"I have so many questions. 
I Got some of the answers Reading this thread. But Can somebody tell me what the daddy issue thing brought to the story/character?",ri7edd
hvppfvh,"""You heard? That little Kraut - the one that looks like Chaplin... He just invaded Poland! The balls on him. Put him here.""

The deliver of this line is one of my favorite movie moments in years. Dafoe is a fuckin genius",ri7edd
hvq4dds,What an excellent movie Holy shit. Blown away for an HBO movie.,ri7edd
hvwad2p,Beautifully set and wonderfully acted. A wonderfully told story about morlity and karma.  I would recommend..,ri7edd
hwghuce,So she was a psychopath?,ri7edd
hwherbx,"I assumed from the trailer and director that this was going to be a fantasy film. I was wrong. I actually think this was better than Shape-ah. The characters were a lot stronger. At least until that last scene with Lilith, if she'd just done it for the money that would have been less convoluted. 

Having Willem Dafoe say ""Did you hear that maniac invaded Poland?"" right out of nowhere is more intrusive than just having a subtitle that says 1939.",ri7edd
hwli3tx,Just finished this movie and I immediately went to check if Bradley Cooper was nominated for an Oscar. I thought for sure he would've been after that amazing performance.,ri7edd
hwnjnc1,ummm can anyone tell me what the point of Ron Perlman’s character was?,ri7edd
hwnkk2e,"Why Dr Lilith didn’t like Stan? Because he won when she tried to get play him? Cus if that’s the case that isn’t just petty, she’s evil and shouldn’t be a psychiatrist lol",ri7edd
hwqadp4,"Hello!
Any answer on how Stan got back on track with the lie detector test after starting to show signs of lying? Thanks!",ri7edd
hwr2ob2,"1 month later but i just got the chance to watch it (idk when was it available in theaters here in México) and i gotta say the pacing ruined it for me, plus some lack of juice.  It felt LOOONG and not only because it's 2hrs 20min (i think) but because it has issues in that regard imo. The objective length aside, i found the carnival first half to lack *something*. I guess the motivation(s) of some characters. I don't know, *something* i can't put my finger on.

Then i found the third act to come so sudden and maybe my perspective was distorted because of how it felt long or because it was actually just too sudden.

I told my mom it felt somewhat tedious at times and though it had specific GREAT moments and that ending just gave it a few points, it was rather disappointing. That final laugh was amazing. I didn't see the conclusion of ""him becoming the geek at the end"" soon though my family did so in that aspect It's my fault (which became positive cause I didn't expect the ending until he went to ask for a job and the acting shocked me). 

So overall it had great moments with fantastic acting and beautiful scenarios but the pacing issue and other problems i found, made the experience kinda disappointing.",ri7edd
hwrpvr4,Is it just me or is there anyone else here you slept off midway?,ri7edd
hwvups7,AmI the only one who thinks all this happens in the purgatory and everyone is dead.   makes the storyline even more twisted and full of symbols.,ri7edd
hx91ttz,"Chekhov’s Geek was just a little too obvious. It was OK, looked great, captured the period vibe well and Bradley Cooper/Cate Blanchett were both excellent. No need to ever watch it again though.",ri7edd
hxqxlda,"It really didn't do it for me.  None of the reveals felt impactful, the finale with Ezra was too perfectly messed up, I can't think of an angle from the Doctor that takes into account Ezra was Stan's idea with the exception of she was that petty about being shown up at the show, which is far from compelling.",ri7edd
hyixjio,loved this movie,ri7edd
hyndq4e,"This movie kind of lost me a little after it left the carnival. I had the same feelings watching this as I did House of Gucci, where at a certain point, the movie slows down, it was like ""okay, let's pick it up a little"". 

Overall, I was engaged at parts throughout (which is more than I could say about House of Gucci, which never got me back into the movie) and I think it just didn't click with me. The execution was done very well, I just didn't connect with most of the characters and so it never fully roped me back in.",ri7edd
hzxq1po,"Just came from seeing this a couple of hours ago. I thought it was predicable. I definitely need to watch it again to pick up more of the nuance, especially regarding the significance of Lilith’s character. I just didn’t really see how she became necessary to Stan’s plot. It seemed he was fascinated with her, but was there any practical reason to let her in on his scam?

It also didn't really make sense to me that he went to such lengths with Grindle. He painted himself into a corner, which he should have been smart enough not to do. I suppose he was blinded by greed and his feelings for Lilith? As a talented performer, it seems like he could have gone on to play larger audiences and led a rich life. It didn't make sense to me that he would do this swindle that was inevitably going to end with him being on the run. Maybe he was already on the run for killing his dad or some other crime. Going to have to watch again, but I don't know that the answers are really there.",ri7edd
i1i4s9j,"First of all, I really tend to enjoy anything by Guillermo Del Toro. He clearly loves anything Art Deco, and this movie is simply awash on some of the most stunning sets. It's just gorgeous. And the star power is off the charts.  Bradley Cooper, Willem Dafoe, Cate Blanchett, Ron Perlman, and the list goes on.

I terms of filmmaking, it's fabulous.  But....

But.....

Ugh. There's really nobody to like. The main character (Bradley Cooper) is clearly a sociopath. And he's not really a fun sociopath. He's a schemer. He has no boundaries. 

And the movie didn't serve up a single surprise. They foreshadowed the alcohol poisoning, and delivered it like 2 scenes later. They foreshadowed the ending as clear as day. Basically, if you saw a scene where people were talking, they were foreshadowing a later scene where the things they said would then happen. Sometimes, it was 2 minutes later. Sometimes, it took an hour. But, nearly every scrap of dialog was simply them telling us what was coming. 

This movie got nominated for Oscar's for production design, costumes, and cinematography. And I totally agree! 

It also got nominated for best picture and I couldn't disagree more. The writing was lazy.

And in the end, we see Stan get what he basically deserves. And who cares? I didn't. I saw it coming. It wasn't irony. It wasn't justice. It was just the shitty world of shitty people who do shitty stuff to each other. Bleh. 

It's a Tiffany box stuffed with a dirty diaper.",ri7edd
i2y58vt,"Finally got around to seeing this. In the opening shot where cooper drags the body from out of frame lower left to upper right while framing the hole beyond and setting up the next shot, I knew I was in for a well composed movie.

A couple questions and observations I have:

-Cooper intentionally kills Pete does he not? or was it his arrogance to grab the wrong alcohol and when he acted like he was listening to the lesson of Dafoe talking about the drinking vs. functional alcohol he actually didn’t regard the dialogue as important and therefore didn’t hear the details as most people do when they find your conversation uninteresting. 

-In a biblical context I believe Lilith is only mentioned briefly and is either a deceiver, seducer of men, or something along those lines which I think is fitting with her character.

-Enoch is said to have killed his mother at birth and that his eye “follows you like the paintings”. I took enoch as the omnipresent eye of witness, or of judgement and that he always saw your capability for darkness. Also Grindle’s woman was killed potentially as a result of her being pregnant and therefore a liability for Grindle. So the son (Grindles son) killed his mother in this way which parallels with Enoch’s description by Dafoe. Biblically, I think Enoch is the scribe of judgment as well. A stretch but interesting to me.

-The scar on Lillith and Enoch also seemed similar in their vertical orientation, “roughness/undulation”, and possibly the purpose Made me think that perhaps Grindle was the one who aborted the baby and that her (the mother) being his first violent attack on a woman that we know of, set up his pattern of hurting women in the future and led him to attack that region of Lillith because he associates that area with his pain or whatever he feels.

-Last question, why are the floor boards of the house removed in the opening scene? we see later the floor is intact in the flash back. Did cooper recover items from under the floor or was he “burying” his father and his shame within the foundation of the house where he was abused? It seemed like a lot of work to pull up the floor if you were going to burn it all down and not hide the body under the floor…

Curious to hear your thoughts! Thanks!",ri7edd
