comment_id,comment_body,submission_id
hovhhlh,That ending was incredible. So satisfying.,ri7edd
hp4l5ju,That’s what your bitch ass gets for cheating On Rooney Mara,ri7edd
hovf5aq,The violence really stuck out to me in this. It's a much more subdued story than I thought it'd be which lent itself to a real feeling of impact from it.,ri7edd
hovmnwi,Bradley Cooper killed it.,ri7edd
hovtkph,"Disclaimer: I've never seen the original or read the book.

Guillermo del Toro is my favorite director. I absolutely love his style and his stories. The first half of the film felt at home in a Del Toro flick. The darkness. The production design. The second half slowed, but still had some Del Toro touches.  I don't know why but the man loves tile walls and floors.

Overall I enjoyed it. The ensemble of fantastic actors came together for a dark story that was foreshadowed early on.

I did leave the theater confused about Cate Blanchett character's motive behind the double cross.  I wasn't sure if she just wanted the money, or she wanted to get back at him for humiliating her during his show.

Also. The murder / suicide in the middle of the film was SOOO loud!",ri7edd
hp5mhz3,"I might be in the minority, but I liked this a lot more than Shape of Water.",ri7edd
hp12871,I loved this movie. The ending hit me hard and my mouth was open and I was just so shocked. The brutal irony. I think this is Cooper’s best work - that scene of him laughing and crying will stay with me for a while.,ri7edd
hp4odd1,"There's been a few longer films this year and I'm glad this one didn't feel it. I thought it was pretty consistently entertaining.   


That being said....

This movie just felt weirdly shapeless to me. 

I know ""What's the point?"" is an overused/pointless criticism but in this case I really didn't know what I was supposed to get out of this experience.

The ending was incredibly telegraphed from the beginning of the film, which made it feel less weighty. 

Stanton fucks up and then pays in a pretty terrible way.. OK? 

He decides to start drinking because Dr. Ritter looks at him coy a couple of times. Later he suddenly shouts at Molly that he doesn't need her anymore. OK? 

His characterization was also all over the place. I don't think he, or any of the characters, had much in the way of motivation. So we're just watching archetypes go through things and have things happen to them - Molly is sweet and innocent, Ezra is arrogant, etc. 

I just wish there was more meat on the bone. I felt like in the end none of what happened really was of any consequence.",ri7edd
hovufub,But you can’t be any geek of the street… Earn your keep.,ri7edd
hpe871z,I want to live in Cate Blanchett’s office. That is the most gorgeous movie set I’ve seen in years.,ri7edd
hox983r,"I saw this last weekend at a screening where Del Toro was doing a Q&A after the show. The Q&A went long, and the people running the theater politely reminded the moderator, Nicole Holofcener, that they needed to get ready to screen “House of Gucci.” 

To which Del Toro said, “Gucci can wait.” And they kept going and it was awesome.",ri7edd
how35qa,I didn't know this was a remake but I liked it for what it is. I think Willem Dafoe was the standout.,ri7edd
hoypdtz,"I thought this was beautiful, stunning. loved the buildup. I hated Stanton for the entire movie because he didn’t help the geeks at the start, so his end was perfect. That final scene is gonna stick with me forever, of course you give that role to Tim Blake Nelson",ri7edd
hplftmk,"Some things that were *chef kiss* splendid about the movie in my opinion:

* The very last line of the film is different in the book. The book version is “I was *made* for this.” vs. 2021’s “I was *born* for this.” Extremely small change that dramatically shifts the meaning of the movie. In the book the implication from made is that his transformation to a geek is the culmination of his life choices and what happened to him. del Toro’s “born” implies that this was Stan’s destiny. That regardless of what he did in his lifetime, his fate as a geek was inescapable.

* The fact that del Toro put the Rorschach tests on the walls of Dr. Ritter’s office. He mentioned this conveys a sense of perfectionism in her office, one that masked the hidden chambers. Which was symbolic of her character. Exquisite and put together, but at the same time a carefully crafted facade to mask her true intentions. 

* The main focus of the movie is obviously witnessing a full circle in Stan’s character development as he goes from looking down on the geek with a superiority complex, to becoming the geek himself at the lowest point in his life. This theme is represented symbolically by the Ferris wheel.

* In the book he is not the only one who’s life can be described as circular. Molly’s father was a compulsive gambler and her husband after leaving Stan also turns out to be a gambler. She too arrives where she started as the victim of a man’s addiction. Which hits hard IMO because as the most moral main character, you would think her morality would exempt her from this fate, evidently it does not.

* The line when Stan enters Dr. Ritter’s office for the first time, “Did you hear? We’re at war.” Stuck out to me but I wasn’t sure why. I later read that this A keeps the timeline of events in our peripheral, but more importantly B it’s not just the US that is at war, but war describes the relationship between Stan and Dr. Ritter perfectly. They both need to feel powerful and superior to the other. Their time spent in her office is a battle of the wits. You see their perspectives shift constantly from Dr. Ritter looking down on him, to Stan looking down on her to demonstrate the back and forth between them. I saw many people where confused by her character’s motives. I think at the end of it, she needed the last laugh on him. She was not motivated by money but power. Money was a tool to get power over Stan. She needed to beat him as his own game.",ri7edd
hovuon2,"Film Noir tale of rags to riches to rags fueled by murder, greed and vengeance.",ri7edd
hp0ih3b,How a man that smart and good at scamming didn’t prevent Ezra Grindle would go running to “Molly” as a mad man? That scenario was very possible,ri7edd
hp40kez,"The set design was fantastic. Cate Blanchett's office was BEAUTIFUL, the round lounge where Stanton and Molly are performing their act was great, and the carnival in the first half was engaging and felt alive and bustling (the fun house scene where Bradley Cooper is looking for the geek was great). I loved all of the art deco in the second half.

Pretty disappointed in the character development and pacing. I honestly think that each major character could have used an extra scene cementing their motives in the movie, and that's saying a lot for a movie that I think was at least half an hour too long. 

I have a few issues with Bradley Cooper's character. To start, I didn't get why he joined the circus in the first place. Maybe I missed it, but they didn't explain at ALL that he was on the run, looking for a job, etc. I knew nothing about the movie going in and my hypothesis after the very first scene was that it was some mob hit. Then Bradley Cooper just gets on a bus and joins a circus on a whim? Surely he had a job or something right? I thought he was taking the bus back home or to the office or something. Really threw me off. 

I see lot of people saying that he's a ""think he's always the smartest in the room""-type character, but he starts off the movie SO incredibly meek. His lack of dialogue through the start of the movie almost had me convinced that he was playing a mute character. Then when he gets a bath at Zeena's, they do a terrible job selling him a suave, confident character (in fact it seems quite intentional that they were selling him as the opposite). But then he spends a few days as her Barker and all of a sudden he's got grade-A schmooze ability that he carries on through the rest of the film? The rest of the film plays out in a very circular manner, so I didn't get why didn't his confidence crash back down like the rest of him? It didn't sit with me.

Him starting to drink really threw me off as well. I thought they had done a good job setting him up as someone who would never drink, and not in the way that prepares you just enough to see him succumb. In the moment, it was just ""oh, that's weird, he said he would never drink but now he is. Cool."" I thought he was convincing enough when he told Cate Blanchett that he never drinks (Cate Blanchett pressing him saying ""Never. There's that word again."" left me wanting A LOT more in that discussion, but it was never really brought up again iirc), but small things like him fetching Pete a bottle of alcohol without taking even a small moment to consider a drink himself sold me that he wouldn't break. There was no foreshadowing at ALL, and him taking a sip from Blanchett's alcohol was not a satisfyingly dramatic, shocking twist because they hadn't set up the plot point that his father was an alcoholic. It becomes clear later in the movie how devastating this is (that scene is pretty much the turning point for his character arc), but you don't get that in the moment. His inevitable downfall after taking that drink felt predictable, but I didn't really know why because (again) that hadn't built up any weight to that action (aside maybe from foreshadowing with how it was Peet's downfall, too).

~~Super minor point, but the him having his father’s watch felt really underdeveloped too. I’m pretty sure they don’t explain that it’s his father’s watch at all until later in the movie, then have him say that he hates his father which imo throws out any emotional attachment that may have been built up to him owning it. Him pawning it off at the end still felt pretty sad, but I think the scene could have easily hit harder.~~ Edit: nvm, its mentioned when he goes to Zeena’s and talks to Pete

Not all scenes were terrible though. I thought the scene where the sheriff and police storm the carnival was a real bright spot in the movie. It was so satisfying watching Bradley Cooper talk his way out of that.

Thankfully the rest of the acting was pretty great. I really liked Bradley Cooper's performance regardless of how his character was written (his fluctuating accents kinda bothered me, but perhaps it's intentional and a throw back to when Zeena tells him to lay on different accents for different crowds) as well as Willem Dafoe's, Cate (lol it's spelled Cater in the post) Blanchett, Ron Perlman, and David Straithairn. Just a shame to see such great acting carrying an otherwise tough script. Molly didn't really do it for me - I think Rooney Mara's acting was a little stiff but I think she's really the only knock I can give the movie acting wise.

The closing shutter transitions felt a little unnecessary. I get that it was trying to invoke an older era of film making, but it really stood out in contrast to the rest of the film's clean, digital look. It didn't feel coherent at all. Like you can't just throw in old-style transitions like that and say the job's done. If they were trying to harken the entire movie back to 40's, they did a pretty terrible job imo (although I may be missing some things, I'm not a film studies person at all or anything). I really hope the black and white cut fixes some of this.

As I mentioned above, the movie was also pretty predictable. I guess that's not necessarily a bad thing, but I think I prefer to be surprised. I knew as soon as Bradley Cooper hid behind the cages of chickens that he would become a geek by the end of the movie. I also guessed the ending line pretty early on too, but I guess it was a satisfying end.

Also, not sure if anyone else picked up on this but some of the camera shots were really offputting. There was something really unnatural in the way that a few character's heads were bobbing in several close ups. At one point I honestly started to wonder if they were using heavy facial animations, and not in a good way.",ri7edd
hovb5zz,"I liked this but I was still a little disappointed. This movie is 40 minutes longer than the 1947 version and you really feel that extra run time. On top of that, the original felt like a much more focused film that was really trying to play as a critique on religion and this movie mostly dropped that theme, but there are still some vestigial remnants in the story that just feel underdeveloped. I also don't think the remake handles the tonal shift near the end as well as the original did. 

On the positive side, I thought the set design was really good. The carnival felt dirty, the fun house was creepy, and Cate Blanchett's office felt big and expensive. Willem Dafoe was tremendous in his relatively small role. He really felt like a sleezey old-timey carnival barker. I also thought the ending really improved on the original. In the 1947 version it felt like it sort of cops out for the happy Hollywood ending. This one is dark and depressing and Bradley Cooper's performance in that scene was haunting.",ri7edd
hox49zz,"He resented his father for two things: Alcoholism, and letting his mother cheat and escape with another man. 

Coincidentally, the first and last things he does in the film are:

Sleep with a married woman.

Accept the geek job after not even getting the chance to perform his mentalism act due to smelling of alcohol.",ri7edd
hpluple,"Seeing a lot of comments saying that the ending is hugely telegraphed, presumably by the scene between Cooper and Dafoe after the first Geek is dropped off, but for my part I think it enhances the ending. It would be one thing if Stanton is blindsided by the geek job at the end, and if we actually saw him in the role I think that would be a detriment. But as that offer is given, he knows exactly what job it’s gonna be and that wouldn’t be the case if it weren’t signposted ahead of time",ri7edd
hp9773n,"The best things about this movie in my opinion are both Cooper’s acting and the writing for Stanton.

Throughout the film you constantly want to like Carlisle until you remember how absolutely terrible of a person he is. The con man character manages to con you throughout the entire movie. What makes the role even more fulfilling are the not so subtle, stereotypical gaslight lines Carlisle will pull throughout, and they are delivered so well that it takes just a second for the true intention to click. A great example of this is when he is chasing Molly into the men’s bathroom trying to convince her to help him and he says “please dont leave me like everyone else” or something along those lines. Gaslighting 101, but the scene is crafted so well and Bradley Cooper does such a great job that for a second you think this is a romantic moment, only to realize it’s typical manipulation that Carlisle has been pulling on customers the entire time, now just expanded towards those he “loves”.",ri7edd
how5f89,Seeing Nightmare Alley and Spider-Man No Way Home on back to back evenings was a trip because of Willem DaFoe. Two completely different performances but the masterclass of DaFoe’s acting was amazing. No pun intended.,ri7edd
hovmqi5,"This 1000% gave me Uncut Gems vibes while watching this. Stress, tension, bad decisions.

 Only difference was I wanted Howard to succeed while I FUCKING hated Stan. I felt like the Cate Blanchett might have been a step too much, the reveal didn't really hit with me.

Him turning into a geek at the end was such an awesome ending tho.",ri7edd
hovrmao,I swear this man would make a pretty good Bioshock movie.,ri7edd
hpax9dj,"I feel all us Nightmare Alley fans now look like ""the final shot"" now staring at the box office difference between Nightmare Alley and Spider-Man.",ri7edd
hovbw9b,"The first half of ""Nightmare Alley"" in the Carnival I sadly didn't find too interesting and while I appreciated the character developments it just didn't hit with me.

However, as soon as the 2nd half kicked of with the Cate Blanchett as the psychological and Richard Jenkins character the film really went up a notch. I really loved how interesting and entertaining the 2nd half was. I just wish the 1st half had a bit more going on.",ri7edd
hp9b93t,"Being a Russian, this movie had a very typically dark and depressing Russian feel to it and I enjoyed it very much. I love watching character driven films with moral ambiguity where you can’t tell whether or not to root for the character. 

It did kinda meander at times, but the pay off was so satisfying.",ri7edd
hoz8u2p,"I absolutely loved this! The ending was fantastic, so much better than the cheesy happy Hollywood ending of the original.

I'm not usually a big fan of Bradley Cooper, but he was perfect as Stan Carlisle. I can't imagine anyone else in that role.",ri7edd
hqs0ubj,"Bradley Cooper was physically imposing as fuck in the movie

felt like he was towering over everyone lol dude is a 1950's movie star through and through",ri7edd
hpj4t0f,"Why did Cate Blanchett saying, “I really did love you” stop Cooper in his tracks and make him realize he’d been played? Was that a reference to something earlier I missed?",ri7edd
hphleg3,Am I the only one that thinks this was del Toro's most beautiful movie? The lighting of the carnival or the city was gorgeous and the set pieces were magnificent.,ri7edd
howf95m,"It was fine. I do enjoy movies that bring things full circle, especially when you can look back and say, “yeah that was fair game, all the hints were there.” But it never felt for me like there was a third act. Pacing was poor, and the “twist” was obvious. Great ending, though.",ri7edd
hova2rh,"For anyone who's seen the original, how does del Toro's version stack up?",ri7edd
hov9khl,"I thought this movie was pretty interesting. Del Toro doesn't *always* do it for me so I was prepared for this to be well acted but shallow, but ended up walking out with quite a bit to chew on. Honestly, though, I probably would have enjoyed watching a cast like this do just about anything.

The setup for the plot takes its time, which is both nice and maybe a little unnecessary. As far as the plot goes, there's lots of interesting characters and themes to think about, but where it's all going is very clearly laid out for us. From the explanation of how to turn someone into a ""geek"" to the professor telling Stanton exactly what happens to people who misuse the con to the tarot cards, we are well aware that this is all leading to Cooper's demise at the hands of his own hubris. Even the IMDB summary of the movie spoils the ultimate twist that Blanchett was in control the whole time. 

That said, watching it get there is pretty neat. This isn't an especially humorous movie, it's actually very moody and at times melodramatic. But what it lacks in humor it makes up for in an interesting main character. Basically, you've got a guy who thinks he's the smartest person in the room at all times. He thinks he hides his past well, he thinks he can read others so well, but as the movie tells us he's as desperate to tell people who he is as they are to tell him. He thinks he's different from the preachers when he's just as bad. He thinks he hides his sins well, but Toni knows what he did to the professor. He thinks he's always in control, but as we find out he's the most easily manipulated. That's why he was ""born to be the geek.""

Blanchett played him just like Dafoe plays the alcoholics. She offered him an opportunity, temporary of course. Make a few bucks and move on. She made him feel vulnerable with her evil powers of psychology. She hooked him on the booze and made him feel in control by sleeping with him. All until he finally broke and hurt someone as she wanted him to, and she did all this despite everyone in his life telling him it was going to happen if he kept doing spook shows and manipulating people. And this whole time the eyes of every character are on him and none are on her. 

Anyways, enjoyed this. 7/10 for me. It's a bit longer than it needs to be and it's not very subtle, but the characters and themes were on point. And let's be real, a moody melodrama with this kind of budget just doesn't come around every day. It's worth enjoying when it does.

/r/reviewsbyboner",ri7edd
hp8v8fe,"The only gripe I had with the film was Cate Blanchett’s character is billed as a psychiatrist and not a psychologist. Psychiatrists treat symptoms and write prescriptions. Psychologists are the ones who sit down with clients and listen to their problems. 
That is always a pet peeve of mine in films because they often get the two mixed up.",ri7edd
hpcdrk3,"The instant we saw the Geek in the pit I leaned over to my gf and said ""I bet he becomes that by the end""  

Welp.",ri7edd
hqijit8,"Just wondering if anyone else realized the 1st geek was Arthur Shelby from Peaky Blinders….

Also watching this movie reminded me of the show Carnivale….",ri7edd
hp0sjf5,"Reading some of the comments and finding out this is a remake, I just read the wiki about the original and it has a somewhat hopeful ending for Stan and Molly. 

I don’t know about you guys but I’m glad Stan got a taste of his own medicine in the end. He went too far which is what basically happened to Pete becoming a drunk. My favorite scene has to be when Molly played the part of deceased wife and Grindle is like who the fuck are you?! And of course the ending. His laughter was so sad yet I think he knew the irony in it and accepted his fate. 

Overall though the movie did feel like it dragged a ton. But I really did enjoy all the set ups and pay offs. The acting was great and probably Bradley Cooper’s best performance.",ri7edd
hp1p4gu,"Pleasant enough, competent enough, never dull in any given scene, but never really comes together for me narratively. 

The performances are all solid but there's not much spin put on the EXTREMELY predictable plotting. I thought the pacing was fine, I never felt like my time was outright wasted, but in hindsight there are some bits that didn't quite get fully developed that perhaps could've been cut. I've never loved any of Del Toro's films but there's nothing about this one that I think will stick with me like certain parts of, say, SoW or Pan did. Somewhere between a director for hire and ""A Guillermo Del Toro"" movie for me.

I almost feel bad because there's a lot of solid shots in this, great costume/set design. Will say something about the visuals as a whole here feel odd to me though, like a modern digital hue over mid century aesthetics, a digital look purporting to be analog sensation I can't quite shake. Death by middling opinion.",ri7edd
hplpona,"Really enjoyed this film. Was a nice cleanse from the marvel/dc juggernauts. Nothing wrong with those movies but nice to see something that’s just for adults. Cinematography and lighting in this movie was top notch. Story was ok, but actors really brought it with the performances.",ri7edd
hozlwg0,Not really what I expected from the sequel to Carol.,ri7edd
hpug6yu,"I saw this last week and absolutely loved it. I just read other comments observing the last line is different in the book (""I was *made* for this"" rather than the movie's ultimate line ""I was *born* for this""), and oddly enough while running this morning I listened to Marc Maron's podcast interview with del Toro where the director talks about how there are circles throughout the film in design and background elements, and how it all connects to the 360 Stanton does with the gimp.

It gets pretty heady-- the narrative focuses on grifters and cons, and how people want to believe in the supernatural and that want is used to exploit them (us), but there's simultaneously this notion of fate that underlies all the worldly cynicism. Yet another reminder why Guillermo del Toro is my favorite working director, as if I needed one! Dude isn't just passionate, he's also meticulous with fleshing out his ideas. What a master.

NA is lengthy, and I was kinda tired seeing it so I had a hard time in the middle, but that said I don't think it was too long per se, my being tired is on me. We NEED more decadent movies like this that aren't box-office friendly, the increasingly profit- and formula-driven nature of the industry is plainly strangling it to death.",ri7edd
hovs8i9,"From what I've seen, a lot of people are split on this movie. To be fair I haven't seen the original so I don't have anything to compare it too. However, I think if you've liked Del Toro's previous stuff, then you'll definitely like this. I think the style and sets of the movie really sell that noir feel. While I've seen people say Del Toro is often style over substance, I think the style definitely elevated the movie here. Lots of foreshadowing and symbolism at play that's fun to think back on once you've seen the whole movie. I thought everyone in the movie was great but Cooper and Defoe really stand out to me, especially one of Cooper's scenes towards the end (I'm sure you know the one I'm talking about). I agree with other people that the movie feels long. And it kind of is at 2hrs 20mins but honestly it felt longer than that. Idk if it was the pacing or the fact that the movie feels like it's covering so much ground or both. Not many redeemable characters in this movie and it does make it hard to watch at times. However, watching the shit show play out towards the end is more fun because these characters are so despicable. Overall, I enjoyed it and it's inspired me to watch the original since people say the storytelling in that is tighter.",ri7edd
