comment_id,comment_body,submission_id
hpe0dev,">The first half of ""Nightmare Alley"" in the Carnival I sadly didn't find too interesting and while I appreciated the character developments it just didn't hit with me.

As a fan of Adventureland, I loved it",ri7edd
hv88zi9,The first half of the movie sets the stage for everything and builds the world.  The second half would have far less impact without the first.  It also establishes that most of the characters are deceptive and everyone is a potential mark.,ri7edd
hwaj9ee,"> Being a Russian, this movie had a very typically dark and depressing Russian feel to it and I enjoyed it very much.

hahaha.  this is peak Russian.",ri7edd
hss00x4,I got to watch some Russian films then.,ri7edd
hp7bcbx,I can imagine a younger actor in the role but no doubt Cooper killed it!,ri7edd
hpmeyvt,"her very next line was  ""Did I oversell it?"" she was pretending to care for and open up to him throughout the movie, but when she actually made a declaration of love it was too much and he knew it was bullshit.",ri7edd
hqscp9o,No because Pan’s Labyrinth exists.,ri7edd
hpn94le,"I prefer this movie to Crimson Peak, but I’d probably say Crimson Peak.",ri7edd
hruosqr,"Every scene change, i keep thinking ""This shot is beautiful"".",ri7edd
hz0j1qc,Ugh now I want to watch Pacific Rim again. Those mechs...talk about beauty.,ri7edd
hovbgum,I mostly prefer the original but that isn't to say I dislike the new version. I actually think Del Toro did a much better job with the ending,ri7edd
iwco5jo,"If you haven't seen the original I would definitely check it out. Its definitely a ""tighter"" story and the pacing is great.  GDT's version has been ""looking"" or ""crafted"" scenes however you want to say it scenes but the story (pacing) and characters of the original are better.",ri7edd
hpa4246,"You make a great point, movies like this just aren’t being made any more. Was it my favorite movie? No. Was it better than any of the blockbusters I’ve seen in recent years? Yes. I enjoyed it, an I hope filmmakers make more movies like this in the future!",ri7edd
hp4encb,Also I have worse things to do than watch Cate Blanchett create ear-blowing-off fetishes for me.,ri7edd
hqi68sb,Toni knows what he did to Pete? What did i miss?,ri7edd
hwybvax,What makes you think Zeena knew that Stan was responsible for the professor?,ri7edd
hxjekd1,"> I was prepared for this to be well acted but shallow

wait, what? his films are anything but shallow",ri7edd
hvk01cb,"Psychiatrists arent just pill pushers, they provide psychotherapy as well just like psychologists do",ri7edd
hvtd9fg,"If I remember correctly, she was a psychologist with a PhD., hence the Dr title.",ri7edd
hvkavi8,"this is incorrect, no wonder you keep struggling with your pet peeve ;)",ri7edd
i23pm6t,[eh you're wrong. the card literally says Consulting Psychologist.](https://imgur.com/a/TIUjZ9L),ri7edd
hwzpchb,I think you would be correct currently but not historically.,ri7edd
hxjs7bp,When did they say she’s a psychiatrist?,ri7edd
hpeqq18,My wife also was pointing to Enoch the fetus and said that’ll be the final twist. Glad she was wrong haha.,ri7edd
hxjqrlh,"I mean, the director intended that so that’s good. 

Del Torro said they wanted to be signaling that from the start of the movie. They didn’t want it to be a surprise. They wanted the how, not the what. Hence the line at the end “I was born for it”, telling us “yes we all knew this was coming.”",ri7edd
hqzo8mv,That was Arthur Fookin Shelby?! No way.,ri7edd
i1vh52d,"He was really great, didn't recognize him at all.",ri7edd
hqijs4x,The original movie is based on a book which had the same dark ending as this.,ri7edd
iavnizh,Yeah it was refreshing to see an adult movie with a budget this high,ri7edd
iwco9aj,">Nothing wrong with those movies

theres def something wrong...",ri7edd
hpe7f2b,For me it felt like GDT’s take on the master by PTA but that too,ri7edd
hq4pwfa,Thanks for the podcast recommendation my guy,ri7edd
hp7c7c2,I’m very surprised this movie isn’t universally being praised.,ri7edd
hp9ngvr,This isn’t a re-make. This is an adaptation of the book and is much more faithful than the ’47 film,ri7edd
hp5dajy,He is my favorite director and this movie just left me feeling very cold. I honestly hated the experience of viewing it and I found it to be thematically shallow and vapid. My most anticipated film of the year and also the worst thing I paid money to see. I paid to see Jungle Cruise.,ri7edd
iwcpe8z,"> 2hrs 20mins but honestly it felt longer than that

watched this yesterday afternoon on couch sick started at 330 and ended around 8pm with potty and snack breaks...was almost a whole day experience....

&#x200B;

if you haven't seen the original it's great short and concise compared to this but it doesn't have the shots of people just thinking or snow falling in beautiful 4k full color",ri7edd
hpvvr1q,I was blindsided by the end too! I gasped loudly.,ri7edd
hsldfba,"I thought it looked familiar to the hospital in ""In the Mouth of Madness""! Thank you",ri7edd
hqazz4c,The Jesus saves Us sign is from his old movie mimic as an Easter egg 🥚,ri7edd
hovhh5d,"Same, realizing that Stan was becoming a Geek and piecing it together was fun",ri7edd
hp03ffl,The pacing wasn’t bad but a good 20-30 minutes could’ve been cut to make it feel tighter.,ri7edd
hp9o516,">	I don’t get why Cate Blanchett hated Stan so much

She didn’t hate him 

The same reason audiences were entertained by watching a geek eat a chicken is why she manipulated Stan. She did it because she could. She’s just a cold Femme",ri7edd
hp3z45r,I watched it last night and I had a different take than the other response you got. It seemed to me it was purely revenge for him humiliating her in his show.,ri7edd
hss0ss2,My gf thinks it was professional rivalry and spite after Stan insulted her in their first meeting. She had to show him who was the better mentalist.,ri7edd
how81fe,[deleted],ri7edd
hp5710v,"He was her mark from the moment he walked into her office, and she knew it. Crossing him let her cut him off forever and take the only thing he valued.",ri7edd
hpl3mhy,He humiliated her at the show,ri7edd
hr8af7p,"I mean, he'd just killed a powerful and well-connected guy; it'd be dangerous if anyone found out that they were buddies.",ri7edd
hzhyxdb,"It was said that in a Q&A with Guillermo del toro that her scar was from Ezra. Making her one of the girls that Ezra admitted to hurting. So part of it was to get back at him. While also using Stan as her instrument, or geek, and basically grifting him as he has done so many times to others. And show him how it’s professionally done.",ri7edd
hplmgka,Love this point. If you look there are also the rorschach tests on the walls of Dr. Ritter’s office.,ri7edd
hp3yxcb,"1) I almost wondered if it'd turn out that ""Enoch"" was Dora's child, with how much emphasis there was on him, but that doesn't seem to be the case. I think it's just meant to be about the overarching theme of parenthood and what people are passed onto by their parents.

2) He doesn't seem to have abandoned her, but instead forced her to get an abortion/purposefully miscarry, which ended up killing her as well. And while she was the one closest to him, she wasn't the only person he treated that way.",ri7edd
howilqk,"I loved his performance at the end too and it's one of those haunting images that will stay with me. Seems like it's truer to the original source material than the 1947 adaptation (in which he gets back with Molly).

In the summary to the 1946 novel, the ending plays exactly the same as the movie:

>His life in shambles, Stan finds a carnival owner and asks to join the sideshow as a palm reader. The owner gives Stan some whiskey but refuses his proposal, saying the show is full. But as Stan begins to drunkenly stumble out, the owner changes his tune and invites Stan back in with a job offer: ""Of course, it's only temporary – just until we get a real geek.""",ri7edd
hp044m3,I think (as others have probably mentioned) the betrayal by Ritter actually works incredibly well because it is the exact same con Dafoe explains earlier on… only using the promise of money and power to manipulate as opposed to alcohol.,ri7edd
hrqsiap,">Dr. Ritter to betray Stanton 

I thought there was going to be a connection between Toni Collette and the psychology. 

TC seems to not really be interested in the fact that this dude essentially stole her act and is living the high life off it.",ri7edd
hrqsmx1,I guess I didn't buy him being an alcoholic. Maybe I missed it but was there a reason he couldn't find like manual labor? I realize he was shot but I didn't get the sense that it was work preventing.,ri7edd
hpepsgd,Less about being money hungry and more about “believing his own lie”. Poor Pete warned him. He just hurt the wrong egos.,ri7edd
iwcqyfs,">I honestly didn’t think Bradley’s character was oh so hungry for money

like he wasn't making enough money two sold out shows a day in a ""theater""",ri7edd
hqe4l3a,"I honestly can't understand how you could think this. 

This reads like a robot AI wrote it. I thought the characters were not well executed. This movie suffered telling and not showing. 

4/10 boooo. Bradley Cooper was terrible. Defoe was amazing and seeing Cooper try to respond felt like I was watching a highschool play.",ri7edd
hox7z3l,"The non-existence of magic or otherworldly things make sense in this universe to me. You want Pete to have some special sight or power. Instead he has a system. You want the Geek to be some type of man-animal hybrid, instead it’s just a gut that’s been drugged out of his mind and neglected. Even Molly’s show comes at the cost of suffering. Giving people hope (by showing real magic or by selling spook shows) would run counter to this movie’s goal so I’m glad Del Toro kept it real and gritty.",ri7edd
hp0sykr,The visual nightmare was the beating of Grindle and the Geek eating the chicken. Looked away at that part haha.,ri7edd
hp9qeqb,"Don’t worry, I hear his next film is about a wooden puppet that comes to life.",ri7edd
hpe1g41,"I got Pan's Labyrinth, but in a different way, and I might be talking crazy.

Nightmare Alley: Horror look in a slice-of-life story, up until we meet Richard Jenkins

Pan's Labyrinth: Horror look in what could, with some alterations, be a kid's movie. I haven't watched the movie in a long time, but I always wondered how it would play to kids if it was toned down",ri7edd
hpe79jw,I was thrown off expecting some level of speculative fiction or fantasy but still enjoyed it overall,ri7edd
hpw61gq,"There where a lot of small but amazing visuals with the lightings. You might not spot it right away but it’s very controlled and very stylized. For example when he’s performing at the hotel the stage lights following him are done with a snoot modifier. Stan later gets a call from Lilith at the hotel and when he picks up the phone he’s head is illuminated inside a spot light most likely achieved with a snoot modifier. There are tons of little details like this through out the whole movie, making the whole thing feel stylized and more glamorized than real life",ri7edd
iwcrca1,"NO thats what I can't stand about Guiremo DT movies, it's always little cute goblins or whatever...I mean it was great when I seen it in Pans Labrynth 20 yeas ago but don't need to see Cute cuddly gremlins again...",ri7edd
hst6d4j,"It's 2 and half hours, and why?",ri7edd
hpuf2wq,"I usually agree on Cooper (although he's terrific in Wet Hot American Summer imo), and going in I wasn't keen on his casting since I knew it was written with DiCaprio in mind, but Cooper really surprised me here, esp. in the first half where he's largely silent and reacting to his surroundings. I think he did a good job here, but I think overall I share your opinion.",ri7edd
hr8b8ar,It's nice seeing a movie in the 1930s/1940s period which isn't just war/adventure.,ri7edd
hpw8a5e,"It’s funny how he flips the hanged man right way up, with regards to the ending.",ri7edd
hpb0avs,"You don't get Hot-tub HJ's in marvel movies, I'm always saying that.",ri7edd
hpll72j,"Wood alcohol is considered a poison, but it was poison Pete consented to drinking. Stan did not poison Pete per se, but it is sort of ambiguous as to whether or not he consciously/subconsciously gave him the dangerous alcohol because he wanted the little book Pete owned. In the Original story Stan also has an affair with Pete’s wife and it’s interpreted that Stan gave Pete the wood alcohol so he’d pass out and be out of the way for Stan to spend time with her. Even then it’s sort of ambiguous as to whether Stan intentionally was trying to kill Pete or if he was merely complicit in aiding Pete to kill himself.",ri7edd
hppcow0,"I think he killed him on purpose. At least I thought the Blanchet character made that assumption when she analyses him the first time. That he had a pattern of killing father figures.   
I think Pete sensed how dangerous Stan was. The last thing he said to him was to not buy his own BS, but Stan has already chosen to kill him.",ri7edd
hpb9wn0,"I think it’s kinda ambiguous, he probably felt guilty about it just like he did with his father-but my impression was it was intentional so he could get his hands on the book.",ri7edd
hpcbzn8,Suggestion that Grindle might have damaged her in some way and she knew she could use Stan as a proxy for revenge.,ri7edd
hwlnhgz,She is a psychopathic supreme narcissist and he hurt her ego so she ruined him.,ri7edd
hqaz8fe,"I don’t think he was broke - he was naive or thought he was grifting by letting her keep all his riches from the marks. 

She scammed him in the end by only giving him singles

Love the concept of the Enoch explained that way! I also thought it represents destiny a bit as it kept appearing",ri7edd
hveeyma,Came here to say exactly this. Blown away that Cooper would spoil the ending like that on Colbert. Unbelievable.,ri7edd
hv7zi0s,I saw that interview and you could pretty much guess the ending when Cooper was learning from the guys.,ri7edd
hp9n2z7,"It’s sadder because it seems a bunch of people who even went to Nightmare Alley completely missed the point of it. I overheard an older couple saying “this was not a good holiday movie, too dark” and I cannot for the life of me think of what they were expecting.",ri7edd
hsvsyqb,Spider-Man was excellent,ri7edd
hpnae2v,"I don’t really watch Marvel stuff anymore (too many) but I accept that something like those will always beat something like this. What depresses me is that there’s less and less room for anything *but* the Spider-Mans, with me having to hustle out to see Nightmare Alley today before it gets cleared out so Spider-Man has more screens to play on. Maybe if we all buy it on Blu-Ray, it will make back 10% of what they spent on it.",ri7edd
hvygjsf,Get off your high horse pal. The majority of people dont want to spend $25+ plus travel each to see some high art film. They want the experience. If anything blame ticket prices and theaters gouging,ri7edd
hpeq8ih,"I’m very angry that the said toy commercial wasn’t even a genuine attempt at story telling, something like a Civil War or Infinity War. It was simply cringe dialogue referencing previous films one after another non stop for 2.5 hours with no semblance of a fucking plot. I’m a Marvel fanboy, but watching Nightmare Alley (and seeing its box office) has convinced me of the absolute crap that the general audience has lapped up in the name of entertainment.",ri7edd
hqdcmba,Blame Disney too,ri7edd
hp57ngr,"1947 has much less character development. The relationships between some characters are less well defined. Every scene has to advance the plot. Sometimes it tells, where the 2021 version shows. Still a good movie for what it is.

2021 spends more time building and has a much darker tone",ri7edd
hp0t2o9,The ending is drastically different. Given I haven’t seen the original but the ending for this movie is great.,ri7edd
iwd4zop,"it's a more concise executed story..pacing is a lot better.

&#x200B;

This movie does a lot more character building and has more of a ""gothich"" feel",ri7edd
hqdb9nx,I saw little to no advertising for Nightmare Alley but holy crap I’ve seen the Kingsman trailer in front of nearly every movie I’ve gone to over the last few months.,ri7edd
iwd5cw8,">I noticed he didn’t wince or move when he tasted it which made me wonder if he had a drinking problem in the past

the way he just downed it like it was a shot was very deliberate meaning he was a heavy drinker before...",ri7edd
hwro732,Bring back Art Deco!,ri7edd
hu82c55,Couldn't agree more. Wohaaa!!!!,ri7edd
hxu4elz,"He did get away from killing his dad, the carnival mentalist, his con, and causing the death of the couple by suicide- he didn’t go to jail or anything. But you can’t run from yourself in the end. He became a geek to punish himself/ “I was born for this”",ri7edd
hwlh7dl,There was something likable about Stan though. Maybe he fooled us too.,ri7edd
hwrwq97,"Yes, the whole time I was thinking of Carnivale while watching the movie. I miss that show so much! 😭",ri7edd
iwd5wa7,">Tyrone Power was absolute aces in the 1947 version and looked the part a wee bit more

ya, felt Bradly cooper felt a little too old but TP was about the same age off maybe 2 years in the 1947 version...

&#x200B;

Speaking of TP have you seen Witness to the Prosecution?",ri7edd
hvopcbm,I'm with you man 💪🏼👍🏽👌🏻,ri7edd
hqdk08s,Shape of Water had some solid Deco throughout.,ri7edd
hqe3tod,"I thought there was some horrible lighting in this movie. 

The scene where the old drunk shows his the act. The spotlight is so bright, it looks completely unnatural. Cooper also walks in front of other actors casting a very harsh shadow on them. It looked downright amatuer. If it was on purpose I question the artistic decision.",ri7edd
hvk0zr2,Or how much they drank. Even in modern movies especially if theres rich and powerful people involved it seems many drink hard liquor through most of the day,ri7edd
hqqgj0i,She gets a happy ending in the book.,ri7edd
hsg2jzi,That's the reason why people loved bleak endings in films.,ri7edd
iwd6gkl,">wouldn't expect someone who refused to drink his whole life to become dependent on alcohol

I think he was an ""alcoholic"" who wasn't drinking.  This is show cleverly with no buildup in the movie he downs a whole glass of liquor like it was a shot of water...he's done this before and he does it so nonchalantly like alcoholics drinking again after long periods of sobriety for no reason...",ri7edd
hrb5d7h,If this worse than shape I’m glad I didn’t waste my time,ri7edd
hst78im,That's the point. It explains how the geeks become the geeks. He became an alcoholic and a drug addict and had no other options. Willem Defoe's character explains this at the restaurant. He finds addicts down on their luck then roofies them opioids so they feel like this work feels better than not having it.,ri7edd
hrfryvp,Because he had nowhere else to go.,ri7edd
hvsdcc4,"My guess is that he did it because he felt like that was what he deserved. He left a trail of destruction behind him and didn't feel human, or entitled to be one, any longer.",ri7edd
hu74hcd,"She's a manipulative sociopath who enjoys messing up people's lives merely because she can. Stan thought he could trust her with the money because she was already rich, but she just wanted to play with him like a cat playing with a mouse.

In the original movie, and novel too I suppose, Stan didn't kill Grindle, and Lilith went on to marry him.",ri7edd
hwrnxcn,"I think Ezra gave her that scar, and she used Stan to destroy him.",ri7edd
hv97uc0,"It seems like that represented the ‘spirits’ that possessed him. That he invited in by his choices .

It was like there was a traditional moral tale about sin and evil, which also had a modern equivalent, that spirit being his subconscious and the psychology of it all.

That’s powerful you could relate so much. I had a similar experience . I have been in a type of relapse state of mind lately , but not with alcohol but other things. It’s really causes me to drift away from my recovery groups and recovery/spirituality in general .

I have found myself wanting to take the reigns back for life , do my own thing, be ‘free’. I could feel my ego growing , and family fading the back of my mind. Ambition and radical new adventure plans starting to make a lot of sense .

Anyway I’ve been in the dilemma for a few days. Struggle with this duality , of this new energy vs. my recovery type of life .

This movie felt like a therapy session for me . It was existentially terrifying and a wake up call . Especially the ending , all that bills up really set me up for the shock ! 

Really reminded me the blessing I’ve had while being in recovery groups, rediscovering love and family , and grace etc.

I found the story very powerful . And it was the black and white version which I didn’t know going in, so it felt pretty special . :)",ri7edd
iwd6wr2,">Lilith knew he was pre disposed in many ways and that's why he avoid it drinking, she knew it would destroy him.

as I posted above on a comment

I think he was an ""alcoholic"" who wasn't drinking. This is show cleverly with no buildup in the movie he downs a whole glass of liquor like it was a shot of water...he's done this before and he does it so nonchalantly like alcoholics drinking again after long periods of sobriety for no reason...

&#x200B;

This was the beauty of LIlith is she knew that he could only say NO for so long sooner or later his ego with get the best of him and he takes to it like he never left it like any alcoholic who has long periods of abstinence does...",ri7edd
huthwnz,Seconded. Those long shots of the carnival in black and white were stunning.,ri7edd
hwrnm5w,How do you do this? Is it an option at theaters or HBO?,ri7edd
hvt7ag8,I took it as Stan realizing he was conned at that point.  There was no love involved and he knew she wouldn't say that.,ri7edd
hwrn7zv,"I was thinking that she used Stan to destroy the rich guy who hurt women, that he had hurt her, thus her scar.",ri7edd
hvosm5t,"oh wow, that's sounds incredible! I hope they filmed all of that and the longer version gets released",ri7edd
i04xrdw,I’m pretty sure Clems wife is the pregnant lady collecting payment for the geek show,ri7edd
hp57ry5,I think it was part of the film noir vibe they were going for but more than once I wish I had subtitles. Didn’t help the names were a little weird too.,ri7edd
hq4pq8p,When I saw the scar I immediately thought she could play The Boss if we lived in a world where we could see MGS3 snake eater as a movie lol. Felt like such a random thought but glad to see I'm not the only one lol,ri7edd
i13v8nu,"I feel like it was kinda both.. his father presumably miles yes him and was a bad, alcoholic father.  But yeah killing him is taking it to the next level.",ri7edd
iwd7pqc,"watch original, you will appreciate it more then...",ri7edd
htwbded,"Pete, Zeena partner, is talking about ""shuteye"" and his act going sometimes too far because you can't foresee how bad it can go or how far you are willing to go.

This is the downfall (one of the tarot card drawn by Zeena in the hotel scene) of Stan. He went too far trying to con a big tycoon man with power to exact revenge, not being able to see that Lilith was herself coning him. His ""vision"" was shut and it led to his demise.",ri7edd
hv98z9i,"Well maybe the eye is reality , or you could call it ‘God’ even . Essentially it’s the full picture , and Staton is living this blind life , running from darkness of his past . All seeing eye ? 

Kind reminds of the fact that throughout the movie he always reading or observing other people . Inside of looking inside himself maybe",ri7edd
hvnll9v,"I just watched it and I agree. I feel like there are two good movies here in the front half in the carnival and the back half with the mentalism. But put together it just becomes too long and without any purpose until you get to old crazy guy, which is about 2/3 of the way through it. I had no idea on what the plot of the movie actually was going to be  until that point. 

Great performances, beautiful cinematography, but entirely too long and without focus.",ri7edd
hvlba2k,">  I knew nothing about the movie going into it, and by the halfway point I was still having a hard time understanding what the movie was even about. It just kind of meanders from one set piece to another, but it doesnt really have a plot until we finally get to the old rich guy. 

Yeah, I'm with you there. It was such a gorgeous film though that I didn't mind the meandering too much. The middle section definitely dragged on, but I was pretty engrossed in the plot by the end.",ri7edd
hp1k56i,I completely disagree. I like the fact that the film took its time to showcase the impeccable production design and introduce its characters and their motivations in a deliberate manner rather than spoon feeding everything right from the start.,ri7edd
hpfqa27,"One thing that would have greatly helped my appreciation and enjoyment of the film would have been feeling a little more tethered to Rooney Mara's character as she was really the only ""good"" person in damn near the entire back half of the film.",ri7edd
hqe4ca9,Was he swinging at the air? That's how this movie felt.,ri7edd
