comment_id,comment_body,submission_id
hzfsgrh,"This is a silly comment. She obviously had a privileged life, but I don’t think owning a football team means your kids just get to be movie stars lmao. She has talent and beauty to go along with it.",ri7edd
i5egeme,Who gives a shit? If she's good at what she does then this doesn't matter at all and isn't even worth mentioning,ri7edd
hvub4qg,got dam,ri7edd
hwqd05d,She's much better than her sister at least.,ri7edd
hxsw62k,“poor mans” demi moore,ri7edd
hw16vq2,I though that final speech in the car was good,ri7edd
hw21yij,top?,ri7edd
hp4esug,The moment he realized Grindle had murdered multiple women and he'd just put the lady closest to him in that same position made him snap. We also saw he was pretty strong when he took down the geek so easily in the beginning.,ri7edd
hu7l724,"Del Toro loves a good face bash in, reminds me of the scene in pans labyrinth where sergi lopez bashes the peasants face in with a bottle.",ri7edd
hp83fc5,I thought it was glass from the glasses.,ri7edd
hp5w0oa,"This is actually much less unsettling to me, as I initially thought it was a shard of bone from the nose.",ri7edd
hwfxma5,I thought it was just bone fragments?,ri7edd
i5pp46y,i thought it was skull fragment,ri7edd
htny0oh,"Agreed.

I think it's always especially harder not just for the graphic nature, but because it's an animal. I can gladly sit through the most graphic scenes in something like the Saw movies, and be eating too. But when it's an animal, I just feel that much more uncomfortable watching.",ri7edd
hqd84pa,"Honestly I thought it went too far. Not really what I thought I was signing up for, CGI or not",ri7edd
hvd1jgf,Aren't most people totally cool with chickens getting killed though?,ri7edd
hvufxfm,"Me too. I wonder if filmmakers think about that. Let's give people a chance to look away, if they must.
The face bashing was fine. I jsut think about Face Off, and what techniques the makeup artists used",ri7edd
hw6e4ti,Couldn't watch that scene.,ri7edd
i4gsgjq,Aw wish I could upvote to 💯,ri7edd
hvf6one,"Person with a small caliber revolver, that's how she shot her husband as well",ri7edd
i1qcxve,"Film has quiet a few bits of eye symbology. The circus at the beginning, the baby in a jar with a giant eye ‘that followed you around’, and her shooting herself. Probably to represent what people see when they are being conned by Stan.  Maybe even ‘foresight’ from the tarot cards.

I was surprised Rittens shot hit Stan in the ear and not eye tbh. Might be a hear no evil, see no evil, speak no evil (symbolised by the alcoholism) sort of thing.",ri7edd
hvug3ce,I thought that the gun moved when she pulled the trigger. I don't think she intended to do the eye.,ri7edd
hup82lc,"When Stan said ""You'll be joining him"" I was like, you just pushed someone with depression to a closure of her life. Didn't really think it was gonna be shown like that",ri7edd
hp5d8t1,The murder suicide with the judge and his wife.,ri7edd
hp7zhf3,"Fuck you, Debbie!",ri7edd
hrywc3c,As soon as she mentioned being together with their son again I knew she was gonna kill both of them,ri7edd
i6r9lrp,The entire movie of Dead Alive? Dudes been a crazy buff for decades.,ri7edd
hqimssx,"I NEED to see this in black & white, the movie looked absolutely gorgeous.",ri7edd
iicqba0,Nailed it,ri7edd
hquyogu,"11 years younger is pretty significant. I think you’re right though, I didn’t think of Pattinson. I thought of Dev Patel or Taron Egerton.",ri7edd
hrrsazc,"Agreed. My biggest issue with this movie is that Bradley Cooper seemed too old — a younger, more arrogant man would’ve made a huge difference. Seeing a grown middle aged  man join the circus and create a new career just didn’t feel right. Likewise, I think seeing Cate Blanchett manipulating a younger arrogant guy would’ve seemed much more believable. Robert Pattinson would’ve been perfect.",ri7edd
hw66lwp,I sure as hell don't lol.  that was painful enough just seeing it unfold.,ri7edd
i3t58tg,He's 46 but fuck I'm old. Thought he was in his 30s. Still looking great,ri7edd
hqpuird,"This makes sense to me, Grindle punishing her after he was a patient. She shows stan the scar in the context of discussing Grindle’s violence.",ri7edd
hvuh1jf,That's a pretty perfect wrap up. Especially since it confirms what I already thought. :),ri7edd
hw6ewo6,Excellent analysis. I completely agree.,ri7edd
i5tqd1r,"All of this, except I don’t believe it’s an “assumption” that Ritter was scarred by Grindle. She says there are “permanent consequences” for working with Grindle, then shortly after shows her scar.",ri7edd
hxik2oi,Amazing analysis!,ri7edd
i4e5cha,The one jump you’re making is knowing that he’d kill grindle and manipulating him sowly for that purpose. It seems to me she has a past with abusive men (the scars) and noticed he had those tendencies when she approached him at the act. She then took advantage of the situations and broke him down and reduced him to nothing.,ri7edd
i0q8aji,You summed that up beautifully.,ri7edd
im8daqh,"One thing I don’t understand is that a lot of people on here are saying Dr Ritter wanted revenge against Grindle, but how was she accomplishing any kind of revenge if Carlisle had succeeded in making Grindle feel at peace? If Grindle hadn’t walked toward the woman at the end, which ruined the illusion, he would have believed it was really his mistress and he would have felt at peace, which is what he hired Carlisle for. Dr Ritter had no way of knowing that Grindle was going to be violently killed, especially since he had a bodyguard. So what kind of revenge was she expecting?",ri7edd
hp29sc5,"> I think the money thing was spiteful revenge for his cruel comments at the first read.

Thought so too. He thought he was her superior, but she knew better. From the moment he walked into her office, she was the spider and he was the fly. Robbing him was putting him back in his place. He was a mark all along.",ri7edd
hpw3nd8,"It was very beautifully telegraphed that she viewed Stan as the mark and all her actions where very deliberately made to pull him further into the trap. She pulled an old but reliable con: let the mark intentionally win a few rounds. Once their guard is down and they are feeling confident drastically increase the wager and win (while not an exact 1 to 1 example Dr. Lilith broke Stan down psychologically the same way the geek was broken down. She supplied him with booz manipulated him mentally and right before he walked away she dangled a “oh there is this one big fish but you couldn’t possibly do it as he’s too big a fish for you” bait aka “either you become a real geek or I need to find a real geek”)

I think the only moment when we can question if it was a genuine reaction or a faked reaction was when Stan outed her hatred of her mother and her depression publicly. I think that’s the only time we are unsure if the mask slipped or not. I think it was a genuine moment and that’s why she chose to twist the knife so deeply with swapping out the money. She wanted to make him feel small.",ri7edd
im8dm6i,"You mention that you think Dr Ritter wanted to get back at Grindle.  But how was she accomplishing any kind of revenge if Carlisle had succeeded in making Grindle feel at peace? If Grindle hadn’t walked toward the woman at the end, which ruined the illusion, he would have believed it was really his mistress and he would have felt at peace, which is what he hired Carlisle for. Like you said, Dr Ritter had no way of knowing that Grindle was going to be violently killed, especially since he had a bodyguard. So what kind of revenge was she expecting?",ri7edd
hpdh4wk,Wasn’t he a patient of hers though? So she would have had to been a psychiatrist already. Also the timeline of when he abused her doesn’t make sense to me… unless he did it to her as a child and then she grew up to be a psychiatrist and then managed to somehow get him as an unknowing patient…,ri7edd
hrqwlj2,"The scar was completely created for the movie, not in the book at all. And Grindle wasn't abusive in the book either.",ri7edd
hqnirzo,it does sound like that she did not anticipate that but it's possible it's planned,ri7edd
hoyyscs,standard - they ain't playing Nightmare Alley in Dolby anywhere by me,ri7edd
hxghs21,"I didn’t even watch it in theaters or home, but in the bathroom at work over the course of 3 nights.  Still sounded good to me.",ri7edd
hsulb1v,"To what end, though? Like if the money was supposed to be a stand in for safety he didn't have with his father, then why leave the carnival?",ri7edd
hw9jlzd,I had no idea.  What's the orginal?,ri7edd
hw176h2,It’s a metaphor for how much GDT is into monsters. Still sucks though,ri7edd
i8np430,"So, you think Shape of Water is corny without even seeing it? Well, let me tell you something: it is.",ri7edd
htugixs,"Haven’t seen Shape of Water yet, but I loved Crimson Peak and that’s what intrigued me to this.",ri7edd
hrl7qkv,I'll back a Malignant recommendation.,ri7edd
hpfeula,"Oh yes. I enjoyed both of those. Actually, I purchased the 4K of Green Knight during Black Friday.",ri7edd
hww2h2c,"Malignant is my favorite horror movie now, these kinds of movies these days take themselves so seriously, its so refreshing to see something that takes the tropes, flips it around, and just goes crazy with it.",ri7edd
hqcyrwr,That was great too!,ri7edd
hwmbdvl,I’m confused about the last part? The guy did get his life sucked out of him. He was months into being a hobo as seen with the beard and hole in the shoe. He gave up his watch for the last bit of alcohol. He was the geek the entire time. He realized it as soon as he realized he was being turned into an actual carnie geek. Which I think he realized when he had already drank the alcohol/opium the first time and right before the 2nd,ri7edd
hvp1l6t,Yes! I was screaming this at the end. He could have changed his name and literally moved 10 miles away. He was homeless for what two days and drinking for a month?? (Maybe not but thats how the film made it seem) Come on man!,ri7edd
hym56l3,"My read was that he was a recovering alcoholic. Maybe his abusive father forced him to drink and he stopped upon leaving. And didn’t come out of nowhere - the therapist took a drink and immediately kissed him, giving him a taste that sent him down hill from there. Just my perspective…",ri7edd
i0jpyt6,"Yeah I thought for sure the girl was going to die, and that would have made sense to me, as a motivation to completely give up.",ri7edd
i2j2n7x,"Thanks, my thinking was the same. He was a borderline-sociopathic narcissicst. He wasn't going to admin defeat and run to a life of virtual endless torture just due to a bad con.",ri7edd
i44nmgo,Right. That ending was in no way earned.,ri7edd
i2aa9cq,Yea I thought the chickens were a signal he would be going back to the carnival but fulfilling the role of Pete. Though I guess there was no Zeena counterpart. And his parallel to being Ritters geek makes sense too,ri7edd
hv1p2fw,"Yes, that’s really insightful and makes a lot more sense for his character.",ri7edd
hws5qmy,"Yup. It’s frustrating also to watch things that so dang slick (cinematography, production design, FX, minus the cg fire) but where the story and characters are uneven. Sometimes good, sometimes 2d. Like Euphoria, the editing, shots, music, are overall as good as anything right now, but the story and acting is uneven. Sometimes killer, other times corny. Well at least it ain’t like Michael Bay’s mediocre stuff, all flash and no strong story.",ri7edd
hvmt2bj,"> And he didn’t drink because she looked at him. Dude was manipulated to kill someone and he broke.

Not sure what you mean here. He starts drinking before Ezra or the Judge and his wife die.",ri7edd
hs6faxu,*I keep forgetting we're not in love anymore.*,ri7edd
hvx4x8c,*bites chicken head off*,ri7edd
hzhmxgg,"An important thing to keep in mind when seeking a therapist: Do they like pretty things? If yes, run!",ri7edd
hvusstq,"Yeah that's what I figured. All the hallways and the elevators within the building are real, but I assumed the office was on a soundstage.",ri7edd
hzpzpjf,He has the capacity to geek.,ri7edd
hvs5gu1,">And here are the all-male nominees

It won't be this year. Shouldn't be, anyway.",ri7edd
hqd8tol,"Cause GDR is god /s 

Idk seems like a massive dick move.",ri7edd
hpe1lde,"Not anymore, but outside of Spider-Man (2002) it seemed to be a lot of cult hits for a while",ri7edd
hpeb9si,DAE think four-time Academy Award nominee Willem Dafoe is a good actor actually? I know it might be an unpopular opinion...,ri7edd
hpl31qe,He even gives Stan an out right before that scene when he says he asked him to cleanse his soul and he failed to do so,ri7edd
hwsro7x,He started believing his own lies. Like the old carney with the book warned him.,ri7edd
hs0n5ej,"Yep.  I am usually very bad at guessing endings, but agree this time, that what the ending would be seemed very obvious very early on.  But, I also agree that watching how we got to the ending we knew was coming was fun to watch.",ri7edd
hwhlt6g,"I seen it as early as when he first went into the Devil’s Sinners Damnation Playhouse , in that moment you can see how he is drawn to that place and they have him go looking there by himself. When he goes inside and finds the geek that is a slight moment when he is talking to the geek that it looks just like him! The weird relationship he had with the geek where he game him the cigarette and also when they drop him off at the doctors Stan wanted to make sure he was taken care of before they left but his boss said don’t worry ( there was a sign in the Alley that was lit up saving Jesus Saves when they first walked in and after he left him there the lights went out and said Us Saves ) subtle but big Signs",ri7edd
hqdqqgc,I don’t get how this is a response to his point that literally the first minute of the movie (let alone 10) is him putting a corpse in a floor and then burning a house down.  You’re saying that didn’t make it clear what he was on the run from?,ri7edd
hzjjequ,Seems like you just forgot the very beginning of the movie. That’s not a flaw in the movie,ri7edd
hvp3in8,"Yes, so true",ri7edd
hvzs4cl,"Im reading the book and so far it makes way more sense than the movie. Im at the part were Pete dies.

So far, no mention of the elaborate set, and he never had a thing for Molly beyond thinking she was hot. In the book, he actually does sustain an affair with Zeena, who he's way more into than her him. It's an actual plot point, and it's even explained that Zeena is only into him because he reminds her of a young Pete. 

The bit where Stan gives Pete the alcohol also makes way more sense in the book. Zeena had kept on blowing of Stan to be with Pete, so Stan decides to give him booze so he'll pass out and he can fuck Zeena. The death is purely accidental, but his motive is purely selfish, not well meaning and driven by pitty. 

The bit in the movie where he mixes up the alcohols is so dumb and I saw it coming a mile away -- why would anyone store two alcohols so close together? And why would anyone, knowing this, fail to make sure they brought the right one with them?",ri7edd
hzq8ckq,"I think you need to consider your lack of imagination and ability to follow the plot is not a flaw in the movie. Like in regards to Zeena, they clearly have an ongoing affair. Its what brings Stan closer to Zeena and Pete, which is how he learns the mentalist act.",ri7edd
hwbm7m5,"The movie never really gets going, imo, until he begins trying to scam the judge. You need the introduction of the geek to give the ending power, I just felt it drug on forever. I also didn’t buy the Rooney Mara- Bradley Cooper chemistry. She felt “stiff” to me. That being said, the last third of the movie was great. I actually did not see him becoming the geek up until the “it’s only temporary…” part. It’s been a while since I’ve seen a movie that has had this much difference between acts.",ri7edd
hu0423y,"I agree, so many subplots that didn’t seem to go anywhere but overall I enjoyed the film. Found myself thinking “this film is long” about half way through which isn’t usually the case",ri7edd
hwb4jmk,I thought the same of Strathairn until >!they mentioned about the booze vs wood alcohol next to each other!<,ri7edd
hw6a5za,"yeah, real blend of physical, psychological, and body horror.  But really it's no different from what happens in prostitution/sex slavery.  This definitely hits differently though, for a couple reasons.",ri7edd
hvcj84o,That was 2 hours in! I just watched it and I cant believe how hollow and forced all the relationships were.,ri7edd
hr18w1u,"I agree. Cooper's Stan never quite lost himself in the grift. It was a scam and he knew it. Maybe he over-estimated his ability to scam *anybody*, or even on some level believed he was helping his marks find the closure they wanted, but he never believed himself to be an *actual* clairvoyant.

Maybe the downfall would have been all the greater if he had.",ri7edd
hvpar6r,"But he really only ever believed how great he is at reading and fooling people, and maybe that he might be helping them. He never believed in anything supernatural. I thought that was heavily laid on that it was all skill and never “intuition”.",ri7edd
hw6cm2o,din't know,ri7edd
hvwon7b,"It was very beautifully telegraphed that she viewed Stan as a mark and all her actions where very deliberately made to pull him further into the trap. She pulled an old but reliable con: let the mark intentionally win a few rounds. Once their guard is down and they are feeling confident drastically increase the wager and win. She showed up a few times to the show to make sure he notices her, when she finally interrupted the show she came with a friend who she knew would want to hire Stan. She interrupted the show to make Stan feel like he “won” when he analyzed her properly (while not an exact 1 to 1 example Dr. Lilith broke Stan down psychologically the same way the geek was broken down. She supplied him with booz manipulated him mentally and pushed his boundaries and right before he walked away she dangled a “oh there is this one big fish but you couldn’t possibly do it as he’s too big a fish for you” bait aka “either you become a real geek or I need to find a real geek”)

I think the only moment when we can question if it was a genuine reaction or a faked reaction was when Stan outed her hatred of her mother and her depression publicly. I think that’s the only time we are unsure if the mask slipped or not. I think it was a genuine moment and that’s why she chose to twist the knife so deeply with swapping out the money. She wanted to make him feel small.",ri7edd
hp1s9b1,[deleted],ri7edd
hqez7y3,Chaos Reigns,ri7edd
hq01fo1,"Yeah, she changed it to singles. Although, she didn’t really do it for the money. When Bradley asks Cate why did she do it when you don’t need the money, she says “but you do”. She’s just taking revenge because her ego was hurt that he guessed the revolver and her mother. Her motivations are set up to be something that would tie all loose ends, but the “twist” is that no, she was just butthurt and wanted to toy with Bradley. Someone also made a point about how she views Bradley like how people view the geek at the carnival.",ri7edd
hqkox4z,"Lol I'm actually surprised IMDB lists it first as a comedy because it's somewhat funny in the same way Uncut Gems has a few funny moments but the drama and tension keeps building the whole movie and it's hard to guess what's gonna happen next, def not a straight comedy.",ri7edd
hv8reob,"yea? well Pedro Pascal doesn't look like The Last of Us's Joel, still got casted",ri7edd
hvhxp0d,"No, but he'd be a perfect Booker DeWitt",ri7edd
i1u9f9x,He plays Rocket Raccoon and sings very well in A Star is Born lol drastically different voices. Even just in this movie his southern voice changes a lot in the two year jump to when he is performing in the nice venue. He could definitely pull off Ryan especially since in most of the game you hear his tinny voice piped through older mics and stuff so it's not his natural voice.,ri7edd
hyumg6l,Would you kindly,ri7edd
hp9ljvc,That Art Deco office was incredible,ri7edd
hps3kb4,When she kept questioning him about 'never' it did feel very reminiscent of 'will you kindly'.,ri7edd
hv89n9c,That'll get the box-office up,ri7edd
hz0isqx,I'm already creeped out. Geez what a perfect movie for him.,ri7edd
hsvqm9w,And the box office is only 9 million,ri7edd
hvh7i3p,"For a Searchlight Pictures movie, that's pretty expensive.",ri7edd
hoxvs62,Ahh I haven’t seen the original I should try and watch to compare.,ri7edd
hssfaqn,Completely agreed,ri7edd
hvhgtik,Arrogance and pride. I think Stan wanted to rub the money in her face.,ri7edd
hvj2y7w,He didn't want his wife to know about the money.,ri7edd
hvs567e,He thought they were partners.,ri7edd
i1u9v06,"He needed to get her guard down and have time to copy her key so he could get the full recordings to listen to without her consent. Having her keep the money helped him in this respect. And I think she was very wrong when she claimed he only cared about money, he could have ran away with his wife with a good amount of cash at many points. He enjoyed fooling people and having her keep the money was also part of getting her to trust him and work with him.",ri7edd
hqu6qxn,Some scenes for sure! Like every time Cate Blanchette‘s cheekbones made an appearance. Absolutely insane lighting.,ri7edd
hovfz9p,"In the original, after Stan agrees to be the geek, there's a scene where he breaks loose, but then he runs into Molly (who also randomly happens to work at that carnival) and she kind of snaps him out of it and they presumably get back together. The new one cuts out that last scene",ri7edd
hslm9w7,"While I totally agree the actual “ending” is far superior in the new one, the old movie’s next to last scenes are much better to me.. new one still executed “the twist” well but in old one you really feel like you have no idea what’s real for a moment.. obviously knowing the plot will change your reaction in that regard but still felt a little more mind bending in the moment when watching the original.. absolutely loved the new movie though, felt like it filled all those nuggets that a fan of the first one wanted / needed",ri7edd
iwcnmna,The pacing of the original is GREAT..that's the only thing I didn't like of the new one pacing and RUN TIME!!,ri7edd
hxiiyv4,I read that as a parallel to what happens to Bradley in the end. He “opens his third eye” and ends up pretty much in a pickle as a result.,ri7edd
hpf940h,I guess 60% positive makes sense if I imagine my friends and family being the sample size. I’d probably estimate less than a 50% score when I think of it that way.,ri7edd
hpe6sce,Yup they only hated this more than jungle cruise because of expectations,ri7edd
hpfnbxk,Two big problems led to the issue of this being too long. The structure is very much like an older rags to riches story or even film noir. If you’ve seen a few of them once the second half hits it gets somewhat predictable because this structure has been done to death almost 100 years ago. The next is that it might flow better on a rewatch since during the carnival scenes and even some of the second half there’s probably a lot of subtle stuff to develop the characters which is what Guillermo loves to do. I would always be looking in the background for stuff that he put in and would be thinking what it’s purpose is. I do plan on rewatching it so hopefully on a rewatch the pacing won’t be as much of an issue.,ri7edd
iwcprdx,"think it has to do more with the original 1947 pic watch if you watch it, it's less then 2 hours and feels like a better story...",ri7edd
hp9n8ay,"She didn’t care about the money. That was just to further break down Stan. 

Maybe she didn’t even care about punishing Ezra—she did it because she could. Just like people got a morbid exhilaration from watching the geek, so does she from manipulating people.",ri7edd
hpy2rxp,"After his first meeting with Ezra, Stan says something like ‘you have to leave money to make money’ which Lilith seemed to cock her head to.",ri7edd
hoyhi12,"I thought it was because she simply enjoyed screwing people over & feeling powerful. 

She tries to shame him in the club, but fails. The explanation of her gun is probably a symbolism that she indeed wants power. Then, she forces stan for a therapy session. Leading me to think she likes to toy w/ people & be in control. Which she probably failed w/ the rich guy ( forgot his name ) & paid the price because he doesn’t like dealing with bullshit ( as he said during the lie detector test. )

If you think about it, most of the main “tricksters” were ‘power’ hungry, manipulative people.",ri7edd
hp5ajyr,she stole it only to fuck with him bc as he said money was the only thing that matter,ri7edd
hvcxp26,"That's one of the possibilities, but it's not really needed for it to be specifically one or the other.",ri7edd
hp9mejn,"those changes have Hayes Code written all over them as well as Stan mocking religion. 

 This was much closer to the book",ri7edd
hpxb6iq,I thought the hanged man was about acceptance of fate?,ri7edd
hvfb39f,"1. That’s probably because she can make more money. Greedy scam artists don’t generally stop.
2. He was married and trying to hide his racket from his wife, I think they established that when he handed her the money in the first place but I hardly remember now.",ri7edd
